url,data,titulo,texto,fonte
https://exame.com/ciencia/raro-buraco-negro-a-40-mil-anos-luz-e-encontrado-pela-nasa/,2025-07-27,Raro buraco negro a 40 mil anos-luz é encontrado pela NASA,"Tudo indica que ele pertence a uma classe rara de buracos negros, de classe intermediária (NASA/Divulgação) Redação Exame Publicado em27 de julho de 2025 às19h33. Um novo buraco negro pode ter sido descoberto pelo telescópio espacialHubblee o Observatório de Raios-X Chandra, daNASA.Tudo indica que ele pertence a uma classe rara deburacos negros, de classe intermediária, os mais raros de serem percebidos por humanos. Estamos falando doNGC 6099 HLX-1, que segundo os estudos é de um aglomerado estelar de uma galáxia gigante. A descoberta foi publicada no jornal científicoAstrophysical Journalnesta sexta-feira, 25. O HLX-1 está localizado a 40 mil anos-luz docentro da galáxia, e acredita-se que esteja dormente e que não está absorvendo uma estrela. Informações da NASA mostram que desde que o Hubble foi lançado, já foi descoberto quegaláxiasem todo o universo podem conter buracos negros enormes em seu núcleo — pesando até bilhões de vezes a massa do Sol. O telescópio espacial ainda foi capaz de descobrir que asburacos negrospequenos podem ser formados a partir de estrelas que chegaram ao fim de suas vidas. Já os com massa intermediária costumam ser invisíveis para os humanos, uma vez que não absorvem a mesma quantidade de gás e estrelas quanto os supermassivos, que emitem uma quantidade superior de radiação. Astrônomos da NASA explicam que para captar imagens de um buraco negro é preciso capturá-lo em ação, seja uma fonte incomum de raios-x ou absorvendo uma estrela próxima. O NGC 6099 HLX-1 possui umatemperaturade 3 milhões de graus Celsius. Além disso, o Hubble encontrou evidências de que existe um pequeno aglomerado deestrelasno entorno do buraco negro, que servem como alimento ao HLX-1. Os pesquisadores seguem em observação sobre o brilho emitido pelo buraco negro. A expectativa é entender se as diferenças na luminosidade são causadas por explosões seguidas ou se houve um pico e agora o buraco negro começa a desaparecer. Pesquisas apontam para benefícios escondidos nesse alimento pouco comum na culinária ocidental; saiba qual é Para especialistas, trata-se de um eclipse solar total que terá mais de seis minutos de duração em seu ponto máximo O médico britânico ficou conhecido por seu trabalho em grandes crises sanitárias globais, como a gripe aviária, a epidemia de Ebola e a pandemia de covid-19 Um fenômeno natural raro que transforma a Cachoeira Rabo de Cavalo em uma impressionante cascata dourada durante o pôr do sol de inverno 01 02 03 exame no whatsapp Receba as notícias da Exame no seu WhatsApp Nos acontecimentos mais relevantes do Brasil e mundo. E-mail inválido Desperta",Exame
https://exame.com/esporte/brasil-sofre-virada-da-italia-e-fica-com-a-prata-da-liga-das-nacoes-de-volei-feminino-pela-4a-vez/,2025-07-27,Brasil sofre virada da Itália e fica com a prata da Liga das Nações de Vôlei Feminino (pela 4ª vez),"Ao todo, a seleção brasileira realizou 15 partidas na Liga das Nações, com 13 vitórias (FIVB/Divulgação) Agência de notícias Publicado em27 de julho de 2025 às18h54. A seleção brasileira feminina devôleinão conseguiu conter o ímpeto e o favoritismo da Itália neste domingo (27), em Lodz, na Polônia, e ficou com a medalha de prata daLiga das Nações(LNF). As atuais campeões olímpicas e agora bi daLNFvenceram a final por 3 sets a 1, com parciais de 22/25, 25/18, 25/22 e 25/22. O resultado fez com que o Brasil ficasse com o vice do torneio pela quarta vez em sete edições. Já aItália,por sua vez, se consolida cada vez mais como a principal seleção devôlei femininodo cenário mundial. As europeias empataram com osEstados Unidoscomo o time mais vencedor da LNF, com três títulos (2022, 2024 e 2025). O Brasil segue em busca do primeiro título. Ao todo, a seleção brasileira realizou 15 partidas na Liga das Nações, com 13 vitórias, um desempenho consistente e aproveitamento de 86,6%. Por mais que o favoritismo fosse da Itália, foi a seleção brasileira quem tomou as rédeas no início da partida. Com boas defesas e sabendo aproveitar os erros das italianas, oBrasilabriu vantagem de quatro pontos no início do primeiroset,quando chegou a vencer por 8 a 4. Depois, as agora bicampeãs consecutivas e tri no geral reagiram e conseguiram virar o set. Com um 21 a 17, as europeias pareciam ter a vitória encaminhada. No entanto, com uma sequência de sete pontos, o time deZé Roberto Guimarãesse reergueu e fechou o placar em 25 a 22. Nos sets seguintes, porém, o jogo virou. Foi a seleção brasileira quem colecionou erros e permitiu que a Itália os aproveitasse para pontuar em sequência. No segundo, vencido pelas italianas por 25 a 18, elas chegaram a abrir 13 a 5 com certa facilidade. Depois, foi só administrar. Já no terceiro, que as europeias levaram a melhor por 25 a 22, o Brasil entregou, só nos cinco primeiros pontos da Itália, três bolas em erros de ataque. Equipe marcou 3 a 1 após prorrogação e pênaltis em disputa na Suíça neste domingo, 27 Duelo decisivo entre Brasil e Itália acontece neste domingo, 27 de julho Veja onde assistir ao GP da Bélgica de Fórmula 1 Partida entre Inter e Vasco é válida pela 17ª rodada da Série A do Campeonato Brasileiro 01 02 03 exame no whatsapp Receba as notícias da Exame no seu WhatsApp Nos acontecimentos mais relevantes do Brasil e mundo. E-mail inválido Desperta",Exame
https://exame.com/mundo/tres-pessoas-morrem-apos-descarrilhamento-de-trem-de-passageiros-na-alemanha/,2025-07-27,Três pessoas morrem após descarrilhamento de trem de passageiros na Alemanha,"A causa do acidente ainda está sendo investigada Repórter de ESG Publicado em27 de julho de 2025 às17h23. Última atualização em27 de julho de 2025 às17h45. Três pessoas morreram e outras ficaram feridas após odescarrilhamento de um tremno sudoeste daAlemanhaneste domingo, 27. Segundo a polícia, 100 passageiros estavam a bordo. Dois vagões do trem saíram dos trilhos entre as cidades deRiedlingeneMunderkingen.Segundo o relato de moradores da região, umatempestadeatingiu o local do acidente, que aconteceu às 18h10 no horário local. Forças de resgate atuam no local onde trem de passageiros descarrilhou no interior da Alemanha neste domingo, 27 O trem fazia uma rota de cerca de 90 quilômetros entre Sigmaringen e Ulm, segundo um porta-voz da polícia. O ministro do interior da Alemanha teria se deslocado para o local, e aCruz Vermelhaenviou tropas para ajudar os feridos. A causa do acidente ainda está sendo investigada. A operadora ferroviária Deutsche Bahn afirmou que havia ""muitos feridos envolvidos"" e que suas orações estavam com as famílias das vítimas. Seis regiões da Grécia apresentam risco muito elevado de incêndios na segunda-feira, afirmou a Proteção Civil. Presidente dos Estados Unidos e Ursula von der Leyen, presidente da Comissão Europeia, se encontraram na Escócia para negociar tarifas Incidente aconteceu no aeroporto de Denver, no Colorado, neste sábado, 26 de julho Possibilidade será discutida entre representantes dos dois países a partir desta segunda-feira em Estocolmo 01 02 03 exame no whatsapp Receba as notícias da Exame no seu WhatsApp Nos acontecimentos mais relevantes do Brasil e mundo. E-mail inválido Desperta",Exame
https://exame.com/brasil/ciclone-extratropical-e-frente-fria-devem-provocar-ventos-de-ate-100-km-h-no-sul-e-sudeste/,2025-07-27,Ciclone extratropical e frente fria devem provocar ventos de até 100 km/h no Sul e Sudeste,"A situação é mais grave no Rio Grande do Sul, onde projeções do MetSul indicam ventanias acima de 100 km/h (Freepik) Repórter de ESG Publicado em27 de julho de 2025 às16h54. Última atualização em27 de julho de 2025 às17h24. O Sul e o Sudeste do Brasil devem sentir os impactos de umciclone extratropicalque se forma na costa do Rio Grande do Sul no início da semana, acompanhado por umafrente friaque provocará mudanças bruscas na temperatura. Em São Paulo, após um domingo de quase 30 °C em partes do Estado, a previsão indica mínimas de um dígito ao longo da semana. Em São Paulo, a alteração no clima deve ser percebida a partir da tarde de terça-feira, com ventos superiores a 60 km/h e possibilidade de pancadas de chuva. Segundo a Defesa Civil estadual, apesar de as precipitações não apresentarem volumes expressivos, há risco de queda de árvores. O alerta inclui não apenas a capital e a Região Metropolitana, mas também áreas do Vale do Ribeira, Itapeva, Sorocaba, Campinas, Vale do Paraíba e todo o litoral paulista. A situação é mais grave noRio Grande do Sul, onde projeções do MetSul indicamventanias acima de 100 km/h na região da Lagoa dos Patos e rajadas entre 70 km/h e 90 km/h em Porto Alegre. Santa Catarinae a Serra do Mar, noParaná,também estão na rota dos ventos fortes, que podem provocar interrupções no fornecimento deenergia elétrica. Além dos ventos, a Defesa Civil alerta pararessaca marítimanacosta do Sul e do Sudeste. Embarcações de pequeno porte, pescadores e praticantes de esportes aquáticos devem evitar o mar. A prefeitura doRio de Janeiroorientou que apopulação não entre no mar entre terça e quinta-feira. As ondas podem chegar a três metros de altura, segundo o Centro de Operações da cidade. O órgão também recomendou evitar pedalar na orla e frequentar mirantes e não tentar resgatar possíveis vítimas de afogamento. A massa de ar polar associada ao fenômeno vai derrubar astemperaturas emSão Paulo. O Climatempo prevêmínimas de 8 °C na quarta e quinta-feira, com máximas de 17 °C e 21 °C, respectivamente. A partir de sexta-feira, os termômetros devem voltar a subir, registrando mínimas de 14 °C e máximas em torno de 27 °C. ADefesa Civilrecomenda que a população evite se abrigar sob árvores ou estruturas frágeis. Telhados, janelas e portas devem ser reforçados, e objetos soltos como vasos, bicicletas e móveis de jardim precisam ser retirados das áreas externas. Também é fundamental manter distância defiações elétricas. Caso encontre fios caídos, não se aproxime. Em emergências, oCorpo de Bombeirospode ser acionado pelo telefone 193 e a Defesa Civil pelo 199. Jorge Messias diz que Tarcísio, Ratinho Jr. e Caiado 'fingem ignorar' que responsabilidade sobre as sanções econômicas é da família Bolsonaro Programa tem redução no número de beneficiários após dois anos de crescimento, enquanto o aumento da renda e a formalização do trabalho ajudam a aliviar a pobreza, segundo especialistas Expectativa é de céu limpo, aumento de nuvens no final da tarde e sensação de calor moderada, sem previsão de chuva O Corpo de Bombeiros de São Paulo disse que ainda não há informações de vítimas 01 02 03 exame no whatsapp Receba as notícias da Exame no seu WhatsApp Nos acontecimentos mais relevantes do Brasil e mundo. E-mail inválido Desperta",Exame
https://exame.com/esporte/inglaterra-vence-espanha-nos-penaltis-e-e-bicampea-da-eurocopa-feminina/,2025-07-27,Inglaterra vence Espanha nos pênaltis e é bicampeã da Eurocopa feminina,"A meio-campista Mariona Caldentey abriu o placar para a seleção espanhola Agência de notícias Publicado em27 de julho de 2025 às16h39. AInglaterraconquistou aEurocopafeminina pela segunda vez consecutiva ao derrotar aEspanhanos pênaltis (1 a 1 após prorrogação, 3 a 1 nas penalidades) na final disputada em Basileia, naSuíça,neste domingo (27). A meio-campista Mariona Caldentey abriu o placar para aseleção espanholacom um gol de cabeça aos 25 minutos, e a atacante Alessia Russo empatou, também com uma cabeçada, no início do segundo tempo (57'). Três anos após o primeiro título, conquistado em casa, as inglesas venceram nos pênaltis, se beneficiando dos erros nas cobranças de três espanholas, incluindo da duas vezes vencedora daBola de Ouro, Aitana Bonmati. Duelo decisivo entre Brasil e Itália acontece neste domingo, 27 de julho Veja onde assistir ao GP da Bélgica de Fórmula 1 Partida entre Inter e Vasco é válida pela 17ª rodada da Série A do Campeonato Brasileiro Saiba onde assistir aos jogos deste domingo online e na TV por assinatura 01 02 03 exame no whatsapp Receba as notícias da Exame no seu WhatsApp Nos acontecimentos mais relevantes do Brasil e mundo. E-mail inválido Desperta",Exame
https://exame.com/esg/china-e-uniao-europeia-fecham-acordo-climatico-em-meio-a-tensoes-comerciais-e-geopoliticas/,2025-07-27,China e União Europeia fecham acordo climático em meio a tensões comerciais e geopolíticas,"Patrocínio: Parceiro institucional: Internamente, a União Europeia enfrenta desafios para implementar metas ambientais mais rigorosas devido à resistência de alguns governos (Vyacheslav Oseledko e Alexander NEMENOV/AFP) Repórter de ESG Publicado em27 de julho de 2025 às16h21. Última atualização em27 de julho de 2025 às16h33. AUnião Europeiae aChinafirmaram um acordo pelo desenvolvimento de planos climáticos para 2035 e o apoio aoAcordo de Paris. O objetivo é unir as nações para demonstrarem liderança pelo clima a poucos meses daCOP30,a conferência climática daONUsobre mudanças climáticas de Belém. Na situação, os países acordaram que é crucial que asgrandes economiasmantenham a continuidade dos esforços contra as mudanças ambientais. Ursula von der Leyen, presidente daComissão Europeia, e Li Qiang, primeiro-ministro daChina, acordaram durante um simpósio na quinta-feira, 24, a cooperação internacional para a implementação deenergias renováveis, mercado de carbono e tecnologias verdes e de baixa emissão. Além disso, as nações concordaram com um controle mais rigoroso dasemissõesglobais demetano,um dos gases responsáveis pelo aquecimento global no curto prazo. Apesar dos avanços, o encontro que marcou os 50 anos das relações diplomáticas entre China e EU foi marcado por tensões, como as críticas da União Europeia sobre o excesso decapacidade produtiva da China, que enfraquece o que é produzido no próprio continente. Além disso, a UE questionou o apoio da China à invasão russa naUcrânia. Acredita-se que a união das potências mundiais pelo clima ocorra pela em meio ao vácuo da retirada da cooperação ambiental dosEstados Unidosapós a posse do presidenteDonald Trump.Pela segunda vez, o líder americano removeu a nação do Acordo de Paris. Além da China, a União Europeia também assinou uma declaração conjunta com oJapãosobre desenvolvimento de energias. Foram firmados compromissos pela ação climática, além da melhoria na infraestrutura de energia à gás. Internamente, a União Europeia enfrenta desafios para implementar metas ambientais mais rigorosas devido à resistência de alguns governos, como França e Polônia, que alegam que o bloco não deveria aumentar as exigências ambientais a menos que aumente também o apoio dado àsindústrias e famílias europeias. Com técnicas de bioeconomia e engajamento comunitário, o projeto tem o potencial de restaurar até 3.000 hectares de vegetação nativa até 2035 Polen atua direto com grandes geradores de resíduos como quiosques e restaurantes, criando sistema digital que rastreia resíduos até a reciclagem e ainda gera créditos de logística reversa Observatório do Clima entrega ao governo análise detalhada que identifica retrocessos em 42 dos 66 artigos aprovados, enquanto Lula enfrenta pressões opostas às vésperas da COP30 Mecanismo de 'seguro' para investidores pode ser chave para viabilizar os US$ 6,5 trilhões anuais necessários até 2030 01 02 03 exame no whatsapp Receba as notícias da Exame no seu WhatsApp Em cases de sucesso e em entrevistas com líderes ESG. E-mail inválido ESG",Exame
https://exame.com/mundo/incendios-na-grecia-bombeiros-seguem-combatendo-fogo-que-ja-retirou-36-mil-pessoas-de-suas-casas/,2025-07-27,"Incêndios na Grécia: bombeiros seguem combatendo fogo, que já retirou 3,6 mil pessoas de suas casas","Os bombeiros estão mobilizados em várias áreas do Peloponeso, e vários incêndios foram registrados durante a noite (AFP/AFP Photo) Agência de notícias Publicado em27 de julho de 2025 às15h47. Última atualização em27 de julho de 2025 às17h56. AGrécialuta neste domingo (27) pelo segundo dia consecutivo contra osincêndios florestaisque devastaram residências e obrigaram a evacuar a população, mas a situação melhora em algumas regiões, afirmaram as autoridades. Cinco incêndios continuam ativos neste domingo na região do Peloponeso, a oeste da capitalAtenas,e nas ilhas de Eubeia e Citera. Aviões e helicópteros retomaram suas operações em várias áreas do país ao amanhecer. No entanto, alguns estão retrocedendo ou sendo controlados pelos bombeiros, especialmente na ilha de Creta. No domingo, atemperatura máxima foi de 42,4°C em Tebas, no centro da Grécia, país afetado pelaonda de calorpelo sétimo dia consecutivo. Seis regiões da Grécia apresentamrisco muito elevado de incêndiosna segunda-feira, afirmou a Proteção Civil. ""Hoje se espera um dia difícil, com alto risco de incêndios em quase todo o território"", disse o porta-voz do Corpo de Bombeiros, Vassilis Vathrakogiannis. Os meteorologistas previram que os fortes ventos que alimentaram aschamasdiminuirão neste domingo na maioria das áreas afetadas, mas alertaram que ailha de Citeracontinua enfrentando condições de vento ""preocupantes"". Alertas de evacuação foram enviados aos residentes da ilha, localizada em frente à extremidade sudeste do Peloponeso, na manhã deste domingo, enquanto o fogo continuava se espalhando descontroladamente. ""Casas, colmeias e oliveiras foram queimadas"", declarou Giorgos Komninos, vice-prefeito de Citera, a mídia localERT News. Segundo a televisão estatal, o foco permanecia ativo nesta tarde, mas em frentes menores. Dezenas debombeiros,apoiados por três helicópteros e dois aviões, combateram o incêndio em Citera, que começou na manhã de sábado e obrigou a retirada de pessoas de uma popular praia turística. As autoridades locais solicitaram a declaração deestado de emergênciapara que os procedimentos de assistência possam começar imediatamente na ilha, que também foi afetada por um grande incêndio em 2017. Onze regiões da Grécia ainda enfrentam alto risco de incêndio, segundo as autoridades. O país solicitou ajuda a seus aliados daUnião Europeiae aguarda a chegada de dois aviões italianos neste domingo, segundo o Corpo de Bombeiros, enquanto unidades daRepública Tchecajá estão trabalhando no local. Os bombeiros estão mobilizados em várias áreas do Peloponeso, e váriosincêndiosforam registrados durante a noite na ilha de Eubeia, perto de Atenas, ondeas chamas devastaram importantes áreas deflorestae mataram milhares de cabeças de gado. Operadores trabalharam desde o amanhecer para reparar graves danos narede elétricada ilha, e algumas aldeias enfrentam problemas no abastecimento de água. Mais ao sul, em Creta, as chamas que começaram na tarde de sábado e destruíram quatro casas e uma igreja agora estão sob controle. Oprimeiro-ministro grego, Kyriakos Mitsotakis, escreveu nasredes sociaisque a situação ""hoje parece melhor e a batalha continua com todos os recursos disponíveis"". A Grécia enfrenta uma onda de calor há quase uma semana, com temperaturas acima dos 40°C em muitas áreas, embora se espere que o calor diminua a partir de segunda-feira (28). Vagões do trem saíram dos trilhos entre as cidades de Riedlingen e Munderkingen; 100 pessoas eram transportadas Presidente dos Estados Unidos e Ursula von der Leyen, presidente da Comissão Europeia, se encontraram na Escócia para negociar tarifas Incidente aconteceu no aeroporto de Denver, no Colorado, neste sábado, 26 de julho Possibilidade será discutida entre representantes dos dois países a partir desta segunda-feira em Estocolmo 01 02 03 exame no whatsapp Receba as notícias da Exame no seu WhatsApp Nos acontecimentos mais relevantes do Brasil e mundo. E-mail inválido Desperta",Exame
