url,data,titulo,texto,fonte
https://www.infomoney.com.br/mercados/dolar-hoje-abertura-fechamento-comercial-turismo-04072025/,2025-07-04,"Dólar sobe a R$ 5,42, com tensões tarifárias e sobre IOF; na semana, perde 0,44%","Felipe MoreiraAgências de notícias04/07/2025 17h22•Atualizado 2 horas atrás 04/07/2025 17h22•Atualizado 2 horas atrás Publicidade Em uma sessão de liquidez reduzida por conta do feriado nos Estados Unidos, o dólar fechou a sexta-feira em alta ante o real, mas ainda assim encerrou a semana com baixa acumulada, na quinta queda semanal consecutiva. Leia mais:Dólar Hoje: Confira a cotação e fechamento diário do dólar comercial Trump disse nesta sextaque as tarifas que constarem nas cartas entrarão em vigor a partir do dia 1º de agostoe podem chegar a 70% em alguns casos. “Até o dia 9, todos estarão totalmente cobertos”, disse, referindo-se ao prazo de 9 de julho, que marca o fim da pausa das tarifas recíprocas e, consequentemente, do período estabelecido para que parceiros comerciais chegassem a acordos com os EUA e ev itassem as tarifas de importação mais altas. Saiba em 1 minuto quanto seu dinheiro pode render Definição sobre tarifas será acompanhada de perto na próxima semana pelo mercado – e pode gerar aversão global ao risco O dólar à vista fechou a sexta-feira em alta de 0,37%, aos R$5,4245, após ter registrado na véspera a menor cotação em mais de um ano, desde 24 de junho de 2024. No acumulado da semana, a divisa dos EUA cedeu 0,44%. Às 17h03, na B3, o dólar para agosto subia 0,20%, aos R$5,4590, mas havia movimentado pouco mais de 100 mil contratos — bem abaixo da média de dias normais. Nesta sessão, investidores pareciam estar realizando ajustes em suas posições em meio aos patamares relativamente baixos atingidos pela divisa norte-americana nos últimos dias. Na quinta-feira, o dólar à vista fechou em baixa de 0,27%, a R$5,4047, na menor cotação desde 24 de junho de 2024. Continua depois da publicidade Os movimentos da moeda brasileira ocorriam na esteira da baixa volatilidade do dólar no exterior devido ao fechamento dos mercados norte-americanos no feriado do Dia da Independência. Com poucos fatores para influenciar os negócios neste pregão, os investidores digeriam comentários de autoridades brasileiras. O presidente Luiz Inácio Lula da Silva e o ministro da Fazenda, Fernando Haddad, participam de evento do Novo Banco de Desenvolvimento (NDB), do Brics, pela manhã no Rio de Janeiro. Mais tarde, o presidente ainda estará presente na cerimônia de retomada de grandes investimentos da Petrobras na Reduc, em Duque de Caxias, às 11h30. Continua depois da publicidade Ainda na cena nacional, o ministro Alexandre de Moraes, do Supremo Tribunal Federal (STF), determinou asuspensão dos efeitos tanto do decreto do governo que aumentava o IOF(Imposto sobre Operações Financeiras), quanto do decreto legislativo que derrubava a medida. A decisão visa frear a escalada de tensão entre os Poderes e abre espaço para uma tentativa de mediação institucional. Além de paralisar os efeitos práticos dos atos, Moraes convocou uma audiência de conciliação entre representantes do Executivo e do Legislativo para o dia 15 de julho, no plenário do STF, em Brasília. Os dois lados terão cinco dias para prestar esclarecimentos formais sobre os fundamentos que embasaram suas decisões. No exterior, os mercados devem continuar monitorando as discussões comerciais dos EUA com seus parceiros, à medida que se aproxima o prazo de 9 de julho para que países fechem acordos comerciais a fim de evitar a imposição de tarifas mais altas. Continua depois da publicidade Na véspera, o presidente dos EUA, Donald Trump, disse que Washington começará a enviar cartas aos parceiros nesta sexta especificando as taxas tarifárias que eles terão de pagar sobre as exportações, uma clara mudança em relação às promessas anteriores de fechar dezenas de acordos individuais. (Com Reuters) Felipe Moreira",Infomoney
https://www.infomoney.com.br/mercados/9-de-julho-vem-ai-tarifas-de-trump-podem-frustrar-novas-maximas-do-ibovespa/,2025-07-04,9 de julho vem aí: tarifas de Trump podem frustrar novas máximas do Ibovespa?,"Lara RizérioAgências de notícias04/07/2025 17h12•Atualizado 2 horas atrás 04/07/2025 17h12•Atualizado 2 horas atrás Publicidade Novas máximas do Ibovespa estão por vir – mas no meio do caminho estão os desdobramentos das tarifas de Donald Trump. O quanto isso pode afetar os ânimos com o mercado brasileiro? Na esteira de um prazo perto de se esgotar em 9 de julho para os países voltarem a ser tarifados de forma diferentes por EUA, esse tema será acompanhado de perto na próxima semana pelo mercado – e pode gerar aversão global ao risco. Mesmo com Wall Street fechada por conta do feriado de 4 de julho nos EUA, os futuros das ações dos EUA recuaram nesta sexta-feira (4), enquanto os parceiros comerciais americanos pressionavam por concessões antes do prazo para finalizar acordos comerciais com a administração Trump. Saiba em 1 minuto quanto seu dinheiro pode render O presidente dos EUA, Donald Trump, aumentou as tensões comerciais após o fechamento de quinta-feira, alertando os parceiros de quepode começar a impor tarifas de até 70% unilateralmente. Faltando menos de uma semana para o prazo, montadoras da União Europeia pressionavam por um acordo que permitiria alívio tarifário em troca do aumento de investimentos nos EUA, informou a Bloomberg News. Enquanto isso, um rascunho de acordo comercial entre EUA e Suíça continha garantias sobre tarifas para exportações farmacêuticas, segundo pessoas familiarizadas com o assunto ouvidas pela Bloomberg. Bolsa brasileira opera ser referência dos EUA, que não opera hoje por feriado nacional Nos últimos dias, XP, Santander e Bradesco revisaram projeções para 2025 e 2026; analistas também veem mudanças no curto prazo Os mercados acionários globais se recuperaram fortemente desde a volatilidade causada pelas tarifas em abril, impulsionados em parte pela força contínua da economia dos EUA. Ainda assim, alguma cautela dos investidores persiste, já que a guerra comercial continua a obscurecer as perspectivas para a inflação e a lucratividade das empresas. Continua depois da publicidade “Há um pouco de dúvida surgindo, especialmente após a alta desta semana”, quando as ações voltaram às máximas, disse Neil Wilson, estrategista de investimentos da Saxo UK. “É um bom dia para reduzir um pouco o risco. Mas não acho que haja uma mudança de fundamentos”, complementou. Thiago Calestine, economista e sócio da Dom Investimentos, aponta que as novas tarifas poderiam gerar uma aversão aos ativos de risco, não só para os brasileiros, mas para os globais. “Com certeza a bolsa americana observaria uma realização de lucros caso essas tarifas entrassem (ou voltassem a entrar) em vigor de novo no dia 9. E obviamente a bolsa americana em queda puxa para baixo outras bolsas, tanto europeias, asiáticas quanto de países emergentes”, avalia. Continua depois da publicidade Para o economista, esse cenário deixaria a visão de médio e longo prazo mais opaca, o que o investidor não gosta. Nesses momentos, o investidor prefere realizar as posições que tem em ativos de risco e correr para a renda fixa. “Com certeza, os ativos de risco brasileiros sentiriam isso. Mas indo muito mais na onda das bolsas globais”, aponta. Cabe ressaltar que, no “Liberation Day”, no último dia 2 de abril, os mercados ficaram abalados com as tarifas anunciadas por Trump. Contudo, Dias depois, mais precisamente em 9 de abril, Trump deu uma janela de três meses para os países negociarem acordos comerciais com os Estados Unidos ou enfrentarem tarifas “recíprocas” mais altas. Isso gerou alívio nos mercados pelo tempo ganho, mas também gerou apreensão sobre os próximos passos já que a suspensão seria temporária. Quase noventa dias depois, Calestine vê que pode haver um efeito similar nos ativos ao ocorrido durante o Liberation Day, mas em escala bem menor, porque já é algo que o mercado coloca no preço. “O mercado já sabe ou já tem alguma noção do que vai acontecer no dia 9, já está no radar”, avalia. Continua depois da publicidade Como um ponto a favor dos ativos domésticos, vale ressaltar que o Brasilfoi visto como uma espécie de “vencedor” pós Liberation Day antes da pausa estabelecidapor Trump do dia 9 de abril. Isso porque, enquanto produtos brasileiros receberam uma tarifa de 10%, outros países, principalmente na Ásia, sofreram com alíquotas entre 25% e 49%. Desta forma, a tarifa-base de 10% estabelecida para o Brasil (a mínima estabelecida para osmais diversos países) foi vista como positiva em termos relativos para o país. Isso fez com que o Ibovespa registrasse variações tímidas nas sessões seguintes ao pós-Liberation Day e subisse forte (mais precisamente 2,26%) no dia 9 de abril de interrupção das tarifas por Trump. Nos quase três meses seguintes, a injeção de capital estrangeiro na B3 foi um dos fatores por trás de um forte ganho para o Ibovespa e fez o índice ultrapassar recordes além dos 141 mil pontos – e com projeções seguindo otimistas à frente. Já para o dólar, Calestine tem a projeção de que ele fique ainda mais fraco, após atingir a mínima de mais de um ano, a R$ 5,40, na véspera. Continua depois da publicidade “Quanto mais tarifas tivermos, ou quanto mais mudanças de política fiscal o presidente Trump fizer, mais ele indica que a moeda norte-americana, o país como um todo e o mercado norte-americano não é mais aquele lugar com uma altíssima previsibilidade sobre o que vai acontecer a médio e longo prazo”, avalia. Com isso, o investidor pode partir para ativos não tão atrelados ao dólar para mitigar esse risco. Neste sentido, também avalia que, com a moeda se enfraquecendo, o fato do Brasil ser agroexportador pode torná-lo mais competitivo no cenário global. Isso, eventualmente, a pode levar a um aumento de receitas nas empresas brasileiras e nas empresas listadas, o que impulsionaria a Bolsa. (com Bloomberg) Lara Rizério Editora de mercados do InfoMoney, cobre temas que vão desde o mercado de ações ao ambiente econômico nacional e internacional, além de ficar bem de olho nos desdobramentos políticos e em seus efeitos para os investidores.",Infomoney
https://www.infomoney.com.br/mercados/taxas-dos-dis-sobem-apos-moraes-convocar-audiencia-sobre-iof/,2025-07-04,Taxas dos DIs sobem após Moraes convocar audiência sobre IOF,"Reuters04/07/2025 17h02•Atualizado 2 horas atrás 04/07/2025 17h02•Atualizado 2 horas atrás Publicidade Sem a referência dos Treasuries em função de feriado nos Estados Unidos, as taxas dos DIs tiveram variações modestas nesta sexta-feira e encerraram a sessão no Brasil com leves altas, com o mercado monitorando os desdobramentos do embate entre governo e Congresso sobre o IOF, agora com a intervenção do STF. Em uma sessão de liquidez reduzida, no fim da tarde a taxa do Depósito Interfinanceiro (DI) para janeiro de 2027 estava em 14,18%, ante o ajuste de 14,136% da sessão anterior. A taxa para janeiro de 2028 marcava 13,405%, ante o ajuste de 13,348%. “É uma decisão de positiva a neutra”, pontua o estrategista-chefe do Grupo Laatus, Jefferson Laatus Entre os contratos longos, a taxa para janeiro de 2031 estava em 13,31%, ante 13,265% do ajuste anterior, e o contrato para janeiro de 2033 tinha taxa de 13,36%, ante 13,327%. O feriado do Dia da Independência nos Estados Unidos manteve o mercado de Treasuries fechado, deixando as negociações ao redor do mundo sem sua principal referência. Com a agenda também relativamente esvaziada no Brasil, investidores se voltaram para Brasília, onde o ministro do Supremo Tribunal Federal (STF) Alexandre de Moraes suspendeu liminarmente os efeitos dos decretos presidenciais que elevaram as alíquotas do Imposto sobre Operações Financeiras (IOF), bem como a decisão do Congresso Nacional na semana passada que sustou os efeitos dessas medidas do governo Lula. Na prática, Moraes zerou a disputa via decretos e convocou uma audiência de conciliação para o próximo dia 15 de julho, com representantes do governo, da Câmara, do Senado e da Procuradoria-Geral da República (PGR). A decisão de Moraes ainda vai passar por um referendo dos demais ministros do STF. Continua depois da publicidade Para Matheus Spiess, analista da Empiricus Research, a notícia de uma reunião de conciliação por iniciativa do STF ajuda a melhorar o humor dos investidores, ainda que a paz entre governo e Congresso seja difícil de ser alcançada. “Não vejo como solução, mas minimiza estragos. Se governo fosse para o tudo ou nada, a trajetória dos ativos poderia ficar turbulenta”, avaliou Spiess. Ao mesmo tempo, ainda que haja conciliação em torno do IOF, a solução para a área fiscal ainda não surgiu, acrescentou Spiess. “Então os prêmios sobem.” Continua depois da publicidade Na ponta longa da curva brasileira — trecho bastante suscetível à questão fiscal –, a taxa do DI para janeiro de 2033 chegou a marcar 13,320% (-1 ponto-base ante o ajuste da véspera) às 13h27, na esteira da decisão de Moraes. Mas a taxa se recuperou até fechar em leve alta, de 3 pontos-base. Em entrevista durante a tarde à CNN Brasil, o presidente da Câmara, Hugo Motta (Republicanos-PB), afirmou que a decisão de Moraes evita o aumento do IOF em sintonia com o desejo da maioria do plenário da Casa. Além disso, defendeu cortes de gastos que não prejudiquem as pessoas mais pobres. Ele citou a revisão de benefícios fiscais — uma pauta defendida pelo governo, mas que sempre encontrou resistência no Congresso. Os comentários de Motta surgem após ele virar alvo nas redes sociais nos últimos dias, sendo acusado de defender medidas que atingem os mais pobres e poupam os mais ricos. Motta afirmou que a Câmara vai aprovar a isenção de Imposto de Renda para quem ganha até R$5 mil — uma proposta do governo. Continua depois da publicidade Perto do fechamento a curva brasileira seguia precificando quase 100% de chances de manutenção da Selic em 15% no fim de julho. Na quinta-feira — atualização mais recente — a precificação das opções de Copom negociadas na B3 indicava 89,50% de chances de manutenção da Selic, contra 6,90% de probabilidade de nova alta de 25 pontos-base este mês. Pela manhã, o Instituto Brasileiro de Geografia e Estatística (IBGE) informou que Índice de Preços ao Produtor recuou 1,29% em maio, após queda de 0,12% em abril, marcando a quarta taxa negativa consecutiva após uma série de 12 resultados positivos. O resultado levou o índice acumulado em 12 meses a uma alta de 5,78%. Reuters",Infomoney
https://www.infomoney.com.br/business/natura-aguarda-proposta-interessante-por-avanco-na-separacao-da-avon-internacional/,2025-07-04,Natura aguarda “proposta interessante” por avanço na separação da Avon Internacional,"Iuri Santos04/07/2025 16h38•Atualizado 2 horas atrás 04/07/2025 16h38•Atualizado 2 horas atrás Publicidade Com a decisão de se desfazer da operação internacional da Avon já definida, a Natura (NATU3) está esperando agora uma “proposta interessante” para avançar no processo. Há urgência, no entanto, para vender o braço da operação responsável pela Avon fora da América Latina. A Naturajá havia anunciado que busca saídas para a operação entre uma venda e a separação do negócio. “A hora que houver uma proposta interessante, pode andar”, disse a vice-presidente de operações da Natura, Josie Romero, aoInfoMoney. Em seu Investor Day na última segunda-feira (30), a empresa anunciou ter dedicado um time para executar o processo. Essa pequena equipe interna atua em conjunto com um grupo de consultores financeiros para avançar no tema. Continua depois da publicidade Segundo Romero, o que existe agora é uma decisão estratégica de fazer a separação. “A partir de agora, a qualquer momento pode acontecer. Existe urgência, não há a menor dúvida disso. Quando se toma a decisão e divulga ela para o mercado, você quer que ela ocorra”, aponta. Nesta semana, a Natura concretizoua incorporação da Natura&Co pela Natura Cosméticose passou a operar pelo código de negociaçãoNATU3na B3. A empresa conclui neste ano o que chama de Onda 2, de integração entre as operações da Avon e da Natura, o que inclui mercados importantes da América Latina como México e Argentina. Iuri Santos Repórter de inovação e negócios no IM Business, do InfoMoney. Graduado em Jornalismo pela Unesp, já passou também pelo E-Investidor, do Estadão.",Infomoney
https://www.infomoney.com.br/mercados/negociacoes-com-dolar-digital-subiram-32-no-brasil-apos-anuncio-de-alta-do-iof/,2025-07-04,"Negociações com dólar digital atingem R$ 9,3 bi no Brasil após anúncio de alta do IOF","Paulo Barros04/07/2025 16h20•Atualizado 3 horas atrás 04/07/2025 16h20•Atualizado 3 horas atrás Publicidade As negociações com o dólar digital Tether (USDT), criptomoeda atrelada à moeda americana, somaram R$ 9,63 bilhões em junho no Brasil, segundo dados da Biscoint. O volume representa um crescimento de 32% em relação a maio, quando foram negociados R$ 7,29 bilhões. A alta coincide com o período em que o governo federal anunciou, por decreto, o aumento das alíquotas do IOF (Imposto sobre Operações Financeiras) para operações como transferências internacionais. O aumento do IOF, anunciado pelo governo como parte de um esforço de justiça fiscal, foi posteriormente anulado pelo Congresso por meio de um decreto legislativo. A reação do Executivo foi acionar o Supremo Tribunal Federal (STF), alegando que o Legislativo violou prerrogativas constitucionais do presidente da República. Na sexta-feira (4), o ministro Alexandre de Moraes, relator do caso,suspendeu os efeitos tanto do decreto do governo quanto do decreto legislativo, e convocou representantes dos dois Poderes para uma audiência de conciliaçãomarcada para 15 de julho. Até esse desfecho, os dados indicam movimentação crescente no USDT, frequentemente usado como alternativa informal a remessas internacionais. Embora o Banco Central tenha emitido orientações preliminares, ainda não há regulamentação definitiva que classifique transações com stablecoins como equivalentes a operações de câmbio, o que permite que esse tipo de transação continue ocorrendo em uma zona de menor regulação tributária. Em unidades negociadas, o volume passou de 1,28 bilhão de USDT para 1,73 bilhão. A média diária de negociações também cresceu, de 41,28 milhões para 57,66 milhões de unidades. O preço médio do USDT em reais caiu de R$ 5,69 para R$ 5,57 no período. A Binance manteve a liderança no par USDT-BRL, com 81,9% de participação de mercado. A brasileira BitPreço liderou entre corretoras nacionais, com 5,4%. Paulo Barros Jornalista, editor de Hard News no InfoMoney. Escreve principalmente sobre economia e investimentos, além de internacional (correspondente baseado em Lisboa)",Infomoney
https://valor.globo.com/financas/noticia/2025/07/04/exclusivo-tim-sonda-mercado-para-venda-de-acoes-em-bloco-que-pode-chegar-a-r-600-milhoes-dizem-fontes.ghtml,2025-07-04,"Exclusivo: TIM sonda mercado para venda de ações em bloco que pode chegar a R$ 600 milhões, dizem fontes","Em alta 04/07/2025 16h11Atualizado04/07/2025 A operadora de telefonia TIM está sondando o mercado para realizar, possivelmente na próxima semana, um leilão de ações na bolsa brasileira, o chamado “block trade”, apurou oValor. A operação seria um leilão de sobras de ações resultantes de processos de grupamento e desdobramento. Segundo fontes, a operação tende a girar entre R$ 500 milhões e R$ 600 milhões. A TIM ainda não selecionou os bancos, mas já teria começado a pedir propostas para a transação. A companhia já tinha sinalizado ao mercado, no início do ano, que faria esse leilão. Procurada, a TIM disse a ""operação já havia sido anunciada em comunicados anteriores e que ainda não há data para o leilão. A operadora também não confirma o valor estimado do bloco de ações"". A operação ocorrerá um tempo após a Vivo ter eito um “block trade” semelhante, que movimentou R$ 1 bilhão. Acompanhe os mercados com nossas ferramentasAcessar gratuitamente Outro tema em que houve avanço é um documento, a ser aprovado pelos ministros de Finanças, para que haja voz uníssona entre países do Brics nos fóruns de governança global e bancos multilaterais Até a posse do novo presidente, Marco Aurelio Viana seguirá interinamente no cargo e, depois, retomará seu cargo na diretoria de seguridade A rivalidade entre o empresário e Trump ameaça partes cruciais do império de Musk e deixa os legisladores republicanos presos em uma disputa entre o presidente dos EUA e o homem mais rico do mundo Secretário-executivo da Fazenda adianta ao Valor argumentos que serão levados à audiência de conciliação com o Congresso, marcada por Moraes para o próximo dia 15 O evento ocorreu na Casa Branca e fez parte das festividades do Dia da Independência dos EUA Vaga de Simão Pedro na Assembleia Legislativa será ocupada por filiada do PSB Decisão judicial sobre guarda do filho de Marília Mendonça destaca alienação parental ABFintechs vê o episódio com “bastante preocupação” e alerta que “vulnerabilidades podem surgir onde menos se espera”",Valor Econômico
https://valor.globo.com/empresas/noticia/2025/07/04/priner-tem-receita-bruta-de-r-3922-milhoes-no-2o-tri-aponta-previa-operacional.ghtml,2025-07-04,"Priner tem receita bruta de R$ 392,2 milhões no 2º tri, aponta prévia operacional","04/07/2025 18h41Atualizado04/07/2025 APrinerreportou uma receita bruta de R$ 392,2 milhões no segundo trimestre de 2025, resultado 72,7% acima dos R$ 227,1 milhões apresentados um ano antes. Os dados preliminares constam da prévia operacional da companhia divulgada nesta sexta-feira (4). O valor aproximado dos novos contratos celebrados pelaPrinerno trimestre foi de R$ 318,2 milhões. A companhia finalizou o trimestre com 6.602 funcionários, ante os 6.967 registrados no primeiro trimestre e 4.796 funcionários no segundo trimestre de 2024. Acompanhe os mercados com nossas ferramentasAcessar gratuitamente Outro tema em que houve avanço é um documento, a ser aprovado pelos ministros de Finanças, para que haja voz uníssona entre países do Brics nos fóruns de governança global e bancos multilaterais Até a posse do novo presidente, Marco Aurelio Viana seguirá interinamente no cargo e, depois, retomará seu cargo na diretoria de seguridade A rivalidade entre o empresário e Trump ameaça partes cruciais do império de Musk e deixa os legisladores republicanos presos em uma disputa entre o presidente dos EUA e o homem mais rico do mundo Secretário-executivo da Fazenda adianta ao Valor argumentos que serão levados à audiência de conciliação com o Congresso, marcada por Moraes para o próximo dia 15 O evento ocorreu na Casa Branca e fez parte das festividades do Dia da Independência dos EUA Vaga de Simão Pedro na Assembleia Legislativa será ocupada por filiada do PSB Decisão judicial sobre guarda do filho de Marília Mendonça destaca alienação parental ABFintechs vê o episódio com “bastante preocupação” e alerta que “vulnerabilidades podem surgir onde menos se espera”",Valor Econômico
https://valor.globo.com/empresas/marketing/noticia/2025/07/04/para-atrair-consumidor-varejistas-transformam-julho-em-mes-de-promocoes-e-campanhas.ghtml,2025-07-04,"Para atrair consumidor, varejistas transformam julho em mês de promoções e campanhas","04/07/2025 15h59Atualizado04/07/2025 O Dias das Mês e dos Namorados já passou, e o Dia dos Pais, a Black Friday e o Natal ainda não chegaram. Para driblar esse período carente de datas comemorativas mais fortes, as plataformas de e-commerce estão investindo em campanhas específicas para o mês de julho. Amazon, Mercado Livre, Shopee e MadeiraMadeira, por exemplo, estão apostando em descontos, influenciadores e distribuição de cupons. Acompanhe os mercados com nossas ferramentasAcessar gratuitamente Outro tema em que houve avanço é um documento, a ser aprovado pelos ministros de Finanças, para que haja voz uníssona entre países do Brics nos fóruns de governança global e bancos multilaterais Até a posse do novo presidente, Marco Aurelio Viana seguirá interinamente no cargo e, depois, retomará seu cargo na diretoria de seguridade A rivalidade entre o empresário e Trump ameaça partes cruciais do império de Musk e deixa os legisladores republicanos presos em uma disputa entre o presidente dos EUA e o homem mais rico do mundo Secretário-executivo da Fazenda adianta ao Valor argumentos que serão levados à audiência de conciliação com o Congresso, marcada por Moraes para o próximo dia 15 O evento ocorreu na Casa Branca e fez parte das festividades do Dia da Independência dos EUA Vaga de Simão Pedro na Assembleia Legislativa será ocupada por filiada do PSB Decisão judicial sobre guarda do filho de Marília Mendonça destaca alienação parental ABFintechs vê o episódio com “bastante preocupação” e alerta que “vulnerabilidades podem surgir onde menos se espera”",Valor Econômico
