url,data,titulo,texto,fonte
https://www.infomoney.com.br/mercados/bolsonaro-nega-ter-monitorado-adversarios-politicos-com-programa-espiao-da-abin/,2025-06-21,Bolsonaro nega ter monitorado adversários políticos com programa espião da Abin,"Agência O Globo21/06/2025 14h00•Atualizado 6 horas atrás 21/06/2025 14h00•Atualizado 6 horas atrás Publicidade O ex-presidente Jair Bolsonaro (PL) negou neste sábado (21) ter utilizado o sistema espião adquirido pela Agência Brasileira de Inteligência (Abin) para monitorar adversários políticos durante seu governo. Em declaração à imprensa ao deixar o hospital em Brasília, onde passou por exames após um mal-estar, Bolsonaro afirmou que “nunca precisou saber” onde estavam seus opositores. “Para que eu usaria um equipamento desse? Bota para fora quem usou para isso e resolve. Usava para quê? Que finalidade? Não existe isso. Criaram uma fantasia que eu estava monitorando as pessoas. Para que eu ia saber onde está A, B ou C? Ninguém reclamou de monitoramento”, disse o ex-presidente. Ex-presidente passou mal durante agenda em Goiânia na sexta-feira As declarações ocorrem após a Polícia Federal afirmar, em relatório encaminhado ao Supremo Tribunal Federal (STF), que Bolsonaro foi o “principal destinatário” dos produtos das ações clandestinas da Abin. Segundo a investigação, durante a gestão de Alexandre Ramagem à frente da agência, foram produzidos documentos com informações sensíveis que eram sistematicamente encaminhados ao então presidente. “Jair Messias Bolsonaro figura como o principal destinatário do produto das ações clandestinas e da instrumentalização da ABIN, ao tempo, dirigida por Alexandre Ramagem conforme se depreende das próprias anotações do então Diretor da ABIN”, diz o documento. A investigação teve início após o GLOBO revelar, em março de 2023, a compra de um sistema espião pela agência para monitorar a localização de alvos predeterminados em todo o país. O relatório final da PF cita documentos encontrados com o deputado federal Alexandre Ramagem (PL-RJ), ex-diretor-geral da Abin, que foram direcionados a Bolsonaro. Os textos tinham títulos como “Bom dia Presidente” e ““Presidente TSE informa”. Continua depois da publicidade “Estas são evidências que corroboram a concorrência do então Presidente da República das ações delituosas perpetradas na ABIN”, alega a PF. De acordo com o relatório, as “anotações revelam ações, cujo produto era encaminhado ao Presidente da República, materializando as ilicitudes perpetradas durante sua gestão como Diretor da ABIN em especial a disponibilização da estrutura do Estado Brasileiro para ações desviadas do sentido republicano”. Agência O Globo",Infomoney
https://www.infomoney.com.br/mercados/qual-a-perda-se-cair-da-serie-a-para-b-do-brasileirao-o-ceo-do-red-bull-calcula/,2025-06-21,Qual a perda se cair da Série A para B do Brasileirão? O CEO do Red Bull calcula,"Renan Prates21/06/2025 10h03•Atualizado 1 dia atrás 21/06/2025 10h03•Atualizado 1 dia atrás Publicidade Com o conhecimento de quem ficou próximo da queda para a Série B do Brasileirão no ano passado, o CEO doRed Bull Bragantino,André Rocha, estimou qual seria a perda financeira para o clube de Bragança Paulista em caso do rebaixamento da Série A para a segunda divisão da competição – o que acabou não acontecendo. O risco considerável de queda fez André Rocha estudar qual seria a quantia que o Red Bull Bragantino deixaria de faturar em caso de rebaixamento para a Série B. “Eu fiz cálculos na ordem de 24 a 25 milhões de euros [entre R$ 151,7 milhões e R$ 158 milhões] no ano passado”, contou, em entrevista ao programa Game Changers. Mas Rocha ressaltou que existem alguns fatores que não foram considerados neste cálculo de perdas financeiras. “Tem uma parte intangível que é potencialmente maior do que o direito de TV. Porque com o clube na Série B hoje, o mesmo atleta, se você for vender, ele tem um tíquete de Série B. Você não sabe ainda qual é esse tíquete. Mas que existe, existe. Isso é inegável”, explicou o executivo. “Alguém valorizou? É impossível, porque o mesmo atleta não vai ser vendido pela mesma quantia no ano na Série A e na Série B. Se você, porventura, perder um patrocínio que está assinado e que seja específico para Série A, também não sei se menciona. A dificuldade de você obter um novo patrocínio aí estando na Série B é outra coisa. Como é que você consegue, né, atrair mão de obra? Como é que você reter um talento que já está lá dentro? Então existe também a parte intangível de uma queda”, complementou. Com um desempenho bastante oscilante na temporada passada, o Red Bull Bragantino terminou o Brasileirão 2024 na décima sexta colocação na competição com 44 pontos marcados, apenas dois na frente do Athletico, que caiu para a Série B. “O que a gente passou no ano passado precisa ser um game changer para nós. Quero acreditar que foi, né? E não estou nem dizendo do resultado perceptivo, porque o resultado é uma consequência de uma série de fatores” Continua depois da publicidade Em janeiro deste ano, Jurgen Klopp, alemão campeão da Premier League como técnico pelo Liverpool e agora diretor global de futebol do Red Bull, ficou cinco dias na sede do Red Bull Bragantino e acompanhou in loco jogos do time principal no Allianz Parque e do sub-17 na Arena Barueri. Rocha lidou diretamente com Klopp durante a passagem do alemão pelo Brasil e foi só elogios ao diretor global. “O Klopp é um ser indescritível. É um cara de uma genialidade e ao mesmo tempo de uma simplicidade ímpar. E acho que é até por isso que ele se torna tão diferente, porque ele é capaz de fazer perguntas absolutamente geniais que te fazem pensar para o resto do dia da onde que ele tirou isso, e perguntas simples, quase que ingênuas, mas pela transparência, pela ingenuidade dele buscar conhecer aquilo ali”. O CEO do Red Bull Bragantino confidenciou que Klopp é fã do futebol brasileiro. “100% apaixonado. Isso não sou eu que estou falando, é o pessoal da matriz que me fala”, explicou André Rocha, para depois contextualizar. Continua depois da publicidade “Ele está apaixonado pelo potencial, por poder efetivamente ver as crianças da forma que ele ouvia falar. Ele esteve com a gente mais tempo até do que eles tinham programado, né? Eu fiquei insistindo para ele ficar mais tempo, e ele acabou ficando cinco dias aqui. Então, viu nossas escolinhas treinando lá in loco, e viu o jogo do sub-17. Ele está apaixonado pelo negócio, está muito feliz”. Game Changersé um programa de entrevistas com as principais personalidades do esporte que mudaram o jogo em suas áreas de atuação. Acompanhe quinzenalmente uma nova edição do Game Changers noYoutube do Infomoney. Renan Prates",Infomoney
https://www.infomoney.com.br/mercados/do-jiu-jitsu-ao-day-trade-trader-que-alia-disciplina-simplicidade-no-mercado/,2025-06-21,De faixa preta no jiu-jitsu ao day trade: Na faixa branca o trabalho é ir lá apanhar,"Bruno Nadai21/06/2025 08h29•Atualizado 1 dia atrás 21/06/2025 08h29•Atualizado 1 dia atrás Publicidade Faixa preta de jiu-jitsu, Pedro Heck vê no esporte lições valiosas para o trader. “Eu comecei o jiu-jitsu em 2012, na faculdade. A faixa azul, por exemplo, é a faixa onde mais se desiste. O paralelo com o mercado é claro: é quando o patrimônio fica flat por anos. A importância está nos pequenos ganhos que, ao longo do tempo, fazem a diferença” explica. Para os iniciantes, o conselho é direto: “Na faixa branca (do jiu-jtsu), seu trabalho é ir lá apanhar, agradecer e voltar no dia seguinte”. No mercado, ele faz o paralelo. “Se precisa sobreviver tempo suficiente para aprender. O stop loss (perda) no mercado é como o arm lock (chave de braço) no jiu-jitsu: ou você bate e vive para lutar outro dia, ou quebra o braço”, compara Heck ao relacionar o trade ao jiu-jitsu. No episódio 68 doGainDelas, do canal GainCast, Pedro Heck — trader, ex-gestor e fundador de uma mesa proprietária em Ribeirão Preto (SP) — compartilhou sua trajetória no mercado financeiro, os desafios da profissão e como a disciplina do jiu-jitsu ajuda em sua rotina como operador. “Eu fui trader de uma gestora aqui no interior de São Paulo (Ribeirão Preto). Comecei na pessoa física, como muitos, operando com uma continha de R$ 1 mil e perdendo dinheiro no início, o que é o natural”, conta Pedro. Heck destacou que sua entrada no mercado foi acompanhada de estudos ainda na faculdade. “Eu comecei a estudar o mercado financeiro na época da faculdade. Eu pegava muita optativa na FEA (USP) lá de Ribeirão Preto, de mercado financeiro, derivativos, sistema financeiro nacional. Não tinha dinheiro para operar, mas falei: ‘Eu vou aprendendo no dia que o dinheiro aparecer a gente vê o que faz’”, lembra. Aprenda o Setup da Praia na Semana do Trader Sossegado 2.0 Continua depois da publicidade Heck fala no episódio sobre sua experiência como trader institucional. “Eu acho que o primeiro ponto que prego muito é estrutura. O volume financeiro é absurdamente superior, mas o que diferencia é ter uma equipe do lado, análise macro, montagem de carteira. O frio na barriga aparece, não tem como evitar, mas essa estrutura dá respaldo”, frisa. Ao deixar a gestora, Pedro não sentiu dificuldade em ajustar o tamanho das operações. “Tenho já bem estabelecido na minha cabeça qual é o tamanho de mão que eu opero, aquele que eu consigo ir lá pegar meu iFood sem ficar suando frio”, afirma. Leia também: Continua depois da publicidade Pedro Heck destaca três conselhos fundamentais para quem está na jornada do trade. O primeiro, segundo ele, é deixar o ego do lado de fora. “O que vai te quebrar é o teu ego. A gente não vai acertar sempre. A gente precisa acertar, ganhar bem quando acerta e perder pouco quando erra”, afirma. O segundo conselho é aceitar que o processo envolve falhas e dores ao longo do caminho. “Você vai se machucar no meio do caminho, vão ter algumas lesões, e isso nunca vai parar. Aceite isso”, diz, reforçando o paralelo com o jiu-jitsu e o mercado financeiro. Por fim, Pedro aponta a importância de respeitar o próprio tempo e trajetória, sem comparações desnecessárias. “Cada um tem o seu tempo. Inspire-se em histórias, mas não compare sua jornada com a de outros”, recomenda. Continua depois da publicidade Confira mais conteúdos sobre análise técnica noIM Trader. Diariamente, o infomoney publica o que esperar dosminicontratos de dólar e índice. Bruno Nadai",Infomoney
https://www.infomoney.com.br/mercados/por-que-as-apostas-online-sao-uma-armadilha-para-sua-saude-mental-financeira/,2025-06-21,Por que as apostas online são uma armadilha para sua saúde mental e financeira,"Bruno Nadai21/06/2025 07h56•Atualizado 1 dia atrás 21/06/2025 07h56•Atualizado 1 dia atrás Publicidade O psicólogo Jan Leonardi explica que, ao contrário de um investimento, em que é possível traçar um perfil de risco e ter previsibilidade, as apostas funcionam como uma armadilha: “Existem aqueles investimentos que eu sei que eu vou ganhar ali talvez 13% no ano com tranquilidade, meu dinheiro não vai desaparecer. E não é o caso das apostas”. O avanço das apostas online no Brasil, incluindo as bets esportivas e os populares “jogos do tigrinho”, tem gerado preocupações em diferentes áreas. Esse foi o tema do 13º episódio da 3ª temporada doMapa Mental, do canal GainCast, que contou com a participação de Jan Leonardi, referência no estudo do comportamento humano. Leonardi é doutor em psicologia clínica pela USP, especialista em terapia comportamental e terapia comportamental dialética. Foi ainda presidente da Associação Brasileira de Psicologia Baseada em Evidências. Aprenda o Setup da Praia na Semana do Trader Sossegado 2.0 Um dos principais mecanismos que mantém os apostadores presos ao ciclo de perdas e tentativas de recuperação é o reforçamento (aumento de probabilidade de comportamento) intermitente. “Se de vez em quando eu der alguma coisinha, mesmo que na soma total ele muito mais perdeu do que ganhou, mantenho ele ali”, explica. As plataformas usam notificações e bônus para estimular o retorno. “Imagina que o cara perdeu um tanto, ele fala: ‘Ah, não sei, só tô perdendo, não quero mais’. Ele fica lá um tempo sem jogar, de repente chega uma notificação: ‘O jogo tá com saudade de você’ ou fala assim: ‘Ó, se você voltar hoje, tem um bônus que só vale para as próximas 2 horas, hein, R$100,00 de bônus’”, exemplifica. Continua depois da publicidade Leia também: Leonardi destaca que o discurso do “dinheiro fácil” promovido nas redes sociais explora um viés cognitivo natural do ser humano. “Nós, seres humanos, temos basicamente dois tipos de cognição. Um pensamento rápido, muito automático, que é uma espécie de atalho mental, e um pensamento muito mais lento, que serve para situações complexas. Quando alguém diz que existe uma solução mágica, que você pode ganhar muito dinheiro rapidamente, isso ativa o pensamento automático, e a pessoa embarca na promessa sem análise crítica”, explica. Continua depois da publicidade Embora qualquer pessoa possa ser impactada, Leonardi aponta grupos mais vulneráveis. “Primeiro adolescentes. Adolescente ele tem menos controle de impulso, é menos racional, mais reativo, mais impulsivo. Então ele já é automaticamente alguém mais suscetível”, comenta. Além disso, pessoas com transtornos de ansiedade, déficit de atenção, ou traços de impulsividade estão em maior risco. O impacto, segundo ele, é devastador: “O principal produto de alguém que entrou em jogo, começou a jogar demais e perdeu tudo é depressão. Porque a depressão é um quadro clínico muito comum de ser disparado por perdas grandes”, afirma. Para quem já se envolveu com apostas ou quer evitar cair na armadilha. “A primeira coisa é olhar para o quanto que ela se preocupa com o jogo, o quanto ela quer jogar, se ela abre mão de outras atividades para jogar. Depois disso, tem o custo financeiro. Eu conheço uma pessoa que aposta todo mês R$ 20,00 em bets. Ele nunca escalonou. Parece que tá tudo bem. A minha questão é: eu nunca arriscaria isso. Porque tem tantos mecanismos previstos e planejados para te fazer apostar mais”, recomenda. Continua depois da publicidade E deixa um recado claro: “Não acredite que você vai conseguir ganhar. Você não vai ganhar. Você sempre vai mais perder do que ganhar numa proporção absurda”. Para Leonardi, as bets são um mercado imoral. “Não é porque algo é legalizado que algo não é imoral. A escravidão já foi legalizada”, destaca. Segundo ele, o verdadeiro problema está nos divulgadores. “O verdadeiro imoral são os divulgadores. A esmagadora maioria das pessoas que fazem propaganda de bets e tigrinho não precisam. São pessoas que já têm grana”, conclui. Continua depois da publicidade Confira mais conteúdos sobre análise técnica noIM Trader. Diariamente, o infomoney publica o que esperar dosminicontratos de dólar e índice. Bruno Nadai",Infomoney
https://valor.globo.com/financas/noticia/2025/06/21/o-que-10-ex-presidentes-do-bc-recomendam-a-gabriel-galipolo-atual-chefe-da-autarquia.ghtml,2025-06-21,"O que 10 ex-presidentes do BC recomendam a Gabriel Galípolo, atual chefe da autarquia","Em alta 21/06/2025 10h49Atualizado21/06/2025 Investir mais em comunicação e tomar decisões mirando o longo prazo são alguns dosconselhos recebidos pelo atualpresidente do Banco Central, Gabriel Galípolo, de seus antecessores.As recomendações fazem parte dasérie""Conversas presidenciais"", que marca a comemoração dos 60 anos da autoridade monetária. Ao todo,foram 10 episódios divulgados semanalmente, nos quais Galípolo entrevista alguns dos principais nomes que moldaram a história do BC.São narradas, entre outras lembranças, a evolução doCopom (Comitê de Política Monetária)e o enfrentamento de crises bancárias, cambiais e internacionais que alteraram o rumo da economia brasileira. Wadico Bucchi O papel da comunicação do BC foi mencionado desde o primeiro episódio, na conversa comWadico Bucchi,que lidou com uma pressão política por tabelamento de juros logo no início de sua gestão (de 1989 a 1990). Para o ex-presidente do BC, é importante transmitir à sociedade a mensagem de que o BC trabalha pela estabilidade. ""O Banco Central não deve ser um agente de volatilidade. [...] Eu sei que isso politicamente é difícil em alguns momentos"", disse. Bucchi exaltou o papel de comunicador de Galípolo, acrescentando que essa habilidade será de grande valia para o BC ao longo de seu mandato. Gustavo Loyola No episódio seguinte,Gustavo Loyola– que lidou com uma crise bancária em sua segunda passagem na chefia, de 1995 a 1997 -- ressaltou que a comunicação tornou-se cada vez mais necessária com o surgimento de novas tecnologias. Além das novas mídias, ele também citou a redistribuição de forças entre os Poderes em Brasília. ""Hoje tem que ter uma comunicação muito forte não apenas com o Executivo mas com o Legislativo e o Judiciário"", acrescentou. Alexandre Tombini Dica semelhante foi dada porAlexandre Tombini,presidente do BC no governo deDilma Rousseff (PT), entre 2011 e 2016. ""Eu aconselharia o presidente lá atrás a investir muito na comunicação com a sociedade. [...] É uma área em que tem que investir [ainda mais] nos dias de hoje, com os novos meios de comunicação"", disse. Roberto Campos Neto Roberto Campos Neto,que passou o bastão para Galípolo na virada do ano, falou da importância de se aproximar do Congresso Nacional para a aprovação de projetos de interesse do Banco Central. ""Se não tivesse tido essa aproximação com a ala política, eu não teria conseguido aprovar quase nada"", afirmou. Na conversa, o ex-presidente do BC alertou Galípolo a afastar a autoridade monetária ao máximo da polarização política e disse não sentir saudade das críticas que recebia do Executivo. Nomeado pelo então presidenteJair Bolsonaro (PL),Campos Neto foi o primeiro a chefiar a autoridade monetária sob o regime de autonomia, que entrou em vigor em 2021 e foi alvo de ataques do presidenteLuiz Inácio Lula da Silva (PT). No décimo e último episódio da série, Campos Neto também recomendou que Galípolo tenha paciência, ressaltando que não se trata de uma ""corrida de 100 metros"". Pedro Malan Essa visão de longo prazo apareceu também no discurso de outros líderes do Banco Central, comoPedro Malan-- chefe da instituição de 1993 a 1994, na implementação do Plano Real. ""É muito importante você saber que tem um horizonte de quatro anos pela frente. [...] Pode ser uma grande vantagem, você poder olhar curto, médio e longo prazo e suas interações, saber que tem certas coisas que se desdobram no tempo"", afirmou. Ainda de acordo com Malan, a maior contribuição que alguém pode dar é chamar a atenção dele para um problema, ainda que às vezes seja uma ""coisa boba"". Ilan Goldfajn Ilan Goldfajn,que lidou com um período de crise com recessão econômica e inflação fora da meta concomitantes em um cenário de juros elevados em sua gestão, de junho de 2016 a fevereiro de 2019, foi outro que aconselhou Galípolo a ter uma perspectiva de horizonte. ""Tem fogueira para apagar todos os dias. Noventa e nove por cento dessas coisas vão passar. Então, calma, não fique tão estressado"", disse. Com Ilan, Galípolo conversou sobre uma antiga decisão do Copom de manter a taxa básica de juros (Selic) em um nível elevado por tempo prolongado -- cenário que tende a se repetir nos próximos meses. No passado, a estratégia trouxe mais credibilidade para a atuação da autoridade monetária e ajudou no combate à inflação. Henrique Meirelles Saber lidar com os problemas de forma mais serena também foi a sugestão deHenrique Meirelles-- o mais longevo presidente do BC, de janeiro de 2003 a dezembro de 2010, durante os dois primeiros mandatos do presidente Lula. ""Calma sob pressão"", afirmou o ex-chefe da autarquia, que defendeu a tomada de decisões ""tecnicamente corretas"" sobre a política de juros, com base em modelos de análise, para que seja possível manter a variação de preços sob controle. Arminio Fraga Responsável pela implementação do sistema de metas de inflação, em 1999,Arminio Fragacompartilhou com Galípolo o conselho dado por ele no passado aStanley Fischer, seu amigo e ex-presidente do banco central de Israel, morto no fim de maio. ""Foca o que importa. Não inventa, a não ser que seja absolutamente necessário"", afirmou. Recomendou também preparação para lidar com tensão política. ""Tenha em mente que o seu capital político é limitado, então, você tem que usá-lo de forma inteligente, parcimoniosa."" Persio Arida JáPersio Arida, que ficou seis meses no comando, em 1995, destacou que o BC deve tomar a dianteira nas questões regulatórias -o que ele classifica como um ""baita desafio"" diante das transformações tecnológicas. Disse também que é difícil ter previsibilidade quando o assunto é a estabilidade do sistema financeiro. ""Alguma hora algum problema acontece e nunca é onde você imagina. Problemas bancários surgem quando você menos espera"", disse. Gustavo Franco Com gestão marcada por crises internacionais, de 1997 a 1999,Gustavo Francoé outro ex-presidente do BC que avalia que imprevistos são predominantes. Para ele, não existe receita de sucesso. ""Tenha bons princípios, vá com a alma limpa trabalhar e faça o melhor que você puder"", declarou. Acompanhe os mercados com nossas ferramentasAcessar gratuitamente Defesa Civil alerta para chegada de onda de frio a partir desta segunda-feira Quando a inteligência artificial é usada para manipular voz, imagem e desinformar, o risco",Valor Econômico
https://valor.globo.com/mundo/noticia/2025/06/21/ftanalise-a-implosao-da-estrategia-iraniana-de-nem-guerra-nem-paz.ghtml,2025-06-21,"FT/análise: A implosão da estratégia iraniana de ‘nem guerra, nem paz’","21/06/2025 10h20Atualizado21/06/2025 A resposta doIrãao assassinato inesperado de seu comandante mais poderoso, ordenado porDonald Trump, foi rápida e contundente. Apenas cinco dias depois que o ataque de drones americanos matouQassem Soleimanino aeroporto de Bagdá, Teerã lançou o que disse serem “dezenas de mísseis” contra duas bases iraquianas que abrigavam tropas dos Estados Unidos. Acompanhe os mercados com nossas ferramentasAcessar gratuitamente Defesa Civil alerta para chegada de onda de frio a partir desta segunda-feira Quando a inteligência artificial é usada para manipular voz, imagem e desinformar, o risco deixa de ser um problema de Cannes e passa a ser sistêmico para todo o mercado Advertência ocorre no mesmo dia em que os americanos deslocaram ao menos seis bombardeiros furtivos B-2 para o Oceano Pacífico Projeto em discussão no Senado propõe acabar com a possibilidade de recondução e estender mandatos para cinco anos Repatriação ainda é avaliada pelo governo Lula, que estuda outras alternativas para viabilizar a saída de cidadãos brasileiros da região Candidato a prefeito de Nova York, Zohran Mamdani prometeu aumentar impostos sobre ricos para financiar ônibus gratuitos e creches, além de supermercados públicos Gean Loureiro afirmou que falta de vagas impediu o embarque Tarifas do presidente dos Estados Unidos, Donald Trump, abriram uma ruptura no banco central americano Trump avalia se deve ou não se juntar aos esforços de Israel para destruir as instalações nucleares do Irã Há anos, a China tem usado a relação com o Irã para aumentar sua influência no Oriente Médio, ao mesmo tempo em que faz do petróleo iraniano barato um pilar da matriz energética",Valor Econômico
