url,data,titulo,texto,fonte
https://exame.com/future-of-money/btg-projeta-alta-de-nova-criptomoeda-e-faz-recomendacao-com-lucro-potencial-de-50/,2025-08-20,BTG projeta alta de nova criptomoeda e faz recomendação com lucro potencial de 50%,"Patrocínio: Criptomoedas (Reprodução/Reprodução) Editora do Future of Money Publicado em20 de agosto de 2025 às17h20. Especialistas da Mynt, plataforma de criptoativos do BTG Pactual, divulgaram na última terça-feira, 19, uma nova recomendação com potencial de lucro de até 50% aos seus clientes. Segundo os analistas de research da plataforma, a criptomoeda da rede de camada 2 da Ethereum, Arbitrum, pode continuar subindo. Nas últimas 24 horas, a ARB subiu mais de 6%, segundo dados do CoinMarketCap. Em cerca de US$ 0,50, a ARB é a criptomoeda de uma das principais redes de camada 2 da Ethereum atualmente. “A recente alta da Ethereum (ETH), impulsionado pelo forte fluxo nos ETFs à vista e pelo aumento da atividade on-chain, tem beneficiado diretamente as principais soluções de segunda camada (L2), como a Arbitrum”, justificaram os analistas Matheus Parizotto, João Galhardo e Lucas Costa no relatório disponível na íntegra no site e aplicativo da Mynt. “Nesse cenário, a rede se destaca como a maior L2 em valor total travado (TVL) e em volume de transações, reforçando seu papel central na escalabilidade do ecossistema Ethereum”, acrescentaram. Anteriormente,relatóriosde Trade Idea da Mynt tiveramacertosconsistentes em suas recomendações. Segundo os analistas da Mynt, a faixa de preço atual é um bom ponto de entrada para investidores que buscam lucrar com Arbitrum. Matheus Parizotto, João Galhardo e Lucas Costa apontaram para duas faixas de preço em que será possível fazer a realização de potenciais lucros com a criptomoeda: US$ 0,66 e US$ 0,75. O último, classifica um lucro potencial de 50%. “Após longo período de queda, ARB formou suporte em US$ 0,25 e depois registrou fundo mais alto em US$ 0,36, sinalizando reversão estrutural e topos e fundos ascendentes nos prazos curtos. A região de US$ 0,50, antes resistência relevante, foi superada em fechamento diário e tende agora a atuar como suporte importante, oferecendo ponto de entrada estratégico”, diz o documento. “Projeções do último pivô de alta apontam para US$ 0,66 como primeiro objetivo e US$ 0,75 como alvo principal”, acrescentaram os analistas. Além disso, o relatório ainda conta com uma observação para venda, caso o cenário previsto não se concretize. “Sugerimos encerrar a operação abaixo de US$ 0,36 caso o nível seja perdido, já que sua eventual perda invalidaria a estrutura de alta, abrindo espaço para correção mais prolongada”. Supremo Tribunal Federal fechou parceria com a Ambipar para a obtenção de créditos de carbono, incluindo o uso da tecnologia blockchain Em relatório, Bitwise afirma que criptomoeda teve ter uma valorização anual média de 28% até 2035 Com proposta inusitada, aplicativo Doop quer usar inteligência artificial para avaliar saúde dos usuários a partir das fezes enviadas Plataformas de criação de memecoins têm disputado a liderança no segmento ao longo das últimas semanas, sem um vencedor claro 01 02 03 exame no whatsapp Receba as notícias da Exame no seu WhatsApp Newsletter Future Of Money Quer saber as novidades que mexem com o mercado cripto? Assine as newsletters gratuitas do Future of Money! Selecione as newsletters que você deseja se inscrever* Crypto Deep (Semanal) Crypto Daily (Diária) Ao informar meus dados, eu concordo com aPolítica de Privacidade.",Exame
https://exame.com/economia/alckmin-diz-que-eua-aliviaram-tarifas-de-produtos-com-aluminio-em-ate-us-26-bilhoes/,2025-08-20,"Alckmin diz que EUA aliviaram tarifas de produtos com alumínio em até US$ 2,6 bilhões","Repórter Publicado em20 de agosto de 2025 às17h15. Última atualização em20 de agosto de 2025 às17h23. O vice-presidente e ministro do Desenvolvimento, Indústria, Comércio e Serviços,Geraldo Alckmin(PSB), afirmou nesta quarta-feira, 20, que uma alteração nas normas detributação dos Estados Unidos beneficiará as exportações brasileiras, com um alívio de US$ 2,6 bilhões em meio ao tarifaço. ""De acordo com Alckmin, o Departamento de Comércio dos EUA decidiu que os produtos industrializados do Brasil, que contêm aço e alumínio, não estarão mais sujeitos à sobretaxa de 50%. Em vez disso, esses produtos passarão a seguir as regras globais estabelecidas para esse tipo de material. ""O produtor que tiver aço ou alumínio passa a vigorar a [seção] 232 nessa parte do produto. Isso melhora nossa competitividade na área industrial. Se eu vendo uma máquina que tem aço, essa parte do aço, nós ficamos igual ao mundo inteiro"", disse. Segundo o vice-presidente, a mudança nas regras americanas, , proporcionará um alívio correspondente a 6,4% do total de US$ 40 bilhões que o Brasil exporta para os EUA, favorecendo setores como máquinas, equipamentos e motocicletas. “Isso vai trazer um avanço na competitividade industrial”, afirmou. A declaração ocorreu após o vice-presidente entregar ao presidente da Câmara, Hugo Motta (Republicanos-PB), um conjunto de medidas voltadas a impulsionar o comércio exterior e a ajudar as empresas brasileiras a lidarem com astarifas impostas pelo presidente dos EUA, Donald Trump. No Congresso, Alckmin solicitou urgência na votação da medida provisória 1309/2025, conhecida como MP do Tarifaço, que o governo chama de Brasil Soberano. Ele também pediu celeridade na tramitação dos Projetos de Lei Complementar (PLPs) que visam ampliar o crédito e expandir programas de incentivo, como o Reintegra e a prorrogação, por mais um ano, do drawback, regime aduaneiro que permite a isenção, suspensão ou restituição de tributos sobre insumos usados na produção de bens destinados à exportação. O presidenteDonald Trumpsurpreendeu os setores da indústria e do varejo dos Estados Unidos nesta terça-feira, ao ampliar astarifas sobre aço e alumíniopara incluir mais de400 itens de consumo que utilizam esses metais, como motocicletas e utensílios de mesa. Despachantes aduaneiros e importadores tiveram pouco tempo para se ajustar à mudança, que entrou em vigor na segunda-feira e afetou também as mercadorias já em trânsito, segundo informações daBloomberg. A nova lista de produtos com tarifas foi divulgada pela Alfândega e Proteção de Fronteiras na sexta-feira. A decisão foi confirmada nesta terça-feira, 19, pelo Departamento de Comércio dos EUA, que informou que407 categorias de produtos derivados de aço e alumínio estariam agora sujeitas à tarifa setorial. “A ação de hoje abrange turbinas eólicas e suas peças e componentes, guindastes móveis, tratores de esteira (bulldozers) e outros equipamentos pesados, vagões ferroviários, móveis, compressores e bombas, além de centenas de outros produtos”, afirmou o Departamento de Comércio em um comunicado. De acordo com a nota,os novos produtos incluídos estarão sujeitos a uma alíquota de 50%, que se aplica a todos os itens que contêm derivados de aço e alumínio, independentemente de seu país de origem. O valor, registrado nesta quarta-feira, representa o total de impostos, taxas e contribuições pagos pelos contribuintes brasileiros aos governos federal, estadual e municipal desde o início do ano Vice-presidente participou da 25ª Conferência Anual do Santander, em São Paulo Proposta é uma promessa de campanha do presidente Lula Ministra disse que é preciso tomar cuidado ""com um judiciário assistencialista"" 01 02 exame no whatsapp Receba as notícias da Exame no seu WhatsApp Nos acontecimentos mais relevantes do Brasil e mundo. E-mail inválido Desperta",Exame
https://exame.com/invest/mercados/dolar-cai-a-r-547-apos-ata-do-fed-apontar-risco-de-inflacao/,2025-08-20,"Dólar cai a R$ 5,47 após ata do Fed apontar risco de inflação","Redação Exame Publicado em20 de agosto de 2025 às17h08. Odólarà vista fechou a quarta-feira, 20, com queda de 0,51%, a R$ 5,472, após oscilar entre R$ 5,463 e R$ 5,505, num movimento de ajuste de excessos e de enfraquecimento global da moeda americana. Na véspera, a moeda americana fechou com alta superior a 1%, tocando nos R$ 5,50, com investidores atentos à proibição do STF que pode influenciar aaplicação da Lei Magnitsky no país.A decisão é importante porque pode piorar a relação entre Brasil e EUA, colocando em risco o sucesso das tentativas de negociação sobre as tarifas anunciadas pelo presidente americano Donald Trump. O mercado repercute também adivulgação da ata do Federal Reserve,coma maioria dos dirigentes apontando que o risco de inflação superou o risco de emprego para manter a taxa de juros inalteradaentre 4,25% e 4,50% pela quinta vez consecutiva. “A precificação de cortes pelo Federal Reserve reduz a atratividade do dólar no cenário internacional, percepção reforçada pela ata do Fed, que mostrou um comitê mais confiante na trajetória de desinflação e já discutindo o momento de iniciar a flexibilização. Esse movimento pressiona os rendimentos de curto prazo e enfraquece a divisa"", explica Bruno Shahini, especialista em investimentos da Nomad. Ainda no exterior, cresce a expectativa pelo simpósio econômico do Federal Reserve em Jackson Hole, onde o presidente do Fed deverá discursar na sexta. No cenário doméstico, adesaprovação do governo do presidente Lula caiu,chegando a 51%. Já a aprovação subiu três pontos percentuais, chegando a 46%. Além disso, a pesquisa também indicou que 55% dos brasileiros consideram que tanto o ex-presidente Jair Bolsonaro quanto o seu filho, o deputado Eduardo Bolsonaro, estão agindo mal diante do tarifaço de Trump. O dólar à vista é o valor negociado no mercado de câmbio para liquidação imediata, geralmente em até dois dias úteis. Esse tipo de câmbio é amplamente utilizado por empresas e instituições financeiras em operações de curto prazo, oferecendo uma cotação com base no valor real de mercado no momento da transação. O dólar futuro é uma cotação projetada para contratos de compra e venda de dólares a serem liquidados em datas futuras. Esse tipo de dólar é negociado na Bolsa de Valores, permitindo que empresas e investidores se protejam contra a volatilidade cambial. A cotação do dólar futuro pode variar bastante, pois leva em consideração as expectativas do mercado sobre a economia. Divisões por objetivos é um dos principais motivos que popularizaram os cofrinhos digitais; em alguns lugares, é possível encontrar rendimentos bem acima do CDI Mercados aguardam também simpósio de Jackson Hole e falas de Haddad e Tarcísio Na última reunião, autoridade monetária manteve, pela quinta vez consecutiva, as taxas em 4,25% e 4,50% ao ano Negócio estaria sendo avaliado em até R$ 12 bilhões s deverá ser feito com um consórcio de operadores aeroportuários e investidores estrangeiros, diz jornal 01 02 03 exame no whatsapp Receba as notícias da Exame no seu WhatsApp Nas melhores oportunidades do mercado para investir. E-mail inválido Invest",Exame
https://exame.com/invest/minhas-financas/caixinhas-virtuais-viram-febre-e-fazem-cdbs-superarem-poupanca/,2025-08-20,'Caixinhas' virtuais viram febre e fazem CDBs superarem poupança,"Caixinhas virtuais: modalidade chega como um novo jeito de poupar (Nora Carol Photography/Getty Images) Repórter de finanças Publicado em20 de agosto de 2025 às17h08. Última atualização em20 de agosto de 2025 às17h56. Acesso rápido pelo celular, com divisão personalizada: “Guarde dinheiro para as férias do Ano Novo”. Ascaixinhas ou cofrinhos virtuaisviraram febre entre os investidores, a ponto de fazer o volume investido emCDBs– os produtos em normalmente as caixinhas aplicam – ultrapassarem até a tradicional poupança. De acordo com a Associação Brasileira das Entidades dos Mercados Financeiro e de Capitais (Anbima), no primeiro semestre de 2025 foram R$ 1,15 trilhão contra R$ 957 bilhões respectivamente. “Esse efeito foi provocado em larga escala pelas caixinhas/cofrinhos dos bancos digitais que também se mostrou no alto número de CPFs na B3 em renda fixa, com CDBs e RDBs”, afirma Felipe Paiva, diretor de Relacionamento com Cliente, Educação e Pessoa Física da bolsa brasileira. Em junho deste ano,o número de CPFs que investem em renda fixa chegou a 100 milhões, um aumento de 9% em relação ao fim de 2024, quando eram 91,8 milhões. Investir nas caixinhas se tornouum novo jeito de poupar. A popularização decorre, em grande parte,da personalização que os cofrinhos proporcionam, já que aproxima o investidor do investimento, diz Claudia Yoshinaga, Coordenadora do Centro de Estudos em Finanças da FGV. “Nas caixinhas, acontece a motivação, ou seja, quando pensamos em um objetivo, como férias. Essa ideia de propósito é um bom gatilho para as pessoas se animarem a investir. E começamos a ver nos últimos tempos as instituições financeiras abraçarem isso de vez”, diz. O grande responsável por popularizar as caixinhas, ainda em 2022, foi oNubank, que tem justamente as divisões por propósitos no seu aplicativo. Logo, várias outros bancos e fintechs seguiram a estratégia. “Nosso foco foi desmistificar o investimento, tornando-o parte do dia a dia. Hojeas caixinhas são um dos produtos mais populares do Nubank”, afirma a gerente geral de contas Maristela Calazans. Uma das atratividades das caixinhas virtuais são os bons rendimentos: aoferta de 100% do CDI é uma das mais encontrados. Mas além da facilidade, a segurança é um dos pilares que atrai os investidores.As caixinhas têm cobertura do Fundo Garantidor de Crédito (FGC), que vale para todas as contas em bancos, até R$ 250 mil. “Quem investe valores abaixo do que esse não corre risco de perder o dinheiro. E ninguém que investe qualquer valor nas caixinhas corre o risco de receber menos do que foi depositado, porque essa não é uma renda variável como ações, por exemplo”, explica a educadora financeira Aline Soaper. Para ela,as caixinhas também democratizaram o acesso aos investimentos, fazendo com que as pessoas não precisem abrir conta em corretoras para investir. “O objetivo principal das caixinhas é criar reserva, juntar dinheiro para realizar algo e ver o dinheiro crescer. O foco precisa ser na acumulação e não apenas no rendimento. Mas o rendimento começa a ficar interessante quanto mais dinheiro é acumulado”, pontua. Entretanto, em alguns lugares é o rendimento que chama a atenção: é possível encontrarrentabilidades de 120%, como ficou célebre numa oferta relâmpago feita peloMercado Pago. Esse alto retorno é uma forma de as empresas aumentarem sua base de clientes. “A oferta é um chamariz para captar uma base de clientes maior. Algumas notícias como essa [da alta rentabilidade] se espalham rapidamente e é uma forma de atingir gente que eles não atingiriam tão facilmente”, diz Yoshinaga. A decisão sobre onde investir é sempre pessoal e depende do perfil e da fase de vida de cada pessoa. Ela reflete tanto os objetivos quanto o nível de risco que o investidor está disposto a assumir. ""E ninguém que investe qualquer valor nas caixinhas corre o risco de receber menos do que foi depositado, porque essa não é uma renda variável como ações, por exemplo”, explica Soaper. Mesmo quem tem um perfil mais agressivo pode utilizar esse tipo de aplicação como uma forma de preservar parte do patrimônio em uma reserva de emergência, aproveitando a liquidez e a facilidade de acesso aos recursos. Confiraquanto uma aplicação de R$ 1.000renderia em um CDI anual de 14,90%. Os valores consideram prazos superiores a três meses, são líquidos deImposto de Rendae não consideramIOF: 3 meses 6 meses 12 meses 24 meses Além doNubank, com caixinhas que rendem 100% e 115% do CDI(na caixinha turbo, caso movimente R$ 900 na conta corrente todo mês), oItaútambém possui cofrinhos, um CDB que rende 100% do CDI. NoInter, é o ""Meu Porquinho por Objetivos"", um CDB que também rende 100% do CDI. NoPicPay, existe o cofrinho que rende 102% do CDI, e o ""Cofrinho Turbinado"", com um retorno de 121% do CDI, desde que seja assinante do PicPay Mais ou aporte, ao menos, R$ 999 na conta todos os meses (e mantenha cadastrada uma chave PIX, CPF ou celular). NoBancodo Brasil, há o ""Cofrinho BB"", aplicado em um fundo que busca acompanhar ataxa Selic(com rentabilidade de 11,22% nos últimos 12 meses). Sistema de pagamento instantâneo pode incentivar transações comerciais no bloco e reduzir dependência do dólar Valor da operação chamou a atenção dos analistas e pode ajudar a reduzir a alavancagem da Simpar Entenda o impacto da Selic nos investimentos, as diferenças entre renda fixa e variável e como montar uma estratégia inteligente em tempos de juros altos Na véspera, a moeda americana fechou com alta superior a 1%, tocando nos R$ 5,50 01 02 03 exame no whatsapp Receba as notícias da Exame no seu WhatsApp Nas melhores oportunidades do mercado para investir. E-mail inválido Invest",Exame
https://exame.com/mundo/misseis-guiados-ogivas-e-13-milhao-de-soldados-veja-o-poderio-belico-dos-eua-contra-a-venezuela/,2025-08-20,"Mísseis guiados, ogivas e 1,3 milhão de soldados: veja o poderio bélico dos EUA contra a Venezuela","Donald Trump, presidente dos EUA, e Nicolás Maduro, presidente da Venezuela (Montagem/Exame) Repórter Publicado em20 de agosto de 2025 às17h07. Ogoverno dos Estados Unidosprovocou um clima de tensão nesta semana por sua movimentação militar na América Latina. A pedido do presidenteDonald Trump, cerca de 4 mil soldados e três embarcações de guerra com mísseis guiados foram enviadas à região, com o objetivo de reforçar o combate ao narcotráfico nas proximidades da Venezuela. A Casa Branca acusa o presidente venezuelano,Nicolás Maduro, de liderar um cartel internacional de tráfico de drogas — incluindo o fentanil, substância que se espalha rapidamente por várias cidades do país, com uma propagação semelhante a uma epidemia — com destino aos Estados Unidos. Embora um confronto direto entre as nações pareça improvável, Trump busca demonstrar seu empenho no combate ao crime organizado que se expande pelaAmérica Latina, e classificou diversos cartéis comoorganizações terroristas, o que lhe permitiria utilizar as forças armadas em sua operação. No entanto, Trump não parece querer promover uma mudança de regime na Venezuela, embora existam setores no país que apoiem essa ideia. Mas o cenário pode mudar, se Maduro tomar alguma decisão que o governo Trump veja como ameaça como, por exemplo, tentar anexar a região do Essequibo, que pertence à Guiana. Mas, se as tensões chegarem a um confronto real, a Venezuela estaria em grande desvantagem. OsEstados Unidosocupam a liderança mundial no quesito poder militar, enquanto a Venezuela está entre as forças de médio porte no continente americano, segundo informações do siteGlobal Firepower, que conta com um ranking que classifica as potências militares do mundo. A lista feita pela plataforma indica que a Venezuela conta com Power Index de 0,8882 — isso significa que se for mais próximo de zero, maior é o poderio militar. Enquanto os EUA têm índice de 0,0712 no ranking, consolidando sua liderança. O Exército norte-americano conta com 1,3 milhão de soldados ativos e aproximadamente 800 mil na reserva. No campo aéreo, as forças armadas dos EUA possuem mais de 13 mil aeronaves, sendo que 9.700 estão prontas para combate; em terra, há mais de 4.600 tanques e cerca de 390 mil veículos operacionais; no mar, a potência se expande com 440 ativos navais, incluindo 70 submarinos. Além disso, os EUA detêm um dos maiores arsenais nucleares do mundo, com 5.177 ogivas, ficando apenas atrás da Rússia, de acordo com a Federação de Cientistas Americanos (FAS). Por outro lado, a Venezuela tem aproximadamente 337 mil militares entre ativos e reservas, além das Milícias Bolivarianas, criadas pelo ex-presidente Hugo Chávez — que governo o país entre 1999 e 2013 — para militarizar a população e defendê-la contra uma possível invasão. Maduro já mobilizou cerca de 4,5 milhões de pessoas para essa tarefa, embora esse número seja considerado exagerado. As Forças Armadas da Venezuela possuem uma frota aérea de 229 aeronaves, sendo que apenas 126 estão em operação; no setor terrestre, há 172 tanques e cerca de 8.800 veículos; e a marinha conta com 34 embarcações. A maioria dos equipamentos militares venezuelanos é de origem russa e soviética, embora, nos últimos anos, o país tenha buscado suprimentos bélicos da China e do Irã. Apesar dos recursos limitados, Caracas faz investimentos significativos no setor militar. De acordo com estimativas da CIA, o governo venezuelano destinou 0,6% do PIB à defesa no ano passado. Após a Casa Branca aumentar para US$ 50 milhões a recompensa por pistas que conduzam à captura de Nicolás Maduro, a secretária de Justiça americana, Pam Bondi, revelou que US$ 700 milhões em bens relacionados ao presidente venezuelano foram confiscados. O governo Trump acusa Maduro de não só infringir as leis antidrogas dosEstados Unidose tomar o poder na Venezuela de forma antidemocrática, mas também de estar ligado aorganizações criminosas como o Tren de Aragua e o Cartel de Sinaloa. Ele é descrito como o líder do Cartel dos Sóis “há mais de dez anos”. Nesta terça-feira, 19 de agosto, Karoline Leavitt, porta-voz de Donald Trump, anunciou queo governo dos EUA irá usar “toda a sua força” contra o regime venezuelano. “Maduro não é um líder legítimo. Ele é um fugitivo e o chefe de um cartel narcoterrorista envolvido no tráfico de drogas”, declarou. No dia anterior, fontes consultadas pela agênciaReutersconfirmaram que três navios de guerra dos EUA com mísseis guiados estão a caminho da costa venezuelana. Os navios USS Gravely, USS Jason Dunham e USS Sampson, acompanhados por 4 mil marinheiros e fuzileiros navais, têm como missão combater cartéis de drogas considerados organizações terroristas, de acordo com a classificação do governo Trump. Além das embarcações, aviões espiões P-8, outros navios de guerra e pelo menos um submarino de ataque também integrarão a força na região, realizando operações tanto no ar quanto nas águas internacionais. Esses ativos podem ser utilizados em diversas operações, incluindo vigilância, coleta de inteligência e até ataques diretos ao solo, segundo uma fonte anônima ouvida pelaReuters. Em resposta, na segunda-feira, Maduro declarou que a Venezuela “defenderá seus mares, céus e terras” contra a “ameaça absurda e bizarra de um império em declínio”, em referência à movimentação militar dos EUA, sem citar o país diretamente. Segundo Marco Rubio, o tribunal tem sido usado como 'instrumento de guerra jurídica' contra os EUA e seu aliado Israel Declarações foram feitas às vésperas da chegada à capital russa do ministro das Relações Exteriores indiano, que planeja discutir a situação criada após a imposição de tarifas pelos EUA Primeiro-ministro suspendeu todos os trabalhos políticos em respeito ao caso; a causa da morte permanece um mistério Projeto E1 prevê 3.400 casas em território palestino e é criticado por isolar Jerusalém Oriental e dificultar a solução de dois Estados 01 02 03 exame no whatsapp Receba as notícias da Exame no seu WhatsApp Nos acontecimentos mais relevantes do Brasil e mundo. E-mail inválido Desperta",Exame
