url,data,titulo,texto,fonte
https://exame.com/brasil/rs-abre-escritorio-na-faria-lima-e-anuncia-investimento-de-r-1-bi-de-empresa-paulista-para-o-estado/,2025-06-23,RS abre escritório na Faria Lima e anuncia investimento de R$ 1 bi de empresa paulista no estado,"Repórter de Brasil e Economia Publicado em23 de junho de 2025 às19h31. Última atualização em23 de junho de 2025 às19h32. O futuro doRio Grande do Sulestá em um novo escritório naFaria Lima. Esse é o peso que o governo gaúcho deu à inauguração do escritório daInvest RS, agência de desenvolvimento do estado, nesta segunda-feira, 23, no coração financeiro da capital paulista.A ação reflete a busca do governo por aumentar a presença do estado em mercados estratégicos e atrair mais investimentos. “Queremos mostrar para todo o Brasil e para o mundo o trabalho que criamos um ótimo ambiente para os negócios. E esse escritório em São Paulo não é apenas a sede física, mas a extensão de toda inteligência de uma agência montada de uma forma técnica e com capacidade intelectual para aproximar o Rio Grande do Sul das melhores oportunidades”, afirmou o governador do estado,Eduardo Leite, em coletiva durante o evento. A inauguração do novo escritório contou com uma plateia de mais de 300 pessoas, sendo pelo menos 60 delas de representantes internacionais, como da Coreia do Sul e outros países do Sudeste Asiático. A agência gaúcha, criada no início do ano, já tem 32 projetos eR$ 5 bilhõesem investimentos projetados, com potencial de criar mais de 4.000 empregos.O novo escritório em São Paulo visa aumentar esses números e expandir a atratividade do estado para negócios de grande porte. “Estava no desenho da Invest RS desde o início estar em São Paulo e hoje nós estamos dando esse passo. A nossa expectativa é ampliar as oportunidades”, afirmou Rafael Prikladnicki, diretor da agência. Serão pelo menos três funcionários no escritório de São Paulo, com Eduardo Lorea, vice-presidente da Invest, na liderança. Entre os focos estão a atração de investimentos para a indústria demáquinas agrícolas,semicondutores, datacenters, biocombustíveis,hidrogênio verdeeturismo. “Vamos entregar o escritório ao empreendedor gaúcho. Promover o estado, conversar, fazer agendas com fundos de investimentos e com empresas, além de fazer eventos. Já temos três eventos programados para o segundo semestre”, disse Lorea. Além da inauguração do escritório, o governo anunciou o investimento de R$ 1 bilhão da empresa Tellescom Semicondutores, grupo com sede em São Paulo e que produz equipamentos eletrônicos, no estado gaúcho. O projeto prevê a construção de uma fábrica em Cachoeirinha para encapsulamento e testes de semicondutores, que serão usados na indústria automotiva, internet das coisas e comunicação sem fio. Estrutura, inaugurada recentemente em Bertioga, caiu de maneira cinematográfica devido a rajadas de vento acima de 50 km/h Jovem de 26 anos, está isolada desde a noite de sexta-feira em uma encosta do Monte Rinjani, um dos vulcões mais altos da Indonésia, após cair de penhasco durante trilha Frente fria traz chuvas e queda de temperatura em São Paulo Imprensa local afirma que publicitária teria sido deixada para trás após se queixar de cansaço; buscas são interrompidas pelo terceiro dia, segundo parentes, que apontam negligência 01 02 03 exame no whatsapp Receba as notícias da Exame no seu WhatsApp Nos acontecimentos mais relevantes do Brasil e mundo. E-mail inválido Desperta",Exame
https://exame.com/carreira/sxsw-e-o-potencial-do-brasil-como-soft-power-regenerativo/,2025-06-23,SXSW e o potencial do Brasil como soft power regenerativo,"Successful and happy business team Autor colaborador Publicado em23 de junho de 2025 às19h18. Mesmo com a quinta maior delegação no festival, o Brasil teve presença tímida nos palcos. Ainda assim, nas ideias da inglesa Jane Goodall — mesmo sem mencionar o país — e nas falas dos brasileiros Antônio Patriota e Almir Suruí, emergiu uma beautiful collision sobre o protagonismo possível do Brasil neste contexto de transição: liderar com base na escuta, na cultura e na regeneração a construção de uma nova reputação global. O tema do evento é um convite a cada um dos participantes a fazer sinapses e conexões improváveis. No meu meu caso, elas estão acontecendo dias depois. Ao relembrar as falas desses três líderes, dentre muitos que escutei nos seis dias evento, percebo que a sinapse entre ciência, diplomacia e ancestralidade revelaram caminhos possíveis para a construção de uma nova liderança global, com novos repertórios e comportamentos. Goodall não falou sobre o Brasil, mas tudo o que defende — regeneração ambiental, empatia entre gerações, colaboração internacional e ação com propósito — dialoga diretamente com potenciais do nosso país. Aos 91 anos, Jane é primatóloga, etóloga, mensageira da paz da ONU e revolucionou a ciência ao demonstrar que chimpanzés usam ferramentas, constroem laços sociais e expressam emoções complexas. Em meio a reações de entusiasmo e emoção por parte da plateia, sua fala noSXSWfoi mais do que uma palestra, foi um manifesto. Para ela, ainda há tempo. Mas só se formos capazes de agir com coragem, escuta e responsabilidade coletiva. Liderar, em sua visão, é servir ao futuro. Comunicar é transformar consciência em mobilização. Foi impossível não conectar esse chamado ético à fala de Antônio Patriota, embaixador do Brasil no Reino Unido e ex-ministro das Relações Exteriores. O que Goodall apresenta como urgência planetária, Patriota traduz como possibilidade estratégica. Para ele, o Brasil tem atributos únicos — uma diplomacia respeitada, uma cultura diversa e uma narrativa ambiental legítima — que podem posicionar o país como articulador de soluções em escala global. Do Brasil para o mundo, empresas, líderes e governos, de forma individual e coletiva, podem ser indutores de novos comportamentos. No painel da Bellwether, também noSXSW, o líder indígena Almir Narayamoga Suruí trouxe uma perspectiva ainda mais transformadora. Ele lembrou que reputação se constrói no tempo e no território. Seu trabalho é reconhecido globalmente por integrar saberes tradicionais com tecnologia de ponta. Em parceria com o Google Earth, criou sistemas de monitoramento da floresta conduzidos por seu povo, o Paiter Suruí. Almir fala de pertencimento, de regeneração e de inovação com raízes. E nos lembra que o Brasil já possui, dentro de si, os modelos que o mundo procura: governança indígena, saberes ancestrais, coletividade, ética do cuidado. O que falta não é repertório, mas espaço para que esses saberes moldem o presente. As falas de Jane Goodall, Antônio Patriota e Almir Suruí também nos permitem identificar competências essenciais para uma nova geração de lideranças comprometidas com a transformação global. De Goodall, aprendemos o valor da escuta ecológica e da empatia intergeracional como fundamentos para a construção de confiança e o engajamento genuíno com juventudes e territórios. Patriota nos oferece a habilidade da narrativa diplomática como instrumento de soft power regenerativo, essencial para um posicionamento global ancorado em valores, cultura e propósito. Almir Suruí, por sua vez, traz a governança relacional e a inteligência ancestral como referência para a sustentabilidade reputacional, demonstrando como saberes originários podem orientar decisões com visão de futuro. E, juntos, os três líderes reforçam a importância da responsabilidade individual e coletiva como competência transversal para gerar impacto local com projeção global, ativando redes e alianças em torno de causas comuns. Mas o que é, afinal, esse soft power regenerativo do qual o Brasil pode ser protagonista? É a capacidade de inspirar e influenciar por meio de práticas coerentes, valores compartilhados e compromisso com a vida. Somos um país que pode traduzir o ancestral em inovação e transformar escuta em ação pública. ACOP 30, que será realizada na Amazônia em 2025, será mais do que um encontro climático, mas uma oportunidade de mostrar ao mundo que o Brasil não é apenas guardião da biodiversidade, mas também formulador de soluções para o século XXI. Quando eu falo em oportunidade para o Brasil, penso especialmente nas empresas globais com operações no país. Muitas contam com estruturas robustas de comunicação para a América Latina e o Brasil, e seus executivos têm a faca e o queijo na mão para liderar as discussões e projetos sobre futuro e inovação. Todo mundo quer estar no hype, mas os desafios são bem maiores. Passa por compreender, de fato, o que o país tem de singular: uma cultura plural, uma diplomacia reconhecida, uma conexão profunda com temas ambientais e sociais, e uma reputação que pode ser ativada de forma legítima. E, nesse novo cenário, não haverá mais espaço para executivos que ainda manifestam preconceito em relação a povos indígenas, tampouco para aqueles que, mesmo dizendo-se livres de preconceitos, continuam enxergando essas pautas apenas como estética de tendência ou como oportunidade publicitária. Virar a página exige comprometimento autêntico, conhecimento e ação. Encerrar essa reflexão exige reconhecer que a ativação do soft power regenerativo brasileiro não acontecerá por gravidade institucional, mas por competência estratégica. E é justamente nesse ponto que os especialistas em reputação se tornam agentes-chave dessa travessia. Em contextos marcados por sobreposição de crises e reconfiguração de expectativas sociais, o papel da reputação se expande para além da gestão de imagem: ela passa a ser infraestrutura simbólica para a ação empresarial e política. Somos responsáveis por articular narrativas consistentes com as transformações em curso, antecipar tensões reputacionais, alinhar discurso e prática organizacional e qualificar a escuta ativa de stakeholders diversos. Mais do que responder ao presente, a atuação em gestão de reputação deve estruturar futuros desejáveis, conectando as capacidades institucionais de influência a demandas emergentes da sociedade. Trata-se, portanto, de operar no campo da legitimidade — e não apenas da visibilidade. E nessa jornada, a reputação é tanto bússola quanto âncora.",Exame
https://exame.com/mundo/trump-anuncia-cessar-fogo-de-12h-entre-israel-e-ira/,2025-06-23,Trump anuncia cessar-fogo entre Israel e Irã,"Repórter Publicado em23 de junho de 2025 às19h18. Última atualização em23 de junho de 2025 às20h04. O presidente dosEstados Unidos,Donald Trump, anunciou umcessar-fogo entre Israel e Irãnesta segunda-feira, 23. O anúncio ocorre horas após o Irã lançar mísseis contra as bases americanas no Catar. Em uma publicação na rede socialTruth Social, o republicano parabenizou todos os envolvidos nas negociações e afirmou que o cessar-fogo deve durar 12 horas. De acordo com o presidente americano, a paralisação dos ataques tem início previsto para daqui a cerca de 6 horas a partir de agora (por volta de 1h da manhã, horário de Brasília). Ele explicou que ocessar-fogoserá oficialmente iniciado pelo Irã, seguido por Israel após 12 horas. O conflito será considerado finalizado após 24 horas de interrupção das hostilidades. ""PARABÉNS A TODOS! Foi plenamente acordado entre Israel e Irã que haverá um CESSAR-FOGO completo e total (em aproximadamente 6 horas a partir de agora, quando Israel e Irã tiverem se acalmado e concluído suas missões finais em andamento!), por 12 horas, momento em que a guerra será considerada ENCERRADA! Oficialmente, o Irã iniciará o CESSAR-FOGO e, na 12ª hora, Israel iniciará o CESSAR-FOGO e, na 24ª hora, o FIM Oficial da GUERRA DE 12 DIAS será saudado pelo mundo. Durante cada CESSAR-FOGO, o outro lado permanecerá PACÍFICO e RESPEITOSO. Partindo do princípio de que tudo funcionará como deveria, o que funcionará, gostaria de parabenizar ambos os países, Israel e Irã, por terem a Resistência, a Coragem e a Inteligência para encerrar o que deveria ser chamado de ""A GUERRA DE 12 DIAS"". Esta é uma guerra que poderia ter durado anos e destruído todo o Oriente Médio, mas não destruiu e nunca destruirá! Deus abençoe Israel, Deus abençoe o Irã, Deus abençoe o Oriente Médio, Deus abençoe os Estados Unidos da América e DEUS ABENÇOE O MUNDO!"". Por enquanto, não houve comentários imediatos do governo do Irã ou de Israel sobre o anúncio deTrump. O anúncio do cessar-fogo ocorre um dia após as declarações deTrump, que afirmou que o Irã deveria passar por uma mudança de regime, e dois dias após obombardeio americano ao país. Anteriormente, Trump disse que encorajaria Israel a prosseguir em direção à paz após rejeitar o ataque do Irã a uma base aérea americana que não causou feridos e agradecer a Teerã pelo aviso prévio. Em entrevista à Fox News, o vice-presidente dosEUA, JD. Vance, afirmou que, caso o Irã tente desenvolver uma arma nuclear no futuro, precisará enfrentar novamente o exército americano. Vance destacou que Teerã é ""incapaz"" de fabricar uma arma nuclear com os recursos disponíveis, uma vez que, segundo ele, o equipamento necessário foi destruído pelosEstados Unidosdurante os ataques realizados neste sábado, 21. Nesta segunda-feira, 23, o Irã realizou um ataque com mísseis contra uma base aérea norte-americana no Catar, mas não houve vítimas. Após o bombardeio, o presidente dos Estados Unidos, Donald Trump, minimizou a ação, classificando-a como uma ""resposta fraca"" aos ataques dos EUA. Trump também fez um apelo para que o Irã e Israel busquem a paz, enquanto o conflito se aproxima de seu 12º dia. Teerã alertou os Estados Unidos horas antes do ataque, utilizando canais diplomáticos, e também notificou as autoridades do Catar, com o intuito de ""minimizar baixas"". *Em atualização. Declaração do presidente ocorreu após o Irã lançar mísseis contra base dos EUA em Doha, no Catar Declaração foi feita pelo presidente francês durante uma visita a Oslo, na Noruega No início da reunião com o chefe da diplomacia iraniana, presidente russo chamou os ataques de Israel e dos EUA de ""agressão injustificada Neste domingo, o Tel Aviv recuperou os corpos de três reféns israelenses mortos durante o ataque do Hamas contra território israelense em 7 de outubro de 2023 01 02 03 exame no whatsapp Receba as notícias da Exame no seu WhatsApp Nos acontecimentos mais relevantes do Brasil e mundo. E-mail inválido Desperta",Exame
https://exame.com/carreira/decisoes-sob-pressao-chefes-estao-usando-esta-tecnica-de-30-minutos-para-fazer-escolhas-melhores/,2025-06-23,Decisões sob pressão? Chefes estão usando esta técnica de 30 minutos para fazer escolhas melhores,"(foto/Thinkstock) Content Writer Publicado em23 de junho de 2025 às19h14. Tomar grandes decisões com mais rapidez e segurança é um dos maiores desafios enfrentados por quem ocupaposições de liderança. Em contextos de alta pressão e com equipes aguardando direcionamentos, a indecisão pode custar caro: oportunidades perdidas, retrabalho, estagnação. A coach de decisão Nell Wulfhart, em entrevista recente à NPR, compartilhou umexercício de 30 minutos que tem ajudado líderes e empreendedores a tomar decisões de forma mais rápidae alinhada com seus objetivos pessoais e profissionais. EXAME e Saint Paul liberam aulas virtuais que ensinam como ser um líder de alta performance; clique aqui e garanta sua vaga por apenas R$ 37 O método é simples, mas poderoso: escrever uma lista de valores pessoais. Não se trata de valores morais ou corporativos, mas daquilo que torna a vida do indivíduo melhor no dia a dia. Wulfhart cita como exemplos os seus próprios valores: Este treinamento ensina as habilidades essenciais para ser um líder de sucesso que vai garantir prosperidade nos negócios do futuro por apenas R$ 37. A orientação é listar e ranquear essas prioridades em ordem de importância. Isso deve ser feito de forma instintiva, em no máximo 30 minutos, para evitar o excesso de análise. Com essa lista em mãos, o processo decisório ganha clareza. Quando surgir uma escolha importante, o líder pode simplesmenteverificar qual das opções está mais alinhada com seus valores. Esse alinhamento pessoal, segundo Wulfhart, acelera a tomada de decisão e reduz o risco de arrependimento futuro. Afinal, a decisão foi baseada naquilo que realmente importa para a pessoa. Em contextos deliderança, essa abordagem traz benefícios diretos à gestão. Líderes que sabem o que valorizam conseguem comunicar suas escolhas de forma mais clara e confiante, o que inspira confiança nas equipes. Além disso, evitam o paralisante ciclo da indecisão crônica, que tanto atrapalha o dinamismo das organizações. Em um ambiente empresarial em constante transformação, a capacidade de tomar decisões rápidas e bem fundamentadas é um diferencial competitivo. Líderes que investem tempo para entender seus valores pessoais ganham uma ferramenta poderosa para orientar suas escolhas de forma mais assertiva. Mais do que um exercício de autoconhecimento, essa prática se revela um recurso estratégico de gestão. Com cases reais do mercado, EXAME e Saint Paul liberam aulas virtuais sobre liderança e gestão; clique aqui e garanta uma vaga por apenas R$ 37. De olho nisso, a EXAME se une à Saint Paul para apresentar oPré-MBA em Liderança e Gestão, um treinamento virtual e com certificado que revela o caminho para ser um líder mais completo – com habilidades técnicas, interpessoais e estratégicas. Durante o treinamento, os alunos irão descobrir qual o perfil de líder mais procurado pelas empresas, o que todo líder de alta performance precisa dominar e o caminho para alavancar a carreira para cargos de alta liderança a nível internacional. Todo esse conteúdo, que soma três horas de duração, está distribuído emquatro aulas 100% online(sendo a última delas ao vivo), que misturam fundamentos teóricos e práticos. O investimento é de R$ 37,00. E não há barreiras para acompanhar. A iniciativa é virtual – isto significa que é possível acompanhar o treinamento de qualquer local do mundo. Além disso, o pré-MBA dá direito acertificado de participação, assinado pela EXAME e Saint Paul, para incluir no currículo. Os interessados devem se inscreverclicando aqui. EU QUERO ACOMPANHAR TREINAMENTO DA EXAME E SAINT PAUL SOBRE LIDERANÇA E GESTÃO Evitar conversas superficiais, pedir conselhos em vez de feedback, saber lidar com críticas e admitir erros são atitudes que revelam altos níveis de inteligência emocional Estratégia ajuda profissionais a superarem a procrastinação e manterem uma rotina produtiva mesmo nos dias mais desafiadores. O método tem ganhado espaço entre líderes que precisam conciliar alta performance com bem-estar mental Em reuniões com altos executivos, o domínio de finanças corporativas deixa de ser diferencial para se tornar pré-requisito Dominar números e finanças corporativas se tornou a habilidade estratégica para quem busca crescer em qualquer empresa 01 02 03 exame no whatsapp Receba as notícias da Exame no seu WhatsApp Nas principais tendências de carreira e do mercado. E-mail inválido Carreira 3.0",Exame
https://exame.com/invest/mercados/tres-acoes-defensivas-ganham-forca-entre-os-analistas-mais-respeitados-de-wall-street/,2025-06-23,Três ações defensivas ganham força entre os analistas mais respeitados de Wall Street,"Redatora Publicado em23 de junho de 2025 às19h14. Em um cenário dejuros altos,inflaçãopersistente e aumento das tensões noOriente Médio, investidores seguem cautelosos, e a volatilidade continua ditando o ritmo dosmercados. Para analistas deWall Street,o momento exige foco no longo prazo e em empresas com fundamentos sólidos, capazes de atravessar períodos de incerteza. Um levantamento da plataformaTipRanks, que classifica analistas com base no histórico de acerto e retorno de suas recomendações, destaca três ações com potencial de crescimento sustentável:Chewy, Pinterest e Uber. As três empresas estão na mira de grandes bancos e investidores institucionais por combinarem inovação, expansão de mercado e geração de valor recorrente. A primeira da lista é aChewy, varejista digital de produtos para pets. A empresa divulgou resultados acima do esperado no primeiro trimestre do ano fiscal de 2025, com crescimento na receita e no número de clientes ativos. Apesar disso, parte do mercado reagiu com cautela devido à redução nofluxo de caixa livre.Para oJPMorgan, esse movimento foi exagerado. O banco elevou o preço-alvo das ações de US$ 36 para US$ 47, mantendo recomendação de compra. A análise destaca que aChewydeve continuar ganhando participação no mercado, inclusive frente a gigantes comoAmazon e Walmart, apoiada em estratégias como o serviço de compras recorrentes AutoShip e aumento da rentabilidade com publicidade. A segunda aposta é aPinterest, plataforma demídia socialque tem fortalecido seu modelo de negócios com foco em publicidade. Recentemente, a empresa anunciou uma parceria com aInstacart, permitindo que os anúncios exibidos na rede social se tornem diretamente compráveis. Na visão doBank of America, esse movimento melhora a mensuração dos resultados das campanhas e atrai mais anunciantes. O banco manteve recomendação de compra para asações, com preço-alvo de US$ 41. A expectativa é que a parceria gere mais investimentos empublicidade, principalmente de marcas de bens de consumo, um dos segmentos mais relevantes para o Pinterest. Fechando a lista está aUber, que segue se consolidando como um ""super app"" global, combinandotransporte,deliverye serviços diversos. O banco de investimentoStifeliniciou cobertura dasaçõescom recomendação de compra e preço-alvo de US$ 110. A análise ressalta que, apesar do avanço dos veículos autônomos, o impacto dessa tecnologia sobre o modelo de negócios daUberé limitado no curto e médio prazo, dado o custo elevado, os desafios regulatórios e os riscos operacionais. Além disso, o banco acredita que o crescimento das reservas da empresa deve se manter robusto, com avanço de 16% ao ano em 2025 e 2026, puxado pela expansão para regiões fora dos grandes centros urbanos, crescimento internacional e aumento da base de usuários no serviço de assinaturaUber One. Os analistas destacam ainda que aUbertem potencial para acelerar os resultados na unidade dedelivery, que contribui tanto para a diversificação da receita quanto para a retenção de clientes. A companhia também começa a explorar o segmento depublicidade digital,aproveitando sua base de dados e geolocalização como diferencial competitivo. Rede de cafeterias fez negociações com diversas empresas, incluindo o private equity Hillhouse Capital Group, FountainVest Partners e Trustar Capital Braço de participação do banco de desenvolvimento, BNDESPar vai investir em empresas com projetos e iniciativas voltadas à transição ecológica, descarbonização e inovação Comparativo entre poupança, Tesouro Selic e CDB mostra que melhor opção rende mais que o dobro da caderneta Comparativo mostra que alguns investimentos rendem o dobro da poupança para quem busca fazer o dinheiro trabalhar 01 02 03 exame no whatsapp Receba as notícias da Exame no seu WhatsApp Nas melhores oportunidades do mercado para investir. E-mail inválido Invest",Exame
