url,data,titulo,texto,fonte
https://exame.com/mundo/trump-diz-que-israel-aceitou-cessar-fogo-de-60-dias-em-gaza/,2025-07-01,Trump diz que Israel aceitou cessar-fogo de 60 dias em Gaza,"Confronto se arrasta desde outubro de 2023 e vem pressionando a comunidade internacional por uma solução diplomática (AFP) Repórter Publicado em1 de julho de 2025 às20h05. Última atualização em1 de julho de 2025 às20h06. O presidente dos Estados Unidos,Donald Trump, afirmou nesta terça-feira, 1º, queIsraelaceitou os termos de uma proposta de cessar-fogo de 60 dias naFaixa de Gaza. A declaração foi feita por meio de sua rede social, Truth Social. Segundo Trump, a decisão foi tomada após uma “longa e produtiva reunião” entre representantes do governo americano e autoridades israelenses. O encontro teria resultado em um consenso sobre os termos para uma pausa temporária no conflito, que já dura desde outubro de 2023 e tem gerado pressão internacional por uma solução diplomática. Ainda de acordo com Trump, caberá agora ao Catar e ao Egito, dois dos principais mediadores regionais, formalizar a proposta junto ao grupo palestino Hamas.“Espero, para o bem do Oriente Médio, que o Hamas aceite este acordo, porque a situação não vai melhorar — só vai piorar”, escreveu o presidente. Até o momento, o Hamas não se pronunciou oficialmente sobre a proposta. A reportagem está em atualização Medidas de imigração visam afetar diretamente setores chave, com alta dependência de trabalhadores indocumentados Ex-presidente da Argentina foi condenada por corrupção e cumpre pena em sua casa em Buenos Aires Timur Ivanov da Defesa da Rússia, Ivanov é acusado de desviar bilhões e é alvo de uma investigação em curso no governo russo Governo Trump e da Flórida investiram US$ 450 milhões e construíram em tempo recorde estrutura que abrigará até 5 mil migrantes detidos 01 02 03 exame no whatsapp Receba as notícias da Exame no seu WhatsApp Nos acontecimentos mais relevantes do Brasil e mundo. E-mail inválido Desperta",Exame
https://exame.com/marketing/como-a-ia-generativa-esta-transformando-a-criatividade-em-tempo-real-nas-agencias-de-comunicacao/,2025-07-01,Como a IA generativa está transformando a criatividade em tempo real nas agências de comunicação,"Interface do Veo 3: nova ferramenta do Google que usa inteligência artificial para gerar vídeos a partir de texto, som e imagem em poucos segundos (TikTok/Reprodução) Redação Exame Publicado em1 de julho de 2025 às20h00. *Por Leopoldo Jereissati O anúncio doVeo 3, novogerador de vídeo por inteligência artificial (IA) doGoogle, marca um ponto de inflexão na produção audiovisual. A capacidade de gerar vídeos de até 8 segundos, com som e imagem, a partir de uma simples descrição em texto, já está disponível para usuários dos planos Google AI Pro e Ultra. Pode parecer apenas uma evolução técnica, mas é muito mais que isso:é o início de uma nova etapa na criação em escala. A projeção de que o mercado global de geradores de vídeo por IA saltará de US$ 534 milhões em 2024 para mais deUS$ 2,5 bilhõesaté 2032 mostra a dimensão dessa transformação. Mas a pergunta que mais interessa às agências é: o que muda na prática? Na All Set, onde operamos com squads in-house para marcas como Nestlé, Mercado Livre e AB InBev, já sentimos os primeiros impactos. A IA generativa, antes conceito, hoje é parte concreta da rotina criativa e de performance, onde velocidade, personalização e eficiência são exigidas, sem abrir mão de estratégia. Prototipação rápida de ideias visuais, testes de linguagem e tom, moodboards dinâmicos, roteiros estruturados e agora simulações audiovisuais em tempo real: tudo isso se tornou acessível. O Veo 3 traz uma nova camada — a do tempo real. Em vez de explicar uma ideia, podemos mostrá-la em segundos. Isso transforma a relação com o cliente, acelera a aprovação e reorganiza o próprio processo criativo. Mas essa evolução exige uma nova postura das agências. Na All Set, entendemos que a IA não é um atalho, mas uma alavanca. Ela amplifica o trabalho humano, mas requer direção, curadoria e responsabilidade. O uso de vídeos sintéticos em campanhas traz novos dilemas: como garantir transparência com o consumidor? Como diferenciar o conteúdo “real” do “gerado”? Como evitar vieses e estereótipos reproduzidos por algoritmos? Essas não são barreiras, são oportunidades. Estamos diante de uma democratização da criação. Nesta semana, em um evento para corretores em Rio Verde (GO), vi duas empresas locais já utilizando roteiros e filmes 3D impulsionados por IA para campanhas em redes sociais. O impacto é imediato — em percepção, performance e escala. É exatamente aí que vejo valor no papel de empresas como a nossa:traduzir avanços técnicos em soluções criativas, éticas e orientadas a resultados. Nosso desafio é tornar a operação do cliente mais eficiente e rever como monetizamos nosso trabalho, pois os modelos vigentes estão sob pressão e precisam evoluir. Estamos apenas no começo dessa revolução. O Veo 3 sinaliza que o vídeo, um dos formatos mais caros e complexos de produzir, está se tornando democrático, programável e escalável. Isso abre espaço para mais liberdade criativa, mais testes e mais inteligência adaptativa. Mas exige, mais do que nunca,visão críticaeliderança prática. A IA vai substituir o profissional mediano e afetar quem não souber trabalhar com ela. As cartas abertas de CEOs globais já indicaram o caminho. Sobreviverá quem se adaptar mais rápido, e dominar o uso da tecnologia com propósito. *Por Leopoldo Jereissati, CEO e fundador da All Set Comunicação Modelo de geração de vídeo a partir da inteligência artificial generativa do Google começa a ser utilizado em campanhas no Brasil Amy Daroukakis defende que vínculos afetivos entre amigas moldam novos produtos, serviços e culturas de cuidado Quarto episódio da série de podcasts ""Smarties: Criatividade Efetiva e Impacto de Negócios"" destaca o case “Errata aos 88” No CMO Summit, cofundador da Braze explica como personalizar em escala — sem invadir ou irritar o consumidor; IA, ética e uso responsável de dados são pilares, diz Jonathan Hyman 01 02 03 exame no whatsapp Receba as notícias da Exame no seu WhatsApp Receba a melhor curadoria para seus momentos casuais. E-mail inválido Casual",Exame
https://exame.com/mundo/trump-decidira-em-breve-sobre-nao-deportar-imigrantes-da-agricultura-e-da-construcao-civil/,2025-07-01,Trump decidirá em breve sobre não deportar imigrantes da agricultura e da construção civil,"Protestos marcam a visita de Trump ao ""Alligator Alcatraz"", novo centro de detenção na Flórida (AFP) Agência de Notícias Publicado em1 de julho de 2025 às19h48. O presidente dos Estados Unidos,Donald Trump, disse nesta terça-feira, na Flórida, que tomará uma decisão nas próximas semanas sobre as isenções às deportações de trabalhadores daconstrução civile daagricultura. Trump fez essa declaração à imprensa durante uma visita ao novo centro de detenção para migrantes ""Alligator Alcatraz"", localizado no meio de um pântano no estado da Flórida, informou a Casa Branca. A política migratória de Trump, que visa deportar 3.000 imigrantes por dia, é especialmente crítica para os setores de construção e agricultura, que contratam muitos cidadãos estrangeiros, muitos deles latino-americanos. As batidas policiais da agência de Imigração e Alfândega (ICE) tiveram como alvo muitos desses trabalhadores, provocando medo entre os próprios trabalhadores e ameaçando desacelerar dois setores que são essenciais para a economia dos EUA. No caso da construção, 25,7% dos trabalhadores são imigrantes e 14,1% do total são indocumentados em nível nacional, de acordo com oAmerican Immigration Council. Na agricultura, o número de funcionários sem documentos é de 42%, de acordo com dados do Departamento de Agricultura citados pelo jornalThe New York Times. Trump compareceu nesta terça-feira à inauguração do polêmico ""Alligator Alcatraz"", acompanhado da secretária de Segurança Nacional,Kristi Noem, e do governador da Flórida, o republicanoRon DeSantis, em meio a protestos de ambientalistas e grupos civis, muito próximos a esse novo centro de detenção de imigrantes. Ex-presidente da Argentina foi condenada por corrupção e cumpre pena em sua casa em Buenos Aires Timur Ivanov da Defesa da Rússia, Ivanov é acusado de desviar bilhões e é alvo de uma investigação em curso no governo russo Governo Trump e da Flórida investiram US$ 450 milhões e construíram em tempo recorde estrutura que abrigará até 5 mil migrantes detidos A deflação industrial prolongada corrói as margens de lucro e desestimula os investimentos, o que preocupa as autoridades 01 02 03 exame no whatsapp Receba as notícias da Exame no seu WhatsApp Nos acontecimentos mais relevantes do Brasil e mundo. E-mail inválido Desperta",Exame
https://exame.com/invest/mercados/boom-de-maximas-historicas-20-acoes-do-ibovespa-que-bateram-batem-recordes-em-junho-de-2025/,2025-07-01,Boom de máximas históricas: 20 ações do Ibovespa que bateram recordes em junho de 2025,"Repórter Publicado em1 de julho de 2025 às19h14. Última atualização em1 de julho de 2025 às19h34. Junho de 2025 entrou para a história como ummês de bonança para uma parcela seleta da bolsa brasileira. Nada menos que 20 ações dos índicesIbovespa, Small Caps (SMLL)eIDIVatingiram máximas históricas — sendo que 13 delas fecharam o mês exatamente no pico. Os dados são da Elos Ayta Consultoria. O fenômeno não se deu por acaso. Mesmo com oscilações no cenário macroeconômico, determinados setores e empresas conseguiram capturar a atenção do mercado, alavancando suas ações a níveis recordes. Entre os destaques estão empresas comoC&A Modas(CEAB3), que saltou 155,87% no acumulado do primeiro semestre, eMoura Dubeux(MDNE3), com alta de 120,44%. Ambas chegaram aos seusmaiores preços históricos no mês de junho, refletindo o apetite por ativos ligados ao consumo e ao setor imobiliário. Ao todo, das 20 ações listadas: Direcional(DIRR3) eSantos Brasil(STBP3) são componentes simultâneos dos três índices — um feito raro. Um olhar por setor revela um padrão interessante. Cinco ações são de incorporações, que seguem em ritmo acelerado de valorização, especialmente entre as small caps. A queda dos juros reais, aliada à perspectiva de novo ciclo de crédito imobiliário, parece ter destravado valor em papéis. Alguns exemplos: Entre os nomes ligados à distribuição de proventos,Tim(TIMS3) eEngie Brasil(EGIE3) se destacaram: O setor de seguros e finanças também registroubons desempenhos, com destaques paraPorto Seguro(PSSA3) eBTG Pactual(BPAC11) — do mesmo grupo controlador da EXAME —, que teve com valorização de 56,20%, segundo a Elos Ayta. Além dos dois papéis que subiram acima dos 100%, sete ações apresentaram rentabilidade entre 50% e 100% no primeiro semestre de 2025: Outras 11 ações ficaram abaixo de 50%, mas mesmo assim atingiram seus picos — o que indica que para boa parte desses papéis o mercado ainda está em processo inicial de valorização. 74 empresas que fazem parte do segmento de maior governança do mercado de ações brasileiro rejeitaram todas as mudanças propostas pela bolsa O valor equivale a R$ 0,1706 por ação ordinária e será pago em uma única parcela no dia 2 de julho de 2025 Descubra as regras para utilizar os recursos do maior programa de financiamento agrícola do país e evite irregularidades que podem gerar problemas AGE para decidir combinação dos negócios está marcada para o próximo dia 18 de julho 01 02 03 exame no whatsapp Receba as notícias da Exame no seu WhatsApp Nos acontecimentos mais relevantes do Brasil e mundo. E-mail inválido Desperta",Exame
https://exame.com/marketing/100-feita-por-ia-nova-campanha-da-latam-usa-veo-3-do-google-assista/,2025-07-01,"100% feita por IA, nova campanha da Latam usa Veo 3 do Google; assista","Campanha da Latam foi produzida com o Veo 3, modelo avançado de inteligência artificial do Google para criação de vídeos em alta definição e com áudio sincronizado (Reprodução/YouTube) Editora-assistente de Marketing e Projetos Especiais Publicado em1 de julho de 2025 às18h42. Última atualização em1 de julho de 2025 às19h17. ALatame oGooglelançaram uma campanha publicitária inteiramente criada porinteligência artificial (IA)para promover os destinos de neve no Chile. Todos os vídeos foram desenvolvidos com oVeo 3, ferramenta de geração de vídeo por IA generativa apresentada pelo Google em maio deste ano, durante o evento I/O 2025. A Latam é a primeira cliente do gigante de tecnologia no Brasil a utilizar o Veo 3 em uma campanha. Os filmes fazem parte de uma ação digital voltada para o período de férias de inverno e foram produzidos diretamente a partir de prompts de texto. A ação foi desenvolvida pelo time de performance da Latam em parceria com o Google. O objetivo foi aproveitar o aumento na demanda por viagens ao Chile e acelerar a criação de peças publicitárias com agilidade e escala. O Veo 3 opera dentro da plataformaVertex AIdoGoogle Cloud, atualmente em fase dePrivate Preview. O modelo promete tornar a produção audiovisual mais eficiente ao permitir a criação de vídeos em alta definição a partir de simples descrições escritas. Entre os recursos do sistema estão sincronia labial com áudio gerado por IA, efeitos sonoros, trilhas, transições de cena e simulações realistas de movimento, luz e sombra. De 'cangurus de apoio emocional'a produtos como oMarisa Maiô, usuários têm explorado o Google Veo 3 para transformar ideias inusitadas em vídeos com som e resolução 4K. De acordo com estudos realizados pelo próprio Google, empresas que adotam a IA para otimizar a agenda criativa podem alcançar até 75% de economia de tempo. A promessa de ganho de produtividade está no centro da proposta da ferramenta, que faz parte da estratégia da companhia para ampliar o uso de modelos generativos em escala comercial. Os quatro vídeos criados pela Latam com o Veo 3 mostram diferentes perfis de viajantes incentivando o público a comprar passagens no site da companhia. A campanha vem sendo veiculada nas plataformas do Google e no YouTube por meio doGoogle Ads. O vídeo abaixo, lançado há 13 dias, já acumula mais de 2 milhões de visualizações. Com qualidade cinematográfica e capacidade de entender instruções complexas, o Veo 3 representa um avanço em relação a modelos anteriores, segundo o Google. A ferramenta foi lançada globalmente em maio e deve ser disponibilizada em etapas para clientes do Google Cloud no Brasil. A nova campanha da Latam ocorre em um momento de intensas discussões na indústria publicitária sobre ouso ético e transparente da inteligência artificial. NoCannes Lions 2025, o maior festival de criatividade do setor, surgiram controvérsias envolvendo o uso de IA em campanhas premiadas. Um dos casos mais emblemáticos foi o da agência DM9, queteve seu Grand Prix retiradodepois de admitir o uso de conteúdo manipulado por IA em um vídeo de estudo de caso. A situação gerou investigações e discussõessobre a integridade criativa na era digital, conforme mostrou reportagem da EXAME. Amy Daroukakis defende que vínculos afetivos entre amigas moldam novos produtos, serviços e culturas de cuidado Quarto episódio da série de podcasts ""Smarties: Criatividade Efetiva e Impacto de Negócios"" destaca o case “Errata aos 88” No CMO Summit, cofundador da Braze explica como personalizar em escala — sem invadir ou irritar o consumidor; IA, ética e uso responsável de dados são pilares, diz Jonathan Hyman Terceiro episódio da série 'Smarties: Criatividade Efetiva e Impacto de Negócios' detalha trabalho que envolveu diversas empresas 01 02 03 exame no whatsapp Receba as notícias da Exame no seu WhatsApp Receba a melhor curadoria para seus momentos casuais. E-mail inválido Casual",Exame
https://exame.com/carreira/aos-12-anos-menino-criou-negocio-que-com-apoio-do-pai-passou-a-render-us-50-mil-por-mes/,2025-07-01,"Aos 12 anos, menino criou negócio que, com apoio do pai, passou a render US$ 50 mil por mês","(Reprodução/Bull Island Breaks) Redator Publicado em1 de julho de 2025 às18h30. O que começou como brincadeira para Madden Forrest, de 12 anos, e seu pai, Steven, de 35, se tornou um negócio que rende quase US$ 50.000 por mês. Foi comprando pacotes de cartas Pokémon para vender as mais raras que Madden percebeu que podia seguir promovendo seu hobbie no TikTok. Percebendo uma oportunidade, Madden perguntou ao pai se poderiam fazer lives vendendo as cartas diretamente aos compradores. Contudo, como menores de idade não podem fazer esse tipo de conteúdo na plataforma, Steven assumiu os vídeos. Eles investiram cerca de US$ 1.000 nessas 10 caixas e venderam tudo em uma tarde. Logo depois, repetiram o sucesso com um pacote de US$ 500 comprado no Sam’s Club. As informações foram retiradas da revistaEntrepreneur. Logo as cartas Pokémon se transformaram em cards colecionáveis da Liga de Futebol Americano dos Estados Unidos, a NFL. Criando engajamento e fidelização desse nicho, Madden e Steven continuaram. Abriram pacotes simples e também caixas ""hobby"", que podem custar milhares de dólares. “A maioria das pessoas não pode pagar por uma caixa inteira”, diz Steven. “Então fazemos os breaks: cada pessoa compra um time da NFL e, se sair uma carta do time, ela fica com ela. Se não, damos cartas extras de graça. ” A introdução do sistema de “breaks” ilustra uma diversificação criativa no modelo de receita — uma estratégia que permite acesso fracionado a produtos de alto valor e amplia o público consumidor. De outubro a dezembro, ainda estavam ""meio comprometidos"", aproveitando a alta demanda das festas. Mas tudo mudou na véspera de Ano Novo: venderam mais de US$ 4.000 em um único dia. Desde então, passaram a fazer lives diariamente às 19h. Todo o faturamento do empreendimento é destinado a uma poupança para o adolescente, que atua principalmente nos bastidores da operação. Com o avanço do negócio, no entanto, seu pai diz que a renda pode até ser suficiente para custear a faculdade. Prestes a completar 13 anos, Madden também cultiva o sonho de ter sua própria loja decardsno futuro. Para aqueles que desejam gerir melhor as finanças corporativas, a EXAME, maior plataforma de negócios do Brasil, se une à Saint Paul, uma das melhores escolas de negócios do mundo, para apresentar oPré-MBA em Finanças Corporativas, um treinamento virtual e com certificado que revela os conceitos financeiros mais importantes para ser um líder de alta performance. Durante o treinamento, os participantes terão acesso a casos reais de empresas e profissionais que estão obtendo sucesso com boas práticas de finanças. Além disso, vão poder conhecer os caminhos de atuação de um especialista em Finanças Corporativas. Todo esse conteúdo, que soma três horas de duração, está distribuído em quatro aulas 100% online (sendo a última delas ao vivo), que misturam fundamentos teóricos e práticos. O investimento é de R$ 37,00. EU QUERO ACOMPANHAR TREINAMENTO DA EXAME E SAINT PAUL SOBRE FINANÇAS CORPORATIVAS Com apenas US$ 100 e um aspirador, Amber Starling criou um negócio de limpeza que fatura meio milhão por ano Escolher uma carreira exige autoconhecimento, análise do mercado e decisões estratégicas para crescer com propósito Cinco aprendizados que moldam carreiras, aceleram decisões e não estão nos livros ou cursos tradicionais Comunicar o impacto que suas habilidades podem gerar é essencial para quem está começando a carreira 01 02 03 exame no whatsapp Receba as notícias da Exame no seu WhatsApp Nas principais tendências de carreira e do mercado. E-mail inválido Carreira 3.0",Exame
https://exame.com/esferabrasil/entenda-o-que-muda-com-a-atualizacao-com-a-tabela-do-imposto-de-renda/,2025-07-01,Entenda o que muda com a atualização da tabela do imposto de renda,"Atualização na tabela de IR não tem relação imediata com a proposta de isenção para quem ganha até R$ 5 mil, considerada como uma das prioridades de Lula (Marcello Casal Jr/Agência Brasil) Plataforma de conteúdo Publicado em1 de julho de 2025 às18h30. Última atualização em1 de julho de 2025 às19h00. Com a aprovação do projeto de lei que altera a tabela mensal do Imposto de Renda pela Câmara dos Deputados, o texto agora depende de análise dos senadores para que seja garantida a isenção para quem recebe até dois salários mínimos, quantia que equivale atualmente a R$ 3.036. A matéria eleva o limite de aplicação da alíquota zero, que chega a R$ 2.428,80. Essa atualização da tabela do IR, que passa a valer a partir de maio, ocorre em decorrência do reajuste do salário mínimo no início do ano. Uma vez que a legislação permite o desconto simplificado mensal, correspondente a 25% do valor máximo da faixa com alíquota zero da tabela progressiva mensal, esse desconto passa a corresponder a R$ 607,20, o que assegura na prática que os rendimentos até dois salários mínimos (R$ 3.036) não sejam tributados mensalmente. Segundo o governo, o reajuste para essa faixa implicará renúncia fiscal de R$ 3,29 bilhões neste ano. As estimativas de redução de receita chegam a R$ 5,34 bilhões em 2026 e de R$ 5,73 bilhões em 2027. A tabela do Imposto de Renda funciona de forma progressiva, e oimpostoa pagar aumenta conforme a faixa de rendimento, chegando a 27,5% para os maiores salários. “A corrosão inflacionária, ao não ser refletida nos limites de isenção e nas demais faixas do imposto, faz com que reajustes salariais que mal recompõem as perdas do poder de compra sejam tributados como se representassem efetivo ganho”, apontou o relator Arthur Lira, em seu parecer. Isenção para quem ganha até R$ 5 mil Essa atualização na tabela de IR não tem relação imediata com a proposta de isenção do imposto para quem ganha até R$ 5 mil, considerada como uma das prioridades do Planalto nesta segunda metade do mandato de Lula. No mês de março, o governo enviou aoCongressoum outro projeto, que, além de isentar pessoas que ganham até R$ 5 mil, também dá desconto para quem recebe entre R$ 5 mil e R$ 7 mil. A medida, que está em análise em comissão especial da Câmara dos Deputados, alcançaria mais de 90 milhões de brasileiros. Essa isenção deve gerar uma renúncia de R$ 27 bilhões em receitas, e a proposta do governo é que seja criado um mecanismo de compensação que tribute rendimentos de quem ganha acima de R$ 600 mil por ano. Em meio à tensão na relação com o Legislativo provocada pela derrubada do aumento do IOF proposto pelo governo,a entrega do texto foi adiada pelo relator Arthur Lira. Para o Brasil, principal foco de atenção é volatilidade nos preços de derivados Somente em maio foram 464,82 mil cotas comercializadas, a maior dos últimos dez anos Verizon analisou 22 mil incidentes de segurança ocorridos em 139 países Segundo o embaixador aposentado Eduardo Gradilone, Trump tenta se colocar como artífice da pacificação no Oriente Médio 01 02 exame no whatsapp Receba as notícias da Exame no seu WhatsApp Nos acontecimentos mais relevantes do Brasil e mundo. E-mail inválido Desperta",Exame
