url,data,titulo,texto,fonte
https://valor.globo.com/politica/noticia/2025/07/27/governadores-de-direita-ignoram-fator-bolsonaro-em-tarifao-critica-agu.ghtml,2025-07-27,"Governadores de direita ignoram ‘fator Bolsonaro’ em tarifaço, critica AGU","27/07/2025 13h19Atualizado27/07/2025 O ministro da Advocacia-Geral da União (AGU), Jorge Messias criticou neste domingo declarações feitas ontem por governadores que são considerados potenciais candidatos à Presidência da República em 2026 sobre o tarifaço anunciado pelos Estados Unidos. Em um evento da corretora XP Investimentos, Ratinho Júnior (Paraná), Ronaldo Caiado (Goiás) e Tarcísio de Freitas (São Paulo) evitaram vincular a medida ao ex-presidente Jair Bolsonaro. “Reunidos há poucos dias num evento econômico para discutir preocupações sobre o tarifaço do Trump, governadores de direita apregoaram pacificação e unidade para enfrentar a ameaça. No entanto, fingem ignorar que os sérios prejuízos que as sanções econômicas podem causar ao povo brasileiro foram traiçoeiramente fomentadas pela família Bolsonaro, clã político apoiado por esses mesmos governadores”, disse o ministro nas redes sociais. Durante o debate, os três governadores preferiram focar suas falas na necessidade de negociação com os americanos e em críticas ao presidente Luiz Inácio Lula da Silva, provável adversário nas urnas em 2026. O mais cotado para representar o bolsonarismo no pleito, Tarcísio reforçou que tem tentado negociar por conta própria com aliados americanos. Ratinho classificou como “falta de inteligência” os apelos de Lula por uma desdolarização do comércio internacional. Já Caiado disse que o presidente “não quer resolver o problema”. Acompanhe os mercados com nossas ferramentasAcessar gratuitamente Log Brasília está localizado próximo ao aeroporto da capital federal e conta com área bruta locável de 63.592 m² Segundo secretário de Comércio dos EUA, investigação foi um dos “principais motivos” para União Europeia buscar acordo comercial mais amplo Presidente da Comissão Europeia ainda afirmou que acordo comercial oferece segurança em tempos de incerteza Parlamentares brasileiros têm uma série de reuniões para tentar reabrir canais de diálogo com o Congresso americano Negociação também prevê investimentos de US$ 600 bilhões nos Estados Unidos Presidente dos EUA indicou que a Europa não receberá tarifa inferior a 15% Jorge Messias criticou declarações feitas ontem por governadores considerados potenciais candidatos à Presidência da República em 2026 Representantes dos dois países se reúnem em negociações em Estocolmo, na Suécia",Valor Econômico
https://valor.globo.com/brasil/noticia/2025/07/27/agenda-tesouro-divulga-resultado-fiscal-do-semestre-e-planejamento-detalha-descontingenciamento.ghtml,2025-07-27,"Agenda: Tesouro divulga resultado fiscal do semestre, e Planejamento detalha descontingenciamento","Por Valor— Brasília 27/07/2025 11h36Atualizado27/07/2025 A última semana do mês é marcada por uma série de divulgações da área econômica do governo federal. Na segunda-feira (28), oTesouro Nacionaldivulga orelatório mensal da dívida públicarelativo ao mês de junho e ao 1º semestre de 2025. Os dados saem às 14h30 e às 15h haverá coletiva de imprensa com técnicos da pasta. Na terça-feira (29), haverá reunião doConselho Nacional de Previdência Social (CNPS), às 14h30. A pauta ainda não foi divulgada. Na quarta-feira (30), o Tesouro Nacional divulga oresultado do governo centralde junho e do 1º semestre de 2025. O horário está em definição, mas os dados devem sair à tarde. Também na quarta-feira, o Ministério do Planejamento e Orçamento publica oDecreto de Programação Orçamentária e Financeira, com o detalhamento dodescongelamento de R$ 20,6 bilhões de gastos do Orçamento. O documento sai no ""Diário Oficial da União"". O resultado do Cadastro Geral de Empregados e Desempregados(Caged)será divulgado excepcionalmente na primeira semana de agosto pelo Ministério do Trabalho e Emprego. Os ministros Fernando Haddad (Fazenda) e Geraldo Alckmin (Indústria e Comércio) despacham de Brasília nesta semana, onde seguem com as tratativas para tentar reverter o tarifaço imposto pelos Estados Unidos ao Brasil. Há a expectativa que eles apresentam, durante a semana, o plano de contingência ao presidente Luiz Inácio Lula da Silva. Na segunda-feira, eles devem participar do evento de sanção do programa Acredita Exportação, que acontecerá no Palácio do Planalto, às 16h. Acompanhe os mercados com nossas ferramentasAcessar gratuitamente Log Brasília está localizado próximo ao aeroporto da capital federal e conta com área bruta locável de 63.592 m² Segundo secretário de Comércio dos EUA, investigação foi um dos “principais motivos” para União Europeia buscar acordo comercial mais amplo Presidente da Comissão Europeia ainda afirmou que acordo comercial oferece segurança em tempos de incerteza Parlamentares brasileiros têm uma série de reuniões para tentar reabrir canais de diálogo com o Congresso americano Negociação também prevê investimentos de US$ 600 bilhões nos Estados Unidos Presidente dos EUA indicou que a Europa não receberá tarifa inferior a 15% Jorge Messias criticou declarações feitas ontem por governadores considerados potenciais candidatos à Presidência da República em 2026 Representantes dos dois países se reúnem em negociações em Estocolmo, na Suécia",Valor Econômico
https://valor.globo.com/financas/noticia/2025/07/27/sou-controlada-com-dinheiro-ate-hoje-diz-anitta.ghtml,2025-07-27,"'Sou controlada com dinheiro até hoje', diz Anitta","Em alta 27/07/2025 08h00Atualizado27/07/2025 Anittaé conhecida por ter transformado sua carreira na música em uma plataforma ampla de negócios. Além de cantar, ela se destaca pela habilidade de tomar decisões estratégicas, seja na construção da própria marca, na escolha de parcerias ou na forma de administrar o próprio dinheiro. De origem humilde, a cantora saiu do subúrbio do Rio de Janeiro para alcançar carreira global com uma mentalidade empreendedora que ela cultiva desde antes da fama. Com disciplina financeira, ela conta que sempre enxergou o dinheiro como meio para realizar objetivos. Ainda nos primeiros anos de carreira, preferiu reinvestir tudo o que ganhava. A artista acredita que empreendedores precisam ter essa “visão de futuro” e investir em seus planos e negócios. Anitta já foi acionista e membro do conselho de administração doNubank, mas deixou a fintech em 2022. Recentemente, em abril deste ano, voltou a unir sua imagem ao mercado financeiro por meio de uma parceria com oMercado Pago. O objetivo, diz, é ampliar o acesso da população a ferramentas simples e acessíveis de gestão de dinheiro. Nesta semana, Anitta foi confirmada como uma das principais palestrantes na 9ª edição do Mercado Livre Experience, que acontece entre os dias 24 e 25 de setembro, no Transamérica Expo, em São Paulo. Em entrevista aoValor, a artista fala sobre suas escolhas, aprendizados e princípios na hora de cuidar do próprio patrimônio. Valor:Você construiu seu patrimônio do zero, sem herança. O que fez com o primeiro valor significativo que recebeu na carreira? Anitta: Comprei uma casa para mim e para minha família. Sem dúvidas foi um dos momentos mais felizes do início da minha carreira. Eu já trabalhava muito, de domingo a domingo. Foi lindo ver um sonho pessoal se realizando. Mas, para chegar nessa primeira casa, eu sempre fui extremamente cautelosa com os meus gastos e investia o que eu ganhava na minha própria carreira. Durante muito tempo eu fiquei no zero a zero. O que entrava eu investia na minha carreira. Tudo que vocês podem imaginar: desde um carro usado para o meu irmão me levar nos shows, figurino, comecei a pagar bailarinas e comprar equipamentos. Mesmo depois de consolidada, eu continuei investindo na música, com clipes e tudo que trazia as melhores assinaturas para o meu trabalho artístico. Acredito que empreendedores precisam ter essa visão de futuro. Guardar o que dá e investir em seus planos e negócios. Valor:Qual é a sua relação com o dinheiro hoje? Você mesma administra suas finanças? Conhece seu perfil de investidora? Anitta: Sempre fui controlada. Eu sou o tipo de pessoa que mesmo hoje eu pergunto: tô com dinheiro para viajar? Ok. Então, vamos! Nunca gastei mais do que eu tinha ou ganhava. Eu tenho uma equipe que me apoia nessas questões. Até porque eu não tenho tempo devido ao trabalho. Mas tudo é realizado com a minha aprovação e eu sempre quero saber o que estou investindo e quais são os riscos. Valor:O que você aprendeu ao longo da sua trajetória sobre lidar com dinheiro que gostaria que as pessoas soubessem desde cedo? Anitta: Se e quando possível, se planejem para o futuro e criem reservas de investimento desde cedo. Não é fácil, mas você pode começar com pouco. Parece óbvio, mas muita gente não sabe como fazer e acaba gastando mais do que deve. Eu vim de uma família pobre. Quando comecei a trabalhar, nos meus primeiros trabalhos como vendedora de loja e estagiária em uma multinacional, eu ganhava pouco. E economizava pouco também. Mas não me arrependo. Eu criava metas para aquele dinheiro, que naquela época eu guardava em um cofrinho dentro de casa. Hoje, com toda a gama de modernidade e rendimento que temos, teria sido diferente, claro! Valor:Sua estratégia para escolher parcerias se parece com a forma como você investe? Você é mais cautelosa ou aceita correr riscos? Anitta: Minha marca e imagem são ativos que conquistei durante mais de uma década de trabalho. Então, sou cautelosa com as minhas parcerias. Penso muito antes de fechar qualquer negócio e só fecho se entendo que está alinhado aos meus objetivos e valores. Prefiro dar passos para trás do que tropeçar na frente. Valor:Por que você decidiu voltar ao mercado financeiro, agora com a parceria com o Mercado Pago? Como funciona essa parceria? Anitta: Como disse, sempre destaquei publicamente a importância de administrar bem o dinheiro. Tomar decisões estratégicas para conquistar objetivos. Sou reconhecida por ser uma empreendedora e empresária que, com muita vontade e luta, construiu uma carreira sólida e de sucesso internacional. Sempre trago mensagens e ações para promover mudanças. Seja qual for a causa. Educação financeira e acesso a oportunidades de investimentos, de forma simples e sem pegadinhas, foi o que me encantou na hora que tive a primeira conversa com o Mercado Pago. Eles realizam um trabalho que busca democratizar o acesso a serviços financeiros, oferecendo ferramentas que ajudam as pessoas a gerenciarem seu dinheiro e a conquistar a liberdade financeira. Isso é fantástico. Me sinto muito bem recebida e ouvida pelo Mercado Pago. Ainda temos muitas coisas para fazermos juntos. Acompanhe os mercados com nossas ferramentasAcessar gratuitamente Log Brasília está localizado próximo ao aeroporto da capital federal e conta com área bruta locável de 63.592 m² Segundo secretário de Comércio dos EUA, investigação foi um dos “principais motivos” para União Europeia buscar acordo comercial mais amplo Presidente da Comissão Europeia ainda afirmou que acordo comercial oferece segurança em tempos de incerteza Parlamentares brasileiros têm uma série de reuniões para tentar reabrir canais de diálogo com o Congresso americano Negociação também prevê investimentos de US$ 600 bilhões nos Estados Unidos Presidente dos EUA indicou que a Europa não receberá tarifa inferior a 15% Jorge Messias criticou declarações feitas ontem por governadores considerados potenciais candidatos à Presidência da República em 2026 Representantes dos dois países se reúnem em negociações em Estocolmo, na Suécia",Valor Econômico
https://valor.globo.com/eu-e/noticia/2025/07/27/livros-prestam-um-tributo-ao-centenario-de-frantz-fanon.ghtml,2025-07-27,Livros prestam um tributo ao centenário de Frantz Fanon,"27/07/2025 08h00Atualizado27/07/2025 Pensar FanonDiversos autores, Ubu 320 págs., R$ 89,90 Acompanhe os mercados com nossas ferramentasAcessar gratuitamente Log Brasília está localizado próximo ao aeroporto da capital federal e conta com área bruta locável de 63.592 m² Segundo secretário de Comércio dos EUA, investigação foi um dos “principais motivos” para União Europeia buscar acordo comercial mais amplo Presidente da Comissão Europeia ainda afirmou que acordo comercial oferece segurança em tempos de incerteza Parlamentares brasileiros têm uma série de reuniões para tentar reabrir canais de diálogo com o Congresso americano Negociação também prevê investimentos de US$ 600 bilhões nos Estados Unidos Presidente dos EUA indicou que a Europa não receberá tarifa inferior a 15% Jorge Messias criticou declarações feitas ontem por governadores considerados potenciais candidatos à Presidência da República em 2026 Representantes dos dois países se reúnem em negociações em Estocolmo, na Suécia",Valor Econômico
https://valor.globo.com/mundo/noticia/2025/07/27/israel-suspende-restricoes-em-gaza-para-tentar-acalmar-clamor-internacional-pela-fome.ghtml,2025-07-27,Israel suspende restrições em Gaza para tentar acalmar clamor internacional pela fome,"27/07/2025 10h01Atualizado27/07/2025 Israelrevogou as restrições à distribuição de ajuda para Gaza no fim de semana, em um esforço para acalmar o crescente clamor internacional sobre acrise de fomeque convulsiona o destroçado enclave palestino. AsForças de Defesa de Israelsuspenderam neste domingo (27) algumas operações militares contra o Hamas para facilitar a movimentação decomboios de ajuda humanitária da ONUe restauraram o fornecimento de eletricidade para uma usina de dessalinização em Gaza pela primeira vez desde março . OPrograma Mundial de Alimentos da ONUalerta há semanas que toda a população de 2,1 milhões de pessoas em Gaza enfrenta níveis críticos de insegurança alimentar, enquanto dezenas de grupos de ajuda humanitária dizem que a fome está se espalhando rapidamente. Isso fez com que a raiva mundial contra o governo de Israel aumentasse em meio a relatos eimagens crescentes de bebês emaciados, crianças amontoadas em filas para sopa e homens brigando por sacos de farinha. Embora continue a negar as acusações de que está deliberadamente matando os moradores de Gaza de fome, Israel começou a enviar suprimentos de alimentos de paraquedas. Esse é um mecanismo de entrega já testado por várias forças aéreas estrangeiras há um ano, mas que foi abandonado na época devido a preocupações com escala e segurança. “Há uma campanha cheia de mentiras em andamento” que criou “uma impressão equivocada de fome em Gaza”, disseDanny Danon, embaixador de Israel na ONU, à rádio 103 FM de Tel Aviv. “Por isso, o gabinete decidiu ontem enviar ajuda, a fim de mostrar ao mundo que estamos atendendo às alegações, mesmo discordando dos fatos.” Sem pronunciamento de Netanyahu A decisão de domingo foi anunciada pelos militares, sem comentários doprimeiro-ministro, Benjamin Netanyahu,ou doministro da Defesa, Israel Katz.Marcou uma reversão de fato do corte de Israel na ajuda humanitária liderada pela ONU em março, após o término do cessar-fogo anterior em Gaza, uma tática que, segundo assessores de Netanyahu, privaria o Hamas de meios para controlar a população e, ao mesmo tempo, alimentaria seus próprios combatentes. Mahmoud Mardawi, um alto funcionário do Hamas, descreveu a reviravolta no Telegram como ""não uma solução, mas sim uma confissão tardia e distorcida de um crime cometido"" por Israel. As negociações para uma nova trégua fracassaram na semana passada, com Israel e os EUA acusando o Hamas de obstrução e insinuando que uma nova escalada na guerra de mais de 21 meses poderia ocorrer. Trump: ""Acho que eles querem morrer"" ""Acho que eles querem morrer, e isso é muito, muito ruim"", disse opresidente dos EUA, Donald Trump,sobre os combatentes islâmicos palestinos apoiados pelo Irã, na sexta-feira (25). ""Chegou a um ponto em que vocês vão ter que terminar o trabalho."" Tropas e tanques israelenses já invadiram 75% da Faixa de Gaza, contornando áreas onde se acredita que o Hamas esteja mantendo 50 reféns capturados em outubro de 2023.A trégua proposta teria resultado na devolução de metade dos reféns, em troca de centenas de palestinos presos, e aumentaria a ajuda para Gaza, ao longo de um período de 60 dias. A recuperação dos reféns restantes, no entanto, exigiria o comprometimento de Israel com o fim da guerra, afirmou o Hamas. Israel descartou essa possibilidade enquanto o Hamas, que consta em listas negras de terrorismo em grande parte do Ocidente, mantiver o armamento e governar Gaza. O Ministro da Segurança Nacional de Israel,Itamar Ben Gvir,membro de extrema direita do governo de coalizão de Netanyahu, disse ter sido excluído da decisão de restaurar a ajuda da ONU. Seu aliado ideológico, o ministro das Finanças,Bezalel Smotrich,também se opõe à suspensão do ataque ao Hamas e quer uma tomada total de Gaza — mesmo que isso represente um risco para os 20 reféns que se acredita ainda estarem vivos. Netanyahu disse na sexta-feira que Israel e os EUA estavam ""considerando opções alternativas para trazer nossos reféns para casa, acabar com o regime terrorista do Hamas e garantir uma paz duradoura para Israel e nossa região"". Isso ocorreu após uma ameaça de Katz de que ""os portões do inferno se abririam"" se o Hamas não libertasse os reféns em breve. Questionado na 103 FM se Israel deveria declarar sua disposição de encerrar a guerra em troca de todos os reféns, Danon disse que tal medida exigiria uma mudança nos objetivos da guerra. “Os objetivos agora, lembro a vocês, são recuperar os reféns, remover o Hamas do poder e atacar suas capacidades”, disse ele. “E o governo precisa decidir se considera que isso foi alcançado ou não.” Mais de 59.000 palestinos foram mortos na guerra, de acordo com o Ministério da Saúde do Hamas, que não faz distinção entre civis e combatentes. Israel lançou a ofensiva em retaliação a um ataque transfronteiriço do Hamas em 7 de outubro de 2023, no qual cerca de 1.200 pessoas foram mortas e 250 sequestradas. O país perdeu 455 soldados em combates em Gaza, incluindo três no fim de semana. ""Corredores humanitários"" Comboios de ajuda humanitária da Jordânia e do Egito chegaram a Gaza neste domingo.O exército israelense afirmou que""corredores humanitários"",ao redor dos quais manteria o fogo, estavam sendo estabelecidos em coordenação com a ONU para entregas a áreas onde as forças terrestres não estão ativas. Quando deixou de lado a rede de ajuda humanitária da ONU no início do ano, Israel criou uma alternativa apoiada pelos EUA, a Fundação Humanitária de Gaza, com o objetivo de excluir o Hamas. A fundação afirma ter distribuído alimentos básicos suficientes para mais de 90 milhões de refeições, mas reconheceu não ter conseguido atender toda a população de Gaza. A fundação também tem sido assombrada por alegações de que centenas de palestinos em busca de ajuda humanitária foram mortos a tiros perto de seus pontos de distribuição — incidentes pelos quais o GHF e as Forças de Defesa de Israel negaram responsabilidade. Acompanhe os mercados com nossas ferramentasAcessar gratuitamente Log Brasília está localizado próximo ao aeroporto da capital federal e conta com área bruta locável de 63.592 m² Segundo secretário de Comércio dos EUA, investigação foi um dos “principais motivos” para União Europeia buscar acordo",Valor Econômico
https://valor.globo.com/mundo/noticia/2025/07/27/trump-e-von-der-leyen-veem-chances-de-50-50-em-acordo-comercial-neste-domingo.ghtml,2025-07-27,Trump vê 50% de chances de fechar acordo comercial com a UE,"27/07/2025 14h02Atualizado27/07/2025 O presidente dos Estados Unidos,Donald Trump, expressou esperança de poder resolver as diferenças com a presidente da Comissão Europeia,Úrsula von der Leyen,sobre o relacionamento comercial entre os paísesantes do prazo final de sexta-feira para aentrada em vigor das tarifas de 30%. Acompanhe os mercados com nossas ferramentasAcessar gratuitamente Log Brasília está localizado próximo ao aeroporto da capital federal e conta com área bruta locável de 63.592 m² Segundo secretário de Comércio dos EUA, investigação foi um dos “principais motivos” para União Europeia buscar acordo comercial mais amplo Presidente da Comissão Europeia ainda afirmou que acordo comercial oferece segurança em tempos de incerteza Parlamentares brasileiros têm uma série de reuniões para tentar reabrir canais de diálogo com o Congresso americano Negociação também prevê investimentos de US$ 600 bilhões nos Estados Unidos Presidente dos EUA indicou que a Europa não receberá tarifa inferior a 15% Jorge Messias criticou declarações feitas ontem por governadores considerados potenciais candidatos à Presidência da República em 2026 Representantes dos dois países se reúnem em negociações em Estocolmo, na Suécia",Valor Econômico
https://valor.globo.com/politica/noticia/2025/07/27/pgr-pede-a-moraes-que-coronel-assessor-de-bolsonaro-continue-preso.ghtml,2025-07-27,PGR pede a Moraes que coronel assessor de Bolsonaro continue preso,"27/07/2025 19h16Atualizado27/07/2025 O procurador-geral da República, Paulo Gonet, recomendou ao Supremo Tribunal Federal (STF) a manutenção da prisão preventiva do coronel Marcelo Câmara, que foi assessor do ex-presidente Jair Bolsonaro e também é réu por tentativa de golpe de Estado. Câmara foi preso preventivamente no mês passado por uma suposta tentativa de interferência no acordo de delação premiada do coronel Mauro Cid, que era o ajudante de ordens de Bolsonaro. O PGR se manifestou contra um recurso da defesa de Câmara, solicitando sua liberdade. A acusação está amparada em mensagens trocada entre Cid e o advogado de Câmara, Luiz Eduardo Kuntz. Na avaliação de Gonet, ""os trechos insinuam que Marcelo Costa Câmara não apenas conhecia a conversa conduzida por seu advogado, mas dela se beneficiou ao utilizá-la como argumento defensivo"". Procurado, Kuntz disse aoValorque está ""muito preocupado"" com a conduta de Gonet no caso. ""É uma atuação tão desconexa com os autos de quem deveria ser o fiscal da lei. É de causar espécie"", afirmou o advogado. Ele disse ainda que pretende aguardar o encerramento da atual fase do julgamento para apresentar um novo pedido de relaxamento da prisão de Câmara.27/07/2025 19:09:27 Acompanhe os mercados com nossas ferramentasAcessar gratuitamente Log Brasília está localizado próximo ao aeroporto da capital federal e conta com área bruta locável de 63.592 m² Segundo secretário de Comércio dos EUA, investigação foi um dos “principais motivos” para União Europeia buscar acordo comercial mais amplo Presidente da Comissão Europeia ainda afirmou que acordo comercial oferece segurança em tempos de incerteza Parlamentares brasileiros têm uma série de reuniões para tentar reabrir canais de diálogo com o Congresso americano Negociação também prevê investimentos de US$ 600 bilhões nos Estados Unidos Presidente dos EUA indicou que a Europa não receberá tarifa inferior a 15% Jorge Messias criticou declarações feitas ontem por governadores considerados potenciais candidatos à Presidência da República em 2026 Representantes dos dois países se reúnem em negociações em Estocolmo, na Suécia",Valor Econômico
