url,data,titulo,texto,fonte
https://exame.com/exame-in/a-cfo-que-gestou-a-fusao-entre-petz-e-cobasi-junto-com-seu-terceiro-filho/,2025-08-30,A CFO que gestou a fusão entre Petz e Cobasi – junto com seu terceiro filho,"Com passagem pela Arezzo, onde liderou novos negócios, como a compra da Reserva, Aline Penna tem longa experiência em M&As; na Petz, o negócio transformacional ocorreu em paralelo com a maternidade Editora do EXAME IN Publicado em30 de agosto de 2025 às 10:25. No cargo de CFO daPetzdesde outubro de 2021,Aline Pennafoi peça-chave nafusão com aCobasi. Participou das negociações, da análise das sinergias e vem tocando o intrincado rito da transação no Conselho Administrativo de Defesa Econômica (Cade). Num longo namoro entre as empresas, o negócio quase foi fechado em setembro de 2023, mas bateu na trave. Parecia que não ia mais em frente, até que as conversas foram retomadas no começo de 2024. Em abril daquele ano, quando os contratos finalmente foram assinados, Penna estava grávida de sete meses da sua terceira filha – e se manteve à frente de tudo, sem transformar a gestação em pauta. “Era uma agenda intensa e fazíamos muitas reuniões por vídeo. Quando encontrei os executivos e sócios da Cobasi presencialmente, já no finzinho da gestação, eles tomaram um susto”, diz. “Eu não falei porque não fazia diferença e, no trabalho, isso não me definia.” SAIBA ANTES: Receba as notícias do INSIGHT no seu Whatsapp A executiva – assim como esta repórter – não é afeita a ‘casos de superação’ e menos ainda ao conceito de ‘supermulher’. Mas topou abrir sua experiência para mostrar a possibilidade de escolher ter uma carreira próspera e demandante e, ao mesmo tempo,construir uma família grande– com todas as dores e delícias que isso implica. “Era meu terceiro filho, eu já sabia como era. Tinha rede de apoio e sabia que era um momento crucial para a empresa”. A renúncia, nesse caso, foi trabalhar (bastante) pouco depois do parto, tocando os ajustes pós-fusão e a agenda concorrencial com a bebê ainda de colo e – como é usual em qualquer que seja a escolha envolvendo carreira e maternidade –, ouvindo críticas até de pessoas próximas. “Não quero naturalizar, dizer que é assim que tem que ser. É sobre se conhecer e saber o que a gente quer e o que a gente topa. Eu sabia que era isso que eu queria e fazia sentido para mim”, afirmou, numa entrevista de mais de duas horas. Penna ocupa um espaço que ainda é exceção para as mulheres.Uma pesquisa feita pelo Insper em parceria com a Assetz mostra que, em 2024, elas ocupavam apenas 18% das cadeiras de CFOs, considerando empresas de grande porte de capital fechado e aberto.Olhando apenas para o recorte de empresas listadas em bolsa, a diferença é ainda maior: além de Penna, apenas outras sete companhias das 81 que compõem o Ibovespa têm CFOs mulheres. Formada em administração pela FGV, a executiva está acostumada a ser uma das poucas mulheres na sala, a trabalhar longas horas e a tocar processos de M&A. Ela iniciou a carreira no investment banking do HSBC, onde ficou por seis anos, assessorando diversas transações. Depois, foi para a área de investimentos proprietários do banco, participando diretamente de negócios como a compra de participação na Camil Alimentos. Sua carreira de 12 anos no banco foi marcada ainda por longa passagem pela asset, uma das maiores com mandatos de ações para América Latina na época, cobrindo empresas de consumo e varejo. Foi nesse período que teve seus dois primeiros filhos. Por lá, ajudou a construir posições relevantes em empresas de consumo: “Tínhamos 10% de Renner, Arezzo, Hering. Isso dava acesso direto aos CEOs”. O relacionamento com os executivos das empresas era próximo — e foi decisivo para sua guinada no mundo corporativo. Questionadora, ela chamou atenção de Alexandre Birman, daArezzo, que a convidou para liderar a área de relações com investidores. Em pouco tempo, assumiu também as áreas de estratégia, novos negócios e planejamento, conduzindo a primeira grande leva de M&As da empresa. Por lá, tocou o projeto estratégico que ampliou a atuação da empresa, que tinha um share já relevante em sapatos femininos, para moda, roupa infantil, tênis e ESG. Liderou aquisiçõescomo a daReservae o licenciamento da Vans. Nem tudo saiu como o previsto. A tentativa de compra da Hering terminou em frustração, quando oGrupo Soma atravessou a propostacom um valor de quase o dobro do que tinha sido oferecido pela Arezzo. “Tínhamos passado muito tempo trabalhando na oferta. Foi duro, mas a disciplina prevaleceu."" (Como se sabe, hoje Arezzo e Soma estão juntos no Azzas.) Depois de seis anos na Arezzo, Penna queria consolidar sua jornada como CFO. E a Petz apareceu com a proposta certa. ""Era uma CFO com um papel amplo — além do financeiro, tinha RI, estratégia, novos negócios."" Ela nunca havia tocado áreas como o fiscal ou tesouraria, mas topou aprender. (A paixão por animais também ajudou: além dos três filhos, Penna tem quatro cachorros, um passarinho e recentemente comprou dois esquilos da Mongólia para o filho mais velho. “Sempre gostei de casa cheia. Acho que é coisa de filha única”, brinca.) Na época, a Petz havia acabado de abrir capital e era uma das queridinhas do mercado, com múltiplos elevados e apetite por crescimento. De novo, a agenda de M&A entrou em jogo: de cara, ela já tocou o fechamento da aquisição da Zee Dog, feita pouco antes da sua chegada. Depois comprou também a fabricante de tapetes higiênicos Petix, aprofundando a verticalização da varejista em direção à indústria. Os tempos de juros baixos, no entanto, ficaram para trás e o segmento de pets passou por uma ressaca brava no pós-pandemia. A demanda caiu e a concorrência aumentou – e Penna precisou trocar o chip. “Saímos da expansão para a eficiência, para o orçamento base zero. É claro que é um desafio, mas me deu um repertório bem mais completo. Saí de uma empresa com margens maiores, mais investimento em marketing, em branding, para uma indústria de margens mais apertadas. São competências complementares”, diz. Hoje, além do seu trabalho como CFO na Petz, Penna também divide sua experiência no setor de consumo como conselheira de administração, da rede",Exame
https://exame.com/brasil/moraes-determina-vistoria-em-carros-que-deixarem-casa-de-bolsonaro/,2025-08-30,Moraes determina vistoria em carros que deixarem casa de Bolsonaro,"Moraes também determinou monitoramento presencial da área externa da residência (EVARISTO SA / AFP) Agência de notícias Publicado em30 de agosto de 2025 às10h13. O ministroAlexandre de Moraes, do Supremo Tribunal Federal (STF), determinou neste sábado que os carros que deixarem a casa do ex-presidente Jair Bolsonaro, em prisão domiciliar, terão de ser revistados. Moraes também determinou monitoramento presencial da área externa da residência. Segundo o ministro,as novas medidas são necessárias para impedir ""qualquer possibilidade de fuga"" do ex-presidente. Na semana que vem, Bolsonaro começará a ser julgado pelo STF pela tentativa de golpe de Estado. ""Determino que a Polícia Penal do Distrito Federal, em complementação às medidas de monitoramento em curso, realize 'vistorias nos habitáculos e porta-malas de todos os veículos que saírem da residência do réu, para fins de incremento nas atividades de monitoramento'"", disse, na decisão. O magistrado afirmou que as vistorias deverão ser devidamente documentadas, com a indicação dos veículos, motoristas e passageiros e que os autos das vistorias deverão ser enviados à juízo diariamente. Quanto ao monitoramento da área externa da casa, Moraes explicou que se refere à parte descoberta da propriedade, na área que faz divisa com outros imóveis devido a existência de ""pontos cegos"". Na decisão, o ministro do STF afirmou que a efetividade do monitoramento integral de Bolsonaro, determinada pelo próprio Moraes, exige a adoção de novas medidas ""que conciliem a privacidade dos demais residentes do local e a necessária garantia da lei penal, impedindo qualquer possibilidade de fuga."" A decisão ocorre após um relatório da Polícia Federal apontar que, em caso de intenção de fuga de Jair Bolsonaro, seria necessário o ""acompanhamento in loco e em tempo integral das atividades do custodiado, e do fluxo de veículos na residência e de vizinhos próximos, únicas medidas hábeis a minimizar, de forma razoavelmente satisfatória, tais riscos"". Depois, a Secretaria de Estado de Administração Penitenciária do Distrito Federal destacou, em ofício, que a existência de outras casas ao lado e nos fundos da residência do ex-presidente causa a existência de ""pontos cegos"" no monitoramento já realizado na frente da propriedade, também determinado por Moraes. A secretaria também apontou que, a depender da localização de Bolsonaro, o sinal da tornozeleira eletrônica pode ser interrompido ou ficar mais lento. Já a Procuradoria-Geral da República não objetou a vigilância da área externa da casa, embora tenha se manifestado contra a presença de agentes na área interna da residência. A Lei de Reciprocidade Econômica, sancionada em julho, autoriza o Brasil a adotar medidas tarifárias e não tarifárias contra países que imponham barreiras às exportações nacionais O faturamento do crime pode ultrapassar R$ 348 bilhões com atividades da economia formal como combustíveis, extração e produção de ouro, tabaco, cigarro e bebidas. As perdas tributárias chegam a R$ 72 bilhões Presidente da República recebeu atletas de ginástica rítmica que conquistaram duas medalhas de prata no mundial do esporte Última sexta-feira do mês terá risco de chuva forte em São Paulo, Minas e Rio, enquanto o Centro-Oeste enfrenta altas temperaturas e ar seco 01 02 03 exame no whatsapp Receba as notícias da Exame no seu WhatsApp Nos acontecimentos mais relevantes do Brasil e mundo. E-mail inválido Desperta",Exame
https://exame.com/esg/exclusivo-henkel-aposta-em-biometano-da-ultragaz-em-fabrica-de-sp-e-reduz-emissoes-na-producao/,2025-08-30,Exclusivo: Henkel aposta em biometano da Ultragaz em fábrica de SP e reduz emissões na produção,"Patrocínio: Parceiro institucional: Henkel tem como meta de longo prazo reduzir 90% das emissões absolutas até 2045 Repórter de ESG Publicado em30 de agosto de 2025 às10h07. A multinacional alemãHenkelanunciou que sua planta fabril em Itapevi (SP) passará a usarbiometanocomo fonte de energia. AUltragazserá responsável pelo fornecimento do gás renovável e pela instalação da infraestrutura necessária, com conclusão prevista para o primeiro semestre de 2026. A mudança deve reduzir cerca de 500 toneladas deemissões de CO₂por ano em comparação aos níveis de 2024. A unidade consumirá aproximadamente 300 mil metros cúbicos de biometano anualmente, substituindo o gás natural tradicional. A iniciativa integra a estratégia global da Henkel de reduzir emissões degases do efeito estufa. A empresa se comprometeu a cortar 42% das emissões diretas (escopos 1 e 2) e 30% das indiretas (escopo 3) até 2030, seguindo critérios da Science Based Targets Initiative (SBTi). O biometano utilizado será produzido a partir da decomposição deresíduos orgânicosdo aterro sanitário de Caieiras (SP). Segundo as empresas, o combustível não emiteCO₂durante o uso e ainda evita a liberação de metano na atmosfera - gás com potencial de aquecimento global 80 vezes maior que odióxido de carbono. ""A adoção dobiometanoem Itapevi reforça nossa visão de integrar soluções de baixo carbono na operação fabril"", disse Edmar Fialho, gerente da Henkel na planta. Erik Trench, diretor de gases renováveis daUltragaz, destacou o papel da empresa natransição energéticaindustrial. ""O biometano tem se mostrado uma alternativa segura e eficiente para esse desafio"". A Henkel tem como meta de longo prazo reduzir 90% das emissões absolutas até 2045, englobando desde processos produtivos até escritórios e frota de veículos. 1/8A energia hidrelétrica é a fonte renovável mais utilizada no Brasil, representando cerca de 57,3% da matriz energética do país(A energia hidrelétrica é a fonte renovável mais utilizada no Brasil, representando cerca de 57,3% da matriz energética do país) 2/8A energia eólica ocupa o segundo lugar no ranking de energias renováveis do Brasil, respondendo por aproximadamente 11,3% da energia produzida no país(A energia eólica ocupa o segundo lugar no ranking de energias renováveis do Brasil, respondendo por aproximadamente 11,3% da energia produzida no país) 3/8Energia solar: China lidera ranking com mais de 5 empresas no top 10 global de capacidade instalada.(A energia solar fotovoltaica representa cerca de 2,5% da energia gerada no país) 4/8A biomassa, que inclui o uso de matéria orgânica como bagaço de cana-de-açúcar, madeira e óleos vegetais, é responsável por aproximadamente 7,5% da matriz energética brasileira(A biomassa, que inclui o uso de matéria orgânica como bagaço de cana-de-açúcar, madeira e óleos vegetais, é responsável por aproximadamente 7,5% da matriz energética brasileira) 5/8Os biocombustíveis, como o etanol e o biodiesel, são importantes fontes de energia limpa no Brasil, especialmente no setor de transportes(Os biocombustíveis, como o etanol e o biodiesel, são importantes fontes de energia limpa no Brasil, especialmente no setor de transportes) 6/8O biogás, produzido a partir da decomposição de resíduos orgânicos, é uma fonte promissora de energia limpa no país(O biogás, produzido a partir da decomposição de resíduos orgânicos, é uma fonte promissora de energia limpa no país) 7/8A energia geotérmica, proveniente do calor interno da Terra, é uma fonte renovável com potencial de exploração no Brasil(A energia geotérmica, proveniente do calor interno da Terra, é uma fonte renovável com potencial de exploração no Brasil) 8/8O hidrogênio verde é uma alternativa promissora para substituir o hidrogênio tradicionalmente obtido a partir de combustíveis fósseis, contribuindo assim para a redução das emissões de gases de efeito estufa.(O hidrogênio verde, produzido a partir de fontes renováveis, é uma tecnologia em desenvolvimento que pode se tornar uma importante fonte de energia limpa no futuro) Isabela Morbach, da COSRO Advogados, analisa os próximos passos do Sistema Brasileiro de Comércio de Emissões e as expectativas para a conferência do clima na Amazônia Crise hídrica, expansão renovável e a nova dinâmica de preços no setor elétrico À EXAME, Marcelo Behar revela estratégia trilionária de bioeconomia estruturada em cinco frentes para posicionar país como potência verde global VOA, realizado em parceria com a Ago Social, já capacitou mais de 500 organizações ao longo de sete anos, impacto positivo para mais de 10 milhões de pessoas 01 02 03 exame no whatsapp Receba as notícias da Exame no seu WhatsApp Em cases de sucesso e em entrevistas com líderes ESG. E-mail inválido ESG",Exame
https://exame.com/mundo/drone-ucraniano-provoca-incencio-perto-de-palacio-de-putin-no-sul-da-russia/,2025-08-30,Drone ucraniano provoca incêncio perto de 'palácio de Putin' no sul da Rússia,"Putin: Os ataques mudaram os hábitos de Putin, que, por exemplo, teria deixado de visitar a cidade de Sochi (Alexander Kazakov/AFP) Agência de notícias Publicado em30 de agosto de 2025 às10h07. Osbombeiros russos lutavam neste sábado (30) contra um incêndio, provocado pelos destroços de um drone ucraniano, perto de um ""palácio""que muitos acreditam que pertence ao presidente Vladimir Putin às margens do Mar Negro. As autoridades da região de Krasnodar, sul da Rússia, anunciaram na quinta-feira que a queda de um drone provocou um incêndio em uma ""área florestal"" perto da cidade de Guelendzhik. A área abriga uma residência de luxo que muitos chamam de ""palácio de Putin"", com a qual o presidente russo nega ter qualquer relação. O Ministério de Situações de Emergência afirmou neste sábado que mais de 400 bombeiros continuavam lutando contra as chamas. Não há indícios de que o incêndio ameace diretamente o ""palácio de Putin"", que as autoridades russas nunca mencionam em seus diversos comunicados. O opositor russo Alexei Navalny, que faleceu na prisão em fevereiro do ano passado, publicou em 2021 uma investigação na qual acusava Vladimir Putin de ser o proprietário da imensa propriedade situada em uma área turística às margens do Mar Negro. Segundo a investigação, o complexo luxuoso, financiado com fundos procedentes da corrupção, incluiria vinhedos, um estádio de hóquei no gelo e um cassino. A Ucrânia, que luta desde 2022 contra uma ofensiva russa em seu território, se defende atacando a Rússia com drones. Os ataques mudaram os hábitos de Putin, que, por exemplo, teria deixado de visitar a cidade de Sochi, agora ao alcance dos drones, segundo o site russo Proekt, que citou uma fonte que pediu anonimato. O presidente Volodimir Zelensky anunciou que a vítima era Andrii Parubii, presidente do Parlamento ucraniano entre 2016 e 2019 Três navios lança-mísseis americanos devem se posicionar em águas internacionais nos próximos dias perto do limite com a Venezuela Corte concluiu que a lei usada por Trump para justificar as tarifas não confere ao presidente o poder de impor taxações Caso veio à tona após a divulgação de áudios nos quais o ex-chefe da Andis, Diego Spagnuolo, afirma que a irmã do presidente recebia 3% do montante pago pela agência para a compra de medicamentos 01 02 03 exame no whatsapp Receba as notícias da Exame no seu WhatsApp Nos acontecimentos mais relevantes do Brasil e mundo. E-mail inválido Desperta",Exame
https://exame.com/mundo/deputado-ucraniano-assassinado-no-oeste-do-pais/,2025-08-30,Deputado ucraniano assassinado no oeste do país,"Agência de notícias Publicado em30 de agosto de 2025 às10h01. O deputado ucraniano Andrii Parubii,ex-presidente do Parlamento, foi assassinado a tiros neste sábado em Lviv, oeste do país, informaram as autoridades locais. A polícia ucraniana relatou um tiroteio em Lviv e que ""uma personalidade pública e política conhecida"" morreu devido aos ferimentos. O presidente Volodimir Zelensky anunciou que a vítima era Andrii Parubii, presidente do Parlamento ucraniano entre 2016 e 2019. Zelensky lamentou um ""assassinato horrível"" e prometeu uma investigação para esclarecer as circunstâncias e os motivos do crime. As autoridades informaram que estão procurando o autor dos disparos. Parubii havia participado dos recentes movimentos pró-europeus na Ucrânia, primeiro na ""Revolução Laranja"" de 2004 e depois na ""Revolução de Maidan"" em 2014. Três navios lança-mísseis americanos devem se posicionar em águas internacionais nos próximos dias perto do limite com a Venezuela Corte concluiu que a lei usada por Trump para justificar as tarifas não confere ao presidente o poder de impor taxações Caso veio à tona após a divulgação de áudios nos quais o ex-chefe da Andis, Diego Spagnuolo, afirma que a irmã do presidente recebia 3% do montante pago pela agência para a compra de medicamentos Órgão enfatizou que a decisão ""viola o direito internacional"" 01 02 03 exame no whatsapp Receba as notícias da Exame no seu WhatsApp Nos acontecimentos mais relevantes do Brasil e mundo. E-mail inválido Desperta",Exame
https://www.infomoney.com.br/mercados/avioes-dos-eua-ganham-barreira-inedita-contra-invasoes-conheca-o-recurso/,2025-08-30,Aviões dos EUA ganham barreira inédita contra invasões; conheça o recurso,"Reuters30/08/2025 16h35•Atualizado 3 horas atrás 30/08/2025 16h35•Atualizado 3 horas atrás Publicidade A companhia aérea norte-americana Southwest Airlines começou a voar na sexta-feira com um primeiro jato equipado com uma barreira secundária na cabine dos pilotos projetada para evitar invasões. O avião, um Boeing 737 MAX 8 que foi entregue nos últimos dias, decolou na tarde de sexta-feira de Phoenix para Denver. As barreiras secundárias – há muito procuradas após os ataques de 11 de setembro de 2001, que expuseram os riscos da proteção inadequada da cabine dos pilotos – são cruciais para a segurança da aviação, segundo os sindicatos de pilotos. Continua depois da publicidade 🔴 Southwest Airlines began operating its first Boeing 737-8 with a secondary cockpit barrier, a post-9/11 safety measure. FAA rules mandate barriers on new aircraft from 2023, though airlines have until July 2026 to implement them.#Airways#Newspic.twitter.com/1Hbxm8pZ00 O voo é um marco que assinala o início da implementação do recurso de segurança em toda a nova frota de linhas aéreas comerciais dos EUA nos próximos anos. Boeing e Airbus disseram à Reuters que começaram a entregar aviões com as barreiras de acordo com a regulamentação da agência norte-americana de aviação (FAA) anunciada em 2023, que entrou em vigor na segunda-feira. No mês passado, a FAA concordou em dar às companhias aéreas até o final de julho de 2026 para colocarem em uso as barreiras nos aviões recém-entregues. A maioria das principais companhias aéreas informou à FAA que planeja aproveitar a prorrogação e não começar a usar as barreiras imediatamente. Continua depois da publicidade Declarações foram feitas pela vice-presidente do ditador Nicolás Maduro após chegada de navios dos EUA ao mar do Caribe Uma foto de Trump acompanhado de sua neta Kai, embarcando em sua comitiva em direção ao Trump National Golf Club em Sterling, na Virgínia, serviu para esfriar os rumores que agitaram as redes sociais A Southwest optou por começar a cumprir a lei imediatamente ao receber novos aviões e espera receber cerca de 25 aviões Boeing adicionais este ano que terão as barreiras. “Sentimos que poderíamos fazer isso e colocá-lo em produção assim que a aeronave estivesse pronta”, disse Justin Jones, vice-presidente executivo de operações da Southwest. Após o sequestro de quatro aviões norte-americanos em 11 de setembro de 2001, a FAA adotou padrões para a segurança das cabines de comando para torná-las resistentes a invasões forçadas e entradas não autorizadas. Continua depois da publicidade A regra da FAA exige que os fabricantes de aeronaves instalem uma segunda barreira física nos novos aviões usados no serviço comercial de passageiros nos EUA, mas não exige que os aviões existentes sejam adaptados. Os fabricantes de aviões sem certificação de barreiras pela FAA ainda não precisam estar em conformidade. Reuters",Infomoney
https://www.infomoney.com.br/mercados/warren-buffett-faz-95-anos-e-o-segredo-de-sua-longevidade-nao-vem-da-dieta/,2025-08-30,Warren Buffett faz 95 anos e o segredo de sua longevidade não vem da dieta,"Roberto de Lira30/08/2025 12h48•Atualizado 7 horas atrás 30/08/2025 12h48•Atualizado 7 horas atrás Publicidade O investidor bilionárioWarren Buffett, considerado o “Oráculo de Omaha”, comemora seu 95º aniversário neste sábado, a última vez que soprará as velinhas enquanto atua como CEO da Berkshire Hathaway – ele anunciou quese aposentará do comando do conglomerado Berkshire Hathawayainda em 2025. A cada giro do calendário, sempre vem a pergunta: qual o segredo de sua longevidade? Um spoiler: não é por uma alimentação saudável. Já ficou clássica uma entrevista que Buffett deu à revista Fortune em 2015, na qual ele admitiu manter hábitos alimentares nada indicados para alguém de sua faixa etária. “Eu verifiquei as tabelas atuariais e a menor taxa de mortalidade está entre as crianças de seis anos. Então decidi comer como uma criança de seis anos”, afirmou. E a declaração não era uma brincadeira. Buffett é um fã declarado da Coca-Cola e afirmou beber cinco latas do refrigerante onças todos os dias. “Se eu comer 2.700 calorias por dia, um quarto disso é Coca-Cola. Eu faço isso todos os dias”, disse ele à Fortune. Continua depois da publicidade E o café da manhã? Com certeza idas ao McDonald’s está na agenda. No documentário da HBO ‘Becoming Warren Buffett’, ele disse que visitava a lanchonete próxima a sua casa todos os dias para um café da manhã de US $ 3,17. O cardápio? Hambúrgueres, salsicha, ovo e queijo. Ou um prato com bacon, ovo e queijo. Ele, claro, uma Coca-Cola. Veja como foi a cobertura do InfoMoney na última reunião da Berkshire Hathaway:AO VIVO: A reunião de Warren Buffett com acionistas da Berkshire No almoço, mais junk food: ele é um cliente frequente da Dairy Queen e adora comer um cachorro-quente com queijo, chili e um sundae de sorvete com xarope de cereja e nozes picadas. Ele também é fã dos bombons See’s Candies. Continua depois da publicidade Se não é reconhecido como um consumidor de alimentos saudáveis, pelo menos o megainvestidor diz não abrir mão de oito horas de sono por noite, hábito aprovado por associações de saúde do coração. Seu lazer inclui sessões jogando bridge com amigos, algo que ele já declarou como um excelente exercício para o cérebro. Ele também disse que passa ao menos cinco horas por dia lendo ou apenas ficando imerso em seus pensamentos. E estar feliz também é uma dica sua. “Acho que a felicidade faz uma enorme diferença … em termos de longevidade. Fico mais feliz quando estou comendo sundaes de chocolate quente ou bebendo Coca-Cola”, disse Buffett em uma entrevista à CNBC em 2017. Roberto de Lira",Infomoney
