url,data,titulo,texto,fonte
https://exame.com/future-of-money/ethereum-voltou-com-tudo-descubra-as-causas-da-disparada-da-criptomoeda/,2025-07-27,Ethereum voltou com tudo? Descubra as causas da disparada da criptomoeda,"Patrocínio: Ethereum: criptomoeda voltou a disparar (Reprodução/Reprodução) Especialista em criptoativos Publicado em27 de julho de 2025 às11h30. Após a disparada de diversascriptomoedasna semana passada, o mercado passa por uma correção. Poucas estão na contramão da maré, com destaque para oether, que registra leve ganho neste momento, operando na casa dos US$ 3.658, com valorização de 2,60% em 7 dias, segundo o CoinMarketCap. Obitcoinse mantém resiliente, sendo negociado por volta dos US$ 116.500, mas é o ether que assume o protagonismo, impulsionado pelo forte interesse institucional. Vimos umaretomada histórica do ativo, com crescimento de quase 60% em um mês. E as apostas estão altas. O próximo alvo aponta para os US$ 4 mil e alguns analistas, ainda mais otimistas, jogam suas previsões lá pra cima, projetando entre US$ 5 mil e US$ 10 mil até o final do ano. OsETFsà vista de ether estão voando, atraindo muito mais capital do que os fundos semelhantes de bitcoin, o que demonstra um reposicionamento no apetite ao risco dos investidores. Foram captados quase US$ 2,4 bilhões durante os últimos seis dias de negociação, enquanto os de bitcoin ficaram com US$ 827 milhões. O grande destaque foi o iShares Ethereum ETF (ETHA) da BlackRock, que sozinho recebeu US$ 1,79 bilhão em investimentos, representando cerca de 75% de todo o volume que entrou nos ETFs de ether no período. O ETHA também conquistou uma marca importante:se tornou o terceiro ETF que mais rápido na históriaatingiu US$ 10 bilhões em patrimônio sob gestão, resultado alcançado em 251 dias de operação. Os ETFs funcionam como canais regulados para atrair capital de grandes investidores, descomplicando o investimento e criando um ambiente mais seguro para o fluxo de recursos. Quando uma gestora como a BlackRock concentra a maior parte desses aportes em ether, os players institucionais, desde fundos de pensão a gestoras de riqueza, leem isso como um sinal claro de confiança. O ether, afinal, é sustentado por uma infraestrutura robusta: mais de 50% dasstablecoinscirculam em sua rede, que ainda abriga os protocolos DeFi mais consolidados do mercado. Empresas como SharpLink, Bitmine, Bit Digital e BTCS Inc. também estão adotando o ativo e ajudando a escrever um novo capítulo na gestão de tesouro corporativo. Elas transformaram o ether em reserva estratégica produtiva. O ether é do tipo que trabalha 24/7: gera renda passiva via staking enquanto valoriza de preço. As empresas citadas já alocam mais de US$ 2,9 bilhões do ativo nos seus balanços. Esse movimento parece repetir os passos da adoção institucional do bitcoin, com ETFs e tesouros como agentes de demanda. E o ether vai traçando sua trilha também como reserva de valor, com redução da oferta circulante e armazenamento para o longo prazo. O avanço institucional não apenas lidera o movimento, mas também legitima o ether como ativo de peso no mercado. Esse efeito se espalha: à medida que os fundos ganham escala e, consequentemente, fortalecem a rede, o varejo começa a enxergar o ativo não só como especulação, mas como um investimento validado. Mesmo ainda tímida diante dos aportes institucionais, essa demanda pode acelerar rapidamente conforme os ETFs ganham manchetes e o mercado reconhece a nova fase do projeto. Nessa trilha de adoção, o ether consegue ampliar o papel de ativo macro com uma camada extra: preserva riqueza e ainda é responsável por habilitar toda uma economia utilitária de contratos inteligentes, DApps e stablecoins. Ao reunir a função de cofre de valor com um ambiente programável, a rede vai consolidando sua posição estratégica no mercado cripto, entregando segurança de reserva e, ao mesmo tempo, impulsionando inovações que alimentam o crescimento de todo o ecossistema. Dados mostram quecerca de 90% dos ativos tokenizados usam a Ethereum como base e 51 % de todas as stablecoins estão emitidas nessa infraestrutura. À medida que mais projetos se conectam, o protocolo ganha força exponencial e, assim, mais atratividade. O presidente da SEC, Paul Atkins, falou, esta semana, durante uma entrevista à CNBC que o ether não é considerado um valor mobiliário. Embora a declaração ainda não represente um parecer jurídico formal, ela reforça a leitura de que o ativo passa a ser tratado como commodity, status semelhante ao do bitcoin. A mensagem tem peso simbólico e prático: além de reduzir incertezas que travavam movimentos institucionais, ela fortalece o papel da Ethereum como peça-chave da infraestrutura digital em construção. É um marco que pode destravar novos ciclos de investimento e desenvolvimento em torno do ativo. E isso acontece em um momento estratégico: com o bitcoin abrindo caminho, o ether já começa a assumir o protagonismo típico das fases iniciais de umaaltseason, quando investidores migram progressivamente para ativos menores em busca de retornos mais rápidos. Na última semana, vimos muitas criptos apresentarem boas valorizações antes da correção atual. Aquele salto foi resultado, em especial, da chamada Crypto Week, que incluiu a aprovação na Câmara dos EUA de três projetos regulatórios, sendo um já sancionado pelo presidente Trump, o Genius Act. O mercado entende que esse avanço abre mais portas para a entrada de institucionais, como um estímulo a um aumento da adoção no mundo. Considerando tudo o que falamos até aqui, fica claro que surgem oportunidades diferentes para investidores com perfis variados. Seja para quem busca mais segurança ou para quem está disposto a assumir mais risco em troca de retorno maior, há caminhos possíveis. A seguir, três formas de se posicionar com mais inteligência neste ciclo. Para quem quer construir uma posição sólida, mas sem se expor a riscos excessivos, a exposição direta ao ether pode fazer sentido. A rede é hoje a principal infraestrutura da nova economia digital e o ether, como moeda nativa, concentra valor à medida que o ecossistema cresce. Com o cenário regulatório mais favorável, a entrada de grandes players e a consolidação dos ETFs, a Ethereum tende a ganhar status ainda mais relevante como camada base. A lógica aqui é: enquanto muitas aplicações dependem do sucesso de um produto específico ou narrativa, o ether acompanha o sucesso estrutural da rede como um todo. Além do próprio",Exame
https://exame.com/pop/os-simpsons-vao-acabar-em-breve-criador-revela-quando-sera-o-final-da-serie/,2025-07-27,'Os Simpsons' deve acabar em breve? Criador revela quando será o final da série,"""Os Simpsons"": série de comédia criada nos EUA é popular em vários países e conquistou gerações de fãs (Divulgação/Fox) Repórter Publicado em27 de julho de 2025 às11h23. Última atualização em27 de julho de 2025 às11h31. Durante um painel dedicado a“Os Simpsons”naSan Diego Comic-Con(SDCC), o criador da série, Matt Groening, comentou sobre as expectativas em relação ao fim da produção.Questionado sobre a possibilidade de encerramento, Groening afirmou que a série deve continuar até que um dos dubladores principais morra. Nos últimos meses, surgiram rumores de que a animação seria encerrada em sua 36ª temporada. ""Honestamente? Eu pensei que seríamos cancelados na 36ª"", disse Groening em tom de brincadeira. ""Não, por enquanto não estamos pensando em um final. Vamos continuar e vamos continuar até que alguém de nós morra!"". A produção está prestes a alcançar a marca de 800 episódios e já planeja uma nova temporada.O 37º ano da série contará com participações de Kieran Culkin (""Succession""), Danny Pudi (""Community""), Glenn Howerton (""It's Always Sunny in Philadelphia""), Idris Elba (""Thor""), Michael Keaton (""Os Fantasmas Ainda Se Divertem"") e Viola Davis (""G20""). No Brasil,“Os Simpsons”, conhecida por “prever” eventos históricos em alguns episódios, é exibida pelo Disney+.Ainda não há confirmação de data de estreia para a 37ª temporada no país. Companhia de streaming está à procura de uma nova liderança para divisão de podcasts com o propósito de integrar essas produções ao catálogo da plataforma Cultura pop pode ser um reflexo das incertezas econômicas, com sinais de recessão já visíveis nas músicas e tendências atuais Eve Jobs sobe ao altar neste sábado, no interior da Inglaterra, em cerimônia com helicópteros, filhos de bilionários e convidados da realeza A data tem origem bíblica e foi instituída pelo Papa Paulo VI, no século XX, para homenagear os pais de Maria, mãe de Jesus 01 02 03 exame no whatsapp Receba as notícias da Exame no seu WhatsApp Nos acontecimentos mais relevantes do Brasil e mundo. E-mail inválido Desperta",Exame
https://www.infomoney.com.br/mercados/futuros-em-ny-operam-em-alta-impulsionados-por-acordo-entre-eua-e-ue/,2025-07-27,Futuros em NY operam em alta impulsionados por acordo entre EUA e UE,"Lucas Gabriel Marins27/07/2025 19h34•Atualizado 36 minutos atrás 27/07/2025 19h34•Atualizado 36 minutos atrás Publicidade Os futuros de ações nos Estados Unidos operam em alta na noite deste domingo (27), impulsionados pelo anúncio de umacordo comercial entre os EUA e a União Europeia, formalizado durante a tarde. Por volta das 19h30 (horário de Brasília), o índice futuro do Dow Jones subia 0,41%, a 45.084 pontos; o futuro do S&P 500 avançava 0,37%, para 6.425 pontos; e o futuro do Nasdaq ganhava 0,42%, alcançando 23.522,50 pontos. Pelo acordo, os Estados Unidos aplicarão uma tarifa de 15% sobre produtos exportados pela UE, e o bloco econômico se comprometeu a investir US$ 600 bilhões no país. Só a União Europeia e outros seis países formalizaram acordo com a administração Trump. O prazo para o início das tarifas – inclusive a taxa de 50% para o Brasil – é a próxima sexta-feira (1º). Trump já sinalizou que não pretender adiar a data, o que deve movimentar o mercado. Leia mais:A cinco dias do tarifaço, veja quais países já fecharam acordo com Trump Além das tarifas, outros eventos devem influenciar os mercados ao longo da semana. Na quarta-feira (30), o Federal Reserve decide a taxa básica de juros dos Estados Unidos. De acordo com a ferramenta CME FedWatch, 97% do mercado espera a manutenção da faixa atual, entre 4,25% e 4,50% ao ano. Continua depois da publicidade Mais de 150 empresas do S&P 500 também divulgam os resultados do segundo trimestre de 2025, o que deve movimentar as bolsas. Algumas das “Sete Magníficas”, grupo que reúne gigantes do setor de tecnologia, estão na lista. Meta (M1TA34) e Microsoft (MSFT34) publicam seus números na quarta-feira (30); Amazon (AMZO34) e Apple (AAPL34), na quinta (31). O mercado de trabalho norte-americano é outro fator no radar dos investidores. O relatório Jolts será divulgado na terça-feira; os dados de emprego privado da ADP saem na quarta; os pedidos iniciais de seguro-desemprego, na quinta; e, na sexta-feira, será publicado o relatório oficial de empregos referentes a julho. Lucas Gabriel Marins",Infomoney
https://www.infomoney.com.br/mercados/iemen-houthis-ameacam-bombardear-navios-de-empresas-que-negociam-com-israel/,2025-07-27,Iêmen: houthis ameaçam bombardear navios de empresas que negociam com Israel,"Lara Rizério27/07/2025 19h12•Atualizado 49 minutos atrás 27/07/2025 19h12•Atualizado 49 minutos atrás Publicidade O braço das Forças Armadas do Iêmen ligado ao movimento houthi anunciou neste domingo, 27, que promoverá uma escalada nas suas operações militares contra Israel, diante do aumento da crise humanitária em Gaza. Segundo os iemenitas, a nova fase inclui o bombardeio a navios de empresas que negociam com os israelenses. “As Forças Armadas do Iêmen alertam todas as empresas para que cessem imediatamente qualquer relação com os portos do inimigo israelense a partir do momento em que esta declaração for anunciada. Caso contrário, seus navios, independentemente do destino, serão alvos em qualquer lugar que esteja ao alcance de nossos mísseis e drones”, afirmou em comunicado o porta-voz das Forças Armadas iemenitas, Yahya Saree. Suspensão começa neste domingo, 27, das 10h às 20h e deve ocorrer diariamente, até nova orientação De acordo com Saree, o Iêmen tem “uma responsabilidade religiosa moral e humanitária” para com os palestinos de Gaza, que têm sofrido “massacres horríveis, brutais e sem precedentes na história contemporânea” por parte do regime de Benjamin Nethanyahu. As operações militares, segundo o porta-voz,”cessarão imediatamente após o fim da agressão contra Gaza e a suspensão do bloqueio” de Israel à região palestina ocupada. “As Forças Armadas do Iêmen apelam a todos os países: se quiserem evitar essa escalada, pressionem o inimigo para interromper sua agressão e suspender o bloqueio à Faixa de Gaza” afirmou Saree. Lara Rizério Editora de mercados do InfoMoney, cobre temas que vão desde o mercado de ações ao ambiente econômico nacional e internacional, além de ficar bem de olho nos desdobramentos políticos e em seus efeitos para os investidores.",Infomoney
https://www.infomoney.com.br/mercados/mania-das-acoes-meme-volta-aos-eua-causa-dilema-e-deixa-operadores-em-alerta/,2025-07-27,"Mania das “ações meme” volta aos EUA, causa dilema e deixa operadores em alerta","Bloomberg27/07/2025 13h25•Atualizado 7 horas atrás 27/07/2025 13h25•Atualizado 7 horas atrás Publicidade A retomada da mania das ações meme na semana passada nos EUA colocou os investidores profissionais diante de um dilema: aproveitar a empolgação dos traders de varejo ou encarar isso como o mais recente sinal de alerta de que os mercados inflacionados estão prestes a sofrer uma correção. As ações especulativas envolvidas na febre, como Opendoor Technologies Inc. e Kohl’s Corp., perderam parte dos ganhos ao longo da semana, mas a maioria ainda negocia em seus níveis mais altos em meses. Os índices mais amplos S&P 500 e Nasdaq 100 estão ainda melhores, atingindo máximas históricas após se recuperarem da queda de abril, provocada pelos anúncios de tarifas do presidente Donald Trump. Há indicadores de que os investidores estão abandonando a cautela e apostando em ganhos adicionais. O montante que os investidores estão tomando emprestado para comprar ações na Bolsa de Nova York, conhecido como dívida de margem, ultrapassou os recordes da bolha das empresas de tecnologia, atingindo um novo patamar, segundo dados da Autoridade Reguladora da Indústria Financeira. A China tem até 12 de agosto para chegar a um acordo tarifário duradouro com o governo do presidente Donald Trump Mas sinais de cansaço começam a aparecer. O último rali das ações meme pareceu perder força após poucos dias, e o Bitcoin, um dos símbolos mais visíveis da febre especulativa, caiu recentemente de suas máximas históricas. Algumas mesas de negociação de Wall Street têm aconselhado clientes a adquirir proteção descontada contra possíveis perdas. O atual rali esticou as avaliações, com o S&P 500 negociando a quase 23 vezes o lucro futuro, bem acima da média de dez anos de cerca de 18, indicando que as ações ficaram significativamente mais caras. “Estou vendo isso e começando a ficar mais cauteloso,” disse Eric Diton, presidente e diretor da Wealth Alliance. “Sou otimista no longo prazo, mas cauteloso no curto prazo. Acho que já está na hora de uma correção por causa da especulação excessiva.” Para ajudar a navegar essa volatilidade, alguns observadores do mercado buscam comparações com o momento mais famoso das ações meme em janeiro de 2021, quando GameStop Corp. e AMC Entertainment Corp. capturaram a atenção mundial. Continua depois da publicidade As duas partes buscam um acordo sobre tarifas, uma vez que o prazo da Casa Branca para impor taxas ao bloco europeu começa na sexta-feira, 1º A administração atual está assumindo participações diretas em empresas em nome da segurança nacional Aquela compra foi impulsionada por traders de varejo que receberam cheques de estímulo e estavam em casa, trocando dicas nas redes sociais. Isso ocorreu após um ano excepcional nos mercados em 2020, mas foi apenas o começo de um rali ainda maior em 2021, quando o S&P 500 subiu mais 27%. Houve, porém, uma correção em 2022, quando o índice caiu 19%, registrando o pior desempenho anual desde a grande crise financeira. “Com toda a euforia do mercado em alta e apetite por risco, esses ciclos tendem a continuar até que parem, então é notoriamente difícil prever quando isso acontece,” disse Victor Haghani, diretor de investimentos da Elm Wealth e sócio fundador da Long Term Capital Management. “Sabemos que estamos nesse ciclo, mas para mim não indica se está perto do fim ou não. A questão é quando, não se, o mercado voltará a níveis mais sensatos.” Na semana passada, houve muitos ecos da febre de 2021, com traders de varejo buscando empresas pequenas, muitas vezes problemáticas, que foram fortemente vendidas a descoberto por fundos de hedge. Alguns fatores que impulsionaram a ascensão da GameStop só se tornaram mais evidentes com a popularização do trading sem comissão e das opções de curto prazo. Continua depois da publicidade Isso se refletiu no volume de negociações da semana passada. No dia mais movimentado, 1,8 bilhão de ações da Opendoor foram negociadas, representando quase 10% de todo o volume do mercado acionário dos EUA. Em 2021, no auge, 800 milhões de ações da GameStop mudaram de mãos, embora o volume negociado em ambas as ações tenha partido de bases semelhantes, segundo dados compilados pela Bloomberg. Desta vez, porém, a empolgação pareceu surgir e desaparecer mais rapidamente, e o cenário macroeconômico é claramente diferente. As taxas de juros estão muito mais altas, o que faz os investidores anteciparem que o Federal Reserve reduzirá sua taxa básica ainda este ano, movimento que pode dar mais impulso ao rali. “Estamos em um momento em que o Fed provavelmente começará a cortar juros, apesar das avaliações altas, o que me diz que as avaliações podem até subir mais,” disse Don Calcagni, diretor de investimentos da Mercer Advisors Inc. “Se o Fed reduzir os juros, isso será um vento favorável para as ações em geral.” Continua depois da publicidade Enquanto os mercados enfrentam os níveis mais altos de tarifas impostos pela administração Trump, os acordos com a maioria dos países terminaram melhor do que o temido em abril. Além disso, a inflação parece estar controlada e o crescimento dos lucros permanece intacto. “As ações meme são meio perturbadoras, não tem como negar. Mas acho que o risco é que as pessoas foquem demais nisso,” disse Alec Young, estrategista-chefe de investimentos da Mapsignals. “Os mercados não negociam com base no que é bom ou ruim, mas no que é melhor ou pior, e em relação às notícias comerciais, todo acordo é melhor do que o precificado no início de abril.” Claro que, se o Fed não cortar os juros este ano ou se algum dos outros ventos favoráveis do mercado enfraquecer devido às tarifas ou à inflação, os mercados podem sofrer uma correção. Continua depois da publicidade “É aí que o mercado terá que fazer uma reavaliação séria,” disse Calcagni. Ainda assim, uma correção breve de alguns pontos percentuais pode ser um sinal de mercado saudável e até oferecer oportunidades para os investidores comprarem ações com desconto. “Eu veria qualquer correção de curto prazo como uma boa oportunidade de compra diante do cenário atual,” disse Ross Mayfield,",Infomoney
