url,data,titulo,texto,fonte
https://valor.globo.com/brasil/noticia/2025/06/23/anp-tem-corte-de-oramento-e-adota-medidas-emergenciais-para-reduzir-custos.ghtml,2025-06-23,ANP tem corte de orçamento e adota medidas emergenciais para reduzir custos,"23/06/2025 19h47Atualizado23/06/2025 A Agência Nacional do Petróleo, Gás Natural e Biocombustíveis (ANP) vai adotarmedidas emergenciaisa partir do dia 1º de julho para enfrentarcortes orçamentáriospromovidos pelo governo. Um decreto que entrou em vigor no último dia 30 de maio determinou bloqueio de R$ 7,1 milhões autorizados para despesas discricionárias, como viagens. A medida tambémcontingenciouR$ 27,7 milhões do orçamento da ANP. Com isso, o orçamento da agência caiu de R$ 140,6 milhões para R$ 105,7 milhões. Em nota, a ANP afirmou que a diretoria colegiada está “concentrando esforços” junto às autoridades para tentarreverter os cortese que busca recompor os limites da reguladora a níveis que permitam manter a continuidade das operações planejadas para 2025. “A redução desses recursos afetará de forma geral o funcionamento da ANP e obrigará a agência a reduzir suas atividades”, disse a ANP. Uma das medidas emergenciais será a suspensão doPrograma de Monitoramento da Qualidade dos Combustíveis(PMQC) durante o mês de julho. Também serão reduzidas despesas com diárias e passagens aéreas e a destinação de recursos parafiscalização. Reuniões de diretoria, audiências públicas, workshops, seminários e similares serão realizados remotamente, destacou a ANP. A agência ainda informou que a diretoria colegiada poderá adotar outras medidas para ajustar o nível de atividade às restrições orçamentárias em vigor. Uma das fontes do setor afirmou que uma das consequências do corte no orçamento da ANP é o aumento das fraudes, principalmente adulteração de combustíveis, com a suspensão da fiscalização de postos. Segundo a fonte, a agência já realizou movimento semelhante entre novembro e dezembro do ano passado, para adequar a operação diária aos custos. “As fraudes explodiram no período. E é o que vai acontecer agora, de novo”, disse a fonte. De acordo com a fonte, um exemplo do enfraquecimento da atuação da agência se deu no fim do ano passado, quando o Ministério Público Federal no Rio de Janeiro (MPF-RJ) pediu uma ação de fiscalização a postos de combustíveis no Estado. A resposta da ANP foi que dos cerca de 129 mil estabelecimentos autorizados pela autarquia, a capacidade de fiscalização da ANP para 2025 era de cerca de 11 mil instalações, ou 9% do total autorizado, sem contar com novos cortes orçamentários. “O trabalho da agência vem sendo enfraquecido, com cortes no orçamento e indefinição da nomeação de diretores”, disse outra fonte, esta, próxima à ANP. A ANP afirmou no comunicado que vem sofrendo restrições orçamentárias recorrentes nos últimos anos. O orçamento da agência caiu de R$ 749 milhões em 2013, cujo valor é corrigido pela inflação, para R$ 134 milhões em 2024, um corte de 82%. O movimento da ANP é o mesmo adotado por outra agência do setor de energia: a Agência Nacional de Energia Elétrica (Aneel) anunciou, na semana passada, que também reduziria “drasticamente” serviços de fiscalização, interromperia o atendimento da ouvidoria e reduziria horário de funcionamento. Acompanhe os mercados com nossas ferramentasAcessar gratuitamente Decisão permite que governo Trump retome as deportações de imigrantes para países que não sejam os seus de origem Neto. Na prática, a autoridade monetária irá vender dólares no mercado à vista e reduzir a posição de swap, que, no momento, é vendida em dólar Também foi aprovada a venda de 24% das unidades de futuro empreendimento residencial no complexo Market Place e de 16,7% do empreendimento comercial no complexo Galleria Um decreto determinou o bloqueio de R$ 34,8 milhões do orçamento da Agência Nacional do Petróleo, Gás Natural e Biocombustíveis Revisão do regulamento do Novo Mercado visa o aperfeiçoamento das regras que as empresas com o maior nível de governança corporativa devem seguir Movimento do ex-prefeito de Ribeirão Preto turbina planos de Kassab para 2026 Informações são resposta a procedimentos para averiguar se tenente-coronel fez uso indevido de redes sociais A vitória também depende de soluções de baixa tecnologia — e da integração rápida e econômica das duas Segundo ele, os países irão cumprir suas “missões finais” antes de iniciar a pausa nos combates O Brasil poderia tirar melhor proveito do cenário externo favorável de queda do dólar e do spread entre ativos americanos e bônus emergentes se tivesse feito um ajuste fiscal eficaz e convincente",Valor Econômico
https://valor.globo.com/legislacao/noticia/2025/06/23/tjsp-empresa-cobrada-por-armazenagem-de-carga-sem-autorizacao-nao-sera-restituida.ghtml,2025-06-23,TJSP: Empresa cobrada por armazenagem de carga sem autorização não será restituída,"Por Valor— São Paulo 23/06/2025 15h14Atualizado23/06/2025 ONúcleo Especializado de Justiça 4.0 – Direito Marítimodo Tribunal de Justiça de São Paulo (TJSP) negou o pedido de uma importadora derestituiçãodosvalores pagos pelo armazenamento de cargano Porto de Santos. Segundo os autos do processo, a empresa importou carga de mais de 2 toneladas de pó à base de níquel, armazenadasem contratação ou autorização prévia.Cabe recurso. Acompanhe os mercados com nossas ferramentasAcessar gratuitamente Decisão permite que governo Trump retome as deportações de imigrantes para países que não sejam os seus de origem Neto. Na prática, a autoridade monetária irá vender dólares no mercado à vista e reduzir a posição de swap, que, no momento, é vendida em dólar Também foi aprovada a venda de 24% das unidades de futuro empreendimento residencial no complexo Market Place e de 16,7% do empreendimento comercial no complexo Galleria Um decreto determinou o bloqueio de R$ 34,8 milhões do orçamento da Agência Nacional do Petróleo, Gás Natural e Biocombustíveis Revisão do regulamento do Novo Mercado visa o aperfeiçoamento das regras que as empresas com o maior nível de governança corporativa devem seguir Movimento do ex-prefeito de Ribeirão Preto turbina planos de Kassab para 2026 Informações são resposta a procedimentos para averiguar se tenente-coronel fez uso indevido de redes sociais A vitória também depende de soluções de baixa tecnologia — e da integração rápida e econômica das duas Segundo ele, os países irão cumprir suas “missões finais” antes de iniciar a pausa nos combates O Brasil poderia tirar melhor proveito do cenário externo favorável de queda do dólar e do spread entre ativos americanos e bônus emergentes se tivesse feito um ajuste fiscal eficaz e convincente",Valor Econômico
https://valor.globo.com/financas/noticia/2025/06/23/bolsas-de-ny-sobem-apos-retaliacao-iraniana-e-fala-dovish-de-vice-presidente-do-fed.ghtml,2025-06-23,Bolsas de NY sobem após retaliação iraniana e fala 'dovish' de vice-presidente do Fed,"Em alta 23/06/2025 17h09Atualizado23/06/2025 Em um dia marcado pela altavolatilidade dos ativosglobais, diante das incertezas causadas pelo conflito entre os Irã, Israel e Estados Unidos, as principaisbolsas de Nova Yorkganharam tração no decorrer da tarde desta segunda-feira (23) e se firmaram no campo positivo após oIrã atacar bases militares americanas no Catar e no Iraque. Grande parte dos agentes financeiros enxergaram a retaliação de Teerã com umcaráter “simbólico”, o que afastou parte das preocupações de fechamento do Estreito de Ormuz. O presidente dos EUA, Donald Trump, chamou a ofensiva de “muito fraca”. A postura “dovish” da vice-presidente de supervisão do Federal Reserve (Fed), Michelle Bowman, fortaleceu a percepção de divergência entre os dirigentes do banco central americano, o que deu suporte ao movimento de queda no rendimento dos Treasuries durante a manhã e, consequentemente, à alta das bolsas em Wall Street. A dirigente disse queapoiaria um corte nos juros na próxima reuniãocaso as pressões inflacionárias permaneçam contidas. Neste contexto, o índice Dow Jones teve alta de 0,89%, aos 42.581,78 pontos, no fechamento dos mercados à vista. O S&P 500 avançou 0,96%, aos 6.025,19 pontos; enquanto o Nasdaq subiu 0,94%, aos 19.630,98 pontos. No mercado de renda fixa, o rendimento da T-note de 2 anos caía para 3,870%, de 3,916% no fechamento anterior, próximo às 17h45 (horário de Brasília). Já os juros da T-note de 10 anos cediam para 4,344%, de 4,383% no fechamento anterior. Ambas se afastaram das mínimas do dia após o ataque do Irã. As falas de Bowman, que votou pela manutenção dos Fed Funds na última reunião da autarquia, se somaram à percepção de divergência entre os dirigentes do Fed sobre a condução da política monetária, especialmente após Christopher Waller se mostrar mais “dovish”, enquanto Thomas Barkin, do Fed de Richmond, mostrou um comportamento mais “hawkish” na semana passada. Adivergência entre os dirigentesjá havia sido mostrada no gráfico de pontos divulgado na semana passada. A projeção mostrou que há 10 membros que acreditam que reduções de 0,50 pontos percentuais (p.p.) ou 0,75 p.p. seriam apropriados neste ano, enquanto outros dois prefeririam apenas 0,25 p.p. e sete propuseram a manutenção das taxas. A percepção de que o ataque do Irã teve caráter simbólico também afetou o desempenho do petróleo hoje. O Brent (referência mundial) para agosto caiu 7,18%, a US$ 71,48 por barril, na ICE. O WTI (referência dos Estados Unidos) com vencimento para o mesmo mês perdeu 7,22%, a US $68,51 por barril, na Nymex. Apesar da queda acentuada, há um sentimento de que o pior cenário no Oriente Médio está longe de ser precificado. “Se as exportações de petróleo iraniano forem reduzidas pela metade, esperamos que o Brent atinja US$ 85 por barril e, no pior cenário, de uma conflagração mais ampla, esperamos que os preços ultrapassem US$ 100 por barril”, disseram os profissionais do Barclays, liderados por Amarpreet Singh. Ainda assim, o banco britânico não alterou seu cenário-base devido à incerteza elevada sobre o conflito, e projeta que o Brent terminará o ano em torno de US$ 66 caso não haja interrupção de suprimentos. A crescente expectativa dos agentes financeiros por um corte nos Fed Funds na próxima reunião somada à queda do petróleo levou o dólar no exterior a reverter o movimento de alta visto no início do pregão. O índice DXY, que mede o desempenho da divisa americana frente a seis moedas fortes, tinha queda de 0,33%, aos 98,38 pontos, no horário citado acima. Acompanhe os mercados com nossas ferramentasAcessar gratuitamente Decisão permite que governo Trump retome as deportações de imigrantes para países que não sejam os seus de origem Neto. Na prática, a autoridade monetária irá vender dólares no mercado à vista e reduzir a posição de swap, que, no momento, é vendida em dólar Também foi aprovada a venda de 24% das unidades de futuro empreendimento residencial no complexo Market Place e de 16,7% do empreendimento comercial no complexo Galleria Um decreto determinou o bloqueio de R$ 34,8 milhões do orçamento da Agência Nacional do Petróleo, Gás Natural e Biocombustíveis Revisão do regulamento do Novo Mercado visa o aperfeiçoamento das regras que as empresas com o maior nível de governança corporativa devem seguir Movimento do ex-prefeito de Ribeirão Preto turbina planos de Kassab para 2026 Informações são resposta a procedimentos para averiguar se tenente-coronel fez uso indevido de redes sociais A vitória também depende de soluções de baixa tecnologia — e da integração rápida e econômica das duas Segundo ele, os países irão cumprir suas “missões finais” antes de iniciar a pausa nos combates O Brasil poderia tirar melhor proveito do cenário externo favorável de queda do dólar e do spread entre ativos americanos e bônus emergentes se tivesse feito um ajuste fiscal eficaz e convincente",Valor Econômico
https://valor.globo.com/financas/noticia/2025/06/23/ouro-fecha-em-alta-com-mercado-atento-a-escalada-nas-tensoes-no-oriente-medio.ghtml,2025-06-23,Ouro fecha em alta com mercado atento à escalada nas tensões no Oriente Médio,"Em alta Por Valor— São Paulo 23/06/2025 15h44Atualizado23/06/2025 Os contratos futuros de ouro fecharam em alta nesta segunda-feira (23) diante de uma perda de fôlego do dólar nos mercados internacionais e de uma escalada nas tensões no Oriente Médio. Na Comex, divisão de metais da New York Mercantile Exchange (Nymex), o ouro para entrega em agosto fechou em alta de 0,27%, negociado a US$ 3.395,00 por onça-troy. Acompanhe os mercados com nossas ferramentasAcessar gratuitamente Decisão permite que governo Trump retome as deportações de imigrantes para países que não sejam os seus de origem Neto. Na prática, a autoridade monetária irá vender dólares no mercado à vista e reduzir a posição de swap, que, no momento, é vendida em dólar Também foi aprovada a venda de 24% das unidades de futuro empreendimento residencial no complexo Market Place e de 16,7% do empreendimento comercial no complexo Galleria Um decreto determinou o bloqueio de R$ 34,8 milhões do orçamento da Agência Nacional do Petróleo, Gás Natural e Biocombustíveis Revisão do regulamento do Novo Mercado visa o aperfeiçoamento das regras que as empresas com o maior nível de governança corporativa devem seguir Movimento do ex-prefeito de Ribeirão Preto turbina planos de Kassab para 2026 Informações são resposta a procedimentos para averiguar se tenente-coronel fez uso indevido de redes sociais A vitória também depende de soluções de baixa tecnologia — e da integração rápida e econômica das duas Segundo ele, os países irão cumprir suas “missões finais” antes de iniciar a pausa nos combates O Brasil poderia tirar melhor proveito do cenário externo favorável de queda do dólar e do spread entre ativos americanos e bônus emergentes se tivesse feito um ajuste fiscal eficaz e convincente",Valor Econômico
https://valor.globo.com/financas/noticia/2025/06/23/goolsbee-do-fed-diz-que-tarifas-comerciais-nao-tiveram-o-impacto-esperado-ate-o-momento.ghtml,2025-06-23,"Goolsbee, do Fed, diz que tarifas comerciais não tiveram o impacto esperado até o momento","Em alta Por Reuters— Nova York 23/06/2025 16h01Atualizado23/06/2025 O presidente da unidade de Chicago do Federal Reserve (Fed, o banco central americano), Austan Goolsbee, disse nesta segunda-feira que, até o momento, o aumento das tarifas comerciais teve um impacto mais modesto sobre a economia dos Estados Unidos em relação ao que era esperado. Acompanhe os mercados com nossas ferramentasAcessar gratuitamente Um decreto determinou o bloqueio de R$ 34,8 milhões do orçamento da Agência Nacional do Petróleo, Gás Natural e Biocombustíveis Revisão do regulamento do Novo Mercado visa o aperfeiçoamento das regras que as empresas com o maior nível de governança corporativa devem seguir Movimento do ex-prefeito de Ribeirão Preto turbina planos de Kassab para 2026 Informações são resposta a procedimentos para averiguar se tenente-coronel fez uso indevido de redes sociais A vitória também depende de soluções de baixa tecnologia — e da integração rápida e econômica das duas Segundo ele, os países irão cumprir suas “missões finais” antes de iniciar a pausa nos combates O Brasil poderia tirar melhor proveito do cenário externo favorável de queda do dólar e do spread entre ativos americanos e bônus emergentes se tivesse feito um ajuste fiscal eficaz e convincente Decisão, segundo a empresa, visa ampliar sua transparência, consolidar sua base acionária e alinhar-se às melhores práticas do mercado de capitais Pela primeira vez uma empresa brasileira emitiu dívida de 40 anos no mercado internacional Presidente tem feito reiteradas críticas a Netanyahu por atuação militar na Faixa de Gaza",Valor Econômico
https://valor.globo.com/eu-e/noticia/2025/06/23/os-melhores-livros-de-economia-de-2025-ate-agora.ghtml,2025-06-23,Os melhores livros de economia de 2025 (até agora),"23/06/2025 15h07Atualizado23/06/2025 “Stellar: A World Beyond Limits, and How to Get There” de James Arbib e Tony Seba (Stellar) Acompanhe os mercados com nossas ferramentasAcessar gratuitamente Decisão permite que governo Trump retome as deportações de imigrantes para países que não sejam os seus de origem Neto. Na prática, a autoridade monetária irá vender dólares no mercado à vista e reduzir a posição de swap, que, no momento, é vendida em dólar Também foi aprovada a venda de 24% das unidades de futuro empreendimento residencial no complexo Market Place e de 16,7% do empreendimento comercial no complexo Galleria Um decreto determinou o bloqueio de R$ 34,8 milhões do orçamento da Agência Nacional do Petróleo, Gás Natural e Biocombustíveis Revisão do regulamento do Novo Mercado visa o aperfeiçoamento das regras que as empresas com o maior nível de governança corporativa devem seguir Movimento do ex-prefeito de Ribeirão Preto turbina planos de Kassab para 2026 Informações são resposta a procedimentos para averiguar se tenente-coronel fez uso indevido de redes sociais A vitória também depende de soluções de baixa tecnologia — e da integração rápida e econômica das duas Segundo ele, os países irão cumprir suas “missões finais” antes de iniciar a pausa nos combates O Brasil poderia tirar melhor proveito do cenário externo favorável de queda do dólar e do spread entre ativos americanos e bônus emergentes se tivesse feito um ajuste fiscal eficaz e convincente",Valor Econômico
https://valor.globo.com/brasil/noticia/2025/06/23/balanca-comercial-brasileira-tem-superavit-de-us-1126-bi-na-3a-semana-de-junho.ghtml,2025-06-23,"Balança comercial brasileira tem superávit de US$ 1,126 bi na 3ª semana de junho","Por Valor— São Paulo 23/06/2025 15h30Atualizado23/06/2025 Abalança comercial brasileiraregistrousuperávitde US$ 1,126 bilhão na terceira semana de junho, informou a Secretaria de Comércio Exterior do Ministério do Desenvolvimento, Indústria, Comércio e Serviços (Secex/Mdic). O valor é resultado de US$ 5,519 bilhões em exportações e de US$ 4,393 bilhões em importações. Em junho, o saldo das transações comerciais brasileiras com outros países está positivo em US$ 4,176 bilhões. No ano, totaliza US$ 28,61 bilhões. A média diária de exportações até a terceira semana do mês caiu 0,6%, na comparação com junho de 2024, para US$ 1,428 bilhão. A retração foi impulsionada pelas exportações do setoragropecuário(-12,2%), seguidas daindústria extrativa(-5,2%). Em contrapartida, as vendas daindústria de transformaçãocresceram 7,5%. Já a média diária de importações até a terceira semana de junho subiu 0,9% para US$ 1,130 bilhão, sobre igual mês do ano passado. O crescimento foi sustentado pelas compras da indústria de transformação (+1,5%). Em contrapartida houve recuo de 7,8% nos desembarques da agropecuária e de 5,2% da indústria extrativa. Acompanhe os mercados com nossas ferramentasAcessar gratuitamente Decisão permite que governo Trump retome as deportações de imigrantes para países que não sejam os seus de origem Neto. Na prática, a autoridade monetária irá vender dólares no mercado à vista e reduzir a posição de swap, que, no momento, é vendida em dólar Também foi aprovada a venda de 24% das unidades de futuro empreendimento residencial no complexo Market Place e de 16,7% do empreendimento comercial no complexo Galleria Um decreto determinou o bloqueio de R$ 34,8 milhões do orçamento da Agência Nacional do Petróleo, Gás Natural e Biocombustíveis Revisão do regulamento do Novo Mercado visa o aperfeiçoamento das regras que as empresas com o maior nível de governança corporativa devem seguir Movimento do ex-prefeito de Ribeirão Preto turbina planos de Kassab para 2026 Informações são resposta a procedimentos para averiguar se tenente-coronel fez uso indevido de redes sociais A vitória também depende de soluções de baixa tecnologia — e da integração rápida e econômica das duas Segundo ele, os países irão cumprir suas “missões finais” antes de iniciar a pausa nos combates O Brasil poderia tirar melhor proveito do cenário externo favorável de queda do dólar e do spread entre ativos americanos e bônus emergentes se tivesse feito um ajuste fiscal eficaz e convincente",Valor Econômico
https://valor.globo.com/financas/noticia/2025/06/23/sparta-reabre-fundo-de-incentivadas-suspenso-h-mais-um-ano-aps-mp-tributar-papis.ghtml,2025-06-23,"Sparta reabre fundo de incentivadas fechado há mais um ano, após MP tributar papéis","Em alta 23/06/2025 14h38Atualizado23/06/2025 Na esteira da medida provisória que prevê cobrança de Imposto de Renda sobre debêntures incentivadas emitidas a partir de 2026, a Sparta reabre nesta terça-feira para captação seu fundo Sparta Deb Inc, fechado desde março de 2024. Acompanhe os mercados com nossas ferramentasAcessar gratuitamente Um decreto determinou o bloqueio de R$ 34,8 milhões do orçamento da Agência Nacional do Petróleo, Gás Natural e Biocombustíveis Revisão do regulamento do Novo Mercado visa o aperfeiçoamento das regras que as empresas com o maior nível de governança corporativa devem seguir Movimento do ex-prefeito de Ribeirão Preto turbina planos de Kassab para 2026 Informações são resposta a procedimentos para averiguar se tenente-coronel fez uso indevido de redes sociais A vitória também depende de soluções de baixa tecnologia — e da integração rápida e econômica das duas Segundo ele, os países irão cumprir suas “missões finais” antes de iniciar a pausa nos combates O Brasil poderia tirar melhor proveito do cenário externo favorável de queda do dólar e do spread entre ativos americanos e bônus emergentes se tivesse feito um ajuste fiscal eficaz e convincente Decisão, segundo a empresa, visa ampliar sua transparência, consolidar sua base acionária e alinhar-se às melhores práticas do mercado de capitais Pela primeira vez uma empresa brasileira emitiu dívida de 40 anos no mercado internacional Presidente tem feito reiteradas críticas a Netanyahu por atuação militar na Faixa de Gaza",Valor Econômico
https://valor.globo.com/mundo/noticia/2025/06/23/analise-com-ataque-simbolico-a-base-dos-eua-ira-sinaliza-disposicao-de-conter-conflito.ghtml,2025-06-23,"Análise: Com ataque simbólico a base dos EUA, Irã sinaliza disposição de conter conflito","23/06/2025 16h46Atualizado23/06/2025 OIrã atacou hoje uma base militar americana no Catar, em retaliação ao ataque americano de sábado contra instalações nucleares iranianas. O ataque eleva a tensão no Oriente Médio, tanto que o preço do petróleo subiu em seguida. Mas parece ter sido uma resposta cuidadosamente pensada por Teerã para sinalizar a disposição de evitar uma escalada militar. Após o ataque, o país deu a entender que negociações podem recomeçar. Acompanhe os mercados com nossas ferramentasAcessar gratuitamente Decisão permite que governo Trump retome as deportações de imigrantes para países que não sejam os seus de origem Neto. Na prática, a autoridade monetária irá vender dólares no mercado à vista e reduzir a posição de swap, que, no momento, é vendida em dólar Também foi aprovada a venda de 24% das unidades de futuro empreendimento residencial no complexo Market Place e de 16,7% do empreendimento comercial no complexo Galleria Um decreto determinou o bloqueio de R$ 34,8 milhões do orçamento da Agência Nacional do Petróleo, Gás Natural e Biocombustíveis Revisão do regulamento do Novo Mercado visa o aperfeiçoamento das regras que as empresas com o maior nível de governança corporativa devem seguir Movimento do ex-prefeito de Ribeirão Preto turbina planos de Kassab para 2026 Informações são resposta a procedimentos para averiguar se tenente-coronel fez uso indevido de redes sociais A vitória também depende de soluções de baixa tecnologia — e da integração rápida e econômica das duas Segundo ele, os países irão cumprir suas “missões finais” antes de iniciar a pausa nos combates O Brasil poderia tirar melhor proveito do cenário externo favorável de queda do dólar e do spread entre ativos americanos e bônus emergentes se tivesse feito um ajuste fiscal eficaz e convincente",Valor Econômico
