url,data,titulo,texto,fonte
https://exame.com/casual/byd-tem-35-mil-emplacamentos-do-dolphin-mini-modelo-100-feito-no-brasil/,2025-07-04,"BYD tem 35 mil emplacamentos do Dolphin Mini, modelo 100% feito no Brasil","BYD Dolphin Mini, carro elétrico mais vendido no Brasil (BYD /Divulgação) Redator Publicado em4 de julho de 2025 às19h53. A montadora de carros elétricosBYDinformou nesta sexta-feira, 4, que seu novo modelo,oDolphin Mini,alcançou a marca de 35 mil emplacamentos. O modelo, lançado em fevereiro de 2024, é o primeiro veículo 100% elétrico produzido no Brasil. Fabricado na nova fábrica da BYD, em Camaçari, na Bahia,o Dolphin Minilidera as vendas na categoria de carros elétricos no país.O vice-presidente sênior da companhia, Alexandre Baldy, comemorou o feito. “Alcançar 35 mil carros vendidos é algo muito importante para nós e encerra uma semana inesquecível, em que fica eternizado como o primeiro BYD feito por brasileiros na nossa fábrica em Camaçari”, disse ele no comunicado. A unidade produtiva de Camaçari ainda passa por um período experimental e não opera em sua capacidade total, o que só deverá acontecer nas próximas fases. A capacidade instalada atualmente é de 150 mil veículos por ano, podendo até dobrar no futuro, o que a ajudará a exportar para outros países da América Latina. Entre os dias 11 e 13 de julho, o Autódromo de Interlagos será palco de uma das corridas mais emocionantes do calendário internacional: a Rolex 6 Horas São Paulo Na Pinacoteca, a exposição ""Flávio Império: tens a vontade e ela é livre"" revela a produção do artista transdisciplinar Na HBO, estreia do longa ""Pecadores"", com Michael B. Jordan interpretando dois irmãos gêmeos Quer transformar seu lar em um refúgio acolhedor neste inverno? Aposte nessas dicas de produtos. Afinal, o frio pode até ser inevitável — mas o desconforto não precisa ser 01 02 03 exame no whatsapp Receba as notícias da Exame no seu WhatsApp Nos acontecimentos mais relevantes do Brasil e mundo. E-mail inválido Desperta",Exame
https://exame.com/carreira/renato-gaucho-6-licoes-e-1-antilicao-de-gestao-de-pessoas-direto-do-vestiario/,2025-07-04,Renato Gaúcho: 6 lições (e 1 antilição) de gestão de pessoas direto do vestiário,"Renato não costuma expor jogadores. Em derrotas, assume a responsabilidade (Paul Ellis / AFP) Redação Exame Publicado em4 de julho de 2025 às19h23. Última atualização em4 de julho de 2025 às20h06. Renato Portaluppi, o técnico doFluminense,está em alta após uma nova vitória noMundial de Clubes. Com folha salarial próxima de 10% de seu adversário, levou oFluminense à vitória contra o saudita Al-Hilal. Nos últimos dias, passou a ser alvo de reportagens da imprensa internacional e voltou a virar pauta no Brasil graças a inúmeras histórias de quem tem mais de 40 anos de futebol. Carismático e polêmico,Renato Gaúcho, como é conhecido, sempre foi daquelas figuras respeitadas, mas tidas como folclóricas. Conquistou títulos relevantes como treinador no Fluminense e no Grêmio (onde tem uma estátua, inclusive), mas sempre foi tratado com alguma desconfiança por especialistas e jornalistas. Nunca foi cogitado como candidato real à seleção brasileira. Demitido pelo Grêmio, assumiu o Fluminense em abril deste ano e em três meses de trabalho levou o clube à maior campanha de sua história. É uma ótima oportunidade para mergulhar nas lições de vida e gestão de pessoas do técnico. Seu estilo informal esconde uma habilidade: Renato entende de gente. E, por isso, seu jeito de conduzir equipes oferece lições valiosas para líderes empresariais que querem melhorar sua relação com seus times. Renato é conhecido por manter uma relação próxima com os atletas. Conversa individualmente, percebe o momento de cada um e evita tratar o grupo como massa homogênea. Neste mundial, por exemplo, defendeu o centroavante Everaldo, criticado pela fase sem gols. “Daqui a pouco vai cair nas graças da torcida. Hoje não está fazendo gols, mas taticamente tem sido muito importante para o nosso time”, disse em uma coletiva. Lição: Gente precisa ser tratada como gente. Gestores que se interessam pela individualidade de seus colaboradores criam confiança e extraem o melhor de cada um. Renato evita o microgerenciamento. Dá liberdade a jogadores-chave para que criem e decidam dentro de campo — e cobra resultado com base nessa confiança. Neste mundial, por exemplo, abriu caminho para Thiago Silva definir a estratégia para a reta final contra a Inter de Milão – deixando Árias livre da necessidade de marcar. “Às vezes quem está lá vê algo que o treinador não está vendo”, disse. Lição: Autonomia fortalece a responsabilidade. Quando o líder acredita no potencial da equipe, ela responde com mais entrega e criatividade. Nos bastidores, Renato é lembrado por resolver conflitos com conversas francas. Publicamente, é direto, mas sabe dosar sinceridade com carisma — e evita rodeios. Lição: Comunicação assertiva e humana evita ruídos, desmobiliza conflitos e fortalece vínculos de confiança dentro da equipe. Mesmo em semanas decisivas, o clima com Renato tende a ser descontraído. Ele sabe que ambiente tenso paralisa — e que a leveza pode ser uma aliada da performance. Neste mundial, por exemplo, aparece em posts feitos por sua filha, Carol, jogando tênis de mesa na concentração. Lição: Ambientes tóxicos minam produtividade. Um bom clima de trabalho é tão importante quanto metas claras. Renato não costuma expor jogadores. Em derrotas, assume a responsabilidade. Neste mundial, após dificuldades contra Ulsan e Mamelodi, sempre enfatizou: “eu sei o que estou fazendo”. Em vitórias, valoriza o grupo. Isso fortalece o senso de pertencimento. Lição: Um líder que protege sua equipe conquista lealdade. Delegar a culpa é um atalho para perder autoridade moral Renato adora dizer que aprendeu o jogo na prática. Brinca com seu “DVD” de melhores lances para mostrar aos jogadores que fala com propriedade. E fala mesmo: foi campeão como jogador e técnico — e entende o que é estar lá dentro. Lição: Líderes que conhecem o dia a dia da operação inspiram mais respeito. A experiência prática, quando bem aplicada, se transforma em autoridade legítima. Aqui, uma antilição do técnico. Renato gosta de dizer que “quem sabe, sabe; quem não sabe, estuda”. É uma forma de proteger o lado lúdico e a experiência do futebol brasileiro contra o avanço do futebol europeu nos últimos anos Antilição: Leveza e experiência podem ser equilibrados com inovação e humildade para abraçar o novo. O risco, aqui, é que grandes vitórias, ou grandes sucessos empresariais, seguem os líderes diante dos desafios do futuro. Podemos também ter uma visão de como certos conceitos de carreira seriam analisados pelo Renato técnico e pelo Renato CEO. Regulação emocional é a competência-chave para o sucesso e a criatividade no trabalho Estudo da IBM revela avanço estratégico da IA nas empresas do Brasil, com foco em inovação e ROI Com esse comando, o ChatGPT transforma qualquer assunto em uma explicação simples, clara e fácil de entender Com foco em retenção, precificação e diversificação, empreendedora transformou um negócio que mal lucrava em uma máquina milionária 01 02 03 exame no whatsapp Receba as notícias da Exame no seu WhatsApp Nos acontecimentos mais relevantes do Brasil e mundo. E-mail inválido Desperta",Exame
https://exame.com/marketing/loco-abreu-vira-el-responsavel-em-campanha-da-betano-sobre-jogo-responsavel/,2025-07-04,Loco Abreu vira 'El Responsável' em campanha da Betano sobre jogo responsável,"Em nova campanha da Betano, Loco Abreu assume o papel de “El Responsável” e protagoniza ações sobre limites e autocontrole nas apostas esportivas (Reprodução/YouTube) Redação Exame Publicado em4 de julho de 2025 às18h35. Última atualização em4 de julho de 2025 às19h22. ABetanolançou uma campanha sobre jogo responsável com o ex-jogador uruguaioLoco Abreucomoembaixador. A empresa quer promover a educação sobreapostas esportivas, reforçando o caráter de entretenimento e afastando a ideia de investimento. Loco Abreu, conhecido pelo estilo irreverente e por recordes no futebol, passa a se chamar “El Responsável” na campanha. Com o slogan “Não mete o Loco”, o filme principal tem 60 segundos e traz o jogador falando em portunhol para alertar sobre limites de tempo e controle nas apostas. No site da campanha, a empresa ainda compartilhará conteúdos educativos sobre o tema, com orientações para respeitar limites e saber quando parar. “Trouxemos uma abordagem leve e descontraída, que vai prender a atenção do nosso público para falar de um assunto sério, com o qual a Betano está comprometida desde o início de suas operações, que é o jogo responsável”, dizArthur Niggemann, senior marketing manager para Américas da Betano. A campanha, criada pela agênciaWieden+Kennedy São Paulo, estreou no Brasil no intervalo doJornal Nacional, daTV Globo, e será veiculada também no Peru, México, Chile, Colômbia, Equador e Argentina. A comunicação terá três fases, incluindo mídia exterior próxima a estádios, conteúdo em redes sociais e inserções durante transmissões de futebol na TV aberta e por assinatura. Loco Abreu também mudará seu nome nas redes para “El Responsável Abreu” e publicará vídeos educativos. Além da campanha, a plataforma afirmou que vai reforçar recursos para controle do jogo, como limites financeiros e de tempo, cronômetros de sessão, opções de autoexclusão temporária e permanente, time-out, e links para entidades de apoio a jogadores. Segundo a Betano, as mensagens “Um bom jogador sabe a hora de parar” e “Respeitar os limites faz parte do jogo” serão destacadas em ações online e presenciais. A Betano opera no Brasil comnaming rightsem algumas das principais competições do calendário esportivo nacional, como oBrasileirão Betano, aCopa Betano do Brasile aSupercopa Betano Rei 2025. A marca é uma das frentes doKaizen Gaming Group, empresa com sede na Grécia, fundada em 2012, que atua no setor de apostas esportivas e jogos online. Atualmente presente em 19 países, o grupo é apontado como uma das empresas que mais crescem no setor de apostas online na Europa e projeta expandir sua atuação para 26 mercados até 2026. O crescimento recente foi impulsionado principalmente pelo desempenho em mercados como Brasil, México, Argentina, Reino Unido, Dinamarca e Colômbia. A Betano tem sido a principal marca do grupo, com forte presença em países como Brasil, Portugal e Alemanha. Na América Latina, a empresa ampliou sua atuação no Brasil após a regulamentação oficial do setor, em janeiro de 2025. No patrocínio esportivo, a Kaizen Gaming aposta em grandes eventos e clubes de futebol com visibilidade global. Em 2024, a Betano foi patrocinadora oficial de torneios como aUefa Euro 2024e aConmebol Copa América. A marca também mantém parceria com aUefa Europa Leaguee aUefa Conference Leagueaté a temporada 2026/27. Entre os clubes patrocinados estão oAston Villa(Inglaterra), com contrato de máster e marca estampada na camisa desde 2024; oBayern de Munique(Alemanha), com parceria de três anos iniciada em 2025/26; e oRiver Plate(Argentina), que passou a contar com a Betano como patrocinadora máster em 2025. O mercado de apostas esportivas no Brasil vive um momento de transformação neste ano, com a entrada em vigor daregulamentação oficial do setor. Levantamento do Itaú Unibanco apontou que, entre junho de 2023 e junho de 2024, o valor movimentado em apostas esportivas ultrapassou R$ 115 bilhões no país. Desde 1º de janeiro de 2025, apenas operadores autorizados pelaSecretaria de Prêmios e Apostas (SPA), órgão vinculado aoMinistério da Fazenda, podem atuar legalmente no país. Empresas não autorizadas tiveram suas atividades encerradas e estão proibidas de fazer publicidade e patrocínios. Entre as regras para as operadoras estão, por exemplo, a obrigatoriedade de sede e atendimento no Brasil, uso exclusivo de domínio “.bet.br” para sites autorizados, e restrições nos meios de pagamento, que agora aceitam apenas boleto bancário e Pix. Políticas contra lavagem de dinheiro, manipulação de resultados e incentivo ao jogo responsável também são exigidas. Atualmente, 73 empresas estão autorizadas, somando 162 sites legalizados, além de outras oito empresas que atuam por decisão judicial, ligadas a 18 marcas. Conforme mostrou a EXAME, no combate a bets ilegais,o governo já derrubou 11 mil sites e planeja publicidade para conscientização. No campo dapublicidade, está em discussão naCâmaraum projeto de lei que impõe novas restrições às campanhas de apostas esportivas. O texto,já aprovado no Senado, proíbe, por exemplo, o uso de atletas, ex-atletas com menos de cinco anos de aposentadoria, artistas, influenciadores, autoridades e personagens infantis em peças publicitárias. Também veda a exibição de anúncios que associem apostas a ganhos fáceis ou como forma de renda, bem como a promoção de bônus ou cotações em tempo real durante transmissões ao vivo. A proposta estabelece horários restritos para veiculação de publicidade em rádio, TV e internet, permitindo apenas durante transmissões esportivas, com janela de 15 minutos antes e depois dos eventos. Mensagens promocionais sem consentimento prévio do usuário e a veiculação de publicidade para menores de idade também estão entre as práticas que podem ser proibidas. A medida ainda precisa ser aprovada pela Câmara dos Deputados e sancionada pela Presidência para entrar em vigor. Ementrevista exclusiva à EXAME, o secretário de Prêmios e Apostas,Regis Dudena, afirmou que o receio com a proibição da publicidade é que, ao proibir totalmente, a população perca o critério de identificação de empresas autorizadas. ""A publicidade é uma das formas de distinguir as empresas autorizadas. O Conar tem sido um parceiro importante, regulando toda a cadeia publicitária"", disse Dudena. No âmbito econômico, mais de 60% das propagandas exibidas durante os jogos do Brasileirão são de casas de apostas, e todos os clubes da Série A contam com ao menos um patrocinador do setor. Como mostrou a EXAME em",Exame
https://exame.com/esporte/mundial-de-clubes-2025-veja-quanto-o-fluminense-vai-ganhar-apos-vencer-o-al-hilal/,2025-07-04,Mundial de Clubes 2025: veja quanto o Fluminense vai ganhar depois de vencer o Al-Hilal,"Flu aguarda o vencedor da partida entre Palmeiras e Chelsea (Chandan Khana / AFP) Repórter Publicado em4 de julho de 2025 às18h16. Última atualização em4 de julho de 2025 às19h07. OFluminensesegurou os nervos durante a partida, aproveitou as oportunidades e conseguiu vencer oAl-Hilalnesta sexta-feira por 2 a 1, se classificando para a semifinal doMundial de Clubes. Martinelli abriu o placar aos 40 minutos do primeiro tempo depois de belo chute no ângulo. O brasileiro Marcos Leonardo igualou a partida após cobrança de escanteio. A jovem revelação Hércules, que já tinha marcado contra a Inter de Milão nas oitavas, anotou novamente depois de toque com categoria no canto do goleiro adversário. Até o jogo contra os sauditas, o Tricolor tinha engordado seus cofres emUS$ 39,835 milhões (R$ 215,7 milhões). Agora, na semifinal, o Flu embolsou mais US$ 21 milhões (R$ 113,8) milhões. Portanto, os comandados de Renato Gaúcho ganharam até agora R$ 329,6 milhões no torneio — que é aquele que mais distribuiu prêmios na história do futebol. *Os valores referem-se ao acumulado de premiação até o dia 04/07/2025 Com controle do PIF e apoio de Mohammed bin Salman, o Al-Hilal se torna uma potência global com ambições esportivas e políticas Para se destacar entre os principais clubes europeus, que dominam o torneio, os clubes precisam investir valores bilionários Com gols decisivos de Marcos Leonardo e Malcom, o Al-Hilal surpreende o Manchester City e avança às quartas do Mundial de Clubes 2025 Com brasileiros como Marcos Leonardo e Malcom em alta, o Al-Hilal chega com força para enfrentar o Fluminense no Mundial de Clubes 2025 nesta sexta-feira 01 02 03 exame no whatsapp Receba as notícias da Exame no seu WhatsApp Nos acontecimentos mais relevantes do Brasil e mundo. E-mail inválido Desperta",Exame
https://exame.com/invest/guia/quais-transacoes-financeiras-tem-iof-entenda-como-calcular-a-taxa/,2025-07-04,Quais transações financeiras têm IOF? Entenda como calcular a taxa,"Entre maio e junho, o governo federal tentou aumentar as alíquotas do IOF através de três decretos diferentes. O objetivo era arrecadar mais R$ 20 bilhões em 2025 para cumprir a meta fiscal do país. (Image Source/Getty Images) Colaboradora Publicado em4 de julho de 2025 às18h15. Já reparou naquela cobrança extra quando usa cartão no exterior? Ou por que o empréstimo vem com valor menor do que o solicitado? Todos esses custos têm o mesmo responsável: oIOF. Apesar de estar presente na rotina financeira de milhões de brasileiros, poucas pessoas sabem exatamente como ele funciona. O assunto ganha ainda mais relevância em 2025,após o governo e o Congresso colocarem o IOF no centro de uma intensa disputa institucional. OIOF- Imposto sobre Operações Financeiras - é um tributo federal que incide sobre diversas transações financeiras realizadas por pessoas físicas e jurídicas no Brasil. Contudo, seu nome completo revela sua abrangência: ""Imposto sobre Operações de Crédito, Câmbio e Seguro, ou relativas a Títulos ou Valores Mobiliários"". Criado em 1966, oIOF funciona como uma ferramenta de regulação econômica. Quando o governo quer desestimular empréstimos para controlar a inflação,pode aumentar a alíquota por decreto. Dessa forma, o crédito fica mais caro e menos pessoas pegam empréstimos, reduzindo o dinheiro circulante na economia. Para o seu bolso, isso significa um custo adicional em operações como empréstimos, compras no exterior, seguros e alguns investimentos. Além disso, diferentemente dos juros - que podem ser negociados -, oIOFé obrigatório e não há como escapar dele quando aplicável. O imposto incide sobre cinco categorias principais de operações financeiras: Toda compra realizada no exterior - seja em loja física ou online - está sujeita aoIOF sobre operações de câmbio. A alíquota atual é de 3,38%, aplicada sobre o valor convertido em reais na sua fatura. O imposto incide no momento do processamento da fatura, quando a operadora converte a moeda estrangeira para reais usando a taxa de câmbio do dia. Por exemplo, uma compra de US$ 100 que vira R$ 550 na fatura terá IOF de R$ 18,59 (3,38% de R$ 550). Vale destacar que isso se aplicatanto a compras presenciais quanto a plataformas internacionaiscomo Amazon, AliExpress e outras lojas online estrangeiras. Quem planeja viajar eprecisa de dólares ou euros em espéciepaga 1,1% deIOFsobre o valor dacompra de moeda estrangeira. Já na venda de moeda estrangeira - quando você volta da viagem e quer converter as sobras -, a alíquota é menor: 0,38%. Essa diferença reflete a política econômica: o governo prefere desencorajar a saída de divisas (compra de moeda estrangeira) e incentivar a entrada (venda de moeda estrangeira). Sacar dinheiro com cartão de créditoé considerado uma operação de crédito, sujeita ao IOF tanto no Brasil quanto no exterior. No país, você paga uma alíquota fixa sobre o valor sacado mais uma taxa diária sobre o saldo devedor (limitada a 30 dias). No exterior, o saque tem dupla tributação: como operação de crédito e também como operação de câmbio, totalizando uma carga tributária significativa. Por isso, especialistas recomendam evitar essa prática sempre que possível. Empréstimos pessoais efinanciamentosestão sujeitos ao IOFno momento da contratação. O imposto é composto por uma alíquota fixa sobre o valor total mais uma taxa diária sobre o saldo devedor, limitada a 30 dias. Contudo, existe uma exceção importante:financiamentos imobiliários residenciais são isentos de IOF. Essa isenção visa facilitar oacesso à casa própria, reduzindo os custos envolvidos na aquisição de imóveis. Ocheque especiale o crédito rotativo do cartão são operações de crédito que geram IOF. O imposto incide quando você utiliza essas linhas de crédito, sendo calculado sobre o valor usado. Dessa forma,além dos juros elevados característicos dessas modalidades, você ainda paga IOF, tornando essas opções ainda mais caras. É mais um motivo para evitar o uso prolongado do cheque especial ou do rotativo. OIOF sobre investimentossegue uma regra específica: só incide em resgates feitos em menos de 30 dias da aplicação. O imposto é cobrado apenas sobre o rendimento (lucro), não sobre o valor principal investido. Investimentos como CDBs, Tesouro Direto, fundos DI e de curto prazo seguem uma tabela regressiva: quanto mais tempo o dinheiro fica aplicado, menor o IOF, chegando a zero no 30º dia. Por outro lado, LCAs, LCIs, ações e fundos imobiliários são totalmente isentos de IOF. A contratação de qualquer tipo de seguro- vida, saúde, automóvel, residencial ou viagem - está sujeita aoIOF. O imposto incide sobre o valor do prêmio (custo do seguro) pago à seguradora. O IOF é aplicado no momento da contratação ou no pagamento de cada parcela, caso o prêmio seja parcelado. Geralmente, o valor já vem embutido no preço final apresentado pela seguradora. As alíquotas do IOF variam conforme o tipo de operação e podem ser fixas ou regressivas. Paracompras internacionais com cartão, a taxa é de 3,38%. Na compra de moeda em espécie, 1,1%. Em empréstimos para pessoas jurídicas, até 1,88% ao ano. O governo pode alterar essas alíquotas por decreto, sem necessidade de aprovação do Congresso - característica que gerou a recente crise institucional. Confira a tabela atual: Para investimentos, o IOF funciona de forma regressiva e temporal. A cobrança está diretamente ligada ao prazo de permanência do dinheiro aplicado, sendo assim, quanto menos tempo investido, maior o imposto pago. Em aplicações de renda fixa como CDBs, Tesouro Direto e fundos DI, o IOF varia de 96% (no primeiro dia) a 0% (após 30 dias). Importante: o imposto incide apenas sobre o rendimento obtido, nunca sobre o valor principal investido. O cálculo varia conforme a operação. Paracompras internacionais, a fórmula é simples: valor em reais × 3,38%. Vamos a um exemplo prático: você comprou um produto de US$ 200 em uma loja americana. Com o dólar a R$ 5,50, o valor convertido é R$ 1.100. O IOF será R$ 1.100 × 0,0338 = R$ 37,18. Total na fatura: R$ 1.137,18. Em empréstimos, o cálculo envolve uma alíquota fixa sobre o valor total mais uma taxa diária sobre o saldo devedor. Por exemplo: empréstimo de R$ 10.000 pode ter IOF fixo de R$ 38 (0,38%)",Exame
https://exame.com/brasil/gilmar-mendes-marca-audiencia-no-stf-para-discutir-pejotizacao/,2025-07-04,Gilmar Mendes marca audiência no STF para discutir pejotização,"O modelo de contratação tem gerado impactos econômicos e sociais relevantes, diante da disseminação da pejotização em empresas de diferentes tamanhos e setores (Valter Campanato/Agência Brasil) Redatora Publicado em4 de julho de 2025 às18h12. Última atualização em4 de julho de 2025 às18h30. O ministro Gilmar Mendes, do Supremo Tribunal Federal (STF),convocou uma audiência pública para o dia 10 de setembro para discutir a legalidade da contratação de profissionais por meio de pessoas jurídicas ou autônomos,mais conhecido comopejotização. O despacho foi assinado na última quinta-feira, 3. De acordo com o ministro, o modelo de contratação tem gerado impactos econômicos e sociais relevantes, diante da disseminação da pejotização em empresas de diferentes tamanhos e setores. A proposta da audiência é reunir dados e avaliações técnicas que ajudem o tribunal a estabelecer critérios para diferenciar contratações regulares de situações que possam configurar fraude trabalhista. ""A reflexão em torno da liberdade da organização produtiva dos cidadãos e da proteção ao trabalhador, especialmente no que se refere aos hipossuficientes, impõe esclarecimentos técnicos acerca do impacto dessa forma de contratação na economia nacional, envolvendo não apenas as empresas contratantes, mas também a União, tendo em vista reflexos diretos em sua arrecadação”, disse Mendes. Empresas, entidades e especialistas interessados em participar da audiência devem se inscrever no site do STF até 10 de agosto. A lista dos habilitados será divulgada no dia 15 do mesmo mês. Presidente fez aceno ao Congresso, mas deu recado eleitoral; ele também reforçou discurso por 'justiça tributária' e contra 'privilégios' A ministra também defendeu que o governo agiu com responsabilidade ao editar os decretos do IOF De acordo com a regra aprovada, esses trabalhadores poderão contratar crédito consignado com desconto de até 30% sobre os repasses feitos pelos aplicativos Os universitários, na faixa etária dos 18 a 34 anos, podem vir de qualquer universidade pública ou privada do país; inscrições são gratuitas 01 02 03 exame no whatsapp Receba as notícias da Exame no seu WhatsApp Nos acontecimentos mais relevantes do Brasil e mundo. E-mail inválido Desperta",Exame
