url,data,titulo,texto,fonte
https://valor.globo.com/politica/noticia/2025/08/22/lula-para-se-ter-governanca-mundial-nao-se-pode-acabar-com-multilateralismo-ou-fazer-o-que-trump-faz.ghtml,2025-08-22,"Lula: Para se ter governança mundial, não se pode acabar com multilateralismo ou fazer o que Trump faz","22/08/2025 15h20Atualizadoagora O presidente Luiz Inácio Lula da Silva (PT) disse nesta sexta-feira que para ter uma governança mundial, o multilateralismo não pode acabar e não se deve fazer como o presidente dos Estados Unidos, Donald Trump, que toma decisões unilaterais sem considerar organismos internacionais, como a Organização das Nações Unidas (ONU) e a Organização Mundial do Comércio (OMC). O chefe do Executivo participa da Cúpula de Presidentes dos Estados Partes do Tratado de Cooperação Amazônica (OTCA), em Bogotá, na Colômbia. Lula disse ainda que convidou, por meio de uma carta pessoal, o presidente dos Estados Unidos, Donald Trump, para participar da COP30. “Eu, inclusive, mandei uma carta pessoal ao presidente Trump. Ele está sendo convidado para ir na COP.” Outros presidentes também receberão uma carta assinada por Lula, como forma de verificar com qual seriedade tratarão a COP30. ""Cada presidente vai receber uma carta com a minha assinatura. Não é uma carta eletrônica não, que é para eles demonstrarem se vão tratar com seriedade essa COP ou não. Porque se não tratarem com seriedade, vamos ter que pensar o que fazer daqui pra frente para cuidar do planeta"", ressaltou. Lula disse ainda que aqueles que poluíram o planeta tentam impor modelos que não nos servem. “Utilizam a luta contra o desmatamento como justificativa para o protecionismo. Usam o combate ao crime como pretexto para violar nossa soberania”, disse. Acompanhe os mercados com nossas ferramentasAcessar gratuitamente Advogados ter havido descumprindo ordens e veem tentativa de ""desmoralização"" do ex-presidente Comando diz que proposta teve aprovação de mais de 99% dos acionistas, com uma quantidade residual de abstenções Ministros trocam indiretas em evento empresarial realizado no Rio de Janeiro, e Moraes diz que falar em 'autocontenção' é 'coisa de ditador' Juros futuros recuam com Treasuries e bolsas americanas sobem com força após discurso de Powell em Jackson Hole Programa prevê R$ 30 bilhões para empresas afetadas pelas sobretaxas de 50% dos EUA, via Fundo de Garantia à Exportações (FGE), administrado pelo banco Na interpretação de participantes do mercado, Jerome Powell soou menos conservador em relação a aparições públicas recentes e, com isso, abriu espaço para o Fed cortar os juros americanos em setembro Instituto foi às ruas nos principais colégios eleitorais do país entre 13 e 17 de agosto Segundo o presidente americano, a investigação estará concluída dentro de 50 dias Projeção aponta que ganhos com as tarifas amenizarão o impacto do projeto fiscal de Trump, chamado por ele de 'projeto grande e lindo' Papéis giraram negociações de R$ 11 milhões nesta sexta-feira (22), ante o volume de R$ 9,9 milhões do pregão de quinta-feira",Valor Econômico
https://valor.globo.com/financas/noticia/2025/08/22/petroleo-sobe-com-discurso-do-presidente-do-fed-e-cessar-fogo-na-ucrania-no-radar.ghtml,2025-08-22,Petróleo sobe com discurso do presidente do Fed e cessar-fogo na Ucrânia no radar,"Em alta 22/08/2025 16h41Atualizadoagora Os contratos futuros dopetróleofecharam em leve alta nesta sexta-feira (22), após oscilarem durante a sessão, com investidores reagindo aodiscursodopresidente do Federal Reserve(Fed),Jerome Powell, noSimpósio de Jackson Hole, no qual ele se mostrou aberto a umcorte de jurosna próxima reunião do banco central americano. Além disso, os operadores estão menos otimistas com as negociações por umcessar-fogonaUcrânia. No fechamento, o petróleo tipoBrent(a referência mundial) com vencimento em outubro teve ligeira alta de 0,08%, cotado a US$ 67,73 por barril, na Intercontinental Exchange (ICE). Já oWTI(a referência americana) com entrega prevista para o mesmo mês subiu 0,22%, cotado a US$ 63,66, na New York Mercantile Exchange (Nymex). Os ganhos seguem limitados pelo temor de que o mercado da commodity enfrente um excesso deoferta, diante do aumento da produção por parte dos membros da Organização dos Países Exportadores de Petróleo e aliados (Opep+). Acompanhe os mercados com nossas ferramentasAcessar gratuitamente Advogados ter havido descumprindo ordens e nega que documento com pedido de asilo na Argentina seja indício de fuga Comando diz que proposta teve aprovação de mais de 99% dos acionistas, com uma quantidade residual de abstenções Ministros trocam indiretas em evento empresarial realizado no Rio de Janeiro, e Moraes diz que falar em 'autocontenção' é 'coisa de ditador' Juros futuros recuam com Treasuries e bolsas americanas sobem com força após discurso de Powell em Jackson Hole Programa prevê R$ 30 bilhões para empresas afetadas pelas sobretaxas de 50% dos EUA, via Fundo de Garantia à Exportações (FGE), administrado pelo banco Na interpretação de participantes do mercado, Jerome Powell soou menos conservador em relação a aparições públicas recentes e, com isso, abriu espaço para o Fed cortar os juros americanos em setembro Instituto foi às ruas nos principais colégios eleitorais do país entre 13 e 17 de agosto Segundo o presidente americano, a investigação estará concluída dentro de 50 dias Projeção aponta que ganhos com as tarifas amenizarão o impacto do projeto fiscal de Trump, chamado por ele de 'projeto grande e lindo' Papéis giraram negociações de R$ 11 milhões nesta sexta-feira (22), ante o volume de R$ 9,9 milhões do pregão de quinta-feira",Valor Econômico
https://valor.globo.com/politica/noticia/2025/08/22/analise-aumentaram-as-chances-de-bolsonaro-ser-preso-antes-do-julgamento-no-stf.ghtml,2025-08-22,Análise: Aumentaram as chances de Bolsonaro ser preso antes do julgamento no STF,"22/08/2025 15h00Atualizadohá 3 horas O partido deJair Bolsonarojá trabalha com a perspectiva de o ex-presidente enfrentar seu julgamento, que se inicia em 2 de setembro, emprisão preventiva. Este desfecho depende dos esclarecimentos da defesa ao despacho do ministroAlexandre de Moraes, do Supremo Tribunal Federal (STF), questionando-a sobre descumprimento das medidas cautelares que haviam sido impostas ao ex-presidente e de sua decisão. A defesa tem até as 20h30 desta sexta para se manifestar. Acompanhe os mercados com nossas ferramentasAcessar gratuitamente Advogados ter havido descumprindo ordens e veem tentativa de ""desmoralização"" do ex-presidente Comando diz que proposta teve aprovação de mais de 99% dos acionistas, com uma quantidade residual de abstenções Ministros trocam indiretas em evento empresarial realizado no Rio de Janeiro, e Moraes diz que falar em 'autocontenção' é 'coisa de ditador' Juros futuros recuam com Treasuries e bolsas americanas sobem com força após discurso de Powell em Jackson Hole Programa prevê R$ 30 bilhões para empresas afetadas pelas sobretaxas de 50% dos EUA, via Fundo de Garantia à Exportações (FGE), administrado pelo banco Na interpretação de participantes do mercado, Jerome Powell soou menos conservador em relação a aparições públicas recentes e, com isso, abriu espaço para o Fed cortar os juros americanos em setembro Instituto foi às ruas nos principais colégios eleitorais do país entre 13 e 17 de agosto Segundo o presidente americano, a investigação estará concluída dentro de 50 dias Projeção aponta que ganhos com as tarifas amenizarão o impacto do projeto fiscal de Trump, chamado por ele de 'projeto grande e lindo' Papéis giraram negociações de R$ 11 milhões nesta sexta-feira (22), ante o volume de R$ 9,9 milhões do pregão de quinta-feira",Valor Econômico
https://valor.globo.com/brasil/cop30-amazonia/noticia/2025/08/22/desejo-que-cop30-tenha-conclusoes-praticas-e-nao-um-desfile-de-discursos-diz-lula.ghtml,2025-08-22,"Desejo que COP30 tenha conclusões práticas e não um desfile de discursos, diz Lula","22/08/2025 14h29Atualizadoagora O presidenteLuiz Inácio Lula da Silva (PT)disse que espera que aCOP30tenha conclusões práticas e não um desfile de discursos. O chefe do Executivo participa da Cúpula de Presidentes dos Estados Parte do Tratado de Cooperação Amazônica (OTCA), em Bogotá, na Colômbia. Segundo Lula, é importante fazer da COP30 a conferência mais séria entre todas realizadas. Isso, segundo ele, porque muitas decisões são tomadas nas conferências e poucos países realmente se mobilizam para cumpri-las. “É importante que a gente esteja preparado para fazer dessa COP a mais séria já realizada entre todas as COPs, e que seja considerada a COP da verdade, onde cada um vai dizer se acredita, efetivamente, no que está acontecendo no planeta”, disse. “Outros não dão a menor importância, e outros, depois que terminam a COP, negam a assinatura de acordos”, ressaltou. A reunião entre os países amazônicos aconteceu na Casa de Nariño, sede do governo e residência do presidente colombiano Gustavo Petro. Esse é o quinto encontro da Organização do Tratado de Cooperação Amazônica, que reúne oito países. No encontro foram discutidas propostas para o Fundo Florestas Tropicais para Sempre, cooperação em segurança pública, fortalecimento regional e ações estratégicas para a COP30, a Conferência do Clima que será realizada em novembro, em Belém do Pará. Acompanhe os mercados com nossas ferramentasAcessar gratuitamente Advogados ter havido descumprindo ordens e veem tentativa de ""desmoralização"" do ex-presidente Comando diz que proposta teve aprovação de mais de 99% dos acionistas, com uma quantidade residual de abstenções Ministros trocam indiretas em evento empresarial realizado no Rio de Janeiro, e Moraes diz que falar em 'autocontenção' é 'coisa de ditador' Juros futuros recuam com Treasuries e bolsas americanas sobem com força após discurso de Powell em Jackson Hole Programa prevê R$ 30 bilhões para empresas afetadas pelas sobretaxas de 50% dos EUA, via Fundo de Garantia à Exportações (FGE), administrado pelo banco Na interpretação de participantes do mercado, Jerome Powell soou menos conservador em relação a aparições públicas recentes e, com isso, abriu espaço para o Fed cortar os juros americanos em setembro Instituto foi às ruas nos principais colégios eleitorais do país entre 13 e 17 de agosto Segundo o presidente americano, a investigação estará concluída dentro de 50 dias Projeção aponta que ganhos com as tarifas amenizarão o impacto do projeto fiscal de Trump, chamado por ele de 'projeto grande e lindo' Papéis giraram negociações de R$ 11 milhões nesta sexta-feira (22), ante o volume de R$ 9,9 milhões do pregão de quinta-feira",Valor Econômico
https://valor.globo.com/empresas/noticia/2025/08/22/eleicao-de-moretti-na-petrobras-foi-antecipada-porque-nome-ja-estava-decidido-no-governo-dizem-fontes.ghtml,2025-08-22,"Eleição de Moretti na Petrobras foi antecipada porque nome já estava decidido no governo, dizem fontes","22/08/2025 14h00Atualizadoagora A antecipação, para a quinta-feira (21), da eleição de Bruno Moretti para presidir o conselho de administração daPetrobrasse deu porque ficou definido que o conselheiro sucederia Pietro Mendes quando ele deixasse o colegiado. Mendes renunciou ao posto para assumir uma diretoria na Agência Nacional do Petróleo, Gás Natural e Biocombustíveis (ANP). Acompanhe os mercados com nossas ferramentasAcessar gratuitamente Advogados ter havido descumprindo ordens e nega que documento com pedido de asilo na Argentina seja indício de fuga Comando diz que proposta teve aprovação de mais de 99% dos acionistas, com uma quantidade residual de abstenções Ministros trocam indiretas em evento empresarial realizado no Rio de Janeiro, e Moraes diz que falar em 'autocontenção' é 'coisa de ditador' Juros futuros recuam com Treasuries e bolsas americanas sobem com força após discurso de Powell em Jackson Hole Programa prevê R$ 30 bilhões para empresas afetadas pelas sobretaxas de 50% dos EUA, via Fundo de Garantia à Exportações (FGE), administrado pelo banco Na interpretação de participantes do mercado, Jerome Powell soou menos conservador em relação a aparições públicas recentes e, com isso, abriu espaço para o Fed cortar os juros americanos em setembro Instituto foi às ruas nos principais colégios eleitorais do país entre 13 e 17 de agosto Segundo o presidente americano, a investigação estará concluída dentro de 50 dias Projeção aponta que ganhos com as tarifas amenizarão o impacto do projeto fiscal de Trump, chamado por ele de 'projeto grande e lindo' Papéis giraram negociações de R$ 11 milhões nesta sexta-feira (22), ante o volume de R$ 9,9 milhões do pregão de quinta-feira",Valor Econômico
https://valor.globo.com/empresas/noticia/2025/08/22/eventual-dificuldade-de-acesso-de-brasileiros-aos-eua-pode-impactar-roaming-diz-presidente-da-tim.ghtml,2025-08-22,"Eventual dificuldade de acesso de brasileiros aos EUA pode impactar roaming, diz presidente da TIM","22/08/2025 15h11Atualizadoagora Uma eventual restrição no acesso de brasileiros aos Estados Unidos pode impactar as receitas da TIM com serviços de roaming, afirmou o presidente-executivo da operadora, Alberto Griselli. Segundo ele, embora a receita com roaming represente uma parcela pequena do faturamento total da empresa, possíveis dificuldades na entrada de brasileiros nos EUA podem afetar a operadora. O governo norte-americano anunciou na quinta-feira (21) quemantém uma análise de mais de 55 milhões de estrangeiros que possuem vistos válidos para os EUA, incluindo os que já receberam permissão para entrar no país, com o objetivo de identificar possíveis violações que possam resultar em deportações. A Casa Branca também informou nesta semana que o Serviço de Cidadania e Imigração dos EUA passará aconsiderar manifestações de “antiamericanismo”como critério nas análises de solicitações de visto. “A gente pode ser impactado pelo roaming. O roaming tem um peso pequeno para nós, mas (é) crescente, porque formatamos toda nossa oferta no pós-pago e controle para ter roaming”, disse Griselli em entrevista em evento do Lide. “Por enquanto, não vemos impacto, mas se houver uma restrição muito grande, será algo a menos que nós teremos”, acrescentou o executivo. Na semana passada, a maior agência de viagens do Brasil, a CVC, citou que incertezas sobre a política de imigração dos EUA atingiram a demanda por viagens para o país e ajudaram a pressionar o resultado da empresa no primeiro semestre. Com relação às tarifas dos EUA sobre o Brasil, Griselli afirmou que o impacto sobre o setor de telecomunicações é limitado e que fatores macroeconômicos como câmbio, inflação, juros e mercado de trabalho têm influência mais significativa. “Estamos crescendo receita, expandindo margem, remuneração aos acionistas, a despeito da conjuntura”, afirmou, reforçando perspectiva de cumprimento das previsões da empresa para o ano. A TIM Brasil, controlada pela Telecom Italia, prevê para este ano alta de cerca de 5% na receita de serviços e avanço 6% a 8% no resultado operacional medido pelo Ebitda. Griselli também disse que a empresa está atenta ao crescimento global do mercado de data centers, mas afirmou que a TIM não tem planos de construir ou operar diretamente esses centros, nem de se tornar uma operadora desses serviços, embora avalie a possibilidades de atuação em nichos desse novo mercado. “Não participamos do segmento de data centers, mas utilizamos os data centers. No segmento corporativo, estamos avaliando se podemos integrar nosso serviço com o de cloud.” Segundo o executivo, a TIM ainda não possui “competência” para integração, mas pode buscar oportunidades de mercado por meio da aquisição de ativos no segmento. A rival Telefônica Brasil anunciou no início do mês uma parceria de cerca de R$ 4 bilhões com a empresa de saneamento de São Paulo, a Sabesp, para investimentos e operação de hidrômetros “inteligentes”. Acompanhe os mercados com nossas ferramentasAcessar gratuitamente Dado consta de pesquisa feita pelo secretariado da Convenção sobre Mudança Climática da ONU, a UNFCCC Segundo banco, publicações buscam ""gerar pânico"" e induzir a população a decisões que podem prejudicar a sua saúde financeira Advogados ter havido descumprindo ordens e nega que documento com pedido de asilo na Argentina seja indício de fuga Comando diz que proposta teve aprovação de mais de 99% dos acionistas, com uma quantidade residual de abstenções Ministros trocam indiretas em evento empresarial realizado no Rio de Janeiro, e Moraes diz que falar em 'autocontenção' é 'coisa de ditador' Juros futuros recuam com Treasuries e bolsas americanas sobem com força após discurso de Powell em Jackson Hole Programa prevê R$ 30 bilhões para empresas afetadas pelas sobretaxas de 50% dos EUA, via Fundo de Garantia à Exportações (FGE), administrado pelo banco Na interpretação de participantes do mercado, Jerome Powell soou menos conservador em relação a aparições públicas recentes e, com isso, abriu espaço para o Fed cortar os juros americanos em setembro Instituto foi às ruas nos principais colégios eleitorais do país entre 13 e 17 de agosto Segundo o presidente americano, a investigação estará concluída dentro de 50 dias",Valor Econômico
https://valor.globo.com/financas/noticia/2025/08/22/juros-futuros-tem-forte-queda-apos-discurso-do-presidente-do-bc-dos-eua.ghtml,2025-08-22,Juros futuros têm forte queda após discurso do presidente do BC dos EUA,"Em alta 22/08/2025 18h13Atualizadoagora Osjuros futurosapresentaram forte queda durante toda a tarde desta sexta-feira (22) e encerraram o pregão com um movimento bastante positivo, impulsionado pelodiscursodopresidente do Federal Reserve(Fed),Jerome Powell, durante oSimpósio de Jackson Hole. Na interpretação de participantes do mercado, o chefe dobanco central americanosoou menos conservador em relação a aparições públicas recentes e, com isso, abriu espaço para o Fed cortar os juros em sua reunião de setembro. Encerrados os negócios, a taxa do contrato de Depósito Interfinanceiro (DI) com vencimento de janeiro de 2026 teve queda modesta de 14,91%, do ajuste anterior, para 14,895%; a do DI de janeiro de 2027 caiu de 14,085% a 13,955%; a do DI de janeiro de 2029 anotou forte baixa de 13,425% para 13,28% e a do DI de janeiro de 2031 recuou de 13,77% a 13,64%. Nos Estados Unidos, os vértices curtos da curva dos juros dos títulos do Tesouro americano (Treasuries) anotaram movimentos mais fortes em meio à perspectiva pela flexibilização da política monetária do Fed. A taxa da T-note de dois anos fechou a sessão em queda de 3,794% para 3,703%, enquanto a da T-note de dez anos cedeu de 4,330% para 4,260%. Embora as taxas domésticas tenham operado em queda desde o início do pregão em meio a um alívio após o estresse que as afetou no restante da semana, o movimento se intensificou no fim da manhã durante o discurso de Powell, em linha com o que se observou no mercado de Treasuries. A leitura de participantes do mercado é de que menções do presidente do Fed a um impacto passageiro das tarifas americanas sobre a inflação; enfraquecimento do mercado de trabalho; política monetária em um patamar restritivo; e a possibilidade de um ajuste nos juros abriram mais a porta para que o Fed volte a cortar a sua taxa básica na decisão do dia 17 de setembro. Essa perspectiva se refletiu no levantamento do CME Group com base nos futuros dos Fed funds, que voltaram a precificar de forma praticamente consensual o corte de 0,25 ponto percentual dos juros americanos no mês que vem. Além disso, ganhou força a previsão de que o Fed corte a taxa básica nas três reuniões restantes deste ano, para a faixa de 3,50% a 3,75% - ainda que a expectativa de dois cortes até dezembro continue como o cenário-base. Na avaliação dos profissionais da consultoria Buysidebrazil, o discurso de Powell nesta sexta-feira marca uma inflexão importante na comunicação da autoridade monetária americana. Se até a ata da última reunião do Comitê Aberto de Política Monetária (Fomc), publicada na quarta-feira, havia uma ênfase nos riscos de alta para a inflação, o presidente do Fed hoje reconheceu o enfraquecimento mais forte do mercado de trabalho, além de alertar que os riscos de baixa para o emprego poderiam se materializar rapidamente. “Dessa forma, após a ata ter esfriado a precificação de cortes em setembro, o discurso em Jackson Hole, especialmente pelo reconhecimento do mercado de trabalho mais fraco, inverteu a leitura dos agentes, tornando majoritária a aposta em favor de um primeiro corte já na próxima reunião. Assim, reforçamos nosso cenário de dois cortes nos Fed funds este ano, com início em setembro e continuidade em dezembro”, diz o relatório semanal da casa. Há, porém, alguns outros participantes menos confiantes na continuidade do ciclo de flexibilização monetária nos Estados Unidos. É o caso de Andressa Durão, economista da ASA, que ressalta o fato de Powell ter apontado que o mercado de trabalho, embora enfraquecendo, ainda mostra uma taxa de desemprego baixa para os padrões históricos. “Um primeiro corte de 0,25 ponto percentual em setembro é o cenário mais provável, e cortes consecutivos dependerão dos próximos dados”, diz ela. Na mesma linha, Ali Jeffery, economista sênior do banco canadense CIBC, sequer enxerga o corte em setembro como algo certo. “O presidente Powell abriu um pouco mais a porta para o reinício das reduções de juros em breve, embora, ao continuar enfatizando que elas serão realizadas com cautela, suas declarações não tenham sido necessariamente um compromisso prévio com uma ação em setembro”, pondera. Acompanhe os mercados com nossas ferramentasAcessar gratuitamente Dado consta de pesquisa feita pelo secretariado da Convenção sobre Mudança Climática da ONU, a UNFCCC Segundo banco, publicações buscam ""gerar pânico"" e induzir a população a decisões que podem prejudicar a sua saúde financeira Advogados ter havido descumprindo ordens e nega que documento com pedido de asilo na Argentina seja indício de fuga Comando diz que proposta teve aprovação de mais de 99% dos acionistas, com uma quantidade residual de abstenções Ministros trocam indiretas em evento empresarial realizado no Rio de Janeiro, e Moraes diz que falar em 'autocontenção' é 'coisa de ditador' Juros futuros recuam com Treasuries e bolsas americanas sobem com força após discurso de Powell em Jackson Hole Programa prevê R$ 30 bilhões para empresas afetadas pelas sobretaxas de 50% dos EUA, via Fundo de Garantia à Exportações (FGE), administrado pelo banco Na interpretação de participantes do mercado, Jerome Powell soou menos conservador em relação a aparições públicas recentes e, com isso, abriu espaço para o Fed cortar os juros americanos em setembro Instituto foi às ruas nos principais colégios eleitorais do país entre 13 e 17 de agosto Segundo o presidente americano, a investigação estará concluída dentro de 50 dias",Valor Econômico
