url,data,titulo,texto,fonte
https://valor.globo.com/politica/noticia/2025/06/16/governo-monitora-sessao-no-congresso-e-lista-vetos-que-causam-preocupacao.ghtml,2025-06-16,Governo monitora sessão no Congresso e lista vetos que causam preocupação,"16/06/2025 19h14Atualizado16/06/2025 O governo Luiz Inácio Lula da Silva monitora com apreensão asessão do Congresso Nacionalprevista para esta terça-feira (17). O motivo é a possível derrubada de vetos presidenciais que causam preocupação ao Palácio do Planalto. OValorapurou que o governo petista elaborou uma lista com os vetos mais sensíveis para o Executivo, o que inclui eólicas offshore, Benefício de Prestação Continuada (BPC), reforma tributária, vírus Zika, Programa de Pleno Pagamento de Dívidas dos Estados (Propag) e, por último, a diabetes mellitus. O documento é encabeçado, por exemplo, pelo veto que trata do projeto que regulamenta a produção de energia eólica offshore. O tema das eólicas não deve ser apreciado pelos congressistas nesta semana, mas está sendo monitorado de perto por conta do seu impacto fiscal. Nas contas feitas pelo governo Lula, esses itens podem representar um custo entre R$ 80 e R$ 120 bilhões para os cofres públicos pelos próximos cinco anos. O PL em questão foi vetado em três artigos que continham jabutis — no jargão político, matérias estranhas ao objetivo principal da proposta. Esses trechos previam, dentre outros pontos, a obrigatoriedade da contratação de usinas térmicas a gás natural com operação mínima de 70% do tempo, o prolongamento de contratos de usinas a carvão mineral e a aquisição compulsória de energia de pequenas centrais hidrelétricas. Na lista, também consta um veto feito pelo presidente que busca excluir as pessoas com deficiência leve da lista de elegíveis a receber o Benefício de Prestação Continuada (BPC). O motivo é que há uma preocupação com a curva ascendente dos custos do programa, que já ultrapassa até mesmo o Bolsa Família. Segundo a mensagem de veto do Poder Executivo, a medida contrariaria o interesse público, “uma vez que poderia trazer insegurança jurídica em relação à concessão de benefício”. Em 2023, o BPC tinha 5,7 milhões de beneficiários, dos quais 3,12 milhões eram idosos e 2,58 milhões eram pessoas com deficiência. Outro assunto que causa inquietação ao Executivo são os vetos que tratam de pensão e indenização decorrente do vírus Zika. Isso porque o presidente Lula, sob recomendação da equipe econômica, decidiu barrar uma pensão, paga mensalmente até o fim da vida, de R$ 7.786,02 a pessoas que nasceram com deficiência causada pelo vírus Zika durante a gestação, além de indenização. Na mensagem em que justifica o veto, a Presidência da República aponta, entre outros problemas, que a proposta ""cria despesa obrigatória de caráter continuado e benefício tributário e amplia benefício da seguridade social, sem a devida estimativa de impacto orçamentário e financeiro, identificação da fonte de custeio, indicação de medida de compensação e sem a fixação de cláusula de vigência para o benefício tributário"". O governo também argumenta que, ""ao dispensar da reavaliação periódica os beneficiários do benefício de prestação continuada concedido em virtude de deficiência decorrente de síndrome congênita associada à infecção pelo vírus Zika, a proposição diverge da abordagem biopsicossocial da deficiência, contraria a Convenção Internacional sobre os Direitos das Pessoas com Deficiência e cria tratamento não isonômico em relação às demais pessoas com deficiência"". Como alternativa, o Executivo chegou a editar uma medida provisória (MP) que propunha um auxílio, em parcela única, de R$ 60 mil às pessoas que foram afetadas pela doença. O texto do governo sugeria limitar o apoio financeiro às pessoas nascidas entre 1º de janeiro de 2015 e 31 de dezembro de 2024 com deficiência decorrente da Síndrome Congênita associada à infecção pelo vírus Zika (SCZ). Pela proposta do governo, o auxílio de R$ 60 mil não seria acumulável com qualquer indenização da mesma natureza concedida por decisão judicial, ressalvado o direito de opção. Apesar disso, o Congresso segue empenhado em barrar o veto de Lula, tanto que, na semana passada, o líder do governo no Congresso Nacional, senadorRandolfe Rodrigues (PT-AP), admitiu que o Planalto decidiu autorizar sua base aliada a votar contra a decisão presidencial. A equipe de articulação política também decidiu incluir na lista de preocupações um veto que não permitiu que quem sofre dediabetes mellitus tipo 1seja equiparado à pessoa com deficiência (PCD). A novidade poderia gerar gastos, como com o BPC, que atende PCDs e idosos de baixa renda. Segundo o governo federal, o projeto foi aprovado sem a estimativa de impacto financeiro exigida pela Constituição. Já sobre areforma tributária, Lula vetou 15 dos 544 artigos da lei que regulamenta a reforma do consumo, integral ou parcialmente. Entre os pontos está a isenção de fundos de investimento imobiliário, patrimoniais e do agronegócio de pagar os novos tributos CBS e IBS. A Advocacia-Geral da União (AGU) avaliou que o trecho concedia um benefício fiscal aos fundos, o que não é previsto na Emenda Constitucional da reforma. O chefe do Executivo também vetou trechos que incluíam na alíquota reduzida de 60% da CBS e do IBS serviços de sistemas de segurança, seguro para dispositivos com dados pessoais furtados ou roubados e serviços de ressarcimento de transações bancárias. Por fim, o governo está monitorando ainda os vetos do chamado Propag, cujos dispositivos foram barrados em janeiro sob justificativa de que poderiam ampliar o impacto fiscal do programa para a União. Na ocasião, o presidente vetou dispositivos que autorizavam os Estados a reduzirem parcelas de suas dívidas com a União utilizando gastos estratégicos, como a realização de obras que cabem ao governo federal. Segundo o Executivo, esses trechos poderiam causar instabilidade jurídica e perda de arrecadação, prejudicando a sustentabilidade fiscal da União. Apesar disso, interlocutores do Planalto veem chances reduzidas de o Executivo ceder nessa questão. Além da análise dos vetos, a sessão deve servir para Davi Alcolumbre ler o requerimento e abrir caminho para a instalação da CPMI que vai investigar o escândalo de descontos indevidos no INSS. Apesar do potencial de desgaste para o governo, aliados avaliam que a oposição perdeu o “timing” para a instalação da comissão. Acompanhe os mercados com nossas ferramentasAcessar gratuitamente Três fontes familiarizadas com o assunto disseram à “Reuters” que a proclamação sobre os termos do acordo incluiria disposições sobre o comércio de aço, etanol, automóveis e carne",Valor Econômico
https://valor.globo.com/financas/noticia/2025/06/16/alem-do-pix-automatico-nova-atualizacao-promete-frear-golpes-no-sistema.ghtml,2025-06-16,Além do Pix automático: nova atualização promete frear golpes no sistema,"Em alta 16/06/2025 17h07Atualizado16/06/2025 Depois do lançamento doPix Automático, uma das próximas atualizações doBanco Centralpara o sistema de pagamentos instantâneos é a nova versão doMecanismo Especial de Devolução (MED). OMED 2.0, como será conhecido, terá como objetivoampliar os recursos contra transferências fraudulentas, fazendo com que os valores roubados possam ser rastreados para além da primeira conta receptora usada no golpe. O MED 2.0 permitirá que o Banco Central procure pelo dinheiro roubado em até cinco níveis de transferência, ou seja, conseguirá identificar o caminho feito por contas secundárias usado pelos golpistas após a transferência inicial. Para que o sistema seja implementado, o Banco Central precisará coordenar essa operação com todas as empresas habilitadas para operar o pix. Também será necessário que o processo de denúncia sem intermediários funcione, o que está previsto para ser iniciado até 1º de outubro. O MED 2.0 está previsto para chegar no primeiro trimestre de 2026. Como o MED funciona hoje? Hoje, o mecanismo de devolução permite que o dinheiro transferido seja rastreado apenas até a primeira conta para onde foi enviado. No modelo atual, a pessoa que sofreu a fraude notifica a sua própria instituição financeira do ocorrido, que verifica se realmente há sinais de golpe. Caso haja evidências suficientes, a instituição notifica o Banco Central, que então entra em contato com a instituição financeira que recebeu o valor transferido. Depois disso, é verificado se a conta bancária receptora tem ou não saldo disponível. Se a resposta for sim, então o valor pode ser devolvido, mas caso a conta não tenha saldo suficiente, a devolução do pix fraudulento é rejeitada. LEIA MAIS Saiba como funciona o Pix AutomáticoPix Parcelado é próxima etapa em agenda do Banco CentralBancos usam crédito pessoal para se antecipar ao Pix Parcelado Isso acontece porque o MED não funciona como uma reversão de pagamento (“chargebak”), assim como uma contestação de uma compra no cartão de crédito, por exemplo. A devolução dos recursos pelo MED só ocorre se houver dinheiro na conta receptora. Porém, as quadrilhas especializadas em aplicar golpes de pix tendem a redistribuir o dinheiro desviado em diferentes contas com rapidez, enquanto a vítima ainda realiza os procedimentos necessários para pedir a devolução do dinheiro. Assim, quando a instituição financeira verifica o saldo da conta receptora, existe a possibilidade do valor não estar mais lá e a vítima ficar no prejuízo. Acompanhe os mercados com nossas ferramentasAcessar gratuitamente Três fontes familiarizadas com o assunto disseram à “Reuters” que a proclamação sobre os termos do acordo incluiria disposições sobre o comércio de aço, etanol, automóveis e carne bovina Proposta contraria entendimento do TCU e, se aprovada, deve aprofundar crise entre Poderes Líderes partidários levam reclamações diversas à ministra em reunião com Hugo Motta Segundo o ministro, vive-se ""uma época em que as fronteiras entre a civilização e a barbárie parecem ténues Contudo, questões como custo de capital e dívida corporativa, educação e habilidades linguísticas em nível baixo, pouca abertura econômica e ambiente regulatório ruim, além da falta de mão de obra qualificada, impedem maior avanço Vereador no Rio, filho do ex-presidente deve disputar eleições por Santa Catarina Empresa já havia investido R$ 630 milhões no ano passado para inaugurar um complexo industrial em Pouso Alegre (MG) Deputados e senadores tem sessão prevista para esta terça-feira Jornalistas das equipes de segurança nacional e política econômica, incluindo aqueles que cobriam a China, teriam sido alvos Tenente-coronel nega ter desrespeitado ordem de proibição",Valor Econômico
https://valor.globo.com/empresas/noticia/2025/06/16/whatsapp-exibir-anncios-para-usurios-e-ter-canais-pagos-por-assinatura.ghtml,2025-06-16,WhatsApp exibirá anúncios para usuários e terá canais pagos por assinatura,"16/06/2025 13h48Atualizado16/06/2025 OWhatsAppanunciou, nesta segunda-feira (16), que passará a exibir anúncios na aba “Atualizações”, onde atualmente aparecem os “Status” publicados pelos usuários. Segundo a empresa, o novo espaço publicitário permitirá a descoberta de empresas e a possibilidade de iniciar conversas com elas diretamente pelo aplicativo. A novidade será implementada de forma gradual e faz parte de uma série de mudanças na plataforma. A aba “Atualizações” é usada por cerca de 1,5 bilhão de pessoas todos os dias, de acordo com dados da companhia. Com a atualização, também será possível assinar canais dentro do WhatsApp. A assinatura, segundo a empresa, permitirá que usuários recebam atualizações exclusivas dos canais de interesse. Todos esses recursos ficarão restritos à aba “Atualizações” e serão exibidos separadamente das conversas pessoais dos usuários. O WhatsApp diz que, para quem utiliza o aplicativo apenas para se comunicar com amigos e familiares, o serviço continuará o mesmo. O aplicativo passará a contar também com canais promovidos. Segundo a empresa, o novo recurso tornará mais fácil descobrir canais que possam interessar aos usuários enquanto eles exploram o guia de canais. Além disso, pela primeira vez, administradores de canais terão acesso a ferramentas para ampliar a visibilidade de seus conteúdos na plataforma. Canais que optarem por esse recurso aparecerão com uma identificação de “patrocinado”. Compartilhamento de dados? O WhatsApp afirma que todos os novos recursos foram desenvolvidos com foco na privacidade dos usuários. As mensagens pessoais, chamadas e atualizações de status continuam protegidas por criptografia de ponta a ponta. Segundo a empresa, mesmo com a introdução de anúncios na plataforma, o conteúdo das conversas permanece inacessível. Para exibir anúncios no “Status” ou promover canais potencialmente relevantes, serão utilizados dados considerados limitados, como país ou cidade, idioma, canais seguidos e o modo como o usuário interage com os anúncios. No caso de quem optou por integrar o WhatsApp à central de contas da Meta, a empresa também utilizará preferências de anúncios e dados compartilhados com outras plataformas do grupo, como Facebook e Instagram. O WhatsApp afirma que nunca venderá nem compartilhará o número de telefone dos usuários com anunciantes. Por isso, conversas pessoais, chamadas e os grupos dos quais o usuário participa não serão utilizados para determinar os anúncios exibidos. Acompanhe os mercados com nossas ferramentasAcessar gratuitamente Três fontes familiarizadas com o assunto disseram à “Reuters” que a proclamação sobre os termos do acordo incluiria disposições sobre o comércio de aço, etanol, automóveis e carne bovina Proposta contraria entendimento do TCU e, se aprovada, deve aprofundar crise entre Poderes Líderes partidários levam reclamações diversas à ministra em reunião com Hugo Motta Segundo o ministro, vive-se ""uma época em que as fronteiras entre a civilização e a barbárie parecem ténues Contudo, questões como custo de capital e dívida corporativa, educação e habilidades linguísticas em nível baixo, pouca abertura econômica e ambiente regulatório ruim, além da falta de mão de obra qualificada, impedem maior avanço Vereador no Rio, filho do ex-presidente deve disputar eleições por Santa Catarina Empresa já havia investido R$ 630 milhões no ano passado para inaugurar um complexo industrial em Pouso Alegre (MG) Deputados e senadores tem sessão prevista para esta terça-feira Jornalistas das equipes de segurança nacional e política econômica, incluindo aqueles que cobriam a China, teriam sido alvos Tenente-coronel nega ter desrespeitado ordem de proibição",Valor Econômico
https://valor.globo.com/mundo/noticia/2025/06/16/ir-ataca-refinaria-de-israel-e-mata-trs-funcionrios.ghtml,2025-06-16,Irã ataca refinaria de Israel e mata três funcionários,"Por Valor, com Reuters— Rio 16/06/2025 18h05Atualizado16/06/2025 O grupo Bazan, empresa do setor de refino de petróleo de Israel com sede em Haifa, informou o desligamento de todas as instalações de sua refinaria na região após uma estação de energia, utilizada na geração de vapor e eletricidade, ter sido severamente danificada em um ataque do Irã, segundo comunicado divulgado hoje. Acompanhe os mercados com nossas ferramentasAcessar gratuitamente Três fontes familiarizadas com o assunto disseram à “Reuters” que a proclamação sobre os termos do acordo incluiria disposições sobre o comércio de aço, etanol, automóveis e carne bovina Proposta contraria entendimento do TCU e, se aprovada, deve aprofundar crise entre Poderes Líderes partidários levam reclamações diversas à ministra em reunião com Hugo Motta Segundo o ministro, vive-se ""uma época em que as fronteiras entre a civilização e a barbárie parecem ténues Contudo, questões como custo de capital e dívida corporativa, educação e habilidades linguísticas em nível baixo, pouca abertura econômica e ambiente regulatório ruim, além da falta de mão de obra qualificada, impedem maior avanço Vereador no Rio, filho do ex-presidente deve disputar eleições por Santa Catarina Empresa já havia investido R$ 630 milhões no ano passado para inaugurar um complexo industrial em Pouso Alegre (MG) Deputados e senadores tem sessão prevista para esta terça-feira Jornalistas das equipes de segurança nacional e política econômica, incluindo aqueles que cobriam a China, teriam sido alvos Tenente-coronel nega ter desrespeitado ordem de proibição",Valor Econômico
https://valor.globo.com/politica/noticia/2025/06/16/motta-se-reune-com-gleisi-e-rui-costa-horas-antes-de-votacao-da-urgencia-do-pdl-que-derruba-decreto-do-iof.ghtml,2025-06-16,Motta se reúne com Gleisi e Rui Costa horas antes de votação da urgência do PDL que derruba decreto do IOF,"16/06/2025 16h15Atualizado16/06/2025 O presidente da Câmara, deputadoHugo Motta(Republicanos-PB) se reuniu com a ministra da Secretaria de Relações Institucionais (SRI),Gleisi Hoffmann, e com o ministro da Casa Civil,Rui Costa, nesta segunda-feira (16), horas antes da sessão em que está prevista a votação da urgência do decreto legislativo (PDL) que derruba oreajuste do IOF. A votação deve ocorrer no fim da tarde. Líderes partidários da Casa também participaram de almoço na residência oficial da Câmara. Eles discutiram o cenário de resistência às novas medidas doMinistério da Fazenda. No fim de semana,Motta esteve com o presidente Luiz InácioLulada Silva (PT)e levou as queixas dos parlamentares sobre o teor da proposta do governo enviada como alternativa aoaumento do IOF. O presidente da Câmara também transmitiu Lula as reclamações sobre a demora do pagamento dasemendas parlamentares. A expectativa de líderes partidários é de que mais de 300 deputados votem favoravelmente à urgênciado projeto que susta o decreto do governo.Em entrevista aoValor, a ministraGleisi Hoffmannafirmou que o governo tentaria demover os deputados de derrubarem as medidas. Disse ainda que se os congressistas insistirem nesse caminho, o resultado vai afetar também as emendas do Legislativo porque um novo contingenciamento e bloqueio das contas públicas será inevitável. 'Bate aqui, bate lá': Gleisi diz que emendas serão afetadas se Congresso derrubar pacote fiscal O pagamento dasemendas parlamentaressegue em ritmo lento e técnicos da consultoria de orçamento da Câmara e da SRI atribuem a lentidão ao atraso da aprovação do orçamento - que ocorreu somente em abril -, bem como novas burocracias criadas com a aprovação das regras de transparência determinadas pelo ministro do Supremo Tribunal Federal (STF)Flávio Dino. Acompanhe os mercados com nossas ferramentasAcessar gratuitamente Três fontes familiarizadas com o assunto disseram à “Reuters” que a proclamação sobre os termos do acordo incluiria disposições sobre o comércio de aço, etanol, automóveis e carne bovina Proposta contraria entendimento do TCU e, se aprovada, deve aprofundar crise entre Poderes Líderes partidários levam reclamações diversas à ministra em reunião com Hugo Motta Segundo o ministro, vive-se ""uma época em que as fronteiras entre a civilização e a barbárie parecem ténues Contudo, questões como custo de capital e dívida corporativa, educação e habilidades linguísticas em nível baixo, pouca abertura econômica e ambiente regulatório ruim, além da falta de mão de obra qualificada, impedem maior avanço Vereador no Rio, filho do ex-presidente deve disputar eleições por Santa Catarina Empresa já havia investido R$ 630 milhões no ano passado para inaugurar um complexo industrial em Pouso Alegre (MG) Deputados e senadores tem sessão prevista para esta terça-feira Jornalistas das equipes de segurança nacional e política econômica, incluindo aqueles que cobriam a China, teriam sido alvos Tenente-coronel nega ter desrespeitado ordem de proibição",Valor Econômico
https://valor.globo.com/financas/noticia/2025/06/16/nuvei-perde-mercado-com-nacionalizacao-das-bets-mas-quer-ampliar-servicos.ghtml,2025-06-16,"Nuvei 'perde' mercado com nacionalização das bets, mas quer ampliar serviços","Em alta 16/06/2025 16h27Atualizado16/06/2025 Com a regulamentação do mercado de apostas esportivas, as chamadas ""bets"", essas empresas tiveram de se nacionalizar e muitas fintechs que faziam as transações internacionais das operadoras ""perderam"" esse mercado. Esse é o caso da canadense Nuvei, que no mundo todo é especializada em atender bets. Juan Jorge Soto, que assumiu no fim do ano passado o recém-criado posto de gerente-geral para América Latina, aponta que os volumes da Nuvei estão sendo afetados pela redução nas transações transfronteiriças das bets, mas que a companhia vem diversificando e ampliando sua atuação. A fintech havia comprado a instituição de pagamento Pay2All, do BTG, no ano passado e, ao mesmo tempo, entrou com pedido de autorização perante o Banco Central. Como a compra foi aprovada antes, agora a empresa acabou desistindo de buscar uma licença própria. ""Nós queremos combinar nossa plataforma tecnológica global, que é uma das melhores do mundo, com uma visão local dos negócios. Cada país na América Latina tem um mercado diferente. No Brasil, por exemplo, nós temos o Pix e precisamos oferecer todas essas ferramentas aos clientes. Nós somos muito forte entre as bets, mas com a mudança na regulação no Brasil, também estamos investindo pesado em outros segmentos, como viagem, e-commerce, moda, varejo em geral. Não somos mais só um player transacional, estamos desenvolvendo uma oferta completa"", diz. A Nuvei era listada na Nasdaq, mas foi comprada pela Advent no ano passado por US$ 6,3 bilhões e saiu da bolsa. A companhia não detalha dados de Brasil, mas Soto diz que é um mercado importante para a fintech. Além da nova posição de gerente-geral para América Latina, o time de Brasil também está crescendo. ""O Brasil é um mercado enorme, com uma grande população, bastante digitalizada, com um bom nível de renda, então obviamente é uma das nossas prioridades nos próximos anos"". Com as mudanças trazidas pela regulamentação das bets, outras fintechs que atuavam nesse nicho viram seus valuations caírem e Soto diz que a Nuvei está sempre analisando potenciais aquisições. ""Estamos sempre olhando e, especialmente no Brasil, há muitas oportunidades"", comenta, lembrando que operações de M&A sempre ajudam a reduzir o tempo de desenvolvimento de produtos. Além da licença da instituição de pagamento, a Nuvei atua como sub-adquirente no Brasil, mas Soto revela que o plano no médio prazo é buscar uma licença de adquirente plena, a exemplo de como já opera na Colômbia. O executivo diz que, pelo menos por enquanto, não há planos de entrar no mercado de pagamentos físicos, com maquininhas de cartão. ""Chegamos na América Latina há pouco tempo, ainda estamos consolidando nossa operação"". Questionado se a guerra tarifária pode afetar as operações da Nuvei na região, o executivo diz que não há impactos diretos, mas as incertezas na economia e alterações nos fluxos de comércio podem prejudicar os volumes de pagamentos dos seus clientes. ""Os EUA têm uma dificuldade com a China e isso pode impactar os fluxos, até as cadeias de distribuição, então, se isso continuar, pode ter um efeito [para a Nuvei]"". O comércio entre Ásia e América Latina é um dos principais fluxos de interesse da Nuvei. A empresa divulgou recentemente um relatório que aponta que o e-commerce brasileiro crescerá para cerca de US$ 585,6 bilhões em 2027 - uma alta de 70% ante 2024 - e 9% desse total deve ser de transações transfronteiriças. A Nuvei foi fundada em 2003 por Philip Fayer, inicialmente com o nome de Pivotal Payments. Em 2023, o ator canadense Ryan Reynolds se tornou sócio e mesmo com a venda para a Advent até hoje atua como garoto-propaganda. A companhia atende mais de 200 mercados, operando em 150 moedas e atuando como adquirente em 50 países. Nos nove primeiros meses de 2024 (dado mais recente disponível) processou US$ 183,1 bilhões em pagamentos, com crescimento anual de 30%. Acompanhe os mercados com nossas ferramentasAcessar gratuitamente Três fontes familiarizadas com o assunto disseram à “Reuters” que a proclamação sobre os termos do acordo incluiria disposições sobre o comércio de aço, etanol, automóveis e carne bovina Proposta contraria entendimento do TCU e, se aprovada, deve aprofundar crise entre Poderes Líderes partidários levam reclamações diversas à ministra em reunião com Hugo Motta Segundo o ministro, vive-se ""uma época em que as fronteiras entre a civilização e a barbárie parecem ténues Contudo, questões como custo de capital e dívida corporativa, educação e habilidades linguísticas em nível baixo, pouca abertura econômica e ambiente regulatório ruim, além da falta de mão de obra qualificada, impedem maior avanço Vereador no Rio, filho do ex-presidente deve disputar eleições por Santa Catarina Empresa já havia investido R$ 630 milhões no ano passado para inaugurar um complexo industrial em Pouso Alegre (MG) Deputados e senadores tem sessão prevista para esta terça-feira Jornalistas das equipes de segurança nacional e política econômica, incluindo aqueles que cobriam a China, teriam sido alvos Tenente-coronel nega ter desrespeitado ordem de proibição",Valor Econômico
