url,data,titulo,texto,fonte
https://valor.globo.com/mundo/noticia/2025/08/30/relatrio-denuncia-padro-de-desaparecimentos-forados-na-venezuela-casos-chegam-a-23-em-9-meses.ghtml,2025-08-30,Relatório denuncia padrão de desaparecimentos forçados na Venezuela; casos chegam a 23 em 9 meses,"30/08/2025 01h39Atualizadoagora O advogado venezuelano Eduardo Torres Muñoz saiu para trabalhar normalmente em 9 de maio. Pela manhã, acompanhou a um tribunal uma mulher cujo filho está detido pelo regime de Nicolás Maduro. À tarde, ligou para a sua esposa, Emiselys, para avisar que estava voltando para a casa deles, em Caracas. Eduardo nunca chegou em casa. ""Essa foi a última conversa que tivemos"", recorda Emiselys. Advogado da Provea, a mais respeitada organização de direitos humanos da Venezuela, ele foi preso pela ditadura chavista. Emiselys demorou oito dias para saber o que havia acontecido com o seu marido. Primeiro, buscou em hospitais, com receio de que ele tivesse sofrido um acidente, e depois em diversos centros de detenção, sem sucesso. ""Eu descobri pela televisão. [O procurador-geral da Venezuela] Tarek William Saab deu uma entrevista mostrando um organograma com a foto do Eduardo, dizendo que ele estava detido"", recorda Emiselys. Seu marido estava sendo acusado de terrorismo. Até hoje, quase quatro meses depois, ele está em uma prisão na capital venezuelana, sem poder receber visitas ou fazer telefonemas. O caso de Eduardo não é isolado e segue padrões de repressão do regime de Maduro, segundo as conclusões do Relatório Especial sobre Desaparecimentos Forçados, elaborado pela Provea, que reúne um total de 23 episódios de pessoas que foram presas entre setembro de 2024 e maio deste ano -incluindo o advogado. O documento será divulgado neste sábado (30), data que marca o Dia Internacional das Vítimas de Desaparecimentos Forçados. O dossiê afirma que familiares e advogados passam dias, semanas ou até meses sem saber o paradeiro ou o estado de saúde dos detidos. Das 23 pessoas, apenas quatro foram libertadas. Além disso, o Judiciário e os centros de detenção negam informações, restringem visitas e impedem que advogados de confiança acompanhem os casos, designando defensores públicos. A Provea segue sem qualquer informação sobre o paradeiro de quatro dos 23 casos contabilizados. As acusações feitas pelo regime também se repetem: terrorismo, financiamento ao terrorismo, incitação ao ódio, conspiração e traição à pátria. ""A maioria das detenções, cerca de 73,9% dos casos, foi realizada por organismos militares contra civis, como a Direção Geral de Contrainteligência Militar e a Guarda Nacional Bolivariana"", diz o coordenador da Provea, Oscar Murillo. ""Há um padrão generalizado de desaparecimentos forçados que violam gravemente os direitos humanos. Na maioria dos casos, o paradeiro das pessoas só foi descoberto em um período médio de sete meses."" Segundo a organização, essas práticas de perseguição foram intensificadas após as eleições presidenciais de julho do ano passado, que reconduziram Maduro a um terceiro mandato. Após o pleito, que tem inúmeras evidências de fraude, protestos tomaram o país, e os confrontos deixaram 28 mortos, cerca de 200 feridos e mais de 2.400 presos. Embora tenha conseguido abafar grandes manifestações, Maduro manteve a repressão. ""Tudo o que ocorre no país tem como origem a crise de legitimidade que o regime de Maduro tentou sufocar com mais repressão e ameaças. O resultado é a maior regressão antidemocrática da América do Sul"", afirma Murillo. De acordo com o informe da Provea, as pessoas foram detidas em diferentes estados do país, sendo a maioria no estado Táchira (6), que fica perto da fronteira com a Colômbia. O distrito de Caracas ficou em segundo lugar, com cinco casos. O restante ocorreu em outros seis distritos. O fator em comum é que, depois de levados, todos foram transferidos para centros de reclusão na capital ou arredores. De acordo com as informações obtidas, os detidos não tinham conhecimento de nenhuma investigação contra eles. Do total de 23 denúncias recebidas pela ONG, sete eram mulheres, o equivalente a 30% dos casos. Entre elas, uma estava grávida e ficou cinco meses sem poder receber visitas. As famílias também sofrem com os gastos que envolvem ter um parente nessa situação. ""Eduardo era o sustento da casa. Eu não trabalhava. Agora preciso cuidar de tudo: da casa, dos filhos, das contas"", afirma Emiselys, citando os custos das idas e vindas aos tribunais e centro de detenção. O casal, que está junto há 30 anos, tem dois filhos, uma menina de 13 anos e um jovem de 20 anos, estudante de Direito. ""É muito difícil para os dois. O mais velho às vezes se pergunta para que seguir [com os estudos] se aqui não se respeitam os direitos, e a carreira de advogado parece não existir"", afirma Emiselys. Apesar de ser impossibilitada de entrar em contato com o marido, ela vai ao centro de detenção para entregar roupas e comida. ""Agora, só permitem às sextas. Era a única forma de sentir alguma conexão [com ele], e agora está ainda mais restrito"", conta. Ela diz que ""o medo sempre existiu"", mas que seu marido sempre dizia ""que não podia se deixar paralisar"" pelo sentimento. ""Se não lutarmos hoje pela Constituição e pelos direitos humanos, serão nossos filhos ou netos que terão que fazê-lo amanhã"", completa. Acompanhe os mercados com nossas ferramentasAcessar gratuitamente Márcia Meng aguarda avaliação de documentos apreendidos para averiguar se há mais fundos envolvidos; até agora são 42 Esquadrão Antibombas inspecionou pertences do suspeito e não encontrou artefato explosivo ou arma Escritor morreu neste sábado (30) aos 88 anos em Porto Alegre Convidados do festival e artistas marcham contra a ofensiva militar de Israel, neste sábado, e reforçam o impacto político crescente do conflito No acumulado de 12 meses, déficit é de R$ 8,83 bilhões até julho, o equivalente a 0,07% do PIB A autarquia tem dois processos sancionadores abertos contra a Reag e três procedimentos envolvendo a BFL Gestão de Recursos Criminosos desviaram R$ 380 milhões do HSBC e R$ 40 milhões da Artta; BC conseguiu bloquear R$ 350 milhões Ahmed al-Rahawi e ""um número de ministros"" foram mortos em um ataque aéreo em Sanaã, capital do país O aumento da folha decorre tanto dos acordos já firmados com categorias do funcionalismo quanto da previsão de novos concursos e contratações no próximo ano A Polícia Civil informou que a investigação segue para localizar e capturar os demais",Valor Econômico
https://valor.globo.com/eu-e/noticia/2025/08/30/livros-um-questionamento-sobre-interesses-por-tras-da-inteligencia-artificial-licoes-de-gestao-de-mario-sergio-cortella.ghtml,2025-08-30,Livros: Um questionamento sobre interesses por trás da inteligência artificial; lições de gestão de Mario Sergio Cortella,"30/08/2025 08h00Atualizadoagora Atlas da IAKate Crawford - Trad.: Humberto do Amaral Edições Sesc, 380 págs., R$ 98,00 Acompanhe os mercados com nossas ferramentasAcessar gratuitamente Márcia Meng aguarda avaliação de documentos apreendidos para averiguar se há mais fundos envolvidos; até agora são 42 Esquadrão Antibombas inspecionou pertences do suspeito e não encontrou artefato explosivo ou arma Escritor morreu neste sábado (30) aos 88 anos em Porto Alegre Convidados do festival e artistas marcham contra a ofensiva militar de Israel, neste sábado, e reforçam o impacto político crescente do conflito No acumulado de 12 meses, déficit é de R$ 8,83 bilhões até julho, o equivalente a 0,07% do PIB A autarquia tem dois processos sancionadores abertos contra a Reag e três procedimentos envolvendo a BFL Gestão de Recursos Criminosos desviaram R$ 380 milhões do HSBC e R$ 40 milhões da Artta; BC conseguiu bloquear R$ 350 milhões Ahmed al-Rahawi e ""um número de ministros"" foram mortos em um ataque aéreo em Sanaã, capital do país O aumento da folha decorre tanto dos acordos já firmados com categorias do funcionalismo quanto da previsão de novos concursos e contratações no próximo ano A Polícia Civil informou que a investigação segue para localizar e capturar os demais criminosos",Valor Econômico
https://valor.globo.com/politica/noticia/2025/08/30/reajustes-e-reestruturao-elevam-em-r-35-bi-despesas-primrias-em-2026.ghtml,2025-08-30,Reajustes e reestruturação elevam em R$ 35 bi despesas primárias em 2026,"30/08/2025 13h58Atualizadoagora Osreajustes salariaise areestruturação de carreiraselevam em R$ 35,4 bilhões as despesas primárias da União com pessoal em 2026. O Projeto de Lei Orçamentária Anual (PLOA), enviado ontem ao Congresso, projeta a expansão desses gastos de R$ 315 bilhões para R$ 350,4 bilhões, incluindo servidores civis e militares. Acompanhe os mercados com nossas ferramentasAcessar gratuitamente Márcia Meng aguarda avaliação de documentos apreendidos para averiguar se há mais fundos envolvidos; até agora são 42 Esquadrão Antibombas inspecionou pertences do suspeito e não encontrou artefato explosivo ou arma Escritor morreu neste sábado (30) aos 88 anos em Porto Alegre Convidados do festival e artistas marcham contra a ofensiva militar de Israel, neste sábado, e reforçam o impacto político crescente do conflito No acumulado de 12 meses, déficit é de R$ 8,83 bilhões até julho, o equivalente a 0,07% do PIB A autarquia tem dois processos sancionadores abertos contra a Reag e três procedimentos envolvendo a BFL Gestão de Recursos Criminosos desviaram R$ 380 milhões do HSBC e R$ 40 milhões da Artta; BC conseguiu bloquear R$ 350 milhões Ahmed al-Rahawi e ""um número de ministros"" foram mortos em um ataque aéreo em Sanaã, capital do país O aumento da folha decorre tanto dos acordos já firmados com categorias do funcionalismo quanto da previsão de novos concursos e contratações no próximo ano A Polícia Civil informou que a investigação segue para localizar e capturar os demais criminosos",Valor Econômico
https://valor.globo.com/legislacao/noticia/2025/08/30/pgfn-compartilha-plataforma-de-cobranca-com-procuradorias-estaduais-e-municipais.ghtml,2025-08-30,PGFN compartilha plataforma de cobrança com procuradorias estaduais e municipais,"30/08/2025 08h30Atualizadohá 9 horas A Procuradoria-Geral da Fazenda Nacional (PGFN) compartilhou aplataformaque alberga seus diferentes sistemas usados para acobrançade tributos, como o Cadastro Informativo de Créditos Não Quitados do Setor Público Federal (Cadin) e o aplicativoDívida Aberta, com asprocuradorias estaduais e municipais. Explicações sobre os sistemas foram dadas durante o II Congresso Nacional da Dívida Ativa, realizado nessa semana. Acompanhe os mercados com nossas ferramentasAcessar gratuitamente Márcia Meng aguarda avaliação de documentos apreendidos para averiguar se há mais fundos envolvidos; até agora são 42 Esquadrão Antibombas inspecionou pertences do suspeito e não encontrou artefato explosivo ou arma Escritor morreu neste sábado (30) aos 88 anos em Porto Alegre Convidados do festival e artistas marcham contra a ofensiva militar de Israel, neste sábado, e reforçam o impacto político crescente do conflito No acumulado de 12 meses, déficit é de R$ 8,83 bilhões até julho, o equivalente a 0,07% do PIB A autarquia tem dois processos sancionadores abertos contra a Reag e três procedimentos envolvendo a BFL Gestão de Recursos Criminosos desviaram R$ 380 milhões do HSBC e R$ 40 milhões da Artta; BC conseguiu bloquear R$ 350 milhões Ahmed al-Rahawi e ""um número de ministros"" foram mortos em um ataque aéreo em Sanaã, capital do país O aumento da folha decorre tanto dos acordos já firmados com categorias do funcionalismo quanto da previsão de novos concursos e contratações no próximo ano A Polícia Civil informou que a investigação segue para localizar e capturar os demais criminosos",Valor Econômico
https://valor.globo.com/financas/noticia/2025/08/30/ataque-hacker-atinge-ambiente-pix-da-sinqia.ghtml,2025-08-30,Hackers desviam R$ 420 milhões após invadirem o ambiente Pix da Sinqia,"Em alta 30/08/2025 15h08Atualizadoagora Dois meses após a invasão hacker à C&M — que resultou emprejuízo estimado superior a R$ 1 bilhão, conforme mostrou oValor—, a Sinqia, empresa de software controlada pela porto-riquenha Evertec, foi alvo de um ataque na última sexta-feira. A estimativa é que ao menos R$ 420 milhões tenham sido desviados de clientes atendidos pela companhia. Acompanhe os mercados com nossas ferramentasAcessar gratuitamente Márcia Meng aguarda avaliação de documentos apreendidos para averiguar se há mais fundos envolvidos; até agora são 42 Esquadrão Antibombas inspecionou pertences do suspeito e não encontrou artefato explosivo ou arma Escritor morreu neste sábado (30) aos 88 anos em Porto Alegre Convidados do festival e artistas marcham contra a ofensiva militar de Israel, neste sábado, e reforçam o impacto político crescente do conflito No acumulado de 12 meses, déficit é de R$ 8,83 bilhões até julho, o equivalente a 0,07% do PIB A autarquia tem dois processos sancionadores abertos contra a Reag e três procedimentos envolvendo a BFL Gestão de Recursos Criminosos desviaram R$ 380 milhões do HSBC e R$ 40 milhões da Artta; BC conseguiu bloquear R$ 350 milhões Ahmed al-Rahawi e ""um número de ministros"" foram mortos em um ataque aéreo em Sanaã, capital do país O aumento da folha decorre tanto dos acordos já firmados com categorias do funcionalismo quanto da previsão de novos concursos e contratações no próximo ano A Polícia Civil informou que a investigação segue para localizar e capturar os demais criminosos",Valor Econômico
https://valor.globo.com/politica/noticia/2025/08/30/polcia-do-rio-prende-dois-envolvidos-em-assalto-a-ex-mulher-de-bolsonaro.ghtml,2025-08-30,Polícia do Rio prende dois envolvidos em assalto a ex-mulher de Bolsonaro,"30/08/2025 13h48Atualizadohá 4 horas APolícia Civil do Riocapturou, na sexta-feira (29), dois homens envolvidos no roubo a familiares do ex-presidenteJair Bolsonaro. As prisões ocorreram no bairro Paraíso, em Resende, sul do Estado do Rio, cinco dias após o crime. Os assaltantes renderam no domingo (24)Rogéria, aex-mulher de Bolsonaro e mãe de Flavio, Carlos e Eduardo Bolsonaro. Depois, entraram na residência dela, roubaram diversos itens e fugiram no carro da família. Os pais de Rogéria também estavam na casa. Em nota, a Polícia Civil do Rio informou que, ainda no domingo, os agentes se reuniram e as diligências foram iniciadas. Foram realizadas buscas e análises de imagens, sendo possível identificar inicialmente as características dos veículos utilizados pelos criminosos. Também foi feito o acompanhamento e monitoramento dos veículos, sendo possível afirmar a participação de ao menos cinco bandidos na ação. As investigações ocorreram também no Estado de São Paulo, de forma a verificar o trajeto dos criminosos após o roubo. ""A partir disso, foi possível definir que os autores utilizaram no dia do crime placas furtadas, que foram posteriormente inutilizadas e substituídas por placas originais. Após abandonarem o carro roubado das vítimas, os autores retornaram para Resende e esconderam um dos veículos utilizados na ação, que foi apreendido nesta sexta com os autores"", diz a nota divulgada pelo governo do Estado do Rio. Também foram apreendidos um revólver, munição, simulacro de pistola, toucas ninjas, celulares e trajes usados no crime. Os agentes ainda recuperaram bens roubados, que foram reconhecidos pelas vítimas. A Polícia Civil informou que a investigação segue para localizar e capturar os demais criminosos. Acompanhe os mercados com nossas ferramentasAcessar gratuitamente Márcia Meng aguarda avaliação de documentos apreendidos para averiguar se há mais fundos envolvidos; até agora são 42 Esquadrão Antibombas inspecionou pertences do suspeito e não encontrou artefato explosivo ou arma Escritor morreu neste sábado (30) aos 88 anos em Porto Alegre Convidados do festival e artistas marcham contra a ofensiva militar de Israel, neste sábado, e reforçam o impacto político crescente do conflito No acumulado de 12 meses, déficit é de R$ 8,83 bilhões até julho, o equivalente a 0,07% do PIB A autarquia tem dois processos sancionadores abertos contra a Reag e três procedimentos envolvendo a BFL Gestão de Recursos Criminosos desviaram R$ 380 milhões do HSBC e R$ 40 milhões da Artta; BC conseguiu bloquear R$ 350 milhões Ahmed al-Rahawi e ""um número de ministros"" foram mortos em um ataque aéreo em Sanaã, capital do país O aumento da folha decorre tanto dos acordos já firmados com categorias do funcionalismo quanto da previsão de novos concursos e contratações no próximo ano A Polícia Civil informou que a investigação segue para localizar e capturar os demais criminosos",Valor Econômico
https://valor.globo.com/brasil/noticia/2025/08/30/governo-conta-com-receitas-incertas-para-cumprir-meta-de-supervit-em-2026.ghtml,2025-08-30,Governo conta com receitas incertas para cumprir meta de superávit em 2026,"30/08/2025 08h13Atualizadohá 9 horas Ogoverno federalconta com R$ 27 bilhões doPrograma de Transação Integral(PTI), de negociação de dívidas de grandes empresas, e R$ 31 bilhões davenda futura de participação da União em campos de petróleopara atingir a meta de superávit primário de 0,25% doProduto Interno Bruto (PIB)em 2026. Os números foram divulgados ontem pelos ministérios do Planejamento e Orçamento e da Fazenda no Projeto de Lei Orçamentária Anual (PLOA) do ano que vem. Além disso, calcula que aumentará a arrecadação em R$ 19,8 bilhões com o corte linear dos benefícios tributários infraconstitucionais, a partir de um projeto de lei elaborado pelo Ministério da Fazenda e protocolado também ontem pelo líder do governo na Câmara dos Deputados, José Guimarães (PT-CE). Há, ainda, mais R$ 10 bilhões previstos com a nova regra de compensação tributária prevista na Medida Provisória 1.303, de 2025, em tramitação no Congresso Nacional, e cerca de R$ 20 bilhões em dividendos extraordinários. Essas são as principais receitas incertas que constam na peça orçamentária do próximo ano. Apesar de estarem num volume menor do que em anos anteriores, demonstram que o governo federal ainda precisa recorrer a medidas extras para garantir um Orçamento dentro da meta fiscal proposta, que é de um superávit de 0,25% do Produto Interno Bruto, o equivalente a R$ 34,3 bilhões. O PTI é um instrumento da Procuradoria-Geral da Fazenda Nacional e da Receita Federal que permite a negociação de dívidas de grandes empresas com a União.Como publicado há duas semanas peloValor, o governo federal não contava com esses recursos para fechar as contas de 2026. Em entrevista coletiva para detalhar o PLOA, o secretário-executivo do Ministério da Fazenda, Dario Durigan, afirmou que a decisão pela retomada do PTI foi uma demanda das empresas. Segundo ele, as companhias querem negociar não só dívidas tributárias, mas também débitos junto a agências reguladoras e com o Conselho Administrativo de Defesa Econômica (Cade). O chefe do Centro de Estudos Tributários e Aduaneiros da Receita Federal, Claudemir Malaquias, por sua vez, explicou que, dos R$ 27 bilhões, R$ 7 bilhões devem vir por meio de transações realizadas entre empresas e agências reguladoras. A respeito da arrecadação de R$ 31 bilhões projetada com venda futura de participações em campos de petróleo, Durigan destacou que já foi aprovada pelo Legislativo uma lei que trata do tema. A previsão é que leilões ocorram em 2026 e sejam realizados pela PPSA, a estatal do pré-sal. Ele também afirmou que essa receita tem um ""grau de incerteza"" baixo, justamente porque não depende mais de aprovação do Congresso, apenas de atos administrativos para viabilizar a realização do leilão no próximo ano. Não há garantias, no entanto, de que os leilões serão bem sucedidos. No caso do projeto, apresentado ontem, que corta linearmente 10% dos benefícios tributários infraconstitucionais, o secretário-executivo afirmou que o governo federal ainda vai debater se há incidência da ""noventena"". Caso seja necessário, o texto teria de ser sancionado até o final de setembro. Esse texto também precisa ser aprovado pelo Congresso para que o corte de fato seja efetivo e gere a receita esperada. Em termos absolutos, a meta de 2026 é de um superávit de R$ 34,3 bilhões. Pelo PLOA 2026, o governo projeta que terá resultado positivo de R$ 34,5 bilhões, ou seja, um pouco acima da meta oficial. Esse valor desconta R$ 57,8 bilhões em despesas que não serão computadas na meta de 2026, como o pagamento de parte de precatórios. O texto também prevê aumento de R$ 153,7 bilhões nas despesas obrigatórias em 2026, em relação à previsão de gastos para este ano. Segundo o governo, o maior aumento deve ser na Previdência Social, com previsão de o governo gastar R$ 89 bilhões a mais que neste ano com pagamento de benefícios. Depois, as maiores altas são em gastos com pessoal (alta de R$ 39,7 bilhões); abono e seguro desemprego (R$ 8,8 bilhões); obrigatórias com controle de fluxo (R$ 8,8 bilhões); e Benefício de Prestação Continuada - BPC (R$ 6,2 bilhões). Já o limite de despesas primárias para 2026 foi fixado em R$ 2,428 trilhões, valor que inclui todos os Poderes. Esse valor representa um aumento líquido de 168 bilhões (7,4%) em relação ao previsto para 2025. Em termos reais, a variação foi de 2,5% acima da inflação, o teto permitido pela lei do novo arcabouço fiscal. O PLOA prevê, ainda, os seguintes pisos de gastos para 2026: R$ 245,5 bilhões para saúde; R$ R$ 133,7 bilhões para educação; e R$ 83 bilhões para investimentos, incluindo o Novo Programa de Aceleração do Crescimento (PAC). Esses são os valores mínimos a serem gastos pelo governo nessas áreas, podendo ser superados. Por fim, o Orçamento prevê que o salário mínimo passará dos atuais R$ 1.518 para R$ 1.631 no ano que vem. Acompanhe os mercados com nossas ferramentasAcessar gratuitamente Márcia Meng aguarda avaliação de documentos apreendidos para averiguar se há mais fundos envolvidos; até agora são 42 Esquadrão Antibombas inspecionou pertences do suspeito e não encontrou artefato explosivo ou arma Escritor morreu neste sábado (30) aos 88 anos em Porto Alegre Convidados do festival e artistas marcham contra a ofensiva militar de Israel, neste sábado, e reforçam o impacto político crescente do conflito No acumulado de 12 meses, déficit é de R$ 8,83 bilhões até julho, o equivalente a 0,07% do PIB A autarquia tem dois processos sancionadores abertos contra a Reag e três procedimentos envolvendo a BFL Gestão de Recursos Criminosos desviaram R$ 380 milhões do HSBC e R$ 40 milhões da Artta; BC conseguiu bloquear R$ 350 milhões Ahmed al-Rahawi e ""um número de ministros"" foram mortos em um ataque aéreo em Sanaã, capital do país O aumento da folha decorre tanto dos acordos já firmados com categorias do funcionalismo quanto da previsão de novos concursos e contratações no próximo ano A Polícia Civil informou que a investigação segue para localizar e capturar os demais criminosos",Valor Econômico
