url,data,titulo,texto,fonte
https://exame.com/carreira/nao-entendeu-um-assunto-ative-o-modo-explicativo-do-chatgpt-com-este-prompt/,2025-07-04,Não entendeu um assunto? Ative o ‘modo explicativo’ do ChatGPT com este prompt,"Carreira em inteligência artificial pede o desenvolvimento de habilidades técninas e comportamentais (Andriy Onufriyenko/Getty Images) Redatora Publicado em4 de julho de 2025 às17h29. Entender um tema complicado pode ser difícil. Mas explicar esse mesmo tema de forma simples exige clareza, lógica e objetividade. A boa notícia? O ChatGPT consegue fazer isso com excelência,desde que receba o comando certo. Com apenas uma frase, qualquer pessoa pode transformar a IA em uma máquina de explicações acessíveis, perfeitas para quem está aprendendo algo novo ou precisa entender o básico antes de se aprofundar. EXAME e Saint Paul estão com vagas abertas para treinamento em Inteligência Artificial por R$ 37 e direito a certificado; clique aqui para garantir a sua vaga O comando que você pode usar é muito fácil: “Explique este assunto como se eu tivesse 10 anos. Use linguagem simples, frases curtas e exemplos do dia a dia.” Você pode ir além e pedir variações como: Quer liderar projetos na sua empresa e ganhar bem por isso? Esse treinamento de 4 aulas da EXAME + Saint Paul revela os conceitos básicos e principais oportunidades da inteligência artificial por R$ 37,00. Clique aqui e inscreva-se A cada ajuste, o ChatGPT encontra formas novas de tornar o conteúdo mais acessível — sem perder o sentido. A EXAME, maior plataforma de negócios do Brasil, se une à Saint Paul, uma das melhores escolas de negócios do mundo, para apresentar oPré-MBA em Inteligência Artificial para Negócios, um treinamento virtual e com certificado que revela o caminho paraconquistar uma carreira nesse setorque só cresce. Durante o treinamento, os alunos irão conhecer as ferramentas de IA mais importantes do mercado, vão descobrir os bastidores de casos de sucesso e poderão traçar um plano de carreira para conquistar o tão sonhado sucesso profissional. Todo esse conteúdo, que soma 3 horas de duração, está distribuído emquatro aulas 100% online(sendo a última delas ao vivo), que misturam fundamentos teóricos e práticos.O investimento é de R$ 37,00. Estudo da IBM revela avanço estratégico da IA nas empresas do Brasil, com foco em inovação e ROI Com foco em retenção, precificação e diversificação, empreendedora transformou um negócio que mal lucrava em uma máquina milionária Com este comando, o ChatGPT cria legendas sob medida para o seu post com tom certo, CTA e zero clichê Com este prompt, o ChatGPT vira seu roteirista e entrega vídeos com começo, meio, fim e chamada para ação 01 02 03 exame no whatsapp Receba as notícias da Exame no seu WhatsApp Nas principais tendências de carreira e do mercado. E-mail inválido Carreira 3.0",Exame
https://exame.com/negocios/6h-de-sono-uma-mordida-de-donuts-e-banho-diario-um-dia-na-rotina-do-homem-mais-rico-do-mundo/,2025-07-04,"6h de sono, uma mordida de donuts e banho diário: um dia na rotina do homem mais rico do mundo","Elon Musk: como o bilionário construiu a maior fortuna do mundo (Antonio Masiello / Colaborador/Getty Images) Redação Exame Publicado em4 de julho de 2025 às17h13. Os últimos dias podem não ter sido dos mais fáceis, mas foram sem dúvida produtivos paraElon Musk.O bilionário dispensa apresentações: dono daSpaceX,Teslae doX(antigo Twitter), o magnata consta em primeiro lugar da lista das pessoas mais ricas do mundo de 2025, produzida pelaForbes.São mais deUS$ 342 bilhões (R$ 1,95 trilhão)em patrimônio. Oimpério bilionáriofoi tomando proporções estratosféricas aos poucos e é compartilhado com a esposa e outros dez filhos. Mas não foi construído numa simples jornada de 44 horas semanais: o horário de trabalho do magnata vai muito além das 8 horas diárias de trabalho. OBusiness Insiderseparou como é a rotina do bilionário, de acordo com suas entrevistas, tuítes e livro autobiográfico. Confira: Dormir 8 horas ou mais é um luxo que o segundo homem mais rico do mundo não usufrui. Musk afirmou aoThe Wall Street Journalno ano passado que vai dormir por volta das 3h da manhã e acorda por volta das 9h, já com o smartphone em mãos. Seis horas diárias de sono são suficientes para ele. Depois das poucas horas de sono, Musk começa o dia comendo um donuts. Mas não inteiro: ""eu só como 0.4 donut pela manhã, porque meu cérebro o qualifica como 0 donuts"", disse ele no X em outubro de 2023. O bilionário é fã do doce, mas não costuma dizer nas redes sociais, tampouco em entrevistas, qual seu sabor de donut favorito. Nascido no Sul da África, o bilionário valoriza o banho diário e o computa como uma importante parte de sua rotina. Depois, quando arrumado, decide em qual Tesla ir para o escritório. Ser dono de três imensas empresas está longe de ser um trabalho simples e se dividir entre elas pode ser muito desafiador. Em inúmeras entrevistas,Muskadmitiu que se dedica a cada uma delas de acordo com as ondas de crises e alterações da bolsa de valores. ""Eu vou dormir, então acordo, trabalho e volto a dormir, e acordo, e tudo se repete. Faço isso sete dias na semana e tenho de fazer por um tempo, não tenho escolha"", disse ele aoTWSJ. Ele também destacou que quando o antigo Twitter estiver bem estabelecido, no caminho ""certo"", o trabalho será menor. ""Acredito que será bem mais fácil de administrar o X do que o SpaceX e a Tesla. A empresa de carros elétricos ""compreende a maior parte do meu tempo de trabalho. E eu trabalho todos os dias da semana, é muito raro que eu tire um domingo de folga"", afirmou ele no X. Aos 52 anos,odono da Tesla deve ainda conquistar seu primeiro trilhão antes de morrer. Considerado um dos maiores empreendedores do século 21, Musk fez fortuna com a criação do PayPal, sistema de pagamentos online. Ele também é dono de uma série de empresas, muito além da montadora de carros elétricos. É o fundador e CEO da SpaceX, além de liderar a startup de chips cerebrais Neuralink e a empresa de infraestrutura The Boring Company, e ter adquirido o X (ex-Twiiter). Elon Musk nasceu em Pretória, África do Sul, em 1971. É um dos três filhos do casal Errol e Maye Musk. Sua mãe era nutricionista e seu pai engenheiro e dono de uma mina de esmeraldas. Aos 12 anos, Elon engatou na programação ao escrever um código de videogame.Aos 17, Musk deixou o país para evitar ser recrutado pelas Forças Armadas. Foi morar no Canadá, onde ingressou na Faculdade de Queens University, em Ontario. Depois de dois anos estudando na instituição, Musk transferiu para a Universidade da Pensilvânia onde se formou em física. Fez o segundo grau de barechal em economia, na Wharton School of Business. Aos 24 anos, em 1995, Musk foi morar na Califórnia para começar um doutorado em física aplicada, mas abandonou o programa em Stanford para dar seus passos como empreendedor. Em 2002, se tornou cidadão americano. Seu primeiro negócio foi a Zip2, empresa que fundou com seu irmão Kimbal e com o sócio Greg Kouri. Depois de acumular uma fortuna de cerca de US$ 100 milhões com o PayPal, Musk fundou a Space Exploration Technologies Corp., conhecida como SpaceX, em maio de 2002. O magnata sempre teve interesse em explorar soluções que ajudassem a melhorar a condição da vida humana na Terra ou que pelo menos evitassem a sua extinção. Com sua reserva, Musk criou sua própria empresa para fomentar a indústria aeroespacial a custos mais acessíveis. Seu desejo é levar a humanidade para colonizar Marte por meio da SpaceX. A Tesla, maior montadora de veículos elétricos do mundo, passou a fazer parte dos planos de Musk em 2004. A fabricante foi fundada em 2003 por Martin Ebergard e Marc Tarpenning, que financiou a empresa até a rodada Série A de investimento. Musk liderou a rodada de investimento e em fevereiro de 2004 se tornou presidente do conselho de administração da Tesla. O objetivo de aquisição da empresa guarda relação com um de seus princípios ao realizar negócios: diminuir os efeitos do aquecimento global. Atualmente, a Tesla produz centenas de milhares de carros elétricos todos os anos. (Com Agência O Globo) A rede de donuts e cafeterias desembarcou no Brasil em abril Com autenticidade, nostalgia e visão estratégica, a marca mostra como transformar processo criativo em conexão e negócio CEO da Trivago libera as manhãs de encontros para mergulhar em pensamento profundo e isso reflete na cultura da empresa Heather Torres transformou abóboras, porches e uma ideia sazonal em um modelo de liderança replicável 01 02 03 exame no whatsapp Receba as notícias da Exame no seu WhatsApp Nos acontecimentos mais relevantes do Brasil e mundo. E-mail inválido Desperta",Exame
https://exame.com/carreira/como-uma-ceo-faturou-us-1-milhao-em-6-meses-corrigindo-esses-cinco-erros-financeiros/,2025-07-04,Como uma CEO faturou US$ 1 milhão em 6 meses corrigindo esses cinco erros financeiros,"Sarah Choudhary: veja os cinco erros financeiros que a CEO resolveu para levar sua empresa ao milhão (AdobeStock/Divulgação) Redatora Publicado em4 de julho de 2025 às16h56. Sarah Choudharyé CEO daICE Innovations, empresa com expertise em soluções tecnológicas para armazenamento e inteligência artificial. No começo do negócio, a empresa já estava operando no limite, sem gerar lucro significativo, mesmo com vendas constantes. Sarah Choudhary sabia que o problema não era a falta de clientes ou de esforço. O desafio não era vender mais, mas entender para onde estava indo o dinheiro. Durante sua trajetória, ela listou cinco erros financeiros que precisavam ser corrigidos. As informações foram retiradas deEntrepreneur. A primeira mudança envolveu um ponto negligenciado por muitas empresas: a retenção de clientes. Sarah percebeu que o custo para conquistar novos consumidores era muito mais alto do que manter os antigos. Então ela criou ofertas exclusivas para clientes recorrentes, implementou um sistema automático de acompanhamento de clientes e facilitou o processo de reembolso. O resultado foi umaumento de 35% na retenção, o que se traduziu em US$ 210 mil de receita anual adicional, sem qualquer investimento em publicidade. Outro ponto essencial foi a eficiência da plataforma de vendas. Apesar de altos investimentos em anúncios, o site não convertia. Sarah redesenhou a página decheckout, adicionou suporte via chat e otimizou a velocidade do site.Essas ações elevaram a taxa de conversão de 2,3% para 4,8%. O mesmo investimento em mídia paga passou a gerar mais que o dobro em retorno, com um salto de US$ 1.500 para US$ 3.800 para cada mil dólares investidos. Na gestão de portfólio, Sarah constatou que variedade excessiva pode ser um tiro no pé. Dos mais de 50 produtos ofertados, apenas 10 respondiam por 80% da receita. Elacortou os itens menos vendidos, reduziu custos de armazenamento e concentrou os esforços nos que eram mais vendidos. A ação simplificou a operação e aumentou as margens de lucro em 22%. O quarto ajuste foi precificar corretamente. Durante anos, Sarah hesitou em aumentar os preços. Com estratégias como valor agregado, embalagem premium, ofertas combinadas e estudo dos concorrentes, ela ajustou o preço em 20%. O volume de vendas permaneceu estável, masolucro por unidade subiu 27%, representando mais US$ 310 mil em lucro sem aumento de volume. Adiversificação de receitas consolidou o crescimento. Sarah criou um modelo de assinatura mensal, com mais de 700 clientes pagando US$ 29, além de lançar um curso online que gerou US$ 85 mil em 30 dias. Parcerias estratégicas também expandiram o alcance da marca, adicionando 7 mil novos consumidores. No total,essa frente rendeu US$ 450 mil em meio ano. Dominar os fundamentos da saúde financeira deixou de ser tarefa exclusiva de contadores ou CFOs. Empreendedores de qualquer porte e setor precisam ter controle total sobre os números do negócio — e isso exige desenvolver hábitos como os apresentados. Por isso, a EXAME, em parceria com a Saint Paul Escola de Negócios, lançou oPré-MBA em Finanças Corporativas— um treinamento criado para quem quer dominar a lógica dos números e utilizá-la como diferencial na trajetória profissional,por R$37,00. Com este comando, o ChatGPT cria legendas sob medida para o seu post com tom certo, CTA e zero clichê Com este prompt, o ChatGPT vira seu roteirista e entrega vídeos com começo, meio, fim e chamada para ação Um grupo de cofundadores descobriu que a rotação de liderança era o caminho para decisões melhores, menos ego e talentos ocultos Saiba o que revisar no salário, benefícios, cláusulas e cultura ao analisar uma proposta de emprego 01 02 03 exame no whatsapp Receba as notícias da Exame no seu WhatsApp Nas principais tendências de carreira e do mercado. E-mail inválido Carreira 3.0",Exame
https://exame.com/mundo/hamas-aceita-proposta-de-cessar-fogo-dos-estados-unidos-diz-agencia/,2025-07-04,"Hamas aprova pontos principais da proposta de cessar-fogo dos Estados Unidos, diz agência","Redação Exame Publicado em4 de julho de 2025 às16h55. Última atualização em4 de julho de 2025 às17h15. O grupo palestinoHamasenviou uma resposta positiva à proposta de cessar-fogo para aFaixa de Gaza, liderada pelo presidente dos Estados Unidos, Donald Trump. O acordo prevê uma trégua de 60 dias, a liberação de reféns ainda mantidos no território e o retorno da ajuda humanitária. O papel de Trump, como garantidor do cessar-fogo e das futuras conversas sobre o fim do conflito, foi um elemento crucial para o avanço das negociações. ""Entregamos aos mediadores,CatareEgito,nossa resposta à proposta de cessar-fogo"", afirmou uma autoridade do Hamas, em entrevista à Reuters. ""A resposta do Hamas é positiva e acredito que deve ajudar e facilitar a obtenção de um acordo"", completou o oficial palestino. De acordo com o jornalal-Araby, doCatar, oHamasconcordou com os ""pontos principais"" do plano, mas solicitou algumas modificações na linguagem do texto antes de sua aprovação final. O grupo indicou que daria uma resposta definitiva sobre o plano ainda nesta sexta-feira. O plano proposto, que é semelhante a negociações anteriores mediadas pelosEUA, CatareEgito,estabelece uma primeira etapa de cessar-fogo de 60 dias, durante a qual ambas as partes devem cumprir a trégua sem violações. O Hamas se comprometeu a libertar dez dos aproximadamente 20 reféns israelenses ainda vivos em Gaza e a entregar os restos mortais de 18 reféns mortos no cativeiro. Em troca, Israel liberaria um número ainda não especificado de prisioneiros palestinos. Além disso, o plano prevê a retomada da entrada de ajuda humanitária por meio de canais tradicionais, como asNações Unidas, em vez de depender exclusivamente da Fundação Humanitária de Gaza (GHF), apoiada pelos EUA e Israel, mas questionada pelaONU. A retirada das tropas israelenses, um ponto controverso, também está contemplada: elas devem se retirar de pontos acordados no norte de Gaza no primeiro dia de cessar-fogo e do sul após a troca de reféns. Um dos aspectos mais destacados das negociações foi o compromisso assumido por Trump em garantir não apenas o cessar-fogo, mas também que os termos do plano, incluindo as futuras negociações sobre o fim definitivo da guerra e a libertação de todos os reféns, sejam cumpridos. Em março, após um impasse sobre a segunda fase de um cessar-fogo, Israel retomou os ataques contra Gaza, alegando a necessidade de uma operação preventiva contra o Hamas. Agora, Trump se comprometeu a assegurar que Israel não viole a trégua e que as partes cumpram suas obrigações. Na terça-feira, Israel concordou com o plano, que será discutido pelo Gabinete do primeiro-ministro Benjamin Netanyahu, que viajará para os EUA na próxima semana. Trump, em sua rede social, Truth Social, expressou esperança de que o Hamas aceite o acordo, alertando que, caso contrário, a situação só piorará. ""Espero, para o bem do Oriente Médio, que o Hamas aceite este acordo"", escreveu o presidente dos EUA. Apesar dos avanços nas negociações, questões importantes permanecem em aberto. Em março, Netanyahu havia proposto um plano para assumir o controle de Gaza e realocar a população, uma medida amplamente criticada pela comunidade internacional. Além disso, não está claro se Israel manterá alguma presença militar em Gaza após um eventual acordo final. Netanyahu já afirmou que não abriria mão de manter zonas de segurança ao longo das fronteiras com Israel e o Egito, enquanto alguns aliados de seu governo defendem uma ocupação permanente de Gaza e o desarmamento completo do Hamas. A situação humanitária também continua sendo uma grande preocupação. De acordo com a UNRWA, a agência da ONU para os refugiados palestinos, 85% do território de Gaza está sob controle militar israelense ou sob ordens de retirada forçada. Desde março, quando o último cessar-fogo foi rompido, cerca de 714 mil civis foram deslocados internamente. A insegurança em relação ao retorno dos civis às suas casas e a falta de uma estratégia clara para a movimentação segura da população continuam a ser desafios enormes. Nas horas que antecederam o anúncio do cessar-fogo, Israel intensificou seus ataques a Gaza, resultando em mais de 100 mortos entre quinta e sexta-feira, incluindo em áreas próximas a pontos de distribuição de alimentos. As autoridades israelenses limitaram a movimentação e o abastecimento, criando um novo método militarizado de distribuição de alimentos, o que tem gerado críticas internacionais. De acordo com a ONU, desde maio, 613 pessoas foram mortas perto de postos de ajuda em Gaza, sendo 509 em áreas controladas pela GHF. A porta-voz do Escritório das Nações Unidas para os Direitos Humanos, Ravina Shamdasani, afirmou que as informações continuam chegando e que a situação é inaceitável. ""Essa carnificina precisa parar agora"", afirmou Aitor Zabalgogeazkoa, coordenador de emergências da ONG Médicos Sem Fronteiras, alertando para a crise humanitária que afeta a população de Gaza. Acordo entre China e EUA resulta na flexibilização das restrições comerciais e no fortalecimento das relações econômicas bilaterais O governo chinês promove isenções fiscais para tecnologia e manufatura avançada, incentivando o crescimento de setores emergentes Alto Comissariado das Nações Unidas para os Direitos Humanos afirma que 613 pessoas morreram durante distribuições de ajuda humanitária, a grande maioria em centrais de organização americana Ataques russos aumentam enquanto negociações de paz permanecem estagnadas, preocupando líderes internacionais 01 02 03 exame no whatsapp Receba as notícias da Exame no seu WhatsApp Nos acontecimentos mais relevantes do Brasil e mundo. E-mail inválido Desperta",Exame
https://exame.com/carreira/este-comando-ajuda-o-chatgpt-a-escrever-uma-legenda-perfeita-para-o-seu-post/,2025-07-04,Este comando ajuda o ChatGPT a escrever uma legenda perfeita para o seu post,"Inteligência artificial é o novo normal do mercado (OsakaWayne Studios/Getty Images) Redatora Publicado em4 de julho de 2025 às16h52. Uma boa imagem pode chamar atenção, mas é a legenda que gera engajamento, salva o conteúdo e cria conexão com o público. O problema? Escrever uma legenda boa dá trabalho, especialmente quando o objetivo é ser direto, criativo, claro e ainda convencer. A boa notícia é que o ChatGPT pode resolver isso. Com ocomando certo, a IA entende o tom, o público e o objetivo do post — e entregauma legenda sob medida, pronta para ser publicada. EXAME e Saint Paul estão com vagas abertas para treinamento em Inteligência Artificial por R$ 37 e direito a certificado; clique aqui para garantir a sua vaga “Quero uma legenda para o seguinte post: [descreva o conteúdo da imagem, o tema ou a ideia central].Escreva com até [X] caracteres, em tom [informal/formal/provocativo/leve/profissional], com uma chamada para ação ao final.Evite clichês e use uma linguagem natural, como se eu estivesse falando com meu público.” Esse modelo de prompt funciona tanto para Instagram, LinkedIn, TikTok ou até posts de carrossel com CTA estratégico. “Quero uma legenda para um post com 3 dicas de produtividade para quem trabalha de casa.Tom direto e leve, com até 300 caracteres, e uma pergunta no final para gerar comentários.” Quer liderar projetos na sua empresa e ganhar bem por isso? Esse treinamento de 4 aulas da EXAME + Saint Paul revela os conceitos básicos e principais oportunidades da inteligência artificial por R$ 37,00. Clique aqui e inscreva-se “Crie uma legenda para um post que mostra os bastidores da minha consultoria.Tom inspirador, sem vender diretamente, mas com CTA para visitar o link da bio.” “Legenda para um post sobre por que trabalhar demais virou status.Tom provocador e crítico, com chamada para reflexão nos comentários.” A EXAME, maior plataforma de negócios do Brasil, se une à Saint Paul, uma das melhores escolas de negócios do mundo, para apresentar oPré-MBA em Inteligência Artificial para Negócios, um treinamento virtual e com certificado que revela o caminho paraconquistar uma carreira nesse setorque só cresce. Durante o treinamento, os alunos irão conhecer as ferramentas de IA mais importantes do mercado, vão descobrir os bastidores de casos de sucesso e poderão traçar um plano de carreira para conquistar o tão sonhado sucesso profissional. Todo esse conteúdo, que soma 3 horas de duração, está distribuído emquatro aulas 100% online(sendo a última delas ao vivo), que misturam fundamentos teóricos e práticos.O investimento é de R$ 37,00. Com este prompt, o ChatGPT vira seu roteirista e entrega vídeos com começo, meio, fim e chamada para ação Um grupo de cofundadores descobriu que a rotação de liderança era o caminho para decisões melhores, menos ego e talentos ocultos Saiba o que revisar no salário, benefícios, cláusulas e cultura ao analisar uma proposta de emprego Entenda por que 57% dos jovens estão pessimistas e descubra estratégias para ganhar confiança e clareza na carreira 01 02 03 exame no whatsapp Receba as notícias da Exame no seu WhatsApp Nas principais tendências de carreira e do mercado. E-mail inválido Carreira 3.0",Exame
