url,data,titulo,texto,fonte
https://exame.com/brasil/apos-tragedia-em-sc-governo-diz-que-vai-discutir-regulamentacao-de-voos-com-balao/,2025-06-21,"Após tragédia em SC, governo diz que vai discutir regulamentação de voos com balão","Redação Exame Publicado em21 de junho de 2025 às19h57. OMinistério do Turismose manifestou neste sábado, 21,após o acidente envolvendo um balão turístico emSanta Catarina, que resultou na morte deoito pessoase deixou13 feridos. Em nota oficial, o ministério afirmou que está acompanhando de perto os desdobramentos do incidente e que irá discutir a regulamentação de voos com balão. O acidente, ocorrido durante uma atividade de balonismo no sul do Brasil, traz à tona a questão da segurança nas operações turísticas com balões. Segundo a nota, desde o início de 2025, o ministério tem se empenhado em parcerias com oSebraee aAgência Nacional de Aviação Civil (ANAC)para a criação deuma regulamentação específicaque vise melhorar as condições de segurança e permitir o desenvolvimento sustentável dessa modalidade no país. O ministério anunciou que já na próxima semana haverá umareuniãocom as instituições envolvidas no processo de regulamentação do balonismo, com o objetivo de avançar significativamente na definição de regras claras para as operações de voos de balão em atividades turísticas. O intuito, segundo o comunicado, é estabelecer umalegislação específica, que garanta asegurançade passageiros e operadores, além de fomentar o desenvolvimento desse segmento turístico no Brasil. A regulamentação, de acordo com o ministério, terá um foco nasnormas de segurança, buscando estabelecer requisitos mais rígidos para as operações de balões turísticos, incluindo exigências para o registro de empresas, capacitação dos operadores e a manutenção das aeronaves. O governo também indicou que a parceria com oSebraepode ajudar no desenvolvimento de pequenas empresas do setor, ao mesmo tempo em que promove umaavaliação rigorosadas condições operacionais. O Ministério do Turismo lamenta o acidente ocorrido neste sábado em Santa Catarina e se solidariza com os familiares das vítimas, neste momento de perda. Desde o início do ano, o Ministério do Turismo tem trabalhado em parceria com o Sebrae e a ANAC (Agência Nacional de Aviação Civil) para regulamentação do balonismo para fins turísticos no Brasil. A expectativa é que, já na próxima semana, haja um avanço significativo nesse processo, em decorrência de uma reunião com as entidades envolvidas no tema. O objetivo é que o país já possua uma regulamentação específica e clara para a operação de voos de balão em atividades turísticas, visando garantir a segurança dos praticantes e impulsionar o desenvolvimento desse segmento no Brasil. Acidente que matou 8 pessoas em Praia Grande evidencia descumprimento de normas e fiscalização precária no balonismo turístico Jovem de 26 anos caiu 300 metros durante subida ao vulcão Rinjani e só foi localizada após uso de drone por turistas Segundo o Corpo de Bombeiros, havia 21 pessoas no passeio; 13 foram resgatadas com vida 21 pessoas estavam no passeio turístico; 13 sobreviveram 01 02 03 exame no whatsapp Receba as notícias da Exame no seu WhatsApp Nos acontecimentos mais relevantes do Brasil e mundo. E-mail inválido Desperta",Exame
https://exame.com/mundo/decisao-dos-eua-sobre-guerra-ainda-nao-foi-tomada-mas-pode-ocorrer-nos-proximos-dias/,2025-06-21,"Decisão dos EUA sobre guerra ainda não foi tomada, mas pode ocorrer nos próximos dias, diz NYT","Drone israelense abatido no Irã, segundo o governo iraniano (Exército do Irã/Divulgação) Redação Exame Publicado em21 de junho de 2025 às19h28. Última atualização em21 de junho de 2025 às19h29. O governo deDonald Trump nãoinformou oficialmente àforça militar israelensese osEstados Unidosplanejam se juntar à guerra contra o Irã, disseram dois oficiais de defesa israelenses ao jornalThe New York Timesneste sábado, 21. No entanto, os dois oficiais, que falaram sob condição de anonimato para discutir questões de segurança, indicaram queWashington provavelmente entraria na guerrae já estaria tomando providências para isso. Com base nas conversas entre Israel e seus aliados norte-americanos nos últimos dias,os oficiais disseram aoNYTque um ataque dos EUA ao Irã poderia ocorrer nos próximos dias. Opresidente Donald Trumphavia agendado para sábado à noite uma reunião com sua equipe de segurança nacional naCasa Brancapara discutir a possibilidade de apoiar os ataques de Israel a sites nucleares iranianos. Embora a Casa Branca tenha afirmado que Trump ainda não tomou uma decisão final sobre um ataque, osEstados Unidosdeslocaram váriosbombardeiros B-2daForça Aéreade uma base norte-americana para o Pacífico. Os bombardeiros têm capacidade para carregar asbombas de penetração de 30 mil libras, que Trump está considerando utilizar contraFordo, uma instalação subterrânea fortificada no Irã, crucial para o programa nuclear do país. Embora os bombardeiros possam não ser finalmente usados, a movimentação deles — e o fato de ser amplamente divulgada — pode ser uma tentativa da Casa Branca de pressionar o Irã a voltar às negociações. Os bombardeiros ofereceriam ao presidente dos EUA opções, caso a ação seja necessária. As forças israelenses realizaram ataques contra vários sites nosul do Irãno sábado, mirando lançadores de mísseis e radares na região deAhvaz, que provavelmente estariam no trajeto de voo de aviões de guerra dos EUA rumo ao alvoFordo. Ray Takeyh, pesquisador sênior de estudos do Oriente Médio noCouncil on Foreign Relations, afirmou aoNYTque os ataques israelenses no sudoeste do Irã poderiam ser uma tentativa de abrir esses trajetos de voo. “Esse provavelmente é o corredor mais ideal,” disse ele, mas acrescentou que os bombardeiros norte-americanos podem se aproximar de Fordo de várias direções. O ataque israelense também pode ser uma forma de sinalizar ao presidente Trump que o custo de entrar na guerra seriamuito baixo, já queIsrael já fez a maioria do trabalho pesado, segundoAli Vaez, diretor do projeto Irã noInternational Crisis Group. ""Eles estão enquadrando isso como um golpe de misericórdia de baixo custo para o programa nuclear do Irã, pelo qual o presidente Trump poderia receber crédito"", disse Vaez aoNYT. No sábado, a força israelense também informou que atingiu sites de armazenamento de munições e drones nosudoeste do Irã, na cidade deBandar Abbas. O Irã ativou seus sistemas de defesa aérea emBandar Abbase em outras cidades, de acordo com a agência de notíciasMehr, afiliada ao governo iraniano. Explosões foram relatadas nas cidades do sul de Ahvaz, Dezful e Mahshahr, e um centro de emergência em Hoveyzeh, uma cidade perto de Ahvaz, também foi atingido, segundo um comunicado da Universidade de Ciências Médicas de Ahvaz. Os ataques israelenses de sábado também visaram enfraquecer a infraestrutura militar do Irã, seus centros comerciais e sua infraestrutura de petróleo no sul, disse Takeyh. “À medida que isso aumenta,” afirmou, “começa-se a ver uma expansão dos alvos.” O Irã mantém que seu programa nuclear tem fins pacíficos. No sábado, o presidenteMasoud Pezeshkianafirmou que o Irã se recusaria a reduzir suas atividades nucleares a zero ""sob quaisquer circunstâncias"", segundo a agênciaMehr. Dois oficiais de defesa israelenses também informaram ao site americano que Washington pediu ao Irã que considerasse várias possíveis estruturas para um acordo de cessar-fogo. Os iranianos expressaram disposição para negociar, segundo os oficiais, mas os americanos consideram que a resposta iraniana até o momento não é aceitável. Em uma nota oficial, o Vice-Ministério das Comunicações informou ter sido ""informado da morte"" do ministro Rodríguez, mas não forneceu detalhes sobre a causa do falecimento Com cerca de 23 milhões de pets e apenas 17 milhões de crianças, o Japão redefine os laços familiares em meio à queda de nascimentos Bloco europeu avalia contrapartidas e pressiona por termos considerados mais justos nas negociações com Washington ""Se os Estados Unidos se envolverem em um ataque e uma agressão contra o Irã, as forças armadas mirarão seus navios e embarcações de guerra no Mar Vermelho"", disse o porta-voz militar do grupo 01 02 03 exame no whatsapp Receba as notícias da Exame no seu WhatsApp Nos acontecimentos mais relevantes do Brasil e mundo. E-mail inválido Desperta",Exame
https://exame.com/casual/superiate-de-quase-r-3-bilhoes-de-jeff-bezos-e-um-dos-maiores-entre-os-bilionarios-veja-foto/,2025-06-21,Superiate de quase R$ 3 bilhões de Jeff Bezos é um dos maiores entre os bilionários; veja foto,"Redação Exame Publicado em21 de junho de 2025 às19h11. OKoru, superiate deJeff Bezos, foi construído porUS$ 500 milhões(cerca deR$ 2,78 bilhõesna cotação atual) e é um dos maiores iates privados do mundo. Com127 metros de comprimento, o Koru é o maior iate a vela entre os bilionários, destacando-se não apenas pelo tamanho, mas também pela combinação de design clássico e recursos de alta tecnologia. O Koru foi projetado pelo estaleiro Oceanco e teve sua construção concluída em abril de 2023. Sua estrutura é composta por um casco de aço azul-marinho e uma superestrutura de alumínio O design exterior foi elaborado pelos arquitetos navais Dykstra, enquanto o interior, caracterizado por madeiras naturais e tons neutros, foi desenvolvido pelo estúdio Mlinaric, Henry & Zervudachi. Com capacidade para18 hóspedesem9 suítese uma tripulação de40 pessoas, o iate oferece uma gama de comodidades de luxo,incluindotrês jacuzzis,piscina,cinema privado, além desalões amplosedecks espaçosos. A bordo, oAbeona, uma embarcação de apoio de75 metros, acomoda a tripulação adicional e oferece espaço para brinquedos náuticos e suprimentos, além de contar com umheliponto. Além de ser uma obra de engenharia e luxo, o Koru tem grande valor pessoal paraBezos.Foi a bordo do iate queBezos pediu Lauren Sánchezem casamento. Na próxima semana, o Koru será o local principal para o casamento do casal, que ocorrerá emVeneza, Itália, em um evento de grande escala que deve reunir diversas celebridades e figuras públicas. O nomeKoruvem da palavramaori, que simbolizanovos começosecrescimento, refletindo o papel do iate na vida de Bezos como uma extensão de sua jornada pessoal e profissional. Durante sua construção, o Koru gerou controvérsias, especialmente quando foi necessário alterar o trajeto para evitar a remoção daponte De Hef, emRotterdam. Iate de Bezos, Koru (Joe Raedle / Equipe/Getty Images) Embora o Koru seja imenso, ele não é o maior iate do mundo. OAzzam(180 metros) deSheikh Khalifae oEclipse(162 metros) deRoman Abramovichainda superam o Koru em tamanho. Em termos de custo, oEclipseé o mais caro, com um valor estimado deUS$ 1,5 bilhões, seguido peloAzzam, que foi construído por cerca deUS$ 600 milhões. OKoru, comUS$ 500 milhões, fica atrás desses dois em valor. “O Príncipe do Boxe”, do jornalista Fábio Altman, fala da trajetória do campeão mundial, sim, mas o foco da obra é seu avô materno, o também pugilista Waldemar Zumbano, tio de Éder A casa, comandada por Rafa Costa e Silva, ficou na posição 28 do World's 50 Best Restaurants 2025, sendo o único brasileiro a aparecer no ranking Em entrevista, escritor fala sobre sua relação com leitores ""F1"" mostra a equipe fictícia APX GP em crise, cujo dono chama ex-prodígio da F1, para ajudar após 30 anos afastado por um grave acidente 01 02 03 exame no whatsapp Receba as notícias da Exame no seu WhatsApp Receba a melhor curadoria para seus momentos casuais. E-mail inválido Casual",Exame
https://exame.com/negocios/mulheres-mais-ricas-do-mundo-quebram-recordes-com-fortuna-acumulada-de-us-276-bilhoes/,2025-06-21,50 mulheres mais ricas do mundo quebram recordes com fortuna acumulada de US$ 276 bilhões,"Oprah Winfrey: apresentadora é uma das 50 mulheres mais ricas do mundo (Steve Jennings/Getty Images) Redação Exame Publicado em21 de junho de 2025 às19h01. A desigualdade de gênero ainda é uma realidade mesmo entre os bilionários do planeta, mas as estatísticas mais recentes indicam mudanças em curso.Pela primeira vez, aForbesdivulgou uma lista global com as 50 mulheres mais ricas do mundo que construíram sua própria fortuna. A soma do patrimônio dessas empresárias chega a US$ 276 bilhões,distribuída entre representantes de 13 países em quatro continentes. Ovalor representa um crescimento de US$ 158 bilhões em comparação a 2017, quando o levantamento começou a ser monitorado. A suíçaRafaela Aponte-Diamantlidera o ranking, com fortuna estimada em US$ 38,8 bilhões. Cofundadora da Mediterranean Shipping Company (MSC), maior companhia de transporte marítimo do mundo, ela iniciou o negócio ao lado do marido, com um empréstimo de US$ 200 mil. Hoje, a MSC opera com 900 navios e emprega mais de 136 mil pessoas. Na segunda posição aparece a americanaDiane Hendricks,com US$ 22,3 bilhões, fruto da empresa ABC Supply, gigante na distribuição de telhados e revestimentos. Entre as norte-americanas mais conhecidas da lista estãoOprah Winfrey(US$ 3,1 bilhões) eSheryl Sandberg(US$ 2,4 bilhões), ex-Facebook. A China e Hong Kong concentram 18 das 50 bilionárias, empatando com os Estados Unidos em número de representantes.Zhong Huijuan, ex-professora de química, aparece em terceiro lugar, com US$ 15,6 bilhões, por trás da farmacêutica Hansoh. Outras chinesas de destaque sãoZhou Qunfei(US$ 10 bilhões), da fabricante de telas Lens Technology, eCheng Xue(US$ 3 bilhões), do setor de molho de soja. A indústria de tecnologia foi a principal fonte de riqueza da maioria dessas mulheres, com 14 nomes ligados ao setor. A empresária mais jovem da lista é a australianaMelanie Perkins, de 38 anos, criadora da plataforma Canva. Na Rússia, Tatyana Kim, ex-professora de inglês, construiu o império de e-commerce Wildberries. Apesar dos avanços, a desigualdade de gênero na concentração de riqueza ainda é marcante:as 50 mulheres mais ricas somam 4% da fortuna dos bilionários autodidatas do mundo.Os 50 homens mais ricos, juntos, detêm US$ 3,8 trilhões — 14 vezes mais do que suas contrapartes femininas. Startup criada em São João del Rei desafia gigantes do setor com atendimento local, expansão via licenciamento e foco em cidades de até 100 mil habitantes Jono Pandolfi começou fazendo pratos de cerâmica em 2004. 20 anos depois, suas peças apareceram em uma das séries mais premiadas da atualidade e seu lucro cresceu quase 30% em um ano A trajetória de Tess Waresmith destaca a importância da educação financeira, da diversificação e do controle sobre seus próprios investimentos para alcançar o sucesso no mercado financeiro Com gestão financeira eficiente e estratégia de captação de recursos, Coristine transformou a LesserEvil em um império de US$ 103 milhões anuais, provando que visão e risco calculado podem gerar grandes negócios 01 02 03 exame no whatsapp Receba as notícias da Exame no seu WhatsApp Nos acontecimentos mais relevantes do Brasil e mundo. E-mail inválido Desperta",Exame
https://exame.com/pop/r-55-milhoes-beyonce-e-iate-de-luxo-tudo-sobre-o-casamento-de-jeff-bezos-e-lauren-sanchez/,2025-06-21,"R$ 55 milhões, Beyoncé e iate de luxo: tudo sobre o casamento de Jeff Bezos e Lauren Sánchez","Bezos e Lauren Sánchez: casamento de US$ 10 milhões em Veneza protestos locais (NIKLAS HALLE'N/Getty Images) Redação Exame Publicado em21 de junho de 2025 às18h56. Com uma cerimônia estimada entre US$ 7 milhões e US$ 11 milhões,Jeff Bezos, fundador daAmazon, eLauren Sánchezirão celebrar seu casamento entre 24 e 26 de junho de 2025 em Veneza, Itália. O evento será realizado ao longo de três dias e contará com a presença de diversas figuras públicas e convidados, em um cenário planejado para garantir uma experiência de grande escala. A cerimônia principal acontecerá nosuperiate Koru, de Bezos, ancorado nalaguna de Veneza, ao largo da ilha deSan Giorgio Maggiore.Ailha será fechada ao públicode 24 a 29 de junho para acomodar o evento, e um serviço privado detenderserá utilizado para transportar os convidados do iate até a ilha. O casamento é descrito comoíntimopara os padrões de celebridades bilionárias, com cerca de200 a 250 convidados, segundo o siteHollywood Reporter. Entre os nomes especulados para comparecer, estãoKim Kardashian,Kris Jenner,Katy Perry,Orlando Bloom,Ivanka Trump,Jared Kushner,Oprah Winfrey,Mick Jagger,Leonardo DiCaprio,Beyoncé, e outros amigos e familiares próximos ao casal. Diversos hotéis de luxo em Veneza foram reservados, como o Aman Venice e o Hotel Danieli.Além disso, 30 táxis aquáticos foram contratados para garantir o transporte dos convidados entre os diferentes pontos da cidade.O Scuola Grande della Misericordia, um prédio histórico de Veneza, também foi reservado para os dias 26 a 28 de junho, embora sua função exata no evento ainda não tenha sido confirmada. Apesar de sua exclusividade, o evento gerou protestos locais devido ao impacto ambiental e ao aumento do turismo em Veneza. Grupos como “No Space for Bezos”organizaram manifestações contra a realização da festa, citando o problema do turismo excessivo na cidade. A grande manifestação está marcada para o dia 28 de junho. Contudo, as autoridades da cidade asseguram que a festa será organizada de forma a minimizar qualquer impacto no cotidiano local. Além disso, 80% dos fornecedores do casamento foram escolhidos localmente, com destaque para o padeiro Rosa Salva e o vidreiro Laguna B, que fornecerão doces personalizados e vidros feitos à mão para os convidados VIP, segundo oTimes of India. A experiência pessoal do casal também tem atraído atenção. Lauren Sánchez expressou sua empolgação pelo evento, mencionando como usou o Pinterest para buscar inspiração para o grande dia. Jeff Bezos, por sua vez, brincou dizendo que não está muito envolvido no planejamento, deixando toda a responsabilidade para sua noiva, segundo aFox News. Trama sobre império pesqueiro e crimes familiares remete ao passado do roteirista, cujo pai foi acusado de tráfico nos anos 1980 Em entrevista à EXAME, Paulo Werneck, diretor-geral da Feira do Livro, detalha o potencial desse formato e como um festival literário pode impactar a cena cultural de uma cidade daptação altera a linha do tempo, aprofunda temas sociais e inclui mistérios que não existem na obra de E. Lockhart Com vídeos insanos, filosofia de risco e uma ética de trabalho incansável, MrBeast domina a internet em 2025 01 02 03 exame no whatsapp Receba as notícias da Exame no seu WhatsApp Nos acontecimentos mais relevantes do Brasil e mundo. E-mail inválido Desperta",Exame
https://exame.com/mundo/ministro-do-trabalho-da-bolivia-morre-dez-meses-apos-assumir-o-cargo-causa-segue-sob-investigacao/,2025-06-21,Ministro do Trabalho da Bolívia morre dez meses após assumir o cargo; causa segue sob investigação,"Agência de notícias Publicado em21 de junho de 2025 às18h41. Oministro do Trabalho da Bolívia,Erland Rodríguez Lafuente, faleceu neste sábado,dez meses após assumir o cargo, por causas que ainda estão sendo investigadas, conforme anunciou o governo deLuis Arce. Em uma nota oficial, oVice-Ministério das Comunicaçõesinformou ter sido ""informado da morte"" do ministro Rodríguez, mas não forneceu detalhes sobre a causa do falecimento. No entanto, o comunicado acrescenta que o governo central instruiu para que ""sejam realizadas as investigações correspondentes sobre o ocorrido"". Rodríguez Lafuente, que era advogado de formação, assumiu o cargo deministro do Trabalhoem12 de agosto de 2024. Antes de sua nomeação, ele teve passagens por diversos cargos públicos, incluindodiretor departamental de La Paz na Procuradoria-Geral do Estado, chefe daunidade de procedimentos e recursos da Agência Nacional de Hidrocarbonetose atuação noSindicato Regional de Trabalhadores de El Alto. A mídia local informou que o falecimento ocorreu em sua residência na cidade deEl Alto. Sua última atividade pública foi umacoletiva de imprensarealizada naterça-feira, na qual ele relatou sobre oferiado de Ano Novo Andino, Amazônico e Chaco, celebrado neste sábado. Com cerca de 23 milhões de pets e apenas 17 milhões de crianças, o Japão redefine os laços familiares em meio à queda de nascimentos Bloco europeu avalia contrapartidas e pressiona por termos considerados mais justos nas negociações com Washington ""Se os Estados Unidos se envolverem em um ataque e uma agressão contra o Irã, as forças armadas mirarão seus navios e embarcações de guerra no Mar Vermelho"", disse o porta-voz militar do grupo Conflito direto já deixou mais de 600 mortos no Irã e reacende alerta global sobre proliferação nuclear 01 02 03 exame no whatsapp Receba as notícias da Exame no seu WhatsApp Nos acontecimentos mais relevantes do Brasil e mundo. E-mail inválido Desperta",Exame
