url,data,titulo,texto,fonte
https://valor.globo.com/empresas/noticia/2025/08/22/apple-avalia-usar-inteligencia-artificial-do-google-gemini-para-impulsionar-siri-renovada.ghtml,2025-08-22,Apple avalia usar inteligência artificial do Google Gemini para impulsionar nova Siri,"22/08/2025 16h44Atualizadoagora AApple Inc.está em discussões iniciais sobre o uso doGoogle Geminipara impulsionar uma versão reformulada daassistente de voz Siri,marcando um possível passo importante para terceirizar mais de sua tecnologia deinteligência artificial. A fabricante doiPhonecontatou recentemente oGoogle, da Alphabet Inc., para explorar a criação de um modelo de IA personalizado que serviria de base para a nova Siri no próximo ano, de acordo com pessoas familiarizadas com o assunto. O Google começou a treinar um modelo que poderia rodar nos servidores da Apple, disseram as pessoas, que pediram para não ser identificadas porque as discussões são privadas. O trabalho faz parte de um esforço para se atualizar em IA generativa, um campo onde a empresa chegou tarde e teve dificuldades para ganhar força. No início deste ano, a Apple também explorou parcerias com aAnthropic PBCe aOpenAI, avaliando seClaudeouChatGPTpoderiam servir como o novo cérebro da Siri. A Apple ainda está a várias semanas de tomar uma decisão sobre se continuará usando modelos internos para a Siri ou se buscará um parceiro. E ainda não definiu quem será esse parceiro. Porta-vozes da Apple e do Google não quiseram comentar. As ações do Google e da Apple atingiram máximas da sessão nesta sexta-feira (22), após aBloomberg Newsnoticiar as discussões. O Google subia 2,9%, para US$ 205,46, às 13h15, em Nova York, enquanto a Apple subia 1,4%, para US$ 227,95. A possível mudança ocorre após atrasos em uma atualização há muito alardeada da Siri, que atenderia a comandos acessando dados pessoais e permitiria que os usuários navegassem pelos dispositivos inteiramente por voz. A atualização da Siri estava programada para a primavera passada, mas foi adiada por um ano devido a problemas de engenharia. Mudanças na equipe de IA O fracasso levou a Apple a afastar o chefe de inteligência artificialJohn Giannandreado desenvolvimento da Siri. O projeto agora é supervisionado pelo chefe de softwareCraig Federighie pelo criador do headsetVision Pro,Mike Rockwell,que estão avaliando o uso de ajuda externa como um possível caminho a seguir. A atualização da Siri foi originalmente projetada com base na tecnologia desenvolvida pela equipe de Modelos da Apple Foundation. Esse grupo também criou os modelos de linguagem de grande porte no dispositivo que impulsionam recursos do Apple Intelligence, como resumo de texto e criação de emojis personalizados. Com o objetivo de corrigir as falhas da Siri e levar os recursos atrasados ​​ao mercado, Federighi, Rockwell e a equipe de desenvolvimento corporativo da Apple, liderada porAdrian Perica, começaram a se reunir com a Anthropic e a OpenAI sobre um possível acordo. Internamente, a Apple está realizando uma competição para ver qual abordagem funcionará melhor. A empresa está desenvolvendo simultaneamente duas versões da nova Siri: uma chamadaLinwood, que funciona com seus modelos, e outra, de codinomeGlenwood, que funciona com tecnologia externa. Parceria com Anthropic Os executivos há muito tempo viam a Anthropic como a principal candidata para uma parceria, mas os termos financeiros exigidos pela empresa levaram a Apple a ampliar a busca e incluir outras empresas. A Apple certamente não descartou a possibilidade de manter seus próprios modelos. Essas negociações são independentes de outros acordos para integrar chatbots aoApple Intelligence. No ano passado, a Apple adicionou o ChatGPT como um recurso alternativo da Siri para consultas de conhecimento geral, uma área em que a assistente tem apresentado desempenho inferior há muito tempo. E tanto a Apple quanto o Google já sinalizaram publicamente planos para uma integração semelhante com o Gemini. Embora a Apple e o Google sejam rivais em smartphones, sistemas operacionais e serviços, eles já têm uma parceria em buscas. O Google paga bilhões de dólares por ano para tornar seu mecanismo de busca a opção padrão nos produtos da Apple. Mas esse acordo está sob análise antitruste doDepartamento de Justiça dos EUAe pode ser desfeito. As negociações sobre o uso dos modelos Gemini do Google para alimentar a Siri ainda são exploratórias, sem negociações comerciais formais em andamento. O Google já fechou acordos semelhantes e alimenta grande parte da funcionalidade de IA em celulares vendidos pelaSamsung Electronics Co. Mercado disputa talentos Enquanto isso, o grupo de modelos de IA da Apple continua sofrendo com turbulências. Em julho,Ruoming Pang— arquiteto-chefe da equipe — foi para aMeta Platforms Inc.Ele foi atraído por um pacote de US$ 200 milhões e uma posição sênior na nova unidadeSuperintelligence Labs. Vários colegas logo o seguiram, e muitos dos que permanecem na Apple estão fazendo entrevistas de emprego em outros lugares — seja por causa da possível mudança para tecnologia de terceiros ou para lucrar com ofertas de emprego multimilionárias. Alguns líderes de engenharia de software sugeriram uma ideia relacionada de também substituir os modelos usados ​​para recursos de IA que não sejam da Siri em dispositivos Apple. Isso seria uma ruptura com a abordagem preferida da Apple. A empresa, em geral, tem buscado manter a propriedade dos recursos de IA executados nas máquinas dos consumidores, visando garantir a segurança e a privacidade. Isso inclui recursos de inteligência da Apple, como ferramentas de escrita. No entanto, a empresa não está trabalhando ativamente nesse plano. No caso de uma parceria com a Siri, os modelos de terceiros seriam executados nos servidoresPrivate Cloud Compute da Apple, que usam chips Mac para processamento remoto de IA. Isso significa que os modelos externos da Siri não seriam executados nos próprios dispositivos. Tim Cook: Apple precisa vencer em IA A Apple continua anos atrás de seus rivais em IA, o que levou a administração a considerar uma série de opções. Em uma reunião geral recente, oCEO, Tim Cook, disse aos funcionários que a Apple precisa vencer em IA e está intensificando seus investimentos. Ele adotou um tom otimista, observando que a Apple raramente é a primeira a chegar a novos mercados, mas ainda assim acaba fornecendo um produto superior. Durante uma teleconferência de resultados trimestrais na mesma semana, Cook se recusou a comentar sobre o uso de modelos de terceiros, afirmando que qualquer discussão revelaria os planos da empresa. Mas isso por si só era um sinal de que a Apple estava",Valor Econômico
https://valor.globo.com/empresas/noticia/2025/08/22/sidney-oliveira-da-ultrafarma-consegue-habeas-corpus-e-no-precisar-pagar-fiana-de-r-25-milhes-diz-tv.ghtml,2025-08-22,"Sidney Oliveira, da Ultrafarma, consegue habeas corpus e não precisará pagar fiança de R$ 25 milhões, diz TV","Por Valor— São Paulo 22/08/2025 16h54Atualizadohá 2 horas A defesa de Sidney Oliveira, dono e fundador da Ultrafarma, conseguiu um habeas corpus nesta sexta-feira (22) e o empresário não precisará pagar a fiança de R$ 25 milhões por sua soltura, segundo informações da TV Globo reproduzidas pelo G1. A suspensão da exigência da fiança é em caráter liminar, ou seja, até o julgamento final do caso. Nesta quinta-feira (21), o Ministério Público havia feito um novo pedido de prisão contra o empresário após ter constatado que ele não havia pago a fiança. Já no dia 15 de agosto, a Justiça determinou a soltura de Oliveira e de Mario Otávio Gomes, diretor estatutário do grupo Fast Shop, sob condição de usarem tornozeleira eletrônica e pagarem fiança de R$ 25 milhões. O executivo da Fast Shop também conseguiu um habeas corpus na 11ª Camara de Direito Criminal do Tribunal de Justiça do Estado de São Paulo para suspender a obrigatoriedade do pagamento da fiança. O auditor fiscal Artur Gomes da Silva Neto teve a prisão temporária prorrogada. O Tribunal de Justiça não informou o período. Enquanto o fiscal Marcelo de Almeida Gouveia teve a prisão preventiva mantida. Sidney, Mario e Artur são alvo de uma operação do Ministério Público de São Paulo (MP-SP) que investiga um esquema de corrupção bilionário envolvendo auditores fiscais tributários da Secretaria de Estado da Fazenda e foram presos temporariamente na terça-feira (12). Acompanhe os mercados com nossas ferramentasAcessar gratuitamente Dado consta de pesquisa feita pelo secretariado da Convenção sobre Mudança Climática da ONU, a UNFCCC Segundo banco, publicações buscam ""gerar pânico"" e induzir a população a decisões que podem prejudicar a sua saúde financeira Advogados ter havido descumprindo ordens e nega que documento com pedido de asilo na Argentina seja indício de fuga Comando diz que proposta teve aprovação de mais de 99% dos acionistas, com uma quantidade residual de abstenções Ministros trocam indiretas em evento empresarial realizado no Rio de Janeiro, e Moraes diz que falar em 'autocontenção' é 'coisa de ditador' Juros futuros recuam com Treasuries e bolsas americanas sobem com força após discurso de Powell em Jackson Hole Programa prevê R$ 30 bilhões para empresas afetadas pelas sobretaxas de 50% dos EUA, via Fundo de Garantia à Exportações (FGE), administrado pelo banco Na interpretação de participantes do mercado, Jerome Powell soou menos conservador em relação a aparições públicas recentes e, com isso, abriu espaço para o Fed cortar os juros americanos em setembro Instituto foi às ruas nos principais colégios eleitorais do país entre 13 e 17 de agosto Segundo o presidente americano, a investigação estará concluída dentro de 50 dias",Valor Econômico
https://valor.globo.com/mundo/noticia/2025/08/22/canad-remover-tarifas-retaliatrias-sobre-produtos-dos-eua-diz-fonte.ghtml,2025-08-22,Canadá remove tarifas retaliatórias sobre produtos dos EUA,"Por Valor, Com Agências Internacionais— Ottawa 22/08/2025 14h20Atualizadoagora O Canadá anunciou nesta sexta-feira (22) a remoção de tarifas retaliatórias sobre uma ampla gama de produtos dos Estados Unidos como um pontapé inicial para reiniciar as negociações comerciais paralisadas. A remoção das tarifas visa igualar as isenções tarifárias americanas sobre produtos que estão em conformidade com o acordo comercial trilateral EUA-México-Canadá, o USMCA, que será revisado em 2026. Para o primeiro-ministro canadense, Mark Carney, o acordo apresenta uma “vantagem única” em um momento em que o acesso ao mercado americano se tornou restrito e caro. Carney venceu a eleição geral de abril com a promessa de enfrentar o tarifaço americano, mas desde então tem adotado um tom mais suave. Em junho, ele abandonou uma proposta de imposto sobre serviços digitais que as empresas dos EUA desaprovavam veementemente e, posteriormente, desistiu de falar sobre sanções adicionais caso os países não chegassem a um acordo até 1º de agosto. Trump elogiou a decisão do país vizinho. ""Ele está removendo suas tarifas retaliatórias, o que achei bom, e vamos ter outra ligação em breve"", declarou o presidente americano a repórteres no Salão Oval da Casa Branca. ""Estamos trabalhando em algo. Queremos ser muito bons com o Canadá. Gosto muito do Carney. Acho que ele é uma pessoa muito boa”, acrescentou, afirmando, porém, que tanto o Canadá quanto o México “levaram muitos de nossos negócios ao longo dos anos.” Mais cedo, a Casa Branca disse ter recebido com “satisfação” a notícia. Conforme o premiê canadense, o compromisso aos termos do USMCA por parte dos EUA garante ao Canadá uma das tarifas médias mais baixas entre os parceiros comerciais do país vizinho. Segundo ele, cerca de 85% do comércio entre os dois lados segue isento de tarifas. A preservação do tratado é de importância fundamental tanto para o Canadá quanto para o México, que têm nos EUA seu principal parceiro comercial. Acompanhe os mercados com nossas ferramentasAcessar gratuitamente Dado consta de pesquisa feita pelo secretariado da Convenção sobre Mudança Climática da ONU, a UNFCCC Segundo banco, publicações buscam ""gerar pânico"" e induzir a população a decisões que podem prejudicar a sua saúde financeira Advogados ter havido descumprindo ordens e nega que documento com pedido de asilo na Argentina seja indício de fuga Comando diz que proposta teve aprovação de mais de 99% dos acionistas, com uma quantidade residual de abstenções Ministros trocam indiretas em evento empresarial realizado no Rio de Janeiro, e Moraes diz que falar em 'autocontenção' é 'coisa de ditador' Juros futuros recuam com Treasuries e bolsas americanas sobem com força após discurso de Powell em Jackson Hole Programa prevê R$ 30 bilhões para empresas afetadas pelas sobretaxas de 50% dos EUA, via Fundo de Garantia à Exportações (FGE), administrado pelo banco Na interpretação de participantes do mercado, Jerome Powell soou menos conservador em relação a aparições públicas recentes e, com isso, abriu espaço para o Fed cortar os juros americanos em setembro Instituto foi às ruas nos principais colégios eleitorais do país entre 13 e 17 de agosto Segundo o presidente americano, a investigação estará concluída dentro de 50 dias",Valor Econômico
https://valor.globo.com/politica/noticia/2025/08/22/veja-como-esta-a-disputa-pelo-governo-em-8-estados-segundo-a-pesquisa-genialquaest.ghtml,2025-08-22,"Veja como está a disputa pelo governo em 8 Estados, segundo a pesquisa Genial/Quaest","Por Valor— São Paulo 22/08/2025 18h03Atualizadoagora O institutoQuaestdivulgou nesta sexta-feira (22) pesquisas da disputa ao governo de oito Estados. A pouco mais de um ano daseleições de 2026, foram entrevistados pela segunda vez nesse ano eleitores emSão Paulo,Rio de Janeiro,Minas Gerais,Goiás,Paraná,Rio Grande do Sul,BahiaePernambuco. Esses Estados representam alguns dos maiores e mais relevantes colégios eleitorais do país.Em ao menos cinco deles, os atuais governadores cogitam concorrer à Presidência da República, o que torna os cenários ainda bastante incertos. Entre os presidenciáveis estãoTarcísio de Freitas (SP), Romeu Zema (MG), Ronaldo Caiado (GO), Ratinho Junior (PR)eEduardo Leite (RS). Além do potencial de voto dos pré-candidatos testados, a pesquisa Genial/Quaest também perguntou a opinião do eleitores sobre a atuação dos atuais governadores. As entrevistas foram realizadas entre 13 e 17 de agosto. A margem de erro em São Paulo é de 2 pontos percentuais para mais ou para menos e nos demais Estados é de 3 pontos. O nível de confiança é de 95%.Veja abaixo os principais resultados: São Paulo O governador de São Paulo,Tarcísio de Freitas (Republicanos), mantém a liderança na preferência do eleitorado paulista na disputa pelo governo, com 43%. Em segundo lugar vem o vice-presidente Geraldo Alckmin (PSB), com 21%. Na sequência, com 8%, aparece a deputada federal Erika Hilton (Psol); o ex-prefeito de Santo André e presidente estadual do PSDB, Paulo Serra, teve 3%, e o cientista político Felipe D'Avila (Novo), 2%. Os indecisos somaram 7% e 16% declararam que não vão votar, vão anular ou votar em branco. A Quaest entrevistou 1.644 eleitores no Estado.Leia a reportagem completa sobre a pesquisa em São Paulo. Rio de Janeiro O prefeito do Rio de Janeiro,Eduardo Paes (PSD), tem 35% das intenções de voto, 26 pontos percentuais a mais do segundo nome no rol, o presidente da Assembleia Legislativa (Alerj),Rodrigo Bacellar (União Brasil). A pesquisa entrevistou 1.404 pessoas. Bacellar tem 9% das intenções de voto e está tecnicamente empatado com o ex-prefeito de Duque de Caxias e ex-secretário estadual de Transportes,Washington Reis (MDB), que tem 5%. A vereadoraMonica Benicio (Psol)tem 4% e o médico e influenciadorItalo Marsili (Novo), 2%. Indecisos somam 15%, e o percentual dos entrevistados que responderam que não vão votar ou vão anular ou votar em branco é de 30%.Leia a reportagem completa sobre a pesquisa no Rio. Minas Gerais A atual senadorCleitinho (Republicanos), nome apoiado por Bolsonaro, aparece em primeiro lugar, com 28% das intenções, seguido pelo ex-prefeito de Belo HorizonteAlexandre Kalil(sem partido), com 16%. Foram ouvidos 1.482 eleitores no Estado. César Felício: Em mês de protagonismo, Zema colhe resultado pífio O senadorRodrigo Pacheco (PSD), nome defendido por Lula, tem 9% das intenções de voto. O atual vice-governador e nome apoiado por Zema,Mateus Simões (Novo), aparece com 4%. Indecisos somam 17% e 26% afirmaram que não vão votar ou votarão branco ou nulo.Leia a reportagem completa sobre a pesquisa em Minas. Goiás O vice-governador de Goiás,Daniel Vilela (MDB), lidera a corrida para o governo do Estado em 2026 com 26% das intenções de votos e é seguido de perto pelo ex-governadorMarconi Perillo (PSDB), que aparece com 22%. Depois aparecem o senadorWilder Morais (PL), aliado do ex-presidente Jair Bolsonaro (PL), com 10%, a deputada federalAdriana Accorsi (PT), com 8%, e do vereadorTelêmaco Brandão (Novo), que aparece com 1%. O levantamento mostra ainda um total de 14% de indecisos e 19% de brancos, nulos e não irão votar em 2026. O instituto ouviu 1.104 pessoas aptas a votar.Leia a reportagem completa sobre a pesquisa em Goiás. Paraná O senadorSergio Moro (União)aparece na frente, com 38%, na corrida para o governo do Paraná. Ao todo, 1.104 eleitores foram entrevistados. Na segunda colocação, o levantamento aponta um empate técnico dentro da margem de erro do levantamento. O atual vice-prefeito de Curitiba,Paulo Eduardo Martins (Novo), aparece com 8%,Ênio Verri (PT), atual diretor-geral da Itaipu Binacional, tem 7%, e o secretário das Cidades do Paraná,Guto Silva (PSD), conta com 6% das intenções de voto. O levantamento aponta ainda 13% de indecisos e 28% de branco, nulo e pessoas que não irão às urnas.Leia a reportagem completa sobre a pesquisa no Paraná. Rio Grande do Sul A disputa pelo governo do Rio Grande do Sul tem dois candidatos em situação de empate técnico: a ex-deputada estadualJuliana Brizola (PDT)tem 21% das intenções, seguida pelo deputado federalCoronel Zucco (PL), com 20%. Na sequência foram citadosEdegar Pretto (PT), com 11%,Gabriel Souza (MDB), com 5%, eFelipe Camozzato (Novo), com 4%. O ""não voto"" superou os resultados dos nomes testados. Responderam que ainda não sabem em quem votar 19% dos entrevistados, e chegou a 20% o percentual de quem pretende anular, votar em branco ou simplesmente não votar. Foram entrevistados 1.104 eleitores no Estado.Leia a reportagem completa sobre a pesquisa no Rio Grande do Sul. Bahia O governadorJerônimo Rodrigues (PT)registrou queda nas intenções de voto e viu crescer a distância em relação ao ex-prefeito de Salvador,ACM Neto (União Brasil). O governador tem 34% das intenções de voto, menos quatro pontos percentuais em relação a fevereiro, enquanto ACM Neto lidera a disputa com 41%, praticamente estável em comparação com a pesquisa anterior (42%). O levantamento mostra o ex-deputado federalJoão Roma (PL)com 4% (ante 3% em fevereiro),Kleber Rosa (Psol), com 2% (era 1%), eJosé Aleluia (Novo), que surge com 1% na disputa. Votos em branco, nulos ou de quem não pretende votar somaram 14%, enquanto 4% dos eleitores permanecem indecisos. O instituto ouviu 1.200 pessoas aptas a votar.Leia a reportagem completa sobre a pesquisa na Bahia. Pernambuco O prefeito do Recife,João Campos (PSB), tem 55% das intenções de voto para as eleições em Pernambuco, liderando a disputa contra a governadoraRaquel Lyra (PSD). O ex-ministroGilson Machado (PL)tem 6% eEduardo Moura (Novo), 4%. Os indecisos somaram 4%, enquanto os brancos e nulos totalizaram 7%. Foram ouvidos 1.104 eleitores, de forma presencial.Leia a reportagem completa sobre a pesquisa em Pernambuco. Acompanhe os mercados com nossas ferramentasAcessar gratuitamente Advogados ter havido descumprindo ordens e veem tentativa de ""desmoralização"" do ex-presidente Comando diz que proposta teve aprovação de mais de 99% dos acionistas, com uma quantidade",Valor Econômico
https://valor.globo.com/financas/noticia/2025/08/22/generali-tem-aumento-de-25-pontos-percentuais-no-lucro-no-1-semestre-para-r-59-milhes.ghtml,2025-08-22,"Generali tem aumento de 25% no lucro no 1° semestre, para R$ 59 milhões","Em alta 22/08/2025 16h49Atualizadoagora Generali Brasil teve lucro de R$ 59 milhões no primeiro semestre, valor 25% maior do que o registrado no mesmo período do ano passado. Os prêmios emitidos totais cresceram 90%, para R$ 1,3 bilhão. Do montante, 87% correspondem ao canal de massificados. Além deles, a seguradora também atua com seguros de grandes riscos e de vida. Acompanhe os mercados com nossas ferramentasAcessar gratuitamente Dado consta de pesquisa feita pelo secretariado da Convenção sobre Mudança Climática da ONU, a UNFCCC Segundo banco, publicações buscam ""gerar pânico"" e induzir a população a decisões que podem prejudicar a sua saúde financeira Advogados ter havido descumprindo ordens e nega que documento com pedido de asilo na Argentina seja indício de fuga Comando diz que proposta teve aprovação de mais de 99% dos acionistas, com uma quantidade residual de abstenções Ministros trocam indiretas em evento empresarial realizado no Rio de Janeiro, e Moraes diz que falar em 'autocontenção' é 'coisa de ditador' Juros futuros recuam com Treasuries e bolsas americanas sobem com força após discurso de Powell em Jackson Hole Programa prevê R$ 30 bilhões para empresas afetadas pelas sobretaxas de 50% dos EUA, via Fundo de Garantia à Exportações (FGE), administrado pelo banco Na interpretação de participantes do mercado, Jerome Powell soou menos conservador em relação a aparições públicas recentes e, com isso, abriu espaço para o Fed cortar os juros americanos em setembro Instituto foi às ruas nos principais colégios eleitorais do país entre 13 e 17 de agosto Segundo o presidente americano, a investigação estará concluída dentro de 50 dias",Valor Econômico
