url,data,titulo,texto,fonte
https://valor.globo.com/mundo/noticia/2025/06/21/ucrania-acumula-us-43-bilhoes-para-a-industria-de-defesa-diz-zelensky.ghtml,2025-06-21,"Ucrânia tem US$ 43 bilhões para a indústria de defesa, diz Zelensky","21/06/2025 11h20Atualizado21/06/2025 AUcrâniajá acumulouUS$ 43 bilhõesneste ano para sua indústria de defesa, somando recursos próprios e ajuda de aliados, afirmou o presidente ucranianoVolodymyr Zelensky. Segundo ele,os valores estão sendo usados para ampliar a produção e a compra de drones, artilharia e outros armamentos. Kiev também lançou o programa“Reconstruir com a Ucrânia”e anunciou novos acordos a serem assinados neste verão, incluindo a abertura de linhas de produção em países europeus. “Vamos fornecer as tecnologias necessárias e produzir armamentos nos países parceiros, tanto para eles quanto para nós”, afirmou Zelensky a repórteres em Kiev na noite de sexta-feira. Segundo ele, os equipamentos poderão incluir drones, mísseis e possivelmente artilharia, e medidas serão tomadas para evitar que qualquer tecnologia caia nas mãos da Rússia. A Ucrânia busca desenvolver sua capacidade militar interna enquanto tenta repelir a invasão russa, que já entra no quarto ano, ereduzir a dependênciada ajuda militar de aliados, especialmente dos Estados Unidos. “Manter o apoio dos Estados Unidos é nossa prioridade”, afirmou Zelensky, acrescentando que, embora alguns países europeus tenham sinalizado que permanecerão ao lado da Ucrânia a qualquer custo, “a situação mais difícil é sem a participação americana.” Zelensky deve participar da cúpula daOtanem Haia, que começa na terça-feira. Ele negou que a Ucrânia esteja prestes a perder grande parte dos sistemas de defesa aérea Patriot fornecidos pelos Estados Unidos e por outros aliados desde 2022, ou que o país careça de armamentos para operá-los de forma eficaz. Zelensky afirmou que as defesas aéreas da Ucrânia também foram reforçadas com o uso intensivo de drones interceptadores, capazes de abater drones do tipo Shahed utilizados pela Rússia. As forças do Kremlin continuam com intensos bombardeios aéreos por toda a Ucrânia.Moscou lançou 272 drones e oito mísseis durante a noite, segundo o boletim regular do Estado-Maior ucraniano. Kremenchuk, na região de Poltava e local de uma importante refinaria de petróleo, foi novamente alvo após ter sofrido novos danos há uma semana. A Rússia também continua a utilizar bombas planadoras e outros armamentos ao longo da linha de frente no leste da Ucrânia, além das regiões nordeste de Sumy e Kharkiv, próximas à fronteira entre os países, bem como em Dnipropetrovsk e outras áreas. Zelensky renovou o apelo por restrições energéticas, como a redução dos tetos depreços do petróleorusso — uma medida descartada pela União Europeia nesta semana —, além de sanções contra empresas que atuam direta ou indiretamente com a indústria de defesa da Rússia. Segundo ele, cerca de39 empresas de defesa estão envolvidas na produçãodo míssil balístico experimental Oreshnik da Rússia, das quais 21 ainda não estão sujeitas a sanções. Acompanhe os mercados com nossas ferramentasAcessar gratuitamente Defesa Civil alerta para chegada de onda de frio a partir desta segunda-feira Quando a inteligência artificial é usada para manipular voz, imagem e desinformar, o risco deixa de ser um problema de Cannes e passa a ser sistêmico para todo o mercado Advertência ocorre no mesmo dia em que os americanos deslocaram ao menos seis bombardeiros furtivos B-2 para o Oceano Pacífico Projeto em discussão no Senado propõe acabar com a possibilidade de recondução e estender mandatos para cinco anos Repatriação ainda é avaliada pelo governo Lula, que estuda outras alternativas para viabilizar a saída de cidadãos brasileiros da região Candidato a prefeito de Nova York, Zohran Mamdani prometeu aumentar impostos sobre ricos para financiar ônibus gratuitos e creches, além de supermercados públicos Gean Loureiro afirmou que falta de vagas impediu o embarque Tarifas do presidente dos Estados Unidos, Donald Trump, abriram uma ruptura no banco central americano Trump avalia se deve ou não se juntar aos esforços de Israel para destruir as instalações nucleares do Irã Há anos, a China tem usado a relação com o Irã para aumentar sua influência no Oriente Médio, ao mesmo tempo em que faz do petróleo iraniano barato um pilar da matriz energética",Valor Econômico
https://valor.globo.com/mundo/noticia/2025/06/21/israel-diz-que-ir-tentou-atacar-cidados-israelenses-no-chipre.ghtml,2025-06-21,Israel diz que Irã tentou atacar cidadãos israelenses no Chipre,"21/06/2025 14h01Atualizado21/06/2025 Oministro das Relações Exteriores de Israel,Gideon Saar,acusou os guardas revolucionários do Irã de tentarem atacar cidadãos israelenses no Chipre neste sábado. Acompanhe os mercados com nossas ferramentasAcessar gratuitamente Defesa Civil alerta para chegada de onda de frio a partir desta segunda-feira Quando a inteligência artificial é usada para manipular voz, imagem e desinformar, o risco deixa de ser um problema de Cannes e passa a ser sistêmico para todo o mercado Advertência ocorre no mesmo dia em que os americanos deslocaram ao menos seis bombardeiros furtivos B-2 para o Oceano Pacífico Projeto em discussão no Senado propõe acabar com a possibilidade de recondução e estender mandatos para cinco anos Repatriação ainda é avaliada pelo governo Lula, que estuda outras alternativas para viabilizar a saída de cidadãos brasileiros da região Candidato a prefeito de Nova York, Zohran Mamdani prometeu aumentar impostos sobre ricos para financiar ônibus gratuitos e creches, além de supermercados públicos Gean Loureiro afirmou que falta de vagas impediu o embarque Tarifas do presidente dos Estados Unidos, Donald Trump, abriram uma ruptura no banco central americano Trump avalia se deve ou não se juntar aos esforços de Israel para destruir as instalações nucleares do Irã Há anos, a China tem usado a relação com o Irã para aumentar sua influência no Oriente Médio, ao mesmo tempo em que faz do petróleo iraniano barato um pilar da matriz energética",Valor Econômico
https://valor.globo.com/eu-e/noticia/2025/06/21/livros-a-alianca-entre-brasil-e-eua-na-segunda-guerra-uma-nova-perspectiva-sobre-os-desafios-da-crise-climatica.ghtml,2025-06-21,Livros: A aliança entre Brasil e EUA na Segunda Guerra; uma nova perspectiva sobre os desafios da crise climática,"21/06/2025 08h00Atualizado21/06/2025 Irmãos de armasFrank D. McCann. Trad.: Laura Teixeira Motta Companhia das Letras 344 págs., R$ 119,90 Acompanhe os mercados com nossas ferramentasAcessar gratuitamente Defesa Civil alerta para chegada de onda de frio a partir desta segunda-feira Quando a inteligência artificial é usada para manipular voz, imagem e desinformar, o risco deixa de ser um problema de Cannes e passa a ser sistêmico para todo o mercado Advertência ocorre no mesmo dia em que os americanos deslocaram ao menos seis bombardeiros furtivos B-2 para o Oceano Pacífico Projeto em discussão no Senado propõe acabar com a possibilidade de recondução e estender mandatos para cinco anos Repatriação ainda é avaliada pelo governo Lula, que estuda outras alternativas para viabilizar a saída de cidadãos brasileiros da região Candidato a prefeito de Nova York, Zohran Mamdani prometeu aumentar impostos sobre ricos para financiar ônibus gratuitos e creches, além de supermercados públicos Gean Loureiro afirmou que falta de vagas impediu o embarque Tarifas do presidente dos Estados Unidos, Donald Trump, abriram uma ruptura no banco central americano Trump avalia se deve ou não se juntar aos esforços de Israel para destruir as instalações nucleares do Irã Há anos, a China tem usado a relação com o Irã para aumentar sua influência no Oriente Médio, ao mesmo tempo em que faz do petróleo iraniano barato um pilar da matriz energética",Valor Econômico
https://valor.globo.com/mundo/noticia/2025/06/21/israel-ataca-instalacao-nuclear-iraniana-em-meio-a-sinais-contraditorios-dos-eua.ghtml,2025-06-21,Israel ataca usina nuclear do Irã,"21/06/2025 10h47Atualizado21/06/2025 Israel e Irã intensificam ataques na segunda semana de hostilidades, com a instalação nuclear de Isfahan sendo atingida novamente, enquanto o presidente dos Estados Unidos,Donald Trump, aumenta a incerteza sobre sua participação no conflito. Jatos israelenses atacaram pela segunda vez a instalação nuclear deIsfahan, no Irã, atingindo uma área de produção de centrífugas, informou as Forças de Defesa de Israel (IDF). A agência semi-oficial iraniana Fars News relatou que não houve vazamento de material perigoso. A IDF também afirmou ter identificado mísseis lançados do Irã e que estava trabalhando para interceptá-los. O Ministro da Defesa de Israel,Israel Katz, afirmou queSaeed Izadi, líder de uma das divisões internacionais daGuarda Revolucionária Islâmica(IRGC) responsável pelo financiamento e armamento do Hamas em Gaza, foi morto na cidade iraniana de Qom.Behnam Shahriyari, outro membro da IRGC ligado ao fornecimento de armas ao Hezbollah, no Líbano, e a outras milícias, também foi morto, assim como um terceiro comandante, segundo um oficial militar israelense. A televisão estatal iraniana informou que cinco membros da IRGC foram mortos no sábado na província ocidental de Lorestan. Após intensificar as ameaças contra o Irã no início desta semana, Trump aparentou amenizar as tensões na quinta-feira, afirmando que daria um prazo de duas semanas para que a diplomacia.Na sexta-feira, ele sinalizou a possibilidade de reduzir esse prazo, mas também sugeriu que “poderia” apoiar um cessar-fogo durante as negociações. O Irã, por sua vez, exige a suspensão dos ataques antes do início das conversas, condição que Israel se recusa a aceitar. “Estou dando a eles um prazo,” declarou Trump a repórteres em Nova Jersey, após se reunir na manhã de sexta-feira com sua equipe de segurança nacional. “Diria que duas semanas é o máximo.” Os ministros das Relações Exteriores do Reino Unido, França e Alemanha reuniram-se com o ministro das Relações Exteriores iraniano em Genebra na sexta-feira, mas aparentemente obtiveram pouco avanço nas negociações. “O Irã não quer falar com a Europa. Eles querem falar conosco,” disse Trump. “A Europa não vai conseguir ajudá-los.” O ministro das Relações Exteriores do Irã,Abbas Araghchi, declarou que o país está disposto a realizar uma nova rodada de reuniões com os europeus em breve, informou a agência estatal IRNA. No entanto, segundo um funcionário europeu, ainda não foi marcada uma data para o encontro de acompanhamento, tampouco houve consenso sobre o local ou o formato das negociações. Os preços do petróleo recuaram na sexta-feira após reportagem da Reuters indicar que o Irã está aberto a discutir restrições no enriquecimento de urânio, embora os valores ainda permaneçam significativamente acima dos níveis anteriores ao conflito.Após uma semana marcada por nervosismo, o mercado acionário encerrou em queda, enquanto investidores avaliavam os desdobramentos geopolíticos e comerciais. O dólar registrou sua melhor performance semanal desde fevereiro. Araghchi esteve em Istambul no sábado para participar da cúpula daOrganização para a Cooperação Islâmica, informou a TV estatal iraniana. Além disso, ele deve se reunir com o presidente turcoRecep Tayyip Erdoğanem encontros paralelos ao evento. “Israel está arrastando nossa região para a instabilidade com o apoio das potências ocidentais,” disse Erdoğan durante a cúpula. Antes da suspensão do processo de negociações com os EUA, que durava dois meses e foi interrompido após o ataque de Israel, Teerã havia demonstrado disposição em aceitar certas restrições às suas atividades de enriquecimento de urânio. Por sua vez, Israel e os EUA defendem que a República Islâmica não deveria ter autorização para enriquecer urânio em nenhuma circunstância. “Não sabemos mais como podemos confiar neles,” disse Araghchi sobre possíveis negociações com os EUA, em entrevista à NBC na sexta-feira. “O que eles fizeram foi, na verdade, uma traição à diplomacia.” Antes da suspensão do processo de negociações com os EUA, que durava dois meses e foi interrompido após o ataque de Israel, Teerã havia sinalizado disposição para aceitar algumas restrições nas suas atividades de enriquecimento de urânio. Por outro lado, Israel e os EUA afirmam que a República Islâmica não deveria ter permissão alguma para realizar o enriquecimento de urânio. Trump reafirmou sua convicção de que o Irã estava a poucas semanas de obter uma bomba nuclear quando Israel realizou o ataque, ignorando mais uma vez as análises da inteligência dos EUA que indicavam que a liderança iraniana não tinha essa intenção. Ele deve participar novamente de uma reunião de segurança nacional no sábado. Enquanto alguns defendem que a participação dos EUA poderia encurtar a guerraao eliminar rapidamente a usina de enriquecimento de combustível de Fordow,outros alertam que isso poderia, na verdade, intensificar o conflitoe ampliar seu alcance para toda a região, incluindo os países vizinhos do Golfo. “Esta guerra vai contra a ordem regional que os países do Golfo querem construir, que é focada na prosperidade da região,” disse Anwar Gargash, assessor diplomático sênior do presidente dos Emirados Árabes Unidos, a repórteres em uma entrevista coletiva na sexta-feira. “Há muitas questões na região. Se escolhermos enfrentar tudo com um martelo, nada ficará intacto.” Acompanhe os mercados com nossas ferramentasAcessar gratuitamente Defesa Civil alerta para chegada de onda de frio a partir desta segunda-feira Quando a inteligência artificial é usada para manipular voz, imagem e desinformar, o risco deixa de ser um problema de Cannes e passa a ser sistêmico para todo o mercado Advertência ocorre no mesmo dia em que os americanos deslocaram ao menos seis bombardeiros furtivos B-2 para o Oceano Pacífico Projeto em discussão no Senado propõe acabar com a possibilidade de recondução e estender mandatos para cinco anos Repatriação ainda é avaliada pelo governo Lula, que estuda outras alternativas para viabilizar a saída de cidadãos brasileiros da região Candidato a prefeito de Nova York, Zohran Mamdani prometeu aumentar impostos sobre ricos para financiar ônibus gratuitos e creches, além de supermercados públicos Gean Loureiro afirmou que falta de vagas impediu o embarque Tarifas do presidente dos Estados Unidos, Donald Trump, abriram uma ruptura no banco central americano Trump avalia se deve ou não se juntar aos esforços de Israel para destruir as instalações nucleares do Irã Há anos, a China tem usado a relação com",Valor Econômico
https://valor.globo.com/mundo/noticia/2025/06/21/onu-diz-que-mais-de-11-mil-criancas-foram-mutiladas-ou-mortas-em-conflitos-armados.ghtml,2025-06-21,ONU diz que mais de 11 mil crianças foram mutiladas ou mortas em conflitos armados,"21/06/2025 11h12Atualizado21/06/2025 No ano passado, a violência contra crianças em conflitos armados atingiu níveis sem precedentes, com aumento de 25% do número de violações graves em comparação a 2023. É o que informa o relatório anual daOrganização das Nações Unidas (ONU)sobre crianças e conflitos armados, divulgado na quinta-feira (19) pelo secretário-geral da entidade,António Guterres. Em 2024, foram registrados 4.676 assassinatos e 7.291 mutilações, vitimando 11.967 crianças.A negação do acesso humanitário, com 7.906 incidentes, o recrutamento e uso de crianças (7.402) e o sequestro de menores de idade (4.573) também apresentaram números extremamente preocupantes. ""Crianças foram mortas e mutiladas, muitas vezes resultando em incapacidades permanentes, em números alarmantes, pelo uso de munições explosivas, incluindo resíduos explosivos de guerra, minas e dispositivos explosivos improvisados, e pelo fogo cruzado entre as partes em conflito. Ataques a instalações civis, incluindo escolas e hospitais, aumentaram drasticamente a vulnerabilidade das crianças"", diz o relatório. Apesar de grupos armados não estatais terem sido responsáveis por quase 50% das violações,as forças governamentais foram as principais perpetradoras da morte e mutilação de crianças, de ataques a escolas e hospitais e da negação de acesso humanitário. Os maiores números de violações graves foram verificados no Território Palestino Ocupado (8.554), especialmente na Faixa de Gaza, que sofre ataques massivos de Israel; na República Democrática do Congo (4.043); na Somália (2.568); na Nigéria (2.436) e no Haiti (2.269). Os maiores aumentos percentuais no número de violações foram verificados no Líbano (545%), Moçambique (525%), Haiti (490%), Etiópia (235%) e Ucrânia (105%). Violência sexual O número de casos de violência sexual cresceu 35%, com registro de um ""aumento drástico"" dos casos de estupro coletivo, o que destaca o uso sistemático da violência sexual como tática deliberada de guerra, enquanto crianças eram associadas a partes em conflito ou para aumentar o controle territorial, deslocar populações e atacar a etnia ou o gênero específico das crianças, entre outros objetivos, diz o relatório. O documento relata que meninas foram sequestradas para fins de recrutamento e uso, e para escravidão sexual. ""A violência sexual continua sendo amplamente subnotificada devido à estigmatização, ao medo de represálias, às normas sociais prejudiciais, à ausência ou à falta de acesso a serviços, à impunidade e a preocupações com a segurança, conforme relatado em meu relatório sobre violência sexual relacionada a conflitos."" Negação humanitária A negação do acesso humanitário atingiu ""escala alarmante"", informa a ONU, com mais trabalhadores humanitários mortos em 2024 do que nunca, incluindo muitos funcionários da própria organização. ""As partes em conflito atacaram comboios e pessoal de ajuda humanitária, detiveram arbitrariamente pessoal humanitário, restringiram atividades e movimentos humanitários, adotaram barreiras burocráticas e administrativas e interferiram em operações humanitárias, resultando em crianças sem acesso a cuidados de saúde, educação, proteção e necessidades vitais"", diz o relatório. Acompanhe os mercados com nossas ferramentasAcessar gratuitamente Defesa Civil alerta para chegada de onda de frio a partir desta segunda-feira Quando a inteligência artificial é usada para manipular voz, imagem e desinformar, o risco deixa de ser um problema de Cannes e passa a ser sistêmico para todo o mercado Advertência ocorre no mesmo dia em que os americanos deslocaram ao menos seis bombardeiros furtivos B-2 para o Oceano Pacífico Projeto em discussão no Senado propõe acabar com a possibilidade de recondução e estender mandatos para cinco anos Repatriação ainda é avaliada pelo governo Lula, que estuda outras alternativas para viabilizar a saída de cidadãos brasileiros da região Candidato a prefeito de Nova York, Zohran Mamdani prometeu aumentar impostos sobre ricos para financiar ônibus gratuitos e creches, além de supermercados públicos Gean Loureiro afirmou que falta de vagas impediu o embarque Tarifas do presidente dos Estados Unidos, Donald Trump, abriram uma ruptura no banco central americano Trump avalia se deve ou não se juntar aos esforços de Israel para destruir as instalações nucleares do Irã Há anos, a China tem usado a relação com o Irã para aumentar sua influência no Oriente Médio, ao mesmo tempo em que faz do petróleo iraniano barato um pilar da matriz energética",Valor Econômico
https://valor.globo.com/mundo/noticia/2025/06/21/japo-reino-unido-e-itlia-formam-joint-venture-edgewing-para-projeto-de-jato-militar.ghtml,2025-06-21,"Japão, Reino Unido e Itália formam joint venture Edgewing para projeto de jato militar","21/06/2025 02h34Atualizado21/06/2025 Japão, Reino Unido e Itália anunciaram na sexta-feira a fundação de uma joint venture chamada Edgewing para lidar com o projeto do caça em desenvolvimento pelos três países. Acompanhe os mercados com nossas ferramentasAcessar gratuitamente Defesa Civil alerta para chegada de onda de frio a partir desta segunda-feira Quando a inteligência artificial é usada para manipular voz, imagem e desinformar, o risco deixa de ser um problema de Cannes e passa a ser sistêmico para todo o mercado Advertência ocorre no mesmo dia em que os americanos deslocaram ao menos seis bombardeiros furtivos B-2 para o Oceano Pacífico Projeto em discussão no Senado propõe acabar com a possibilidade de recondução e estender mandatos para cinco anos Repatriação ainda é avaliada pelo governo Lula, que estuda outras alternativas para viabilizar a saída de cidadãos brasileiros da região Candidato a prefeito de Nova York, Zohran Mamdani prometeu aumentar impostos sobre ricos para financiar ônibus gratuitos e creches, além de supermercados públicos Gean Loureiro afirmou que falta de vagas impediu o embarque Tarifas do presidente dos Estados Unidos, Donald Trump, abriram uma ruptura no banco central americano Trump avalia se deve ou não se juntar aos esforços de Israel para destruir as instalações nucleares do Irã Há anos, a China tem usado a relação com o Irã para aumentar sua influência no Oriente Médio, ao mesmo tempo em que faz do petróleo iraniano barato um pilar da matriz energética",Valor Econômico
https://valor.globo.com/brasil/noticia/2025/06/21/ex-prefeito-de-florianpolis-tentou-embarcar-em-balo-que-se-acidentou.ghtml,2025-06-21,Ex-prefeito de Florianópolis tentou embarcar em balão que se acidentou,"21/06/2025 15h10Atualizado21/06/2025 O ex-prefeito de Florianópolis Gean Loureiro (União Brasil) afirmou em uma rede social que só não embarcou no balão que caiu em Praia Grande (SC) porque não havia mais vagas. Acompanhe os mercados com nossas ferramentasAcessar gratuitamente Defesa Civil alerta para chegada de onda de frio a partir desta segunda-feira Quando a inteligência artificial é usada para manipular voz, imagem e desinformar, o risco deixa de ser um problema de Cannes e passa a ser sistêmico para todo o mercado Advertência ocorre no mesmo dia em que os americanos deslocaram ao menos seis bombardeiros furtivos B-2 para o Oceano Pacífico Projeto em discussão no Senado propõe acabar com a possibilidade de recondução e estender mandatos para cinco anos Repatriação ainda é avaliada pelo governo Lula, que estuda outras alternativas para viabilizar a saída de cidadãos brasileiros da região Candidato a prefeito de Nova York, Zohran Mamdani prometeu aumentar impostos sobre ricos para financiar ônibus gratuitos e creches, além de supermercados públicos Gean Loureiro afirmou que falta de vagas impediu o embarque Tarifas do presidente dos Estados Unidos, Donald Trump, abriram uma ruptura no banco central americano Trump avalia se deve ou não se juntar aos esforços de Israel para destruir as instalações nucleares do Irã Há anos, a China tem usado a relação com o Irã para aumentar sua influência no Oriente Médio, ao mesmo tempo em que faz do petróleo iraniano barato um pilar da matriz energética",Valor Econômico
https://valor.globo.com/mundo/noticia/2025/06/21/eua-deslocam-bombardeiros-capazes-de-portar-superbombas-para-o-oriente-diz-nyt.ghtml,2025-06-21,"EUA deslocam bombardeiros capazes de portar superbombas para o Oriente, diz 'NYT'","21/06/2025 14h46Atualizado21/06/2025 Vários bombardeiros B-2 da Força Aérea dos EUA pareciam estar no ar e indo para o oeste, saindo dos Estados Unidos, através do Pacífico, e o presidente Trump deve retornar à Casa Branca no final da tarde de sábado, vindo de Nova Jersey, informou o jornal americano ""The New York Times"". Trump avalia se deve ou não se juntar aos esforços de Israel para destruir as instalações nucleares do Irã. Acompanhe os mercados com nossas ferramentasAcessar gratuitamente Defesa Civil alerta para chegada de onda de frio a partir desta segunda-feira Quando a inteligência artificial é usada para manipular voz, imagem e desinformar, o risco deixa de ser um problema de Cannes e passa a ser sistêmico para todo o mercado Advertência ocorre no mesmo dia em que os americanos deslocaram ao menos seis bombardeiros furtivos B-2 para o Oceano Pacífico Projeto em discussão no Senado propõe acabar com a possibilidade de recondução e estender mandatos para cinco anos Repatriação ainda é avaliada pelo governo Lula, que estuda outras alternativas para viabilizar a saída de cidadãos brasileiros da região Candidato a prefeito de Nova York, Zohran Mamdani prometeu aumentar impostos sobre ricos para financiar ônibus gratuitos e creches, além de supermercados públicos Gean Loureiro afirmou que falta de vagas impediu o embarque Tarifas do presidente dos Estados Unidos, Donald Trump, abriram uma ruptura no banco central americano Trump avalia se deve ou não se juntar aos esforços de Israel para destruir as instalações nucleares do Irã Há anos, a China tem usado a relação com o Irã para aumentar sua influência no Oriente Médio, ao mesmo tempo em que faz do petróleo iraniano barato um pilar da matriz energética",Valor Econômico
