url,data,titulo,texto,fonte
https://www.infomoney.com.br/mercados/figma-divulga-crescimento-de-receita-e-lucro-em-pedido-de-ipo-nos-eua/,2025-07-01,Figma divulga crescimento de receita e lucro em pedido de IPO nos EUA,"Reuters01/07/2025 18h17•Atualizado 59 minutos atrás 01/07/2025 18h17•Atualizado 59 minutos atrás Publicidade A Figma divulgou receita e lucro maiores no trimestre encerrado em 31 de março, enquanto se prepara para listar suas ações na Nyse, mais de um ano após seu planejado acordo de venda para a Adobe por US$ 20 bilhões ter sido cancelado. O IPO da plataforma de design baseada em nuvem está prestes a ser uma das listagens de maior destaque este ano, sinal de que as preocupações geradas pelas tarifas dos Estados Unidos estão cessando rapidamente em meio a um forte rali de ações. Desde que o acordo com a Adobe foi bloqueado por órgãos de defesa da concorrência da Europa e do Reino Unido, o IPO da Figma é amplamente aguardado. Em dezembro de 2023, as empresas encerraram mutuamente o acordo, que teria sido uma das maiores aquisições de uma startup de software. No ano passado, a Figma foi avaliada em US$ 12,5 bilhões em uma oferta pública que permitiu que seus funcionários e investidores iniciais resgatassem parte de sua participação. Nos três meses encerrados em 31 de março, a empresa teve receita de US$ 228,2 milhões, contra US$ 156,2 milhões no ano anterior, e seu lucro líquido triplicou para US$ 44,9 milhões. Continua depois da publicidade Parte dos recursos do IPO irá para o pagamento de dívidas, segundo a empresa. Morgan Stanley, Goldman Sachs, Allen & Co e J.P. Morgan são os subscritores líderes da operação. A Figma prevê ser negociada sob o código “FIG”. Reuters",Infomoney
https://www.infomoney.com.br/mercados/petroleo-fecha-em-alta-puxado-por-dolar-fraco-e-expectativa-de-demanda-da-china/,2025-07-01,"Petróleo fecha em alta, puxado por dólar fraco e expectativa de demanda da China","Estadão Conteúdo01/07/2025 17h51 01/07/2025 17h51 Publicidade Os contratos futuros de petróleo fecharam em alta nesta terça-feira, 1º, impulsionados pela fraqueza do dólar e por expectativas com um possível aumento na demanda por parte da China, maior importadora de petróleo do mundo, após dados econômicos positivos no país asiático. No radar, investidores seguem monitorando um possível aumento de produção da commodity pela Organização de Países Exportadores de Petróleo e aliados (Opep+), bem como o cenário geopolítico no Oriente Médio. Na New York Mercantile Exchange (Nymex), o petróleo WTI para agosto fechou em alta de 0,52% (US$ 0,34), a US$ 65,45 o barril. Já o Brent para setembro, negociado na Intercontinental Exchange (ICE), avançou 0,55% (US$ 0,37), a US$ 67,11 o barril. Principais índices em NY fecham mistos com projeto orçamentário de Trump passando no Senado Em meio à incerteza sobre as políticas comerciais e fiscais dos EUA, o dólar oscilou entre ganhos e perdas e favoreceu a alta do petróleo. Para o Price Futures Group, o óleo também é beneficiado pela “boa demanda sazonal”, que compensa parcialmente a perda do prêmio de risco geopolítico, enquanto o cessar-fogo entre Israel e Irã se mantém. Ontem, a leitura da S&P Global em parceria com a Caixin mostrou que o índice de gerentes de compras (PMI) industrial da China subiu de 48,3 em maio para 50,4 em junho, acima do esperado por analistas da FactSet. O resultado acima da marca de 50 pontos indica expansão da atividade, o que aumenta as expectativas de uma maior demanda de petróleo pelo país. No entanto, de acordo com o ING, os ganhos da commodity são moderados pelas expectativas com a decisão de aumento da produção da Opep+ em agosto. “Isso e um aumento de magnitude semelhante em setembro reverteriam completamente os 2,2 milhões de barris por dia de cortes voluntários e contribuiriam para um superávit no mercado global no 4º trimestre”, afirma o banco holandês. Na avaliação da Kpler, o cartel “parece estar em um curso que pode inclinar o mercado global de petróleo para uma perspectiva de baixa” e há preocupações com o excesso de oferta do óleo no mercado. Para a instituição, “tensões comerciais não resolvidas” também pesam para o lado negativo. Continua depois da publicidade *Com informações da Dow Jones Newswires Estadão Conteúdo",Infomoney
https://www.infomoney.com.br/mercados/dolar-hoje-abertura-fechamento-comercial-turismo-01072025/,2025-07-01,"Dólar sobe a R$ 5,46, acompanhando exterior e após o governo defender IOF no STF","Felipe MoreiraAgências de notícias01/07/2025 17h33•Atualizado 2 horas atrás 01/07/2025 17h33•Atualizado 2 horas atrás Publicidade Após atingir na véspera a menor cotação desde setembro do ano passado, o dólar fechou a terça-feira em alta ante o real, acompanhando por um lado o avanço da divisa dos EUA também no exterior e por outro o embate entre governo e Congresso sobre o IOF no Brasil. Leia mais: Dólar Hoje: Confira a cotação e fechamento diário do dólar comercial Saiba em 1 minuto quanto seu dinheiro pode render Em Brasília, o governo decidiu que ingressará nesta terça no Supremo Tribunal Federal (STF) com uma ação para tentar anular a decisão do Congresso que derrubou a alta do Imposto sobre Operações Financeiras (IOF). O dólar à vista fechou com alta de 0,48%, aos R$5,4610, depois de ter atingido na segunda-feira o menor valor desde 19 de setembro. No ano, porém, a divisa acumula baixa de 11,62%. Às 17h04 na B3 o dólar para agosto — atualmente o mais líquido no Brasil — subia 0,48%, aos R$5,5005. Continua depois da publicidade Analistas veem fraqueza do dólar principalmente por questões globais e projetam mais quedas, ainda que modestas, na segunda metade do ano Índices futuros dos EUA recuam após registrarem recordes Depois de oscilar no território negativo na abertura, o dólar ganhou força no Brasil com alguns agentes aproveitando os preços mais baixos para comprar moeda, em movimento amparado ainda pela cautela em torno da disputa entre governo e Congresso sobre o Imposto sobre Operações Financeiras (IOF). A Advocacia-Geral da União (AGU) decidiu ingressar com ação no Supremo Tribunal Federal (STF) para defender o decreto do governo que elevou alíquotas do imposto, derrubado pelo Congresso Nacional. Pela manhã, o secretário-executivo do Ministério da Fazenda, Dario Durigan, afirmou em evento em São Paulo que a decisão do presidente Luiz Inácio Lula da Silva de recorrer ao Supremo é mais jurídica do que econômica ou política. Durigan disse que é normal da democracia o presidente defender suas prerrogativas constitucionais e afirmou que não faltará da parte dele, e da equipe econômica disposição para dialogar com o Congresso. Continua depois da publicidade No mercado de câmbio, além do desconforto com a possibilidade de retorno das alíquotas mais altas, agentes avaliavam que o embate entre governo e Congresso eleva as incertezas. O viés positivo para o dólar se intensificou no fim da manhã, após o Departamento do Trabalho dos EUA, em sua pesquisa Jolts, informar que as vagas de emprego em aberto — uma medida da demanda por mão de obra — subiram em 374.000, para 7,769 milhões, no último dia de maio. Economistas consultados pela Reuters previam 7,30 milhões de vagas. Os números deram força à leitura de que o Federal Reserve pode não ter tanto espaço para cortar juros no curto prazo, o que impulsionou o dólar ante várias outras divisas e os rendimentos dos Treasuries. Continua depois da publicidade Neste cenário, após registrar a cotação mínima de R$5,4204 (-0,27%) às 9h06, logo depois da abertura, o dólar à vista atingiu a máxima de R$5,4712 (+0,67%) às 15h22. Às 17h14, o índice do dólar =USD — que mede o desempenho da moeda norte-americana frente a uma cesta de seis divisas — caía 0,04%, a 96,717. (Com Reuters) Felipe Moreira",Infomoney
https://www.infomoney.com.br/mercados/ibovespa-hoje-bolsa-de-valores-ao-vivo-01072025/,2025-07-01,"Ibovespa abre semestre em alta, com Vale, Petrobras e Embraer","Principais índices em NY fecham mistos com projeto orçamentário de Trump passando no Senado Começou o segundo semestre de 2025. Hoje, foi o primeiro dia do resto do ano. E o Ibovespa, veja só, começou da mesma maneira que terminou a primeira metade: com ganhos. Ontem, mais 1,45%. Hoje, um pouco menos,com 0,50%, aos 139.549,43 pontos, um ganho de 694,83 pontos. Ninguém reclamou. O real é que não teve uma performance lá muito animadora neste 1º de julho. Depois de três baixas seguidas, o dólar comercialganhou terreno sobre a moeda nacional,com mais 0,51%, a R$ 5,461– ainda abaixo de R$ 5,5. E os juros futuros (DIs) terminaram de forma mista. Ainda faltam exatos seis meses para 2026, mas o ano de 2025 parece interminável, com tanta coisa que aconteceu até aqui. Para começar o resto do ano, o governo resolveu chacoalhar ainda mais o cenário:acionou de fato, como esperado, o STFpara reverter a anulação do decreto do IOF pelo Legislativo. Para amenizar, a Advocacia-Geral da União (AGU) chamou a manobra de ato em favor da institucionalidade da Presidência da República enão de algo contra o Congresso. O líder da oposição não quis nem saber. Afirmou, de forma contundente: “governo declarou guerra ao Congresso“. Não se sabe ainda como ficarão as relações entre os dois poderes. Nos meses que virão pela frente, quem sabe? Enquanto isso, o presidente Lula tenta ajustar o discurso e defendeu o seu ministro da Fazenda, Fernando Haddad: segundo os dois,o objetivo é uma “tributação mais justa”. Paralelamente, sem perder tempo, o secretário-executivo do Ministério da Fazenda, Dario Durigan, voltou a afirmar que o governonão permitirá que o país passe por uma crise fiscal. Trump ganha no Senado, mas no sufocoCrise fiscal que o governo Trump, lá nos EUA, também parece ter que enfrentar. No primeiro dia do resto do ano, o Executivo conseguiu umavitória para lá de apertada do novo pacote trilionário, bastante criticado. O voto vencedor foi o de minerva, que no caso da lei dos EUA coube ao vice-presidente do país, que também é presidente do Senado, JD Vance.Do outro lado do Atlântico, com horas à frente, as bolsas europeias terminaram esse primeiro dia do segundo semestrecom baixas. As negociações comerciais com os EUA seguem no foco. A inflação na zona do euro, ao menos,já atingiu a meta do BCE agora em junho.Ainda na Europa, Jerome Powell, presidente do banco central dos EUA, participou de um evento de banqueiros centrais, em Sintra, Portugal, e disse que tirando a questão das tarifas, talvez já fosse hora do Fed cortar taxas, mas em algum momento, ainda este ano,isso irá acontecer. Assim, os principais índices em Nova York terminaram mesmo mistos.Vale acelera e Petrobras sobeO tempo não para, já dizia o poeta. E em São Paulo, com seis meses ainda pela frente, o Ibovespa já acumula ganhos de mais de 16% em 2025. Nada mal.Hoje, foi a Vale (VALE3), com seus pomposos mais 1,35%, quem mais ajudou na alta do principal índice da Bolsa brasileira. Ainda que o minério de ferro não ajudou ecaiu na China. Petrobras (PETR4) valorizou 0,35%, com o petróleo subindo nas duas principais referências mundiais.É tempo de colher frutos, pelo menos para a Embraer (EMBR3), que decolou 4,42%,com novos pedidos da companhia aérea SAS.CONTINUA DEPOIS DA PUBLICIDADEMas é tempo ainda de incertezas, pelo menos para os bancos, que oscilaram neste 1º de julho. BB (BBAS3) caiu 0,81%, depois de passar boa parte do dia no azul. Itaú Unibanco (ITUB4) também oscilou e quase não saiu da estabilidade – no final, respirou e ficou com mais 0,45%. Bradesco (BBDC4) avançou 0,62% e Santander (SANB11) ganhou 2,02%. Já a B3 (B3SA3) perdeu 0,55%.Hora de dividendos, quando se trata de BB Seguridade (BBSE3): as ações subiram 1,76%, com anúncio dedistribuição de mais de R$ 3 bilhões.É tempo também de mudanças. Natura (NTCO3) negociou hoje pela última vez com esseticker– amanhã é NATU3 – e omercado analisa as mudançasque incluem a separação da Avon Internacional. O ativo recuou 2,26%.Tem também contagem regressiva: o Conselho Administrativo de Defesa Econômica (Cade) determinou um prazo de 60 dias para que a CSN (CSNA3) apresenteum plano de venda das açõesque detém na Usiminas (USIM5). As duas ações terminaram em direção contrárias: respectivamente, mais 0,94% e menos 0,49%.E, enfim, é tempo de dados. Amanhã, os brasileiros conhecerão a produção industrial de maio. Os norte-americanos terão mais um dado do mercado de trabalho, com as vagas privadas ADP,após o JOLTs surpreender hoje. Na Europa, tem a taxa de desemprego. Assim, o relógio gira os ponteiros: piscou, o tempo voou, o ano acabou. (Fernando Augusto Lopes)CONTINUA DEPOIS DA PUBLICIDADEConfira as últimas dos mercadosupdate18h04Encerramos nossa cobertura dos Mercados Ao VivoAcessa o Ao Vivo do InfoMoney todos os dias? Então, adicioneeste link aos favoritosdo seu navegador para acompanhar diariamente a cobertura a partir das 8 horas ou acesse oIM Trader, onovo canal do InfoMoney sobre Mercados!update18h04Minidólar com vencimento em agosto (WDOQ25), nos minutos finais, tem alta de 0,48%, cotado a 5.500,00update18h03Mini-índice com vencimento em agosto (WINQ25) tem, na reta final, mais 0,40%, aos 141.685 pontosVolume de negócios ultrapassou os 4,48 milhões.update18h03Na reta final, Bitcoin Futuro (BITFUT) tem recuo de 1,04%, aos 582.980,00update18h03Perto do fechamento, Ibovespa Futuro (INDFUT) tem mais 0,38%, aos 141.635 pontosupdate18h02Próximo de fechar, Dólar Futuro (DOLFUT) opera com mais 0,47%, aos 5.499,50update18h00DIs: juros futuros encerram sessão de forma mistaTaxa (%)Variação (pp)DI1F2614,915-0,010DI1F2714,1050,010DI1F2813,2900,040DI1F2913,0800,010DI1F3113,160-0,010DI1F3213,220-0,030DI1F3313,230-0,040DI1F3513,220-0,050update17h36Ibovespa: BBAS3 é a ação mais negociada do dia; veja as demaisNegóciosDia (%)BBAS337.151-0,81ITUB437.0110,45VALE335.0021,35B3SA332.997-0,55BBDC430.4040,62update17h34Ibovespa: EMBR3 é a maior alta do dia; confira a listaDia (%)Valor (R$)EMBR34,4280,41CSAN33,067,07PCAR32,603,16RECV32,5814,70BEEF32,245,01update17h33Ibovespa: AZZA3 é a maior queda do dia; veja a listaDia (%)Valor (R$)AZZA3-4,4241,10ASAI3-3,2010,90NTCO3-2,2610,80VAMO3-1,914,10SMTO3-1,7617,26update17h19Índice de Small Caps (SMLL) encerra sessão com alta de 0,07%, aos 2.231,65 pontosupdate17h19Índice de BDRs (BDRX) termina sessão com baixa de 0,23%, aos 22.036,72 pontosupdate17h18Índice de Fundos Imobiliários (IFIX) encerra pregão com menos 0,26%, aos 3.474,88 pontosupdate17h15Ibovespa fecha com alta de 0,50%, aos 139.549,43 pontosMáxima: 139.695,23Mínima: 138.854,89Diferença para a abertura: +694,83 pontosVolume: R$ 17,30 bilhõesConfira a evolução do IBOV durante a semana, mês e ano:Segunda-feira (30): +1,45%Terça-feira (1º): +0,50%Semana: +1,96%Julho: +0,50%3T25: +0,50%2025: +16,02%Receba as principais notícias de",Infomoney
https://www.infomoney.com.br/mercados/embraer-embr3-acao-sobe-forte-apos-receber-novas-encomendas-de-aeronaves-da-sas/,2025-07-01,"Embraer: boas notícias continuam e ação EMBR3 sobe 4,42% com novos pedidos de aérea","Felipe Moreira01/07/2025 17h25•Atualizado 2 horas atrás 01/07/2025 17h25•Atualizado 2 horas atrás Publicidade As ações da fabricante de aeronaves Embraer (EMBR3) fecharam com forte valorização e renovando máximas nesta terça-feira (1º), após a companhia brasileira fechar acordo para venda de até 55 aeronaves para companhia aérea SAS. Às 10h59 (horário de Brasília), ação da empresa subiu 4,42%, a R$ 80,41. A Scandinavian Airlines (SAS) assinou um acordo com a Embraer para comprar 45 jatos E195-E2 da companhia brasileira, com direitos de compra para 10 aeronaves adicionais. Segundo o JPMorgan, a parte firme do pedido está avaliada em aproximadamente US$ 3,8 bilhões (considerando um preço de tabela de US$ 84,1 milhões por aeronave), representando um aumento de 12% no backlog (carteira de pedidos) consolidado, que chega a US$ 34,5 bilhões após o Salão Aéreo de Paris de 2025 (PAS), já excluindo as entregas previstas para o 2T25. Incluindo as opções, estima-se que o pedido totalize US$ 4,6 bilhões, levando o backlog para US$ 36,6 bilhões (+14% em relação ao pós-PAS com opções). A entrega de quatro aeronaves A-29 Super Tucano para a Força Aérea Paraguaia As entregas devem começar em 2028, mas ainda se aguarda o comunicado oficial da Embraer para confirmação. Com esse anúncio, o book-to-bill (relação entre pedidos recebidos e entregas) da Embraer em 2025 na aviação comercial fica entre 1,41 vez e 1,56 vez, considerando os 120 pedidos firmes no ano até agora e a projeção de entregas para 2025. O JPMorgan considera o anúncio positivo, pois confirma o forte momento das campanhas de vendas da Embraer e a expansão do backlog, fatores importantes para a recomendação de compra e preço-alvo de R$ 93. A Embraer está sendo negociada a um múltiplo de 9,1 vezes Valor da Firma (EV)/Ebitda, ou lucro antes de juros, impostos, depreciações e amortizações, estimado para 2026, contra 22,8 vezes da Boeing, 11,1 vezes da Airbus e 8,2 vezes da Bombardier. O Bradesco BBI avaliou como positiva a notícia do novo pedido recebido pela Embraer, mantendo recomendaçãooutperform(desempenho acima da média, equivalente à compra) para o papel e preço-alvo de US$ 60,00 para o ADR ERJ (recibo de ações negociado na Bolsa de Nova York). Segundo o banco, pelo preço de tabela, o pedido firme de 45 aeronaves representa aproximadamente US$ 4 bilhões, o equivalente a 15% do backlog reportado no 1T25. Considerando também as opções, o valor total do contrato pode chegar a US$ 4,8 bilhões, ou 18% do backlog. Em termos de valor presente líquido (VPL), o BBI estima um impacto de US$ 1,60 por ação ERJ, o que representa cerca de 3% sobre o preço de fechamento anterior. Continua depois da publicidade O pedido é considerado relevante, uma vez que havia preocupações no mercado quanto ao fato de os contratos recentes da Embraer, no segmento de aviação comercial, estarem concentrados na família E1, como o acordo de 60 unidades com a SkyWest. Agora, a demanda volta a incluir os modelos da nova geração E2. O banco também destaca que o novo contrato eleva o book-to-bill da companhia para 1,5 vez, patamar considerado sólido e próximo ao registrado no ano passado (1,6x). Além da aviação comercial, o BBI observa que os segmentos de defesa e jatos executivos seguem com desempenho robusto, impulsionados pela crescente demanda por aeronaves como o KC-390, o A-29 Super Tucano e pelos jatos da aviação executiva. O Itaú BBA também avalia as notícias como positivas. O pedido da SAS, anunciado logo após o acordo com a SkyWest, reforça o fluxo de notícias construtivas em torno do programa de jatos comerciais da Embraer, impulsionando especialmente o programa E2. Continua depois da publicidade O BBA destaca que o pedido aumenta em cerca de US$ 2 bilhões a carteira atual de pedidos da Embraer, que soma US$ 26,4 bilhões (sem incluir entregas e novos pedidos após o 1T25). Além disso, o fato de as entregas estarem previstas para começar em 2027 destaca o prazo significativamente menor da Embraer em comparação com seus concorrentes comerciais. Desde o início de junho, a Embraer permanece como a principal escolha do BBA, sustentada por catalisadores futuros, como potenciais novos pedidos e o início da campanha de testes de voo do EVE no segundo semestre de 2025. O banco manteve recomendação de compra e preço-alvo de US$ 62. Já o BTG comenta que dado o forte acúmulo de pedidos, o foco do mercado deve migrar gradualmente para a capacidade da Embraer de executar e entregar esse pipeline elevado. Especialmente considerando que ainda há gargalos na cadeia de suprimentos, sobretudo na p rodução de motores. Continua depois da publicidade Dados preliminares sugerem que as entregas do segundo trimestre foram ligeiramente inferiores às do mesmo período do ano passado (esperamos que a empresa divulgue os números em breve), o que reflete dificuldades operacionais e entraves logísticos. “Por isso, continuamos projetando que a performance da aviação comercial da Embraer será significativamente concentrada no segundo semestre de 2025”, diz BTG. “A normalização da produção deve se tornar mais visível a partir de 2026, ao menos na divisão comercial.” O BTG reiterou recomendação de compra e preço-alvo de R$ 94 paraEMBR3. Felipe Moreira",Infomoney
https://www.infomoney.com.br/mercados/bbse3-acoes-da-bb-seguridade-sobem-apos-bolada-de-r-377-bi-em-dividendos/,2025-07-01,"BBSE3: ações da BB Seguridade sobem 2% após bolada de R$ 3,77 bi em dividendos","Lara Rizério01/07/2025 17h21•Atualizado 2 horas atrás 01/07/2025 17h21•Atualizado 2 horas atrás Publicidade A BB Seguridade (BBSE3) vê suas ações subirem nesta terça-feira (1) após anunciar na vésperadividendos de R$ 3,77 bilhões referentes ao primeiro semestre de 2025, com dividend yield (dividendo sobre valor da ação) bruto de 1,9%. Os valores a serem distribuídos por ação e as datas de pagamento e de início das negociações das ações ex-dividendos serão informados após a divulgação dos resultados do 2T25, prevista para o dia 4 de agosto de 2025. Os ativosBBSE3fecharam com ganhos de 1,98%, a R$ 36,51. Bolsas dos EUA recuam após registrarem recordes O Goldman Sachs, por sua vez, considerou o anúncio como neutro, com o dividendo em apenas 3% acima da sua projeção. O dividendo implica um payout ratio (dividendo em relação ao lucro) de 89% em suas estimativas, consistente com a mensagem da administração de manter a taxa na parte superior da faixa de 80-90%. “Observamos também que umpayoutde 90% implicaria R$ 2,2 bilhões em lucros no 2T25 (contra R$ 2,1 bilhões esperado pelo Goldman e R$ 2,4 bilhões inferidos pelos dados mensais de abril)”, avalia. Após seu recente desempenho abaixo do esperado (-9% nos últimos 3 meses), o Goldman projeta agora um dividend yield de 11,5% para aBBSE3em 2025, o maior em sua ampla cobertura empresas financeiras. A recomendação é de compra paraBBSE3, com um preço-alvo de R$ 43 em doze meses (19% de potencial de valorização e 12% de rendimento de dividendos). Lara Rizério Editora de mercados do InfoMoney, cobre temas que vão desde o mercado de ações ao ambiente econômico nacional e internacional, além de ficar bem de olho nos desdobramentos políticos e em seus efeitos para os investidores.",Infomoney
