url,data,titulo,texto,fonte
https://valor.globo.com/politica/noticia/2025/08/20/governistas-admitem-falha-na-articulacao-em-derrota-na-cpi-mista-do-inss.ghtml,2025-08-20,Governistas admitem falha na articulação em derrota na CPI mista do INSS,"20/08/2025 14h52Atualizadoagora Parlamentares da base governista admitiram nesta quarta-feira que falhas na articulação política resultaram na inesperadaderrota na sessão para definição dos cargos da CPMI do INSS. Por 17 votos a 14, o colegiado elegeu o senadorCarlos Viana (Podemos-MG)para a presidência e este indicou o deputado bolsonaristaAlfredo Gaspar (União-AL)para a relatoria. Acompanhe os mercados com nossas ferramentasAcessar gratuitamente Segundo o presidente da Comissão Parlamentar Mista de Inquérito do INSS, o colegiado funcionará duas vezes na semana e o plano de trabalho será apresentado na próxima quinta (28) A Casa também aprovou novo diretor da Agência Nacional de Transportes Terrestres e nova ouvidora da Agência Nacional de Transportes Aquaviários Blogueiro vive nos EUA desde 2020; em outubro de 2021, o ministro Moraes decretou sua prisão preventiva e extradição, mas pedido não foi atendido e seu nome não foi incluído na lista da Interpol Polícia Federal também fez buscas contra pastor Silas Malafaia Pastor está proibido de deixar o Brasil e de manter contato com outros investigados Mais cedo, um aliado de Trump acusou Cook de fraudar dados para financiamentos imobiliários e Trump endossou afirmando que ela deveria renunciar Estratégia, segundo a companhia, é focar na posição de liderança no mercado de fragrâncias, que representa mais de 60% das receitas atualmente Petroleira afirma que tem diversos estudos e análises de possibilidades de negócios nos segmentos de bioprodutos, que incluem as cadeias de etanol A Autoridade Nacional de Segurança Nuclear (ANSN) é uma autarquia federal responsável por monitorar, regular e fiscalizar a segurança nuclear e a proteção radiológica no Brasil",Valor Econômico
https://valor.globo.com/financas/noticia/2025/08/20/ministros-do-stf-voltam-a-receber-bancos-para-discutir-magnitsky-aps-deciso-de-dino.ghtml,2025-08-20,Ministros do STF voltam a receber bancos para discutir Magnitsky após decisão de Dino,"Em alta 20/08/2025 17h06Atualizadoagora Ministros do Supremo Tribunal Federal (STF) voltaram a receber representantes de bancos após decisão dada na segunda-feira por Flávio Dino contra a aplicação imediata no Brasil de leis, decisões judiciais, atos administrativos e ordens executivas estrangeiras. Cristiano Zanin recebeu Rodrigo Maia, ex-presidente da Câmara e atual presidente da Confederação Nacional das Instituições Financeiras (antiga CNF, atual FIN). O encontro ocorreu ontem. Eles já tinham se reunido no começo do mês, após Zanin ser sorteado relator de uma ação que pede para o STF barrar o bloqueio das contas do ministro Alexandre de Moraes. Outros ministros também receberam representantes de bancos de segunda-feira para cá. Segundo apurou oValor, os bancos ainda têm dúvidas sobre todos os efeitos da decisão dada por Dino. De um lado, eles temem sanções dos Estados Unidos e, de outro, multas do Supremo caso descumpram a ordem de Dino. Zanin é relator de uma ação em que o deputado Lindbergh Farias (PT-RJ), líder do PT na Câmara, pede para o Supremo impedir que bancos brasileiros bloqueiem as contas de Moraes, sancionado pela Magnitsky em julho. Em 1º de agosto, o ministro enviou o caso à Procuradoria-Geral da República (PGR). Ele aguarda o posicionamento do órgão. Zanin quer ouvir todos os atores envolvidos antes de tomar uma eventual decisão, o que inclui também bancos. No começo do mês, Gilmar Mendes e Moraes também participaram de reuniões com representantes de bancos. Na ocasião, a avaliação foi a de que não haveria bloqueios de contas naquele momento. Se houvesse movimentação neste sentido, no entanto, o STF poderia atuar para barrar a aplicação da Magnitsky no Brasil, como de fato ocorreu na segunda-feira (18) por meio da decisão de Dino. A ordem foi dada em uma ação que não discute especificamente as sanções dos EUA, mas ações movidas por municípios brasileiros no Reino Unido por desastres ambientais. Por meio de associações setoriais, as instituições financeiras têm atuado em Brasília para tentar diminuir a temperatura em meio à escalada das tensões entre Brasil e Estados Unidos. Acompanhe os mercados com nossas ferramentasAcessar gratuitamente Segundo o presidente da Comissão Parlamentar Mista de Inquérito do INSS, o colegiado funcionará duas vezes na semana e o plano de trabalho será apresentado na próxima quinta (28) A Casa também aprovou novo diretor da Agência Nacional de Transportes Terrestres e nova ouvidora da Agência Nacional de Transportes Aquaviários Blogueiro vive nos EUA desde 2020; em outubro de 2021, o ministro Moraes decretou sua prisão preventiva e extradição, mas pedido não foi atendido e seu nome não foi incluído na lista da Interpol Polícia Federal também fez buscas contra pastor Silas Malafaia Pastor está proibido de deixar o Brasil e de manter contato com outros investigados Mais cedo, um aliado de Trump acusou Cook de fraudar dados para financiamentos imobiliários e Trump endossou afirmando que ela deveria renunciar Estratégia, segundo a companhia, é focar na posição de liderança no mercado de fragrâncias, que representa mais de 60% das receitas atualmente Petroleira afirma que tem diversos estudos e análises de possibilidades de negócios nos segmentos de bioprodutos, que incluem as cadeias de etanol A Autoridade Nacional de Segurança Nuclear (ANSN) é uma autarquia federal responsável por monitorar, regular e fiscalizar a segurança nuclear e a proteção radiológica no Brasil",Valor Econômico
https://valor.globo.com/financas/noticia/2025/08/20/stf-precisara-encontrar-solucao-que-nao-coloque-sistema-financeiro-em-risco-diz-banqueiro.ghtml,2025-08-20,"STF precisará encontrar solução que não coloque sistema financeiro em risco, diz banqueiro","Em alta Por Reuters 20/08/2025 16h59Atualizadohá 2 horas O embate entre o Supremo Tribunal Federal (STF) e o governo americano pode ter consequências sérias para instituições financeiras brasileiras, disseram dois banqueiros do país que pediram anonimato para falar com franqueza sobre o assunto. Na segunda-feira (18), ministro do STF Flávio Dino alertou que leis estrangeiras não podem ser automaticamente aplicadas no Brasil. A decisão ocorreu após os EUA terem aplicado a Lei Magnitsky contra o ministro Alexandre de Moraes, também do Supremo. A Magnitsky impede o sancionado de ter contas em instituições americanas, entre outras medidas. A decisão de Dino foi seguida por uma dura repreensão do Escritório de Assuntos do Hemisfério Ocidental do Departamento de Estado dos EUA . Leia também:Moraes diz que bancos podem ser punidos se aplicarem sanções dos EUA a ativos brasileirosÉ muita falta de responsabilidade quando um brasileiro coloca em xeque a solidez de uma empresa como o BB, diz CEO A maioria dos grandes bancos é supervisionada de alguma forma pelo governo dos EUA devido à sua presença internacional ou exposição, seja por meio de uma filial estrangeira ou pela emissão de títulos no exterior, disse o ex-diretor de um banco internacional no Brasil. A escolha para esses bancos, sob pressão dos EUA, pode ser convidar clientes sancionados a buscar outra instituição para manter seus ativos, acrescentou o banqueiro. O diretor de um grande banco brasileiro afirmou que, na prática, a decisão judicial de segunda-feira significa que qualquer ação tomada por bancos brasileiros com base em regras envolvendo o Escritório de Controle de Ativos Estrangeiros (OFAC) do Tesouro dos EUA, que supervisiona sanções americanas, precisará de aprovação do Supremo. Ao mesmo tempo, ele acrescentou, deixar de cumprir uma decisão do OFAC pode cortar o acesso de um banco ao sistema financeiro internacional. “O Brasil realmente não tem escolha”, disse o banqueiro. “Dado o quão interconectado tudo é, e a disparidade de poder econômico entre os EUA e o Brasil, ficamos em uma posição de subordinação. Não há muito o que fazer.” Ele ressaltou que o tribunal precisará encontrar uma solução “que não coloque o sistema financeiro em risco.” As ações doBanco do Brasil, onde a maioria dos funcionários públicos, incluindo juízes, recebe seus salários, caíram 6% na terça-feira — a maior queda entre os três maiores bancos do país. O banco afirmou em comunicado na terça-feira que está preparado para lidar com questões “complexas e sensíveis” envolvendo regulamentações globais. Acompanhe os mercados com nossas ferramentasAcessar gratuitamente Segundo o presidente da Comissão Parlamentar Mista de Inquérito do INSS, o colegiado funcionará duas vezes na semana e o plano de trabalho será apresentado na próxima quinta (28) A Casa também aprovou novo diretor da Agência Nacional de Transportes Terrestres e nova ouvidora da Agência Nacional de Transportes Aquaviários Blogueiro vive nos EUA desde 2020; em outubro de 2021, o ministro Moraes decretou sua prisão preventiva e extradição, mas pedido não foi atendido e seu nome não foi incluído na lista da Interpol Polícia Federal também fez buscas contra pastor Silas Malafaia Pastor está proibido de deixar o Brasil e de manter contato com outros investigados Mais cedo, um aliado de Trump acusou Cook de fraudar dados para financiamentos imobiliários e Trump endossou afirmando que ela deveria renunciar Estratégia, segundo a companhia, é focar na posição de liderança no mercado de fragrâncias, que representa mais de 60% das receitas atualmente Petroleira afirma que tem diversos estudos e análises de possibilidades de negócios nos segmentos de bioprodutos, que incluem as cadeias de etanol A Autoridade Nacional de Segurança Nuclear (ANSN) é uma autarquia federal responsável por monitorar, regular e fiscalizar a segurança nuclear e a proteção radiológica no Brasil",Valor Econômico
https://valor.globo.com/financas/noticia/2025/08/20/c6-tem-lucro-de-r-1-bilho-no-1-semestre-e-chega-a-37-milhes-de-clientes.ghtml,2025-08-20,C6 tem lucro de R$ 1 bilhão no 1º semestre e chega a 37 milhões de clientes,"Em alta 20/08/2025 16h35Atualizadoagora O C6 Bank teve lucro líquido de R$ 1,049 bilhão no primeiro semestre, com queda de 19,4% ante o semestre imediatamente anterior e alta de 8,3% ante o mesmo período de 2024. O retorno sobre o patrimônio líquido (ROE) anualizado ficou em 43% e o banco, fundado há seis anos, chegou a 37 milhões de clientes. ""Neste semestre, nosso balanço deixa evidente duas características do nosso modelo de negócio: crescimento, de receitas e de lucro, por meio da expansão das nossas áreas de atuação, e a capacidade de gerar um ROE elevado e recorrente, resultado da alavancagem operacional que nossa estrutura proporciona"", diz em nota o CEO do C6 Bank, Marcelo Kalim. A receita líquida atingiu R$ 4,238 bilhões, com expansão de 7,5% no semestre e de 3,2% em um ano. Já as despesas operacionais somaram R$ 1,969 bilhão, com queda de 14,4% e 12,6%, respectivamente. Já as provisões para devedores duvidosos (PDD) somaram R$ 996 milhões, com alta de 15,4% e baixa de 5,2%, na mesma base de comparação. A carteira de crédito expandida do banco fechou o primeiro semestre do ano em R$ 72,387 bilhões, o que representa uma expansão de 20,7% no semestre e de 49,1% em um ano. Deste total, 46% está em consignado, 26% em veículos, 16% em crédito para pessoa física, 11% em pessoa jurídica e 1% em home equity. A taxa de inadimplência ficou em 3,2% no primeiro semestre, de 2,6% em dezembro e 3,1% em junho do ano passado. Entretanto, o C6 diz que, excluindo o impacto da Resolução CMN nº 4.966 do Banco Central, o índice agora teria sido de 2,1%. Segundo o vice-presidente financeiro do C6, Philippe Katz, a PDD está bem controlada e sobe nominalmente porque a carteira cresce muito. Ele diz que uma desaceleração da atividade econômica no segundo semestre e o juro a 15% já estavam na conta do banco e que a carteira deve manter um ritmo forte, superando R$ 80 bilhões este ano. ""Temos um crescimento saudável, com melhora no indicador de inadimplência. Esse patamar de 3%, com a resolução 4.966, é confortável para nós"", diz o CFO. Ele ressalta que o C6 tem uma carteira muito colateralizada, sendo que esse indicador chegou a 79,8% em junho, de 75,8% no meio do ano passado. Com o C6 forte em consignado, Katz diz que no primeiro semestre o banco foi cauteloso com a nova linha para trabalhadores do setor privado, mas que deve crescer de maneira mais forte na segunda metade do ano. ""Conhecemos o produto, entendemos deste mercado. Estamos observando como as coisas acontecem e no segundo semestre devemos crescer mais."" A base de captação (depósitos à vista e a prazo) do C6 cresceu 64% em um ano, para R$ 93,5 bilhões. Igor Rongel, diretor de investimentos e private banking, lembra que o banco abriu em março três escritórios regionais de investimento, se somando aos quatro que já possuía, com o objetivo de tornar o atendimento ao cliente de alta renda ainda mais próximo. ""Nossa captação cresceu mais que a base de clientes, o que signifca que estamos ganhando mais engajamento e principalidade. O investimento geralmente vem por último, o cliente só investe quando está com a credibilidade do banco muito bem cristalizada na sua mente"", diz Rongel. Para Katz, outro indicador que mostra o maior engajamento e aumento do número de produtos por clientes é a receita de serviços, que saiu de 20% para 27%. ""À medida que o banco cresce, com maior penetração na alta renda, temos olhado mais o engajamento... o o número de usuários passa a não ser tão relevante assim. Ter a principalidade pode ser mais importante do que trazer 'X' clientes."" Acompanhe os mercados com nossas ferramentasAcessar gratuitamente Segundo o presidente da Comissão Parlamentar Mista de Inquérito do INSS, o colegiado funcionará duas vezes na semana e o plano de trabalho será apresentado na próxima quinta (28) A Casa também aprovou novo diretor da Agência Nacional de Transportes Terrestres e nova ouvidora da Agência Nacional de Transportes Aquaviários Blogueiro vive nos EUA desde 2020; em outubro de 2021, o ministro Moraes decretou sua prisão preventiva e extradição, mas pedido não foi atendido e seu nome não foi incluído na lista da Interpol Polícia Federal também fez buscas contra pastor Silas Malafaia Pastor está proibido de deixar o Brasil e de manter contato com outros investigados Mais cedo, um aliado de Trump acusou Cook de fraudar dados para financiamentos imobiliários e Trump endossou afirmando que ela deveria renunciar Estratégia, segundo a companhia, é focar na posição de liderança no mercado de fragrâncias, que representa mais de 60% das receitas atualmente Petroleira afirma que tem diversos estudos e análises de possibilidades de negócios nos segmentos de bioprodutos, que incluem as cadeias de etanol A Autoridade Nacional de Segurança Nuclear (ANSN) é uma autarquia federal responsável por monitorar, regular e fiscalizar a segurança nuclear e a proteção radiológica no Brasil",Valor Econômico
https://valor.globo.com/brasil/noticia/2025/08/20/politicamente-e-pior-ser-amigo-do-que-inimigo-de-trump-diz-alex-soros.ghtml,2025-08-20,"Politicamente, é pior ser amigo do que inimigo de Trump, diz Alex Soros","20/08/2025 16h41Atualizadoagora O presidente do Conselho da Open Society Foundations, Alexander Soros, afirmou nesta quarta-feira (20) que ser atacado pelo presidente dos Estados Unidos, Donald Trump, pode ser politicamente mais interessante do que ser aliado do presidente americano. Em seminário na sede do Banco Nacional de Desenvolvimento Econômico e Social (BNDES), no Rio, o herdeiro do império multibilionário construído pelo pai investidor e filantropo George Soros também disse que Trump só respeita pessoas mais poderosas ou mais fortes. “É uma fascinação que ele tem”, disse. Questionado se a estratégia do presidente Luiz Inácio Lula da Silva (PT) para enfrentar o tarifaço sobre produtos brasileiros está correta, Soros defendeu que os governos devem lutar contra as medidas americanas e sustentar sua posição. “E alguns países têm se saído melhor nisso”, notou. O empresário também comparou a conduta do presidente americano a um bullying: ""E você não pode permitir que os bullys [valentões, em tradução livre] te dominem."" O filantropo acrescentou que o comportamento de Trump tem um “efeito político perverso”, mas ponderou que a oposição a Trump pode representar um ativo na política interna. “Se você olhar para o mundo, politicamente é muito pior ser amigo do Trump do que ser inimigo dele. Por motivos políticos, é muito melhor ser atacado do que amado por ele”, disse. Soros citou o exemplo do Canadá, onde movimentos patriotistas ganharam força contra o efeito Trump. O presidente americano fala sobre anexar o Canadá aos EUA desde o início de seu mandato, em janeiro, e anunciou taxas de 35% ao país. “E a mesma coisa aconteceu na Austrália. Desde que Trump foi eleito, houve apenas uma eleição em que ele tentou interferir e isso ajudou o candidato, que foi na Polônia."" Em junho, o candidato nacionalista polonês Karol Nawrocki venceu o segundo turno das eleições presidenciais do país com 50,89% dos votos. Nawrocki é um defensor do presidente dos EUA, Donald Trump, e visitou a Casa Branca nas semanas que antecederam a eleição. Acompanhe os mercados com nossas ferramentasAcessar gratuitamente Segundo o presidente da Comissão Parlamentar Mista de Inquérito do INSS, o colegiado funcionará duas vezes na semana e o plano de trabalho será apresentado na próxima quinta (28) A Casa também aprovou novo diretor da Agência Nacional de Transportes Terrestres e nova ouvidora da Agência Nacional de Transportes Aquaviários Blogueiro vive nos EUA desde 2020; em outubro de 2021, o ministro Moraes decretou sua prisão preventiva e extradição, mas pedido não foi atendido e seu nome não foi incluído na lista da Interpol Polícia Federal também fez buscas contra pastor Silas Malafaia Pastor está proibido de deixar o Brasil e de manter contato com outros investigados Mais cedo, um aliado de Trump acusou Cook de fraudar dados para financiamentos imobiliários e Trump endossou afirmando que ela deveria renunciar Estratégia, segundo a companhia, é focar na posição de liderança no mercado de fragrâncias, que representa mais de 60% das receitas atualmente Petroleira afirma que tem diversos estudos e análises de possibilidades de negócios nos segmentos de bioprodutos, que incluem as cadeias de etanol A Autoridade Nacional de Segurança Nuclear (ANSN) é uma autarquia federal responsável por monitorar, regular e fiscalizar a segurança nuclear e a proteção radiológica no Brasil",Valor Econômico
https://valor.globo.com/financas/noticia/2025/08/20/ouro-sobe-com-perspectiva-de-cortes-nos-juros-e-liquidacao-nas-bolsas-de-ny.ghtml,2025-08-20,Ouro sobe com perspectiva de cortes nos juros dos EUA e liquidação nas bolsas de NY,"Em alta 20/08/2025 15h12Atualizadoagora Após quatro sessões consecutivas de queda, os contratos futuros doouroencerraram a sessão desta quarta-feira (20) em alta, em meio à perspectiva dos investidores porcortes nos jurospelo Federal Reserve (Fed, o banco central dos EUA). A liquidação vista nos últimos dois dias nas principaisbolsas de Nova Yorktambém dá suporte ao avanço nos preços do metal precioso. Na Comex, a divisão de metais da New York Mercantile Exchange (Nymex), os contratos futuros de ouro com vencimento para outubro terminaram em alta de 0,89%, a US$ 3.361,60 poronça-troy. O metal tem se mantido amplamente estável por vários meses, devido à calmaria sazonal na demanda por ouro por bancos centrais e instituições, afirmam analistas do Goldman Sachs em nota. O banco manteve suas expectativas de preço de US$ 4 mil por onça-troy para meados de 2026, impulsionada pela demanda estruturalmente forte dos bancos centrais e pelos ingressos de ETFs. A maior demanda pelo ouro seria apoiada, ainda, pela perspectiva deflexibilizaçãodapolítica monetáriado Fed e um risco derecessãode 30% nos EUA em 12 meses, o que poderia aumentar os ingressos de ouro, dizem os analistas. Acompanhe os mercados com nossas ferramentasAcessar gratuitamente Segundo o presidente da Comissão Parlamentar Mista de Inquérito do INSS, o colegiado funcionará duas vezes na semana e o plano de trabalho será apresentado na próxima quinta (28) A Casa também aprovou novo diretor da Agência Nacional de Transportes Terrestres e nova ouvidora da Agência Nacional de Transportes Aquaviários Blogueiro vive nos EUA desde 2020; em outubro de 2021, o ministro Moraes decretou sua prisão preventiva e extradição, mas pedido não foi atendido e seu nome não foi incluído na lista da Interpol Polícia Federal também fez buscas contra pastor Silas Malafaia Pastor está proibido de deixar o Brasil e de manter contato com outros investigados Mais cedo, um aliado de Trump acusou Cook de fraudar dados para financiamentos imobiliários e Trump endossou afirmando que ela deveria renunciar Estratégia, segundo a companhia, é focar na posição de liderança no mercado de fragrâncias, que representa mais de 60% das receitas atualmente Petroleira afirma que tem diversos estudos e análises de possibilidades de negócios nos segmentos de bioprodutos, que incluem as cadeias de etanol A Autoridade Nacional de Segurança Nuclear (ANSN) é uma autarquia federal responsável por monitorar, regular e fiscalizar a segurança nuclear e a proteção radiológica no Brasil",Valor Econômico
