url,data,titulo,texto,fonte
https://exame.com/esg/bioeconomia-uma-nova-perspectiva-para-o-desenvolvimento-do-brasil/,2025-08-30,Bioeconomia: uma nova perspectiva para o desenvolvimento do Brasil,"Patrocínio: Parceiro institucional: No último encontro do G20, o Brasil propôs e aprovou, por unanimidade, os dez princípios da bioeconomia (Leandro Fonseca /Exame) Redação Exame Publicado em30 de agosto de 2025 às14h00. *Thais Ferraz, diretora programática do Instituto Clima e Sociedade (iCS) eMarcelo Behar, enviado especial de Bioeconomia da COP30 Em um mundo em que acrise climáticajá é realidade, ouvimos repetidamente que o Brasil pode ser umprovedor global de soluções.No entanto, nosso modelo de desenvolvimento ainda está ancorado no passado. Mas como transformar esse potencial em ação? A chave está em assumir o protagonismo a partir das nossas maiores riquezas: abrigar aAmazônia– a maiorfloresta tropicaldo mundo –, contar com uma das legislações ambientais mais avançadas e aproveitar a oportunidade de ampliar a produçãoagropecuáriaao mesmo tempo em que capturamos carbono com a restauração de cerca de 40 milhões de hectares deáreas degradadas. E, em novembro, em Belém, aCOP30será a oportunidade de alinhar duas dimensões fundamentais: a climática — guiada pela ciência e pelas metas de redução de emissões — e a da natureza — que estabelece indicadores e objetivos para conservar abiodiversidadee regular o uso dosrecursos naturais. Faz-se urgente promover o uso sustentável da floresta. Para isso, é fundamental que haja umfinanciamentode longo prazo ajustado às realidades da sociobioeconomia e o reconhecimento oficial do papel das comunidades tradicionais nesse processo. É preciso realocarsubsídiosdas fontes não renováveis para as renováveis e criar mecanismos de financiamento do mercado de carbono previstos no Artigo 6.2 doAcordo de Paris, além do avanço na mensuração de serviços ecossistêmicos. No âmbito daconservação,além da manutenção dos mecanismos de controle,é preciso um instrumento robusto, como o Fundo de Florestas Tropicais (TFFF), proposto emUS$ 125 bilhõespelo governo federal. Apesar do enorme desafio, bons ventos já anunciam mudanças. Programas como o AtivaCred aceleram crédito a agricultores dasociobioeconomia. O Plano Nacional de Desenvolvimento da Bioeconomia (PNDBio) articula ministérios para estruturar políticas. A BRB Finance Coalition já mobiliza 2,6 bilhões de dólares de investimentos privados para arestauração. Avançam ainda iniciativas em ampliação de acesso a mercados e estruturação de cadeias produtivas. Para a COP30, o Brasil está desenvolvendo, junto a financiadores desoluções baseadas na natureza, critérios comuns que permitam a criação de um novo mecanismo de investimento. O caminho está posto, mas é preciso coordenação e foco para implementá-lo com a escala necessária.Temosfloresta,ciência, talento e capital para fazer dabioeconomiaum diferencial competitivo do Brasil. Já passou da hora de mostrarmos ao mundo que somos o país do novo presente. 1/30Rio Amazonas - ribeirinhas - ribeirinhos - moradia - casas palafitas - amazonia - barco - canoa Foto: Leandro Fonseca Data: 02/07/2025(Embarcação no Rio Amazonas) 2/30Rio Amazonas - ribeirinhas - ribeirinhos - moradia - casas palafitas - amazonia - barco - canoa Foto: Leandro Fonseca Data: 02/07/2025(Ribeirinhos navegando no Rio Amazonas) 3/30Rio Amazonas - ribeirinhas - ribeirinhos - moradia - casas palafitas - amazonia - barco - canoa - familia - criança Foto: Leandro Fonseca Data: 02/07/2025(Familia Ribeirinha no rio Amazonas) 4/30Rio Amazonas - agro - criação - bufalo - amazonia - Foto: Leandro Fonseca Data: 02/07/2025(Criação de búfalos no rio Amazonas) 5/30Rio Amazonas - ribeirinhas - ribeirinhos - moradia - casas palafitas - amazonia - barco - canoa Foto: Leandro Fonseca Data: 02/07/2025(Casa de palafita no rio Amazonas) 6/30Rio Amazonas - ribeirinhas - ribeirinhos - moradia - casas palafitas - amazonia - barco - canoa Foto: Leandro Fonseca Data: 02/07/2025(Ribeirinhos no rio Amazonas) 7/30Rio Amazonas - ribeirinhas - ribeirinhos - moradia - casas palafitas - amazonia - barco - canoa Foto: Leandro Fonseca Data: 02/07/2025(Casas de palafita na margem do rio Amazonas) 8/30Rio Amazonas - ribeirinhas - ribeirinhos - moradia - casas palafitas - amazonia - barco - canoa - familia - criança Foto: Leandro Fonseca Data: 02/07/2025(Ribeirinho navegando no rio Amazonas) 9/30Rio Amazonas - ribeirinhas - ribeirinhos - moradia - casas palafitas - amazonia - barco - canoa - familia - criança Foto: Leandro Fonseca Data: 02/07/2025(Ribeironho acompanhado barco de turismo no rio Amazonas para pedir prendas) 10/30Rio Amazonas - ribeirinhas - ribeirinhos - moradia - casas palafitas - amazonia - barco - canoa Foto: Leandro Fonseca Data: 02/07/2025(Casa de Ribeiros nas margens do rio Amazonas) 11/30Rio Amazonas - ribeirinhas - ribeirinhos - moradia - casas palafitas - amazonia - barco - canoa - familia - criança Foto: Leandro Fonseca Data: 02/07/2025(Ribeirinho no rio Amazonas) 12/30Rio Amazonas - ribeirinhas - ribeirinhos - moradia - casas palafitas - amazonia - barco - canoa Foto: Leandro Fonseca Data: 02/07/2025(Casas de Ribeirinhos nas margens do rio Amazonas) 13/30Rio Amazonas - ribeirinhas - ribeirinhos - moradia - casas palafitas - amazonia - barco - canoa Foto: Leandro Fonseca Data: 02/07/2025(Casas de Ribeirinhos nas margens do rio Amazonas) 14/30Rio Amazonas - ribeirinhas - ribeirinhos - moradia - casas palafitas - amazonia - barco - transporte Foto: Leandro Fonseca Data: 02/07/2025(Embarcação com turistas navegando no rio Amazonas) 15/30Rio Amazonas - ribeirinhas - ribeirinhos - moradia - casas palafitas - amazonia - Foto: Leandro Fonseca Data: 02/07/2025(Criaçnao de bois na margem do rio Amazonas) 16/30Rio Amazonas - ribeirinhas - ribeirinhos - moradia - casas palafitas - amazonia - Foto: Leandro Fonseca Data: 02/07/2025(Criaçnao de bois na margem do rio Amazonas) 17/30Rio Amazonas - ribeirinhas - ribeirinhos - moradia - casas palafitas - amazonia - Foto: Leandro Fonseca Data: 02/07/2025(Lancha de transporte rápido de passageiros navegando no rio Amazonas) 18/30Rio Amazonas - ribeirinhas - ribeirinhos - moradia - casas palafitas - amazonia - Foto: Leandro Fonseca Data: 02/07/2025(Casa de Ribeirinho na margem do rio Amazonas) 19/30Rio Amazonas - lancha - amazonia - Foto: Leandro Fonseca Data: 02/07/2025(Lancha no rio Amazonas) 20/30Rio Amazonas - amazon gas - combustivel - barco amazonia - Foto: Leandro Fonseca Data: 02/07/2025(Transporte de gás no rio Amazonas) 21/30Rio Amazonas - ribeirinhas - ribeirinhos - moradia - casas palafitas - amazonia - Foto: Leandro Fonseca Data: 02/07/2025(Casas de familias Ribeirinhas no rio Amazonas) 22/30Rio Amazonas - ribeirinhas - ribeirinhos - moradia - casas palafitas - amazonia - Foto: Leandro Fonseca Data: 02/07/2025(Casas de familias Ribeirinhas no rio Amazonas) 23/30Rio Amazonas - ribeirinhas - ribeirinhos - moradia - casas",Exame
https://exame.com/economia/por-que-voos-curtos-de-ponte-aerea-exigem-mais-dos-motores-dos-avioes/,2025-08-30,Por que voos curtos de ponte aérea exigem mais dos motores dos aviões?,"Motores de avião Leap, da GE Aerospace, em oficina de manutenção (Divulgação) Repórter de macroeconomia Publicado em30 de agosto de 2025 às12h27. Última atualização em30 de agosto de 2025 às12h35. Petrópolis, RJ- Os voos de ponte aérea, que ligam cidades próximas, comoSão PauloeRio de Janeiro,encurtam distâncias, mas exigem mais dos motores. Assim, os aviões usados nesses trechos acabam tendo de ir mais vezes para a oficina. A razão para isso é que a decolagem do avião é o momento em que os motores são mais exigidos. ""Eles precisam usar força máxima para a decolagem"", diz Luiz Froes, vice-presidente de Relações com governos naGE Aerospacepara a América Latina A empresa, uma das principais fabricantes de motores do mundo, faz manutenção dessas peças em oficinas no estado do Rio de Janeiro. As unidades brasileiras receberam cerca de 600 motores em 2024. Os motores precisam passar por revisões periódicas, assim como os carros. No entanto, a métrica usada é o número de decolagens. ""Um determinado motor pode operar até 20 mil ciclos sem manutenção. Um ciclo é uma decolagem e um pouso. Se o voo é curtinho, você pode fazer 10 ciclos por dia. Aí ele tem que vir [para a oficina] em um espaço mais curto de tempo"", diz Froes. Uma estratégia para reduzir o desgaste é alternar os aviões usados na ponte aérea. Assim, uma aeronave pode fazer o trecho São Paulo-Rio em um dia e no outro ir de São Paulo a Recife, por exemplo, para fazer viagens curtas e mais longas, de modo a reduzir o desgaste das peças. Em média, os motores passam por revisão de rotina a cada cinco ou seis anos. O tempo pode ser reduzido se houver algum dano inesperado, como um choque com um pássaro ou sinais de danos em alguma parte. Os equipamentos são avaliados diariamente pelas companhias aéreas, que fazem reparos mais simples em suas oficinas. Em caso de problemas mais graves ou revisões periódicas, os motores são retirados dos aviões e enviados para o fabricante. Nessas ocasiões, eles são completamente desmontados e remontados, para que todas as milhares de peças internas sejam avaliadas. Froes explica que o motor usado em aviões grandes funciona como um aspirador. ""Você aspira uma quantidade de ar suficiente, comprime aquele ar, joga o combustível e ele gera a queima. Essa combustão gera a energia suficiente para empurrar o avião e poder decolar e voar"", diz. Nas outras etapas do voo depois da decolagem, o motor trabalha menos. Depois que o avião atinge 10 mil pés de altitude, a resistência do ar é menor e as rotações são mais baixas. No pouso, os motores podem usar uma função reversa para ajudar na frenagem, mas o esforço também é menor. * O repórter viajou a convite da GE Aerospace. Equipe econômica também deve contar com outros projetos em tramitação e receitas extraordinárias para ficar no azul em 2026 O montante dessas verbas segue regras estabelecidas pela Constituição e pelo Congresso, como um percentual da receita líquida do governo e a inflação Porém, maior parte de pagamentos de precatórios segue fora da contabilidade oficial As estimativas afastam, pelo menos por ora, o temor do mercado financeiro de um aumento do benefício em ano eleitoral 01 02 exame no whatsapp Receba as notícias da Exame no seu WhatsApp Nos acontecimentos mais relevantes do Brasil e mundo. E-mail inválido Desperta",Exame
https://exame.com/esporte/um-dia-11-estados-e-1600-pessoas-acao-esportiva-revela-estrategia-social-da-decathlon-no-brasil/,2025-08-30,"Um dia, 11 estados e 1.600 pessoas: ação esportiva revela estratégia social da Decathlon no Brasil","Emilie Langrené: diretora da Fundação Decathlon Repórter Publicado em30 de agosto de 2025 às11h50. Última atualização em30 de agosto de 2025 às11h50. Em 2016, a francesa Emilie Langrené desembarcou no Brasil com uma mochila leve, mas uma bagagem carregada de experiências de vida, trilhas em diferentes países e uma convicção: o esporte pode transformar realidades. Hoje, nove anos depois, ela lidera a Fundação Decathlon no país, braço social da multinacional. A entidade nasceu em 2005, na França, com a missão de ampliar o acesso ao esporte para além da barreira econômica. Não se trata apenas de oferecer produtos acessíveis, mas também de enfrentar obstáculos sociais e culturais: de mulheres impedidas de praticar atividades físicas em alguns países a pessoas com deficiência sem espaços adequados para se exercitar. “A fundação existe para que ninguém fique invisível”, diz Emilie, citando o que considera a essência do trabalho: apoiar ONGs e comunidades em projetos de longo prazo, capazes de criar impacto sustentável. Essa perspectiva de permanência é central. Em vez de patrocinar eventos pontuais, a Fundação Decathlon investe em infraestruturas e iniciativas que durem.Um dos exemplos é a reforma de um ginásio no Caju, no Rio de Janeiro, que, desde o final dos anos 2000, já recebeu milhares de crianças e adolescentes em atividades esportivas. “Quando apoiamos a construção ou reforma de um espaço, sabemos que ele será usado por muitos anos, multiplicando o alcance e fortalecendo vínculos com a comunidade”, afirma. O engajamento, no entanto, não se restringe a cheques ou obras. Um traço particular da fundação é o envolvimento direto dos colaboradores da Decathlon. Cada projeto apoiado nasce da iniciativa de funcionários que se aproximam de ONGs, compartilham valores e levam as propostas para aprovação do comitê da fundação. Isso gera histórias de longo prazo, como a de jovens que começaram em projetos apoiados e depois ingressaram como aprendizes ou funcionários da rede de lojas. A mobilização se torna evidente em iniciativas como o Decathlon Foundation Day, evento que neste ano ocorreu em 11 estados e reuniu mais de 35 organizações sociais. A programação incluiu futebol, basquete, vôlei, badminton, tênis de mesa e outras modalidades, adaptadas para diferentes públicos — de crianças a idosos, passando por pessoas com deficiência, síndromes e TEA.Em 2025, o evento realizado em 28 de agosto, impactou mais de 1.600 beneficiários em 40 unidades da marca, com a participação de centenas de voluntários. Para Emilie, é uma síntese da filosofia da fundação: unir vitalidade, responsabilidade, autenticidade e generosidade. “É um dia para viver as maravilhas do esporte e compartilhar nossos valores. Celebramos o esporte, mas também um trabalho contínuo, diário, que conecta ONGs já apoiadas e novas organizações indicadas pelos próprios colaboradores”, afirma. A relação pessoal de Emilie com o esporte ajuda a explicar seu entusiasmo. Montanhista, já percorreu trilhas da Capadócia até na Chapada Diamantina. No dia a dia, gosta de praticar diferentes atividades, sempre incentivada pela cultura esportiva da própria empresa. “Quando nos reunimos em equipe, o esporte faz parte. Recentemente, organizamos um team building de escalada — era a primeira vez de muitos. Foi transformador”, conta. Essa vivência também alimenta seu olhar para o Brasil. Ao longo dos últimos anos, Emilie diz ter visto a relação dos brasileiros com o esporte se expandir — das corridas em parques urbanos à busca por bem-estar e saúde mental. A pandemia, avalia, acelerou essa transformação. “Muitas pessoas descobriram o esporte como ferramenta de equilíbrio e isso se refletiu em várias modalidades, do pilates às caminhadas”, diz. No balanço global, a Fundação Decathlon já impactou mais de 1 milhão de pessoas em 20 anos, por meio de centenas de projetos apoiados em diferentes países. No Brasil, a missão segue sendo descentralizar iniciativas para além do eixo Rio–São Paulo, alcançando estados como Bahia, Ceará e Minas Gerais. A fundação, diz ela, é um espaço de generosidade genuína — e também de visão de futuro. “Sempre pensamos na longevidade dos projetos. Não é apenas esporte por esporte. É esporte como ferramenta de inclusão, de empregabilidade, de bem-estar e de pertencimento”. São Paulo recebe o segundo jogo oficial da NFL no Brasil, com ingressos recordes e potencial impacto econômico A terceira edição do São Paulo Corporate Games acontece entre os dias 4 e 7 de setembro Com inscrições esgotadas dois meses antes da largada, evento se consolida como motor de turismo e negócios em Santa Catarina Partida das Eliminatórias será no dia 4 de setembro, às 21h30, com 70 mil lugares disponíveis 01 02 03 exame no whatsapp Receba as notícias da Exame no seu WhatsApp Um resumo descomplicado sobre a evolução do setor de IA E-mail inválido Inteligência Artificial",Exame
https://exame.com/future-of-money/ethereum-a-nova-queridinha-dos-institucionais-ou-ativo-com-alta-passageira/,2025-08-30,Ethereum: a nova queridinha dos institucionais ou ativo com alta passageira?,"Patrocínio: Ethereum: especialista aponta quais fatores influenciam no preço da criptomoeda (Reprodução/Reprodução) Analista de research da Mynt, plataforma cripto do BTG Pactual Publicado em30 de agosto de 2025 às11h45. Os sinais de apetite institucional ficaram explícitos em agosto: osETFsà vista deetherregistraram picos históricos (mais de US$ 1 bilhão em um único dia, em 12 de agosto), além de novos aportes na casa de centenas de milhões de dólares por vários dias seguidos. No acumulado recente, os fluxos líquidos já somamUS$ 13 bilhões, uma guinada que mudou a conversa nas mesas de alocação. Para o investidor, isso importa porque criademanda programática e previsívelpor ether; o tipo de comprador que não “desmonta” posição com ruídos de curto prazo. Outro vetor é o movimento detesourarias corporativas. Em 4 de agosto, a agência Reuters apurou pelo menos 966 mil unidades de ether em balanços de empresas, cerca de US$ 3,5 bilhões no fim de julho, número ordens de magnitude acima do observado no fim de 2024. A combinação destakingnativo da rede e o papel do ether como “combustível” doblockchainEthereum tem atraído companhias menores que buscam retorno e tese de crescimento, ainda que com riscos de execução e volatilidade. E para onde isso pode ir? A resposta passa pelosfluxos dos ETFs, pelatrajetória do dólar digital(já chegaremos lá) e porsinais regulatóriosque podem adicionar um “rendimento” formal à tese de ether no varejo regulado. Em 29/07, a SEC autorizou criações e resgates “in-kind” para ETFs de criptomoedas, resultando em alívio de atrito operacional que tende a baratear e escalar a esteira de captação. Com a máquina mais eficiente, os picos de volume institucional em torno do ether tendem a setransmitir melhor ao mercado à vista. Nem tudo é linha reta: dados recentes da CoinShares relatamsaídas de capital dos ETFs de etherrecentemente, ainda queagostosiga comfortes entradasno agregado. Mas o recado segue o mesmo.Volatilidade tática, mas umatendência estruturalde adoção nos portfólios que, por enquanto, favorece ether. O tema “empresa comprando ether” já deixou de ser só narrativa:ETHZilladivulgou102.237 unidades de etherem reservas e aprovou um programa de recompra; outras listadas, como Cosmos Health, iniciaram uma estratégia formal de tesouraria em ether. É um público aindaconcentrado em small caps, mas que ajuda asecar ofloate reforça a percepção de que o ativo deixou de ser apenas “tecnologia promissora” para virarlinha de balanço. O mercado destablecoinsbateu recorde próximo deUS$ 280 bilhões a US$ 283 bilhõesem agosto, e aEthereum mantém a maior fatia on-chain(cerca de US$ 148 bilhões em float). Isso significa transações, liquidez e demanda por bloco que sustentam a utilidade do ether (gás) e sua economia de queima de taxas quando a atividade acelera. Se stablecoins seguirem crescendo, ademanda orgânicapor Ethereum tende a seguir junto. Hoje, staking dentro dos ETFs de ETH ainda não foi aprovado. Há pedidos formais (BlackRock, Grayscale) e a SEC adiou decisões enquanto avalia o tema; o consenso de mercado trabalha com análise até o fim de outubro, mas nada está decidido. Se aprovado, cria-se um “kicker de yield” que pode aumentar o apetite por ETFs de ether; se vetado, mantém-se a tese atual, ainda forte, ancorada em fluxo, utilidade e tesourarias. Em síntese:o caso de ether como infraestrutura com compradores recorrentes (ETFs, tesourarias e o dólar digital) hoje pesa mais do que o ruído de curto prazo. Regra de bolso:siga o fluxo (ETFs), a atividade (stablecoins) e a pauta regulatória; é assim que o investidor separa tendência de evento. Siga o Future of Money nas redes sociais:Instagram|X|YouTube|Telegram|TikTok Relatório da Pantera Capital indica que o setor caminha para superar recorde de 2021 nos investimentos de capital de risco Com 6,6 milhões de usuários, transações com cripto no Nubank saltaram 250% no primeiro semestre de 2025 Modelo da Tiger Research aponta que criptomoeda tem potencial para bater novo recorde nas próximas semanas Departamento do Comércio também anunciou parceria com a Chainlink e a Pyth Network, que disparou após a novidade 01 02 03 exame no whatsapp Receba as notícias da Exame no seu WhatsApp Newsletter Future Of Money Quer saber as novidades que mexem com o mercado cripto? Assine as newsletters gratuitas do Future of Money! Selecione as newsletters que você deseja se inscrever* Crypto Deep (Semanal) Crypto Daily (Diária) Ao informar meus dados, eu concordo com aPolítica de Privacidade.",Exame
https://exame.com/casual/luis-fernando-verissimo-vendeu-56-milhoes-de-livros-conheca-a-obra-do-autor/,2025-08-30,"Luis Fernando Verissimo vendeu 5,6 milhões de livros: conheça a obra do autor","Filho de Erico Verissimo, autor de O Tempo e o Vento, herdou do pai o gosto pela escrita despretensiosa (Editora Objetiva/Divulgação) Colaboradora na Exame Publicado em30 de agosto de 2025 às11h33. Mestre do humor inteligente, da crônica cotidiana e das tiras que disfarçavam filosofia e crítica política em piadas rápidas, oescritor Luis Fernando Verissimoconsolidou uma obra que atravessou gerações e vendeu mais de5,6 milhões de exemplares.O gaúcho morreu aos 88 anos, na madrugada deste sábado, 30, em Porto Alegre. Cronista, escritor, cartunista, Verissimo era conhecido por sua discrição e pelas respostas concisas em entrevistas.“Não sou eu que falo pouco, os outros é que falam muito”, brincou certa vez. Se era interpretado como tímido ao falar, era na escrita que encontrava sua forma de se expressar. ""Essa é uma das vantagens da crônica. A gente pode ser o que quiser escrevendo uma crônica"", explicou o autor. Luis Fernando foi o criador de personagens icônicos, como oanalista de Bagé,Ed Mort, avelhinha de Taubatée asCobras. Filho deErico Verissimo, autor deO Tempo e o Vento, herdou do pai o gosto pela escrita despretensiosa. Nascido em Porto Alegre em 1936, passou parte da infância nos Estados Unidos, onde Erico lecionava literatura brasileira. Foi lá que o jovem Luis Fernando descobriu ojazze osaxofone, paixões que o acompanhariam pela vida. ""O pai foi um dos primeiros escritores brasileiros a escrever de uma maneira mais informal. E eu acho que herdei um pouco isso"", disse o cronista sobre o pai. De volta ao Brasil, começou como revisor no jornalZero Hora, emPorto Alegre, em 1966. NoRio de Janeiro, atuou como tradutor. Em 1973, publicou seu primeiro livro,O Popular. Depois, entre 1975 e 1999, Verissimo marcou presença diária nas páginas do jornal gaúcho. Foi nesse período, ainda sob a censura da ditadura, que nasceu As Cobras, os personagens mais célebres de suas tirinhas. Duas serpentes discutiam desde a infinitude do universo até as pequenas ironias da vida política brasileira, mostrando que, muitas vezes, os quadrinhos diziam o que os textos não podiam. ""As Cobras são o produto da combinação do meu gosto por quadrinhos com minhas limitações como desenhista. Cobra é muito fácil de fazer, só tem pescoço"", brincou o autor na antologia definitiva publicada pela editora Companhia das Letras em 2010. Ao longo de mais de 20 anos de carreira, Verissimo somou mais de 70 títulos, entre romances, contos, crônicas e coletâneas. Alguns de seus principais sucessos são ""Comédias para se ler na escola"" e ""As mentiras que os homens contam"". Sua obra também chegou à televisão:Comédias da Vida Privada(1994) virou série daGlobo, e Verissimo integrou a equipe de roteiristas da icônicaTV Piratano fim dos anos 1980. Também foi colunista no OEstado de S.PauloeO Globo. ""Um desafio porque o humor de televisão, ao contrário do que possa parecer, é mais difícil de fazer que o humor impresso, o humor gráfico, vamos dizer assim (...) Não tenho uma vocação humorística, mas consigo eventualmente produzir humor. Mas é uma coisa mais deliberada, mais pensada, do que espontânea, no meu caso"", disse em entrevista na época. Além da literatura, Luis Fernando Verissimo tinha paixões que alimentavam sua obra. A música, em especial o jazz, era uma delas. Saxofonista amador e colecionador de discos, gostava de ouvir música sem distrações. “Música é sentar e ouvir”, dizia. Outra de suas grandes paixões era o futebol, mais especificamente oInternacional, seu time do coração. Ele acompanhou de perto a história do clube, o que rendeu o livro Internacional, Autobiografia de uma Paixão. Verissimo vibrou com o tricampeonato invicto de 1979 e se emocionou com o Mundial de Clubes de 2006, escrevendo a célebre crônica “Não me acordem”. “Vejo como o triunfo do Gabiru (autor do gol), o grande herói que era criticado. Algo meio melodramático. Foi um momento de sonho. Antes do jogo, o sentimento era: ‘Se perder de pouco, está bom’”, recordava. O escritor e cronista estava internado há quase 20 dias, com um quadro grave de pneumonia Modelo deve ser lançado também nos EUA, com valores inferiores aos praticados no mercado europeu Novos sabores, combinações e experiências que movimentam o mercado de café Tan Tan é eleito pela terceira vez o melhor bar do país. Confira os outros 46 bares paulistanos no ranking 01 02 03 exame no whatsapp Receba as notícias da Exame no seu WhatsApp Receba a melhor curadoria para seus momentos casuais. E-mail inválido Casual",Exame
