url,data,titulo,texto,fonte
https://exame.com/tecnologia/ainda-da-tempo-esta-aula-gratuita-pode-transformar-sua-carreira-antes-do-fim-do-ano/,2025-08-30,Ainda dá tempo: esta aula gratuita pode transformar sua carreira antes do fim do ano,"Redação Exame Publicado em30 de agosto de 2025 às18h16. Última atualização em30 de agosto de 2025 às19h41. Setembro chegou e você aindanão deu aquele salto que tanto queria na carreira?Calma, ainda dá tempo. Com quatro meses pela frente até o ano acabar, é possível transformar sua rotina, ser mais produtivo e fechar o ano em alta. E a chave para essa transformação pode estar nainteligência artificial. As oportunidades de trabalho em IA mais quetriplicaram no Brasil nos últimos dois anos, segundo o LinkedIn. Mais impressionante: empregadores estão dispostos apagar até 47% maispara profissionais com conhecimento em IA. _*]:min-w-0""> Para quem quer aproveitar essa chance, a EXAME Saint Paul apresenta neste domingo, 31, às 17h, uma aula gratuita e ao vivo que vai direto ao ponto. Com linguagem acessível para todos os níveis, a aula mostra na prática diversas ferramentas de IA que você pode usar imediatamentepara ser mais produtivo no trabalho e dar aquele impulso na carreira que tanto busca. EU QUERO GARANTIR MINHA VAGA NA AULA GRATUITA Ferramentas práticas, resultados imediatos A aula vai trazer aplicações concretas da IA no dia a dia profissional, desdeautomação de tarefas repetitivas até análise de dados para tomada de decisões. O foco está em demonstrar como pequenas mudanças na rotina podem gerar ganhos significativos de tempo e eficiência. A aula acontece neste domingo, 31, às 17h, ao vivo no YouTube da EXAME. Para não perder, ative o sininho do canal ouclique aqui. Jacobson antecipou recursos do FM26, que terá a inclusão do futebol feminino e melhorias técnicas Uso crescente de tecnologia e internet no Burning Man levanta debates sobre o equilíbrio entre a tradição de desconexão do festival e a conveniência da conectividade digital Saiba quais modelos podem deixar de ser vendidos e não receberão mais atualizações com a chegada do novo iPhone 17 Avanço tecnológico promete revolucionar a comunicação sem fio, com impacto significativo na próxima geração de redes 6G e na integração de inteligência artificial em sistemas de comunicação 01 02 03 exame no whatsapp Receba as notícias da Exame no seu WhatsApp Um resumo descomplicado sobre a evolução do setor de IA E-mail inválido Inteligência Artificial",Exame
https://exame.com/brasil/morte-de-luis-fernando-verissimo-presidente-lula-declara-luto-oficial/,2025-08-30,Morte de Luis Fernando Verissimo: presidente Lula declara luto oficial,"Escritor estava recluso desde 2021, quando recebeu diagnóstico da doença de Parkinson (Editora Objetiva/Divulgação) Redação Exame Publicado em30 de agosto de 2025 às17h30. O escritor e cronistaLuis Fernando Verissimomorreu neste sábado, 30, em Porto Alegre (RS). A informação foi veiculada, inicialmente, pelo jornalZero Hora, onde Verissimo atuou como colunista. O Hospital Moinhos de Vento, onde ele estava internadodesde o último dia 11confirmou o falecimento às 00h40, devido a complicações decorrentes de uma pneumonia. Diagnosticado com doença de Parkinson em 2021, Veríssimo tinha histórico cardíaco e sofreu um acidente vascular cerebral no mesmo ano. O autor também passou por uma cirurgia em 2020 para retirada de um câncer ósseo na mandíbula. A cirurgia foi bem-sucedida e não exigiu quimioterapia ou radioterapia. Desde o AVC, porém, ele enfrentava complicações de saúde. O presidente Luiz Inácio Lula da Silva declarou luto oficial de três dias em todo país em sinal de pesar pelo falecimento do escritor.O decreto foi publicado hoje em edição extra do Diário Oficial da União. Nascido em 26 de setembro de 1936, em Porto Alegre, filho de Mafalda e Erico Verissimo, também escritor, Luis Fernando Verissimo tem mais de 70 livros publicados e 5,6 milhões de cópias vendidas. Vivia em Porto Alegre, no bairro Petrópolis, com a esposa Lúcia e o filho caçula, Pedro. Reconhecido como um dos principais cronistas e escritores do país, foi autor de contos, romances e crônicas publicadas em jornais e revistas ao longo de décadas de carreira. Também escreveu colunas para jornais comoO Estado de S.PauloeO Globo. Ele iniciou a carreira em 1966 como revisor doZero Hora, em Porto Alegre, onde também atuou em outras funções jornalísticas, antes de lançar seu primeiro livro,O Popular, em 1973. Levantamento mostra o petista em desvantagem no 2º turno, mas com estabilidade e crescimento nas intenções de voto no 1º turno Os dados mostram ainda que a reprovação supera a aprovação em todos os segmentos demográficos analisados O ministro também mandou a Polícia Penal monitorar a área externa da propriedade; medidas são para evitar fuga de ex-presidente A Lei de Reciprocidade Econômica, sancionada em julho, autoriza o Brasil a adotar medidas tarifárias e não tarifárias contra países que imponham barreiras às exportações nacionais 01 02 03 exame no whatsapp Receba as notícias da Exame no seu WhatsApp Nos acontecimentos mais relevantes do Brasil e mundo. E-mail inválido Desperta",Exame
https://exame.com/agro/brasil-abre-mercado-de-farinhas-de-bovinos-e-suinos-do-mexico-potencial-e-de-us-1-bilhao/,2025-08-30,Brasil abre mercado de farinhas de bovinos e suínos do México; potencial é de US$ 1 bilhão,"O vice-presidente do Brasil, Geraldo Alckmin, em reunião com a presidente mexicana, Claudia Sheinbaun, na Cidade do México (Jessica Ramírez/Presidencia do México) Editor de Macroeconomia Publicado em30 de agosto de 2025 às15h24. Última atualização em30 de agosto de 2025 às15h37. CIDADE DO MÉXICO* - O Brasil abriu umnovo mercado agropecuário para exportações ao México. Após umaumento significativo das exportações da carne bovina nacional ao país, que se tornou osegundo maior comprador da proteína brasileira, as autoridades mexicanas se comprometeram a abrir o mercado defarinha de bovinos e suínos.Nas contas do governo brasileiro, trata-se de um mercado deUS$ 1 bilhãono México. ""O mercado mexicano de produtos de reciclagem animal é de US$ 1 bilhão. Com essa abertura, o Brasil agora começa a disputar esse mercado de US$ 1 bilhão"", afirmouJorge Viana, presidente da ApexBrasil, em conversa com jornalistas. ""No México, todos os números são grandes."" Os acordos acontecem após visita do vice-presidente e ministro do Desenvolvimento, Indústria e Comércio (MDIC),Geraldo Alckmin, na qual eleanunciou que os acordos comerciais entre os países serão renovados, com umcronograma para nova assinaturaem agosto de 2026. Essa parte da cadeia dos frigoríficos é conhecida comoreciclagem animal. Em suma, utilizam-se ossos e outras partes de aves, bovinos e suínos para gerar uma farinha que possa alimentar outros animais (a oferta de farinha precisa ser ""cruzada""; ou seja, a farinha bovina pode alimentar um rebanho suíno, e assim sucessivamente). Presidente da ApexBrasil, Jorge Viana, assina memorando de entendimento no México: mercado de reciclagem animal mexicano movimenta US$ 1 bilhão anualmente (VPR/Divulgação) Esse produto é amplamente utilizado naformulação de rações,pet foodeprodutos derivados de origem animal. Para o setor da carne nacional, trata-se de uma vitória. Em julho, aChinahabilitou 51 frigoríficosnacionais para exportarfarinhas deaves e suínos. O país asiático importava quase integralmente dos Estados Unidos o produto. Em 2024, segundo a ApexBrasil, o Brasil produziu cerca de3,7 milhões de toneladas de farinhas de origem animal, de todas as espécies, masexportou apenas 9% desse total— um movimento deUS$ 211 milhões. Na China e no México, os Estados Unidos lideram as exportações do produto. Na China, por exemplo, osfabricantes americanos exportaram 407 mil toneladas de farinhas animaisem 2024. No caso mexicano, trata-se de um grande mercado depet food.""O México é um ótimo mercado, uma vez que o setor de pets é grande aqui"", disse Carlos Fávaro, ministro da Agricultura, em conversa com jornalistas. ""No mês passado, abrimos [o mercado de] farinhas para China, foram as primeiras habilitações. Era um produto com um mercado muito restrito. Na medida que a gente começa a abrir esses mercados, a nossa indústria de transformação se beneficia. Quando você acha um mercado remunerador para vender, ela deixa de ser um subproduto para ser um co-produto"", afirmou o ministro. Segundo ele, o produto principal é a carne. ""Mas o osso passa a ser um produto a ser exportado, e tem valor agregado"", disse. De acordo com o ministro, o Brasilhabilitará ainda mais 14 plantas de carne bovina, suína e de avespara exportar ao México. ""A abertura de mercado é um processo: habilitam-se as plantas, tem que passar nos critérios técnicos do país comprador, e aí começam novos negócios"", disse Fávaro. Ele comemorou a marca de 415 novos mercados abertos (isto é, produtos com facilitação para exportação e importação) para comércio global, conquistada nesta semana. Mas destacou o valor do México nesse esforço. ""Dos 415 mercados, parece que a gente é muito dedicado à Ásia e ao Oriente Médio. Na realidade, o recordista é o México, com 22 habilitações nesse período e também com o maior volume de negócio, que chegou a US$ 870 milhões nesses dois anos e meio"", disse Fávaro em conversa com jornalistas no México. ""É 50% do valor que as novas habilitações e aberturas comerciais geraram."" Um estudo do Mapa mostrou que as aberturas de mercados desde 2023 resultaram emUS$ 1,73 bilhão adicionais em exportações agropecuárias. O México responde por 50,4% dessas exportações adicionais, segundo o Mapa, seguido deEgito,com US$ 175 milhões adicionais,Vietnã(US$ 157 milhões),Turquia(US$ 89 milhões), eArgélia(US$ 81 milhões). Nos encontros, o Brasil autorizou aimportação de derivados de atum,pêssegoseaspargosmexicanos. Além disso, o governo mexicano se comprometeu com aregionalização,em caso de gripe aviária, para a comercialização de produtos de aves. ""Mediante a ocorrência da patogenicidade, o protocolo será avaliado em até 10 dias pelo México para restringir às exportações a área de influência da doença"", disse o Mapa, em nota. A medida é importante, apontou Fávaro, porque diminui consideravelmente o impacto na produção -- que, em geral, não é afetada quando há um caso isolado, como aconteceu no Brasil neste ano. ""É um grande avanço para a relação comercial e praticamente impacto zero [para o setor de aves]"", afirmou. Também estão previstas para os próximos meses auditorias mexicanas para habilitação de novas plantas frigoríficas brasileiras de bovinos, aves e suínos para a comercialização para o México. Liderada por Alckmin, a missão contou com reuniões governamentais e fóruns empresariais com a participação de mais de 350 empresários brasileiros e mexicanos. Segundo Fávaro, para o agro, o balanço foi a sinalização de renovação doPaquete Contra la Inflación y la Carestía(PACIC),programa quezera as tarifas de importação para produtos da cesta básica no Méxicopara diminuir a inflação local, a abertura desses novos mercados, a habilitação de novos frigoríficos e um entendimento para a regionalização quando forem identificados casos de gripe aviária. ""Discutimos uma exigência mexicana, que é a rastreabilidade bovina"", afirmou o ministro. O ministro da Agricultura, Carlos Fávaro (à esquerda), o vice-presidente, Geraldo Alckmin, em encontro com Julio Berdegué, secretário de Agricultura e desenvolvimento rural do México (Nurivan Mendoza Memije/Divulgação) O ministro destacou que apresentou o programa de rastreabilidade bovina brasileiro, oPlano Nacional de Identificação Individual de Bovinos e Búfalos. ""Não vai ser da noite para o dia, são 230 milhões de cabeças de gado que serão identificadas"", disse. Produtores, indústria e governo, contou Fávaro, definiram o prazo de início da obrigatoriedade do rastreamento para janeiro de 2027. Para ele, a partir desse momento o processo será ""muito rápido"". ""Passa a ser uma exigência crescente do mercado e,",Exame
https://exame.com/carreira/lideranca-contemporanea-o-desafio-da-lideranca-de-transformar-o-poder-em-influencia-e-resultado/,2025-08-30,Liderança contemporânea: o desafio de transformar o poder em influência e resultado,"Membros do Clube CHRO em São Paulo reunidos para aprender sobre ""Liderança Contemporânea"" com José Cláudio Securato, CEO da Saint Paul Escola de Negócios (Eduardo Frazão/Exame/Divulgação) Repórter Publicado em30 de agosto de 2025 às15h14. Última atualização em30 de agosto de 2025 às15h15. O mundo corporativo deixou de andar sobre trilhos previsíveis — agora, as decisões acontecem em um terreno horizontal, múltiplo, acelerado por tecnologia e menos tolerante a hierarquias que falam mais alto do que os dados. Essa é uma das provocações deJosé Cláudio Securato, fundador e CEO daSaint Paul Escola de Negócios, sobre “Liderança Contemporânea”durante oClube CHRO SP, evento da EXAME realizado com executivos C-levels na sede da redação, em São Paulo, em um jantar especial para membros. O evento conta com patrocínio exclusivo da Alelo. Leia também: Gestão humanizada: como ser um líder leve e ao mesmo tempo gerar resultado para a empresa? Para Securato, compreender o “novo mundo” é o ponto de partida. “A principal característica desta era é a mudança de um mundo vertical para um mundo horizontal.” Nesse deslocamento, ela explica a referência datranscendência(natureza, divino, razão até chegar ao novo mundo) e comenta sobre o indivíduo como centro – inclusive no mercado de trabalho. A consequência direta recai sobre quem ocupa o topo: “A mudança de mundo tem desafiado muito a alta liderança. E a alta liderança está muito solitária nessa discussão.” Ele sugere encarar quatro frentes: relações de poder, ambidestria/multidestria, agendas vertical e horizontal, e cultura. “Liderar é ter poder”, observa. “Você é promovido, você ganha um pacote de poder extra. Então, como é que você lida com o poder?” No dia a dia, times precisam alternar entre rigidez e padrão x criatividade e flexibilidade. “Quando você ouve falar de ambidestria, o que a gente está falando é da união dos dois mundos”, diz o executivo, que traz um exemplo para os C-Levels de RH presentes no evento. “Você gostaria que a pessoa que faz manutenção da turbina da aeronave fosse criativa, flexível? Não. Mas para vender passagem aérea essas características parecem ideais.” Daí a noção demultidestria— trocar de chave com rapidez entre lógicas distintas. Securato desmonta o imaginário de ficção científica. “IA não é um robô dotado de sentimentos negativos. O que é inteligência artificial? É uma tecnologia que usa dados, estatística, probabilidade. É uma plataforma que faz uma predição.” Isso explica por que certas rotinas estão mudando: “Tarefas repetitivas e tarefas de baixa interação social têm cara de algoritmo.Onde está a oportunidade? Em tarefas de alta interação social e tarefas criativas.” Como resumo, Securato deixa três lições de sua palestra para C-Levels de RH que participram do clube CHRO em São Paulo, na EXAME: A provocação do presidente da Saint Paul Escola de Negócios é sobre uma nova prática que está mudando o mercado de trabalho. Para ele, o novo mundo é o mundo do indivíduo. As pessoas são singulares e não existe mais um único padrão de sucesso, de família ou de carreira. “Se antes a liderança se sustentava em hierarquia e comando, hoje ela precisa reconhecer e valorizar trajetórias diversas, construindo influência e colaboração. Liderar nesse novo mundo é entender que cada pessoa traz sua singularidade, e é nessa pluralidade que está a força das organizações”, afirma o executivo. Abaixo, as empresas que participaram do clube CHRO neste mês: 1/8(José Cláudio Securato, fundador da Saint Paul, e Camila Securato, CSO da Exame Educação | Saint Paul) 2/8(Mafoane Odara, Executiva de Pessoas, Cultura e Transformação; Vanessa Togniolli People Executive Director at Numen IT; Gabrielle Botelho, Diretora de Recursos Humanos da Viridien; Charline Carolino, Diretora de RH da Esporte Clube Bahia; e Ana Paula Franzoti, Executiva RH.) 3/8(Rafael Alvarenga Godói, VP LATAM da Oitchau; Leandro Araújo, Head of People & Operations, LATAM da CI&T; Leticia Nicolau, Gerente de Clubes e Comunidades da Exame | Saint Paul; e Luana Aquino, Clubes e Comunidades da Exame | Saint Paul) 4/8(Beatriz Nóbrega, Desenvolvedora de Pessoas e Negócios) 5/8(Sarita Vollnhofer ,CHRO da Alice; e Ana Clara Silva, Head de Pessoas e Cultura da Dengo) 6/8(Jeison Lion Vice President, Americas Human Resources & LA Labor Relations at Bridgestone) 7/8(Gustavo Siqueira, vice-presidente de Recursos Humanos América Latina da Saint Gobain) 8/8(Valeria Plata, CHRO da Direcional Engenharia) Descubra como a técnica ‘Dar-Resistir-Exalar’ pode melhorar sua imagem e respeito no trabalho; especialista explica que há outra forma (mais eficaz) de ser respeitado no trabalho Simon Sinek, autor best-seller, destaca que liderar é assumir a responsabilidade de fazer mais pelas pessoas; veja como aprimorar sua liderança e gestão Treinamento online e certificado prepara profissionais para liderar estratégias de branding, performance e engajamento em um mercado global em expansão Essas perguntas ajudam líderes e liderados a se conhecerem e se entenderem melhor 01 02 03 exame no whatsapp Receba as notícias da Exame no seu WhatsApp Nas principais tendências de carreira e do mercado. E-mail inválido Carreira 3.0",Exame
https://exame.com/invest/mercados/hackers-desviam-r-420-milhoes-em-ataque-a-sistema-pix-da-sinqia-hsbc-e-um-dos-afetados/,2025-08-30,Hackers desviam R$ 420 milhões em ataque a sistema Pix da Sinqia; HSBC é um dos afetados,"(shapecharge/Getty Images) Repórter de negócios e finanças Publicado em30 de agosto de 2025 às15h08. Última atualização em30 de agosto de 2025 às19h32. A reportagem foi atualizada com os posicionamentos do HSBC e Artta Um novo ataquehacker, desta vez aos sistemas da Sinqia, empresa debanking as a service,resultou no desvio de R$ 420 milhões. A informação, divulgada incialmente pelo siteNeofeed, foi confirmada por fontes ouvidas pelaEXAME. Na tarde de ontem, 29, por volta das 15h30 (horário de Brasília), o problema foi identificado pelo Banco Central, que logo cortou o acesso da empresa ao sistema financeiro nacional. Oshackersretiraram R$ 380 milhões do HSBC e outros R$ 40 milhões de uma associação de crédito direto, a Artta. De acordo com uma fonte ouvida pela reportagem, R$ 350 milhões já foram bloqueados. ""É o primeiro passa para devolver os recursos às instituições"". Segundo ela, o problema foi estancado e não se alastrou. Em nota à imprensa,a Sinqia confirmou ter detectado atividade suspeita no ambiente Pix. ""Nossa equipe agiu rapidamente e iniciou uma investigação para determinar a causa do incidente. Estamos trabalhando com o apoio dos melhores especialistas forenses nisto. Já estamos em contato com clientes afetados, que compreendem um número limitado de instituições financeiras"", diz o comunicado da Sinqia. A empresa diz ainda que investiga se a tal atividade teria sido limitada ao ambiente Pix e afirma que, por enquanto, não há evidência de atividade suspeita em outro sistema.""Esse problema afeta apenas a Sinqia no Brasil"". A nota também informa não haver indicação de que dados pessoais tenham sido comprometidos. A empresa afirma estar em contato com clientes afetados, explicando se tratar de ""um número limitado de instituições financeiras"". O comunicado não cita nomes, nem fala em valores desviados. ""Por precaução, estamos trabalhando ativamente para reconstruir os sistemas afetados em um novo ambiente com monitoramento e controles aprimorados"", segue a nota da Sinqia. ""Também estamos trabalhando com especialistas externos adicionais para nos ajudar a acelerar esse processo e complementar os recursos de nossa própria equipe"". O sistema Pix da Sinqia só vai voltar a operar ""depois que o ambiente for reconstruído e estivermos confiantes de que está pronto para ser colocado de volta em funcionamento, o Banco Central irá revisá-lo e aprová-lo antes de colocá-lo novamente online"", diz a empresa. O BC ainda não se manifestou oficialmente. A Sinqia, que já foi uma empresa listada da B3 e um dia conhecida como Senior Solution, foi adquirida pela porto-riquenha Evertec em 2023, porém manteve a gestão brasileira. No ano passado, a empresaentrou em meio de pagamentosjunto com a PaySmart, outra aquisição da Evertec no Brasil. O HSBC, por sua vez, atua no Brasil somente como banco de atacado. O banco britânico encerrou as operações de varejo no Brasil em 2015. Em nota, o banco confirma ter identificado transações financeiras via Pix em uma conta de um provedor do banco. Mas diz que nenhuma conta dos clientes ou fundos foram impactados pela operação, por elas terem ocorrido exclusivamente no sistema do provedor, a Sinqia. ""O banco esclarece ainda que medidas foram tomadas para bloquear essas transações no ambiente do provedor. O HSBC reafirma o compromisso com a segurança de dados e está à disposição das autoridades para colaborar com as investigações."" A Artta também afirma que o incidento foi externo, na infraestrutura da Sinqia. ""Não houve ataque ao ambiente da Artta nem às contas de nossos clientes. Como medida preventiva, as transações de saída estão temporariamente suspensas. Estamos em contato direto com o Banco Central e a Sinqia para normalizar as operações com segurança e agilidade."" A invasão aos sistemas da Sinqia ocorre menos de dois meses depois de umataque hacker à infraestrutura da C&M Software, conectada a contas reservas do Banco Central. Os criminosos conseguiram desviar ao menos meio bilhão de reais - a maior parte dos recursospertencia à BMP, uma plataforma de banco digital do tipowhite label. De acordo com oNeofeed,o ataque de ontem guarda semelhanças com o anterior, em que o dinheiro das instituições foram transferidos para contas de ""laranjas"". Nesse tipo de invasão, em vez de mirar apenas um banco, oshackersentram em um sistema conectado à várias instituições. Segundo fontes ouvidas pelo site, o potencial do ataque ao sistema da Sinqia teria maior potencial de desvio do que a invasão à infraestrutura da C&M. Após anunciar que deixará a direção executiva do conglomerado Berkshire Hathaway, Buffett reduzirá sua carga de trabalho depois de seis décadas no comando Com a aquisição de um ponto físico, a gigante do e-commerce conseguiria comercializar medicamentos com prescrição médica; modelo poderia ser replicado em mercado altamente pulverizado Impactos para a siderurgia brasileira são esperados; China traz aço para o país a preço abaixo do mercado As apostas podem ser feitas até as 19h (horário de Brasília), nas casas lotéricas credenciadas pela Caixa, em todo o país ou pela internet 01 02 03 exame no whatsapp Receba as notícias da Exame no seu WhatsApp Nas melhores oportunidades do mercado para investir. E-mail inválido Invest",Exame
