url,data,titulo,texto,fonte
https://valor.globo.com/empresas/noticia/2025/07/01/localiza-prope-incorporao-da-controlada-locamerica.ghtml,2025-07-01,Localiza propõe incorporação da controlada Locamerica,"01/07/2025 19h51Atualizado01/07/2025 O conselho de administração daLocaliza&Codecidiu propor, em assembleia geral extraordinária (AGE), a incorporação da sua subsidiária integralLocamerica, como parte de uma estratégia de simplificação societária e ganho de eficiência operacional. A AGE está marcada para 1º de agosto. Confira os resultados e indicadores daLocalizae das demais companhias de capital aberto no portal Valor Empresas 360 A operação prevê a transferência de todo o acervo líquido da Locamerica para aLocaliza, com a consequente extinção da Locamerica. A incorporação foi submetida à análise do conselho fiscal daLocaliza, que, em reunião nesta terça-feira (1º), opinou favoravelmente. “A incorporação se justifica pela conveniência aos interesses sociais daLocalizae da Locamerica e se baseia em fundamentos estratégicos, tendo em vista que aLocalizatem as condições necessárias para conduzir todas as atividades atualmente conduzidas pela Locamerica”, diz a companhia em comunicado. Ainda de acordo com aLocaliza, a efetivação da incorporação trará benefícios de ordem administrativa, econômica e financeira, em especial, a racionalização e simplificação da estrutura societária e, consequentemente, consolidação e redução de gastos e despesas operacionais, logísticos e administrativos combinados, permitindo a captação de ganhos de eficiência e sinergia pelas partes, além da melhoria da experiência do cliente, com a unificação de sua jornada. Caso seja aprovada nas assembleias gerais extraordinárias daLocalizae da Locamerica, a incorporação não implicará aumento do capital social daLocaliza, uma vez que é a detentora da totalidade do capital social da Locamerica e, portanto, o patrimônio líquido da Locamerica já está refletido no ativo daLocaliza. Acompanhe os mercados com nossas ferramentasAcessar gratuitamente Operação prevê a transferência de todo o acervo líquido da Locamerica para a Localiza, com a consequente extinção da Locamerica A empresa americana Aecom vai prestar assessoria nas negociações de compra da Braskem no que se refere ao afundamento do solo em bairros de Maceió Companhia disse que concentrará todos os esforços para o cumprimento das exigências ambientais estabelecidas na licença prévia Medida é prevista no Marco Legal das Garantias, lei aprovada em 2023 Texto assinado por Lindbergh Farias (RJ) critica forças, que, segundo os parlamentares, agem contra a redução das desigualdades Zucco afirma que ação desrespeita Legislativo e decreto era inconstitucional Votação simbólica dá aval para uso de até R$ 15 bilhões para habitação e calamidades Segundo a autora do estudo, o grupo deveria aumentar os esforços para unir a agenda, pois os países do Brics detêm parte significativa das reservas globais de minerais essenciais Há na Corte duas ações questionando a decisão do Congresso de derrubar o aumento do IOF: uma foi ajuizada pelo Psol e outra é da AGU, em nome do governo Ex-assessor de Bolsonaro presta depoimento à PF em inquérito que apura contato indevido com militar",Valor Econômico
https://valor.globo.com/empresas/noticia/2025/07/01/familia-bilionaria-fundadora-da-handm-acelera-compras-de-acoes.ghtml,2025-07-01,Família bilionária fundadora da H&M acelera compras de ações,"Por Reuters— Londres e Estocolmo 01/07/2025 14h14Atualizado01/07/2025 Abilionária família Persson,fundadora da varejistaH&M,acelerou o ritmo de compra das ações da companhia, segundo registros regulatórios divulgados nesta terça-feira (1º), alimentando especulações de que a empresa possa eventualmente ter seu capital fechado. Acompanhe os mercados com nossas ferramentasAcessar gratuitamente Operação prevê a transferência de todo o acervo líquido da Locamerica para a Localiza, com a consequente extinção da Locamerica A empresa americana Aecom vai prestar assessoria nas negociações de compra da Braskem no que se refere ao afundamento do solo em bairros de Maceió Companhia disse que concentrará todos os esforços para o cumprimento das exigências ambientais estabelecidas na licença prévia Medida é prevista no Marco Legal das Garantias, lei aprovada em 2023 Texto assinado por Lindbergh Farias (RJ) critica forças, que, segundo os parlamentares, agem contra a redução das desigualdades Zucco afirma que ação desrespeita Legislativo e decreto era inconstitucional Votação simbólica dá aval para uso de até R$ 15 bilhões para habitação e calamidades Segundo a autora do estudo, o grupo deveria aumentar os esforços para unir a agenda, pois os países do Brics detêm parte significativa das reservas globais de minerais essenciais Há na Corte duas ações questionando a decisão do Congresso de derrubar o aumento do IOF: uma foi ajuizada pelo Psol e outra é da AGU, em nome do governo Ex-assessor de Bolsonaro presta depoimento à PF em inquérito que apura contato indevido com militar",Valor Econômico
https://valor.globo.com/financas/noticia/2025/07/01/stf-valida-busca-e-apreenso-de-bens-sem-deciso-judicial-em-caso-de-inadimplncia.ghtml,2025-07-01,STF valida busca e apreensão de bens sem decisão judicial em caso de inadimplência,"Em alta 01/07/2025 19h37Atualizado01/07/2025 O Supremo Tribunal Federal (STF) validou dispositivos que autorizam a busca e apreensão de bens, sem decisão judicial, em caso de inadimplência. A medida é prevista no Marco Legal das Garantias, lei aprovada em 2023. O julgamento virtual terminou na segunda-feira (30). Acompanhe os mercados com nossas ferramentasAcessar gratuitamente Operação prevê a transferência de todo o acervo líquido da Locamerica para a Localiza, com a consequente extinção da Locamerica A empresa americana Aecom vai prestar assessoria nas negociações de compra da Braskem no que se refere ao afundamento do solo em bairros de Maceió Companhia disse que concentrará todos os esforços para o cumprimento das exigências ambientais estabelecidas na licença prévia Medida é prevista no Marco Legal das Garantias, lei aprovada em 2023 Texto assinado por Lindbergh Farias (RJ) critica forças, que, segundo os parlamentares, agem contra a redução das desigualdades Zucco afirma que ação desrespeita Legislativo e decreto era inconstitucional Votação simbólica dá aval para uso de até R$ 15 bilhões para habitação e calamidades Segundo a autora do estudo, o grupo deveria aumentar os esforços para unir a agenda, pois os países do Brics detêm parte significativa das reservas globais de minerais essenciais Há na Corte duas ações questionando a decisão do Congresso de derrubar o aumento do IOF: uma foi ajuizada pelo Psol e outra é da AGU, em nome do governo Ex-assessor de Bolsonaro presta depoimento à PF em inquérito que apura contato indevido com militar",Valor Econômico
https://valor.globo.com/mundo/noticia/2025/07/01/ft-eua-estreitam-foco-para-garantir-acordos-comerciais-antes-do-prazo-de-trump.ghtml,2025-07-01,FT: EUA estreitam foco para garantir acordos comerciais antes do prazo de Trump,"01/07/2025 16h32Atualizado01/07/2025 As principais autoridades comerciais de Donald Trump estão reduzindo suas ambições de firmar acordos abrangentes e recíprocos com outros países, passando a buscar pactos mais restritos para evitar a iminente reimposição de tarifas pelos Estados Unidos. Acompanhe os mercados com nossas ferramentasAcessar gratuitamente Operação prevê a transferência de todo o acervo líquido da Locamerica para a Localiza, com a consequente extinção da Locamerica A empresa americana Aecom vai prestar assessoria nas negociações de compra da Braskem no que se refere ao afundamento do solo em bairros de Maceió Companhia disse que concentrará todos os esforços para o cumprimento das exigências ambientais estabelecidas na licença prévia Medida é prevista no Marco Legal das Garantias, lei aprovada em 2023 Texto assinado por Lindbergh Farias (RJ) critica forças, que, segundo os parlamentares, agem contra a redução das desigualdades Zucco afirma que ação desrespeita Legislativo e decreto era inconstitucional Votação simbólica dá aval para uso de até R$ 15 bilhões para habitação e calamidades Segundo a autora do estudo, o grupo deveria aumentar os esforços para unir a agenda, pois os países do Brics detêm parte significativa das reservas globais de minerais essenciais Há na Corte duas ações questionando a decisão do Congresso de derrubar o aumento do IOF: uma foi ajuizada pelo Psol e outra é da AGU, em nome do governo Ex-assessor de Bolsonaro presta depoimento à PF em inquérito que apura contato indevido com militar",Valor Econômico
https://valor.globo.com/financas/noticia/2025/07/01/petroleo-avanca-com-reuniao-da-opep-no-radar-e-dados-economicos-dos-eua.ghtml,2025-07-01,Petróleo avança com reunião da Opep+ no radar e dados econômicos dos EUA,"Em alta 01/07/2025 16h13Atualizado01/07/2025 Os contratos futuros depetróleofecharam em alta nesta terça-feira (1), comdados de atividademais fortes nosEstados Unidosimpulsionando a percepção de maiordemandapela commodity no país. Os investidores também aguardam mais informações sobre areuniãoda Organização dos Países Exportadores de Petróleo e aliados (Opep+), no fim de semana, à medida que a expectativa é de um novo aumento na produção pelo cartel. No fechamento, os contratos futuros de petróleoBrent(a referência mundial) para setembro subiram 0,55%, a US$ 67,11 por barril, na Intercontinental Exchange (ICE). OWTI(a referência americana) com vencimento para agosto ganhou 0,52%, a US$ 65,45 por barril, na New York Mercantile Exchange (Nymex). O presidente dos EUA,Donald Trump, afirmou, hoje, que está esperando o momento certo para recompor areserva estratégicade petróleo do país, o que pode dar um impulso na demanda de curto prazo. A reserva emergencial de petróleo dos EUA está, atualmente, nos níveis mais baixos desde a década de 1980. Osdados do setor industrial americanosuperaram as expectativas dos agentes financeiros. O índice de gerentes de compras (PMI, na sigla em inglês) medido pela S&P Global subiu de 52 para 52,9 pontos em junho, ante consenso de manutenção. Já oíndice de atividade do setor industrialmedido pelo Instituto para Gestão da Oferta (ISM) avançou de 48,5 para 49 pontos, ante consenso de 48,6. Além disso, orelatório Joltsmostrou que as vagas de emprego em aberto nos EUA aumentaram de 7,395 milhões em abril para 7,769 milhões em maio, acima do valor de 7,3 milhões esperados pelo mercado. Acompanhe os mercados com nossas ferramentasAcessar gratuitamente Operação prevê a transferência de todo o acervo líquido da Locamerica para a Localiza, com a consequente extinção da Locamerica A empresa americana Aecom vai prestar assessoria nas negociações de compra da Braskem no que se refere ao afundamento do solo em bairros de Maceió Companhia disse que concentrará todos os esforços para o cumprimento das exigências ambientais estabelecidas na licença prévia Medida é prevista no Marco Legal das Garantias, lei aprovada em 2023 Texto assinado por Lindbergh Farias (RJ) critica forças, que, segundo os parlamentares, agem contra a redução das desigualdades Zucco afirma que ação desrespeita Legislativo e decreto era inconstitucional Votação simbólica dá aval para uso de até R$ 15 bilhões para habitação e calamidades Segundo a autora do estudo, o grupo deveria aumentar os esforços para unir a agenda, pois os países do Brics detêm parte significativa das reservas globais de minerais essenciais Há na Corte duas ações questionando a decisão do Congresso de derrubar o aumento do IOF: uma foi ajuizada pelo Psol e outra é da AGU, em nome do governo Ex-assessor de Bolsonaro presta depoimento à PF em inquérito que apura contato indevido com militar",Valor Econômico
https://valor.globo.com/empresas/noticia/2025/07/01/chevron-tem-nova-presidente-de-explorao-e-produo-na-amrica-do-sul.ghtml,2025-07-01,Chevron tem nova presidente de exploração e produção na América do Sul,"01/07/2025 16h22Atualizado01/07/2025 A petroleira americanaChevronanunciou na segunda-feira (30) a executivaPatricia Pradalcomo presidente de exploração e produção da companhia na América do Sul. A economista, com 20 anos de companhia, entra no lugar deEvelyn Vilchezque, depois de dois anos à frente da empresa na região, assume uma nova posição na sede da Chevron nos Estados Unidos, disse a companhia em nota. A atuação da Chevron na região está presente no Brasil, no Suriname, no Uruguai e no Peru. No último leilão de áreas de petróleo no Brasil, a companhia americana levou nove blocos na Foz do Amazonas em consórcio com a chinesa CNPC. Formada em economia e administração de empresas pela Universidade Candido Mendes, com MBA em Negócios de Petróleo pelo MBP-COPPE/UFRJ, Pradal ocupou cargos na Chevron nas áreas de desenvolvimento de negócios, comercial, planejamento estratégico e relações corporativas, conforme a companhia. A economista atua ainda em projetos da petroleira no setor de novas energias. Pradal é membro do comitê setorial de petróleo e gás do Instituto Brasileiro de Petróleo e Gás (IBP/Abep) e foi uma das fundadoras do comitê de diversidade da instituição. Atualmente participa do conselho da Câmara de Comércio Brasil-EUA (Amcham), como presidente do comitê de energia. Pradal é ainda diretora-conselheira do Lide-Rio e membro do conselho da Câmara de Comércio Brasil-Texas (Bratecc). Na América do Sul, a Chevron tem portfólio de negócios em atividades de “upstream” e “downstream”. A petroleira tem 33 projetos de exploração em águas profundas e rasas no Brasil, Suriname, Uruguai e Peru. Em “downstream” no Brasil, a Chevron produz aditivos para lubrificantes na fábrica da Oronite, em Mauá (SP) e vende lubrificantes pela joint venture Iconic Lubrificantes. Em combustíveis, a Chevron atua por meio da marca Texaco. Acompanhe os mercados com nossas ferramentasAcessar gratuitamente Operação prevê a transferência de todo o acervo líquido da Locamerica para a Localiza, com a consequente extinção da Locamerica A empresa americana Aecom vai prestar assessoria nas negociações de compra da Braskem no que se refere ao afundamento do solo em bairros de Maceió Companhia disse que concentrará todos os esforços para o cumprimento das exigências ambientais estabelecidas na licença prévia Medida é prevista no Marco Legal das Garantias, lei aprovada em 2023 Texto assinado por Lindbergh Farias (RJ) critica forças, que, segundo os parlamentares, agem contra a redução das desigualdades Zucco afirma que ação desrespeita Legislativo e decreto era inconstitucional Votação simbólica dá aval para uso de até R$ 15 bilhões para habitação e calamidades Segundo a autora do estudo, o grupo deveria aumentar os esforços para unir a agenda, pois os países do Brics detêm parte significativa das reservas globais de minerais essenciais Há na Corte duas ações questionando a decisão do Congresso de derrubar o aumento do IOF: uma foi ajuizada pelo Psol e outra é da AGU, em nome do governo Ex-assessor de Bolsonaro presta depoimento à PF em inquérito que apura contato indevido com militar",Valor Econômico
https://valor.globo.com/financas/noticia/2025/07/01/cmn-amplia-uso-de-recursos-do-fat-para-financiamentos-com-juros-baixos.ghtml,2025-07-01,CMN amplia limite de uso do FAT para financiamentos com custo atrelado à TR,"Em alta 01/07/2025 16h19Atualizado01/07/2025 Em reunião extraordinária, o Conselho Monetário Nacional (CMN) ampliou o limite do uso do Fundo de Amparo ao Trabalhador (FAT) para operações de financiamento com custo financeiro atrelado à Taxa Referencial (TR). Segundo informou a Fazenda, o limite passou de 1,5% para 2,5%. Esse aumento de 1 ponto percentual, segundo a pasta, será destinado exclusivamente ao financiamento de investimentos e gastos em difusão tecnológica. Segundo nota da Fazenda, com isso, serão disponibilizados R$ 4,43 bilhões adicionais ""para alavancar o apoio ao setor industrial e ampliar o acesso a crédito com melhores condições financeiras"". De acordo com a Fazenda, essa foi uma solicitação do Ministério do Desenvolvimento, Indústria, Comércio e Serviços (MDIC). ""Estima-se que, com uma alocação adequada e o uso de estruturas de ""blended finance"", esses recursos cumprirão papel fundamental na modernização do parque produtivo nacional. Importante ressaltar que a medida não envolve fluxo de despesas primárias da União e, conforme previsto na LRF (Lei de Responsabilidade Fiscal), não implica impacto sobre o resultado primário"", assinala a Fazenda, em nota. Acompanhe os mercados com nossas ferramentasAcessar gratuitamente Operação prevê a transferência de todo o acervo líquido da Locamerica para a Localiza, com a consequente extinção da Locamerica A empresa americana Aecom vai prestar assessoria nas negociações de compra da Braskem no que se refere ao afundamento do solo em bairros de Maceió Companhia disse que concentrará todos os esforços para o cumprimento das exigências ambientais estabelecidas na licença prévia Medida é prevista no Marco Legal das Garantias, lei aprovada em 2023 Texto assinado por Lindbergh Farias (RJ) critica forças, que, segundo os parlamentares, agem contra a redução das desigualdades Zucco afirma que ação desrespeita Legislativo e decreto era inconstitucional Votação simbólica dá aval para uso de até R$ 15 bilhões para habitação e calamidades Segundo a autora do estudo, o grupo deveria aumentar os esforços para unir a agenda, pois os países do Brics detêm parte significativa das reservas globais de minerais essenciais Há na Corte duas ações questionando a decisão do Congresso de derrubar o aumento do IOF: uma foi ajuizada pelo Psol e outra é da AGU, em nome do governo Ex-assessor de Bolsonaro presta depoimento à PF em inquérito que apura contato indevido com militar",Valor Econômico
https://valor.globo.com/politica/noticia/2025/07/01/moraes-nega-pedido-para-que-eduardo-e-carlos-bolsonaro-testemunhem-em-acao-da-trama-golpista.ghtml,2025-07-01,Moraes nega pedido para que Eduardo e Carlos Bolsonaro testemunhem em ação da trama golpista,"01/07/2025 16h35Atualizado01/07/2025 O ministroAlexandre de Moraes, do Supremo Tribunal Federal (STF), rejeitou nesta terça-feira (1) um pedido feito porFilipe Martins, ex-assessor do ex-presidenteJair Bolsonaro(PL), para que o deputado federal licenciadoEduardo Bolsonaro(PL-SP) e o vereadorCarlos Bolsonaro(PL-RJ) sejam ouvidos como testemunhas de defesa na ação datrama golpista. Martins integra o ""núcleo dois"" de acusados de golpe. O grupo é apontado pela Procuradoria-Geral da República (PGR) como responsável por gerenciar ações para manter Bolsonaro no poder, apesar da derrota nas eleições de 2022.As testemunhas dos réus desse núcleo serão ouvidas a partir de 14 de julho, durante o recesso do Judiciário. Segundo Moraes, Eduardo está sendo investigado por tentativa de abolição violenta do Estado Democrático de Direito e coação no curso do processo. A apuração foi aberta após Eduardo passar a defender sanções contra ministros do STF nos Estados Unidos sanções. Já Carlos, disse, foi indiciado na apuração sobre aAbin paralela, que investiga a existência de uma suposta estrutura na Agência Brasileira de Inteligência (Abin) para monitorar autoridades e jornalistas críticos a Bolsonaro. Os inquéritos contra Eduardo e Carlos, disse Moraes, têm relação com a ação da trama golpista. Por isso, segundo o ministro, os dois não podem depor como testemunha. “Todas as investigações são conexas. Ambos, também, são filhos de um dos investigados em ação penal conexa. Portanto, não podem ser ouvidos como testemunhas"", disse. Além de Martins, fazem parte do ""núcleo dois"" de acusados de golpe o ex-diretor-geral da Polícia Rodoviária Federal (PRF)Silvinei Vasques, o ex-assessor da PresidênciaMarcelo Câmara, o general da reservaMario Fernandese os ex-diretores do Ministério da JustiçaMarília AlencareFernando Oliveira. Acompanhe os mercados com nossas ferramentasAcessar gratuitamente Operação prevê a transferência de todo o acervo líquido da Locamerica para a Localiza, com a consequente extinção da Locamerica A empresa americana Aecom vai prestar assessoria nas negociações de compra da Braskem no que se refere ao afundamento do solo em bairros de Maceió Companhia disse que concentrará todos os esforços para o cumprimento das exigências ambientais estabelecidas na licença prévia Medida é prevista no Marco Legal das Garantias, lei aprovada em 2023 Texto assinado por Lindbergh Farias (RJ) critica forças, que, segundo os parlamentares, agem contra a redução das desigualdades Zucco afirma que ação desrespeita Legislativo e decreto era inconstitucional Votação simbólica dá aval para uso de até R$ 15 bilhões para habitação e calamidades Segundo a autora do estudo, o grupo deveria aumentar os esforços para unir a agenda, pois os países do Brics detêm parte significativa das reservas globais de minerais essenciais Há na Corte duas ações questionando a decisão do Congresso de derrubar o aumento do IOF: uma foi ajuizada pelo Psol e outra é da AGU, em nome do governo Ex-assessor de Bolsonaro presta depoimento à PF em inquérito que apura contato indevido com militar",Valor Econômico
https://valor.globo.com/empresas/noticia/2025/07/01/neoenergia-quer-iniciar-obras-de-projeto-solar-em-fernando-de-noronha-ainda-este-ano.ghtml,2025-07-01,Neoenergia quer iniciar obras de projeto solar em Fernando de Noronha ainda este ano,"01/07/2025 19h47Atualizado01/07/2025 ANeoenergiadisse, nesta terça-feira (1º), que quer conseguir a licença de instalação para oprojeto Noronha Verde, em Fernando de Noronha, o mais breve possível, a fim de iniciar as obras ainda este ano. A empresa obteve, na segunda-feira (30), a licença prévia para a implantação de umausina de energia solar fotovoltaica,combinada com um sistema de armazenamento por baterias. Leia mais:Neoenergia obtém licença prévia para projeto de energia solar e baterias em Fernando de NoronhaConfira os resultados e indicadores daNeoenergiae das demais companhias de capital aberto no portal Valor Empresas 360 Em nota, a companhia disse que concentrará todos os esforços para o cumprimento das exigências ambientais estabelecidas na licença prévia, para obter a licença de instalação do órgão ambiental estadual, aAgência Estadual de Meio Ambiente (Aema) de Pernambuco. “A intenção é reduzir a dependência da geração termelétrica a diesel e tornar Noronha a primeira ilha habitada na América Latina a alcançar essa marca”, disse a empresa, em nota. O projeto foi autorizado pelo Ministério de Minas e Energia (MME) em novembro passado e tem o objetivo de substituir a geração com uso de combustíveis fósseis por energia limpa. ANeoenergiaatualizou alguns dados do projeto: os investimentos giram em R$ 350 milhões (a previsão inicial eram R$ 300 milhões), e a meta é alcançar até 85% de descarbonização do arquipélago. O sistema deve entrar em operação em duas fases: a primeira está prevista para o início de 2026 e a segunda, em 2027. Acompanhe os mercados com nossas ferramentasAcessar gratuitamente Operação prevê a transferência de todo o acervo líquido da Locamerica para a Localiza, com a consequente extinção da Locamerica A empresa americana Aecom vai prestar assessoria nas negociações de compra da Braskem no que se refere ao afundamento do solo em bairros de Maceió Companhia disse que concentrará todos os esforços para o cumprimento das exigências ambientais estabelecidas na licença prévia Medida é prevista no Marco Legal das Garantias, lei aprovada em 2023 Texto assinado por Lindbergh Farias (RJ) critica forças, que, segundo os parlamentares, agem contra a redução das desigualdades Zucco afirma que ação desrespeita Legislativo e decreto era inconstitucional Votação simbólica dá aval para uso de até R$ 15 bilhões para habitação e calamidades Segundo a autora do estudo, o grupo deveria aumentar os esforços para unir a agenda, pois os países do Brics detêm parte significativa das reservas globais de minerais essenciais Há na Corte duas ações questionando a decisão do Congresso de derrubar o aumento do IOF: uma foi ajuizada pelo Psol e outra é da AGU, em nome do governo Ex-assessor de Bolsonaro presta depoimento à PF em inquérito que apura contato indevido com militar",Valor Econômico
