url,data,titulo,texto,fonte
https://valor.globo.com/empresas/noticia/2025/07/24/azul-recebe-aprovacao-da-justica-de-ny-para-financiamento-de-us-16-bilhao.ghtml,2025-07-24,"Azul recebe aprovação da Justiça de NY para financiamento de US$ 1,6 bilhão","24/07/2025 18h57Atualizado24/07/2025 AAzuldivulgou ao mercado, na noite desta quinta-feira (24), que recebeu aaprovação final do Tribunal de Nova York para o seu financiamento do tipo DIP (“debtor-in-possession”, que tem quitação prioritária) de US$ 1,6 bilhão.A Azul havia recebido o aval inicial da Corte para acessar uma primeira tranche desse recurso, de US$ 250 milhões, no fim de maio. A tranche inicial foi um recurso emergencial para dar liquidez à companhia antes da avaliação completa sobre o DIP. Agora, a Corte deu o veredicto favorável para o financiamento. A estimativa é que a segunda tranche venha para ajudar o caixa e, sobretudo, pagar uma dívida de prioridade elevada na estrutura de capital da empresa. Já a terceira fase é esperada para o fim do processo. “Com a aprovação final do financiamento DIP e o suporte contínuo de nossos principais parceiros financeiros, a Azul está bem-posicionada para executar nosso plano de transformação e emergir como uma companhia aérea mais forte e competitiva”, afirmouJohn Rodgerson, CEO da Azul,em nota. A Azul informou que também protocolou o acordo previamente anunciado com a AerCap, que representa a maior parte de seu passivo de arrendamento de aviões. A expectativa é que somente esse acordo resulte em mais de US$ 1 bilhão em economia na operação da frota da Azul, segundo a empresa. O acordo com a AerCap está previsto para ser avaliado na próxima audiência com a corte, em 13 de agosto. O tribunal também autorizou a rejeição de dois contratos de arrendamento de motores inativos. Acompanhe os mercados com nossas ferramentasAcessar gratuitamente Em depoimento ao STF, Mário Fernandes também reconheceu que digitalizou documento Revisão faz parte do programa de US$ 20 bilhões entre o Fundo e a Argentina, realizado em abril, e aguarda agora a aprovação final do Conselho Executivo Na América Latina, as vendas líquidas do 2º trimestre cresceram 17,4% na base anual, para 10,85 bilhões de pesos – ou US$ 584,9 milhões Empresa faz movimento rumo à América Latina enquanto busca abrir capital nos EUA Medida é parte de um grande pacote do Ministério de Minas e Energia para ajudar a aumentar a arrecadação do governo em 2025 e 2026 O vice-presidente e ministro do Desenvolvimento, Indústria, Comércio e Serviços (Mdic) contou que conversou com o secretário de Comércio dos Estados Unidos, Howard Lutnick, no sábado (19) Aérea informou também que protocolou o acordo previamente anunciado com a AerCap, que representa a maior parte de seu passivo de arrendamento de aviões Motivo foi um erro no site, que disponibilizou todo o portfólio por preços entre R$ 150,99 e R$ 161,90 Segundo BC, nova norma inclui atividades de instituições mais recentes, como instituições de pagamento e fintechs de crédito, potencialmente ampliando a competitividade do segmento",Valor Econômico
https://valor.globo.com/mundo/noticia/2025/07/24/presidente-da-camara-dos-eua-diz-que-caso-epstein-nao-e-uma-farsa.ghtml,2025-07-24,Presidente da Câmara dos EUA diz que caso Epstein 'não é uma farsa',"Por Reuters— Washington 24/07/2025 16h16Atualizado24/07/2025 O presidente da Câmara dos Deputados dos Estados Unidos, o republicanoMike Johnson, disse nesta quinta-feira (24), em entrevista, queo escândalo de Jeffrey Epstein ""não é uma farsa"", à medida que o caso continua a alimentar a turbulência dentro do partido do presidente americano,Donald Trump. Trump denunciou o furor em torno de seu falecido amigo, um financista em desgraça e criminoso sexual condenado, como ""a farsa de Jeffrey Epstein"" e pediu a seus pares republicanos, sem sucesso, que abandonassem a questão. ""Não é uma farsa. É claro que não"", disse Johnson em uma entrevista à emissora CBS News. Na terça-feira, Johnson disse que mandaria os parlamentares para casa um dia antes para um recesso de verão de cinco semanas para evitar uma briga política sobre a divulgação de arquivos adicionais sobre Epstein, que se enforcou em uma prisão da cidade de Nova York em 2019, de acordo com o médico legista chefe da cidade de Nova York. Mesmo assim, um subcomitê controlado pelos republicanos no Comitê de Supervisão da Câmara aprovou nesta quarta uma intimação solicitando todos os arquivos do Departamento de Justiça sobre Epstein. Três republicanos se juntaram a cinco democratas para apoiar a iniciativa, em um sinal de que o partido de Trump não estava pronto para deixar de lado a questão. ""Queremos transparência total. Queremos que todos que estejam envolvidos de alguma forma com os males de Epstein -- vamos chamá-los como foram -- sejam levados à Justiça o mais rápido possível. Queremos que todo o peso da lei recaia sobre suas cabeças"", disse Johnson. Nesta quarta,uma revelação sobre a aparição de Trump nos registros de casos do Departamento de Justiça ameaçou aprofundar uma crise política que envolveu seu governo durante semanas, após o “Wall Street Journal” informar que a secretária de Justiça dos EUA,Pam Bondi, disse a Trump em maio que seu nome aparecia em arquivos de investigação relacionados a Epstein. Acompanhe os mercados com nossas ferramentasAcessar gratuitamente Em depoimento ao STF, Mário Fernandes também reconheceu que digitalizou documento Revisão faz parte do programa de US$ 20 bilhões entre o Fundo e a Argentina, realizado em abril, e aguarda agora a aprovação final do Conselho Executivo Na América Latina, as vendas líquidas do 2º trimestre cresceram 17,4% na base anual, para 10,85 bilhões de pesos – ou US$ 584,9 milhões Empresa faz movimento rumo à América Latina enquanto busca abrir capital nos EUA Medida é parte de um grande pacote do Ministério de Minas e Energia para ajudar a aumentar a arrecadação do governo em 2025 e 2026 O vice-presidente e ministro do Desenvolvimento, Indústria, Comércio e Serviços (Mdic) contou que conversou com o secretário de Comércio dos Estados Unidos, Howard Lutnick, no sábado (19) Aérea informou também que protocolou o acordo previamente anunciado com a AerCap, que representa a maior parte de seu passivo de arrendamento de aviões Motivo foi um erro no site, que disponibilizou todo o portfólio por preços entre R$ 150,99 e R$ 161,90 Segundo BC, nova norma inclui atividades de instituições mais recentes, como instituições de pagamento e fintechs de crédito, potencialmente ampliando a competitividade do segmento",Valor Econômico
https://valor.globo.com/empresas/noticia/2025/07/24/investimento-em-inteligencia-artificial-ja-e-imparavel-e-muito-mais-esta-por-vir.ghtml,2025-07-24,Investimento em inteligência artificial já é 'imparável' e muito mais está por vir,"Por Dow Jones— Nova York 24/07/2025 16h47Atualizado24/07/2025 A tsunami de investimentos eminteligência artificial,já uma força aparentemente imparável na maior economia do mundo, está prestes a se tornar ainda mais relevante com o novo apoio daCasa Brancae compromissos renovados das maiores empresas do setor. AAlphabet, controladora do Google, que está em uma corrida para proteger seus negócios de busca e publicidade,anunciou, na noite de quarta-feira (23), que gastará mais de US$ 85 bilhões em novos projetos neste ano. Acompanhe os mercados com nossas ferramentasAcessar gratuitamente Em depoimento ao STF, Mário Fernandes também reconheceu que digitalizou documento Revisão faz parte do programa de US$ 20 bilhões entre o Fundo e a Argentina, realizado em abril, e aguarda agora a aprovação final do Conselho Executivo Na América Latina, as vendas líquidas do 2º trimestre cresceram 17,4% na base anual, para 10,85 bilhões de pesos – ou US$ 584,9 milhões Empresa faz movimento rumo à América Latina enquanto busca abrir capital nos EUA Medida é parte de um grande pacote do Ministério de Minas e Energia para ajudar a aumentar a arrecadação do governo em 2025 e 2026 O vice-presidente e ministro do Desenvolvimento, Indústria, Comércio e Serviços (Mdic) contou que conversou com o secretário de Comércio dos Estados Unidos, Howard Lutnick, no sábado (19) Aérea informou também que protocolou o acordo previamente anunciado com a AerCap, que representa a maior parte de seu passivo de arrendamento de aviões Motivo foi um erro no site, que disponibilizou todo o portfólio por preços entre R$ 150,99 e R$ 161,90 Segundo BC, nova norma inclui atividades de instituições mais recentes, como instituições de pagamento e fintechs de crédito, potencialmente ampliando a competitividade do segmento",Valor Econômico
https://valor.globo.com/financas/noticia/2025/07/24/banco-inter-e-bradesco-lideram-ranking-de-reclamaes-do-bc-no-segundo-trimestre.ghtml,2025-07-24,Banco Inter e Bradesco lideram ranking de reclamações do BC no segundo trimestre,"Em alta 24/07/2025 15h25Atualizado24/07/2025 O Banco Inter liderou o ranking de reclamações das maiores instituições financeiras referente ao segundo trimestre de 2025. A escala considera as 15 maiores instituições em número de clientes e foi publicada nesta quinta-feira pelo Banco Central (BC). Acompanhe os mercados com nossas ferramentasAcessar gratuitamente Em depoimento ao STF, Mário Fernandes também reconheceu que digitalizou documento Revisão faz parte do programa de US$ 20 bilhões entre o Fundo e a Argentina, realizado em abril, e aguarda agora a aprovação final do Conselho Executivo Na América Latina, as vendas líquidas do 2º trimestre cresceram 17,4% na base anual, para 10,85 bilhões de pesos – ou US$ 584,9 milhões Empresa faz movimento rumo à América Latina enquanto busca abrir capital nos EUA Medida é parte de um grande pacote do Ministério de Minas e Energia para ajudar a aumentar a arrecadação do governo em 2025 e 2026 O vice-presidente e ministro do Desenvolvimento, Indústria, Comércio e Serviços (Mdic) contou que conversou com o secretário de Comércio dos Estados Unidos, Howard Lutnick, no sábado (19) Aérea informou também que protocolou o acordo previamente anunciado com a AerCap, que representa a maior parte de seu passivo de arrendamento de aviões Motivo foi um erro no site, que disponibilizou todo o portfólio por preços entre R$ 150,99 e R$ 161,90 Segundo BC, nova norma inclui atividades de instituições mais recentes, como instituições de pagamento e fintechs de crédito, potencialmente ampliando a competitividade do segmento",Valor Econômico
https://valor.globo.com/politica/noticia/2025/07/24/bolsonaristas-dizem-que-decisao-de-moraes-censura-ex-presidente.ghtml,2025-07-24,Bolsonaristas dizem que decisão de Moraes censura ex-presidente,"24/07/2025 14h33Atualizado24/07/2025 Aliados de Jair Bolsonaro (PL) mantiveram críticas ao ministroAlexandre de Moraes, do Supremo Tribunal Federal (STF), nesta quinta-feira (27), após adecisão que descartou a prisão do ex-presidente, apesar de considerar que houve descumprimento da ordem que o proíbe de usar redes sociais. Filhos do ex-presidente, o deputado federal licenciadoEduardo (PL-SP)e o senadorFlávio (PL-RJ)vincularam Moraes a ""censura"" por ter alertado que Jair Bolsonaro desobedeceu à medida cautelar com a utilização de perfis de Eduardo para difundir mensagens favoráveis ao clã. Bolsonaro pode dar entrevistas? Entenda a decisão de Moraes em 5 pontos No X (antigo Twitter), Eduardo chamou o ministro do STF de ""tirano covarde"" e disse que sofre uma tentativa de ser calado. ""Moraes diz que meu pai pode dar entrevistas, desde que não sejam 'instrumentalizadas' por mim. Ou seja, ele está dizendo que, se eu falar sobre a entrevista que meu pai der, ele irá prendê-lo, por atos que eu pratiquei"", disse o deputado, questionando a possibilidade de o pai ser punido por algo que o filho fizer. Para Eduardo, a decisão deixa dúvidas sobre o que pode ou não ser feito nas redes. Moraes deixou claro que ""não será admitida a utilização de subterfúgios para a manutenção da prática de atividades criminosas [por Bolsonaro], com a instrumentalização de entrevistas ou discursos públicos como 'material pré-fabricado' para posterior postagens nas redes sociais de terceiros previamente coordenados"". O ministro afirmou que oex-presidente não está proibido de conceder entrevistas, mas que a reprodução de trechos considerados ilícitos (como referências a atentado à soberania) podem resultar em prisão. Flávio afirmou que a decisão ""é puro suco de censura"" e que Moraes ""precisa de uma internação compulsória para tratar sua obsessão por Bolsonaro"", porque ""está viciado em persegui-lo"". O líder do PL na Câmara,Sóstenes Cavalcante (RJ), também acentuou as críticas contra o ministro, a quem se referiu como ""psicopata de toga"" e ""tirano disfarçado de juiz"". ""Alexandre de Moraes recuou? Não. Ele apenas tentou encobrir a censura grosseira que havia imposto"", declarou Sóstenes no X, acrescentando que ""o Brasil está sob um estado de exceção camuflado"" e que o magistrado ""age por raiva, ataca com fúria, recua por cálculo"". ""Quem censura, persegue e pune sem julgamento justo… não quer justiça. Quer controle"", disse ainda o líder do partido. Políticos e influenciadores bolsonaristas também ironizaram Moraes por causa de um erro gramatical na versão inicial da decisão, com a troca da conjunção adversativa ""mas"" pelo advérbio de intensidade ""mais"", na frase: ""A Justiça é cega, mais [sic] não é tola"". Momentos depois umanova versão da decisão foi publicada, com a frase corrigida. Citando também erros no uso de crase ao longo do documento, o ex-deputado federalDeltan Dallagnol (Novo-PR)escreveu que é ""tudo isso vindo de um finalista do Prêmio Jabuti, o maior reconhecimento literário do país"". Moraes é um dos finalistas do segmento acadêmico do Jabuti, na categoria ""direito"", com um livro sobre milícias digitais. O líder da oposição no Senado,Rogério Marinho (PL-RN), disse que a revogação parcial das medidas impostas contra Bolsonaro ""representa um raro gesto de bom senso"". O senador criticou Moraes ao afirmar que ""tentaram calar, de forma autoritária, a maior liderança política do país"" e que há ""uso do processo penal como instrumento de perseguição"". Acompanhe os mercados com nossas ferramentasAcessar gratuitamente Em depoimento ao STF, Mário Fernandes também reconheceu que digitalizou documento Revisão faz parte do programa de US$ 20 bilhões entre o Fundo e a Argentina, realizado em abril, e aguarda agora a aprovação final do Conselho Executivo Na América Latina, as vendas líquidas do 2º trimestre cresceram 17,4% na base anual, para 10,85 bilhões de pesos – ou US$ 584,9 milhões Empresa faz movimento rumo à América Latina enquanto busca abrir capital nos EUA Medida é parte de um grande pacote do Ministério de Minas e Energia para ajudar a aumentar a arrecadação do governo em 2025 e 2026 O vice-presidente e ministro do Desenvolvimento, Indústria, Comércio e Serviços (Mdic) contou que conversou com o secretário de Comércio dos Estados Unidos, Howard Lutnick, no sábado (19) Aérea informou também que protocolou o acordo previamente anunciado com a AerCap, que representa a maior parte de seu passivo de arrendamento de aviões Motivo foi um erro no site, que disponibilizou todo o portfólio por preços entre R$ 150,99 e R$ 161,90 Segundo BC, nova norma inclui atividades de instituições mais recentes, como instituições de pagamento e fintechs de crédito, potencialmente ampliando a competitividade do segmento",Valor Econômico
https://valor.globo.com/politica/noticia/2025/07/24/coronel-da-reserva-nega-ter-participado-de-plano-para-matar-lula-alckmin-e-moraes-em-2022.ghtml,2025-07-24,Militar diz que acompanhava rotina de Moraes para tentar aproximar ministro de Bolsonaro,"24/07/2025 16h05Atualizado24/07/2025 O coronel da reservaMarcelo Costa Câmara, ex-assessor do ex-presidenteJair Bolsonaro (PL), negou nesta quinta-feira (24) que tenha participado de um plano para monitorar e assassinar autoridades. Durante seu interrogatório à Primeira Turma do Supremo Tribunal Federal (STF), o militar disse que acompanhava o itinerário do ministroAlexandre de Moraespara tentar aproximar o magistrado do ex-presidenteJair Bolsonaro (PL). Réu no núcleo dois da trama golpista, Marcelo seria responsável, segundo a Procuradoria-Geral da República (PGR), por “coordenar as ações de monitoramento e neutralização de autoridades públicas”. Segundo a Procuradoria-Geral da República (PGR), o militar da reserva seria responsável por coordenar ações de monitoramento e neutralização de autoridades públicas. Investigação da Polícia Federal (PF) afirma que havia um plano para assassinar Moraes, o presidente Luiz Inácio Lula da Silva (PT) e o vice, Geraldo Alckmin (PSB). “Meu nome não consta nesse plano. Não tinha contato com as pessoas que constam nesse plano. Não tenho participação nisso. Não fui a nenhuma reunião”, afirmou. Câmara disse que nunca participou de nenhuma ação de monitoramento. “Tem uma celeuma em relação a monitoramento. Inclusive foi pedido para a gente olhar no dicionário o que é”, afirmou. Câmara negou que tenha “monitorado” Moraes. Ele disse que colhia informações sobre o ministro do STF a pedido do tenente-coronel Mauro Cid, ex-ajudante de ordens de Bolsonaro, por uma questão de “ajuste de agendas” e para aproximar o ex-presidente de autoridades. Cid também é réu na ação e assinou acordo de delação premiada. “Tudo isso era com a finalidade de aproximação. Isso é o que nós queríamos (...) Havia uma intenção de aproximação do presidente, e não criar nenhum constrangimento (...) Essas informações não tem profundidade a nível de um monitoramento. O Cid me perguntava e eu passava pra ele”, disse. Em 2022, Moraes já era relator de ações contra aliados de Bolsonaro e presidia o Tribunal Superior Eleitoral (TSE). O ministro era alvo frequente de críticas e ataques do ex-presidente, que acusava o magistrado de perseguir seu grupo político. Com o andamento da ação da trama golpista, também relatada por Moraes, e as informações que existem hoje, Marcelo Câmara afirma desconfiar que os dados que ele colhia podem ter sido utilizadas para outros fins. “Eu começo a questionar se ele estava usando o que eu passei de forma diferente do que eu tinha intenção. Se alguma coisa que eu passei para o Cid aí ele usou para outra coisa que eu não esperava. Eu me sinto usado nisso aí. De uma hora para outra eu começo a perceber que eu poderia estar sendo usado. Eu realmente fico muito chateado com isso, porque não era a minha intenção”, disse. Réus do núcleo dois O STF ouve os réus do núcleo dois da trama golpista, grupo que seria responsável por gerenciar operações para manter Bolsonaro no poder, apesar da derrota para Lula nas eleições de 2022. Além dele, foram interrogados nesta quinta-feiraFernando de Sousa Oliveira, delegado da PF e ex-secretário executivo da Secretaria de Segurança Pública do Distrito Federal, eFilipe Martins, ex-assessor especial de Assuntos Internacionais da Presidência. Ainda serão interrogados Mário Fernandes, ex-número dois da Secretaria-Geral da Presidência e general da reserva; Marília Ferreira de Alencar, ex-diretora de inteligência do Ministério da Justiça; e Silvinei Vasques, ex-diretor-geral da Polícia Rodoviária Federal. Os interrogatórios são realizados por videoconferência. Ocanal do STF no YouTube transmite as oitivas. Elas são conduzidas por Rafael Henrique, juiz auxiliar do ministro Alexandre de Moraes. Os seis integrantes do núcleo dois são réus pelos crimes de organização criminosa armada, tentativa de abolição violenta do Estado Democrático de Direito, golpe de Estado, dano contra o patrimônio da União e deterioração de patrimônio tombado. Acompanhe os mercados com nossas ferramentasAcessar gratuitamente Em depoimento ao STF, Mário Fernandes também reconheceu que digitalizou documento Revisão faz parte do programa de US$ 20 bilhões entre o Fundo e a Argentina, realizado em abril, e aguarda agora a aprovação final do Conselho Executivo Na América Latina, as vendas líquidas do 2º trimestre cresceram 17,4% na base anual, para 10,85 bilhões de pesos – ou US$ 584,9 milhões Empresa faz movimento rumo à América Latina enquanto busca abrir capital nos EUA Medida é parte de um grande pacote do Ministério de Minas e Energia para ajudar a aumentar a arrecadação do governo em 2025 e 2026 O vice-presidente e ministro do Desenvolvimento, Indústria, Comércio e Serviços (Mdic) contou que conversou com o secretário de Comércio dos Estados Unidos, Howard Lutnick, no sábado (19) Aérea informou também que protocolou o acordo previamente anunciado com a AerCap, que representa a maior parte de seu passivo de arrendamento de aviões Motivo foi um erro no site, que disponibilizou todo o portfólio por preços entre R$ 150,99 e R$ 161,90 Segundo BC, nova norma inclui atividades de instituições mais recentes, como instituições de pagamento e fintechs de crédito, potencialmente ampliando a competitividade do segmento",Valor Econômico
