url,data,titulo,texto,fonte
https://www.infomoney.com.br/mercados/ibovespa-hoje-bolsa-de-valores-ao-vivo-20082025/,2025-08-20,"Ibovespa fecha com leve alta, graças a Petrobras e bancos","Principais índices em NY fecham mistos e sem força, como ontem O Ibovespa sossegou nesta quarta-feira, após a forte queda de ontem:alta de 0,17%, aos 134.666,46 pontos, um ganho pequeno de 234,20 pontos, após perder quase 3 mil pontos ontem. O dólar comercialtambém se acomodouerecuou 0,48%, a R$ 5,473, após a ampla alta vista ontem. E os DIs (juros futuros) caíram por toda a curva. O ganho de hoje foi mais uma correção do que um fato concreto. É um alívio, não uma esperança. Porque ninguém está muito iludido: o quadro político ainda não mudou na relação EUA e Brasil. Uma relação que praticamente inexiste, como mostra bemevento cancelado pelos EUA que aconteceria com a FAB. O ministro do STF, Alexandre de Moraes, inclusiveconcorda com a situação complicadaque o setor bancário brasileiro está colocado e que foi justamente a causa da derrota acachapante do Ibovespa ontem. Em entrevista àReuters, reconheceu que a atuação da Justiça dos EUA em relação aos bancos brasileiros que têm operações nos EUA “é da aplicação da lei norte-americana. Agora, da mesma forma, se os bancos resolverem aplicar a lei internamente, eles não podem. E aí eles podem ser penalizados internamente”. Para ele seria preciso que a lei de lá fosse validada por cá, através de um processo legal. Os bancos hoje subiram (bem pouco, mas subiram), como correção e como compreensão,como a de Moraes, de que as coisas vão se assentar: BB (BBAS3) ganhou 0,30%; Bradesco (BBDC4) avançou 0,32%; Itaú Unibanco (ITUB4) ficou com mais 0,06%; e Santander (SANB11) subiu com mais amplitude, 2,08%. Trump pressiona Fed novamenteNão que Donald Trump, o presidente dos EUA, esteja assim tão preocupado com o Brasil. Ele tem outras coisas para meter a mão e balançar os mercados.Hoje, por exemplo, voltou sua artilharia para o Federal Reserve novamente epediu a renúncia de uma diretora. Bem no dia em que o banco central do paíssoltou a Ata da última reunião sobre política monetária, sem muitas novidades.Aproveitou também para dar mais uma cutucada em Jerome Powell, presidente da instituição, dizendo agora que o Fedprejudica o setor imobiliário. “As pessoas não conseguem obter uma hipoteca por causa dele. Não há inflação, e todos os sinais apontam para um grande corte nos juros”, escreveu Trump em sua própria rede social, a Truth Social.O ataque não é gratuito: na sexta-feira, a agenda de Powell tem um compromisso importante: seu último simpósio anual em Jackson Hole, onde falará sobre a política monetária e apontará caminhos.Bolsas pelo mundoÉ isso que tem travado o andamento dos mercados em Wall Street. Os principais índices por lá seguiram a cantilena de ontem: Nasdaq e S&P 500 em baixas amplas e Dow Jones oscilando. Há uma pedra no sapato que nem mesmo as tarifas elevadas parecem resolver: déficit dos EUAdeve subir US$ 1 trilhãona próxima década, segundo órgão de fiscalização.Na Europa,mais um dia de alta nos mercados. A taxa de inflação em julhose manteve dentro da metado Banco Central Europeu, o que vem sendo um padrão nos últimos meses e é um problema a menos – embora o núcleo siga acima.CONTINUA DEPOIS DA PUBLICIDADEComércio global busca soluçõesEnquanto Trump aponta a metralhadora giratória do caos para onde quiser, o mundo se move, tentando escapar ileso. O banco central chinêsmanteve sua taxa de juros inalterada. E o gigante asiático mandou avisar: a Chinaaumentou as importações de soja do Brasil e diminuiu as dos EUA. O agro brasileiro comemora. Além disso, a Chinase reaproximou de ninguém menos do que a Índia, recentemente taxada de forma brutal pelos EUA.Tem mais: os presidentes Lula e Emmanuel Macron, da França, faltaram por telefone hoje por uma hora, ese comprometeram a concluiro tratado Mercosul e União Europeia. A França é ainda o maior entrave.As exportações brasileiras vão bem, obrigado, e é preciso melhorar o escoamento e a infraestrutura. Por isso, o governocorre com leilão no terminal do Porto de Santos.Em São Paulo, a sensação é que fora os ruídos do comércio exterior e da política, que não são poucos, a coisa até vai indo bem: analistas destacaram que, no geral, atemporada de balanços do 2T25 superou as projeções, mas já veem desaceleração no 3º trimestre por conta dos juros altos. Por conta do agro, que tem no primeiro trimestre seu melhor resultado, a economia brasileira normalmente desacelera no segundo semestre. É esperar para ver o quanto.Vale em baixa e Petrobras em altaNesse interim, Vale (VALE3) recuou hoje: baixa de 0,45%, na esteira daqueda do minério de ferro. Mas, além da recuperação curta dos bancos, a Petrobras (PETR4) aproveitou a alta do barril de petróleo e ganhou 0,60%.CONTINUA DEPOIS DA PUBLICIDADEOs demais setores terminaram também cambaleantes. As petroleiras juniores subiram igualmente com o petróleo,com analistas destacandoBrava (BRAV3), que hoje subiu 1,56%. Os frigoríficos caíram 0,35% e 3,16% com BRF (BRFS3) e Marfrig (MRFG3), apóspedido de vistas no julgamento do Cade sobre a fusão das duas, mas viram Minerva (BEEF3) avançar 1,71%. Os varejistas tiveram baixa de 1,01% com Lojas Renner (LREN3) e altas de 1,69% com Vivara (VIVA3).Destaque mesmo veio com as ações da Simpar (SIMH3), que dispararam 10,05%, após venda de controladapor valor bilionário.Nesta quinta, os investidores acessarão dados dos PMIs (índice gerente de compras) dos EUA, Japão, zona do euro, Alemanha e outros. No Brasil, não há calmaria, enquanto a incerteza da relação com os EUA continuar. O que vai prevalecer? (Fernando Augusto Lopes)Confira as últimas dos mercadosupdate18h05Encerramos nossa cobertura dos Mercados Ao VivoAcessa o Ao Vivo do InfoMoney todos os dias? Então, adicioneeste link aos favoritosdo seu navegador para acompanhar diariamente a cobertura a partir das 8 horas ou acesse oIM Trader, onovo canal do InfoMoney sobre Mercados!update18h05Minidólar com vencimento em setembro (WDOU25), nos minutos finais, tem queda de 0,34%, cotado a 5.496,50update18h04Mini-índice com vencimento em outubro (WINV25) tem, na reta final, mais 0,43%, aos 137.075 pontosVolume de negócios ultrapassou os 4,52 milhões.update18h03Na reta final, Bitcoin Futuro (BITFUT) tem avanço de 0,49%, aos 629.820,00update18h03Próximo de fechar, Dólar Futuro (DOLFUT) opera com menos 0,34%, aos 5.496,50update18h03Perto do fechamento, Ibovespa Futuro (INDFUT) tem mais 0,48%, aos 137.105",Infomoney
https://valor.globo.com/empresas/noticia/2025/08/20/prejuizo-da-coty-sobe-88percent-no-4o-trimestre-fiscal-com-queda-em-vendas-e-endividamento.ghtml,2025-08-20,"Prejuízo da Coty sobe 88% no 4º trimestre fiscal, com queda em vendas e endividamento","20/08/2025 19h16Atualizadoagora A perfumaria e fabricante de cosméticosCotyregistrou prejuízo de US$ 44,9 milhões no quarto trimestre fiscal de 2025, piora de 88% em relação ao mesmo período do ano passado. O prejuízo por ação foi de US$ 0,08. Já o lucro operacional caiu 55%, para US$ 15,5 milhões. A receita da Coty caiu 8% no comparativo anual, para US$ 1,25 bilhão. O resultado reflete queda de 5% nas vendas da divisão “prestígio”, que representa 61% de todas as vendas da Coty. No último trimestre, o faturamento da divisão de luxo foi de US$ 760,6 milhões. O segmento de massa sofreu recuo de 12% nas vendas, para US$ 491,8 milhões. “Embora o quarto trimestre tenha ficado em linha com as expectativas e esperemos um forte calendário de lançamos no ano fiscal de 2026, além do início dos efeitos das nossas mudanças organizacionais, ainda há muito a ser feito”, afirmou a diretora-presidente da Coty no relatório de resultados. A estratégia, segundo a companhia, é focar na posição de liderança no mercado de fragrâncias, que representa mais de 60% das receitas atualmente. O Brasil foi um dos mercados com ganho de participação na perfumaria de luxo, assim como África do Sul, Europa e Oriente Médio. Nos Estados Unidos, a Coty afirma ter registrado desempenho abaixo do mercado. O portfólio de prestígio inclui nomes como oBurberry Goddess, destaque do ano fiscal de 2024, além doFlora Gorgeous Gardenia Intense,daGucci. Para o mercado massivo de maquiagens, o objetivo é aumentar a lucratividade, com detalhes a serem divulgados “nos próximos trimestres”. A companhia reportou nível de alavancagem de 3,5 vezes a razão entre a dívida líquida e o Ebitda ajustado. A antiga participação de 25,8% da companhia naWellarepresentou uma dívida aproximada de US$ 2,75 bilhões. As ações da companhia registravam queda de 13,17% no pós-mercado daNasdaq, a US$ 4,22 por papel. No pregão regular, as ações haviam caído 0,61%, para US$ 4,86. Acompanhe os mercados com nossas ferramentasAcessar gratuitamente Segundo o presidente da Comissão Parlamentar Mista de Inquérito do INSS, o colegiado funcionará duas vezes na semana e o plano de trabalho será apresentado na próxima quinta (28) A Casa também aprovou novo diretor da Agência Nacional de Transportes Terrestres e nova ouvidora da Agência Nacional de Transportes Aquaviários Blogueiro vive nos EUA desde 2020; em outubro de 2021, o ministro Moraes decretou sua prisão preventiva e extradição, mas pedido não foi atendido e seu nome não foi incluído na lista da Interpol Polícia Federal também fez buscas contra pastor Silas Malafaia Pastor está proibido de deixar o Brasil e de manter contato com outros investigados Mais cedo, um aliado de Trump acusou Cook de fraudar dados para financiamentos imobiliários e Trump endossou afirmando que ela deveria renunciar Estratégia, segundo a companhia, é focar na posição de liderança no mercado de fragrâncias, que representa mais de 60% das receitas atualmente Petroleira afirma que tem diversos estudos e análises de possibilidades de negócios nos segmentos de bioprodutos, que incluem as cadeias de etanol A Autoridade Nacional de Segurança Nuclear (ANSN) é uma autarquia federal responsável por monitorar, regular e fiscalizar a segurança nuclear e a proteção radiológica no Brasil",Valor Econômico
https://valor.globo.com/financas/noticia/2025/08/20/stuhlberger-pensamento-de-trump-sobre-poltica-monetria-muito-parecido-com-o-da-gleisi.ghtml,2025-08-20,Stuhlberger: ‘Pensamento de Trump sobre política monetária é muito parecido com o da Gleisi’,"Em alta 20/08/2025 14h34Atualizadoagora O pensamento do presidente dos Estados Unidos, Donald Trump, sobre política monetária e quanto um país deve pagar de juros “é muito parecido” com o de Gleisi Hoffmann (PT), ministra de Relações Institucionais do governo Lula, afirmou Luis Stuhlberger, CIO e CEO da Verde Asset Management. “Qualquer juro que você pague é dinheiro jogado fora”, resumiu o que seria o pensamento de ambos, ao participar de evento do Santander hoje em São Paulo. Para Stuhlberger, com uma popularidade insuficiente e dados macroeconômicos aquém do que Trump gostaria, o “grande trunfo” do mandatário americano deve ser a política monetária. “Acho que ele vai para o ‘all in’ [apostar todas as fichas] no Fed [Federal Reserve, banco central dos EUA] de uma maneira que nunca vimos na vida”, disse, acrescentando que Trump deve “pressionar todos” pelos cortes de juros. Na sua avaliação, Trump deve empurrar os limites. “Acho que Trump vai testar juro real zero”, afirmou. Nesse cenário, gestores de recursos como o próprio Stuhlberger precisam pensar em reservas que não se limitem a moedas, especificamente ao dólar, disse. “Esse movimento vai se acelerar muito”, afirmou. Esse tipo de tese, segundo ele, deve ser levado a sério, mas nem todos a estão colocando nos preços dos ativos ainda. Acompanhe os mercados com nossas ferramentasAcessar gratuitamente Segundo o presidente da Comissão Parlamentar Mista de Inquérito do INSS, o colegiado funcionará duas vezes na semana e o plano de trabalho será apresentado na próxima quinta (28) A Casa também aprovou novo diretor da Agência Nacional de Transportes Terrestres e nova ouvidora da Agência Nacional de Transportes Aquaviários Blogueiro vive nos EUA desde 2020; em outubro de 2021, o ministro Moraes decretou sua prisão preventiva e extradição, mas pedido não foi atendido e seu nome não foi incluído na lista da Interpol Polícia Federal também fez buscas contra pastor Silas Malafaia Pastor está proibido de deixar o Brasil e de manter contato com outros investigados Mais cedo, um aliado de Trump acusou Cook de fraudar dados para financiamentos imobiliários e Trump endossou afirmando que ela deveria renunciar Estratégia, segundo a companhia, é focar na posição de liderança no mercado de fragrâncias, que representa mais de 60% das receitas atualmente Petroleira afirma que tem diversos estudos e análises de possibilidades de negócios nos segmentos de bioprodutos, que incluem as cadeias de etanol A Autoridade Nacional de Segurança Nuclear (ANSN) é uma autarquia federal responsável por monitorar, regular e fiscalizar a segurança nuclear e a proteção radiológica no Brasil",Valor Econômico
https://valor.globo.com/financas/noticia/2025/08/20/petroleo-sobe-apos-queda-maior-do-que-a-esperada-nos-estoques-dos-eua.ghtml,2025-08-20,Petróleo sobe após queda maior do que a esperada nos estoques dos EUA,"Em alta Por Valor— São Paulo 20/08/2025 16h38Atualizadoagora Os contratos futuros dopetróleofecharam em alta nesta quarta-feira (20), após uma queda maior do que a esperada nosestoquesda commodity nosEstados Unidos. Investidores também seguem atentos aos desdobramentos das negociações para umcessar-fogonaUcrânia, já que qualquer perspectiva de avanço deve pesar sobre os preços da commodity. ""A possível flexibilização dassançõessobre opetróleo russocontinua pesando no sentimento do mercado, enquanto o aumento da produção daOpep+também alimenta riscos de queda"", afirma Felipe Barragán, da Pepperstone, em nota. No fechamento, o petróleo tipoBrent(a referência mundial) com vencimento em outubro teve alta de 1,59%, cotado a US$ 66,84 por barril, na Intercontinental Exchange (ICE). Já o petróleoWTI(a referência americana) com entrega prevista para o mesmo mês subiu 1,52%, a US$ 62,71 por barril, na New York Mercantile Exchange (Nymex). Segundo o Departamento de Energia (DoE) dos Estados Unidos, os estoques de petróleo caíram em 6,014 milhões de barris, para 420,684 milhões de barris, na semana encerrada na última sexta (15). O consenso dos analistas consultados pelo “Wall Street Journal” apontava para uma queda de 1,5 milhão de barris. Acompanhe os mercados com nossas ferramentasAcessar gratuitamente Segundo o presidente da Comissão Parlamentar Mista de Inquérito do INSS, o colegiado funcionará duas vezes na semana e o plano de trabalho será apresentado na próxima quinta (28) A Casa também aprovou novo diretor da Agência Nacional de Transportes Terrestres e nova ouvidora da Agência Nacional de Transportes Aquaviários Blogueiro vive nos EUA desde 2020; em outubro de 2021, o ministro Moraes decretou sua prisão preventiva e extradição, mas pedido não foi atendido e seu nome não foi incluído na lista da Interpol Polícia Federal também fez buscas contra pastor Silas Malafaia Pastor está proibido de deixar o Brasil e de manter contato com outros investigados Mais cedo, um aliado de Trump acusou Cook de fraudar dados para financiamentos imobiliários e Trump endossou afirmando que ela deveria renunciar Estratégia, segundo a companhia, é focar na posição de liderança no mercado de fragrâncias, que representa mais de 60% das receitas atualmente Petroleira afirma que tem diversos estudos e análises de possibilidades de negócios nos segmentos de bioprodutos, que incluem as cadeias de etanol A Autoridade Nacional de Segurança Nuclear (ANSN) é uma autarquia federal responsável por monitorar, regular e fiscalizar a segurança nuclear e a proteção radiológica no Brasil",Valor Econômico
https://valor.globo.com/financas/noticia/2025/08/20/moraes-diz-que-bancos-podem-ser-punidos-se-aplicarem-sancoes-dos-eua-a-ativos-brasileiros.ghtml,2025-08-20,Moraes diz que bancos podem ser punidos se aplicarem sanções dos EUA a ativos brasileiros,"Em alta Por Reuters 20/08/2025 14h21Atualizadoagora O ministro doSupremo Tribunal Federal (STF)Alexandre de Moraes, recentemente sancionado pelo governo dos Estados Unidos, disse à agência Reuters que tribunais brasileiros podem punir instituições financeiras nacionais que bloquearem ou confiscarem ativos domésticos em resposta a ordens norte-americanas. Leia mais:CEOs de grandes bancos não comentam desdobramentos da Magnitsky, mas assunto domina rodas de conversasSTF precisará encontrar solução que não coloque sistema financeiro em risco, diz banqueiroMoraes aposta em solução diplomática e espera que Trump revogue sanções contra ele As declarações foram dadas em meio a um impasse quederrubaram as ações de bancos brasileiros, que ficaram em meio a sanções norte-americanas e ordens do STF. Em entrevista na noite de terça-feira, em seu gabinete em Brasília, Moraes reconheceu que a atuação da Justiça dos EUA em relação aos bancos brasileiros que têm operações nos Estados Unidos ""é da aplicação da lei norte-americana"". ""Agora, da mesma forma, se os bancos resolverem aplicar a lei internamente, eles não podem. E aí eles podem ser penalizados internamente"", acrescentou. As declarações de Moraes apontam para as possíveis consequências da decisão de segunda-feira do ministro do STF Flávio Dino, que alertou que leis estrangeiras não podem ser automaticamente aplicadas no Brasil. Essa decisão foi seguida por uma dura repreensão do Escritório de Assuntos do Hemisfério Ocidental do Departamento de Estado dos EUA que, horas depois, alertou nas redes sociais que Moraes era “tóxico” e alertou que ""pessoas que não são dos EUA devem ter cautela: aquelas que fornecerem apoio material a violadores de direitos humanos correm o risco de também serem sancionadas"". O Departamento do Tesouro dos EUA sancionou Moraes no mês passado com base em uma lei criada para impor penalidades econômicas a estrangeiros considerados corruptos ou violadores de direitos humanos. A ordem acusou-o de suprimir a liberdade de expressão e liderar processos politizados, incluindo contra o ex-presidente Jair Bolsonaro, um aliado fiel de Trump que será julgado em breve pelo Supremo por supostamente tramar um golpe para reverter sua derrota nas eleições de 2022. Bolsonaro nega ter cometido qualquer crime e diz ser alvo de perseguição política. Na entrevista, Moraes afirmou que decisões de tribunais e governos estrangeiros só podem ter efeito no Brasil após validação por meio de um processo doméstico. Segundo ele, portanto, não é possível confiscar bens, congelar fundos ou bloquear propriedades de cidadãos brasileiros sem seguir esses trâmites legais. O alcance global do sistema financeiro dos EUA faz com que bancos estrangeiros frequentemente restrinjam uma gama mais ampla de transações para evitar sanções secundárias. Embora tenha afirmado que o uso da Lei Magnitsky tenha sido ""totalmente equivocado"" contra ele, Moraes disse estar confiante de que conseguirá reverter as sanções contra ele por meio de canais diplomáticos ou de uma eventual contestação nos tribunais dos EUA. Mas reconheceu que, por ora, elas colocaram instituições financeiras em uma situação difícil. ""Esse desvio de finalidade na aplicação da lei coloca até instituições financeiras em uma situação difícil. E não são só instituições financeiras brasileiras, mas são seus parceiros norte-americanos, são empresas norte-americanas que atuam no Brasil e também têm contas, investimentos, financiamentos de bancos brasileiros"", disse. ""Exatamente por isso que é importante, eu repito, o canal diplomático para que isso seja logo solucionado para não desvirtuar a aplicação de uma lei que é importante contra o terrorismo, contra organizações criminosas, contra o tráfico internacional de drogas, contra o tráfico internacional de seres humanos"", acrescentou. O Departamento de Estado não respondeu de imediato a um pedido de comentário. Um porta-voz do Tesouro afirmou que Moraes ""cometeu sérios abusos contra os direitos humanos"". Acompanhe os mercados com nossas ferramentasAcessar gratuitamente A Casa também aprovou novo diretor da Agência Nacional de Transportes Terrestres e nova ouvidora da Agência Nacional de Transportes Aquaviários Blogueiro vive nos EUA desde 2020; em outubro de 2021, o ministro Moraes decretou sua prisão preventiva e extradição, mas pedido não foi atendido e seu nome não foi incluído na lista da Interpol Polícia Federal também fez buscas contra pastor Silas Malafaia Pastor está proibido de deixar o Brasil e de manter contato com outros investigados Mais cedo, um aliado de Trump acusou Cook de fraudar dados para financiamentos imobiliários e Trump endossou afirmando que ela deveria renunciar Estratégia, segundo a companhia, é focar na posição de liderança no mercado de fragrâncias, que representa mais de 60% das receitas atualmente Petroleira afirma que tem diversos estudos e análises de possibilidades de negócios nos segmentos de bioprodutos, que incluem as cadeias de etanol A Autoridade Nacional de Segurança Nuclear (ANSN) é uma autarquia federal responsável por monitorar, regular e fiscalizar a segurança nuclear e a proteção radiológica no Brasil Na terça-feira, os papéis do setor bancário recuaram de maneira expressiva, após a determinação do ministro contra a aplicação imediata no Brasil de leis, decisões judiciais, ordens executivas e atos administrativos estrangeiros",Valor Econômico
https://valor.globo.com/brasil/noticia/2025/08/20/governadores-do-rio-e-bahia-defendem-sistema-unico-de-seguranca-publica-para-combater-violencia-no-pais.ghtml,2025-08-20,Governadores do Rio e Bahia defendem sistema único de segurança pública para combater violência no país,"20/08/2025 14h41Atualizadohá 3 horas Os governadoresJerônimo Rodrigues (PT), da Bahia, eCláudio Castro (PL), do Rio de Janeiro, defenderam a existência de um sistema único de segurança pública (Susp) no Brasil para combater a violência. No debate “Diálogos”, promovido pelo jornal “O Globo” nesta quarta-feira (20), os dois chefes de Executivo estadual afirmaram que a criminalidade “evoluiu” e, por isso, é preciso haver uma coordenação entre as diferentes instâncias brasileiras para combatê-la. Acompanhe os mercados com nossas ferramentasAcessar gratuitamente Segundo o presidente da Comissão Parlamentar Mista de Inquérito do INSS, o colegiado funcionará duas vezes na semana e o plano de trabalho será apresentado na próxima quinta (28) A Casa também aprovou novo diretor da Agência Nacional de Transportes Terrestres e nova ouvidora da Agência Nacional de Transportes Aquaviários Blogueiro vive nos EUA desde 2020; em outubro de 2021, o ministro Moraes decretou sua prisão preventiva e extradição, mas pedido não foi atendido e seu nome não foi incluído na lista da Interpol Polícia Federal também fez buscas contra pastor Silas Malafaia Pastor está proibido de deixar o Brasil e de manter contato com outros investigados Mais cedo, um aliado de Trump acusou Cook de fraudar dados para financiamentos imobiliários e Trump endossou afirmando que ela deveria renunciar Estratégia, segundo a companhia, é focar na posição de liderança no mercado de fragrâncias, que representa mais de 60% das receitas atualmente Petroleira afirma que tem diversos estudos e análises de possibilidades de negócios nos segmentos de bioprodutos, que incluem as cadeias de etanol A Autoridade Nacional de Segurança Nuclear (ANSN) é uma autarquia federal responsável por monitorar, regular e fiscalizar a segurança nuclear e a proteção radiológica no Brasil",Valor Econômico
