url,data,titulo,texto,fonte
https://valor.globo.com/politica/noticia/2025/06/23/pedro-paulo-espera-que-regulamentacao-do-ibs-seja-votada-antes-do-recesso-parlamentar.ghtml,2025-06-23,Pedro Paulo espera que regulamentação do IBS seja votada antes do recesso parlamentar,"23/06/2025 14h53Atualizado23/06/2025 O deputado federalPedro Paulo (PSD-RJ)afirmou que o projeto de lei 108, que complementa areforma tributáriaaprovada em 2024, pode ser votado antes do recesso parlamentar, que começa em 18 de julho e vai até 31 de agosto. O projeto de lei está em discussão no Senado e, em abril, o relator e líder do MDB na Casa,Eduardo Braga (MDB-AM), tinha previsto concluir a votação da matéria no início de junho. Entre os pontos do projeto de lei está a criação do Comitê Gestor do Imposto sobre Bens e Serviços (IBS), que será responsável por distribuir os recursos da União para Estados e municípios. A principal instância desse grupo é o conselho superior, formado por 27 representantes de governadores e 27 de prefeitos. Pedro Paulo, que é vice-líder do governo na Câmara dos Deputados, disse que a discussão sobre a proposta foi destravada nas últimas semanas a partir de um acordo que vem sendo construído entre a Confederação Nacional dos Municípios (CMN) e a Frente Nacional dos Prefeitos e Prefeitas (FNP). O entendimento prevê que a CNM escolherá 14 membros e a FNP 13 participantes, além da garantia de quadros técnicos e secretários de Fazenda no colegiado. Segundo o parlamentar, o acordo foi incluído “de forma literal” na emenda apresentada pelo senadorOtto Alencar (PSD-BA). “O que faltava era esse acordo entre as duas associações, que avançou bem. Então eu acho que isso vai destravar a finalização da votação no Senado e vai espelhar esse acordo na Câmara”, afirmou ao Valor, após participar do evento “Desafios da reforma tributária: como se preparar para as novas regras”, na sede da Federação das Indústrias do Estado do Rio de Janeiro (Firjan), com realização da Editora Globo. O deputado acredita que o acordo será aprovado ""logo"" para que o PL possa ser votado antes do recesso parlamentar: “Não tem porque demorar mais. Tenho esperança de que isso possa ser votado antes do recesso. Tem que aprovar logo”, disse. Ele também minimizou o impacto da discussão sobre medidas alternativas ao aumento do Imposto sobre Operações Financeiras (IOF) no debate legislativo da reforma. “A reforma tributária já foi. A gente está na fase final de resolver brigadeiro ou cajuzinho, só pouca coisa, residual”, declarou. Na apresentação, o deputado federal afirmou que o orçamento federal está em direção a um colapso porque o atual governo Lula (PT) não foi capaz de realizar um ""choque de credibilidade fiscal"". ""O governo petista é um dos mais competentes para produzir boas políticas sociais e ninguém tem dúvida de que o Bolsa Família é um belo programa. Mas o atual governo precisava dar um choque de credibilidade fiscal e não fez isso. Por isso vamos ter esse colapso das contas públicas"", afirmou. O deputado citou a taxa básica de juros, a Selic, fixada em 15% na última reunião do Comitê de Política Monetária (Copom) e a inflação, para argumentar que o “desajuste fiscal” está contaminando os resultados e afetando os esforços do governo e da sociedade. ""Esse desajuste fiscal está contaminando todos os esforços feitos pela sociedade e até pelo governo. É preciso fazer algo para que ao menos se construa esse ambiente. Quanto mais demorar, mais custoso será para a sociedade.” Acompanhe os mercados com nossas ferramentasAcessar gratuitamente Decisão permite que governo Trump retome as deportações de imigrantes para países que não sejam os seus de origem Neto. Na prática, a autoridade monetária irá vender dólares no mercado à vista e reduzir a posição de swap, que, no momento, é vendida em dólar Também foi aprovada a venda de 24% das unidades de futuro empreendimento residencial no complexo Market Place e de 16,7% do empreendimento comercial no complexo Galleria Um decreto determinou o bloqueio de R$ 34,8 milhões do orçamento da Agência Nacional do Petróleo, Gás Natural e Biocombustíveis Revisão do regulamento do Novo Mercado visa o aperfeiçoamento das regras que as empresas com o maior nível de governança corporativa devem seguir Movimento do ex-prefeito de Ribeirão Preto turbina planos de Kassab para 2026 Informações são resposta a procedimentos para averiguar se tenente-coronel fez uso indevido de redes sociais A vitória também depende de soluções de baixa tecnologia — e da integração rápida e econômica das duas Segundo ele, os países irão cumprir suas “missões finais” antes de iniciar a pausa nos combates O Brasil poderia tirar melhor proveito do cenário externo favorável de queda do dólar e do spread entre ativos americanos e bônus emergentes se tivesse feito um ajuste fiscal eficaz e convincente",Valor Econômico
https://valor.globo.com/brasil/noticia/2025/06/23/firjan-celebra-avanco-significativo-com-reforma-tributaria-mas-pede-outras-reformas-estruturantes.ghtml,2025-06-23,"Firjan celebra avanço 'significativo' com reforma tributária, mas pede outras reformas estruturantes","23/06/2025 14h47Atualizado23/06/2025 O presidente da Federação das Indústrias do Estado do Rio de Janeiro (Firjan), Luiz Césio Caetano, celebrou nesta segunda-feira (23) “o avanço significativo” trazido pela reforma tributária para a economia brasileira e os investimentos no país, mas destacou a necessidade de outras reformas estruturantes, como a administrativa. “As novas normas representam significativo avanço no recolhimento de tributos. [...] A reforma tributária dá transparência, neutralidade e isonomia aos diversos setores da economia. O IBS [Imposto sobre Bens e Serviços] torna-se antídoto para a famigerada guerra fiscal que por anos a fio orientou decisões de investimento no país”, afirmou ele. Em sua participação no evento “Desafios da reforma tributária: como se preparar para as novas regras”, na sede da Firjan e com realização da Editora Globo, Caetano defendeu que se dê prioridade à segurança pública e jurídica no país, para aumentar a capacidade de atração de investimentos. Quem não se preparou já está atrasado, diz Appy sobre transição da reforma tributária para empresasAppy nega que haverá mais de uma fiscalização em paralelo para a mesma empresa no novo sistema tributárioAppy prevê que projeto de lei que regulamenta IBS será aprovado nos próximos meses Além disso, citou a importância de uma reforma administrativa. Com elevado comprometimento do orçamento público em despesas com pessoal, notou ele, há “má alocação de recursos e penalização dos investimentos”. “Sem reformas estruturantes, a competitividade estará cada vez mais comprometida e estaremos perpetuando má qualidade da prestação de serviços em segurança, saúde e educação”, disse. Na sua avaliação, o Rio de Janeiro tende a ganhar com a atual reforma tributária, como segundo maior Estado consumidor do país. “O Rio de Janeiro tem condições de se beneficiar com a nova reforma tributária. É o segundo maior Estado consumidor, dispõe de uma das maiores redes de ensino técnico do país... Mas precisamos melhorar nossa infraestrutura de portos, avançar em reformas”, afirmou. Acompanhe os mercados com nossas ferramentasAcessar gratuitamente Decisão permite que governo Trump retome as deportações de imigrantes para países que não sejam os seus de origem Neto. Na prática, a autoridade monetária irá vender dólares no mercado à vista e reduzir a posição de swap, que, no momento, é vendida em dólar Também foi aprovada a venda de 24% das unidades de futuro empreendimento residencial no complexo Market Place e de 16,7% do empreendimento comercial no complexo Galleria Um decreto determinou o bloqueio de R$ 34,8 milhões do orçamento da Agência Nacional do Petróleo, Gás Natural e Biocombustíveis Revisão do regulamento do Novo Mercado visa o aperfeiçoamento das regras que as empresas com o maior nível de governança corporativa devem seguir Movimento do ex-prefeito de Ribeirão Preto turbina planos de Kassab para 2026 Informações são resposta a procedimentos para averiguar se tenente-coronel fez uso indevido de redes sociais A vitória também depende de soluções de baixa tecnologia — e da integração rápida e econômica das duas Segundo ele, os países irão cumprir suas “missões finais” antes de iniciar a pausa nos combates O Brasil poderia tirar melhor proveito do cenário externo favorável de queda do dólar e do spread entre ativos americanos e bônus emergentes se tivesse feito um ajuste fiscal eficaz e convincente",Valor Econômico
https://valor.globo.com/financas/noticia/2025/06/23/kiara-capital-levanta-us-15-mi-para-fundo-de-estreia-objetivo-chegar-a-us-30-mi.ghtml,2025-06-23,Kiara Capital levanta US$ 15 mi para fundo de estreia; objetivo é chegar a US$ 40 mi,"Em alta 23/06/2025 16h57Atualizado23/06/2025 A gestora de venture capital (investimento em startups) Kiara Capital anunciou que conseguiu levantar US$ 15 milhões neste mês, na primeira fase da captação de seu fundo de estreia. O foco é em fintechs B2B com atuação em Brasil, América Latina e operações ""cross border"" nos Estados Unidos, ou seja, americanas que miram fazer negócios fora do país ou de outras nacionalidades entrando nos EUA. O objetivo é chegar a US$ 40 milhões. Acompanhe os mercados com nossas ferramentasAcessar gratuitamente Decisão permite que governo Trump retome as deportações de imigrantes para países que não sejam os seus de origem Neto. Na prática, a autoridade monetária irá vender dólares no mercado à vista e reduzir a posição de swap, que, no momento, é vendida em dólar Também foi aprovada a venda de 24% das unidades de futuro empreendimento residencial no complexo Market Place e de 16,7% do empreendimento comercial no complexo Galleria Um decreto determinou o bloqueio de R$ 34,8 milhões do orçamento da Agência Nacional do Petróleo, Gás Natural e Biocombustíveis Revisão do regulamento do Novo Mercado visa o aperfeiçoamento das regras que as empresas com o maior nível de governança corporativa devem seguir Movimento do ex-prefeito de Ribeirão Preto turbina planos de Kassab para 2026 Informações são resposta a procedimentos para averiguar se tenente-coronel fez uso indevido de redes sociais A vitória também depende de soluções de baixa tecnologia — e da integração rápida e econômica das duas Segundo ele, os países irão cumprir suas “missões finais” antes de iniciar a pausa nos combates O Brasil poderia tirar melhor proveito do cenário externo favorável de queda do dólar e do spread entre ativos americanos e bônus emergentes se tivesse feito um ajuste fiscal eficaz e convincente",Valor Econômico
https://valor.globo.com/mundo/noticia/2025/06/23/trump-diz-que-israel-e-ir-concordaram-com-um-cessar-fogo.ghtml,2025-06-23,Trump diz que Israel e Irã concordaram com um cessar-fogo,"Por Valor— São Paulo 23/06/2025 19h19Atualizado23/06/2025 Opresidente dos Estados Unidos, Donald Trump, disse, nesta segunda-feira (23), em publicação na sua rede social, queIsrael e Irãconcordaram com um cessar-fogo no conflito que já dura 12 dias. Segundo ele, os países irão cumprir suas “missões finais” antes de iniciar a pausa nos combates. “Foi totalmente acordado entre Israel e Irã que haverá um CESSAR-FOGO COMPLETO E TOTAL (em aproximadamente 6 horas a partir de agora, quando Israel e Irã concluírem suas missões finais em andamento!), por 12 horas, momento em que a guerra será considerada ENCERRADA!”, disse Trump em seu perfil na Truth Social. “Oficialmente, o Irã iniciará o CESSAR-FOGO e, após a 12ª hora, Israel iniciará o CESSAR-FOGO e, após a 24ª hora, o FIM OFICIAL DA GUERRA DE 12 DIAS será saudado pelo mundo.” Mais cedo, Trump disse que incentivaria Israel a avançar em direção a uma solução pacífica para o conflito após minimizar o ataque do Irã a uma base aérea americana, que não causou feridos. Ele também agradeceu o governo de Teerã pelo aviso prévio, que permitiu que a base fosse evacuada. Segundo o presidente americano, o Irã lançou 14 mísseis contra a base aérea de Al-Udeid. Do total, 13 foram interceptados e um foi ""liberado"" por não representar uma ameaça ao local. Na mensagem na Truth Social, Trump classificou a resposta iraniana como ""muito fraca"". Fontes ouvidas pela imprensa americana já haviam informado que o Irã avisou tanto aos EUA como o Catar do ataque, com o objetivo de minimizar eventuais danos e impedir a escalada do conflito. O regime, porém, precisava dar uma resposta aos americanos após os ataques contra as instalações nucleares de Natanz, Fordow e Isfahan. ""PARABÉNS A TODOS! Foi totalmente acordado entre Israel e Irã que haverá um CESSAR-FOGO Completo e Total (em aproximadamente 6 horas a partir de agora, quando Israel e Irã concluírem suas missões finais em andamento!), por 12 horas, momento em que a guerra será considerada ENCERRADA! Oficialmente, o Irã iniciará o CESSAR-FOGO e, após a 12ª hora, Israel iniciará o CESSAR-FOGO e, após a 24ª hora, o FIM OFICIAL DA GUERRA DE 12 DIAS será saudado pelo mundo. Durante cada período de CESSAR-FOGO, o outro lado deverá manter-se PACÍFICO e RESPEITOSO. Partindo do princípio de que tudo ocorrerá como deve, e assim será, gostaria de parabenizar ambos os países, Israel e Irã, pela resistência, coragem e inteligência em pôr fim ao que deve ser chamado de “GUERRA DE 12 DIAS.” Esta foi uma guerra que poderia ter durado anos e destruído todo o Oriente Médio — mas não durou, e nunca durará! Deus abençoe Israel, Deus abençoe o Irã, Deus abençoe o Oriente Médio, Deus abençoe os Estados Unidos da América, e DEUS ABENÇOE O MUNDO!"" Acompanhe os mercados com nossas ferramentasAcessar gratuitamente Decisão permite que governo Trump retome as deportações de imigrantes para países que não sejam os seus de origem Neto. Na prática, a autoridade monetária irá vender dólares no mercado à vista e reduzir a posição de swap, que, no momento, é vendida em dólar Também foi aprovada a venda de 24% das unidades de futuro empreendimento residencial no complexo Market Place e de 16,7% do empreendimento comercial no complexo Galleria Um decreto determinou o bloqueio de R$ 34,8 milhões do orçamento da Agência Nacional do Petróleo, Gás Natural e Biocombustíveis Revisão do regulamento do Novo Mercado visa o aperfeiçoamento das regras que as empresas com o maior nível de governança corporativa devem seguir Movimento do ex-prefeito de Ribeirão Preto turbina planos de Kassab para 2026 Informações são resposta a procedimentos para averiguar se tenente-coronel fez uso indevido de redes sociais A vitória também depende de soluções de baixa tecnologia — e da integração rápida e econômica das duas Segundo ele, os países irão cumprir suas “missões finais” antes de iniciar a pausa nos combates O Brasil poderia tirar melhor proveito do cenário externo favorável de queda do dólar e do spread entre ativos americanos e bônus emergentes se tivesse feito um ajuste fiscal eficaz e convincente",Valor Econômico
https://valor.globo.com/politica/noticia/2025/06/23/lira-apresenta-parecer-favoravel-a-projeto-que-atualiza-tabela-mensal-do-imposto-de-renda.ghtml,2025-06-23,Lira apresenta parecer favorável a projeto que atualiza tabela mensal do Imposto de Renda,"23/06/2025 15h07Atualizado23/06/2025 O relator do projeto de lei 2.692/2025, deputadoArthur Lira (PP-AL), apresentou nesta segunda-feira (23) parecer favorável ao projeto que propõe aatualização dos valores da tabelaprogressiva mensal do Imposto de Renda da Pessoa Física (IRPF). O texto incorpora o conteúdo da Medida Provisória (MP) 1.294/2025 e amplia o limite daprimeira faixa de isenção de R$ 2.259,20 para R$ 2.428,80.Na prática, contribuintes que recebem até R$ 3.036,00 por mês continuarão isentos, considerando o desconto simplificado. A estimativa de renúncia fiscal é de R$ 3,29 bilhões em 2025, R$ 5,34 bilhões em 2026 e R$ 5,73 bilhões em 2027, segundo a Receita Federal. O texto já teve o regime de urgência aprovado pelos deputados e poderá ser votado diretamente no Plenário da Casa. O projeto é diferente do PL 1.087/2025 – também relatado por Lira – que trata de uma reforma mais ampla do IRPF e prevê, entre outras medidas, a ampliação da faixa de isenção para quem ganha até R$ 5 mil mensais. No parecer apresentado nesta segunda-feira, o presidente da Câmara argumenta que, embora o reajuste da tabela proposto no PL 2.692/2025 gere uma renúncia fiscal em 2025, as medidas compensatórias previstas no PL 1.087/2025 neutralizam as perdas nos anos seguintes, resultando, no mínimo, em um impacto fiscal neutro a partir de 2026. “A ausência de uma correção plena e tempestiva da tabela do IRPF, ao longo de sucessivos exercícios, impôs aos cidadãos, notadamente àqueles de menor capacidade econômica, uma forma perversa e silenciosa de aumento da carga tributária”, afirma o relator no parecer. O ex-presidente da Câmara reconhece, no entanto, que a defasagem histórica da tabela do IRPF exige um debate mais profundo e estrutural, que o Congresso pretende enfrentar “em momento oportuno e com a devida responsabilidade”. Lira ressalta que a proposta atual tem caráter pontual e busca sanar o efeito mais imediato e nocivo da defasagem. Na proposta do PL 1.087/2025, o governo sugere, como uma das medidas compensatórias, a criação de um imposto mínimo de até 10% para quem ganha mais de R$ 50 mil por mês. A discussão sobre a compensação é hoje o principal ponto de polêmica na comissão especial criada para deliberar sobre o tema e um dos focos de atuação de Lira. Segundo o plano de trabalho apresentado pelo relator, a expectativa é de que ele apresente seu parecer até o fim de junho. Acompanhe os mercados com nossas ferramentasAcessar gratuitamente Decisão permite que governo Trump retome as deportações de imigrantes para países que não sejam os seus de origem Neto. Na prática, a autoridade monetária irá vender dólares no mercado à vista e reduzir a posição de swap, que, no momento, é vendida em dólar Também foi aprovada a venda de 24% das unidades de futuro empreendimento residencial no complexo Market Place e de 16,7% do empreendimento comercial no complexo Galleria Um decreto determinou o bloqueio de R$ 34,8 milhões do orçamento da Agência Nacional do Petróleo, Gás Natural e Biocombustíveis Revisão do regulamento do Novo Mercado visa o aperfeiçoamento das regras que as empresas com o maior nível de governança corporativa devem seguir Movimento do ex-prefeito de Ribeirão Preto turbina planos de Kassab para 2026 Informações são resposta a procedimentos para averiguar se tenente-coronel fez uso indevido de redes sociais A vitória também depende de soluções de baixa tecnologia — e da integração rápida e econômica das duas Segundo ele, os países irão cumprir suas “missões finais” antes de iniciar a pausa nos combates O Brasil poderia tirar melhor proveito do cenário externo favorável de queda do dólar e do spread entre ativos americanos e bônus emergentes se tivesse feito um ajuste fiscal eficaz e convincente",Valor Econômico
https://valor.globo.com/politica/noticia/2025/06/23/ccj-da-camara-abre-prazo-para-que-zambelli-apresente-defesa-em-processo-sobre-perda-do-mandato.ghtml,2025-06-23,CCJ da Câmara abre prazo para que Zambelli apresente defesa em processo sobre perda do mandato,"23/06/2025 16h03Atualizado23/06/2025 A Comissão de Constituição e Justiça (CCJ) da Câmara abriu prazo, nesta segunda-feira (23), para que a deputadaCarla Zambelli(PL-SP) apresente sua defesa no processo que pode resultar na cassação de seu mandato. A deputada tem até cinco sessões do plenário para apresentar defesa e indicar eventuais provas. A contagem dessas sessões vai começar nesta terça-feira (24). Encerrado o prazo, o colegiado tem mais cinco sessões para que o relator entregue seu parecer, que recomendará a cassação ou a manutenção do mandato. Uma vez votado, o documento é encaminhado ao plenário, onde os 513 deputados votam.Para que a cassação seja decretada é necessária maioria absoluta dos votos, ou seja, pelo menos 257 deputados devem se manifestar nesse sentido. Zambellifoi condenada pela Primeira Turma do Supremo Tribunal Federal (STF) a dez anos de prisão por se associar ao hackerWalter Delgatti Netopara invadir os sistemas do Conselho Nacional de Justiça (CNJ) e adulterar documentos. A condenação ocorreu em maio e a deputada fugiu para a Itália, país onde tem cidadania. No começo do mês, já comZambellifora do país, a Primeira Turma rejeitou recurso da deputada, manteve a condenação por unanimidade de votos, e determinou o trânsito em julgado da ação (quando não é mais possível recorrer). A Constituição determina que um parlamentar condenado criminalmente com sentença transitada em julgado perderá o mandato. O presidente da Câmara,Hugo Motta(Republicanos-PB), chegou a afirmar publicamente que não havia mais o que se feito na Câmara em relação a Zambelli e que daria cumprimento à decisão do STF. Mas voltou atrás após pressão de deputados bolsonaristas e decidiu levar o caso ao plenário da Casa. Bloqueio de verbas para gabinete Neste mês, Motta bloqueou o salário e as verbas para o gabinete de Zambelli. A medida também atende determinação doSTF. Ao condenar a deputada a 10 anos de prisão, aPrimeira Turmatambém determinou o bloqueio dos vencimentos e ""quaisquer outras verbas, inclusive destinadas ao gabinete"". O objetivo da medida é garantir o pagamento de uma multa que foi imposta na condenação. O valor pode chegar a R$ 260 mil. Acompanhe os mercados com nossas ferramentasAcessar gratuitamente Decisão permite que governo Trump retome as deportações de imigrantes para países que não sejam os seus de origem Neto. Na prática, a autoridade monetária irá vender dólares no mercado à vista e reduzir a posição de swap, que, no momento, é vendida em dólar Também foi aprovada a venda de 24% das unidades de futuro empreendimento residencial no complexo Market Place e de 16,7% do empreendimento comercial no complexo Galleria Um decreto determinou o bloqueio de R$ 34,8 milhões do orçamento da Agência Nacional do Petróleo, Gás Natural e Biocombustíveis Revisão do regulamento do Novo Mercado visa o aperfeiçoamento das regras que as empresas com o maior nível de governança corporativa devem seguir Movimento do ex-prefeito de Ribeirão Preto turbina planos de Kassab para 2026 Informações são resposta a procedimentos para averiguar se tenente-coronel fez uso indevido de redes sociais A vitória também depende de soluções de baixa tecnologia — e da integração rápida e econômica das duas Segundo ele, os países irão cumprir suas “missões finais” antes de iniciar a pausa nos combates O Brasil poderia tirar melhor proveito do cenário externo favorável de queda do dólar e do spread entre ativos americanos e bônus emergentes se tivesse feito um ajuste fiscal eficaz e convincente",Valor Econômico
https://valor.globo.com/empresas/noticia/2025/06/23/ft-a-aposta-de-us-14-bi-da-meta-em-um-jovem-de-28-anos.ghtml,2025-06-23,FT: A aposta de US$ 14 bi da Meta em um jovem de 28 anos,"23/06/2025 17h03Atualizado23/06/2025 Ochefe da Meta, Mark Zuckerberg,está apostando mais de US$ 14 bilhões em um jovem bem relacionado de 28 anos.A aposta é que ele seja o catalisador de que sua empresa precisa para alcançar as rivais na corrida para desenvolver e comercializar ainteligência artificial (IA). Acompanhe os mercados com nossas ferramentasAcessar gratuitamente Decisão permite que governo Trump retome as deportações de imigrantes para países que não sejam os seus de origem Neto. Na prática, a autoridade monetária irá vender dólares no mercado à vista e reduzir a posição de swap, que, no momento, é vendida em dólar Também foi aprovada a venda de 24% das unidades de futuro empreendimento residencial no complexo Market Place e de 16,7% do empreendimento comercial no complexo Galleria Um decreto determinou o bloqueio de R$ 34,8 milhões do orçamento da Agência Nacional do Petróleo, Gás Natural e Biocombustíveis Revisão do regulamento do Novo Mercado visa o aperfeiçoamento das regras que as empresas com o maior nível de governança corporativa devem seguir Movimento do ex-prefeito de Ribeirão Preto turbina planos de Kassab para 2026 Informações são resposta a procedimentos para averiguar se tenente-coronel fez uso indevido de redes sociais A vitória também depende de soluções de baixa tecnologia — e da integração rápida e econômica das duas Segundo ele, os países irão cumprir suas “missões finais” antes de iniciar a pausa nos combates O Brasil poderia tirar melhor proveito do cenário externo favorável de queda do dólar e do spread entre ativos americanos e bônus emergentes se tivesse feito um ajuste fiscal eficaz e convincente",Valor Econômico
