url,data,titulo,texto,fonte
https://exame.com/pop/aplicativos-de-jogos-na-india-suspendem-partidas-com-dinheiro-apos-nova-proibicao/,2025-08-22,Aplicativos de jogos na Índia suspendem partidas com dinheiro após nova proibição,"Mercado de jogos online sofre impacto após veto a partidas com dinheiro na Índia (Joédson Alves/Agência Brasil) Redatora Publicado em22 de agosto de 2025 às17h54. Última atualização em22 de agosto de 2025 às18h17. Alguns dos principais aplicativos dejogos onlineda Índia interromperam suas operações envolvendo dinheiro real depois que o parlamento aprovou, na última quinta-feira, 21, umaproibição nacionalsobre esse tipo de atividade. A medida afeta plataformas apoiadas por grandesfundos de investimentoe coloca em risco um mercado que tinha previsão de atingir US$ 3,6 bilhões até 2029. Entre os aplicativos que suspenderam jogos com dinheiro real estãoDream11, PokerBaazi e Mobile Premier League, segundo comunicados das empresas e divulgado pela Reuters. O governo do primeiro-ministroNarendra Modijustificou a decisão afirmando que jogos com dinheiro real representamriscos financeiroselevados e podem causar danos psicológicos aos usuários. A proibição também inclui anúncios e serviços de pagamento relacionados. A notícia provocou forte queda nas ações da Nazara Technologies, que tem participação de 46,07% na Moonshine Technologies, controladora do PokerBaazi. Os papéis da companhia recuaram 17% em três pregões consecutivos. Empresas do setor avaliam recorrer à Suprema Corte indiana, alegando falta de consulta prévia na formulação da regra e questionando a inclusão de modalidades com base em habilidade, como o pôquer, dentro do escopo da proibição. O remake de ‘Vale Tudo’ está na sua reta final e deve chegar ao fim nos próximos meses Elenco conta com estrelas como Sandra Bullock, Regina King, Enrique Murciano, Ernie Hudson, entre outros Filme premiado chegou ao streaming na última semana Edição limitada da Pop Mart dispara no mercado de colecionáveis e atrai lances de cinco dígitos 01 02 03 exame no whatsapp Receba as notícias da Exame no seu WhatsApp Receba a melhor curadoria para seus momentos casuais. E-mail inválido Casual",Exame
https://exame.com/economia/linha-de-credito-de-r-30-bi-para-exportadores-afetados-pelo-tarifaco-tera-juros-de-ate-082-ao-mes/,2025-08-22,"Linha de crédito de R$ 30 bi para exportadores afetados pelo tarifaço terá juros de até 0,82% ao mês","Repórter de Brasil e Economia Publicado em22 de agosto de 2025 às17h44. Última atualização em22 de agosto de 2025 às18h14. As linhas de crédito no valor de R$ 30 bilhões para exportadores impactados pelo aumento de tarifas de50% imposto pelos Estados Unidosanunciadas pelo governo do presidente Luiz Inácio Lula da Silva (PT) serão direcionadas a empresas cujo impacto no faturamento seja maior ou igual a 5%. Serão oferecidas quatro modalidades de crédito, com juros que variam entre 0,58% e 0,82% ao mês. O plano Brasil Soberano foi detalhado nesta sexta-feira, 22. O evento ocorreu na sede do Banco Nacional de Desenvolvimento Econômico e Social (BNDES), e contou com a participação de Aloizio Mercadante, presidente do Banco, Guilherme Mello, secretário de Política Econômica do Ministério da Fazenda, e Uallace Moreira, secretário de Desenvolvimento Industrial, Inovação, Comércio e Serviços do Ministério do Desenvolvimento, Indústria, Comércio e Serviços (MDIC). O BNDES será o agente financeiro da linha de financiamento que vai utilizar os R$ 30 bilhões do Fundo de Garantia à Exportação (FGE) como fonte de recursos (funding), podendo habilitar outros agentes financeiros para atuar nas operações de repasse, que assumirão os riscos das operações. De acordo com o plano, as empresas com percentual de faturamento bruto proveniente de exportações de produtos impactados igual ou superior a 20% do faturamento total poderão acessar linhas de financiamento com condições mais favoráveis, especialmente as MPMEs. Para quem tem impacto maior ou igual a 5%, as empresas podem acessar a linha Giro Diversificação e a garantia do Peac FGI (no caso das micro e pequenas empresas). No caso das garantias do Programa Emergencial de Acesso a Crédito (Peac-FGI Solidário), apenas empresas com faturamento bruto anual de até R$ 300 milhões no ano anterior à contratação (MPMEs) terão acesso. As empresas beneficiadas com as linhas de créditodeverão comprovar a manutenção do número de empregos.O cálculo do impacto será apurado no período de julho de 2024 a junho de 2025. De acordo com o BNDES, as empresas terão acesso a quatro linhas de crédito: Capital de Giro:financiamento de gastos operacionais gerais Giro Diversificação: financiamento para busca de novos mercados Valor máximo por empresa somadas as duas linhas de crédito: até R$ 35 milhões (MPMEs) e até R$ 200 milhões (Grandes). Bens de Capital:aquisição de máquinas e equipamentos Investimento:inovação tecnológica, adaptação da atividade produtiva de produtos, de serviços e de processos, e alongamento da cadeia produtiva Além dos R$ 30 bilhões, o BNDES ofertará R$ 10 bilhões em linhas próprias do banco. As empresas com produtos tarifados pelos EUA (qualquer percentual de tarifa) de todos os portes terão acesso. Giro Emergencial Complementar:financiamento para gastos operacionais gerais; Giro Diversificação Complementar:financiamento para busca de novos mercados Pronampe FGO: R$ 1 bilhão que poderá alavancar em torno de R$ 2,5 bilhões. Peac FGI – Solidário: R$ 2 bilhões que poderão alavancar em torno de R$ 20 bilhões. Quem poderá acessar: MPMEs cujo valor das exportações aos EUA impactadas pela tarifa de 50% somem pelo menos 5% do faturamento bruto total. Garantias: os fundos poderão garantir financiamentos com recursos incentivados do FGE, bem como recursos livres do Sistema Financeiro Nacional. Certame foi realizado nesta manhã em cerimônia na cidade de São Paulo Mercadante sugere que as empresas se preparem e trabalhem com os bancos comerciais para acelerar o desembolso Banco de fomento divulgou dados do desempenho operacional e do resultado financeiro nesta quinta-feira Tarifa de 50% sobre itens brasileiros entrou em vigor há duas semanas 01 02 exame no whatsapp Receba as notícias da Exame no seu WhatsApp Nos acontecimentos mais relevantes do Brasil e mundo. E-mail inválido Desperta",Exame
https://exame.com/negocios/ela-trocou-uma-carreira-promissora-na-cidade-grande-para-construir-um-negocio-milionario-no-interior/,2025-08-22,Ela trocou uma carreira promissora na cidade grande para construir um negócio milionário no interior,"Maíra Scheid, da Sheid Clínica Veterinária: ""Vinculei meu sobrenome ao negócio justamente para criar identificação: eu era desconhecida por muitos, mas a minha família era conhecida na cidade. Em lugares pequenos, isso faz diferença"" (Divulgação/Divulgação) Estímulo Publicado em22 de agosto de 2025 às17h26. No ano de 2017, a empreendedora Maíra Scheid tomou uma decisão que parecia contraditória: deixar uma carreira recém-iniciada na região metropolitana para abrir uma clínica veterinária em sua cidade natal, Cerro Largo, no interior do Rio Grande do Sul — um município com pouco mais de 14 mil habitantes e nenhum serviço de saúde animal especializado. “Voltar para minha cidade natal nunca esteve nos meus planos. Eu cresci ouvindo que, para ser alguém na vida, era preciso estudar e trabalhar nos grandes centros urbanos”, lembra. Após especialização em cirurgia veterinária e uma experiência frustrante no mercado de trabalho, Maíra deu um Google com a pergunta: “Como abrir uma clínica veterinária?” E assim nasceu um negócio promissor. Na época, não havia serviços veterinários com estrutura mínima em Cerro Largo. Os atendimentos mais complexos exigiam deslocamentos de até 70 km. O cenário, desafiador para quem buscava atendimento, era ao mesmo tempo uma janela de oportunidade. “Foi um projeto ambicioso, principalmente para quem não tinha ‘um real’ no bolso. Houve críticas, incentivos, dúvidas... Mas eu faria tudo de novo, exatamente igual”, afirma. Nos primeiros meses da Sheid Clínica Veterinária, o maior obstáculo não foi financeiro, mas a confiança da comunidade. “Era um serviço novo, que poucos conheciam. Conquistar os clientes, um a um, foi essencial. Vinculei meu sobrenome ao negócio justamente para criar identificação: eu era desconhecida por muitos, mas a minha família era conhecida na cidade. Em lugares pequenos, isso faz diferença”, relembra a empresária. Com o aumento da demanda, a estrutura original do negócio se tornou insuficiente. Entre o sexto e o sétimo ano de atuação, veio uma expansão ousada: investimento seis vezes maior que o inicial, com aquisição de novos equipamentos e ampliação da equipe. “Chegamos à nossa capacidade máxima. Sem expandir, não conseguiríamos crescer mais”, ressalta Sheid. Entre as aquisições que marcaram a nova fase da clínica está o aparelho de raio-x digital. “Era um sonho antigo, que parecia impossível. Antes, o serviço era terceirizado, e a logística dificultava muito. Hoje conseguimos realizar o exame na hora, o que melhora o diagnóstico e o tratamento dos animais”, pontua. Mas a profissionalização do negócio não veio só da parte técnica. A adoção de um sistema de gestão (GestãoPet) foi outro divisor de águas. “A informatização ajudou a entender melhor os nossos números, precificar com exatidão e analisar o desempenho dos setores. Boa gestão é o que sustenta o crescimento.” A estruturação também passou por momentos de aperto, mas para viabilizar a expansão, foi necessário recorrer a empréstimos — um processo que, segundo Maíra, exigiu coragem e controle. “Nunca tive medo de não dar conta. Com uma base de clientes fidelizada e fluxo constante de novos atendimentos, bastava seguir trabalhando com consistência.” Nesse processo, contar com Fundo de Impacto Estímulo, que apoia o micro e pequeno empreendedor brasileiro foi fundamental. “Isso foi peça-chave para viabilizar o financiamento da expansão do negócio, pois os grandes bancos recusavam liberar recursos para quem não tinha renda ou capital próprio. Foi o respiro que precisávamos para nos reorganizar”, conta Maíra. Além disso, a clínica participa de licitações para castrações voluntárias promovidas pela prefeitura — uma política de saúde pública e controle populacional que beneficia diretamente a comunidade. “Sou defensora de que os municípios valorizem os prestadores locais. É uma forma de levar um serviço de qualidade para quem mais precisa”, completa a veterinária. Com as contas equilibradas e a estrutura consolidada, o foco agora é outro: gestão de pessoas. “A prioridade nos próximos dois anos é consolidar a equipe. Hoje, há uma limitação técnica na formação dos profissionais. Então precisamos investir no time, treiná-los e garantir que os valores da empresa sejam mantidos.” Para quem pensa em empreender fora dos grandes centros, o recado de Maíra é claro: “Arrisquem com responsabilidade e nunca abram mão da qualidade. Nos grandes centros, o mercado está saturado. Aqui, conseguimos nos destacar por competência, e não apenas por preço. E isso faz toda a diferença”, finaliza a empresária. Este conteúdo foi produzido pelo Fundo de Impacto Estímulo - que apoia pequenos empreendedores brasileiros com crédito facilitado, capacitação e conexões - em parceria com a EXAME. Para saber mais sobre o Estímulo visite estimulo2020.org. Para ler todas reportagens anteriores publicadasclique aqui. Investidores negociam compra de ações em operação que transforma o papel dos profissionais de finanças corporativas nas empresas de tecnologia Maor Shlomo criou a Base44, uma empresa de inteligência artificial, em fevereiro de 2025 e a vendeu para a Wix por US$ 80 milhões Gigante sueca abre as portas no Brasil neste sábado, lança e-commerce nacional e projeta expansão rápida para países vizinhos até 2026 Realizada pela ApexBrasil em parceria com a EXAME, a premiação reforça o protagonismo do Brasil no comércio exterior 01 02 03 exame no whatsapp Receba as notícias da Exame no seu WhatsApp Nos insights de grandes empresários para seu negócio. E-mail inválido Empreenda",Exame
https://exame.com/future-of-money/investidor-perde-r-490-milhoes-em-bitcoin-apos-cair-em-golpe-de-engenharia-social/,2025-08-22,Investidor perde R$ 490 milhões em bitcoin depois de cair em golpe de engenharia social,"Patrocínio: Bitcoin: investidor perdeu milhões em golpe (Reprodução/Reprodução) Editor do Future of Money Publicado em22 de agosto de 2025 às17h24. Última atualização em22 de agosto de 2025 às18h26. Um investidor perdeu US$ 91 milhões (R$ 493 milhões, na cotação atual) em unidades debitcoindepois de cair em umgolpe de engenharia social. O golpe foi executado na última terça-feira, 19, e os criminosos conseguiram usar uma carteira digital específica que conseguiu apagar os rastros dos ativos, dificultando a identificação. O golpe foi identificado por ZachXBT, um investigador famoso no mercado decriptomoedaspor identificar diferentes tipos de ataques e roubos no setor. Ele realiza as investigações principalmente por meio da tecnologiablockchain, conseguindo identificar os pontos de destino e origem de ativos desviados. De acordo com o investigador, foram roubadas 783 unidades de bitcoin na ação. Os criminosos teriam se passado pelas equipes de suporte de uma empresa de carteiras digitais para o armazenamento de criptomoedas e de uma corretora de criptomoedas. Usando diferentes técnicas de engenharia social, eles conseguiram convencer o dono dos ativos a passar suas credenciais de acesso. Com os dados, os golpistas foram capazes de acessar a carteira digital do investidor e enviar todas as unidades da criptomoeda para outra carteira. Em seguida, os ativos foram enviados para uma carteira da Wasabi Wallet, que oferece uma ferramenta de garantia de privacidade de usuários, dificultando o rastreio dos ativos. O uso da ferramenta deve dificultar tanto a identificação dos criminosos quanto a recuperação das unidades de bitcoin. Além disso, a identidade da vítima não foi revelada até o momento. Questionado sobre as possíveis técnicas usadas pelos criminosos para descobrir qual corretora e carteira digital a vítima usava, ZachXBT disse que ""há muitas violações que tornam suas informações pessoais amplamente disponíveis online, e aí agentes maliciosos podem explorá-las"". Os golpes de engenharia social não exigem conhecimentos técnicos complexos e não envolvem ações de hackers ou invasões para roubar os ativos. Ao invés disso, os criminosos usam técnicas para convencer a própria vítima a enviar voluntariamente dados pessoais que permitem a realização dos roubos. A ação se soma a um 2025 marcado por grandes roubos no mercado de criptomoedas, envolvendo tanto engenharia social quanto ataques de hackers. No primeiro semestre do ano, foram roubados US$ 3,1 bilhões em unidades de bitcoin e outras criptos. O valor semestral superou todas as perdas registradas no ano de 2024. Siga o Future of Money nas redes sociais:Instagram|X|YouTube|Telegram|TikTok Decisão de trocar investimentos no bitcoin para o ether chamou a atenção do mercado, mas investidor segue anônimo Kenneth Rogoff, que também foi economista-chefe do FMI, disse que subestimou a capacidade do bitcoin de concorrer com moedas fiduciárias Brian Armstrong demonstrou otimismo em relação à trajetória da criptomoeda e projeta novos recordes nos próximos anos NBIT11 foi lançado na B3 e seguirá vencimento mensal mais próximo do contrato futuro da criptomoeda na Bolsa de Valores 01 02 03 exame no whatsapp Receba as notícias da Exame no seu WhatsApp Newsletter Future Of Money Quer saber as novidades que mexem com o mercado cripto? Assine as newsletters gratuitas do Future of Money! Selecione as newsletters que você deseja se inscrever* Crypto Deep (Semanal) Crypto Daily (Diária) Ao informar meus dados, eu concordo com aPolítica de Privacidade.",Exame
https://exame.com/invest/mercados/dolar-cai-quase-1-apos-discurso-de-powell-em-jackson-hole/,2025-08-22,Dólar cai quase 1% após discurso de Powell em Jackson Hole,"Dólar: divisa foi fortemente impactada pelo discurso de Powell (Jason Dean/Getty Images) Redação Exame Publicado em22 de agosto de 2025 às17h19. Última atualização em22 de agosto de 2025 às17h40. Odólar à vistafechou a sessão desta sexta-feira, 22, em queda de 0,97%, a R$ 5,425, depois de oscilar entre R$ 5,412 e R$ 5,476. A divisa foi fortemente impactada pelodiscurso mais 'dovish' do presidente do Federal Reserve (Fed, banco central dos Estados Unidos), Jerome Powell, nosimpósio de Jackson Hole. ""A leitura mais 'dovish' de suas falas, ao reconhecer riscos crescentes para o mercado de trabalho e a necessidade de reavaliar o equilíbrio da política monetária, elevou as apostas em cortes de juros já a partir de setembro"", aponta Bruno Shahini, especialista em investimentos da Nomad. Esse cenário pressionou oíndice DXY, que recuou também próximo a 1% frente às principais moedas, refletindo o enfraquecimento global da divisa. Com a perspectiva de redução da taxa básica nos Estados Unidos, os Treasuries também cederam, abrindo espaço para moedas emergentes e especialmente o real. ""Ao mesmo tempo, o ambiente de menor aversão ao risco alimentou o modorisk on, impulsionando bolsas em Nova York e no Brasil, e reforçando a busca por ativos de maior retorno"", complementa Shahini. OIbovespa subiu mais de 2%, enquanto osprincipais índices americanos subiram mais de 1,5%. O grande destaque do discurso, segundo William Castro Alves, estrategista-chefe da Avenue, foi quea autoridade vê a inflação como potencialmente temporáriae queos riscos para desaceleração do mercado de trabalho aumentaram: com isso,pode ser apropriado um ajuste na política monetária. ""Com a política em território restritivo, a perspectiva básica e a mudança no equilíbrio de riscos podem justificar o ajuste de nossa postura política”, considerou ochairman. Na plataforma FedWatch, do CME Group, as chances de corte nos fed funds em setembro saltaram de 74,97% para 93,05%, após as falas de Powell. O dólar à vista é o valor negociado no mercado de câmbio para liquidação imediata, geralmente em até dois dias úteis. Esse tipo de câmbio é amplamente utilizado por empresas e instituições financeiras em operações de curto prazo, oferecendo uma cotação com base no valor real de mercado no momento da transação. O dólar futuro é uma cotação projetada para contratos de compra e venda de dólares a serem liquidados em datas futuras. Esse tipo de dólar é negociado na Bolsa de Valores, permitindo que empresas e investidores se protejam contra a volatilidade cambial. A cotação do dólar futuro pode variar bastante, pois leva em consideração as expectativas do mercado sobre a economia. Medida ocorre em meio a prejuízos bilionários e dificuldades na retomada da fabricante de chips Ministério Público mantém investigação sobre prejuízos de US$ 3,2 bilhões ligados a bancos e imobiliária Companhia vai elevar preço da commodity para pedidos feitos a partir de setembro; ajuste chega a US$ 80 a tonelada em algumas regiões Com garantia do FGC e rendimentos acima do CDI, ‘cofrinhos virtuais’ podem ser uma boa opção para quem está começando 01 02 03 exame no whatsapp Receba as notícias da Exame no seu WhatsApp Nas melhores oportunidades do mercado para investir. E-mail inválido Invest",Exame
https://exame.com/negocios/com-alta-do-chatgpt-openai-pode-valer-us-500-bilhoes-com-venda-de-acoes-por-funcionarios/,2025-08-22,"Com alta do ChatGPT, OpenAI pode valer US$ 500 bilhões com venda de ações por funcionários","(JASON REDMOND/Getty Images) Redatora Publicado em22 de agosto de 2025 às17h16. Última atualização em22 de agosto de 2025 às18h52. AOpenAI, criadora doChatGPT, pode alcançar um novo marco financeiro: umvaluationdeUS$ 500 bilhões. A informação foi divulgada pelaInc., com base em dados obtidos pelaReuters, e revela que atuais e ex-funcionários da empresa estão em negociações para vender aproximadamenteUS$ 6 bilhões em açõespara investidores como SoftBank Group, Thrive Capital e Dragoneer Investment Group. A possível venda, ainda em fase inicial de negociação, ocorre com grande expectativa do mercado. Caso concretizada, a avaliação da empresa saltaria dos atuais US$ 300 bilhões para US$ 500 bilhões, um aumento de mais de 60% em poucos meses. Compreenda como crescimento se traduz em receita e retorno para investidores. Desenvolva competências para analisar escalabilidade e relevância de mercado. Garanta sua vaga no Pré-MBA em Finanças Corporativas por R$ 37. A OpenAI dobrou sua receita nos sete primeiros meses de 2025 e hoje opera com uma taxa de receita de US$ 12 bilhões, podendo chegar a US$ 20 bilhões até o final do ano. Além disso, o ChatGPT já alcança700 milhões de usuários semanais, um crescimento impressionante frente aos 400 milhões de fevereiro. A escalada no número de usuários traduz-se diretamente em receita, relevância de mercado e retorno para investidores. Esse movimento de venda secundária, quando funcionários vendem suas ações, e não a própria empresa, sinaliza um amadurecimento do modelo de negócios e financiamento no setor de tecnologia. Em vez de esperar por uma oferta pública inicial (IPO), colaboradores da OpenAI estão monetizando suas participações de forma antecipada, com o aval de grandes fundos de investimento. PRÉ-MBA FINANÇAS CORPORATIVAS: Domine vendas, liquidez e estruturação de capital. Prepare-se para o futuro das finanças em tecnologia. Inscreva-se por R$ 37. O caso da OpenAI exemplifica como o domínio de estratégias financeiras complexas se tornou indispensável para profissionais que atuam ou desejam atuar nas áreas definanças corporativasou gestão estratégica. Compreender as dinâmicas de valuation, rodadas de investimento, liquidez secundária e estruturação de capital é hoje uma competência crítica. A venda de ações de funcionários antes de um IPO, algo que há poucos anos seria considerado fora do comum, torna-se cada vez mais frequente em empresas que operam na fronteira da inovação. Por isso, a EXAME, em parceria com a Saint Paul Escola de Negócios, lançou oPré-MBA em Finanças Corporativas— um treinamento criado para quem quer dominar a lógica dos números e utilizá-la como diferencial na trajetória profissional,por R$37,00. Domine finanças que operam na fronteira da inovação com a EXAME + Saint Paul.Faça um pré-MBA com 3 horas de duração e quatro aulas práticas. Clique aqui e faça sua inscrição. Com investimento inicial simbólico e muitas dúvidas, a gaúcha Maíra Scheid montou uma clínica veterinária após uma frustração pessoal. Hoje, o negócio é referência em saúde animal na região Maor Shlomo criou a Base44, uma empresa de inteligência artificial, em fevereiro de 2025 e a vendeu para a Wix por US$ 80 milhões Gigante sueca abre as portas no Brasil neste sábado, lança e-commerce nacional e projeta expansão rápida para países vizinhos até 2026 Realizada pela ApexBrasil em parceria com a EXAME, a premiação reforça o protagonismo do Brasil no comércio exterior 01 02 03 exame no whatsapp Receba as notícias da Exame no seu WhatsApp Nas principais tendências de carreira e do mercado. E-mail inválido Carreira 3.0",Exame
https://www.infomoney.com.br/mercados/banco-do-brasil-bbas3-diz-que-tomara-providencias-legais-para-proteger-reputacao/,2025-08-22,Banco do Brasil (BBAS3) diz que tomará providências legais para “proteger reputação”,"Camille Bocanegra22/08/2025 19h35•Atualizado 2 minutos atrás 22/08/2025 19h35•Atualizado 2 minutos atrás Publicidade O Banco do Brasil (BBAS3) divulgou nota à imprensa nesta sexta-feira (22) afirmando que “tomará todas as medidas legais cabíveis para proteger sua reputação”. A afirmação é direcionada ao que o banco chamou de “desinformação” em redes sociais. “O Banco acompanha o surgimento de algumas publicações inverídicas e maliciosas que disseminam desinformação em redes sociais, com o objetivo de gerar pânico e induzir a população a decisões que podem prejudicar a sua saúde financeira, sugerindo uma retirada de depósitos por parte dos clientes”, diz a nota. Analistas, que já estavam cautelosos com BB, veem mais um motivo para ficarem com pé atrás com instituição O banco ainda diz que atua em conformidade com a lei brasileira e com as normas de mais de 20 países onde está presente. Na nota, a instituição ainda afirma estar preparada para “lidar com temas complexos e sensíveis que envolvem regulamentações globais”. “O Banco sempre acompanha esses assuntos com atenção e conta com assessoramento jurídico especializado para garantir atuação alinhada às melhores práticas de governança, integridade e segurança financeira”, afirma. Camille Bocanegra",Infomoney
