url,data,titulo,texto,fonte
https://valor.globo.com/brasil/noticia/2025/06/16/desempenho-econmico-faz-brasil-avanar-quatro-posies-em-ranking-internacional-de-competitividade.ghtml,2025-06-16,Desempenho econômico faz Brasil avançar quatro posições em ranking internacional de competitividade,"16/06/2025 19h23Atualizado16/06/2025 O Brasil avançou da 62° colocação para a 58ª posição em 2025 noRanking Mundial de Competitividadeelaborado peloInternational Institute for Management Development (IMD), que conta com a colaboração doNúcleo de Inovação e Tecnologias Digitais da Fundação Dom Cabral (FDC). É o melhor posicionamento desde 2021, mas o país segue entre os últimos – a lista avalia 69 países. A melhora foi impulsionada principalmente pelo desempenho econômico do país e por avanços na eficiência empresarial. Na análise de eficiência governamental, o subfator subsídios governamentais segue contribuindo positivamente para o Brasil no ranking do IMD e o total de atividade empreendedora em estágio inicial subiu quatro posições nessa subcategoria. Infraestrutura e sobretudo o subfator de energias renováveis também ajudam o país. Contudo, questões como custo de capital e dívida corporativa, educação e habilidades linguísticas em nível baixo, pouca abertura econômica e ambiente regulatório ruim, além da falta de mão de obra qualificada, seguem jogando a posição geral do Brasil para o último pelotão da lista. “Não há mudança estrutural. Não há nenhum motivo para comemorar, por exemplo, o aumento de carga tributária que o governo tem feito, principalmente inibindo o potencial de investimento de fundos. Estamos indo na contramão dos principais países que crescem nos rankings”, pontuaHugo Tadeu, diretor do núcleo de inovação e tecnologias digitais da Fundação Dom Cabral e líder da pesquisa no Brasil. Ele critica a proposta do governo federal de aumentar o Imposto sobre Operações Financeiras (IOF) para aumentar a arrecadação e cumprir as metas fiscais. “Estamos sufocando o ambiente empresarial brasileiro e dependendo cada vez mais do governo”, adiciona. Segundo Tadeu, assim como praticamente todas as economias avaliadas no ranking, o Brasil tem pontos fortes e pontos fracos, com destaque negativo para a baixa qualidade da educação, Conforme mostram os dados, o Brasil ficou em último em relação à habilidades linguísticas, em penúltimo no quesito educação primária e secundária e antepenúltimo em educação em gestão e educação universitária. “Temos fortalezas e fragilidades. O ideal é olhar para todos os dados do ranking e construir uma agenda. Do contrário, ano que vem o Brasil pode tanto subir uma posição ou cair para 60º. Ou resolvemos os problemas estruturais ou vamos continuar com voos de galinha e muito dependentes de setores baseados em exportação e exploração dos recursos naturais, enquanto os países bem colocados estão baseados em conhecimento e tecnologia”. Já entre os destaques positivos, o relatório aponta que o Brasil ficou entre as dez melhores avaliações nos quesitos fluxo de investimento direto estrangeiro, crescimento de longo prazo do emprego, subsídios governamentais, atividade empreendedora em estágio inicial e energias renováveis. Entre os países latino-americanos, o Brasil ainda aparece atrás de Chile (42º lugar), Colômbia (54º) e México (55º) no ranking geral. Argentina (62º) e Venezuela (69º) são os sul-americanos atrás, entre os que foram incluídos no ranking – o Uruguai não foi avaliado. Ao observar o ranking inteiramente, Namíbia (68º), Nigéria (67º), Turquia (66º), Mongólia (65º) e África do Sul (64º) continuam enfrentando questões como instabilidade institucional, baixa integração econômica e infraestrutura precária. Já no topo do ranking, a Suíça assumiu a liderança, depois de aparecer no segundo lugar no ano passado. Em seguida, estão Singapura (2º), que perdeu a primeira posição na lista geral, mas manteve a liderança em performance econômica e Hong Kong (3º), com avanços em eficiência empresarial e institucional. Dinamarca (4º) e Emirados Árabes Unidos (5º) completam o top cinco. Os países que detêm os maiores Produtos Internos Brutos (PIB) do mundo estão fora do top dez do ranking de competitividade do IMD.Os Estados Unidos aparecem em 12º lugar, a China em 16º, a Alemanha em 19º e o Japão apenas em 35º. “Olhamos para além do PIB no ranking. Analisamos fatores como comércio internacional, investimento direto, capacidade de gerar emprego e uma série de outras agendas”, explica Tadeu, apontando que todos os quesitos são divididos nos quatro principais fatores, que são performance econômica, eficiência governamental, eficiência empresarial e infraestrutura. Acompanhe os mercados com nossas ferramentasAcessar gratuitamente Três fontes familiarizadas com o assunto disseram à “Reuters” que a proclamação sobre os termos do acordo incluiria disposições sobre o comércio de aço, etanol, automóveis e carne bovina Proposta contraria entendimento do TCU e, se aprovada, deve aprofundar crise entre Poderes Líderes partidários levam reclamações diversas à ministra em reunião com Hugo Motta Segundo o ministro, vive-se ""uma época em que as fronteiras entre a civilização e a barbárie parecem ténues Contudo, questões como custo de capital e dívida corporativa, educação e habilidades linguísticas em nível baixo, pouca abertura econômica e ambiente regulatório ruim, além da falta de mão de obra qualificada, impedem maior avanço Vereador no Rio, filho do ex-presidente deve disputar eleições por Santa Catarina Empresa já havia investido R$ 630 milhões no ano passado para inaugurar um complexo industrial em Pouso Alegre (MG) Deputados e senadores tem sessão prevista para esta terça-feira Jornalistas das equipes de segurança nacional e política econômica, incluindo aqueles que cobriam a China, teriam sido alvos Tenente-coronel nega ter desrespeitado ordem de proibição",Valor Econômico
https://valor.globo.com/financas/noticia/2025/06/16/bolsas-de-ny-fecham-em-alta-com-o-conflito-entre-israel-e-ira-no-radar.ghtml,2025-06-16,Bolsas de NY fecham em alta com o conflito entre Israel e Irã no radar,"Em alta Por Valor, com Reuters— São Paulo 16/06/2025 17h26Atualizado16/06/2025 Osmercados acionários americanosencerraram o pregão desta segunda-feira (16) em alta, apoiados pela menor percepção de risco em torno doconflitoentreIsraeleIrã. A possibilidade de uma abertura para umdiálogodo país persa com osEstados Unidostambém deu apoio à recuperação das bolsas em Nova York, que, contudo, não conseguiram se sustentar nas máximas do dia, na medida em que os rendimentos dos títulos do Tesouro americano (Treasuries) de longo prazo continuaram a subir e impediram uma valorização ainda mais expressiva dasaçõesamericanas diante de uma taxa de desconto mais elevada. No fim dos negócios em Wall Street, o índiceDow Jonessubiu 0,75%, aos 42.515,09 pontos, oS&P 500avançou 0,94%, aos 6.033,11 pontos, e o índice eletrônicoNasdaqfechou a sessão em alta de 1,52%, aos 19,701,21 pontos. De acordo com informações do ""Wall Street Journal"", o Irã enviou mensagens aos EUA e a Israel por meio de alguns países árabes intermediários e sinalizou que desejava encerrar ashostilidadese retomar asnegociaçõessobre seuprograma nuclear. Após a publicação da reportagem, as bolsas, que já haviam iniciado a sessão em alta, ampliaram o ritmo de valorização e se firmaram em território positivo. Entre os destaques, osetor de tecnologiae ofinanceirolideraram os ganhos em Nova York. “Os mercados chegaram à conclusão de que, por ora, o conflito entre Israel e Irã está localizado”, afirma o chefe de renda fixa internacional da National Alliance Securities, Andy Brenner, em relatório enviado a clientes. O movimento em Wall Street só não foi mais expressivo devido à alta dos rendimentos dos Treasuries de longo prazo, que deixaram a taxa de desconto mais alta para as ações americanas. Acompanhe os mercados com nossas ferramentasAcessar gratuitamente Três fontes familiarizadas com o assunto disseram à “Reuters” que a proclamação sobre os termos do acordo incluiria disposições sobre o comércio de aço, etanol, automóveis e carne bovina Proposta contraria entendimento do TCU e, se aprovada, deve aprofundar crise entre Poderes Líderes partidários levam reclamações diversas à ministra em reunião com Hugo Motta Segundo o ministro, vive-se ""uma época em que as fronteiras entre a civilização e a barbárie parecem ténues Contudo, questões como custo de capital e dívida corporativa, educação e habilidades linguísticas em nível baixo, pouca abertura econômica e ambiente regulatório ruim, além da falta de mão de obra qualificada, impedem maior avanço Vereador no Rio, filho do ex-presidente deve disputar eleições por Santa Catarina Empresa já havia investido R$ 630 milhões no ano passado para inaugurar um complexo industrial em Pouso Alegre (MG) Deputados e senadores tem sessão prevista para esta terça-feira Jornalistas das equipes de segurança nacional e política econômica, incluindo aqueles que cobriam a China, teriam sido alvos Tenente-coronel nega ter desrespeitado ordem de proibição",Valor Econômico
https://valor.globo.com/empresas/marketing/noticia/2025/06/16/brasil-conquista-grand-prix-e-tres-ouros-no-primeiro-dia-do-cannes-lions.ghtml,2025-06-16,Brasil conquista Grand Prix e três Ouros no primeiro dia do Cannes Lions,"16/06/2025 17h00Atualizado16/06/2025 No primeiro dia doFestival Internacional de Criatividade Cannes Lions 2025, principal premiação global da publicidade, o Brasil conquistou um Grand Prix na categoria ""Áudio & Rádio"" e três Leões de Ouro — um em Áudio, outro em ""Saúde & Bem-estar"" e outro em ""Impresso"" . Ao todo, o país somou 20 prêmios nesta segunda-feira (16). Acompanhe os mercados com nossas ferramentasAcessar gratuitamente Três fontes familiarizadas com o assunto disseram à “Reuters” que a proclamação sobre os termos do acordo incluiria disposições sobre o comércio de aço, etanol, automóveis e carne bovina Proposta contraria entendimento do TCU e, se aprovada, deve aprofundar crise entre Poderes Líderes partidários levam reclamações diversas à ministra em reunião com Hugo Motta Segundo o ministro, vive-se ""uma época em que as fronteiras entre a civilização e a barbárie parecem ténues Contudo, questões como custo de capital e dívida corporativa, educação e habilidades linguísticas em nível baixo, pouca abertura econômica e ambiente regulatório ruim, além da falta de mão de obra qualificada, impedem maior avanço Vereador no Rio, filho do ex-presidente deve disputar eleições por Santa Catarina Empresa já havia investido R$ 630 milhões no ano passado para inaugurar um complexo industrial em Pouso Alegre (MG) Deputados e senadores tem sessão prevista para esta terça-feira Jornalistas das equipes de segurança nacional e política econômica, incluindo aqueles que cobriam a China, teriam sido alvos Tenente-coronel nega ter desrespeitado ordem de proibição",Valor Econômico
https://valor.globo.com/politica/noticia/2025/06/16/toffoli-autoriza-posse-de-prefeito-em-itaguai-para-terceiro-mandato.ghtml,2025-06-16,"Toffoli autoriza posse de prefeito em Itaguaí, no Rio, para terceiro mandato","Por Agência Brasil— Brasília 16/06/2025 17h22Atualizado16/06/2025 O ministroDias Toffoli, do Supremo Tribunal Federal (STF),autorizou, nesta segunda-feira (16), a posse deRubem Vieira de Souza, conhecido como Dr. Rubão (Podemos),no cargo de prefeito deItaguaí (RJ). O político foi eleito no pleito municipal de 2024, mas ainda não foi empossado porque teve a candidatura barrada pela Justiça Eleitoral por pretender exercer o terceiro mandato no comando da prefeitura do município. Em 2020, Dr. Rubão era presidente da Câmara Municipal de Itaguaí e exerceu um ""mandato tampão"" após oimpeachment do prefeito Carlo Busatto Júnior, e o vice, Abeilard Goulart. Nas eleições realizadas no mesmo ano, Rubão foi eleito para o primeiro mandato. No pleito de 2024, ele concorreu à reeleição e venceu novamente, mas teve a candidatura barrada pela primeira instância da Justiça Eleitoral. Pela decisão, o político concorreu ao terceiro mandato consecutivo ao mesmo cargo, o que é proibido pelaConstituição. Inconformado com a decisão, o prefeito eleito recorreu aoTribunal Superior Eleitoral (TSE),mas o caso ainda não foi julgado. Dessa forma, o ministro Dias Toffoli entendeu que Rubem Vieira deve assumir o cargo até a decisão final do TSE. ""O prefeito encontra-se afastado do cargo para o qual foi soberanamente eleito com mais de 39% dos votos válidos, há mais de cinco meses, situação essa que, se mantida indefinidamente, configura quadro de instabilidade institucional e de insegurança jurídica com inegáveis prejuízos à necessária continuidade na prestação de serviços públicos aos cidadãos do município"", decidiu o ministro. A data da posse será definida pelo Tribunal Regional Eleitoral (TRE) do Rio de Janeiro. Acompanhe os mercados com nossas ferramentasAcessar gratuitamente Três fontes familiarizadas com o assunto disseram à “Reuters” que a proclamação sobre os termos do acordo incluiria disposições sobre o comércio de aço, etanol, automóveis e carne bovina Proposta contraria entendimento do TCU e, se aprovada, deve aprofundar crise entre Poderes Líderes partidários levam reclamações diversas à ministra em reunião com Hugo Motta Segundo o ministro, vive-se ""uma época em que as fronteiras entre a civilização e a barbárie parecem ténues Contudo, questões como custo de capital e dívida corporativa, educação e habilidades linguísticas em nível baixo, pouca abertura econômica e ambiente regulatório ruim, além da falta de mão de obra qualificada, impedem maior avanço Vereador no Rio, filho do ex-presidente deve disputar eleições por Santa Catarina Empresa já havia investido R$ 630 milhões no ano passado para inaugurar um complexo industrial em Pouso Alegre (MG) Deputados e senadores tem sessão prevista para esta terça-feira Jornalistas das equipes de segurança nacional e política econômica, incluindo aqueles que cobriam a China, teriam sido alvos Tenente-coronel nega ter desrespeitado ordem de proibição",Valor Econômico
https://valor.globo.com/mundo/noticia/2025/06/16/ue-avana-com-proposta-de-proibio-do-gs-russo-apesar-dos-vetos-de-hungria-e-eslovquia.ghtml,2025-06-16,UE avança com proposta de proibição do gás russo apesar dos vetos de Hungria e Eslováquia,"Por Reuters— Luxemburgo 16/06/2025 13h37Atualizado16/06/2025 Hungria e Eslováquia se opuseram hoje a um plano da União Europeia (UE) para proibir as importações de gás da Rússia, embora Bruxelas deva propor a lei amanhã, que poderá ser aprovada mesmo sem a aprovação desses países. A Comissão Europeia pretende banir as importações de gás e gás natural liquefeito (GNL) russos pela UE até o fim de 2027. O bloco vai propor as medidas e explicará como pretende implementar legalmente o plano, que foi anunciado no mês passado. Hungria e Eslováquia, no entanto, impediram que os ministros da energia da UE publicassem uma declaração conjunta apoiando o plano, que recebeu o aval dos outros 25 Estados-membros. “A política energética é uma competência nacional, e isso coloca em risco nossa soberania e segurança energética”, disse o ministro das Relações Exteriores da Hungria, Peter Szijjarto, em publicação no X, na qual afirmou que a Hungria vetou a declaração conjunta. Um porta-voz da delegação da Eslováquia na UE confirmou que o país fez o mesmo. A Comissão planeja propor a proibição com base em um dispositivo legal que permite sua aprovação com o apoio de uma “maioria qualificada reforçada” de países e da maioria do Parlamento Europeu, segundo autoridades da UE. Essa maioria qualificada requer pelo menos 15 dos 27 membros do bloco e deve representar pelo menos 65% de sua população. Na reunião a portas fechadas de hoje, a maioria dos ministros da energia indicou apoio à proposta, embora alguns tenham expressado preocupações de que isso possa expor empresas a riscos legais ou multas financeiras por quebra de contratos de fornecimento de gás de longo prazo, disseram diplomatas da UE. Acompanhe os mercados com nossas ferramentasAcessar gratuitamente Três fontes familiarizadas com o assunto disseram à “Reuters” que a proclamação sobre os termos do acordo incluiria disposições sobre o comércio de aço, etanol, automóveis e carne bovina Proposta contraria entendimento do TCU e, se aprovada, deve aprofundar crise entre Poderes Líderes partidários levam reclamações diversas à ministra em reunião com Hugo Motta Segundo o ministro, vive-se ""uma época em que as fronteiras entre a civilização e a barbárie parecem ténues Contudo, questões como custo de capital e dívida corporativa, educação e habilidades linguísticas em nível baixo, pouca abertura econômica e ambiente regulatório ruim, além da falta de mão de obra qualificada, impedem maior avanço Vereador no Rio, filho do ex-presidente deve disputar eleições por Santa Catarina Empresa já havia investido R$ 630 milhões no ano passado para inaugurar um complexo industrial em Pouso Alegre (MG) Deputados e senadores tem sessão prevista para esta terça-feira Jornalistas das equipes de segurança nacional e política econômica, incluindo aqueles que cobriam a China, teriam sido alvos Tenente-coronel nega ter desrespeitado ordem de proibição",Valor Econômico
https://valor.globo.com/empresas/noticia/2025/06/16/tribunal-condena-meta-a-pagar-indenizacao-por-vazamentos-de-dados-em-2018-e-2019.ghtml,2025-06-16,Tribunal condena Meta a pagar indenização por vazamentos de dados em 2018 e 2019,"Por O Globo— São Paulo 16/06/2025 16h24Atualizado16/06/2025 O Tribunal de Justiça de Minas Gerais (TJMG) decidiu que aMeta, dona do Facebook, Instagram e WhatsApp,deve pagar indenizações aos usuários afetados por vazamentos de dados ocorridos em 2018 e 2019. A empresa foi condenada a pagar R$ 40 milhões por danos morais coletivos e também R$ 10 mil para cada usuário afetado. A Meta ainda pode recorrer. A decisão de segunda instância confirma o que já havia sido determinado pela primeira, com uma mudança importante:o usuário não precisará mais comprovar que foi prejudicado; é a empresa que deverá ativamente identificar os usuários afetados para indenizá-los. Os pagamentos devem ser realizados diretamente pela empresa a esses usuários, sem necessidade de ações individuais na Justiça. Em nota, a empresa disse discordar da decisão e que está avaliando suas opções legais. ""Como é uma ação coletiva, nada adianta haver o reconhecimento dessa indenização, mas cada consumidor ter que pedir o pagamento individualmente"", diz Lilian Salgado, presidente do Comitê Técnico do Instituto Defesa Coletiva, que entrou com a ação. Inicialmente, a Justiça havia determinado que cada consumidor precisaria comprovar que seus dados foram expostos, mas essa exigência foi descartada. Após a nova decisão, é a empresa quem deve provar que determinados usuários não foram afetados caso não os inclua nas indenizações, diz Gabriel de Britto Silva, advogado especializado em direito do consumidor. Se não conseguir fazê-lo, todos os usuários ativos no momento dos vazamentos terão direito à indenização. ""Na ausência de prova individualizada de que não houve vazamento daquele usuário, o entendimento é de que houve vazamento. A prova do dano causado pelo vazamento de dados cabe à Meta."" O julgamento analisou duas ações civis públicas do Instituto Defesa Coletiva, que foram protocoladas depois de uma série de vazamentos de informações pessoais dos internautas. O primeiro vazamento aconteceu em setembro de 2018, quando hackers conseguiram burlar a segurança do Facebook e acessar detalhes como nome, telefone e e-mail de 15 milhões de pessoas. Outros 14 milhões de usuários tiveram ainda mais dados acessados: gênero, localidade, idioma, status de relacionamento, religião, cidade natal e data de nascimento. Em dezembro, houve um novo vazamento, desta vez de fotos de usuários, além de imagens carregadas, mas não publicadas, nos stories. O número de vítimas ultrapassa 6 milhões de internautas. Em abril de 2019, senhas 22 mil contas e detalhes da movimentação de mais de 540 milhões de usuários foram expostas. Esses três casos constam na primeira ação protocolada em maio de 2019. A segunda ação foi protocolada em julho de 2020 e cita uma vulnerabilidade do aplicativo WhatsApp em maio de 2019, que permitiu que hackers instalassem programas para ter acesso aos dados dos celulares. O número de usuários afetados não foi informado pela empresa. Outro vazamento citado na ação é referente ao aplicativo de mensagens vinculado ao Facebook, o Messenger. O Facebook contratou funcionários terceirizados para transcrever áudios enviados pelos consumidores sem sua anuência. Na ação civil coletiva, o Facebook não apresentou uma lista com o nome das pessoas que tiveram seus dados vazados nem comprovou ter avisado os internautas sobre o problema. Acompanhe os mercados com nossas ferramentasAcessar gratuitamente Três fontes familiarizadas com o assunto disseram à “Reuters” que a proclamação sobre os termos do acordo incluiria disposições sobre o comércio de aço, etanol, automóveis e carne bovina Proposta contraria entendimento do TCU e, se aprovada, deve aprofundar crise entre Poderes Líderes partidários levam reclamações diversas à ministra em reunião com Hugo Motta Segundo o ministro, vive-se ""uma época em que as fronteiras entre a civilização e a barbárie parecem ténues Contudo, questões como custo de capital e dívida corporativa, educação e habilidades linguísticas em nível baixo, pouca abertura econômica e ambiente regulatório ruim, além da falta de mão de obra qualificada, impedem maior avanço Vereador no Rio, filho do ex-presidente deve disputar eleições por Santa Catarina Empresa já havia investido R$ 630 milhões no ano passado para inaugurar um complexo industrial em Pouso Alegre (MG) Deputados e senadores tem sessão prevista para esta terça-feira Jornalistas das equipes de segurança nacional e política econômica, incluindo aqueles que cobriam a China, teriam sido alvos Tenente-coronel nega ter desrespeitado ordem de proibição",Valor Econômico
