url,data,titulo,texto,fonte
https://valor.globo.com/brasil/noticia/2025/07/24/plano-de-contingencia-contra-tarifaco-tem-medidas-para-todo-gosto-incluindo-linha-de-credito-diz-haddad.ghtml,2025-07-24,"Plano de contingência contra 'tarifaço' 'tem medidas para todo gosto', incluindo linha de crédito, diz Haddad","24/07/2025 15h52Atualizado24/07/2025 Oministro da Fazenda,Fernando Haddad, afirmou nesta quinta-feira (24) que oplano de contingênciadesenhado pelas áreas técnicas do governo para ajudar as empresas que serão afetadas pelo ""tarifaço"" imposto pelo presidente dos Estados Unidos,Donald Trump, ""tem medidas para todo gosto"", incluindo umalinha de crédito. Esse plano, disse Haddad, será apresentado na próxima semana para opresidente Luiz Inácio Lula da Silva, a quem caberá a decisão sobre quais medidas serão adotadas e em qual escala. Leia mais:Com tarifaço, AEB estima queda de 27,4% do superávit comercial brasileiro em 2025Indefinição sobre sobretaxa de Trump preocupa setor de autopeças: 'A tarifa é devastadora' ""O que eu posso dizer é que o cardápio está pronto. Foi feito todo um balanço do que é possível e vai ser apresentado semana que vem. Mas é o presidente da República, dada a sensibilidade do tema, que vai julgar a conveniência, a oportunidade, o que fazer, qual a escala da medida. Isso é uma decisão política que necessariamente vai caber a ele, pela sensibilidade do tema e pela importância do tema"", afirmou Haddad em entrevista à rádio Itatiaia. Ele disse que não poderia dar detalhes das medidas, porque elas ainda carecem do aval do presidente, a quem também caberá a decisão sobre a data de anúncio do plano. Segundo Haddad, são mais de 10 mil empresas brasileiras que podem ser afetadas pelo tarifaço, além dos 340 milhões de americanos que também serão afetados, pois pagarão mais caro pelos produtos que compram do Brasil. O ministro voltou a repetir que não há justificativa técnica para a tarifa de 50% imposta pelos Estados Unidos àimportaçãode produtos brasileiros. Essa tarifa entrará em vigor em 1º de agosto.Haddad frisou que o Brasil segue disposto a negociar. ""Estamos fazendo gestão no sentido de reabrir as negociações na mesa da qual jamais saímos. Nós reiteramos as cartas que enviamos de maio para cá, enfatizando pontos que estamos dispostos a negociar. São temas sensíveis pra eles que estamos abertos a negociar"", disse Haddad. O Brasil, contudo, ainda não teve resposta dessas cartas e o canal de negociação segue travado. Haddad também disse que o governo brasileiro tem orientado asempresas brasileirasa questionar o ""tarifaço"" na Justiça americana. ""Nós estamos orientando, do ponto de vista jurídico, as pessoas [empresas] a procurarem respaldo da legislação americana. O próprio Estado brasileiro já recorreu àOMCe pode recorrer fazendo cumprir a lei"", disse o ministro. Ele afirmou, ainda, que as próprias empresas americanas estão entrando na Justiça, porque precisam dos produtos fornecidos pelo Brasil. ""Tem muitas empresas que estão entrando com ação judicial nos Estados Unidos, inclusive empresas americanas estão litigando contra a decisão do Trump, porque querem os contratos honrados, compraram osuco de laranja, querem o suco de laranja. Está parando a empresa nos Estados Unidos."" O ministro avaliou que o ""tarifaço"" desorganiza as cadeias produtivas do Brasil e dos Estados Unidos. Haddad destacou que aUnião Europeiaestá dando apoio para o Brasil. ""O mundo livre, os organismos internacionais estão apoiando o Brasil, não estão apoiando essa ação unilateral dos Estados Unidos."" Segundo ele, o plano de contingência desenhado pelo governo brasileiro para ajudar as empresas afetadas pelo tarifaço incluirá, inclusive, medidas permitidas pela lei internacional. Família Bolsonaro Na entrevista, Haddad afirmou que afamília Bolsonaroestáobstruindoo canal denegociaçãodo Brasil com os Estados Unidos. Ele fez um apelo aos governadores de direita para que sensibilizem a família Bolsonaro a ""desobstruir"" as negociações. ""A primeira medida que o governo está tomando é tentar uma interlocução com o governo dos Estados Unidos, mas há pessoas ligadas ao ex-presidente [Jair] Bolsonaro que estão lá [em Washington] atuando para que as negociações não tenham início"", disse. Entre essas pessoas, ele citou odeputado federal Eduardo Bolsonaro, filho do ex-presidente, ePaulo Figueiredo, um dos nomes ligados à extrema direita. ""Nós já estaríamos numa mesa de negociação se não fosse a interveniência desses personagens para impedir que a negociação aconteça, porque nós estamos disponíveis o tempo todo. Agora, precisa desobstruir esse canal, e quem está obstruindo esse canal é a família Bolsonaro e os seus apoiadores"", afirmou Haddad. ""Vários governadores no Brasil têm vínculos com a extrema direita. Essas pessoas deveriam se mobilizar junto ao Bolsonaro, ao Paulo Figueiredo, ao Eduardo Bolsonaro, para que parem de militar contra o Brasil, parem de militar contra as negociações, porque eles estão atrapalhando o Brasil"", defendeu o ministro da Fazenda. ""Por isso que eu faço um apelo para que as pessoas que têm amizade, respeito e admiração por essa família podem fazer a diferença de sensibilizar e dizer: 'Olha, saiam do caminho, vocês perderam uma eleição, saiam do caminho, deixem o governo negociar'. O governo assume o bônus e o ônus da negociação."" Haddad avaliou que a família Bolsonaro toma essa atitude visando um ""bônus político"" que não vai se concretizar, porque o ""tarifaço"" vai prejudicar as empresas brasileiras e afetar empregos. ""Querem sabotar a economia brasileira para ter bônus eleitoral, mas as pessoas estão atentas a isso"", disse. ""Esse tipo de coisa visando bônus político eleitoral não interessa ao país"", completou. Scott Bessent O ministro contou que ainda não conversou com osecretário do Tesouro dos Estados Unidos,Scott Bessent, sobre a tarifa de 50%. Houve apenas uma conversa em maio, quando o Brasil ainda estava ameaçado por uma taxa extra de 10%. Segundo Haddad, em maio, Bessent reconheceu que havia espaço para negociação, porque a situação dabalança comercialdo Brasil édeficitáriaem relação aos EUA. ""Ele próprio admitia que havia espaço para uma negociação"", disse. Depois, Haddad não conseguiu mais conversar com Bessent, que informou ao governo brasileiro, por meio dos seus assessores, que as negociações estão concentradas naCasa Branca. ""Nada justifica essa tarifa de 50%, a não ser a atuação da extrema direita"", afirmou Haddad, dizendo que vê uma relação direta entre a situação do ex-presidente Jair Bolsonaro e a taxação. ""Há quanto tempo não se vê um traidor agindo contra interesses nacionais?"", questionou. Contudo, na avaliação de Haddad, isso é um tiro no pé do próprio Trump, porque, além de prejudicar empresas e os cidadãos americanos, o presidente dos EUA tem visto suas",Valor Econômico
https://valor.globo.com/financas/noticia/2025/07/24/cmn-aprova-resolucao-que-atualiza-normas-para-financeiras.ghtml,2025-07-24,CMN aprova resolução que atualiza normas para financeiras,"Em alta 24/07/2025 18h42Atualizado24/07/2025 O Conselho Monetário Nacional (CMN) aprovou nesta quinta-feira uma resolução que faz uma consolidação e atualiza as normas para as financeiras, as Sociedades de Crédito, Financiamento e Investimento (SCFI), informa o Banco Central (BC). A resolução entra em vigor no dia 1º de setembro. De acordo com o BC, a resolução consolida regras antigas em um ato normativo único e revoga atos considerados obsoletos, que vigoravam desde 1959. Além disso, segundo o BC, a resolução incorpora todas as operações que atualmente são permitidas para o segmento e ""inclui atividades de instituições mais recentes, como instituições de pagamento e fintechs de crédito, potencialmente ampliando a competitividade do segmento"". O BC também explicou que, ao consolidar as normas, o objetivo é posicionar adequadamente as SCFIs em relação a instituições que têm escopo mais limitado de atuação. ""Além disso, o ato normativo cria incentivos para que fintechs de crédito e instituições de pagamento migrem, conforme expandam seus negócios, para o segmento mais compatível com suas estratégias, operações e clientes"", informou o BC. O normativo é resultado de consulta pública realizada em 2024, que recebeu 33 contribuições de participantes do mercado, financeiras e escritórios de advocacia. Segundo o BC, algumas sugestões recebidas foram incorporadas ao texto da norma. ""Dentre essas sugestões estão a permissão para atuar como credenciador, na forma de regulamentação vigente para desempenho dessa atividade, e a expressão textual de possibilidade de participação no capital social de outras sociedades"", diz a nota do BC. Ainda de acordo com o Banco Central, alguns temas que estavam em outros atos normativos, como a possibilidade de emissão de Letra de Crédito Imobiliário (LCI) e certificado de operações estruturadas (COE) como fontes de recursos, além da permissão de utilização de instrumentos para captação de recursos no exterior, foram incorporados ao texto. Acompanhe os mercados com nossas ferramentasAcessar gratuitamente Em depoimento ao STF, Mário Fernandes também reconheceu que digitalizou documento Revisão faz parte do programa de US$ 20 bilhões entre o Fundo e a Argentina, realizado em abril, e aguarda agora a aprovação final do Conselho Executivo Na América Latina, as vendas líquidas do 2º trimestre cresceram 17,4% na base anual, para 10,85 bilhões de pesos – ou US$ 584,9 milhões Empresa faz movimento rumo à América Latina enquanto busca abrir capital nos EUA Medida é parte de um grande pacote do Ministério de Minas e Energia para ajudar a aumentar a arrecadação do governo em 2025 e 2026 O vice-presidente e ministro do Desenvolvimento, Indústria, Comércio e Serviços (Mdic) contou que conversou com o secretário de Comércio dos Estados Unidos, Howard Lutnick, no sábado (19) Aérea informou também que protocolou o acordo previamente anunciado com a AerCap, que representa a maior parte de seu passivo de arrendamento de aviões Motivo foi um erro no site, que disponibilizou todo o portfólio por preços entre R$ 150,99 e R$ 161,90 Segundo BC, nova norma inclui atividades de instituições mais recentes, como instituições de pagamento e fintechs de crédito, potencialmente ampliando a competitividade do segmento",Valor Econômico
https://valor.globo.com/politica/noticia/2025/07/24/bolsonaro-vai-a-culto-e-chora-com-pregacao-de-michelle.ghtml,2025-07-24,Bolsonaro vai a culto e chora com pregação de Michelle,"Por Folhapress— Brasília 24/07/2025 16h52Atualizado24/07/2025 Oex-presidente Jair Bolsonaro (PL)participou de um culto na manhã desta quinta-feira (24) e chorou com a pregação de sua esposa,Michelle Bolsonaro. Bolsonaro está de tornozeleira eletrônica e com outras medidas cautelares impostas pelo Supremo Tribunal Federal (STF), como restrição de horário e proibição de deixar sua residência aos finais de semana. Bolsonaro pode dar entrevistas? Entenda a decisão de Moraes em 5 pontosMaria Cristina Fernandes: Moraes faz recuo contrariado em nova decisão Enquanto ocorria o culto, o ministroAlexandre de Moraes, do STF, respondeu aos advogados de Bolsonaro edecidiu afastar eventual prisão preventiva neste momento, mesmo após considerar que o político descumpriu medidas cautelares impostas pela Corte. O ex-presidente participou do culto na Igreja Casa da Benção, em Taguatinga (DF), ao lado do senadorMagno Malta (PL-ES)e do filhoJair Renan, vereador em Balneário Camboriú (SC). Mais novo de seus quatro filhos homens, ele está acompanhando o pai ao menos desde o início da semana. A Casa da Benção é uma igreja evangélica tradicional em Taguatinga, que passou por um escândalo em 2010, envolvendo o ex-governador José Roberto Arruda. Pastores da igreja com mandato na Câmara Legislativa do DF foram flagrados em vídeo com o que ficou conhecido como ""oração da propina"", em que agradeciam recebimento dos recursos ilícitos. Em sua fala, a ex-primeira-dama falou haver censura contra o marido e disse que Deus está no comando. Bolsonaro, que estava na primeira fileira, chorou. Moraes afirmou que, em discurso na Câmara dos Deputados, Bolsonaro voltou a instigar apoiadores contra as medidas impostas pelo Supremo. A replicação da fala do ex-presidente pelo filhoEduardo Bolsonaro (PL)nas redes sociais foi caracterizada pelo ministro como um ""ilícito modus operandi"" na tentativa de obstrução de Justiça. Na decisão, o ministro diz que Bolsonaro não está proibido de dar entrevistas ou discursos públicos. Segundo Moraes, o veto está relacionado à ""utilização de subterfúgios para a manutenção da prática de atividades criminosas"". Moraes entende que as declarações de Bolsonaro são previamente definidas para repercutirem nas redes sociais de forma coordenada. Essa estratégia, na visão do ministro, seria uma forma do ex-presidente burlar a decisão do STF que o proibiu de usar redes sociais. Acompanhe os mercados com nossas ferramentasAcessar gratuitamente Em depoimento ao STF, Mário Fernandes também reconheceu que digitalizou documento Revisão faz parte do programa de US$ 20 bilhões entre o Fundo e a Argentina, realizado em abril, e aguarda agora a aprovação final do Conselho Executivo Na América Latina, as vendas líquidas do 2º trimestre cresceram 17,4% na base anual, para 10,85 bilhões de pesos – ou US$ 584,9 milhões Empresa faz movimento rumo à América Latina enquanto busca abrir capital nos EUA Medida é parte de um grande pacote do Ministério de Minas e Energia para ajudar a aumentar a arrecadação do governo em 2025 e 2026 O vice-presidente e ministro do Desenvolvimento, Indústria, Comércio e Serviços (Mdic) contou que conversou com o secretário de Comércio dos Estados Unidos, Howard Lutnick, no sábado (19) Aérea informou também que protocolou o acordo previamente anunciado com a AerCap, que representa a maior parte de seu passivo de arrendamento de aviões Motivo foi um erro no site, que disponibilizou todo o portfólio por preços entre R$ 150,99 e R$ 161,90 Segundo BC, nova norma inclui atividades de instituições mais recentes, como instituições de pagamento e fintechs de crédito, potencialmente ampliando a competitividade do segmento",Valor Econômico
https://valor.globo.com/financas/criptomoedas/noticia/2025/07/24/bitgo-abre-filial-no-brasil-de-olho-em-custdia-para-bancos.ghtml,2025-07-24,BitGo abre filial no Brasil de olho em custódia para bancos,"24/07/2025 19h17Atualizado24/07/2025 A empresa de custódia de criptoativos americanaBitGoabriu umafilial no Brasilde olho nas oportunidades do mercado local, no qual já atuam concorrentes, como a israelenseFireblocks. Em entrevista aoValor, o diretor para América Latina da empresa,Luis Ayala, afirma que a estratégia éexplorar as possibilidades de parceria com bancos que estão entrando no mundo cripto e aproveitar a forte adoção da tecnologia pelos brasileiros. O movimento vem ao mesmo tempo em que a companhia entra com pedido de Oferta Pública Inicial(IPO) nos Estados Unidos, segundo informações veiculadas pela imprensa internacional. De acordo com Ayala, o relacionamento da BitGo com o país vem de antes, apesar do desembarque oficial acontecer agora, pois a companhia teve seu primeiro cliente brasileiro em 2017.Hoje, já são 25, o que tornou importante estabelecer uma base aqui. “A regulamentação de criptomoedas ainda não está clara no Brasil e queríamos ser um player mais local para receber em reais e ter faturas diretamente no país”, explica. Entre os clientes da BitGo no país atualmente hábancos,neobancos,corretoras de criptoativose fundos negociados em bolsa (ETFs). Existem sete pessoas trabalhando no país para atender a esses usuários. Para o executivo, ajudar as instituições financeiras que estão dando seus primeiros passos no mercado de ativos digitais é uma estratégia central para a empresa. “É trazer não só tecnologia de custódia. Nosso processo tem também um seguro para operações de custódia locais dos bancos”, destaca. “Não queremos competir com o mercado de custódia desses bancos, mas queremos ser parceiros para ajudar a fazer isso de forma clara e segura. Ayala conta que a BitGo tem umacamada de custódia fiduciária regulamentada com um seguro na Lloyd’s de Londres, que paga até US$ 250 milhões. Esse valor pode chegar até US$ 1 bilhão caso o cliente queira contratar o adicional. Mesmo com o foco em bancos, Ayala esclarece que a empresa também se dedica a casos de uso mais complexos na mira das chamadas empresas criptonativas, a exemplo do chamadostaking(remuneração obtida ao manter uma criptomoeda bloqueada em determinada blockchain para ajudar no processo de validação). “As criptonativas estão fazendo casos de uso muito mais complexos, como compartilhar ganhos diretamente do staking. Temos bem clara essa diferença.” Em relação ao que oBanco Central (BC)já adiantou sobre o que trará na regulamentação das empresas prestadoras de serviços de ativos virtuais (PSAVs), o executivo aponta que não há uma estratégia clara da empresa, pois as regras ainda podem mudar, mas que o ponto que trata dos países nos quais a custódia pode ser realizada não seria um grande problema. Pela redação da consulta pública 109, a custódia só poderá ser feita em países com regulação compatível com a do Brasil e quando o BC tiver acordo de cooperação com a autoridade regulatória local. “Já temos custódia na Dakota do Sul e em Nova York [nos EUA], além de Alemanha, Dinamarca, Suíça, Dubai e Singapura. Acho que é uma força nossa”, argumenta o executivo. Acompanhe os mercados com nossas ferramentasAcessar gratuitamente Em depoimento ao STF, Mário Fernandes também reconheceu que digitalizou documento Revisão faz parte do programa de US$ 20 bilhões entre o Fundo e a Argentina, realizado em abril, e aguarda agora a aprovação final do Conselho Executivo Na América Latina, as vendas líquidas do 2º trimestre cresceram 17,4% na base anual, para 10,85 bilhões de pesos – ou US$ 584,9 milhões Empresa faz movimento rumo à América Latina enquanto busca abrir capital nos EUA Medida é parte de um grande pacote do Ministério de Minas e Energia para ajudar a aumentar a arrecadação do governo em 2025 e 2026 O vice-presidente e ministro do Desenvolvimento, Indústria, Comércio e Serviços (Mdic) contou que conversou com o secretário de Comércio dos Estados Unidos, Howard Lutnick, no sábado (19) Aérea informou também que protocolou o acordo previamente anunciado com a AerCap, que representa a maior parte de seu passivo de arrendamento de aviões Motivo foi um erro no site, que disponibilizou todo o portfólio por preços entre R$ 150,99 e R$ 161,90 Segundo BC, nova norma inclui atividades de instituições mais recentes, como instituições de pagamento e fintechs de crédito, potencialmente ampliando a competitividade do segmento",Valor Econômico
https://valor.globo.com/brasil/noticia/2025/07/24/anp-muda-clculo-de-referncia-do-petrleo-o-que-pode-aumentar-arrecadao-do-governo.ghtml,2025-07-24,"ANP muda cálculo de referência do petróleo, o que pode aumentar arrecadação do governo","24/07/2025 19h14Atualizado24/07/2025 AAgência Nacional do Petróleo (ANP)aprovou, nesta quinta-feira (24),a mudança da metodologia de cálculo do preço de referência do petróleo para distribuição de participações governamentais, como royalties e participações especiais.A nova metodologia entra em vigor em 1° de setembro e terá impacto a partir de novembro, diz a agência. A medida é parte de um grande pacote doMinistério de Minas e Energia (MME)para ajudar a aumentar a arrecadação do governo em 2025 e 2026. Conforme cálculos de técnicos da pasta, todas as propostas, que incluem a aprovação da ANP, renderiam R$ 35 bilhões aos cofres públicos neste ano e no próximo. Segundo a ANP, a resolução aprovada nesta quinta-feira busca aprimorar a regulação e torná-la mais aderente ao cenário de preços praticados no mercado internacional. Com a mudança, o cálculo passa a considerar um diferencial de qualidade do petróleo. ""Se o petróleo de determinado campo for de melhor qualidade, o seu preço de referência aumenta. Assim como se a qualidade for inferior, diminui. Para fazer essa comparação de qualidade são usados derivados, como gasolina, diesel e o óleo combustível"". A reguladora segue princípios de especificação determinados pelaOrganização Marítima Internacional (IMO, na sigla em inglês), pela regulamentação IMO 2020, que determinou novos limites máximos de teor de enxofre dos produtos, incluindo o óleo combustível marítimo. ""A IMO 2020 reduziu o teor de enxofre do óleo combustível para navios, em algumas localidades, de 3,5% para 0,5%, acarretando transformação no mercado internacional de óleo combustível"", diz a ANP. ""Por isso, a nova fórmula adotada irá utilizar ambos os padrões de qualidade, fazendo uma ponderação que utilizará os preços do óleo combustível com 0,5% e com 3,5% de enxofre (50% cada), já que ambos permaneceram sendo comercializados no mercado internacional."" Acompanhe os mercados com nossas ferramentasAcessar gratuitamente Em depoimento ao STF, Mário Fernandes também reconheceu que digitalizou documento Revisão faz parte do programa de US$ 20 bilhões entre o Fundo e a Argentina, realizado em abril, e aguarda agora a aprovação final do Conselho Executivo Na América Latina, as vendas líquidas do 2º trimestre cresceram 17,4% na base anual, para 10,85 bilhões de pesos – ou US$ 584,9 milhões Empresa faz movimento rumo à América Latina enquanto busca abrir capital nos EUA Medida é parte de um grande pacote do Ministério de Minas e Energia para ajudar a aumentar a arrecadação do governo em 2025 e 2026 O vice-presidente e ministro do Desenvolvimento, Indústria, Comércio e Serviços (Mdic) contou que conversou com o secretário de Comércio dos Estados Unidos, Howard Lutnick, no sábado (19) Aérea informou também que protocolou o acordo previamente anunciado com a AerCap, que representa a maior parte de seu passivo de arrendamento de aviões Motivo foi um erro no site, que disponibilizou todo o portfólio por preços entre R$ 150,99 e R$ 161,90 Segundo BC, nova norma inclui atividades de instituições mais recentes, como instituições de pagamento e fintechs de crédito, potencialmente ampliando a competitividade do segmento",Valor Econômico
