url,data,titulo,texto,fonte
https://exame.com/mundo/pai-de-miguel-uribe-vai-substitui-lo-como-pre-candidato-nas-eleicoes-de-2026-na-colombia/,2025-08-22,Pai de Miguel Uribe vai substituí-lo como pré-candidato nas eleições de 2026 na Colômbia,"Agência de notícias Publicado em22 de agosto de 2025 às19h59. Última atualização em22 de agosto de 2025 às20h08. Miguel Uribe Londoño, pai do senador assassinado a tiros Miguel Uribe Turbay, assumiráo lugar de seu filho como pré-candidato presidencial da direita nas eleições de 2026 na Colômbia, anunciou seu partido político nesta sexta-feira, 22. Uribe Turbay morreu na semana passada devido a ferimentos na cabeça após um ataque armado em junho, que intensifica a polarização e revive os fantasmas dos piores anos da violência política, com cinco candidatos presidenciais assassinados durante a segunda metade do século 20. ""A partir de hoje [Uribe Londoño] entra no processo de seleção do candidato presidencial"", anunciou em comunicado o Centro Democrático, o maior partido de direita na Colômbia cujo líder histórico é o ex-presidente Álvaro Uribe (2002-2010), sem parentesco com a família Uribe Turbay. Com 79 anos, Uribe Londoño entrará na disputa com outros pesos pesados de seu setor, como as legisladoras María Fernanda Cabal e Paloma Valencia, ""para escolher um único candidato"" entre dezembro de 2025 e janeiro de 2026, acrescentou o partido. Uribe Londoño foi casado com a renomada jornalista Diana Turbay, sequestrada em 1990 por ordem de Pablo Escobar e assassinada durante uma operação de resgate. Na época, o pequeno Miguel, filho de ambos, tinha 5 anos. ""Há 34 anos, a guerra levou aquela que foi minha esposa"", disse em discurso pouco antes do enterro de seu filho na semana passada. ""Tive de dizer a uma criança (...) com toda a dor da minha alma a horrível notícia do assassinato de sua mãe."" ""Essa absurda violência também me arranca esse mesmo menino"", acrescentou. Quando sua esposa foi assassinada, Uribe Londoño era um reconhecido empresário do café. Entre 1988 e 1990, foi vereador de Bogotá. Ele é membro do Centro Democrático desde sua fundação em 2013 e logo depois foi coordenador do partido na capital. As autoridades da Colômbia capturaram seis pessoas vinculadas ao assassinato de Uribe Turbay, incluindo o atirador de 15 anos, e apontam como principal suspeita a dissidência das Farc conhecida como Segunda Marquetalia. O primeiro-ministro canadense, Mark Carney, anunciou que, a partir de 1º de setembro, o Canadá deixará de aplicar as tarifas punitivas aos EUA para facilitar um acordo comercial com Trump O policial disse que várias pessoas ficaram presas e algumas foram ejetadas do ônibus Na quinta-feira, a Rússia também lançou 574 drones e 40 mísseis contra o território ucraniano em seu maior ataque em semanas Estados Unidos tentam pressionar governo da Venezuela há mais de uma década, com uma série de punições 01 02 03 exame no whatsapp Receba as notícias da Exame no seu WhatsApp Nos acontecimentos mais relevantes do Brasil e mundo. E-mail inválido Desperta",Exame
https://exame.com/brasil/bolsonaro-pode-ser-preso-o-que-acontece-apos-defesa-responder-questionamentos-de-moraes/,2025-08-22,Bolsonaro pode ser preso? O que acontece após defesa responder a questionamentos de Moraes,"Bolsonaro: defesa do ex-presidente enviou resposta para Moraes Repórter de Brasil e Economia Publicado em22 de agosto de 2025 às19h54. Última atualização em22 de agosto de 2025 às20h03. Adefesa do ex-presidenteJair Bolsonaro(PL) negou aoSupremo Tribunal Federal (STF), na noite desta sexta-feira, 22, que ele tenha planejado pedir asilo à Argentina e que tenhadescumprido medidas cautelares impostas pela Corte. Os esclarecimentos foram apresentados por determinação do ministro Alexandre de Moraes, após a Polícia Federal (PF) apontar o desrespeito às obrigações. Ao questionar a defesa do ex-presidente, Moraescitou a “reiteração de condutas ilícitas” atribuídas a Bolsonaro e destacou o risco de fuga, com base no relatório da PF. Foi encontrado um rascunho de pedido de asilo político na Argentina. A defesa do ex-presidente argumenta, no entanto, que a carta foi enviada a ele como uma ""sugestão"", mas que em nenhum momento ele cogitou fugir do país para escapar do processo. Os advogados citam o fato de que o documento foi enviado há mais de um ano, em fevereiro de 2024, e que desde então Bolsonaro cumpriu todas as obrigações impostas pela Justiça. Os advogados disseram a Moraes que Bolsonaro nunca esteve proibido de usar o ""WhatsApp, de trocar mensagens e de se manifestar"". ""A tentativa de incriminar o envio de mensagens privadas para sua lista de contatos é, de um lado, dar uma interpretação elástica às medidas cautelares impostas que, pelo contrário, deveriam ter sempre leitura restrita e precisa"", falaram os advogados de Bolsonaro. Os investigadores identificaram umrascunho de pedido de asilo político na Argentina, datado de fevereiro de 2024, poucos dias após uma operação de busca e apreensão contra o ex-presidente. Segundo o ministro, “os elementos de prova obtidos pela Polícia Federal indicam que Jair Messias Bolsonaro tinha posse de documento destinado a possibilitar sua evasão do território nacional”. Outro ponto levantado foi uma troca de mensagens entre Bolsonaro e o generalBraga Netto,em fevereiro do ano passado.Ambos são réus por tentativa de golpe de Estado e estavam proibidos de manter contato. Bolsonaroteria compartilhado vídeos sobre sanções dos Estados Unidos ao ministro Alexandre de Moraes, além de divulgar eventos. A PF ainda registrou conversas dele com o advogado americano Martin de Luca, ligado à Trump Media & Technology Group e à plataforma Rumble. O jurista moveu ações nos EUA contra Moraes, sob a acusação de censura. Após a apresentação de resposta da defesa do ex-presidente, Moraes deve encaminhar os esclarecimentos à Procuradoria-Geral da República (PGR), que emitirá um parecer indicando se houve ou não violação das medidas em até 48 horas. Com base no parecer, Moraes decidirá se mantém as cautelares ou se impõe novas medidas contra Bolsonaro, como uma eventual prisão preventiva. Segundo a legislação, a prisão preventiva poderá ser decretada como garantia da ordem pública, por conveniência da instrução criminal ou para assegurar a aplicação da lei penal, quando houver prova de existência do crime e indícios suficientes da autoria. Essa prisão não tem prazo determinado e pode ser mantido enquanto persistirem os fundamentos legais, como risco à ordem pública ou à investigação. Bolsonaro atualmente cumpre prisão domiciliar, por ter descumprido medidas cautelares determinadas pelo ministro. A PF pediu o indiciamento de Bolsonaro pelos crimes de coação no curso do processo e tentativa de abolição do Estado Democrático de Direito. A investigação da Polícia Federal aponta que tanto o ex-presidente quanto seu filho Eduardo Bolsonaro utilizaram recursos para interferir nas investigações e ameaçar o regular andamento dos processos judiciais. As acusações incluem a prática decoação no curso do processo, que se refere a tentativas de influenciar o julgamento da Ação Penal 2668/DF, eobstrução de investigação, com o objetivo de prejudicar as investigações sobre os eventos pós-eleições de 2022. A decisão foi tomada após a PF concluir as investigações sobre a atuação de Eduardo junto ao governo do presidente dos Estados Unidos, Donald Trump, para promover medidas de retaliação contra o governo brasileiro e ministros do Supremo. O governo dos Estados Unidos anunciou nos últimos meses uma série de ações contra o Brasil e autoridades brasileiras, como o tarifaço de 50% contra importações de produtos do país, uma investigação comercial contra o Pix e sanções financeiras contra o ministro Alexandre de Moraes na Lei Magnitsky. Advogados do ex-presidente responderam determinação de Moraes, após relatório da PF Em São Paulo, o calor predomina especialmente no interior Ministro de Minas e Energia disse que pretende retomar investimentos em grandes usinas hidrelétricas O benefício reconhece que a atividade envolve riscos elevados, como colisões, atropelamentos e situações de violência 01 02 03 exame no whatsapp Receba as notícias da Exame no seu WhatsApp Nos acontecimentos mais relevantes do Brasil e mundo. E-mail inválido Desperta",Exame
https://exame.com/invest/minhas-financas/mega-sena-sorteia-premio-de-r-28-milhoes-no-sabado-veja-como-jogar-e-fazer-bolao/,2025-08-22,Mega-Sena sorteia prêmio de R$ 28 milhões no sábado; veja como jogar e fazer bolão,"Mega-Sena: o jogo simples, com seis números marcados, custa R$ 6 (Rafa Neddermeyer/Agência Brasil) Redação Exame Publicado em22 de agosto de 2025 às19h49. Última atualização em22 de agosto de 2025 às19h56. AMega-Senarealiza no sábado, 23, oconcurso 2905com prêmio estimado em R$ 28 milhões. O sorteio será realizado no Espaço da Sorte, em São Paulo. Os interessados podem apostar até as 19h do dia do sorteio nas casas lotéricas de todo o país, no portal Loterias Caixa (www.loteriasonline.caixa.gov.br) ou no app Loterias Caixa (disponível para usuários das plataformas iOS e Android), além da internet banking para clientes do banco. Pela web, é necessário ter um cadastro, ser maior de 18 anos e informar o número do cartão de crédito (caso de não clientes da Caixa). O palpite mínimo custa R$ 6.Além desse modelo de aposta, com seis números selecionados, que paga o prêmio principal, ainda é possível ganhar prêmios ao acertar quatro ou cinco dezenas. Bolão Caixa é a possibilidade que o apostador tem de realizar apostas em grupo. Basta preencher o campo próprio no volante ou solicitar ao atendente da lotérica. Na Mega-Sena, os bolões têm um preço mínimo de apenas R$ 15, com cada cota a partir de R$ 6. Veja os dez maiores prêmios sorteados na História da Mega-Sena: O prazo para retirar prêmios de loteria se encerra 90 dias após a data do sorteio. Depois disso, os valores são repassados ao Tesouro Nacional para aplicação no Fundo de Financiamento ao Estudante do Ensino Superior (Fies). Os apostadores que acertarem as seis dezenas da Mega-Sena vão receber uma fatia maior do prêmio. Uma portaria da Secretaria de Prêmios e Apostas do Ministério da Fazenda elevou de 35% para 45% o total destinado ao prêmio principal. Com o aumento nos prêmios principais, as faixas inferiores pagarão prêmios menores. O prêmio da quina (cinco dezenas) caiu de 19% para 13% do valor destinado a premiações. O total destinado à quadra (quatro acertos) recuou de 19% para 15%. A Justiça do Trabalho realizará um leilão nacional para o pagamento de dívidas trabalhistas Conheça fundos, ETFs, BDRs e outras formas de aplicar na moeda americana diretamente por corretoras brasileiras, sem precisar enviar dinheiro para fora Dólar à vista fechou a sessão desta sexta-feira, 22, em queda de 0,97%, a R$ 5,425 Medida ocorre em meio a prejuízos bilionários e dificuldades na retomada da fabricante de chips 01 02 03 exame no whatsapp Receba as notícias da Exame no seu WhatsApp Nas melhores oportunidades do mercado para investir. E-mail inválido Invest",Exame
https://exame.com/brasil/defesa-de-bolsonaro-nega-ao-stf-que-ele-tenha-buscado-asilo-e-descumprido-obrigacoes/,2025-08-22,Defesa de Bolsonaro nega ao STF que ele tenha buscado asilo e descumprido obrigações,"Moraes deu 48 horas para a defesa de Bolsonaro apresentar esclarecimentos (Mateus Bonomi / AFP) Agência de notícias Publicado em22 de agosto de 2025 às19h45. Adefesa do ex-presidente Jair Bolsonaro(PL) negou ao Supremo Tribunal Federal (STF) que ele tenha planejado pedir asilo à Argentina e que tenha descumprido medidas cautelares impostas pela Corte.Os esclarecimentos foram apresentados por determinação do ministro Alexandre de Moraes, após a Polícia Federal (PF) apontar o desrespeito às obrigações. Os advogados dizem a Moraes que Bolsonaro nunca esteve proibido de usar o ""WhatsApp, de trocar mensagens e de se manifestar"". ""A tentativa de incriminar o envio de mensagens privadas para sua lista de contatos é, de um lado, dar uma interpretação elástica às medidas cautelares impostas que, pelo contrário, deveriam ter sempre leitura restrita e precisa"", argumentam os advogados de Bolsonaro. A PF relatou o descumprimento das cautelares no mesmo relatório em que indiciou Bolsonaro e um de seus filhos, o deputado federal Eduardo Bolsonaro (PL-SP), por coação no curso do processo abolição violenta do Estado Democrático de Direito. Os dois são suspeitos de utilizarem sanções aplicadas pelos Estados Unidos para atrapalhar a ação penal da trama golpista. Na quarta-feira, após a apresentação do relatório, Moraes deu 48 horas para a defesa de Bolsonaro apresentar ""esclarecimentos sobre os reiterados descumprimentos das medidas cautelares impostas, a reiteração das condutas ilícitas e a existência de comprovado risco de fuga"". O pedido foi feito por Moraes após a PF encontrar uma carta com um pedido de asilo político ao presidente da Argentina, Javier Milei, no celular de Bolsonaro. O documento, de 33 páginas, prevê uma alegação de perseguição política no Brasil. “De início, devo dizer que sou, em meu país de origem, perseguido por motivos e por delitos essencialmente políticos. No âmbito de tal perseguição, recentemente, fui alvo de diversas medidas cautelares”, diz o texto. A defesa do ex-presidente argumenta, no entanto, que a carta foi enviada a ele como uma ""sugestão"", mas que em nenhum momento ele cogitou fugir do país para escapar do processo. Os advogados citam o fato que o documento foi enviado há mais de um ano, em fevereiro de 2024, e que desde então Bolsonaro cumpriu todas as obrigações impostas pela Justiça. Bolsonaro está em prisão preventiva, em regime domiciliar, desde o início de agosto. A prisão foi decretada justamente devido ao descumprimento de outras cautelares, que tinham sido impostas por Moraes em julho, como a proibição do uso de redes sociais, mesmo que por terceiros. Agora, a PF apontou novos indícios de desrespeito à proibição do uso de redes sociais, como o envio por WhatsApp de vídeos que depois seriam publicados por outras pessoas nas plataformas. Segundo o relatório, o ex-presidente atuou para ""propagar e amplificar por meio das redes sociais ataques em face de ministros do Supremo Tribunal Federal e dos chefes do Poder Legislativo (Câmara dos Deputados e Senado Federal), de modo a coagir e restringir o livre exercício dos poderes constituídos, visando impor a votação de proposta de anistia e de destituição de ministros do Supremo Tribunal Federal por supostos crimes de responsabilidade"". O documento, de 33 páginas, em que Bolsonaro solicita asilo a Milei, cita as medidas cautelares e o argumento de perseguição política para justificar a perseguição. “De início, devo dizer que sou, em meu país de origem, perseguido por motivos e por delitos essencialmente políticos. No âmbito de tal perseguição, recentemente, fui alvo de diversas medidas cautelares”, diz o texto. Segundo análise da perícia, o arquivo foi salvo no aparelho no dia 10 de fevereiro de 2024, dois dias após o ex-presidente ter seu passaporte apreendido. No dia 12 do mesmo mês, ex-mandatário foi à embaixada da Hungria no Brasil, onde ficou por duas noites. Para os investigadores, a carta endereçada a Milei, um aliado, revela que o ex-presidente planejou fugir do país para escapar de eventuais punições. “Embora se trate de um único documento em formato editável, sem data e assinatura, seu teor revela que o réu, desde a deflagração da operação Tempus Veritatis, planejou atos para fugir do país, com o objetivo de impedir a aplicação de lei penal”, diz o relatório da PF. O argumento de que se tratava apenas de uma sugestão, mas que nunca foi levada adiante, também já foi utilizada pelo ex-presidente em outros momentos, como no caso da discussão de uma minuta golpista. Em interrogatório ao STF, em junho, Bolsonaro admitiu ter apresentado a comandantes das Forças Armadas um documento no qual previa alternativas diante da derrota eleitoral de 2022, quando Luiz Inácio Lula da Silva foi eleito. Segundo o ex-presidente, porém, as medidas foram descartadas e não havia “clima”, “oportunidade” e “base minimamente sólida para qualquer coisa”. Ao indiciar Bolsonaro por coação à Justiça no processo da trama golpista, a PF também afirmou que o ex-ministro Walter Braga Netto, réu na mesma ação, descumpriu a proibição de entrar em contato com o ex-presidente. Foi encontrada uma mensagem enviada pelo militar ao aliado afirmando que estava com um novo número “para qualquer emergência”. A investigação ainda evidenciou o uso do tarifaço imposto ao Brasil pelo governo de Donald Trump como barganha para livrar o ex-presidente de punições. As conversas de Bolsonaro com o filho e com o pastor Silas Malafaia, também investigado no caso, mostram como as tarifas impostas pelos EUA foram utilizadas para pressionar por uma anistia direcionada ao próprio ex-presidente. A estratégia foi evidenciada em mensagem enviada por Eduardo ao pai em 7 de julho, no mesmo dia em que Trump fez uma publicação criticando o processo criminal contra o aliado. O deputado considerou que uma “anistia light”, que beneficiaria apenas os executores do 8 de Janeiro, encerraria a “ajuda” dos EUA. Com isso, indicou que seria necessária uma medida mais ampla, que beneficiaria Bolsonaro também. ""Se a anistia light passar, a última ajuda vinda dos EUA terá sido o post do Trump. Eles não irão mais ajudar. Temos que decidir entre ajudar o Brasil, brecar o STF e resgatar a democracia OU enviar o pessoal que esteve",Exame
https://exame.com/pop/carminha-nazare-e-odete-roitman-as-10-vilas-mais-iconicas-das-novelas-brasileiras/,2025-08-22,"Carminha, Nazaré e Odete Roitman: as 10 vilãs mais icônicas das novelas brasileiras","Carminha: vilã é uma das mais icônicas da história da TV (TV Globo/Reprodução) Redação Exame Publicado em22 de agosto de 2025 às19h39. Asnovelas brasileirassão famosas por suas histórias emocionantes e personagens memoráveis. Mas, entre osheróis e heroínas, as vilãs quase sempre roubaram a cenacom suas atitudes impiedosas, artimanhas e sede de poder. Ao longo das décadas, muitas delas se tornaram ícones, não só por sua maldade, mas também pela maneira com que conquistaram o público e marcaram a história da TV. Confira a lista das10 vilãs mais icônicas das novelas brasileiras, segundo um compilado de enquetes e estudos sobre a dramaturgia: Interpretada porAdriana Esteves, Carminha se tornou um dos maiores ícones de vilania contemporânea. Calculista, manipuladora e disposta a tudo para conquistar poder e vingança, Carminha foi capaz de destruir vidas sem remorso. Sua trama de vingança contra a família de Nina (Débora Falabella) e a forma como ela comandava seu destino a tornaram inesquecíveis, com sua personalidade complexa e suas estratégias maquiavélicas. Com a inconfundível interpretação deRenata Sorrah, Nazaré Tedesco virou um verdadeiro símbolo da maldade na TV. Obcecada por status e dinheiro, Nazaré não tinha limites quando o assunto era destruir vidas para alcançar seus objetivos. Sua risada maléfica e suas tramas para destruir a vida de Maria do Carmo (Susana Vieira) marcaram gerações de telespectadores, consolidando Nazaré como uma das vilãs mais lembradas da história da teledramaturgia. Interpretada por Glória Menezes, Laurinha é sobrinha da protagonista Maria do Carmo, mas mergulha em tramas de inveja, intrigas familiares e até assassinato para usurpar fortuna e status. Sua arrogância e falsidade marcam a intensa rivalidade no universo da sucata paulistana. Na obra de Gilberto Braga, Claudia Abreu deu vida a Laura, uma ambiciosa sem escrúpulos que ascende no mundo das celebridades a qualquer custo. Seu cinismo e dissimulação, aliados a crimes como assassinato e chantagem, tornaram-na uma das vilãs mais inesquecíveis da teledramaturgia brasileira. Bárbara Paztrouxe à vida Dolores, uma dona de casa que, à primeira vista, parecia ser a típica esposa submissa, mas que, na realidade, se revelava uma mulher vingativa, ardilosa e cheia de artimanhas. Sua busca por poder e sua habilidade em manipular todos ao seu redor conquistaram os telespectadores e garantiram seu lugar entre as vilãs mais marcantes. A psicólogaVilma, interpretada porMalu Galli, ficou marcada por sua frieza e psicopatia. Embora parecesse uma mulher recatada, Vilma cometeu crimes horríveis ao longo da trama. Seu comportamento manipulador e suas atitudes cruéis tornaram-na uma das vilãs mais odiadas e lembradas da teledramaturgia. Malu Maderdeu vida a Carolina, uma mulher de comportamento ambíguo que, embora não fosse tão explicitamente malvada, era manipuladora e fria. Seu relacionamento com o marido e o modo como usava a manipulação emocional fizeram dela uma vilã inesquecível. O jogo psicológico que ela fazia com a protagonista Helena (Vera Fischer) lhe garantiu o título de vilã, apesar de sua abordagem mais sutil. A imortal interpretação deBeatriz Segallcomo Odete Roitman é um marco na história das vilãs. Representando a elite arrogante e egoísta, Odete se tornou sinônimo de vilania. Sua morte, que virou um dos maiores mistérios da teledramaturgia brasileira, foi um dos momentos mais emblemáticos da novela, e sua personalidade cheia de desprezo pelos outros a tornou uma das vilãs mais icônicas. Interpretada porSusana Vieira, Pilar era uma empresária implacável, disposta a destruir qualquer um que estivesse em seu caminho. Sua sede de poder e sua crueldade em negócios fizeram dela uma vilã memorável na década de 90. Pilar se destacou não apenas pela sua frieza, mas pela forma como dominava todos ao seu redor. A personagem dePatrícia Pillarem “A Indomada” foi uma das vilãs mais complexas e cheias de nuances. Morgana liderava com mão de ferro uma rivalidade familiar em Greenville, sempre cercada por superstições e vingança. Sua postura autoritária e a manipulação de sua família para alcançar seus objetivos tornaram-na uma figura inesquecível. Segundo semestre de 2025 terá a maior parte dos feriados em sábados ou domingos; veja calendário Ocasião é conhecida como a estação das flores, quando várias delas — de diversos tipos — começam a desabroxar e a transformar o ambiente Produção, baseada na popular trilogia literária de Jenny Han, conquistou fãs ao redor do mundo e, com o término da série, promete fechar de maneira definitiva a história contada desde 2023 Nono mês do ano marca o início da Primavera no Hemisfério Sul 01 02 03 exame no whatsapp Receba as notícias da Exame no seu WhatsApp Nos acontecimentos mais relevantes do Brasil e mundo. E-mail inválido Desperta",Exame
