url,data,titulo,texto,fonte
https://exame.com/invest/mercados/menor-demanda-domestica-julho-dificil-derruba-as-acoes-da-american-airlines/,2025-07-24,Menor demanda doméstica: julho 'difícil' derruba as ações da American Airlines,"A American Airlines oferece mais destinos e voos domésticos em relação a suas duas maiores rivais: Delta e United Redator Publicado em24 de julho de 2025 às20h02. AAmerican Airlinesregistrou uma queda significativa de suas ações no pregão desta quinta-feira, 24. Os papéis da companhia aérea caíram 6% após acompanhia aéreadeclarar, em teleconferência para analistas, que a demanda por voos domésticos (dentro dos Estados Unidos) foi abaixo do esperado para o último trimestre e o mês de julho, uma tendência que já havia sido observada em sua concorrente, aSouthwest Airlines. ""O mês de julho tem sido difícil, realmente afetado pela incerteza durante o período de reserva primária"", disse o CEO da American Airlines, Robert Isom, durante a teleconferência de resultados da empresa nesta quinta-feira. A companhia registrou queda de 6% na receita doméstica em relação ao mesmo período do terceiro trimestre de 2024. A empresa, no entanto, estima que o desempenho melhore nos próximos meses e não afete o resultado projetado para o segundo semestre do ano. “Vamos encarar a realidade: a rede de voos domésticos está sob pressão devido à incerteza na economia e à relutância dos passageiros domésticos em entrar neste jogo”, disse Isom. A American disse que espera um prejuízo por ação entre US$ 0,10 e US$ 0,60 durante o trimestre atual e lucros para 2025 em uma faixa entre um prejuízo de US$ 0,20 e um ganho de US$ 0,80 por ação. A American Airlines oferece mais destinos e voos domésticos em relação a suas duas maiores rivais:DeltaeUnited. De modo geral, o setor tem se dedicado a atender à demanda de rotas internacionais, bem como a de assentos premium, que geram preços de passagens mais altos. Com a aprovação, a Skydance agora pode concluir a transação e assumir o controle da Paramount nas próximas semanas Vendas no período foram beneficiadas por expansões dos shopping centers, uma das principais estratégias da companhia Receita com nuvem cresce 32% e mercado reage com alta das ações após anúncio de novos aportes No início do mês, o presidente americano Donald Trump anunciou uma tarifa extra de importação de 50% para os produtos brasileiros 01 02 03 exame no whatsapp Receba as notícias da Exame no seu WhatsApp Nos bastidores do mercado com notícias exclusivas. E-mail inválido Exame Insight",Exame
https://exame.com/ciencia/jovens-ganham-dinheiro-como-iscas-de-mosquitos-para-combater-doenca-causadora-de-cegueira/,2025-07-24,Jovens ganham dinheiro como iscas de mosquitos para combater doença causadora de cegueira,"Aedes Aegpty, o mosquito que transmite a dengue e outras doenças (Getty Images) Repórter Publicado em24 de julho de 2025 às19h39. Toda segunda e terça-feira pela manhã, Bosede Oluwaokere, de 48 anos, acorda em sua casa, na cidade de Ilorin, no oeste daNigéria, se veste e caminha até um riacho nas proximidades. Senta-se sob uma árvore e levanta sua saia até a altura das coxas. Durante as próximas seis horas, ela permanece ali, aguardando que um tipo específico demosquitose posicione sobre ela, para poder capturá-la com um pequeno tubo de plástico. Oluwaokere é uma ""papa-mosquito humana"" – ou captura de pouso humana, como é conhecida pelaOrganização Mundial da Saúde (OMS)– considerada o ""padrão ouro"" na coleta de borrachudos. Esses insetos hematófagos, que se reproduzem nas proximidades de rios, transmitem a oncocercose, uma doença tropical que pode levar à cegueira, conhecida também como ""cegueira dos rios"". Quando uma pessoa é picada por um borrachudo infectado, as larvas do parasita Onchocerca volvulus entram no corpo, onde se transformam em vermes que podem viver por até 15 anos. As fêmeas desses vermes produzem milhares delarvas microscópicasque se espalham pelo corpo. Se essas larvas atingirem os olhos, podem causar perda permanente da visão. Os borrachudos podem transmitir a doença quando se alimentam do sangue de uma pessoa infectada e, ao picar outra, transmitem o parasita. “Eu gosto deste trabalho”, diz Oluwaokere ao jornal britânicoThe Guardian. A jovem foi recrutada como voluntária pelo Ministério da Saúde. “Não tenho medo, pois amo minha comunidade e quero ajudá-la a se livrar das doenças.” Ela recebe uma bolsa de 10.000 nairas (aproximadamente £ 5) por mês da Sightsavers, uma ONG internacional focada em projetos de saúde pública. Na Nigéria, cerca de 40 milhões de pessoas estão em risco de contrair oncocercose, com 120.000 casos de cegueira devido à doença e muitos outros sofrendo com complicações incapacitantes. De acordo com aOMS, em 2023, quase 250 milhões de pessoas precisariam de tratamento preventivo contra a oncocercose globalmente. Mais de 99% dos infectados vivem naÁfricae no Iémen, com 1% restante vivendo na região fronteiriça entre oBrasile aVenezuela. O Estudo da Carga Global de Doenças estimou que, em 2017, 14,6 milhões de pessoas já apresentavam doenças de pele e 1,15 milhão enfrentavam perda de visão devido à doença. A OMS incluiu a oncocercose entre as doenças alvo de eliminação até 2030, conforme parte de sua estratégia para doenças tropicais negligenciadas (DTNs). Embora não exista cura para a oncocercose, aOMSrecomenda a administração em massa de medicamentos (MDA), onde uma grande parte da população recebe medicamentos preventivos para interromper a disseminação da doença. O tratamento é doado pela farmacêutica Merck, sob a marca Mectizan, e é administrado anualmente a populações em risco por até 15 anos. À medida que mais pessoas são tratadas, menos indivíduos são infectados, e os borrachudos se tornam menos propensos a transmitir o parasita. Após várias rodadas de MDA, os ministérios da saúde dos países afetados realizam testes para verificar se a doença pode ser considerada eliminada. Isso envolve exames de sangue em áreas de risco e a captura de borrachudos para análise dos parasitas que eles podem carregar. Na Nigéria, a meta é capturar 6.000 borrachudos, e os papa-moscas humanos são o método preferencial. Há uma preocupação ética em torno do uso de pessoas como iscas para pesquisas, o que gera desconforto para algumas organizações. ""É uma prática arriscada"", diz Louise Hamill, diretora de oncocercose da Sightsavers. ""Estamos pedindo a um ser humano com uma vida, uma família e um trabalho que coloque tudo de lado e passe várias horas sentado à beira de um rio. Eles estão se expondo ao risco de picadas de borrachudos, mas também de outras doenças, como a doença do sono transmitida pela mosca tsé-tsé, malária oudengue. Além disso, correm o risco de picadas de cobras ou de se exporem ao calor, sol intenso e até chuva."" Oluwaokere não se intimida com esses perigos, mas sua colega voluntária, Olamilekan Adekeye, estudante universitária de 26 anos, teve que se refugiar após ver uma cobra. “Não sei que tipo de cobra era, mas o medo me fez fugir. Me escondi em uma loja e voltei algumas horas depois.” A OMS também recomenda o uso de armadilhas de janela Esperanza (EWT), que capturam os borrachudos em superfícies pegajosas. Propostas pela primeira vez em 2013, essas armadilhas têm sido eficazes na América do Sul, mas não se mostraram tão bem-sucedidas naÁfrica. ""Acredito que o fator humano é essencial"", afirma a Dra. Maria Rebollo Polo, líder do programa global de eliminação da oncocercose naOMS. ""A atração dos humanos pelas moscas parece ser tão forte que é difícil replicá-la."" Com o intuito de reduzir o uso de pessoas, a Sightsavers e o Instituto Global para Eliminação de Doenças estão trabalhando no desenvolvimento de novas versões das EWT. Estudos em países como Malawi, Moçambique, Gana e Costa do Marfim buscam otimizar essas armadilhas, utilizando variações como dióxido de carbono para imitar o hálito humano, colas, roupas de cores diferentes e até o cheiro de pés suados. Rebollo reconhece que os papa-moscas humanos, apesar de serem uma técnica rudimentar, ainda são necessários devido à falta de recursos financeiros. ""Se as doenças tropicais negligenciadas recebessem mais atenção e financiamento, já teríamos desenvolvido técnicas mais avançadas que reduziriam o desconforto humano"", afirmou. Ela acrescenta que o uso de pessoas é fundamental em diversas pesquisas, como exames de sangue em crianças para monitoramento demaláriaou ensaios clínicos em que as pessoas são expostas a medicamentos. Cada país tem comitês de ética que regulam como as pessoas podem ser envolvidas em tais estudos. De volta a Ilorin, Oluwaokere e Adekeye sentem-se gratas por poder contribuir para melhorias na saúde, mas ambas desejam que o valor pago seja mais alto. ""O que recebo é muito pouco"", diz Adekeye. ""Tenho outras fontes de trabalho que pagam melhor, mas escolhi fazer isso para ajudar minha comunidade."" Pesquisa com mais de 58 mil mulheres revela que o envelhecimento reprodutivo pode alterar a probabilidade de ter meninos ou meninas Projeto utiliza os",Exame
https://exame.com/invest/mercados/fcc-aprova-fusao-da-paramount-com-a-skydance-com-acordo-de-us-8-bilhoes/,2025-07-24,FCC aprova fusão da Paramount com a Skydance em acordo de US$ 8 bilhões,"Repórter Publicado em24 de julho de 2025 às19h31. Última atualização em24 de julho de 2025 às19h33. A fusão entre aParamounte aSkydance Mediarecebeu aprovação formal do governo deDonald Trumpnesta quinta-feira, 24 de julho, encerrando meses de incerteza regulatória. Os comissários da Comissão Federal de Comunicações (FCC) votaram por 2 a 1, com a divisão partidária, aprovando o acordo de US$ 8 bilhões. Com a aprovação, aSkydanceagora pode concluir a transação e assumir o controle da Paramount nas próximas semanas. O processo de análise da fusão, que normalmente é longo, foi marcado por alegações de interferência política, especialmente após as críticas de Trump à divisãoCBS Newsda Paramount. Nos últimos dias, aSkydance, liderada pelo CEO David Ellison, comprometeu-se a contratar um ombudsman na CBS e a não adotar novas políticas de Diversidade, Equidade e Inclusão (DEI). Esses compromissos, com as promessas de manter conteúdo local, foram fundamentais para a aprovação de Brendan Carr, presidente da FCC, que já havia demonstrado sua lealdade aDonaldTrump, incluindo o uso de um broche com a cabeça do presidente. Carr solicitou que seus colegas comissários votassem sobre a fusão nesta quinta-feira, 24. “Parabenizo a Skydance pelo compromisso em promover mudanças significativas na CBS, uma emissora que tem uma longa história”, declarou Carr em um comunicado. “A Skydance assumiu compromissos por escrito para garantir que a programação da nova empresa represente uma diversidade de perspectivas políticas e ideológicas. A Skydance também adotará ações para reduzir o viés que prejudicou a confiança na mídia nacional.” “Esses compromissos, se cumpridos, permitirão que a CBS opere no interesse público, com foco em uma cobertura justa, imparcial e fundamentada em fatos”, acrescentou Carr. “Isso iniciaria o processo de recuperar a confiança do público americano.” Recentemente, aParamountconcordou em pagar US$ 16 milhões à futura biblioteca presidencial de Trump para resolver o processo legal contra aCBS News. A empresa e a FCC insistiram que o pagamento não estava relacionado à aprovação da fusão, embora alguns senadores democratas tenham sugerido que isso configuraria um “suborno” em troca da autorização. Vendas no período foram beneficiadas por expansões dos shopping centers, uma das principais estratégias da companhia Receita com nuvem cresce 32% e mercado reage com alta das ações após anúncio de novos aportes No início do mês, o presidente americano Donald Trump anunciou uma tarifa extra de importação de 50% para os produtos brasileiros Investidores repercutem uma bateria de balanços corporativos, os dados de emprego nos Estados Unidos e o discurso da presidente do Banco Central Europeu 01 02 03 exame no whatsapp Receba as notícias da Exame no seu WhatsApp Nos acontecimentos mais relevantes do Brasil e mundo. E-mail inválido Desperta",Exame
https://exame.com/economia/alckmin-afirma-ter-conversado-com-secretario-de-comercio-dos-eua-mas-negociacao-segue-emperrada/,2025-07-24,"Alckmin afirma ter conversado com secretário de Comércio dos EUA, mas negociação segue emperrada","Repórter especial de Macroeconomia Publicado em24 de julho de 2025 às18h33. Última atualização em24 de julho de 2025 às18h36. Ovice-presidente da Repúblicae ministro do Desenvolvimento, Indústria, Comércio e Serviços,Geraldo Alckmin, afirmou nesta quinta-feira, 24, que conversou por 50 minutos com o secretário de Comércio dosEstados Unidos, Howard Lutnick, no último sábado, 19. “Conversei com o secretário de comércio, com que já tinha conversado há alguns meses atrás. Reiterei a disposição do Brasil de negociação. O Brasil nunca saiu da mesa de negociação, não criamos esse problema e queremos resolver”, disse. Alckmin, entretanto, não detalhou que temas foram tratados durante a reunião. Ele disse apenas que o conversa foi “longa, importante, mas os temas são confidenciais”. Alckmin também informou que a partir da próxima segunda-feira, 28, fará pronunciamentos diários, às 11h, sobre as conversas com empresários brasileiros e sobre o status da negociação com osEstados Unidos. O vice-presidente também não informou se há uma próxima reunião marcada com membros do governo dos Estados Unidos. Com a verba adicional, o volume total de recursos para política habitacional subirá de R$ 126,8 bilhões para R$ 136,8 bilhões neste ano Ministro afirma que governo já finalizou propostas de apoio a empresas, como uma linha de crédito aos setores mais afetados pelo tarifaço americano Fenômeno foi registrado globalmente no primeiro trimestre do ano O governo brasileiro está finalizando um plano de contingência para mitigar os danos das tarifas impostas pelos EUA, com medidas que serão avaliadas por Lula 01 02 exame no whatsapp Receba as notícias da Exame no seu WhatsApp Nos acontecimentos mais relevantes do Brasil e mundo. E-mail inválido Desperta",Exame
https://exame.com/invest/mercados/multiplan-bate-expectativa-do-mercado-e-lucra-r-2644-milhoes-no-2o-tri/,2025-07-24,"Multiplan bate expectativa do mercado e lucra R$ 264,4 milhões no 2º tri","Shoppings da Multiplan terão postos de coleta de alimentos (Multiplan/Divulgação) Redação Exame Publicado em24 de julho de 2025 às18h32. A Multiplan (MULT3), administradora de shopping centers e complexos corporativos, registrou lucro líquido de R$ 264,4 milhões no segundo trimestre de 2025. A cifra é 6,2% menor que a registrada no mesmo período do ano passado, porém ficou acima do consenso do mercado que projetava lucro de R$ 211 milhões. O fluxo de caixa operacional (FFO), exclui os efeitos ""não caixa"" dos resultados"", ficou em R$ 292,6 milhões, com queda anual de 8,2%. O lucro antes de juros, impostos, depreciações e amortizações (Ebitda, na sigla em inglês), por sua vez, foi de R$ 460,11 milhões, registrando, assim, um crescimento de 18,1% em relação ao segundo trimestre de 2024. A receita líquida da Multiplan, entre abril e junho deste ano, totalizou R$ 694,06 milhões, com alta de 28,6%. O montante superou com folga a média das projeções do mercado, que apontava para um valor de R$ 553 milhões. As vendas dos lojistas somaram R$ 6,3 bilhões, com alta anual de 12,8%. A companhia destacou o desempenho dos shoppings Diamond Mall e Park Shopping Barigui, que passaram por expansões no ano passado. O segundo trimestre foi marcado por duas datas comerciais importantes. No Dia das Mães, as vendas foram 21,3% maiores que as do ano passado. No período do Dia dos Namorados, o avanço foi de 11,1%. Combinadas, as datas contribuíram com um aumento de 12,8% nas vendas dos shoppings, de acordo com a Multiplan. A taxa de ocupação dos shopping centers da Multiplan avançou 12 pontos-base para 96,1%. A receita com locação nos shoppings, por sua vez, cresceu 8,6%, para R$ 414 milhões. Enquanto isso, o custo de ocupação recuou para 12,6%, o que, segundo a companhia, é o menor para um segundo trimestre desde o IPO. As despesas gerais e administrativas da companhia avançaram 12,1%, em bases anuais, para R$ 51,5 milhões, por ""maiores contingências trabalhistas e despesas com dissídio"", informa o balanço. A cifra representou 7,4% da receita líquida da Multiplan no período. Os investimentos da Multiplan somaram R$ 149,4 milhões e foram todos direcionados para expansões e revitalizações. Comparando com o mesmo período de 2024, ocapexcaiu 44,7%. A dívida bruta da companhia terminou o segundo trimestre em R$ 5,12 bilhões. Houve uma redução de 6,4% na comparação com o valor ao final do último mês de março. Mas o custo aumentou 70 pontos-base. A dívida líquida também cresceu, em 3,6%, para R$ 4,382 bilhões. Ao final do período, a Multiplan tinha posição de caixa líquida de R$ 742,3 milhões. A alavancagem medida pela relação dívida líquida e Ebitda ficou em 2,27 vezes, praticamente estável em relação ao primeiro trimestre. Receita com nuvem cresce 32% e mercado reage com alta das ações após anúncio de novos aportes No início do mês, o presidente americano Donald Trump anunciou uma tarifa extra de importação de 50% para os produtos brasileiros Investidores repercutem uma bateria de balanços corporativos, os dados de emprego nos Estados Unidos e o discurso da presidente do Banco Central Europeu Após balanço mal recebido por investidores, executivos desenham estratégias para reduzir impacto de um possível ‘tarifaço’ 01 02 03 exame no whatsapp Receba as notícias da Exame no seu WhatsApp Nas melhores oportunidades do mercado para investir. E-mail inválido Invest",Exame
https://exame.com/negocios/morango-do-amor-tiktok-produto-viral-vendendo-quanto/,2025-07-24,Morango do amor: hype do TikTok turbina as vendas dessas empresárias — e depois?,"Priscilla Diniz, da confeitaria de mesmo nome: a baiana é uma das pioneiras do produto viral (Priscilla Diniz/Divulgação) Publicado em24 de julho de 2025 às18h27. Última atualização em24 de julho de 2025 às18h48. No mês em que se comemora a “festajulina”, a maçã do amor perdeu lugar para o “morango do amor”. Coberta com brigadeiro branco e uma casca de açúcar vermelha, o produto tem viralizado nas redes sociais por seu visual atrativo e “instagramável”. E tem se mostrado uma oportunidade lucrativa: em menos de uma semana, já rendeu um bom dinheiro para algumas empreendedoras — dentro e fora do Brasil. Laís Prates, dona da Piece Confeitaria, anunciou a venda dos morangos na última terça-feira, 22, por R$ 16,90. Antes do fim de semana chegar, o estoque acabou. ""Limitamos a 100 unidades por dia, mas sabemos que dá para vender 3x mais que isso. Estamos aumentando o time para dar conta, provavelmente deve durar um tempo"", diz a dona da loja localizada no Tucuruvi, zona norte de São Paulo. Com essa demanda, Prates está ganhando aproximadamente R$ 1.600 por dia com a venda dos ""morangos do amor"" desde que começou na última semana. Uma das pioneiras do doce que viralizou na internet éPriscilla Diniz, dona da confeitaria de mesmo nome, que foi inaugurada em 2012 e hoje soma 8 lojas em Salvador, Bahia. ""Morango do Amor é uma receita muito antiga. Eu tive a ideia em 2023 de fazer e lançar nas vitrines da nossa confeitaria. Até então nunca tinha visto ninguém fazer e vender em lojas"", diz a empresária, que afirma que é o produto mais vendido da empresa, por R$ 17,90. O sucesso foi instantâneo. Desde então, Diniz lançou o 'Ovo de Páscoa do Amor' e o 'Buquê do Amor' (no Dia dos Namorados). ""O doce fez sucesso até em pistas de dança de casamentos"", diz Diniz. Neste tempo, a empresária de Salvador lembra queinfluencerse famosos como Ana Paula Siebert, Giovanna Antonelli e Claudia Leitte, provaram e fizeram um marketing totalmente espontâneo e gratuito. ""Isso ajudou a viralizar pelo Brasil. O público respondeu imediatamente de uma maneira incrível, e até hoje não consigo atender à demanda, tanto nas lojas, no delivery, como nas encomendas. Ele chega e esgota no dia"", afirma Diniz, que há 2 anos tem um setor na confeitaria que só faz ""morango do amor"". ""Estamos com três turnos para tentar atender a demanda. É uma correria maravilhosa!"", diz a confeiteira. ""Acho super bacana que a minha ideia de lançar um produto 'esquecido' está ajudando muitas outras confeiteiras a ter o trabalho valorizado e reconhecido"", afirma. Por conta da alta demanda da região, Diniz conta queos noveprodutores de morangojá reajustaram seus valores de venda de 50 a 100% do que ela pagava antes em cada caixa. ""Ainda assim não conseguem entregar a quantidade e qualidade do que precisamos para manter nosso padrão. Estamos nos virando em mil. Precisamos aproveitar a onda desse doce fenômeno"", diz. Mesmo com a temperatura por volta dos 30 °C, os americanos também estão em busca dos morangos do amor. A brasileiraCelina Bredemanndiz que os pedidos não param de chegar na cafeteria,Araras Coffee, localizada na cidade de White Plains, em Nova Iorque, da qual ela é dona. Celina Bredemann, empresária do Araras Coffe (Araras Coffe/Divulgação) Desde segunda-feira, 21, Bredemann está vendendo cerca de 270 morangos por dia pelo preço de US$ 7,99 cada (aproximadamente R$ 44 na cotação atual). Isso significa que, em uma semana, a brasileira pode chegar a faturar mais de R$ 50 mil somente com os doces ""instagramáveis""—seguindo a média de R$ 11 mil por dia. “Está uma loucura. Os pedidos não param de chegar. Já vendemos tudo e ainda há uma grande fila de espera”, conta Bredemann, que trabalha nos Estados Unidos em pleno verão de 30 °C. “Apesar da alta demanda, não enfrentamos falta de morangos, já que o verão favorece bastante a produção.” Até grandes marcas de docerias, como aSodiê Doces, estão apostando na febre dos morangos.O produto foi oficialmente lançado nesta quarta-feira, 23, e 8 mil unidades já foram vendidas em toda a rede, sendo 10% delivery. “É uma resposta estratégica a uma demanda do consumidor, sem abdicar da qualidade artesanal que nos acompanha há mais de duas décadas”, afirma Fábio Araujo, diretor-geral da Sodiê Doces. No entanto, por se tratar de um item feito com morangos frescos, sua disponibilidade pode variar conforme a sazonalidade da fruta e a logística de cada unidade. A franquia recomenda consultar previamente a loja mais próxima. Criadores de conteúdo estão transformando a tendência em fonte de renda: o confeiteiro e empreendedor Leonardo Flakes, por exemplo,já oferece apostilas de R$ 40 para quem quer aprender a fazer e vender. A influenciadora Geicy Galindo também vende um passo a passo de como fazer o morango do amor pelo mesmo valor. Nos vídeos, ela conta que chegou a vender 120 unidades em apenas 20 minutos de delivery. No terceiro dia, vendeu 300 doces em uma hora, e desde então conta com uma equipe de cinco pessoas trabalhando diariamente. A confeiteira Milena Moreira já acumula vídeos com mais de 1,5 milhão de visualizações e compartilha com frequência as filas gigantescas que se formam na porta do seu negócio. Em um dos relatos, um cliente chegou a oferecer R$ 50 para furar a fila e garantir o doce. Desde julho, o termo 'morango do amor' tem estado entre mais buscados no Google, com aumento de 100% na procura, segundo dados do Google Trends. Já no TikTok, os termos estão na terceira hashtag mais buscada da semana, com mais de 16 mil postagens no Brasil sobre o tema nos últimos 30 dias — sendo 14 mil delas nos últimos desde segunda-feira, 21. Abaixo, veja como é o processo para fazer um ""morango do amor"": A post shared by Araras coffee & more (@ararascoffeeandmore) Como as paletas mexicanas, obubble teae o pistache, o morango do amor é mais umhypeque, em breve, deve perder o seu charme— e os preços salgados devem cair junto. A paranaenseLos Paleteros,",Exame
