url,data,titulo,texto,fonte
https://valor.globo.com/mundo/noticia/2025/07/04/trump-sanciona-projeto-de-lei-fiscal-na-casa-branca.ghtml,2025-07-04,Trump sanciona projeto de lei fiscal na Casa Branca,"Por Valor— São Paulo 04/07/2025 19h01Atualizado04/07/2025 O presidente dos Estados Unidos,Donald Trump, sancionou nessa sexta-feira (4) oprojeto de lei fiscalque prevê uma série decortes de gastos e impostos, além de recursos para financiar alguma de suas principais propostas de campanha. O evento ocorreu naCasa Brancae fez parte das festividades doDia da Independência dos EUA. Trump pressionou oCongressoamericano a aprovar o projeto para que fosse sancionado durante o 4 de julho. Apelidado de“lei grande e linda”, o projeto movimentou o Congresso americano durante a semana para atender os desejos de Trump. A proposta foi aprovada entre ossenadoresapós voto de desempate do vice-presidenteJ.D. Vance, que pela constituição americana é também presidente do Senado, e seguiu para aCâmara, onde também enfrentouresistência de republicanos céticosquanto à proposta, mas foi aprovada após uma sessão de mais de 24h. A aprovação na Câmara incluiu até mesmo o envolvimento direto de Trump, que convocou republicanos céticos para uma reunião na Casa Branca. Trump e seus aliados republicanos estão contando que osUS$ 4,5 trilhões em cortes de impostosprevistos no projeto impulsionarão o crescimento econômico. A legislaçãoadia muitos dos cortes de gastos, mas antecipa reduções de tributos com apelo popular, incluindo um aumento permanente no crédito fiscal por filho eincentivos fiscais temporários, por quatro anos, para idosos e paragorjetas e horas extras– promessas feitas por Trump durante a campanha presidencial. O Escritório de Orçamento do Congresso (CBO, na sigla em inglês), um órgão apartidário, prevê que alegislação aumentará o déficit dos EUA em US$ 3,3 trilhões na próxima década, aumentando as preocupações dos investidores com o rumo fiscal do país. Jeffrey Gundlach, da DoubleLine Capital, um dos nomes mais conhecidos do mercado de bônus, alertou no mês passado que o peso da dívida federal se tornou“insustentável”, e o dólar já caiu cerca de 9% neste ano frente às principais moedas do mundo, em parte devido a essas preocupações. Por outro lado, umaumento de US$ 5 trilhões no teto da dívidados EUA incluído no pacoteelimina o risco de um caloteque poderia abalar os mercados – algo que o Tesouro havia previsto para meados de agosto caso o Congresso não agisse. O Senado também impôs cortes mais profundos noMedicaid, o programa de seguro saúde para pessoas de baixa renda e com deficiências, reduzindo os gastos com o programa em quase US$ 1 trilhão ao longo da próxima década, segundo o CBO. Isso incluirestrições ao repasse federal para os programas estaduais do Medicaid,novos requisitos de trabalho para beneficiários aptos a trabalhar e que não tenham filhos menores de 14 anos, e novas exigências de coparticipação para quem obteve cobertura por meio da Lei de Cuidados Acessíveis, sancionada pelo presidente Barack Obama. O pacote também corta os gastos com cupons de alimentação federais e empréstimos estudantis universitários. Amaioria dos incentivos fiscais para a energia limpa aprovados no governo Biden serão eliminados gradualmentee um popular crédito fiscal ao consumidor de US$ 7.500 para a compra de veículos elétricos será eliminado para compras feitas após 30 de setembro. Acompanhe os mercados com nossas ferramentasAcessar gratuitamente Outro tema em que houve avanço é um documento, a ser aprovado pelos ministros de Finanças, para que haja voz uníssona entre países do Brics nos fóruns de governança global e bancos multilaterais Até a posse do novo presidente, Marco Aurelio Viana seguirá interinamente no cargo e, depois, retomará seu cargo na diretoria de seguridade A rivalidade entre o empresário e Trump ameaça partes cruciais do império de Musk e deixa os legisladores republicanos presos em uma disputa entre o presidente dos EUA e o homem mais rico do mundo Secretário-executivo da Fazenda adianta ao Valor argumentos que serão levados à audiência de conciliação com o Congresso, marcada por Moraes para o próximo dia 15 O evento ocorreu na Casa Branca e fez parte das festividades do Dia da Independência dos EUA Vaga de Simão Pedro na Assembleia Legislativa será ocupada por filiada do PSB Decisão judicial sobre guarda do filho de Marília Mendonça destaca alienação parental ABFintechs vê o episódio com “bastante preocupação” e alerta que “vulnerabilidades podem surgir onde menos se espera”",Valor Econômico
https://valor.globo.com/brasil/noticia/2025/07/04/equilibrio-entre-atrair-capital-privado-e-compartilhar-riscos-e-desafio-chave-para-transicao-climatica-diz-professor-de-harvard.ghtml,2025-07-04,"Equilíbrio entre atrair capital privado e compartilhar riscos é desafio-chave para transição climática, diz professor de Harvard","04/07/2025 16h10Atualizado04/07/2025 O equilíbrio entre atraircapital privadoe compartilharriscosé um desafio-chave para osetor públicoe osbancos de desenvolvimentofinanciarem atransição climática. A afirmação foi feita nesta sexta-feira (4) peloprofessor de Economia e Política InternacionaldaUniversidade de Harvard Dani Rodrik, em debate no10º Encontro do Novo Banco de Desenvolvimento (NBD), conhecido como o banco doBrics. Na sua avaliação, está claro que os recursos de governos e bancos de desenvolvimento não serão suficientes para financiar os projetos exigidos para mudança climática e é preciso mobilizar mais capital. No entanto, é preciso uma formulação adequada para atração do capital privado. Por um lado, atrair dinheiro privado com garantias e incentivos, mas ao mesmo tempo, evitar que setor público e bancos de fomento assumam riscos sozinhos. “As instituições multilaterais precisam de instrumentos financeiros que possam aumentar o retorno para o investimento privado e mitigar riscos, produzir externalidades positivas. Mas também existe essa tensão, de subsídios demais.” “A questão é como equilibrar os instrumentos e abordagens entre atrair o investimento privado, com mais garantias e algum subsídio, mas também com disciplina e condicionalidades no financiamento privado, para garantir que os riscos sejam compartilhados. É uma questão de desenho institucional e um desafio-chave”, completa. Aemergência climática, afirma Rodrik, exige uma cooperação entre os países maior do que a existente hoje. Sua leitura é que atransição verdepode ajudar na construção de um novo modelo de crescimento da economia, especialmente para os países em desenvolvimento. Caminhos tradicionais do passado, como indústria e exportações, “não estão funcionando no momento”, segundo ele. “E não é só por causa do protecionismo em países ocidentais. A indústria também não está atraindo empregos.” Acompanhe os mercados com nossas ferramentasAcessar gratuitamente Outro tema em que houve avanço é um documento, a ser aprovado pelos ministros de Finanças, para que haja voz uníssona entre países do Brics nos fóruns de governança global e bancos multilaterais Até a posse do novo presidente, Marco Aurelio Viana seguirá interinamente no cargo e, depois, retomará seu cargo na diretoria de seguridade A rivalidade entre o empresário e Trump ameaça partes cruciais do império de Musk e deixa os legisladores republicanos presos em uma disputa entre o presidente dos EUA e o homem mais rico do mundo Secretário-executivo da Fazenda adianta ao Valor argumentos que serão levados à audiência de conciliação com o Congresso, marcada por Moraes para o próximo dia 15 O evento ocorreu na Casa Branca e fez parte das festividades do Dia da Independência dos EUA Vaga de Simão Pedro na Assembleia Legislativa será ocupada por filiada do PSB Decisão judicial sobre guarda do filho de Marília Mendonça destaca alienação parental ABFintechs vê o episódio com “bastante preocupação” e alerta que “vulnerabilidades podem surgir onde menos se espera”",Valor Econômico
https://valor.globo.com/politica/noticia/2025/07/04/forum-de-lisboa-foi-convertido-em-sala-de-situacao-da-crise-do-iof.ghtml,2025-07-04,Fórum de Lisboa foi convertido em 'sala de situação' da crise do IOF,"04/07/2025 16h49Atualizado04/07/2025 Enquanto a crise entre o governoLulae o Congresso escalava com judicialização do Imposto sobre Operações Financeiras (IOF), nesta semana, vários dos principais atores envolvidos estavam em Portugal. De quarta até esta sexta-feira (4), o ministroGilmar Mendesfoi o anfitrião doFórum de Lisboa, evento que chegou à 13ª edição e já virou tradição anual da nata do judiciário e da política brasileira na capital portuguesa. Acompanhe os mercados com nossas ferramentasAcessar gratuitamente Outro tema em que houve avanço é um documento, a ser aprovado pelos ministros de Finanças, para que haja voz uníssona entre países do Brics nos fóruns de governança global e bancos multilaterais Até a posse do novo presidente, Marco Aurelio Viana seguirá interinamente no cargo e, depois, retomará seu cargo na diretoria de seguridade A rivalidade entre o empresário e Trump ameaça partes cruciais do império de Musk e deixa os legisladores republicanos presos em uma disputa entre o presidente dos EUA e o homem mais rico do mundo Secretário-executivo da Fazenda adianta ao Valor argumentos que serão levados à audiência de conciliação com o Congresso, marcada por Moraes para o próximo dia 15 O evento ocorreu na Casa Branca e fez parte das festividades do Dia da Independência dos EUA Vaga de Simão Pedro na Assembleia Legislativa será ocupada por filiada do PSB Decisão judicial sobre guarda do filho de Marília Mendonça destaca alienação parental ABFintechs vê o episódio com “bastante preocupação” e alerta que “vulnerabilidades podem surgir onde menos se espera”",Valor Econômico
https://valor.globo.com/financas/noticia/2025/07/04/ataque-hacker-no-teve-origem-em-empresa-de-banking-as-a-service-diz-associao.ghtml,2025-07-04,"Ataque hacker não teve origem em empresa de ‘banking as a service’, diz associação","Em alta 04/07/2025 15h36Atualizado04/07/2025 A Associação Brasileira de Banking as a Service (ABBAAS) divulgou uma nota nesta sexta-feira (4) em que reforça que não houve falhas de segurança em empresas de “banking as a service”. A associação afirma estar atuando com seus associados para “endereçar” questões relacionadas aoataque hacker que atingiu a C&M Software, integradora de serviços do Pix. Embora a ABBAAS não tenha nenhuma associada diretamente envolvida no caso, a principal empresa afetada, a BMP, atua no setor de “banking as a service”. A BMP teve mais de R$ 500 milhões desviados de sua conta reserva, mantida junto ao Banco Central (BC), segundo a Polícia Civil de São Paulo, que investiga o caso. A ABBAAS destaca que o episódio teve origem em um fornecedor de serviços de tecnologia, e não nas plataformas de “banking as a service” em si. “A segurança e a integridade das plataformas sempre foram prioridade máxima de nossos associados e não foram comprometidas”, diz a nota. A associação afirma estar trabalhando ativamente com seus membros para revisar e fortalecer continuamente os padrões de segurança e manter a integridade do sistema financeiro. Acompanhe os mercados com nossas ferramentasAcessar gratuitamente Outro tema em que houve avanço é um documento, a ser aprovado pelos ministros de Finanças, para que haja voz uníssona entre países do Brics nos fóruns de governança global e bancos multilaterais Até a posse do novo presidente, Marco Aurelio Viana seguirá interinamente no cargo e, depois, retomará seu cargo na diretoria de seguridade A rivalidade entre o empresário e Trump ameaça partes cruciais do império de Musk e deixa os legisladores republicanos presos em uma disputa entre o presidente dos EUA e o homem mais rico do mundo Secretário-executivo da Fazenda adianta ao Valor argumentos que serão levados à audiência de conciliação com o Congresso, marcada por Moraes para o próximo dia 15 O evento ocorreu na Casa Branca e fez parte das festividades do Dia da Independência dos EUA Vaga de Simão Pedro na Assembleia Legislativa será ocupada por filiada do PSB Decisão judicial sobre guarda do filho de Marília Mendonça destaca alienação parental ABFintechs vê o episódio com “bastante preocupação” e alerta que “vulnerabilidades podem surgir onde menos se espera”",Valor Econômico
https://valor.globo.com/politica/noticia/2025/07/04/tre-confirma-perda-de-mandato-de-deputado-estadual-do-pt-em-sp.ghtml,2025-07-04,TRE confirma perda de mandato de deputado estadual do PT em SP,"04/07/2025 19h01Atualizado04/07/2025 O Tribunal Regional Eleitoral de São Paulo (TRE-SP) confirmou a perda de mandato do deputado estadualSimão Pedro (PT), em julgamento finalizado na quinta-feira (3). O acórdão foi publicado nesta sexta-feira (4). O parlamentar ainda pode recorrer ao Tribunal Superior Eleitoral (TSE). Por cinco votos a um, ficou decidido que a vaga na Assembleia Legislativa de São Paulo (Alesp) será ocupada pela deputada Camila Godoi (PSB) e Simão Pedro torna-se primeiro suplente do PT. O julgamento encerra uma ação iniciada após as eleições de 2022, quando Simão Pedro questionou os efeitos de uma retotalização dos votos que resultaram na perda do seu mandato. O cálculo foi feito porque o TRE-SP entendeu ter havido fraudes à cota de gênero na relação de candidaturas do Pros e do PTB – a norma exige no mínimo 30% de candidaturas femininas. Os votos recebidos por esses partidos foram anulados e a contagem de votos válidos precisou ser refeita. O resultado interferiu no cálculo para distribuição das 94 vagas da Alesp e acarretou a perda do mandato de Simão Pedro, o menos votado dos 19 parlamentares eleitos pela federação PT/PV/PCdoB. O petista recorreu e em novembro do ano passado conseguiu recuperar o mandato, graças a uma decisão liminar. Nessa quinta-feira, os juízes analisaram o mérito do processo. A defesa argumentou que havia vícios jurídicos nas ações que apontavam fraude à cota de gênero e que os dirigentes do Pros e do PTB deveriam ter sido citados na ação. Também questionou a ausência da defesa das candidatas citadas. Venceu o voto do juizRégis de Castilho, que recusou as considerações da defesa do petista. Para ele, não havia razão para citar o deputado na ação já que a candidatura dele não era vinculada diretamente aos partidos que tiveram os votos cassados. O juiz entende que Simão Pedro ""apenas sofreu um impacto negativo tardio e indireto da recontagem dos votos decorrentes do julgamento"". O relator acrescenta que ficaram provadas as fraudes e o processo legal foi respeitado. Ficou derrotado o relatorClaudio Langroiva, que concordou ter havido falhas nas ações iniciais, as quais deveriam ser declaradas nulas. Em suas redes sociais, Simão Pedro disse respeitar a decisão, mas destacou que o relator da ação acatou as considerações de sua defesa. O deputado vai recorrer ao TSE. ""O PT não teve qualquer participação [nas fraudes]. Aliás nós sempre primamos pelo respeito às mulheres na chapa. Tanto que nossa chapa elegeu seis mulheres em 2022. É uma pena"", afirmou. Mantida a decisão, o PT ficará com 17 vagas na Alesp – 18 se considerada a federação com PV/PCdoB. O PSB passará a ter 4 parlamentares. Acompanhe os mercados com nossas ferramentasAcessar gratuitamente Outro tema em que houve avanço é um documento, a ser aprovado pelos ministros de Finanças, para que haja voz uníssona entre países do Brics nos fóruns de governança global e bancos multilaterais Até a posse do novo presidente, Marco Aurelio Viana seguirá interinamente no cargo e, depois, retomará seu cargo na diretoria de seguridade A rivalidade entre o empresário e Trump ameaça partes cruciais do império de Musk e deixa os legisladores republicanos presos em uma disputa entre o presidente dos EUA e o homem mais rico do mundo Secretário-executivo da Fazenda adianta ao Valor argumentos que serão levados à audiência de conciliação com o Congresso, marcada por Moraes para o próximo dia 15 O evento ocorreu na Casa Branca e fez parte das festividades do Dia da Independência dos EUA Vaga de Simão Pedro na Assembleia Legislativa será ocupada por filiada do PSB Decisão judicial sobre guarda do filho de Marília Mendonça destaca alienação parental ABFintechs vê o episódio com “bastante preocupação” e alerta que “vulnerabilidades podem surgir onde menos se espera”",Valor Econômico
https://valor.globo.com/brasil/noticia/2025/07/04/balanca-comercial-tem-superavit-de-us-589-bi-em-junho.ghtml,2025-07-04,"Balança comercial tem superávit de US$ 5,89 bi em junho","04/07/2025 15h34Atualizado04/07/2025 Abalança comercialregistrousuperávit de US$ 5,889 bilhões em junho deste ano. O número foi divulgado pela Secretaria de Comércio Exterior (Secex) do Ministério do Desenvolvimento, Indústria, Comércio e Serviços (Mdic). O resultado foi 6,9% menor do que o registrado no mesmo mês do ano anterior. Asexportaçõessomaram US$ 29,147 bilhões em junho deste ano, alta de 1,4% em relação ao mesmo mês do ano passado. Já as importações alcançaram US$ 23,257 bilhões, alta de 3,8%. No acumulado deste ano, o superávit alcançou US$ 30 bilhões, queda de 27,6%, sempre na comparação com o mesmo período do ano anterior. As exportações somaram US$ 165,87 bilhões de janeiro a junho deste ano, queda de 0,7%. Já as importações alcançaram US$ 135,777 bilhões, alta de 8,3%. A corrente de comércio, soma de exportações e importações, alcançou US$ 301,647 bilhões no acumulado do ano, um crescimento de 3,2% na comparação com 2024. O diretor de Estatísticas e Estudos de Comércio Exterior do Mdic,Herlon Brandão,afirmou que as exportações brasileiras para a Argentina cresceram ao longo do ano devido ao setor automotivo. “Nós temos observado um crescimento, ao longo do ano, da exportação para a Argentina, motivado pela recuperação do setor automotivo. O país vem aí recuperando a demanda desse setor”, disse. De acordo com o secretário, as exportações brasileiras estão ligeiramente abaixo do acumulado do ano passado, mas muito semelhante, mesmo com a queda de preço. “Então, o volume tem sustentado os embarques deste ano. O valor exportado esse ano é sustentado pelos volumes crescentes, já que temos observado uma redução dos preços internacionais dos bens”, ressaltou. Déficit com os EUA Brandão afirmou que oBrasilé totalmente “deficitário” com osEstados Unidose que é esperado que o país mais importe do que exporte para os americanos. Segundo ele, esse semestre “tivemos valor exportado maior para os EUA no primeiro semestre, com crescimento de 4,4%, muito impulsionado pelos principais produtos da pauta, como petróleo”. “O Brasil exporta alimentos também para os EUA: suco de laranja, café, carne, que são produtos com baixa elasticidade. São produtos que, mesmo que tenha aumento de preço interno nos EUA, continuam sendo consumidos”, disse. O secretário também afirmou que é necessário um estudo mais aprofundado [sobre impactos em setores que sofreram tarifas] e que a desaceleração de exportação aos EUA pode ser resultado de uma demanda menor ou aumento de preços decorrente da política tarifária. Indústria de transformação Asexportações agropecuárias brasileirascaíram 10% em junho deste ano em relação ao mesmo mês do ano anterior. No caso daindústria extrativa, houve queda de 6,2%, enquanto na indústria de transformaçãohouve alta de 10,9%. Pelo lado dasimportações,houve queda de 2,8% nas compras agropecuárias, queda de 20,9% na indústria extrativa e alta de 5,5% na indústria de transformação. Exportações para China As exportações brasileiras paraChina, Hong Kong e Macau, principais destinos dos produtos brasileiros, subiram 2,3% em junho deste ano, em relação ao mesmo mês do ano anterior. Já as vendas totais para a Ásia tiveram alta de 1,2%. Na mesma base de comparação, as vendas para a América do Norte subiram 4,5%, enquanto para a América do Sul tiveram alta de 34,3%. Já para a Europa, foi registrada queda de 11,2% em junho. Queda de exportações foi motivada por preços menores Segundo Herlon Brandão, a queda das exportações brasileiras no primeiro semestre, de 0,7% no acumulado do ano, foi motivada por preços menores. Apesar disso, a previsão é que as exportações tenham um aumento de 1,5% para o ano. Em entrevista coletiva para comentar os números da balança comercial de junho, o secretário também afirmou que no ano o Brasil deve ter uma queda de saldo de 32%. No primeiro semestre, a queda foi de 27%. “No primeiro semestre, o Brasil teve uma queda de saldo de cerca de 27%, mas a gente está esperando uma queda de 32% no ano. Era uma queda que a gente já esperava”, disse. Acompanhe os mercados com nossas ferramentasAcessar gratuitamente Outro tema em que houve avanço é um documento, a ser aprovado pelos ministros de Finanças, para que haja voz uníssona entre países do Brics nos fóruns de governança global e bancos multilaterais Até a posse do novo presidente, Marco Aurelio Viana seguirá interinamente no cargo e, depois, retomará seu cargo na diretoria de seguridade A rivalidade entre o empresário e Trump ameaça partes cruciais do império de Musk e deixa os legisladores republicanos presos em uma disputa entre o presidente dos EUA e o homem mais rico do mundo Secretário-executivo da Fazenda adianta ao Valor argumentos que serão levados à audiência de conciliação com o Congresso, marcada por Moraes para o próximo dia 15 O evento ocorreu na Casa Branca e fez parte das festividades do Dia da Independência dos EUA Vaga de Simão Pedro na Assembleia Legislativa será ocupada por filiada do PSB Decisão judicial sobre guarda do filho de Marília Mendonça destaca alienação parental ABFintechs vê o episódio com “bastante preocupação” e alerta que “vulnerabilidades podem surgir onde menos se espera”",Valor Econômico
