url,data,titulo,texto,fonte
https://exame.com/mundo/franca-vai-reconhecer-o-estado-da-palestina-na-onu-em-setembro-diz-macron/,2025-07-24,"França vai reconhecer o Estado da Palestina na ONU em setembro, diz Macron","Emmanuel Macron, presidente da França (AFP) Repórter Publicado em24 de julho de 2025 às17h31. O presidente francêsEmmanuel Macronanunciou nesta quinta-feira, 24, que aFrançapassará a reconhecer oficialmente a Palestina como um Estado. Em uma declaração inesperada no X, após meses de especulações e incertezas sobre o possível reconhecimento francês daPalestina, Macron informou que fará o anúncio formal na Assembleia Geral da ONU, em setembro, emNova York. “Fiel ao compromisso histórico com uma paz justa e duradoura no Oriente Médio, decidi que a França vai reconhecer o Estado da Palestina. Anunciarei solenemente durante aAssembleia Geral da ONU, em setembro”, publicou. ""Agora, a prioridade é cessar aguerra em Gazae garantir ajuda à população civil"", afirmou. Fidèle à son engagement historique pour une paix juste et durable au Proche-Orient, j’ai décidé que la France reconnaîtra l’État de Palestine. J’en ferai l’annonce solennelle à l’Assemblée générale des Nations unies, au mois de septembre prochain.…pic.twitter.com/7yQLkqoFWC — Emmanuel Macron (@EmmanuelMacron)July 24, 2025 Embora a maioria dos países ao redor do mundo já reconheça a Palestina como um Estado, os Estados Unidos e a maior parte de seus aliados próximos ainda não o fizeram. Com essa decisão, a França se tornaria o primeiro país do G7 — grupo formado pelosEstados Unidos, Reino Unido, Canadá, Alemanha, Japão e Itália— a adotar essa postura. Essa ação provavelmente causaria desconforto aogoverno Trump, que tem pressionado por uma solução para o conflito em Gaza. Negociadores de ambos os lados mantêm conversas indiretas no Catar, na tentativa de concordar com uma trégua Em junho, republicano havia citado a possibilidade de retirar todos os subsídios e contratos governamentais fechados com empresas de Musk, após uma disputa pública entre ambos sobre o plano fiscal Segundo Rubens Barbosa, ex-embaixador do Brasil em Londres (1994-1999) e em Washington (1999-2004), governo precisa enviar aos Estados Unidos ""autoridade de alto nível"" para conduzir negociações Candace Owens é acusada de ter dito que Brigitte Macron nasceu homem, que o casal tem consanguinidade, e que Macron foi eleito como parte de um programa de controle mental operado pela CIA 01 02 03 exame no whatsapp Receba as notícias da Exame no seu WhatsApp Nos acontecimentos mais relevantes do Brasil e mundo. E-mail inválido Desperta",Exame
https://exame.com/future-of-money/brasil-ainda-tem-posicao-favoravel-no-mercado-cripto-e-vantagem-em-relacao-aos-eua-diz-coinbase/,2025-07-24,"Brasil ainda tem posição favorável no mercado cripto e vantagem em relação aos EUA, diz Coinbase","Patrocínio: Coinbase: corretora ainda vê posição favorável do Brasil em cripto (NurPhoto/Getty Images) Editor do Future of Money Publicado em24 de julho de 2025 às17h25. Apesar do avanço acelerado da regulação decriptomoedasnos Estados Unidos, o Brasil ainda tem uma posição favorável e vantagens em relação à maior economia do mundo. É o que avaliaFabio Plein, diretor regional daCoinbasepara as Américas, em uma entrevista exclusiva à EXAME. Plein afirma que o ""grande avanço regulatório nos Estados Unidos"" é o grande marco para o mercado cripto em 2025, mas que isso não significa que o Brasil perdeu sua atratividade, obtida nos últimos anos após a criação de um marco regulatório para o setor anos antes do país norte-americano. O executivo da maior corretora de criptomoedas dos Estados Unidos também destaca que 2025 tem sido um ano de forte institucionalização para o setor e reforçou seu otimismo em relação aos preços de ativos digitais, com um cenário ainda mais favorável. ""O grande marco do ano foi esse grande avanço regulatório nos Estados Unidos, e em consequência disso os desdobramentos positivos que se vislumbram para a indústria. É o maior destaque e tem trazido muito otimismo para a indústria e para a Coinbase, que tem sido um player muito ativo nessa questão e no debate regulatório de lá"", comenta Plein. O executivo vê um ""contexto novo"" para as criptomoedas: ""No passado recente, cripto era visto como um tema de discussão sobre se ia regular ou não e qual o lugar nos serviços financeiros. Agora, os países estão entendendo o lugar de cripto no futuro das finanças e o debate é como regular"". No caso dos Estados Unidos, essa mudança está ligada principalmente à chegada de Donald Trump à presidência. Desde então,o presidente já sancionou o Genius Act- projeto específico parastablecoins- e defende a aprovação de outros projetos,incluindo o Clarity Act, que cria um arcabouço regulatório para todo o mercado cripto. ""Isso resulta em um entusiasmo e adoção cada vez maiores pelas empresas"", resume Plein. Ele avalia que o país caminha para construir uma ""estrutura regulatória unificada, com fundação e alicerces bem claros. Isso muda um cenário em que os EUA estavam atrás das discussões regulatórias. Agora, estão rapidamente se posicionando como um líder nessas discussões. Dá uma clareza regulatória e uma solidez para a indústria"". O principal ganho, ressalta, é que agora as empresas de criptomoedas poderão canalizar recursos que antes concentrados nos esforços para avanço da regulação em direção ao desenvolvimento de produtos e projetos, como parte de um esforço para ""atualizar o sistema financeiro"". Mesmo assim, Plein acredita que o Brasil mantém sua posição internacional favorável. O paísaprovou o Marco Legal das Criptomoedas em 2022, criando uma estrutura regulatória para o setor anos antes dos Estados Unidos. Nos últimos anos, porém, oprocesso de regulação infralegalpeloBanco Centraltem sido mais lento. ""O Banco Central vem trabalhando no detalhamento, na regulação em si. Os tempos talvez até se casem, com o Clairty Act aprovado lá. A diferença é que eles já têm uma regulamentação específica para stablecoins lá. Talvez no passado o Brasil estivesse muito à frente, mas agora os EUA se aproximaram. Entretanto, tudo está ocorrendo em um timing favorável para o Brasil"", afirma. Sobre o futuro da regulação de criptomoedas, Plein enxerga um amadurecimento das discussões e está otimista com as regras que a autarquia vai criar, inclusive para stablecoins. Ele pondera, porém, que o setor também teve ""efeitos mais contrários, menos construtivos"", em especial por parte do Executivo e no âmbito tributário. ""Diferentemente do trabalho do Banco Central, que foi mais técnico, entendendo impactos, a solução do governo foi mais ampla, o que tem efeitos negativos para a indústria cripto. Por cripto ser um mercado global, se taxa tão agressivo as compras de ativos digitais no exterior acaba tendo um impacto direto"", comenta. O diretor da Coinbase acredita que aalta na incidência do IOF em algumas operações de empresas de criptomoedasvai obrigá-las a buscar outras soluções, como a criação de livros de ordens locais, em reais. Porém, isso pode ""limitar a oferta de ativos para compra e venda e pode aumentar os preços para os usuários"". ""O mercado vai ter que adaptar, encontrar soluções, mas tem um feito negativo e incentiva a busca por players não regulados ou fora do país. São preocupações, mas é muito cedo para dizer como isso vai impactar a adoção de cripto no Brasil. Pode ter forças que atrapalhem a adoção ou incentivem, mas a visão ainda é positiva por ser uma população acostumada a adotar inovação nos serviços financeiros e vendo cripto como uma solução muito importante e com ganhos de qualidade"", avalia. No caso da Coinbase, Plein destaca que 80% da receita da empresa ainda vêm dos Estados Unidos, mas que o avanço regulatório no país ""nos dá animo para ter mais tranquilidade nesse mercado para poder ter ainda mais atenção e foco para seguir investindo no Brasil, trabalhando com os reguladores para seguir avançando na clareza regulatória"". ""No Brasil, foco é de seguir aumentando a presença. Foi oprimeiro mercado em que a Coinbase foi lançada na América Latinae em dois anos se consolidou no top3 de empresas do setor no país. Queremos expandir a presença América Latina e espero que tenhamos agora um momento de muita construção e expansão"", projeta. Siga o Future of Money nas redes sociais:Instagram|X|YouTube|Telegram|TikTok Dados do banco indicam que setor de criptomoedas atraiu US$ 60 bilhões em investimentos no acumulado de 2025 Líder no segmento de câmbio, empresa avalia incorporação de criptomoedas pareadas ao dólar após aprovação de regulação nos EUA Criptomoedas alternativas ao bitcoin registram perdas expressivas nas últimas horas, mas especialista aponta que tendência ainda é de alta Unidades da criptomoeda não eram transferidas há 14 anos, e dono agora tem lucro milionário 01 02 03 exame no whatsapp Receba as notícias da Exame no seu WhatsApp Newsletter Future Of Money Quer saber as novidades que mexem com o mercado cripto? Assine as newsletters gratuitas do Future of Money! Selecione as newsletters que você deseja se inscrever* Crypto",Exame
https://exame.com/mundo/israel-e-eua-convocam-negociadores-apos-resposta-do-hamas-a-proposta-de-tregua-em-gaza/,2025-07-24,Israel e EUA convocam negociadores após resposta do Hamas à proposta de trégua em Gaza,"Agência de notícias Publicado em24 de julho de 2025 às17h12. Israelafirmou nesta quinta-feira, 24, que continua buscando um acordo para um cessar-fogo emGaza, embora tenha chamado seus negociadores para consultas e osEstados Unidostenham convocado sua equipe que participou das conversas e criticado a ""postura egoísta"" doHamas. Há mais de duas semanas, os negociadores de ambos os lados mantêm conversas indiretas no Catar, na tentativa de concordar com uma trégua que permita, em um primeiro momento, a libertação de dez reféns israelenses vivos, em troca de um número indeterminado de palestinos detidos em Israel. O gabinete do primeiro-ministro israelense, Benjamin Netanyahu, informou que, após receber a resposta do Hamas, decidiu o retorno da equipe de negociação para continuar as consultas em Israel. Netanyahu disse que está ""trabalhando para alcançar outro acordo para a libertação dos reféns"". ""Mas se o Hamas interpreta nossa vontade de alcançar um acordo como uma fraqueza, como uma oportunidade para ditar condições de rendição que possam colocar o Estado deIsraelem perigo, eles estão muito enganados"", afirmou. O enviado americano Steve Witkoff anunciou o retorno de seus negociadores presentes no Catar ""para consultas após a última resposta do Hamas, que demonstra claramente sua falta de vontade em alcançar um cessar-fogo em Gaza"". ""Embora os mediadores tenham feito um grande esforço, oHamasnão parece estar coordenado ou agindo de boa-fé"", declarou. Segundo uma fonte palestina próxima às negociações, a resposta inclui emendas às modalidades de entrada de ajuda humanitária, mapas das áreas das quais o Exército israelense deveria se retirar e garantias sobre o fim definitivo da guerra em curso desde outubro de 2023. Israel enfrenta uma crescente pressão de organizações humanitárias que denunciam a ""morte de fome em massa"" que está se espalhando pelaFaixa de Gaza, após quase dois anos de conflito. No terreno, continuam os bombardeios e disparos israelenses, e aDefesa Civil de Gazarelatou pelo menos 40 mortos, incluindo crianças e pessoas que aguardavam a distribuição de ajuda. Em Khan Yunis, no sul do território, Um al Abd Nasar instou oHamasa concordar com uma trégua, após seu filho morrer em um bombardeio em um campo de refugiados. ""Eles têm que fazer algo. Já chega dessa destruição e pessoas morrendo"", declarou à AFP. Após impor à Gaza um cerco total em outubro de 2023,Israelimpôs novamente um bloqueio ao território costeiro palestino no início de março, que aliviou parcialmente no fim de maio. Os mais de dois milhões de habitantes de Gaza enfrentam grandes dificuldades para acessar comida, medicamentos e combustível. ""As crianças caem ao caminhar por falta de comida"", afirmou Salma Al Qadumi, cinegrafista da AFP, ao falar de seus três sobrinhos, de entre quatro e 12 anos. Nesta quinta-feira, as agências de notícias AFP, AP e Reuters e a emissora britânica BBC instaram Israel a ""autorizar a entrada e saída de jornalistas em Gaza"", ao mesmo tempo que se disseram ""profundamente preocupadas pelo fato de que, agora, a fome ameaça sua sobrevivência"". O diretor-geral daOrganização Mundial da Saúde (OMS), Tedros Adhanom Ghebreyesus, afirmou na quarta-feira que ""grande parte"" da população de Gaza sofre de fome. Para a França, ""o risco de fome"" em Gaza é ""resultado do bloqueio"" imposto por Israel. Na terça-feira, um hospital de Gaza afirmou que 21 crianças haviam morrido de fome e desnutrição nas últimas 72 horas. ""Enquanto o cerco do governo israelense mata de fome a população de Gaza, trabalhadores humanitários se juntam agora às mesmas filas por alimentos, arriscando serem baleados apenas para alimentar suas famílias"", indicaram na quarta-feira 111 organizações, incluindo Médicos Sem Fronteiras (MSF), Save the Children e Oxfam, em um comunicado conjunto. O porta-voz do governo israelense, David Mencer, afirmou que ""não há uma fome causada por Israel. Trata-se de uma escassez provocada pelo Hamas"", que governa Gaza e que, segundo ele, impede a distribuição da ajuda e saqueia parte dela. As autoridades israelenses informaram nesta quinta-feira que cerca de 70 caminhões com ajuda haviam sido descarregados na véspera nos pontos de entrada e ""mais de 150 já haviam sido recuperados pela ONU e organizações internacionais em Gaza"". As agências humanitárias afirmam, por outro lado, que as autorizações concedidas porIsraelsão limitadas e a coordenação para enviar os caminhões constitui um desafio importante em uma zona de guerra. O ataque do Hamas em 7 de outubro de 2023 em Israel resultou na morte de 1.219 pessoas, em sua maioria civis, segundo um balanço da AFP baseado em dados oficiais. A campanha militar israelense no território palestino matou 59.587 palestinos, majoritariamente civis, segundo dados do Ministério da Saúde deGaza, considerados confiáveis pelaONU. Os militantes capturaram ainda, naquele dia, 251 pessoas em território israelense, das quais 49 seguem em cativeiro em Gaza. Destas, 27 estariam mortas, segundo o Exército. Em junho, republicano havia citado a possibilidade de retirar todos os subsídios e contratos governamentais fechados com empresas de Musk, após uma disputa pública entre ambos sobre o plano fiscal Segundo Rubens Barbosa, ex-embaixador do Brasil em Londres (1994-1999) e em Washington (1999-2004), governo precisa enviar aos Estados Unidos ""autoridade de alto nível"" para conduzir negociações Candace Owens é acusada de ter dito que Brigitte Macron nasceu homem, que o casal tem consanguinidade, e que Macron foi eleito como parte de um programa de controle mental operado pela CIA Segundo Carlos Fávaro, Brasil está na iminência de conquistar 400 novos mercados, mas solução para café e suco de laranja deve demorar 01 02 03 exame no whatsapp Receba as notícias da Exame no seu WhatsApp Nos acontecimentos mais relevantes do Brasil e mundo. E-mail inválido Desperta",Exame
https://exame.com/brasil/nao-e-so-bolsonaro-135-das-prisoes-do-brasil-sao-domiciliares-com-uso-de-tornozeleira-eletronica/,2025-07-24,"Não é só Bolsonaro: 13,5% das prisões do Brasil são domiciliares com uso de tornozeleira eletrônica","Ex-presidente Jair Bolsonaro, com tornozeleira eletrônica, deixa o Congresso em Brasília enquanto aguarda julgamento por suposta tentativa de golpe Redatora Publicado em24 de julho de 2025 às17h06. Dados do relatório Segurança em Números 2025, divulgados nesta quinta-feira, 24, mostram que 13,5% dapopulação prisional brasileiracumpre pena em regime domiciliar com monitoramento eletrônico. O número representa uma parcela significativa do total de909.594 pessoas privadas de liberdade no país, sendo atornozeleira eletrônicao recurso utilizado para acompanhar o cumprimento das restrições judiciais fora do ambiente penitenciário. O levantamento aponta que cerca de 123 mil pessoas estavam nessa condição em 2024, refletindo a expansão das medidas alternativas ao encarceramento tradicional. A tornozeleira tem sido adotada tanto em decisões judiciais de primeira instância quanto em concessões de instâncias superiores, como nocaso do ex-presidente Jair Bolsonaro, que teve a medida determinada no âmbito do inquérito das milícias digitais. O uso da tornozeleira eletrônica vem crescendo no Brasil como uma alternativa para reduzir o impacto da superlotação nas unidades prisionais. Segundo o relatório, 20,3% da população carcerária trabalha dentro ou fora do sistema, e a adoção de monitoramento remoto permite a continuidade dessas atividades sob vigilância. Além disso, decisões judiciais têm utilizado o recurso para aplicar medidas cautelares e proteger vítimas de violência doméstica, com base naLei Maria da Penha. A distribuição desse tipo de prisão varia entre os estados, de acordo com a capacidade técnica, cobertura de rede e infraestrutura do sistema penal local. O relatório também destaca que o déficit nacional de vagas prisionais é de 10,6%, o que pressiona o Judiciário a aplicar medidas alternativas, especialmente em casos de réus primários, mulheres gestantes ou indivíduos em regime semiaberto. Relatório aponta que a maioria das vítimas é formada por homens jovens, negros e mortos em via pública País registra 44 mil mortes violentas e aumento de crimes contra crianças em 2024 Declaração do presidente ocorreu nesta quinta-feira em um evento em Minas Gerais Receita Federal arrecadou R$ 1,4 trilhão neste ano, entre janeiro e junho 01 02 03 exame no whatsapp Receba as notícias da Exame no seu WhatsApp Nos acontecimentos mais relevantes do Brasil e mundo. E-mail inválido Desperta",Exame
https://exame.com/invest/mercados/dolar-fecha-perto-da-estabilidade-com-desdobramentos-das-tarifas-de-trump-no-radar/,2025-07-24,Dólar fecha perto da estabilidade com desdobramentos das tarifas de Trump no radar,"Dólar: Na máxima do dia, moeda americana chegou a R$ 5,539. (RHJ/Getty Images) Redação Exame Publicado em24 de julho de 2025 às17h02. Odólarfechou esta quinta-feira, 24, com leve queda de 0,06%, cotado aR$ 5,519. Na máxima do dia, chegou a R$ 5,539. Investidores continuam atentos a possíveis novas informações sobre medidas tarifárias dos Estados Unidos contra o Brasil. Ontem, o mercado mostrou um apetite maior por ativos de risco, otimistas com o acordo comercial fechado entre Japão e EUA, com odólar fechando o dia com queda de 0,79%.O acordo estabelece uma tarifa de 15% sobre produtos japoneses, abaixo dos 25% inicialmente previstos para entrarem em vigor em 1º de agosto. O presidente americanoDonald Trumpanunciou umatarifa extra de importação de 50% para os produtos brasileiros no início do mês,argumentando que a taxa se deve aos processos judiciais contra o ex-presidente Jair Bolsonaro e contra as redes sociais americanas. Além disso, o republicano também citou práticas comerciais do Brasil que considera prejudiciais aos Estados Unidos. Na segunda, o ministro da Fazenda,Fernando Haddad, afirmou que o governo avalia implementar instrumentos de apoio a setores da economia impactados pela tarifa anunciada pelos EUA. Enquanto isso, o vice-presidente,Geraldo Alckmin, realiza reuniões com o setor produtivo para discutir uma resposta à tarifa de 50%sobre produtos brasileiros. A faixa de 15% foi definida por Trump como o menor percentual de sobretaxa a ser impostos, enquanto a de 50% seria a maior. Mais cedo, o ministro do STF,Alexandre de Moraes, decidiu não mandar prenderBolsonaro, o que elevou a volatilidade do câmbio momentaneamente. Depois disso, ele voltou à estabilidade. O dólar à vista é o valor negociado no mercado de câmbio para liquidação imediata, geralmente em até dois dias úteis. Esse tipo de câmbio é amplamente utilizado por empresas e instituições financeiras em operações de curto prazo, oferecendo uma cotação com base no valor real de mercado no momento da transação. O dólar futuro é uma cotação projetada para contratos de compra e venda de dólares a serem liquidados em datas futuras. Esse tipo de dólar é negociado na Bolsa de Valores, permitindo que empresas e investidores se protejam contra a volatilidade cambial. A cotação do dólar futuro pode variar bastante, pois leva em consideração as expectativas do mercado sobre a economia. Investidores repercutem uma bateria de balanços corporativos, os dados de emprego nos Estados Unidos e o discurso da presidente do Banco Central Europeu Após balanço mal recebido por investidores, executivos desenham estratégias para reduzir impacto de um possível ‘tarifaço’ Desfalque de Musk se soma a um período difícil para a Tesla, que enfrenta desafios adicionais devido à possível eliminação de um crédito fiscal de US$ 7,5 mil para a compra de veículos elétricos Loteria americana chega a prêmio histórico, atraindo milhões de apostadores de todo o mundo. Saiba como participar da Powerball 01 02 03 exame no whatsapp Receba as notícias da Exame no seu WhatsApp Nas melhores oportunidades do mercado para investir. E-mail inválido Invest",Exame
https://exame.com/pop/battlefield-6-e-anunciado-para-pc-playstation-5-e-xbox-series-veja-o-que-esperar-do-jogo/,2025-07-24,"Battlefield 6 é anunciado para PC, PlayStation 5 e Xbox Series; veja o que esperar do jogo","Battlefield 6: jogo estará disponível para PC, PlayStation 5 e Xbox Series X|S (Eletronic Arts/Divulgação) Repórter Publicado em24 de julho de 2025 às16h53. A Electronic Arts (EA) revelou, nesta quinta-feira, 24, o trailer oficial deBattlefield 6, e anunciou que o jogo estará disponível paraPC, PlayStation 5 e Xbox Series X|S. ""Testemunhe o violento caminho de destruição construído pela Pax Armata, o principal grupo militar privado do mundo. A PAX quer a destruição daOTANe de seus aliados, e não mede esforços para manter seu lema: 'Nossa Proteção, Sua Paz'"", diz a descrição do jogo. Mais informações sobre o título serão compartilhadas em 31 de julho, às 15h30 (horário de Brasília), com uma transmissão ao vivo noYouTube, exibindo a jogabilidade do modo multiplayer deBattlefield 6. ""Prepare-se para a experiência de guerra total definitiva. Lute em combates de infantaria de alta intensidade. Corte os céus em combates aéreos. Destrua seu ambiente para ter uma vantagem estratégica. Em uma guerra de tanques, jatos e enormes arsenais de combate, seu pelotão é a arma mais mortal. Este é oBattlefield 6."" O site oficial do jogo já está no ar e, conforme indicado nos ""Avisos Legais"" (via Wario64), a data de lançamento está confirmada para 10 de outubro, coincidente com o fechamento das ofertas de pré-venda. Astro de Hollywood estrela como Reed Richards, o Sr. Elástico, no novo ""Quarteto Fantástico"", da Marvel O elenco conta com estrelas como Robert Downey Jr., Ralph Fiennes, Antonio Banderas, Tom Holland, Emma Thompson, entre outros Leilão exclusivo reúne objetos raros do ‘Príncipe das Trevas’, incluindo uma guitarra de Randy Rhoads e memorabilia histórica O ex-lutador sofreu uma parada cardíaca em casa, na cidade de Clearwater, Flórida 01 02 03 exame no whatsapp Receba as notícias da Exame no seu WhatsApp Nos acontecimentos mais relevantes do Brasil e mundo. E-mail inválido Desperta",Exame
