url,data,titulo,texto,fonte
https://exame.com/invest/mercados/banco-do-brasil-descarta-dividendo-antecipado-apos-distribuicao-cair-para-30-do-lucro/,2025-08-20,Banco do Brasil descarta dividendo antecipado após distribuição cair para 30% do lucro,"Logo do Banco do Brasil (BBSA3) (Paulo Whitaker/Reuters) Repórter de negócios e finanças Publicado em20 de agosto de 2025 às19h33. O Banco do Brasil (BBAS3) informou, por meio de fato relevante, que não vai antecipar a distribuição de dividendos referentes ao terceiro trimestre de 2025. Os valores serão pagos integralmente no dia 11 de dezembro deste ano. O banco diz estar em convergência para opayout(percentual do lucro distribuído em proventos) de 30%, aprovado pela administração no último dia 13 de agosto. O BB costumava distribuir entre 40% e 45% do lucro, mas revisou o percentual diante da queda de mais de 60% do lucro no segundo trimestre deste ano. A inadimplência do agronegócio pressionou os resultados do banco no período. NoBanco do Brasil, 30% da carteira de clientes é composta por produtores do setor agro. Além disso, o BB é responsável pormetade do financiamento do agronegócio brasileiro, o que o torna mais vulnerável às flutuações do setor — o banco é o principal financiador do Plano Safra. A inadimplência atual é resultado da seca de 2023 e das enchentes no Sul em 2024. Ao todo, são20 mil clientes do setor agro com contas em atraso há mais de 90 dias, de um total de um milhão — 2% da base. Entre esses devedores, 74% são clientes quenunca haviam apresentado inadimplênciacom o banco até 2023. Na teleconferência dos resultados trimestrais, o CFO Geovanne Tobias destacou que o foco da instituição está na geração orgânica de capital e na recuperação da carteira de crédito, principalmente no segmento de agronegócio.A expectativa é de que não haja pagamento extraordinário de proventos este ano. ApresidenteTarciana Medeiros, por sua vez, enfatizou que a redução nopayouté uma fase temporária. ""Estamos passando por um ciclo que, eventualmente, será superado, e retornaremos ao patamar de rentabilidade que o Banco do Brasil sempre teve. Mesmo assim, este foi o quarto maior lucro da história do banco"", destacou. O BB registrou lucro líquido ajustado de R$ 3,8 bilhões entre e maio e junho deste ano. O número é 60,2%menor que o registrado no mesmo período em 2024. Pietro Mendes também é secretário do Ministério de Minas e Energia e teve nome aprovado para assumir diretoria na ANP Refeições combinadas terão descontos em até oito opções, respondendo a aumento de preços e queda no tráfego de clientes Sistema de pagamento instantâneo pode incentivar transações comerciais no bloco e reduzir dependência do dólar Valor da operação chamou a atenção dos analistas e pode ajudar a reduzir a alavancagem da Simpar 01 02 03 exame no whatsapp Receba as notícias da Exame no seu WhatsApp Nas melhores oportunidades do mercado para investir. E-mail inválido Invest",Exame
https://exame.com/brasil/pf-conclui-relatorio-indicia-jair-e-eduardo-bolsonaro-e-envia-documento-ao-stf/,2025-08-20,PF conclui relatório e indicia Jair e Eduardo Bolsonaro por tentativa de obstruir processo no STF,"Repórter Publicado em20 de agosto de 2025 às19h27. Última atualização em20 de agosto de 2025 às20h00. APolícia Federalinformou nesta quarta-feira, 20, que concluiu o relatório de investigação sobre ações de coação em suposta tentativa de golpe de Estado no Brasil e indiciou oex-presidente Jair Bolsonaroe odeputado federal Eduardo Bolsonaro (PL-SP)por tentativa de obstrução de Justiça. Segundo a corporação, o relatório foi encaminhado aoSupremo Tribunal Federal (STF). Durante a investigação, a Polícia Federal, ao restaurar dados de backup, descobriu uma intensa atividade de Jair Bolsonaro na criação e disseminação de mensagens para as redes sociais, violando a medida cautelar que havia sido imposta anteriormente. O relatório foi enviado ao ministroAlexandre de Moraes, do STF, e acusaJair Bolsonaroe seu filho, Eduardo Bolsonaro, de agirem de maneira coordenada para interferir nas investigações. Ambos são acusados de cometer coação no curso do processo e de tentar abalar o Estado Democrático de Direito, buscando restringir o funcionamento dos poderes constitucionais. O inquérito aponta que Eduardo Bolsonaro, atualmente nosEstados Unidos, tem utilizado sua atuação internacional para deslegitimar as instituições brasileiras e proteger seu pai no processo que está em andamento no STF. A PF também tomou medidas contra o pastorSilas Malafaia, incluindo a realização de buscas e apreensões, além da retenção de seu passaporte. No relatório, também foi citado o jornalista Paulo Figueiredo. No relatório, a Polícia Federal informou que foram recuperados do celular de Jair Bolsonaro áudios e conversas com Malafaia e Eduardo Bolsonaro, que haviam sido apagados. Esses registros, segundo os investigadores, reforçam as tentativas de articulação para intimidar autoridades brasileiras e interferir nos inquéritos que investigam a trama golpista. “Conclui-se que Eduardo Nantes Bolsonaro e Jair Messias Bolsonaro, com a participação de Paulo Figueiredo e Silas Lima Malafaia, encontram-se associados ao mesmo contexto, praticando condutas com objetivo de interferir no curso da Ação Penal nº 2668 – STF, processo no qual o segundo nominado consta formalmente como réu”, diz o relatório da PF. A investigação, que faz parte do inquérito sobre a tentativa de golpe, aponta que os atos não foram isolados, mas parte de uma estratégia intencional de obstrução judicial, com o apoio de aliados bolsonaristas. Entre os elementos reunidos estão declarações públicas, articulações internacionais e ações coordenadas nas redes sociais. A ação penal de número 2668, que trata especificamente da tentativa de golpe de Estado após as eleições de 2022, já tornou Jair Bolsonaro réu por cinco crimes. O indiciamento de Eduardo Bolsonaro amplia a responsabilidade dentro do núcleo político e familiar do ex-presidente. A Polícia Federal também encontrou mensagens nas quais Jair Bolsonaro teria conversado com aliados sobre a possibilidade de solicitar asilo político aopresidente da Argentina, Javier Milei. De acordo com a PF, no conteúdo, Bolsonaro alegou perseguição política no Brasil: “De início, devo dizer que sou, em meu país de origem, perseguido por motivos e por delitos essencialmente políticos. No âmbito de tal perseguição, recentemente, fui alvo de diversas medidas cautelares. Para decretação de tais medidas foram mencionados os delitos dos Arts. 359-I e 359-M do Código Penal brasileiro."" Durante a análise do material apreendido, a polícia encontrou um arquivo de texto cuja última modificação ocorreu em 12 de fevereiro de 2024. O conteúdo desse arquivo revela que Bolsonaro ""praticou atos para obter asilo político na Argentina"". Embora o documento seja um único arquivo editável, sem data e assinatura, o seu teor indica que o réu, desde o início da operação Tempus Veritatis [que investiga a tentativa de golpe de Estado], estava planejando ações para fugir do país e evitar a aplicação da lei penal"", destacou a Polícia Federal. A data da última modificação do documento coincide com o momento em que o ex-presidente esteve na embaixada da Hungria no Brasil, onde permaneceu por duas noites. Essa visita aconteceu quatro dias após a apreensão de seu passaporte pela Polícia Federal, durante uma operação. ""A Polícia Federal concluiu as investigações que apuraram ações de coação no curso da Ação Penal n° 2668, em trâmite no Supremo Tribunal Federal (STF). O relatório final foi encaminhado ao STF, nesta sexta-feira (15/8), com o indiciamento de um deputado federal, atualmente no exterior, e de um ex-presidente da República, pelos crimes de coação no curso do processo e tentativa de abolição do Estado Democrático de Direito por meio da restrição ao exercício dos poderes constitucionais."" As linhas 11-Coral e 10-Turquesa terão uma estação adicionada em seus percursos, enquanto a 7-Rubi deixará de atender uma estação. As mudanças começam na próxima semana Para ter validade, medida ainda precisa ser aprovada pelo Plenário do Senado Com parlamentares, ministra quer analisar o que levou a derrota, que pegou Planalto de surpresa, e recalcular os próximos passos do governo no colegiado Para valer nas eleições de 2026, o texto precisa passar também pela Câmara e ser sancionado até outubro deste ano 01 02 03 exame no whatsapp Receba as notícias da Exame no seu WhatsApp Nos acontecimentos mais relevantes do Brasil e mundo. E-mail inválido Desperta",Exame
https://exame.com/esporte/por-que-ancelotti-passou-por-bateria-de-exames-procedimento-pode-afetar-proximos-jogos-da-selecao/,2025-08-20,Por que Ancelotti passou por bateria de exames? Resultados podem afetar próximos jogos da Seleção,"Carlo Ancelotti: treinador italiano assumiu a Seleção Brasileira de Futebol (Mauro Pimentel/AFP) Repórter Publicado em20 de agosto de 2025 às18h38. Última atualização em20 de agosto de 2025 às18h43. O treinador da seleção brasileira,Carlo Ancelotti, realizou uma série de exames médicos nesta terça-feira, no Rio de Janeiro, faltando pouco menos de um mês para o confronto contra a Bolívia, em El Alto, pela última rodada das eliminatórias sul-americanas para aCopa do Mundo. Esses exames têm caráter preventivo e fazem parte do protocolo da CBF para jogos disputados em altitudes elevadas – El Alto, na região metropolitana de La Paz, está localizada a 4 mil metros acima do nível do mar. Durante sua participação no programa Seleção Sportv, nesta última terça-feira, o presidente daCBF, Samir Xaud, afirmou que o técnico italiano, de 66 anos, estará à frente da equipe brasileira no banco de reservas durante o jogo contra os bolivianos, que ainda buscam uma vaga no próximo Mundial, enquanto o Brasil já está classificado. A CBF ainda não divulgou a programação detalhada para essa partida. A expectativa é que a Seleção se prepare na Granja Comary, em Teresópolis, viaje para Santa Cruz de La Sierra, cidade sem altitude, e siga para El Alto somente no dia do jogo. Antes do duelo contra a Bolívia, o Brasil enfrentará o Chile, no Maracanã, em 4 de setembro. Com 25 pontos, a Seleção já assegurou sua participação na Copa do Mundo, que será realizada no Canadá, EUA e México. Ancelotti fará a convocação para esses dois jogos na próxima segunda-feira. É certo que o atacante Vini Jr., suspenso para o confronto contra o Chile, ficará de fora da lista: ele será preservado para o jogo contra a Bolívia. Os convocados se reunirão na Granja Comary a partir de 1º de setembro. Na próxima segunda-feira, 25 de agosto, às 15h30, o técnicoCarlo Ancelottivai divulgar a convocação dos 23 jogadores para os dois últimos jogos da Seleção Brasileira nasEliminatórias da Copa do Mundo de 2026. O anúncio acontecerá na sede daConfederação Brasileira de Futebol (CBF), localizada na Barra da Tijuca, no Rio de Janeiro (RJ), e será transmitido ao vivo pela CBF TV. Com 25 pontos e já garantida na Copa do Mundo, a Seleção ocupa a terceira posição na tabela de classificação. O Brasil enfrentará o Chile no dia 4 de setembro, às 21h30 (horário de Brasília), no Maracanã. Em seguida, a equipe viajará para El Alto, onde enfrentará a Bolívia no dia 9 de setembro, às 20h30 (horário de Brasília). Nos últimos anos, mercado esportivo ficou tão aquecido que investidores precisaram se unir para entrar em alguns negócios A Copa Libertadores 2025 segue como um torneio de grande importância esportiva e financeira, com prêmios milionários e um título disputado por clubes de peso no continente O Tricolor paulista segue em sua busca pelo título, agora com uma premiação expressiva e uma vaga entre os oito melhores times da competição continental A partida entre Internacional e Flamengo é válida pelas oitavas de final da Copa Libertadores 01 02 03 exame no whatsapp Receba as notícias da Exame no seu WhatsApp Nos acontecimentos mais relevantes do Brasil e mundo. E-mail inválido Desperta",Exame
https://exame.com/brasil/7-rubi-menor-e-10-turquesa-e-11-coral-maiores-o-que-vai-mudar-nas-linhas-da-cptm/,2025-08-20,"7-Rubi menor, 10-Turquesa e 11-Coral maiores: o que vai mudar nas linhas da CPTM","CPTM: mudanças vão afetar três linhas (Rovena Rosa/Agência Brasil) Repórter de Brasil e Economia Publicado em20 de agosto de 2025 às18h37. Última atualização em20 de agosto de 2025 às18h56. As três linhas daCompanhia Paulista de Trens Metropolitanos (CPTM)passarão por mudanças de traçado a partir da próxima semana. Aslinhas 11-Coral e 10-Turquesaterão uma estação adicionada em seus percursos, enquanto a7-Rubideixará de atender uma estação. A partir de segunda-feira, 25 de agosto, a linha 11-Coral, que parte da estação Estudantes, passará a ter como novo terminal a estação Palmeiras-Barra Funda. Anteriormente, o trajeto terminava na estação Luz. Com a alteração, o governo paulista afirma que passageiros vindos do Alto Tietê e da zona leste terão acesso direto à zona oeste da capital durante os dias úteis, nos chamados horários de vale — das 8h às 15h30 e das 20h à 0h. As mudanças nas demais linhas ocorrerão a partir de quinta-feira, 28 de agosto. A linha 10-Turquesa, que antes ia de Rio Grande da Serra até a Luz, passará a ter como terminal a estação Barra Funda, com uma estação a mais no trajeto. A linha 7-Rubi será a única das linhas a ""perder"" uma estação. O novo traçado vai de Jundiaí até Barra Funda, sem parada na estação Luz, que deixará de ser o terminal da linha. Para os passageiros que quiserem seguir até a Luz, será necessário fazer baldeação na mesma plataforma,com estimativa de impacto de até 6 minutos no deslocamento. As alterações estão relacionadas ao fim do Serviço 710 da CPTM, que unificava as linhas 7-Rubi e 10-Turquesa, com trens circulando entre Jundiaí e Rio Grande da Serra. Com a concessão da linha 7 à iniciativa privada, esse serviço será descontinuado. Além da linha 7, a linha 11-Coral também foi concedida à iniciativa privada em leilão realizado em março deste ano. O ramal — que inclui ainda as linhas 12-Safira e 13-Jade —passará a ser administrado pelo Grupo Comporte, holding de transportes que venceu a licitação. Apenas a linha 10-Turquesa ainda não foi leiloada,mas existe a previsão do certame até o fim do ano. O governo estadual afirma que as mudanças fazem parte do projeto de transformar a estação Palmeiras-Barra Funda no novo hub de integração do transporte ferroviário em São Paulo. A expectativa é que a reorganizaçãomelhore a fluidez da operação e traga mais agilidade e conforto aos passageiros. Além das linhas da CPTM, incluindo o Expresso Aeroporto, a estação Barra Funda também integra a linha 3-Vermelha do Metrô e a linha 8-Diamante da ViaMobilidade, além de oferecer conexão com terminais rodoviários intermunicipais e interestaduais, universidades, casas de show e equipamentos culturais. Para ter validade, medida ainda precisa ser aprovada pelo Plenário do Senado Com parlamentares, ministra quer analisar o que levou a derrota, que pegou Planalto de surpresa, e recalcular os próximos passos do governo no colegiado Para valer nas eleições de 2026, o texto precisa passar também pela Câmara e ser sancionado até outubro deste ano Presidência e relatoria da Comissão Parlamentar Mista de Inquérito ficaram com o senador Carlos Viana (Podemos-MG) e o deputado Alfredo Gaspar (União-AL) 01 02 03 exame no whatsapp Receba as notícias da Exame no seu WhatsApp Nos acontecimentos mais relevantes do Brasil e mundo. E-mail inválido Desperta",Exame
https://exame.com/invest/mercados/petrobras-presidente-do-conselho-de-administracao-renuncia-quatro-meses-apos-reeleicao/,2025-08-20,Presidente do conselho de administração da Petrobras renuncia para assumir cargo na ANP,"Pietro Mendes renunciou do conselho alegando ""novos desafios profissionais"" (Tomaz Silva/ Agência Brasil) Repórter de negócios e finanças Publicado em20 de agosto de 2025 às18h25. Última atualização em20 de agosto de 2025 às18h46. O presidente do conselho de administração da Petrobras, Pietro Adamo Sampaio Mendes, renunciou do cargo, segundo fato relevante divulgado pela estatal na noite desta quarta-feira, 20. De acordo com o comunicado, a renúncia tem efeitos imediatos. Mendes deixa oboard""em razão de novos desafios profissionais"", diz a nota. O nome de Pietro Mendes foi aprovado ontem pelo Senado Federal para assumiruma diretoria na Agência Nacional do Petróleo, Gás Natural e Biocombustíveis (ANP). Ele assumirá esse cargo após publicação no Diário Oficial da União. ""O senhor Pietro Adamo Sampaio Mendes, ao renunciar, deixou seu agradecimento aos colegas de conselho, aos membros da diretoria executiva, liderados pela presidente Magda Chambriard, e às equipes da Petrobras pela colaboração durante seu período à frente do conselho de administração, e desejou sucesso a todos na caminhada que prossegue"". A Petrobras explica que o próprio conselho de administração pode eleger um substituto para ochairman. A eleição deve ocorrer até a realização da próxima assembleia geral da companhia. Desde abril de 2023, Pietro Mendes conciliava a presidência doboardcom o cargo de secretário nacional de petróleo, gás natural e biocombustíveis do Ministério de Minas e Energia (MME). Em abril deste ano, ele foi reeleito para um novo mandato de presidente do conselho da Petrobras,com indicação da União- o acionista controlador - para ocupar o cargo. O fato de ocupar um cargo no governo lhe rendeuum afastamento do conselho no ano passado, por determinação da Justiça, a pedido de um deputado do partido Novo, que alegou conflito de interesse. Mendes ingressou no MME em 2020, ainda no governo Bolsonaro. Essa não será sua primeira incursão na ANP. Mendes foi assessor do diretor-geral da ANP entre os anos de 2018 e 2020. Refeições combinadas terão descontos em até oito opções, respondendo a aumento de preços e queda no tráfego de clientes Sistema de pagamento instantâneo pode incentivar transações comerciais no bloco e reduzir dependência do dólar Valor da operação chamou a atenção dos analistas e pode ajudar a reduzir a alavancagem da Simpar Entenda o impacto da Selic nos investimentos, as diferenças entre renda fixa e variável e como montar uma estratégia inteligente em tempos de juros altos 01 02 03 exame no whatsapp Receba as notícias da Exame no seu WhatsApp Nas melhores oportunidades do mercado para investir. E-mail inválido Invest",Exame
https://exame.com/negocios/esse-e-o-maior-arrependimento-financeiro-dos-americanos-veja-como-evita-lo/,2025-08-20,Esse é o maior arrependimento financeiro dos americanos — veja como evitá-lo,"(Natalya Kosarevich/Getty Images) Redatora Publicado em20 de agosto de 2025 às18h17. Não poupar dinheiro foi apontado como o maior arrependimento financeiro dos americanos em 2025. De acordo com uma pesquisa realizada pela consultoria Bankrate, com 2.078 pessoas nos Estados Unidos,cerca de 40% dos entrevistados admitiram que se arrependeram de não terem economizadoo suficiente para a aposentadoria, emergências ou educação dos filhos. O levantamento mostra que 3 em cada 4 americanos tiveram algum tipo de arrependimento financeiro no último ano. As informações foram retiradas deCNBC Make It. Aprenda como evitar o maior arrependimento financeiro: não poupar o suficiente. Desenvolva estratégias para proteger sua empresa. Participe do Pré-MBA em Finanças Corporativas por R$ 37. Embora o arrependimento pessoal domine a narrativa da pesquisa, os reflexos desse comportamento se estendem ao mundo corporativo. Colaboradores com dificuldades financeiras tendem a apresentar menor produtividade, maior índice de faltas e mais dificuldade para tomar decisões críticas, especialmente quando ocupam posições de liderança ou gestão orçamentária. 43% dos entrevistados com algum tipo de arrependimento afirmaram não ter feito qualquer progresso em direção à resolução do problema no último ano. E quando questionados sobre o que mais ajudaria suas finanças no curto prazo, as respostas foram pragmáticas: custos menores com gasolina e supermercado, melhores oportunidades de trabalho, aluguéis mais baratos e valorização do mercado de ações. Para empresas, departamentos financeiros e líderes corporativos, o cenário reforça anecessidade de reforçar a cultura deeducação financeiradentro das organizações. Um colaborador que entende como gerenciar seus próprios recursos tende a ser mais eficiente ao lidar com orçamentos empresariais, metas de rentabilidade, investimentos e estratégias de redução de custos. PRÉ-MBA EM FINANÇAS CORPORATIVAS: Domine gestão financeira que melhora não só suas finanças pessoais, mas também sua performance profissional. Garanta sua vaga por R$ 37. Jake Martin, planejador financeiro certificado ouvido pelo Business Insider, afirma que o mais difícil costuma ser simplesmente começar, especialmente quando se tem a sensação de que é tarde demais. Mas, segundo ele, “começar tarde ainda é melhor do que nunca começar”. Martin orienta um caminho prático de três etapas que também pode ser incorporado ao planejamento financeiro de qualquer área corporativa: Esses fundamentos não são novidade para quem atua emfinanças corporativas. Mas o que os dados do Bankrate reforçam é o abismo entre o conhecimento técnico e sua aplicação na vida prática. Por isso, a EXAME, em parceria com a Saint Paul Escola de Negócios, lançou oPré-MBA em Finanças Corporativas— um treinamento criado para quem quer dominar a lógica dos números e utilizá-la como diferencial na trajetória profissional,por R$37,00. Reduza o abismo entre conhecimento técnico e aplicação prática. Domine finanças que funcionam tanto para sua vida pessoal quanto carreira corporativa com a EXAME + Saint Paul.Faça um pré-MBA com três horas de duração e quatro aulas práticas. Clique aqui e faça sua inscrição. Um cálculo mal feito no planejamento financeiro pode reduzir meses de sobrevivência de uma empresa recém nascida Em Ourinhos, no interior paulista, Rodrigo e Camila Santiago fundaram a Santoagro, consultoria que ajuda o agronegócio a recuperar créditos tributários e está no ranking EXAME Negócios em Expansão 2025 Carter Osborne criou um negócio online de tutoria para ingresso em universidades; tem três meses de férias e fatura mais do que ganhava em uma multinacional Hefei aposta em inovação para impulsionar crescimento econômico, com a criação de mais de 770 empresas baseadas em pesquisa científica no primeiro semestre de 2025 01 02 03 exame no whatsapp Receba as notícias da Exame no seu WhatsApp Nas principais tendências de carreira e do mercado. E-mail inválido Carreira 3.0",Exame
