url,data,titulo,texto,fonte
https://exame.com/mundo/trem-de-pouso-de-aeronave-da-american-airlines-pega-fogo-na-decolagem-nos-eua/,2025-07-27,Trem de pouso de aeronave da American Airlines pega fogo na decolagem nos EUA,"Avião da American Airlines pega fogo em Denver (Redes Sociais/Reprodução) Repórter Publicado em27 de julho de 2025 às14h43. Um Boeing 737 Max 8 daAmerican Airlinesprecisou ser evacuado durante os procedimentos de decolagem no aeroporto deDenver, noColorado, neste sábado, 26.A aeronave, que tinha como destinoMiami, naFlórida, pegoufogo no trem de pouso esquerdo, segundo informações da companhia e da torre de controle. A gravação do contato entre os pilotos e os controladores de tráfego aéreo confirma queos bombeiros do aeroporto foram acionados para conter o início do incêndio. O avião ficou cercado por fumaça enquanto equipes de emergência se aproximavam da pista. Os 179 ocupantes, incluindo passageiros e tripulantes, deixaram aaeronavepelas saídas de emergência, utilizando as escorregadeiras. Apesar das instruções para abandonarem as bagagens, várias pessoas saíram levando malas. Uma dessas situações resultou em um acidente: um passageiro, ao se desequilibrar com o peso de sua bagagem, acabou ferindo uma criança. Cinco pessoas receberam atendimento médico no aeroporto, e uma delas precisou ser encaminhada ao hospital com ferimentos leves. AFederal Aviation Administration, ouFAA, informou que ainda não é possível determinar as causas do incêndio. O órgão abriu uma investigação para apurar o caso. A post shared by Highly Migratory (@highlymigratoryfishing) Possibilidade será discutida entre representantes dos dois países a partir desta segunda-feira em Estocolmo Presidente americano se reuniu com Ursula von der Leyen, presidente da Comissão Europeia, na Escócia para negociar as medidas tarifárias entre os EUA e o bloco Centros eleitorais começaram a abrir suas portas às 6h, para uma jornada que deve terminar às 18h Região enfrenta uma crise alimentar provocada pelas restrições à entrada de suprimentos impostas por Israel 01 02 03 exame no whatsapp Receba as notícias da Exame no seu WhatsApp Nos acontecimentos mais relevantes do Brasil e mundo. E-mail inválido Desperta",Exame
https://exame.com/mundo/eua-e-china-devem-prorrogar-tregua-tarifaria-por-mais-90-dias-diz-jornal/,2025-07-27,"EUA e China devem prorrogar trégua tarifária por mais 90 dias, diz Jornal","Durante essa extensão, os dois países não deverão impor tarifas adicionais um ao outro (AFP) Agência de notícias Publicado em27 de julho de 2025 às14h20. Estados UnidoseChinadevem estender atrégua tarifáriapor mais três meses, segundo informou o jornalSouth China Morning Post, citando pessoas familiarizadas com o assunto. Durante essa extensão, os dois países não deverão importarifasadicionais um ao outro, disse uma das fontes ao jornal. A atual pausa estava prevista para terminar em 12 de agosto. A reportagem foi publicada às vésperas das negociações comerciais entre o secretário doTesourodos EUA, Scott Bessent, e o vice-primeiro-ministro chinês, He Lifeng, que devem começar na segunda-feira, em Estocolmo. Na última terça-feira, Bessent disse esperar que uma extensão da trégua comercial seja resultado dessa próxima rodada de negociações, que incluirá uma gama mais ampla de temas — incluindo as compras de petróleo feitas por Pequim da Rússia e do Irã. 1/7Howard Lutnick foi CEO a Cantor Fitzgerald, uma empresa de serviços financeiros especializada em títulos do governo. Ele assumiu o Departamento de Comércio(Howard Lutnick foi CEO a Cantor Fitzgerald, uma empresa de serviços financeiros especializada em títulos do governo. Ele assumiu o Departamento de Comércio) 2/7Jamieson Greer será o representante comercial, responsável por enfrentar outros países em questões comerciais(Jamieson Greer será o representante comercial, responsável por enfrentar outros países em questões comerciais) 3/7Kevin Hassett foi chefe do Conselho de Assessores Econômicos durante o primeiro mandato de Trump. Será diretor do Conselho Econômico Nacional(Kevin Hassett foi chefe do Conselho de Assessores Econômicos durante o primeiro mandato de Trump. Será diretor do Conselho Econômico Nacional) 4/7Michael Faulkender será secretário-adjunto do Tesouro. Esteve no primeiro mandato de Trump como secretário-assistente de política econômica(Michael Faulkender será secretário-adjunto do Tesouro. Esteve no primeiro mandato de Trump como secretário-assistente de política econômica) 5/7O investidor e gestor de fundos de hedge dos EUA Scott Bessent testemunha perante o Comitê de Finanças do Senado sobre sua nomeação para Secretário do Tesouro, no Capitólio em Washington, DC, em 16 de janeiro de 2025(O investidor e gestor de fundos de hedge dos EUA Scott Bessent testemunha perante o Comitê de Finanças do Senado sobre sua nomeação para Secretário do Tesouro, no Capitólio em Washington, DC, em 16 de janeiro de 2025) 6/7Peter Navarro será conselheiro sênior para comércio e indústria. Economista formado por Harvard, ele cumpriu quatro meses de prisão no ano passado após se recusar a cooperar com uma investigação do Congresso sobre o ataque ao Capitólio em 6 de janeiro de 2021(Peter Navarro será conselheiro sênior para comércio e indústria. Economista formado por Harvard, ele cumpriu quatro meses de prisão no ano passado após se recusar a cooperar com uma investigação do Congresso sobre o ataque ao Capitólio em 6 de janeiro de 2021) 7/7Após atuar como diretor do Orçamento da Casa Branca durante o primeiro mandato de Trump, Russell Vought estará no Escritório de Gestão e Orçamento(Após atuar como diretor do Orçamento da Casa Branca durante o primeiro mandato de Trump, Russell Vought estará no Escritório de Gestão e Orçamento) Presidente americano se reuniu com Ursula von der Leyen, presidente da Comissão Europeia, na Escócia para negociar as medidas tarifárias entre os EUA e o bloco Centros eleitorais começaram a abrir suas portas às 6h, para uma jornada que deve terminar às 18h Região enfrenta uma crise alimentar provocada pelas restrições à entrada de suprimentos impostas por Israel As IDF anunciaram neste domingo uma 'pausa tática' diária de dez horas em suas atividades militares em três zonas do enclave para permitir a distribuição de ajuda humanitária 01 02 03 exame no whatsapp Receba as notícias da Exame no seu WhatsApp Nos acontecimentos mais relevantes do Brasil e mundo. E-mail inválido Desperta",Exame
https://exame.com/mundo/trump-reforca-que-tarifas-comecam-em-1-de-agosto-e-ve-boa-chance-de-acordo-com-a-uniao-europeia/,2025-07-27,Trump reforça que tarifas começam em 1° de agosto e vê 'boa chance' de acordo com a União Europeia,"Donald Trump se reuniu com Ursula von der Leyen, presidente da Comissão Europeia, na Escócia (Andrew Harnik/Getty Images) Repórter Publicado em27 de julho de 2025 às13h58. Última atualização em27 de julho de 2025 às14h58. O presidente dos Estados Unidos,Donald Trump, afirmou neste domingo, 27 de julho, que há “boa chance” de um acordo com aUnião Europeiasobre astarifas impostasao bloco. Ele declarou que as novas tarifas comerciais entram em vigor em1° de agosto, próxima sexta-feira, exceto no caso do aço e do alumínio. Trump se reuniu com Ursula von der Leyen, presidente da Comissão Europeia, na Escócia para negociar as medidas tarifárias entre osEUAe o bloco. Antes do encontro, ambos afirmaram que havia“50% de chance” de um acordo. Em uma coletiva de imprensa antes da reunião, o republicano disse que as divergências incluem barreiras às exportações de automóveis e produtos agrícolas americanos. Questionado se as tarifas poderiam ser “melhores do que 15%”, Trump respondeu: “se melhor significa menor, não”. O presidente afirmou ainda que o mercado europeu é “muito fechado” e que, em caso de acordo, este encerraria a discussão tarifária. Ele acrescentou que produtos farmacêuticos ficariam de fora das tarifas. JáUrsula von der Leyendeclarou que qualquer acerto precisa ser “baseado na justiça e em um reequilíbrio”. Antes da reunião, ela descreveu Trump como um “negociador duro” e destacou que, se fechado, este será o maior acordo já firmado pelas duas partes. Donald Trumpafirmou que a União Europeia precisa abrir seus mercados para os produtos americanos. Ao comentar o desequilíbrio comercial entre as duas regiões, ele disse: “não vendemos carros ou produtos do agronegócio para a Europa. Eles vendem milhões de carros para os EUA”. A presidente da Comissão Europeia concordou com a necessidade de ajustes e disse que “a UE é superavitária e precisa rebalancear os fluxos comerciais”. O republicano indicou ainda que osprodutos farmacêuticospodem ser tratados de forma separada do acordo em negociação com aUnião Europeia. A medida, segundo analistas, representaria um impacto significativo para o bloco, que esperava limitar tarifas sobre medicamentos, um dos principais itens exportados para os EUA. “Os produtos farmacêuticos são muito especiais”, afirmou. Ele reforçou que Washington arrecada valores expressivos com as tarifas já aplicadas ao aço e ao alumínio – itens que aUnião Europeiatenta isentar das taxas. “Quem não quiser pagar nenhuma tarifa deve abrir uma fábrica nos EUA”, enfatizou. De acordo com a agênciaFrance Press, a relação comercial entre osEUAe aUnião Europeiamovimenta cerca deUS$ 1,9 trilhão(R$ 10,5 trilhões na cotação atual) anuais em bens e serviços. Caso Trump e von der Leyen alcancem um acordo, os termos precisarão ser aprovados pelos 27 Estados-membros do bloco, que devem se reunir ainda neste domingo em caso de sinal positivo. Trump também disse que os EUA estão próximos de umacordo com a Chinae queCamboja e Tailândia manifestaram interesse em negociar tarifas comerciais com o país. Presidente dos Estados Unidos e Ursula von der Leyen, presidente da Comissão Europeia, se encontram na Escócia para negociar tarifas Incidente aconteceu no aeroporto de Denver, no Colorado, neste sábado, 26 de julho Possibilidade será discutida entre representantes dos dois países a partir desta segunda-feira em Estocolmo Centros eleitorais começaram a abrir suas portas às 6h, para uma jornada que deve terminar às 18h 01 02 03 exame no whatsapp Receba as notícias da Exame no seu WhatsApp Nos acontecimentos mais relevantes do Brasil e mundo. E-mail inválido Desperta",Exame
https://exame.com/agro/agricultores-alertam-que-operacoes-de-trump-ameacam-seguranca-alimentar-dos-eua/,2025-07-27,Agricultores alertam que operações de Trump ameaçam segurança alimentar dos EUA,"(Anna Moneymaker/AFP) Agência de notícias Publicado em27 de julho de 2025 às13h47. A agricultora Lisa Tate, cuja família trabalhou a terra no sul daCalifórniapor mais de um século, afirma que nunca viu uma ameaça àscolheitascomo nos últimos meses com ainvestida anti-imigração do governo de Donald Trump. Residindo em Ventura, cidade ao norte de Los Angeles que recentemente foi palco de diversas operações das autoridades migratórias, Tate sustenta que a execução dessa política federal não resolve o problema no campo. Pelo contrário, ""só vai desmontar toda aeconomia""e coloca em risco asegurança alimentardo país. ""Comecei a me preocupar quando vi um grupo de agentes de imigração vindo para o Vale Central e indo às fazendas para caçar pessoas, desrespeitando o direito de propriedade"", disse a agricultora de 46 anos em entrevista àAFPem uma de suas plantações de abacate. ""Não estamos acostumados a ver isso naagricultura"",acrescentou Tate, cuja família administra oito fazendas dedicadas principalmente aos cítricos e ao abacate, além de café. A agricultora explica que não se trata apenas dos trabalhadores que colhem assafrasno campo. ""Toda acadeia alimentarestá envolvida"", afirma. Motoristas, embaladores, vendedores, mercados. Além do estado migratório, todo mundo está com medo, disse, inclusive ela, cujas raízes estão profundamente estabelecidas nosEstados Unidos. ""Estou nervosa e assustada porque nos sentimos atacados"", comentou. Vários agricultores consultados pelaAFPrecusaram conversar por medo de represálias do governo. Tate afirma que seu setor tenta há anos encontrar soluções permanentes para o campo que atendam à demanda existente, e não apenas permissões temporárias para trabalhadoresimigrantes, mão de obra essencial nas plantações. O número de vagas que qualificam o programa devistos temporáriospara o campo praticamente triplicou entre 2014 e 2024, segundo dados do Departamento do Trabalho, o que evidencia a dependência do setor demão de obra estrangeirapara preencher suas vagas. E cerca de 42% dos trabalhadores agrícolas não têm autorização para trabalhar nosEstados Unidos, de acordo com um estudo de 2022 do Departamento de Agricultura. Os números coincidem com a contínua escassez de funcionários que osagricultoresenfrentam no campo. Segundo eles, os americanos não buscam esse tipo de trabalho que implica jornadas extensas sob temperaturas extremas, seja com chuva ou sol, e que exige enorme esforço físico. Por consequência, Tate aponta que remover aqueles que realmente estão nos cultivos causaria um caos imensurável. Não apenas paralisaria fazendas, que teriam que trabalhar anos para recuperar sua produção, como também dispararia ospreços dosalimentose atéameaçaria a segurança alimentar do país, obrigando-os a importar alimentos, comenta. ""O que realmente precisamos é umalegislaçãoque estabeleça o tipo de programa necessário, que funcione para os trabalhadores garantindo sua segurança, igualando as condições no comércio internacional, bem como atendendo às necessidades nacionais"", disse. Os trabalhadores também alertam que as operações só espalham medo. ""A única coisa que fazemos é trabalhar"", disse Silvia, que viu vários de seus amigos serem presos em uma operação recente em Oxnard, a cerca de 16 quilômetros a oeste. Amexicanade 32 anos agora vive sempre temerosa de ser a próxima e, consequentemente, de ser separada de suas duas filhas nascidas nos EUA. ""Se não vamos trabalhar, de onde vamos tirardinheiropara os gastos? E se saímos, corremos o risco de nos encontrarmos com eles"", referindo-se aos agentes de imigração. Os agricultores insistem que essas políticas não atendem às verdadeiras necessidades docampo. ""Do jeito que o governo daqui está trabalhando atualmente, todos perdem"", disse Miguel, que tem três décadas de experiência nas plantações do sul da Califórnia, e agora trabalha em uma das fazendas de Tate. O homem de 54 anos, que preferiu não dar seu verdadeiro nome por precaução, afirmou que, por um lado, eles perdem o emprego. Por outro,os agricultores ficam sem mão de obra e os americanos ficam sem comida. ""São trabalhos muito duros"", comentou Miguel, que já desempenhou diversas funções no setor, mesmo durante os anos dapandemia,e agora se sente um alvo vulnerável à caça. ""Que investiguem um pouco para que percebam. Todo produto que eles consomem vem dos campos, certo?"", comentou. ""Então seria bom que tomassem consciência e nos dessem a oportunidade de participar mais positivamente, sem precisar nos esconder"", completou. Geneticista se tornou especialista no melhoramento da planta do café e seus estudos contribuíram para tornar o Brasil um dos principais produtores País lidera a adoção de tecnologias e práticas sustentáveis, segundo relatório da McKinsey O setor agropecuário representa 10% do Produto Interno Bruto (PIB) argentino, segundo dados oficiais, enquanto seis de cada dez dólares que entram no país por exportações provêm desse ramo Sistema de manejo é fundamental para a agricultura de precisão e com alta produtividade 01 02 03 exame no whatsapp Receba as notícias da Exame no seu WhatsApp Nos acontecimentos mais relevantes do Brasil e mundo. E-mail inválido Desperta",Exame
https://exame.com/mundo/maduro-incentiva-venezuelanos-a-votar-nas-eleicoes-municipais-dia-de-festa-e-paz/,2025-07-27,Maduro incentiva venezuelanos a votar nas eleições municipais: 'Dia de festa e paz',"Agência de Notícias Publicado em27 de julho de 2025 às13h20. O presidente daVenezuela,Nicolás Maduro, convidou neste domingo os cidadãos a votarem em suas autoridades municipais, entre elas 335 prefeitos em todo o país, em eleições rejeitadas pelo maior grupo da oposição. “O chamado é para votar! Hoje, 27 de julho, o povo exerce sua democracia direta e protagonista, elegendo as autoridades das prefeituras e dos conselhos municipais, e simultaneamente será realizada a Consulta Popular Nacional da Juventude. É um dia de festa e de paz!”, publicou o governante em sua conta no Telegram. Os centros eleitorais começaram a abrir suas portas às 6h (horário local) para uma jornada que deve terminar às 18h (19h em Brasília) ou até que não haja mais eleitores nos locais de votação, conforme antecipado pelo Conselho Nacional Eleitoral (CNE). No total, neste domingo serão eleitos 2.806 cargos — 335 prefeitos e 2.471 vereadores — e, por meio de uma consulta popular promovida pelo chavismo, serão selecionados 5.336 projetos comunitários impulsionados por jovens que serão financiados pelo governo. As eleições deste domingo são realizadas um dia antes do primeiro aniversário da controversa segunda reeleição deMaduro, que foi proclamada pelo CNE, controlado por funcionários ligados ao chavismo. Esse resultado é considerado “fraudulento” por vários países ocidentais e pela oposicionista Plataforma Unitária Democrática (PUD), que reivindica a vitória deEdmundo González Urrutia, no exílio há mais de dez meses. A líder oposicionistaMaría Corina Machadoafirmou no sábado que o chavismo ficará sozinho nas eleições municipais deste domingo, como já aconteceu, segundo ela, nas eleições presidenciais de 28 de julho de 2024 e nas regionais do último dia 25 de maio. No entanto, um pequeno setor da oposição, liderado por prefeitos que buscam a reeleição, decidiu se candidatar a este processo, depois de conseguir em maio vários assentos na Assembleia Nacional (AN, Parlamento). Há um mês, o CNE proclamou o partido governista vencedor em 23 dos 24 governos estaduais, incluindo Guiana Essequiba, em referência ao território de quase 160 mil quilômetros quadrados queCaracasconsidera seu 24º estado, apesar de ser administrado pela Guiana. Além disso, conquistou 253 das 285 cadeiras da Assembleia Nacional. Região enfrenta uma crise alimentar provocada pelas restrições à entrada de suprimentos impostas por Israel As IDF anunciaram neste domingo uma 'pausa tática' diária de dez horas em suas atividades militares em três zonas do enclave para permitir a distribuição de ajuda humanitária Confirmação oficial ocorreu depois que a coalizão pró-palestina Flotilha da Liberdade denunciou que as Forças de Defesa de Israel interceptaram o Handala após a meia-noite Praias de Mawasi constituem um importante núcleo de deslocados na Faixa de Gaza, onde centenas de milhares de pessoas se amontoam em tendas em condições humanitárias precárias 01 02 03 exame no whatsapp Receba as notícias da Exame no seu WhatsApp Nos acontecimentos mais relevantes do Brasil e mundo. E-mail inválido Desperta",Exame
https://exame.com/mundo/jordania-e-emirados-arabes-lancam-25-toneladas-de-ajuda-humanitaria-sobre-a-faixa-de-gaza/,2025-07-27,Jordânia e Emirados Árabes lançam 25 toneladas de ajuda humanitária sobre a Faixa de Gaza,"Agência de Notícias Publicado em27 de julho de 2025 às13h16. AsForças ArmadasdaJordâniae dosEmirados Árabesrealizaram neste domingo três lançamentos aéreos naFaixa de Gazacom 25 toneladas de ajuda humanitária, em meio a uma crise alimentar provocada pelas restrições à entrada de suprimentos impostas por Israel e pelas quais 133 pessoas morreram de desnutrição desde o início da guerra. “Os lançamentos aéreos foram realizados com aviões C-130 da Força Aérea Real da Jordânia e da Força Aérea dosEmirados Árabes Unidos, que transportaram 25 toneladas de ajuda alimentar e suprimentos humanitários”, informou a televisão oficial jordaniana ""Al Mamlaka"" sobre esta operação conjunta com os Emirados Árabes. A operação abrangeu vários pontos da Faixa de Gaza, em coordenação com diversas instituições, como a Organização Beneficente Hachemita da Jordânia, “com o objetivo de aliviar o sofrimento humanitário e apoiar a população” de Gaza, de acordo com um comunicado da mídia jordaniana. “Os lançamentos aéreos são uma via adicional através da qual aJordâniaestá investindo em diversos meios para entregar ajuda especial rapidamente e em áreas de difícil acesso por terra”, acrescentou a nota. A Jordânia enfatizou que esses lançamentos aéreos não substituirão a ajuda terrestre à população daFaixa de Gaza, “já que os comboios terrestres são o meio principal, mais eficaz e prioritário para entregar ajuda lá”, apesar do bloqueio israelense que dificulta sua entrada através das passagens fronteiriças terrestres. Desde o início da guerra, a Jordânia enviou 181 comboios terrestres, compostos por 7.932 caminhões, enquanto o número de lançamentos realizados desde então é de 127, além dos 267 realizados em cooperação com outros países. Esta operação humanitária ocorre no mesmo dia em que oMinistério da Saúde de Gazainformou a morte de pelo menos seis pessoas, entre elas duas crianças, nas últimas 24 horas no enclave palestino, como consequência da desnutrição causada pelo bloqueio deIsraelà entrada de alimentos. Com essas novas mortes, o número de mortos por desnutrição sobe para 133 desde o início da ofensiva israelense em 7 de outubro de 2023, entre eles 87 menores, de acordo com a mesma fonte. As mortes por fome dispararam nas últimas semanas em Gaza, após o fechamento quase total dos acessos imposto por Israel em março, que impediu a entrada de alimentos, medicamentos e combustível e agravou drasticamente a crise nutricional no enclave. EmboraIsraeltenha reaberto parcialmente as passagens no final de maio para permitir a entrada de ajuda humanitária, o volume continua insuficiente e buscar essa assistência coloca em risco a vida dos habitantes deGaza. As IDF anunciaram neste domingo uma 'pausa tática' diária de dez horas em suas atividades militares em três zonas do enclave para permitir a distribuição de ajuda humanitária Confirmação oficial ocorreu depois que a coalizão pró-palestina Flotilha da Liberdade denunciou que as Forças de Defesa de Israel interceptaram o Handala após a meia-noite Praias de Mawasi constituem um importante núcleo de deslocados na Faixa de Gaza, onde centenas de milhares de pessoas se amontoam em tendas em condições humanitárias precárias Pontífice americano reforçou também seu pedido de um cessar-fogo imediato e da libertação dos reféns sequestrados pelo grupo islâmico Hamas 01 02 03 exame no whatsapp Receba as notícias da Exame no seu WhatsApp Nos acontecimentos mais relevantes do Brasil e mundo. E-mail inválido Desperta",Exame
